,Datetime,Tweet Id,Text,Username
0,2022-02-23 19:02:48+00:00,1496561196257927171,"The President's sanctions package is a significant, but very measured step. We have many options left in our sanctions arsenal should #Russia continue to move against #Ukraine. The next step is to apply these sanctions to foreign subsidiaries of U.S. corporations. (3/3)",BradSherman
1,2022-02-23 19:02:48+00:00,1496561195050020866,"I have long been an advocate of sanctioning Russian sovereign debt; with Russian borrowing at a 15 year high, these sanctions will impose significant economic pressure directly on the Russian govt and protect American investors from indirectly financing Putin's agenda. (2/3)",BradSherman
2,2022-02-23 19:02:47+00:00,1496561193309380619,I applaud @POTUS for including enhanced Russian sovereign debt as part of a significant sanctions package announced yesterday to combat Russian aggression against Ukraine. (1/3) https://t.co/zHa2vcC1oY,BradSherman
3,2022-02-19 23:24:10+00:00,1495177419350851598,"If the Europeans don’t want restrictions on buying Russian oil and gas and want Russia to stay in the SWIFT international banking system, sanctions won't do much to deter Putin.",BradSherman
4,2022-02-18 22:44:52+00:00,1494805142910251010,Great to join the North Valley Chamber @nvrcc to show support for our terrific Valley small businesses. https://t.co/PH8B2SI3zK,BradSherman
5,2022-02-18 18:25:36+00:00,1494739896770125832,Pleased to have talked to @USAID Administrator Samantha Power @PowerUSAID on Thursday about the need for economic development projects in #Sindh.,BradSherman
6,2022-02-18 15:12:39+00:00,1494691338654257152,(2/2) True Democracy advocates must plainly state that all #Rohingya born in Burma/Myanmar must be repatriated and given citizenship documents.,BradSherman
7,2022-02-18 15:12:39+00:00,1494691337173708806,"(1/2) At yesterday’s @HouseForeign hearing on Burma, I spoke about how there can be no true democracy in Burma without the full inclusion of the #Rohingya. 

Watch⬇️
https://t.co/N93AO7IU57",BradSherman
8,2022-02-18 03:15:18+00:00,1494510808742645789,Talked to @USAID Administrator Samantha Power @PowerUSAID about the food blockade of #Tigray. Clearly the Ethiopian and Eritrean government are using starvation as a weapon. I urge that we act to #EndTigraySiege.,BradSherman
9,2022-02-15 19:13:34+00:00,1493664801142321160,We should remember: Sanctions against Russia will impose costs on Americans too.,BradSherman
10,2022-02-14 16:08:00+00:00,1493255716106391557,"If Russia in effect forces #Ukraine to enter into a treaty forswearing ever joining NATO, we should impose some sanctions. (3/3)",BradSherman
11,2022-02-14 16:08:00+00:00,1493255714999046147,"However, the Russian invasion could be a disaster for #Ukraine and Europe. Ultimately this is a decision to be reached by Ukraine, and America should not pressure Zelensky. (2/3)",BradSherman
12,2022-02-14 16:08:00+00:00,1493255713757573125,"#Ukraine may need to choose between entering into a treaty with Russia forswearing ever joining NATO, or face invasion. Such a treaty commitment impairs Ukraine’s options in the decades to come and sets a bad international precedent. (1/3)",BradSherman
13,2022-02-14 03:05:10+00:00,1493058710729596930,A great day for the #Rams. For Los Angeles. And especially for the San Fernando Valley. #SuperBowl https://t.co/fH8g4ptKsm,BradSherman
14,2022-02-14 02:35:56+00:00,1493051350954958848,https://t.co/KjwU8feUrA,BradSherman
15,2022-02-09 20:47:30+00:00,1491514115151564802,"Pleased to join @RepMalinowski in passing H.R. 6600. Ethiopia and Eritrea are blocking food aid deliveries to Tigray and using starvation of civilians as a weapon of war.
https://t.co/4gEYArg5Gz",BradSherman
16,2022-02-09 20:47:30+00:00,1491514113599619074,"The mass detention of Tigrayan civilians in unlivable conditions is a human rights violation so outrageous that it demands a forceful U.S. response. I'm pleased that H.R. 6600 passed @HouseForeign with my amendment to respond to this atrocity. Watch ⬇
https://t.co/CsJt4YOwSV",BradSherman
17,2022-02-08 15:27:30+00:00,1491071194296389633,"(2/2) Learn more about our event last night here: 
https://t.co/5g10XVlO0L",BradSherman
18,2022-02-08 15:27:29+00:00,1491071191662329857,"Thank you to the nearly 7,000 Valley residents that joined our Telephone Town Hall last night! It was a great opportunity to update you on my work in Congress &amp; hear your thoughts on the critical issues we face. 

Special thanks to guests Dr. Lynn Goldman &amp; @AsmJesseGabriel (1/2) https://t.co/3fcnn02PHX",BradSherman
19,2022-02-08 03:00:39+00:00,1490883245923135490,Starting Now! Dial in at (855) 920-0548 https://t.co/D3bssaRguI,BradSherman
20,2022-02-08 02:30:38+00:00,1490875689268289540,"Starting Soon!

Our Telephone Town Hall will be starting soon at 7:00 PM where we’ll discuss all the critical issues we face together. 

📱Dial in at (855) 920-0548 starting at 7:00 PM tonight to join! https://t.co/HprcspIcOV",BradSherman
21,2022-02-08 01:21:33+00:00,1490858305547571204,"Fine print hidden in a lengthy contract shouldn’t be what stops a sexual abuse survivor from telling their story.
 
Today, I voted to pass the #EndForcedArbitration Act, a historic pro-labor piece of legislation. https://t.co/nc2AhERcPF",BradSherman
22,2022-02-07 23:13:50+00:00,1490826163316477956,Today I cosponsored &amp; submitted an amendment to expand my friend @Malinowski ’s HR 6600 which holds Ethiopia accountable for abuses in #Tigray. My amdt. conditions sanctions relief on the Ethiopian govt allowing aid into Tigray &amp; ending ethnically-based detentions of Tigrayans. https://t.co/4dNW6hzOS5,BradSherman
23,2022-02-07 20:30:24+00:00,1490785035045289984,"Join us for our Telephone Town Hall *Tonight* starting at 7 PM where we'll discuss all the critical issues facing Congress.

We'll be joined by Dr. Lynn Goldman, epidemiologist &amp; pediatrician, who'll answer questions on #COVID19

RSVP/Submit a Question at: https://t.co/GTFpvGufVl https://t.co/bJMP1UmMDl",BradSherman
24,2022-02-06 20:37:01+00:00,1490424314138607623,"Join us for our Telephone Town Hall tomorrow, Monday February 7th, starting at 7:00 PM where we’ll discuss all the critical issues facing Congress. 

📱Dial in at (855) 920-0548

✅ RSVP or Submit a Question at:
https://t.co/1a5vCudb3Z",BradSherman
25,2022-02-04 22:49:29+00:00,1489732873552805891,"The @GOP's definition of ""legitimate political discourse"": https://t.co/uESLOGbmx8 https://t.co/0jNu1TiLMo",BradSherman
26,2022-02-04 18:29:12+00:00,1489667371895869443,"Today the House passed two of my provisions that will provide transparency and accountability when Chinese companies sell stock to U.S. investors.

Learn more here:
https://t.co/ORdd1u2LIb",BradSherman
27,2022-02-04 16:30:30+00:00,1489637500058542082,"The #AmericaCOMPETES Act will set us on a strong path to compete globally in innovation &amp; technology. I’m proud to co-sponsor &amp; help pass this transformative bill through the House, &amp; look forward to working with my colleagues on this critical investment in our country's future. https://t.co/A4T1FeLuox",BradSherman
28,2022-02-04 00:02:04+00:00,1489388753386975237,Whoopi Goldberg is not anti-Semitic. I appreciate her acknowledging that her comment on the Holocaust was erroneous and her use of her platform to turn a mistake into a teaching moment. This is a reminder of the need to increase Holocaust education. https://t.co/mDs5SoIFHd,BradSherman
29,2022-02-03 20:55:20+00:00,1489341757678665730,"For our children, loved ones and communities across the country, the Senate must pass the Bipartisan #BackgroundChecksAct, close the Charleston loophole, and act to help us finally #EndGunViolence. (2/2)",BradSherman
30,2022-02-03 20:55:19+00:00,1489341755841564675,"#GVSurvivorsWeek indicates the approximate time that gun deaths in the United States exceeds the number of gun deaths experienced by peer countries in an entire calendar year. 

We've already reached that point this week -- and it's only the 3rd day of February. (1/2) https://t.co/k04gBBhI61",BradSherman
31,2022-02-02 14:36:11+00:00,1488883955583668239,https://t.co/K17cjs01xA,BradSherman
32,2022-02-01 16:24:26+00:00,1488548807197577220,"During #BlackHistoryMonth we commemorate the history and significant contributions African Americans have and continue to make. May this time serve as more than a celebration of our history, where we reaffirm our commitment towards achieving justice and equality for all. https://t.co/qDBubtHtPZ",BradSherman
33,2022-02-01 14:15:13+00:00,1488516290952241157,"I want to wish a happy and healthy #LunarNewYear to all who celebrate!

May the #YearOfTheTiger bring good health, prosperity and success to all. https://t.co/4fbHV3Fode",BradSherman
34,2022-02-01 04:34:25+00:00,1488370127900971010,"In One Week: 

Join us for our next Telephone Town Hall on Monday, February 7th starting at 7:00 PM.

We'll update you on all the critical issues facing Congress.

RSVP or Submit a Question at:
https://t.co/1a5vCudb3Z",BradSherman
35,2022-01-31 23:28:29+00:00,1488293134379339777,"It's with sadness that I've learned of the passing of Richard Close. A fierce advocate for the Valley &amp; an effective organizer w/@ShermanOaks914, Richard &amp; I worked closely over the years to combat Valley traffic &amp; reduce aircraft noise. My thoughts are with his family &amp; friends.",BradSherman
36,2022-01-31 18:12:55+00:00,1488213719381389321,Thank you Father Art for inviting me to join services yesterday morning at Our Lady of the Valley Catholic Church in Canoga Park. Good opportunity to tell people about our constituent services program. https://t.co/4NTyMr9F1D,BradSherman
37,2022-01-29 00:42:51+00:00,1487224687415463939,"Join us for our next Telephone Town Hall on February 7th starting at 7:00 PM.

We'll update you on all the critical issues facing Congress.

RSVP or Submit a Question at:
https://t.co/GTFpvGufVl https://t.co/X85lLNyfE4",BradSherman
38,2022-01-28 19:07:52+00:00,1487140385130434569,"Three principles for preserving #Democracy:

1) You can't just love your country when you win (Joe Biden, 2022)

2) You can't condemn political violence only when it's done by the ""other side""

3) You can't just obey the laws you agree with",BradSherman
39,2022-01-28 00:31:33+00:00,1486859455736254468,"On Tuesday, @TuckerCarlson praised the government of Hungary for giving subsidies to parents and encouraging parenthood. 

Does Tucker have the guts to endorse the #ChildTaxCredit? Or perhaps the entire #BuildBackBetter? 

Or does he only support parenthood in Hungary?",BradSherman
40,2022-01-27 20:30:58+00:00,1486798910026825731,"Today on #HolocaustRemembranceDay we remember and honor the memories of the millions of Jews who were murdered. 

As we commemorate this solemn anniversary, may we also reaffirm our resolve to continue the fight against bigotry, anti-Semitism, intolerance and hate.

#WeRemember https://t.co/b8jh2lxhxH",BradSherman
41,2022-01-27 19:14:26+00:00,1486779650009411597,"Yesterday marked India’s 73rd #RepublicDay -- commemorating the day India's constitution came into effect. As the celebrations continue today, let us also reaffirm our resolve to deepen the bond between our nations -- an unwavering priority of mine throughout my time in Congress.",BradSherman
42,2022-01-26 16:03:24+00:00,1486369187991891968,"(2/2) The ""Kobe Bryant and Gianna Bryant Helicopter Safety Act"" that @SenFeinstein and I introduced this Congress aims to do just that by requiring the FAA to strengthen federal safety standards for equipping helicopters. 

Learn more about the bill here:
https://t.co/4MNTqTgCQM",BradSherman
43,2022-01-26 16:03:24+00:00,1486369186788093956,"Today marks two years since we shockingly lost Los Angeles and world icon #KobeBryant, his daughter Gianna Bryant and seven other souls in a tragic helicopter crash. We must honor their memories by working to ensure such tragedies can be prevented in the future. (1/2)",BradSherman
44,2022-01-25 02:20:05+00:00,1485799607145832449,"While Republicans have relentlessly attacked Democrats’ voting rights protection bills as supposed “federal takeover of elections”, here’s evidence of plans for an actual federal take over of an election. 

A stark example of why we must secure voting rights for all Americans. https://t.co/FtqGQx7t65",BradSherman
45,2022-01-24 20:20:35+00:00,1485709134251057156,I was honored to join yesterday’s morning services at Saint Catherine of Siena Catholic Church in Reseda where I got a chance to speak about our constituent services program. https://t.co/ysuoUUMBxQ,BradSherman
46,2022-01-22 23:54:39+00:00,1485038231922126860,"As we’ve seen a relentless assault on reproductive rights for nearly half a century, today’s commemoration of #Roe49 also serves as a vital reminder on the urgent need to codify #RoeVWade and to continue the work of protecting reproductive healthcare rights across the country.",BradSherman
47,2022-01-21 19:47:58+00:00,1484613762640400391,"ICYMI: Watch my recent appearance on @cspanwj where I discussed the rising tensions between the U.S. and Russia over Ukraine and the future of NATO.
https://t.co/yioagOZXfB",BradSherman
48,2022-01-21 18:49:55+00:00,1484599154563334147,"I want to thank the over 6,000 Valley residents who joined our Telephone Town Hall last night.

It was a productive review of the progress we've made in the first year with @POTUS, and an informative and spirited discussion over the challenges we face.
https://t.co/K9Nr7rRjj3",BradSherman
49,2022-01-21 03:00:30+00:00,1484360225230503944,Starting Now! Dial (855) 920-0548 to join! https://t.co/beAmrzTmR5,BradSherman
50,2022-01-21 02:25:36+00:00,1484351443159044100,"Our Telephone Town Hall will be starting soon at 7 PM where we'll discuss all the critical issues facing Congress.

To participate, Dial (855) 920-0548 anytime between 7:00-8:00 PM tonight. https://t.co/mIzfOwnH60",BradSherman
51,2022-01-20 20:27:28+00:00,1484261315707572224,"Join us tonight at 7 PM for our Telephone Town Hall -- exactly 1 year since Joe Biden was sworn in as @POTUS.

We'll review the progress we've made, and the challenges we face.

To participate in our Telephone Town Hall, Dial (855) 920-0548 anytime between 7:00-8:00 PM tonight. https://t.co/5OTdKnwSNh",BradSherman
52,2022-01-20 15:08:54+00:00,1484181146107891714,https://t.co/AY5RGhuLFS,BradSherman
53,2022-01-19 22:22:19+00:00,1483927832371900418,The State Order medal commemorates the establishment of diplomatic relations between Armenia and the United States; it was awarded to me by the decree of Armenian President Armen Sarkissian @Arm_President for my efforts to strengthen the U.S.-Armenia relationship. (2/2),BradSherman
54,2022-01-19 22:22:19+00:00,1483927830652141568,I was honored to receive Armenia’s State Order medal from Armenian Ambassador to the U.S. Lilit Makunts @LilitMakunts and President of the Armenian National Assembly Alen Simonyan @alensimonyan. (1/2) https://t.co/8KWrqZzFkf,BradSherman
55,2022-01-19 22:10:03+00:00,1483924742855970817,"Join us for our Telephone Town Hall tomorrow, January 20th starting at 7:00 PM. 

Joining us will be Dr. Lynn Goldman, epidemiologist and pediatrician, who will answer questions on #COVID19

RSVP or Submit a Question at: 
https://t.co/1a5vCudb3Z",BradSherman
56,2022-01-19 18:55:33+00:00,1483875795261169668,"Starting today: Every home in America can order four at-home #COVID19 tests. The tests are completely FREE.  

Click below to order:
https://t.co/vUdq3zBJWI",BradSherman
57,2022-01-19 15:55:26+00:00,1483830468432777220,"My father, Maurice H. Sherman, was born 100 years ago today. 

His service in the U.S. Navy, to the Southern California community, and to the Jewish community inspires me everyday. https://t.co/pq2Ocdcr1P",BradSherman
58,2022-01-18 23:00:05+00:00,1483574947733774338,"Join us for our Telephone Town Hall this Thursday, January 20th starting at 7:00 PM.

Joining us will be Dr. Lynn Goldman, epidemiologist and pediatrician, who will answer questions on #COVID19

RSVP or Submit a Question at:
https://t.co/dQ3YWORDkk",BradSherman
59,2022-01-17 17:26:39+00:00,1483128648110682122,"#MLK stood up for civil rights for all Americans, including the sacred right to vote. 
 
His commitment to do what is right inspired generations and helped bring millions fair access to the ballot.
 
Today, we honor his life and legacy and continue fighting to secure his vision. https://t.co/wIWXCvNhK2",BradSherman
60,2022-01-15 23:28:28+00:00,1482494925816176641,"We pray for those in danger and those held hostage.
https://t.co/n8BImy1n3p",BradSherman
61,2022-01-14 00:03:11+00:00,1481778887281549312,"""No where in the world are we witnessing hell like in Tigray. Even in Syria we have access during the worst of crisis in Syria. In Yemen the same, we have access"" https://t.co/MQnpAuCel1",BradSherman
62,2022-01-13 18:47:07+00:00,1481699347276439558,"Wishing a happy #KoreanAmericanDay to the thousands of Korean Americans in the San Fernando Valley and across the nation. In 1903, the first wave of Korean American immigration began; today, Korean Americans are an integral part of our nation.",BradSherman
63,2022-01-13 17:51:36+00:00,1481685375559114754,This is an outrageous trivialization of the Holocaust. Equating health guidelines that protect lives with the systematic murder of millions of Jews and others is abhorrent. https://t.co/Z7hf28ZY9y,BradSherman
64,2022-01-12 20:26:21+00:00,1481361932250750979,"For 100 days Republican Sen. Rand Paul has endangered Israeli civilians by blocking critical funds for the Iron Dome, a purely defensive system that saves countless civilian lives from Hamas rockets. It's time for Sen. Paul to stop helping Hamas and start defending our ally.",BradSherman
65,2022-01-12 18:59:23+00:00,1481340043683893248,https://t.co/Kk48EaW4eE,BradSherman
66,2022-01-11 04:17:13+00:00,1480755653085904898,"Our next Telephone Town Hall will be on Thursday, January 20th -- exactly one year after Joe Biden was sworn in as @POTUS. 

We'll review the progress we've made, and the challenges we face.

RSVP or Submit a Question at:
https://t.co/GTFpvGufVl",BradSherman
67,2022-01-10 02:30:37+00:00,1480366436770062338,https://t.co/oGqSMrEemn,BradSherman
68,2022-01-08 23:54:58+00:00,1479964879880704005,"""We would have had a higher vaccination rate if we didn't politicize the vaccine""

ICYMI: Watch my appearance on @FoxNews earlier today where I provided some context to our efforts against #COVID19. 
https://t.co/gJ9CtxL5CX",BradSherman
69,2022-01-08 18:46:56+00:00,1479887363040059393,We must stand with the people of Kazakhstan and against dictatorship. Putin is acting as a mercenary-for-hire by endangered kleptocrats.,BradSherman
70,2022-01-08 15:01:25+00:00,1479830608243212295,I'll be appearing on @FoxNews Live today at 9:05 AM (12:05 PM EST) to discuss the latest developments on ending the #COVID19 pandemic and on our economic progress.,BradSherman
71,2022-01-06 23:55:01+00:00,1479240116820451329,I was honored to join @SpeakerPelosi @SenSchumer and many of my colleagues on the steps of the Capitol for a prayer vigil marking the one year anniversary of the #January6th attack. https://t.co/iyBe99y5DK,BradSherman
72,2022-01-06 18:35:56+00:00,1479159818581680134,".@POTUS Biden spoke the truth today: ""You can't love your country only when you win, you can't obey the law only when it's convenient."" I would add: you can't condemn political violence only when it's committed by ""the other side"". https://t.co/HdC1i7T6v4",BradSherman
73,2022-01-06 16:20:32+00:00,1479125743661731845,"Today, as we mark one year since the #January6th attack, we must not allow anyone to rewrite history or whitewash the gravity of what took place. I stand in solidarity with my colleagues in working to ensure that such an assault on our Democracy cannot ever happen again. https://t.co/nctnReHrpM",BradSherman
74,2022-01-04 16:44:05+00:00,1478406893827723264,"L.A. County residents can receive FREE at-home #COVID19 tests in the mail. 

For more information, click below:
https://t.co/EeVKeE1K8R",BradSherman
75,2022-01-02 05:57:51+00:00,1477519487192616961,https://t.co/a8OHWqkDj1,BradSherman
76,2022-01-01 17:19:03+00:00,1477328529343741955,"Wishing everyone a #HappyNewYear and welcome to 2022! Here’s to this being a year of growth, health and happiness for communities across our country. https://t.co/rN5LWIfEpU",BradSherman
77,2021-12-26 21:34:11+00:00,1475218408639807513,Wishing a happy first day of #Kwanzaa to everyone celebrating! May the new year bring bountiful blessings to you all! https://t.co/ypTNkTnWo9,BradSherman
78,2021-12-25 18:26:37+00:00,1474808819075145732,"Wishing everyone who celebrates a #MerryChristmas 
 and #HappyHolidays.
  
May your day be filled with good times, love and cheer. https://t.co/VH0kiPa2FM",BradSherman
79,2021-12-22 02:07:44+00:00,1473475308435161089,"This tells us what everyone already knows about the government of China, and what some hoped wasn’t true about Amazon...I wonder if the Washington Post will cover this story.
https://t.co/ROlDu4NBO0",BradSherman
80,2021-12-21 23:59:28+00:00,1473443030141132808,"Disasters like Deepwater Horizon and Aliso Canyon reveal that we cannot rely upon the fossil fuel industry’s claims about safety. We need to work to #ShutDownAlisoCanyon.
https://t.co/n63hkYmuu6",BradSherman
81,2021-12-21 15:34:20+00:00,1473315909783728132,The authors do not “advocate for a ‘regime change’ strategy under cover of non-proliferation.”(4/4),BradSherman
82,2021-12-21 15:34:20+00:00,1473315908756160516,"The authors, while arguing for the development of a credible threat to Iran’s nuclear infrastructure, built at such great cost &amp; a source of pride for Iran's government, note that “only by diplomatic agreement” can we resolve the problem that is Iran’s nuclear program. (3/4)",BradSherman
83,2021-12-21 15:34:19+00:00,1473315907673931779,"Included on this list is my friend and one-time opponent, Howard Berman. Howard, it should be noted, was one of the most powerful voices in 2015 in support of the JCPOA. (2/4)",BradSherman
84,2021-12-21 15:34:19+00:00,1473315906340151298,"An important statement from some of our most distinguished foreign and defense policy officials, as well as former Democratic House members with a wealth of foreign policy experience on the Democratic side of the aisle. (1/4)
https://t.co/EWJxP4kL0f",BradSherman
85,2021-12-20 21:52:17+00:00,1473048636019941381,"We need forces to disengage, and stop fighting, and allow ground delivery of humanitarian relief. This statement from the TDF is a big step in the right direction. https://t.co/ICXlk40hRo",BradSherman
86,2021-12-17 18:56:50+00:00,1471917317835694084,"That’s a lot of herpestids!  

Thank you for helping those devastated by the tornadoes. https://t.co/fGQQfaikbP",BradSherman
87,2021-12-17 15:20:34+00:00,1471862894434336772,"Congressman Lowenthal has served our country for 30 years and leaves behind an extraordinary legacy of service on behalf of Californians, our environment and our democracy. It's been an honor to serve with him. Wishing my friend @RepLowenthal all the best. https://t.co/x3h4BtPIp6",BradSherman
88,2021-12-16 22:18:29+00:00,1471605678250893315,~1 million continue to face famine in Tigray after a year of blockade of food and humanitarian aid by PM Abiy Ahmed and by Eritrea. We must take all available action to establish food access corridors. (2/2),BradSherman
89,2021-12-16 22:18:29+00:00,1471605676770267141,"Today's @hrw and @amnesty report makes it clear - a genocide maybe unfolding in Tigray. With ~30k Tigrayans rounded up into concentration camps, the need for an immediate ceasefire and international monitoring has never been more dire. (1/2) https://t.co/veXosEH4ck",BradSherman
90,2021-12-16 21:55:22+00:00,1471599860315045888,"I suggested the Western Kentucky Relief Fund was a great way to help and the mongoose community responded with a $5000 contribution. This should inspire all Americans, regardless of currency preferences. (2/2) https://t.co/cJVMtGqM4z",BradSherman
91,2021-12-16 21:55:15+00:00,1471599830967504896,"I may not agree with everyone in the crypto community, or the emerging mongoose community, on each aspect of financial services regulation. But all of us are united in our concern for the people of Kentucky. (1/2) https://t.co/IsWa0PsWs3",BradSherman
92,2021-12-15 04:44:16+00:00,1470977989789814788,"#MarkMeadows texts and emails reveal his extensive and alarming involvement with the #January6th attack. He owes a full, truthful testimony to the American people and his refusal to honor a legally binding subpoena is why I voted tonight to hold him in contempt of Congress.",BradSherman
93,2021-12-15 03:23:12+00:00,1470957587470471168,"Today the House took action against China’s ongoing oppression of Uyghurs by passing the #Uyghur Forced Labor Prevention Act, which I cosponsored. The ongoing internment of China’s Muslim population, and the practice of forced labor, must be confronted.",BradSherman
94,2021-12-14 22:22:28+00:00,1470881904622776323,"The government of Kentucky has established the ""Team Western Kentucky Tornado Relief Fund"" to assist those impacted by the tornadoes. If you would like to help, click here: https://t.co/SJRvwjj1NE",BradSherman
95,2021-12-12 21:02:04+00:00,1470136894046490630,"Our hearts are with Kentucky and the communities across the central U.S. 
that were impacted by these devastating tornadoes.

We join together across the nation in praying for their swift recovery and stand ready to aid and assist.",BradSherman
