,Datetime,Tweet Id,Text,Username
96,2021-12-10 23:57:08+00:00,1469456179134963712,"As we fight to protect the constitutional right to abortion care nationwide, my bill, the Medical Travel Assistance to Protect Women’s Right to Choose Act,  will cover costs for patients who are forced to cross state lines to avoid near-total bans on abortion, like #SB8. (2/2)",BradSherman
97,2021-12-10 23:57:08+00:00,1469456177511776256,"Although today's #SCOTUS decision allows challenges to #SB8 to proceed, the Court's failure to block Texas' abortion ban means #SB8 will continue to wreak havoc on women's lives every day it's still in effect. (1/2) https://t.co/QLvXTB1xQq",BradSherman
98,2021-12-10 22:06:49+00:00,1469428413203165191,"I joined “One World” with @ZainAsher on
 @cnni to discuss the situation in #Ethiopia. We must get food to those who are starving and Eritrea should open its ports to U.N. relief agencies. All parties should agree to a ceasefire. 
https://t.co/R9KnTVdp9q",BradSherman
99,2021-12-09 22:52:40+00:00,1469077563939209223,"Mongoose defeats Cobra 

Mongoose defeats Hamster-like creature 

This tweet is not intended to provide investment advice. https://t.co/UmNhpDreup",BradSherman
100,2021-12-09 21:55:57+00:00,1469063294061359114,"Today I voted to pass the #ProtectingOurDemocracy Act, a bill I co-sponsored. It's the third pillar in our fight to protect our democracy, along with the #JohnLewisVotingRightsAct and the #ForThePeopleAct, two bills I helped to introduce and pass in the House. https://t.co/AlVPtvA3Yp",BradSherman
101,2021-12-09 01:08:33+00:00,1468749374121340928,"As I said on the House Floor:

As Co-Chair of the CPA caucus, I can certify that this is the most important genuinely boring bill we will deal with all year. 

And it passed 415 to 9 https://t.co/8z6bin5eou",BradSherman
102,2021-12-09 00:05:30+00:00,1468733506842939392,"I want to thank Chairwoman @RepMaxineWaters and my colleagues for their help in advancing this vital bill, and for demonstrating how Congress can come together and solve an impending crisis before it hits. (2/2)
https://t.co/jO6Vh2F76e",BradSherman
103,2021-12-09 00:05:30+00:00,1468733505475649539,"Today the House passed with bipartisan support my Adjustable Interest Rate (#LIBOR) Act -- legislation to protect the U.S. financial system from $16 Trillion LIBOR uncertainty. (1/2)
https://t.co/W2eoPnybrW",BradSherman
104,2021-12-07 23:17:03+00:00,1468358925623955460,"(2/2) They say the San Fernando Valley is a terrible place to live and they reach this conclusion by citing statistics about the City of San Bernardino. Seems some of my critics know very little about the San Fernando Valley, the City of San Bernardino, or my efforts in Congress.",BradSherman
105,2021-12-07 23:17:03+00:00,1468358924667600903,(1/2) My staff has told me that there are quite a number of tweets attacking my position with regard to the Horn of Africa and attacking me personally along the following lines:,BradSherman
106,2021-12-06 20:03:55+00:00,1467947933828067336,"I am pleased that the State Department has spoken out about the troubling roundup of tens of thousands of ethnic Tigrayans by the Ethiopian Government and reaffirmed the need for an immediate ceasefire by all parties, which I have been calling for since November of 2020. https://t.co/mGcCP4VSHW",BradSherman
107,2021-12-06 18:01:51+00:00,1467917217706692619,"In 2017, I filed articles of impeachment against #Trump based on obstruction of justice for firing Comey. 

Here he is 4 years later casually confessing to it. https://t.co/i8RhJMC8nT",BradSherman
108,2021-12-04 19:43:20+00:00,1467217978211119113,https://t.co/7oe0Kyq5kr,BradSherman
109,2021-12-03 18:52:14+00:00,1466842730169049090,"The fact is Eritrean forces, sometimes disguised as Ethiopian troops, have worked to block food shipments into Tigray. So it would be a wonderful and surprising reversal if Eritrea would allow food shipments though its own territory. (4/4) https://t.co/GjnR9yxDVq",BradSherman
110,2021-12-03 18:52:13+00:00,1466842728877154309,It is good that Eritrea acknowledges its obligation under intl. law to allow aid in. I welcome a commitment from the Eritrean Govt to allow its ports/roads to be used to send aid to dying Tigrayans. When can UN start moving aid through Eritrea to Tigray? (3/4),BradSherman
111,2021-12-03 18:52:13+00:00,1466842727560224772,Do you think they all failed to notice that the closest ports to Tigray are in Eritrea and the relevant truck routes can't be blocked by Ethiopian troops? Truck routes from Djibouti and Sudan are blocked by Ethiopian troops and allied militia. (2/4),BradSherman
112,2021-12-03 18:52:13+00:00,1466842726029275140,"~1 million in Tigray are facing famine. The U.N., U.S. and others are desperate to ship food to a port, and truck it into Tigray. (1/4)
https://t.co/ki1mQM9BIi",BradSherman
113,2021-12-01 22:26:00+00:00,1466171753298857992,"The U.S. must take every available action to end PM Abiy &amp; Eritrea's blockade of Tigray, get food aid to the 1 million facing famine, and prevent genocide. (3/3)",BradSherman
114,2021-12-01 22:26:00+00:00,1466171751671472129,"In the last few weeks alone, over 30,000 Tigrayans have been rounded up into concentration camps across Ethiopia. Government officials have referred to Tigrayans as “rats” and a “cancer”. Given PM Abiy's media blackout, the situation could be worse than what we already know.(2/3)",BradSherman
115,2021-12-01 22:25:59+00:00,1466171749934981120,"What’s unfolding in Ethiopia has all the makings of a genocide and we cannot wait for this to become another Rwanda before we take action. See my questioning of @AsstSecStateAF &amp; @USAIDAfrica #SenDepAsstAdministrator (1/3)
https://t.co/brofWCRKuw",BradSherman
116,2021-12-01 16:50:59+00:00,1466087442595913728,"Tragic events like yesterday's shooting in Oxford, Michigan underscore the need for stronger gun control laws. I applaud the 9th Circuit's decision here, but there's more work to do to create safe and sensible gun policies that protect the lives of Californians and all Americans. https://t.co/hi6uPaeMAt",BradSherman
117,2021-11-30 02:32:30+00:00,1465509009901821956,"Last night on “Life Liberty &amp; Levin” Trump asserted the Spanish flu was the major reason for the end of WW1. He was completely wrong, as usual. I don't know which is worse. That Trump is completely ignorant about history. Or that Trump does not know that he's completely ignorant.",BradSherman
118,2021-11-29 17:47:01+00:00,1465376767183519755,https://t.co/FiOSodGSFN,BradSherman
119,2021-11-28 22:22:19+00:00,1465083659929616386,"Wishing a very #HappyHanukkah
 to all those celebrating! May this #FestivalOfLights fill our homes with brightness, and our hearts with hope and happiness. https://t.co/reVOAF5oYe",BradSherman
120,2021-11-27 19:13:11+00:00,1464673677404901382,".@ReaganWorld thank you for all you do for foster youth, especially through @mixedroots and thank you for bringing that wonderful organization to my attention. God bless and go #Bruins! https://t.co/crZaWGspVq",BradSherman
121,2021-11-25 18:44:45+00:00,1463941747390627841,"Happy #Thanksgiving to all across the nation! May this year’s gathering be filled with many blessings, laughter and thanks. https://t.co/gHqnnQzjhl",BradSherman
122,2021-11-22 23:35:56+00:00,1462927860130275329,"We discussed relations between the U.S. and #Morocco, the Western Sahara, the U.S. commitment to recognize Moroccan sovereignty, and the commitment of Morocco to open an embassy in Israel. (2/2)",BradSherman
123,2021-11-22 23:35:56+00:00,1462927859174068228,"Today I was pleased to meet with Moroccan Minister of Foreign Affairs Nasser Bourita and Ambassador of Morocco to the United States, her Highness Princess Lalla Joumala. (1/2)",BradSherman
124,2021-11-22 18:17:22+00:00,1462847690832850946,(2/2) Biden's appointment of Powell and Dr. Lael Brainard as Vice Chair is applauded by @SpeakerPelosi: https://t.co/yKkch5kRxl,BradSherman
125,2021-11-22 18:17:21+00:00,1462847687645085711,(1/2) I've been advocating for the reappointment of @federalreserve Chair Jerome Powell for one term. See from @WSJ article: https://t.co/9a80mOO0dp,BradSherman
126,2021-11-21 21:10:50+00:00,1462528959040663552,"Think of the long-term boost to our GDP of universal Pre-K (a better workforce decades from now), Child Care (bringing more parents into the labor force now) and a healthy workforce with an expanded Obamacare.  (6/6)",BradSherman
127,2021-11-21 21:10:50+00:00,1462528958042456065,"The Trump Tax Bill increased the deficit by $2 trillion. Republicans responded by using loosey-goosey ""dynamic scoring"". If we had used dynamic scoring for #BuildBackBetter, it would eventually cut the deficit by trillions. (5/6)",BradSherman
128,2021-11-21 21:10:50+00:00,1462528957065089030,"Under Ronald Reagan we had one IRS employee for every 2,400 Americans. Now it's one for every 4,400. If Republicans respected Reagan, they'd support the tax administration provisions of #BuildBackBetter. (4/6)",BradSherman
129,2021-11-21 21:10:50+00:00,1462528955924332547,".@GOPLeader in his 8 hour speech challenged Democrats to debate him in his district on tax administration provisions of #BuildBackBetter. I renewed my acceptance of his challenge -- but he won't debate because I'm a CPA, and because he's wrong. (3/6)",BradSherman
130,2021-11-21 21:10:49+00:00,1462528954804449281,Also explained that #BuildBackBetter will more than pay for itself by helping to close the $1 trillion annual tax gap -- taxes owed by the wealthy and not collected. (2/6),BradSherman
131,2021-11-21 21:10:49+00:00,1462528953386741775,"See my @FoxNews Live appearance: I said #Trump (and I'd add @TuckerCarlson) has blood on his hands for discouraging vaccination. ""Ghoulish political strategy"" to keep the economy closed and improve GOP chances in 2022. (1/6)
https://t.co/Le49oxLjpU",BradSherman
132,2021-11-21 16:47:56+00:00,1462462794138361858,Will be joining @FoxNews Live with @MikeEmanuelFox today at 1:10 PM EST (10:10 AM PS) to discuss the #BuildBackBetter Act and more.,BradSherman
133,2021-11-20 20:48:45+00:00,1462161009876033538,"Wishing a very Happy Birthday to @POTUS Joe Biden! 

Thank you for your dedicated leadership on helping America #BuildBackBetter https://t.co/azelzGcIRz",BradSherman
134,2021-11-19 22:27:56+00:00,1461823585270611972,"As Co-Chair of the Congressional India Caucus, I want to wish the Sikh community in the San Fernando Valley and across the world a very Happy #Gurpurab – a day meant to commemorate the birth of Guru Nanak Dev Ji, founder of the Sikh faith.",BradSherman
135,2021-11-19 16:06:05+00:00,1461727487180914690,"Today I proudly voted to pass the #BuildBackBetter Act -- a transformative investment in the future of our nation that will revitalize the economy, create millions of new jobs, combat the climate crisis, and uplift working families across the country. https://t.co/Dk4FIrEWYE",BradSherman
136,2021-11-19 06:39:27+00:00,1461584892614086656,".@GOPLeader watched your speech and accept your challenge. Happy to do joint Town Halls in your district or mine or the one in between on Tax Enforcement. Big talk on the floor, but I’m sure you don’t have the courage to debate a CPA.",BradSherman
137,2021-11-19 05:22:58+00:00,1461565642864316416,".@GOPLeader #McCarthy: ""Build Back Slower"" https://t.co/2Fo6hEPhYa",BradSherman
138,2021-11-19 05:08:26+00:00,1461561985456386053,I didn't know the House had a filibuster problem too... https://t.co/SdQN5WISZv,BradSherman
139,2021-11-19 04:47:27+00:00,1461556703053369344,"At this rate, we'll get to the year 2022 before @GOPLeader stops talking https://t.co/XIq6XLj8lG",BradSherman
140,2021-11-17 23:02:43+00:00,1461107562410094592,I cosponsored and today voted for a resolution to censure Rep. #Gosar for promoting violence against another Member of Congress and the President. Graphic depictions and threats of violence are never appropriate and are especially unbecoming of a Member of Congress.,BradSherman
141,2021-11-17 19:17:22+00:00,1461050850722435073,"My constituents and I require confidence that a full cleanup will move forward expeditiously, while always conforming to the highest standards of public safety. #SSFL (2/2)",BradSherman
142,2021-11-17 19:17:22+00:00,1461050848994332687,"I wrote today to @SecGranholm @ENERGY to get answers regarding the demolition of a building last month at the Santa Susana Field Lab site, as covered by @NBCLA @JoelNBCLA. (1/2) https://t.co/AJgXoqc3cW",BradSherman
143,2021-11-17 17:19:36+00:00,1461021214357532679,"I want to thank the thousands of Valley residents that joined our Telephone Town Hall last night!

It was a productive and spirited conversation on the many critical issues we face together.

ICYMI, learn more about our event here:
https://t.co/h2rsu1N29h",BradSherman
144,2021-11-17 03:01:04+00:00,1460805158150066180,Starting now! Join now by dialing (855) 920-0548 https://t.co/jW7zoApBwk,BradSherman
145,2021-11-17 02:16:57+00:00,1460794054401265669,Starting soon at 7:00 PM Pacific! https://t.co/jW7zoApBwk,BradSherman
146,2021-11-16 22:42:27+00:00,1460740073192837120,"Join us *Tonight* for our Telephone Town Hall starting at 7:00 PM Pacific to discuss all the critical issues facing Congress.

We'll be joined by Dr. Lynn Goldman, Dean of @GWpublichealth

To RSVP or Submit a question, visit: https://t.co/1snLNRj3hZ https://t.co/tzKnDkaYhu",BradSherman
147,2021-11-15 22:17:11+00:00,1460371328599478284,Pleased to have joined my colleagues in supporting @POTUS's vision that will create millions of good-paying jobs and lay the foundation for strong economic growth for decades to come. https://t.co/T72XfRAKWC,BradSherman
148,2021-11-14 00:07:41+00:00,1459674358729822214,"This Sunday is an opportunity for the rest of the nation to learn more as the documentary, In the Dark of the Valley, will be shown nation-wide by MSNBC on Sunday, November 14th, at 7pm PST/10pm EST. (2/2)",BradSherman
149,2021-11-14 00:07:40+00:00,1459674356892712960,Many of us in the Valley are aware of the contamination at the Santa Susana Field Laboratory site and have been pushing for cleanup. (1/2),BradSherman
150,2021-11-13 00:43:19+00:00,1459320939896881157,"Today, @RepSchakowsky and I asked the State Department to take meaningful steps to ensure Iraqi Christians are not marginalized in elections. The organized disenfranchisement of Christian minorities during Iraq’s recent elections is unacceptable. Read our letter below. https://t.co/e3OJm2a6Bt",BradSherman
151,2021-11-11 15:52:31+00:00,1458824970801397769,"On #VeteransDay, we salute all who have and are bravely serving our country and pledge to honor their sacrifice today and every day. https://t.co/n8W8RK7bn2",BradSherman
152,2021-11-09 23:34:48+00:00,1458216533201727489,"In One Week: I'll be hosting a Telephone Town Hall on Tuesday, November 16th starting at 7 PM.

We'll discuss the latest on the #BuildBackBetter agenda, our efforts to defeat #COVID19 and all the critical issues facing Congress.

RSVP/Submit a Question at:
https://t.co/Xu1cx6kTtP",BradSherman
153,2021-11-08 22:33:45+00:00,1457838780556136453,"A mutual declaration ending the 1950 state of war between the United States, South Korea and North Korea is not a concession to Pyongyang - it's a vital step towards peace. 

Read the letter that I, along with 22 of my colleagues, sent @POTUS on this critical issue. https://t.co/OEYgurrMp0",BradSherman
154,2021-11-06 03:58:56+00:00,1456833453467516931,"I am confident that we will pass an important 
#BuildBackBetter bill later this month. (2/2)",BradSherman
155,2021-11-06 03:58:56+00:00,1456833452293169153,"I proudly voted for @POTUS's Infrastructure Investment &amp; Jobs Act; a-once-in-a generation investment in our infrastructure that'll help create millions of jobs, unleash the full potential of working families &amp; position the U.S to win the 21st century.(1/2)
https://t.co/A1Rb30LcAt",BradSherman
156,2021-11-04 23:01:24+00:00,1456396187343458305,"As war in Ethiopia escalates, we must get aid into Tigray where ~ 1 million face famine. It's unacceptable that no humanitarian aid has gotten into Tigray since Oct 18 due to PM Abiy Ahmed and Eritrea’s blockade. See my interview w/@BBCWorld News America: 
https://t.co/bVSrMSEgbe",BradSherman
157,2021-11-04 16:06:16+00:00,1456291717678837767,"I want wish a happy and safe #Diwali to all those who celebrate the #FestivalOfLights. The lessons of this tradition remind us to let good triumph over evil, choose love over hate, and joy over despair. https://t.co/r15vjQcLgS",BradSherman
158,2021-11-04 14:47:05+00:00,1456271790179639299,"I urged the California Public Utilities Commission (CPUC) @californiapuc to reject plans to increase natural gas storage at the Aliso Canyon Natural Gas Storage Facility, site of the largest methane gas leak in U.S. history.
https://t.co/dVbzYL4Ahw",BradSherman
159,2021-11-03 18:11:09+00:00,1455960756135071750,(3/3) My commonsense legislation will better prepare the State Department to assist Americans in emergencies abroad. I urge my colleagues to support it. Read my bill here: https://t.co/5gjpT6h5uI,BradSherman
160,2021-11-03 18:11:09+00:00,1455960755019386883,"(2/3) This is not a new issue. In the U.S.’s evacuation of 15,000 Americans from Lebanon in 2006, the subsequent GAO report found that the lack of registration significantly hampered evacuation efforts, just like it did in Afghanistan this year.",BradSherman
161,2021-11-03 18:11:08+00:00,1455960753555578884,"(1/3) During today’s @HouseForeign hearing, I was pleased that Dep. Sec. McKeon confirmed that requiring U.S. citizens to register with the State Department when entering war zones would have vastly improved the Afghanistan evacuation. My SAFE Act (H.R. 5387) would do just that.",BradSherman
162,2021-11-02 18:55:47+00:00,1455609602133856265,I remain committed to strengthening the U.S.-Armenia partnership and was pleased to discuss these important issues with Ambassador Makunts. (2/2),BradSherman
163,2021-11-02 18:55:47+00:00,1455609599898308610,"This afternoon, I joined the Congressional Armenian Caucus in meeting with Armenian Ambassador to the United States @LilitMakunts. We spoke about the need to demine #Artsakh, Armenian POWs in Azerbaijan, and the possibilities of a U.S.-Armenia Tax Treaty. (1/2) https://t.co/QtY2x4Jz5X",BradSherman
164,2021-10-30 18:40:31+00:00,1454518595569033218,"I am deeply concerned about the deteriorating health condition of former Georgian President Saakashvili and urge the Government of Georgia to guarantee his access to hospital care and full legal representation. Read my full statement here:
https://t.co/Js2w2GYHcC",BradSherman
165,2021-10-28 21:43:34+00:00,1453839884301619203,(3/3) The American @LungAssociation recent report on EVs finds that “lower-income communities and communities of color often face disproportionate exposures to harmful pollution.” Let’s not leave struggling communities behind in the transition to EVs.,BradSherman
166,2021-10-28 21:43:33+00:00,1453839882544197633,(2/3) Also proud to report that I’ve worked with @FSCDems to include a provision in the #BuildBackBetter package to ensure funding is available for the installation of electric vehicle chargers in eligible apartment buildings.,BradSherman
167,2021-10-28 21:43:33+00:00,1453839880912519169,"1/3) Proud of the work @MaxineWaters, @FSCDems and I have done to see $150 Billion included in the #BuildBackBetter bill to make critical investments in safe &amp; affordable housing. This long-overdue investment in our nation’s housing infrastructure is key to #BuildingBackBetter.",BradSherman
168,2021-10-28 20:05:36+00:00,1453815232279744512,"(2/2) We discussed my bill, the Peace on the Korean Peninsula Act. Read the bill here: https://t.co/15J7QYnyqk",BradSherman
169,2021-10-28 20:05:35+00:00,1453815228332978183,"Pleased to meet with South Korean leaders Seok-Hyun Lee, Vice Chair of the Peaceful Unification Advisory Council, Youngsun Park @Park_Youngsun, former Member of the National Assembly of South Korea, and Casey Choi @CaseyK_Choi, President of #KAPAC. (1/2) https://t.co/wlWLyIbN7u",BradSherman
170,2021-10-27 14:52:58+00:00,1453374167022247943,"For the record: Sometimes I list options the U.S. could take, or should consider, or could threaten to take under certain circumstances. That is not the same as calling for each listed action to be taken immediately. (2/2)",BradSherman
171,2021-10-27 14:52:58+00:00,1453374165856231428,For the record: I no longer bother to correct the record when right-wing or anti-Israel media misquotes me or mischaracterizes my statements. Happens too often. I have a lot to do. (1/2),BradSherman
172,2021-10-27 13:29:53+00:00,1453353258609688581,Today marks the third anniversary of the deadliest anti-Semitic massacre in American history at the #TreeofLife Synagogue in Pittsburgh. May their memory be a blessing. We remain resolute in our stand against anti-Semitism and will always be #StrongerThanHate.,BradSherman
173,2021-10-26 22:10:49+00:00,1453121969491173377,"See my questioning of the witnesses from the hearing here: 
https://t.co/R7kNRvMFyu",BradSherman
174,2021-10-26 20:34:38+00:00,1453097761776279555,"Today, as Chair of the House Financial Services Subcommittee on Capital Markets and Investor Protection, I convened a hearing examining the risks #China poses to American investors and U.S. capital markets. See my opening statement below.
https://t.co/5Di5kS4Ghy",BradSherman
175,2021-10-22 16:16:53+00:00,1451583345838723072,"6 yrs ago Aliso Canyon became the site of the largest gas blowout in US history. We must shut it down. I helped intro a bill requiring the fed gov issue improved safety regulations. Yesterday I was assured by @PHMSA_DOT such regulations will be published.
https://t.co/8nyp8Px9TE",BradSherman
176,2021-10-22 14:17:29+00:00,1451553298058727429,"I recently joined @SenAlexPadilla @RepBrownley @RepLouCorrea and @gracenapolitano in expressing our strong concerns about delays in the clean-up of #SSFL.
https://t.co/iYpU0HKKkb",BradSherman
177,2021-10-21 21:06:00+00:00,1451293718951178249,"Steve Bannon has actively undermined the #January6th Committee and prevented Congress from doing its job investigating the horrible attack on our Capitol. That's why I joined today's bipartisan vote to hold him in contempt of Congress. 

No one is above the law. https://t.co/K8pHuhh3qk",BradSherman
178,2021-10-20 19:04:23+00:00,1450900721277222926,"I was pleased to meet with Indian Ambassador to the U.S. Taranjit Singh Sandhu @SandhuTaranjitS. We discussed continuing the US-India partnership on #COVID19 vaccines, China and ways in which Congress can work to improve the U.S.-India relationship. https://t.co/X1BVtR27fn",BradSherman
179,2021-10-19 19:41:37+00:00,1450547705852436484,I was pleased to meet with Armenian Ambassador to the U.S. Lilit Makunts @LilitMakunts and discuss the ways in which Congress can work to strengthen the U.S.-Armenia relationship. https://t.co/3Sp1QXfQLn,BradSherman
180,2021-10-18 21:06:52+00:00,1450206771197497344,"Saddened by the passing of General Colin Powell, the first Black Secretary of State, the youngest Chairman of the Joint Chiefs of Staff, a trailblazer and dedicated public servant. My prayers are with his family during this difficult time.",BradSherman
181,2021-10-17 21:18:44+00:00,1449847368577437705,"ICYMI: Joined @MikeEmanuelFox on @FoxNews earlier today to discuss where negotiations over the #BuildBackBetter agenda stands in Congress. 
https://t.co/y1u4l6SScS",BradSherman
182,2021-10-17 02:48:26+00:00,1449567952001511426,"TCM to air tribute tomorrow to the life and work of the Valley's very own Marsha Hunt; a legendary actress and one of Hollywood’s first ever “actor-vists”. 
https://t.co/ZbDHkumpoB",BradSherman
183,2021-10-16 02:16:40+00:00,1449197573512761346,The Medical Travel Assistance to Protect Women’s Right to Choose Act that I authored will cover costs for patients who are forced to cross state lines to avoid near-total bans on abortion. But what we need is abortion rights in all 50 states. (2/2),BradSherman
184,2021-10-16 02:16:40+00:00,1449197571843444747,"These terrible stories show the problems with the Texas law #SB8 as women have had to travel hundreds of miles to get abortion care, and illustrate why we must work to protect the constitutional right to abortion care nationwide. (1/2) https://t.co/T0p28qgxY4",BradSherman
185,2021-10-16 00:23:33+00:00,1449169104561127426,I want to wish everyone who celebrates a happy and prosperous #Dussehra https://t.co/4mi6VdwoMK,BradSherman
186,2021-10-15 18:43:39+00:00,1449083564461641731,Was pleased to join the Chatsworth/Porter Ranch Chamber of Commerce @cprcoc “State of the Community” luncheon yesterday and be able to discuss programs like PPP and the Restaurant Revitalization Act that support valley businesses. https://t.co/CoIBUtdr03,BradSherman
187,2021-10-15 04:45:15+00:00,1448872574239350784,Best game ever! #Dodgers https://t.co/OsBwT72hnu,BradSherman
188,2021-10-13 18:25:53+00:00,1448354320550928386,I stand in agreement with my colleagues on the @FSCDems and Chairwoman @RepMaxineWaters that #HousingIsInfrastructure. We must seize this once-in-a-lifetime opportunity to invest in the long-overdue need for #AffordableHousing by making it a part of the #BuildBackBetterAct. https://t.co/TruQT7R8pT,BradSherman
189,2021-10-12 18:16:40+00:00,1447989612576747523,"The #AmericanRescuePlan continues to deliver as the next advance #ChildTaxCredit payment arrives for millions of families this Friday, October 15th. 

For more info visit the IRS's #ChildTaxCredit Portal here: https://t.co/CyfKYVKSTt
https://t.co/6Ex3wOlohe",BradSherman
190,2021-10-12 03:36:47+00:00,1447768183180517376,"On behalf of my team, thanks Ray. https://t.co/InlV8gzpeC",BradSherman
