,Datetime,Tweet Id,Text,Username
191,2021-10-11 18:22:51+00:00,1447628778461618182,Was pleased to join the North Valley Regional Chamber of Commerce @NVRCC Oktober Festival yesterday where we highlighted the work of our constituent services team. https://t.co/NWrWut3op4,BradSherman
192,2021-10-07 21:41:10+00:00,1446229135093870600,"This is also why I authored the Medical Travel Assistance to Protect Women’s Right to Choose Act, to defray the costs for women who are forced to cross state lines to avoid restrictive bans like this. (2/2)",BradSherman
193,2021-10-07 21:41:09+00:00,1446229133458087939,"I applaud the recent decision preventing the enforcement of #SB8, the most extreme abortion ban in the country. We must ensure that the constitutional right to abortion care is protected nationwide, which is why I helped introduce the Women’s Health Protection Act. #WHPA (1/2) https://t.co/EhMi3iDQHE",BradSherman
194,2021-10-07 17:18:52+00:00,1446163126265819139,I am honored to celebrate this #HispanicHeritageMonth with my colleagues in the @HouseDemocrats. Our diversity is our strength — and I am proud to serve alongside all of you as we fight for our Hispanic communities and our American values.,BradSherman
195,2021-10-07 02:39:26+00:00,1445941811663548417,Yesterday’s #FacebookWhistleblower testimony that Facebook’s engagement-based ranking promoted hateful content targeting Rohingya and Tigrayans during ongoing atrocities is an outrage.,BradSherman
196,2021-10-06 21:00:25+00:00,1445856492674957316,Was glad to speak at @CSUNorthridge about my efforts to fight for federal aid for higher education at today’s @CAGovernor Newsom bill signing with great California champions of higher education @EleniforCA @AsmJesseGabriel @AsmKevinMcCarty @MariaEDurazo @AsmReyes47 @AsmMarcBerman https://t.co/ei5aRhKVds,BradSherman
197,2021-10-05 19:04:24+00:00,1445464908703809541,"The devastating oil spill across the Southern California coast serves as a painful reminder of why, for 25 years in Congress, I've fought against offshore drilling off of California's coast and have worked to hold big oil accountable for their pollution. 
https://t.co/XpA234sLsV",BradSherman
198,2021-10-04 21:56:20+00:00,1445145788410179592,"In May, we saw how vital the #IronDome defense system is to saving thousands of lives when Hamas fired +4,500 rockets into Israel. It's critical that the U.S. continues to stand with Israel and help support these crucial, life saving programs. (2/2)",BradSherman
199,2021-10-04 21:56:19+00:00,1445145787223117836,"I was proud to join so many of my colleagues a couple weeks ago in voting to replenish Israel's #IronDome.  Despite this overwhelming bipartisan vote to stand with our ally Israel, Senator Rand Paul now stands in the way of the bill coming to the Senate floor. (1/2)",BradSherman
200,2021-10-01 22:28:40+00:00,1444066764367794179,"Rent and utility assistance will also still be available for renters and landlords impacted by #COVID19. 

For more info, visit: https://t.co/PoJ6Sv7MZN",BradSherman
201,2021-10-01 22:28:39+00:00,1444066760685236224,"Many state eviction protections are set to expire today. I've fought for an extension of Federal eviction protections and joined @RepCori's sit-in on the Capitol steps to highlight this urgent need.

Fortunately, @LACity's protections remain. Learn more at https://t.co/IQ2uhQDwGl https://t.co/XBnWIXAjMN",BradSherman
202,2021-09-29 23:16:24+00:00,1443354000192155652,"At our @HouseForeign hearing on South East Asia, I focused on the oppression of the Rohingya people by Burma/Myanmar. Watch my full remarks above on the need for more urgent action.",BradSherman
203,2021-09-29 23:16:24+00:00,1443353998992543748,"Sherman: “The fact that we're still providing millions of dollars to help the government of Myanmar/Burma achieve its economic objectives-when that government is engaging in genocide and ethnic cleansing- is a stain on the morality of the United States.”
https://t.co/gpzGnfiWuE",BradSherman
204,2021-09-29 23:01:08+00:00,1443350158876594176,"During yesterday's @HouseForeign hearing, I asked the administration what we're doing to aid #Tigray. As millions face starvation, we must ensure that the Ethiopian government allows humanitarian aid to reach the people of Tigray.",BradSherman
205,2021-09-29 23:01:08+00:00,1443350157563731971,"Sherman: “The Ethiopian gov continues to block humanitarian aid from entering #Tigray. Is it our position that this is a gross depravation of human rights/war crime?” 

Dep. Asst. Sec Gonzales: “We certainly see it as a gross depravation of human rights.”
https://t.co/zLQ4D2NzZO",BradSherman
206,2021-09-29 17:28:10+00:00,1443266365150859267,"Thank you to all who joined our Telephone Town Hall last night! It's always great to hear what's on the minds of Valley residents and keep them informed on all the critical issues we face together. 
https://t.co/3PeqNKyQzR",BradSherman
207,2021-09-29 02:00:09+00:00,1443032820662874115,"Starting Now!

To Join Dial (855) 920-0548! https://t.co/NGDn4Wuz4L",BradSherman
208,2021-09-29 01:04:18+00:00,1443018767630471172,Starting tonight in about 1 hour! https://t.co/NGDn4Wuz4L,BradSherman
209,2021-09-28 22:03:58+00:00,1442973382799204352,"Join us *Tonight* for our Telephone Town Hall starting at 7:00 PM Pacific where we'll update you on all the critical issues facing Congress.

We'll be joined by Dr. Lynn Goldman, Dean of the @GWpublichealth 

To participate, Dial (855) 920-0548 anytime during the event tonight. https://t.co/N8VNWZHtYR",BradSherman
210,2021-09-28 16:39:10+00:00,1442891643317673985,"Thank you Tucker for endorsing one of the most progressive provisions in the most progressive bill of the century. Unfortunately, the refundable #ChildTaxCredit expires next year. Unless we pass the Democratic #ReconciliationBill #BuildBackBetter. [2/2]",BradSherman
211,2021-09-28 16:39:08+00:00,1442891638561333254,"[1/2] Last night, @TuckerCarlson interviewed the President of Poland @prezydentpl who described his country's program of paying money to parents. Tucker said he wished the US had a similar program. We do. It's called the #ChildTaxCredit ($250 per child/month; $300 kids 5 &amp; under) https://t.co/EvlW1piESC",BradSherman
212,2021-09-27 22:12:32+00:00,1442613151653154817,"Join us *Tomorrow* for our Telephone Town Hall starting at 7 PM Pacific where we'll discuss all the critical issues facing Congress.

We'll be joined by Dr. Lynn Goldman, Dean of the @GWpublichealth 

RSVP or Submit a Question in advance at: https://t.co/1snLNRj3hZ",BradSherman
213,2021-09-27 14:34:03+00:00,1442497770976382980,"We need to impose tariffs on China now in order to negotiate from strength to deal with China's wrongful behavior. The article below describes the latest outrage. 
https://t.co/DltS1yPf9X",BradSherman
214,2021-09-24 21:45:44+00:00,1441519243560845318,"After the Supreme Court greenlit the most restrictive ban on abortion we've ever seen, today the House passed the Women's Health Protection Act -- legislation I helped introduce that would protect the right to access abortion throughout the United States. #WHPA https://t.co/xM9JudqWhv",BradSherman
215,2021-09-24 20:45:32+00:00,1441504092292059137,"They deserve dignity, living wages and safe work conditions. #IASolidarity (2/2)",BradSherman
216,2021-09-24 20:45:31+00:00,1441504090626867204,"Our favorite shows and movies would literally not be possible without the work of @IATSE members. In addition to their contributions to our culture, their work is of major importance to the U.S. economy, and especially here in the Valley. (1/2)",BradSherman
217,2021-09-24 19:28:27+00:00,1441484694357413888,The bill is an imperfect solution to a problem that should not exist. The Supreme Court should re-affirm and enforce Roe v. Wade so that women in all states have the right to choose. (2/2),BradSherman
218,2021-09-24 19:28:26+00:00,1441484692209819651,"Today I introduced the Medical Travel Assistance to Protect Women's Right to Choose Act -- to support women living in states that have enacted abortion bans by providing funding to travel to states where they can access full reproductive healthcare. (1/2)
https://t.co/KskWCuU701",BradSherman
219,2021-09-24 17:25:08+00:00,1441453660530167809,Good to meet with President of Zambia @HHichilema along with @RepGregoryMeeks of Foreign Affairs and @RepKarenBass of the Africa Subcommittee. The President spoke of his dedication to Democracy and the rule of law.,BradSherman
220,2021-09-24 16:46:00+00:00,1441443812870696962,Pleased to report that the House passed an amendment offered by @RepCardenas @RepAdamSchiff and I calling for Azerbaijan’s immediate release of Armenian prisoners of war and for an investigation into their actions during their 2020 attacks against #Artsakh.,BradSherman
221,2021-09-23 18:56:34+00:00,1441114282255532038,"A great victory for the US-Israel alliance. House votes to replenish Iron Dome. Supported by 96% of Democrats and 99% of Republicans. 

The most bi-partisan vote this year.",BradSherman
222,2021-09-22 20:47:44+00:00,1440779871710445576,"The House voted to pass the amendment offered by @RepMaxineWaters and I to punish Russia for its interference in U.S. elections.

This sends a powerful message that the U.S. is prepared to act against Putin’s efforts to undermine our democracy.
https://t.co/SSVSavi7x9",BradSherman
223,2021-09-22 04:38:34+00:00,1440535972064550914,I’m pleased we will vote on a separate Iron Dome bill soon. I am confident it will pass by a wide margin— as it should. Iron Dome saves lives.,BradSherman
224,2021-09-21 22:03:09+00:00,1440436464584560641,"In ONE WEEK: Join us for our Telephone Town Hall on Tuesday September 28th starting at 7 PM where we'll update you on all the critical issues facing Congress.

We'll be joined by Dr. Lynn Goldman, Dean of the @GWpublichealth.

RSVP or Submit a Question at: https://t.co/1snLNR1rTp",BradSherman
225,2021-09-18 23:32:42+00:00,1439371835758596097,"Was good to share some time and New Year greetings with former ambassador and Israel’s current representative to Southern California and over a dozen western states, @Hillel_Newman. Continuing my efforts to strengthen US-Israel relationship. https://t.co/QuD3MFmJEx",BradSherman
226,2021-09-18 23:02:41+00:00,1439364279753449478,"Nice meeting with Valley members of the Hindu Volunteer Group on the occasion of the festival #RakshaBandha. Always good to see Sunil Agrawal, Chairman of the 
India Association of Los Angeles. https://t.co/dP9z2Wko36",BradSherman
227,2021-09-18 22:01:16+00:00,1439348826339430401,"If not, at least we stood up for peace. And the American people and the world will know where China stands. (2/2)",BradSherman
228,2021-09-18 22:01:16+00:00,1439348825076944897,"As I just discussed with @bbcworldservice, we should propose an Indo-Pacific conference on naval limitations to prevent a naval arms race. If China agrees to a reasonable deal, great for everyone but arms merchants. (1/2)",BradSherman
229,2021-09-15 22:04:55+00:00,1438262579487514633,"G'Mar Chatima Tovah to all who are getting ready to observe #YomKippur. May it be a day full of reflection, atonement and continuance of tradition. https://t.co/FbqL6kHVuK",BradSherman
230,2021-09-15 21:34:21+00:00,1438254888929071106,"We'll be hosting a Telephone Town Hall on Tuesday September 28th starting at 7:00 PM Pacific to update you on all the critical issues facing Congress.

To RSVP or Submit a Question, visit: https://t.co/1snLNRj3hZ",BradSherman
231,2021-09-15 19:57:37+00:00,1438230546212085765,"ICYMI -- Sherman tells @FoxNews: This is a smashing victory and a repudiation of the Republican party by a massive margin.
https://t.co/tCSqXblL5K",BradSherman
232,2021-09-15 19:30:37+00:00,1438223750571470853,"Why would a Chinese General believe General Milley? American hubris leads us to believe that everyone thinks we’re the good guys, and never lie. Our adversaries don’t believe that.",BradSherman
233,2021-09-13 21:16:38+00:00,1437525652492664837,"See my questioning of @SecBlinken during today's @HouseForeign hearing evaluating the U.S. withdrawal from #Afghanishtan. The questioning shows that Trump had committed to withdraw by May 1, but had no plan on how. 
https://t.co/xEDc1glJIf",BradSherman
234,2021-09-13 15:28:13+00:00,1437437972488597507,"Honored this weekend to pay tribute to my friend and advisor Larry Horner, veteran, public servant, Mayor @CityofTO, and beloved husband and father. May his memory be a blessing. @eltongallegly24 @lindaparks2021 @CBill_delaPena @ASM_Irwin @hageltim @AyubBill https://t.co/QyCk7qZV1O",BradSherman
235,2021-09-11 14:08:30+00:00,1436693136466714628,"Today we remember the lives lost on September 11th, and come together as a nation to honor their memories.

We remember and honor the selfless first responders, firefighters, and police officers for their heroism on that fateful day.

Today and everyday we will #NeverForget https://t.co/TF8ke9HpiS",BradSherman
236,2021-09-06 19:45:34+00:00,1434966020775677963,"As families get ready to celebrate #RoshHashanah, I want to wish all who are celebrating a sweet, happy and healthy New Year – Shanah Tovah U’Metukah. https://t.co/WRAXUo0uFL",BradSherman
237,2021-09-06 17:10:46+00:00,1434927065590116352,"On #LaborDay, we recognize the achievements of America’s labor movement and reaffirm our resolve to continue the fight for workers’ rights.

Through such transformative actions like passing the #PROAct, @HouseDemocrats continue to honor and support American workers. https://t.co/539eJQEK4V",BradSherman
238,2021-09-03 21:45:36+00:00,1433909066041004032,"Very sad to hear of the passing of tremendous Valley activist, Elaine Berke. Her leadership in Jewish institutions, as well as her support of @csunorthridge, will have long-lasting impacts. My deepest condolences to her family.",BradSherman
239,2021-09-02 18:30:11+00:00,1433497500791590915,"Today marks the 30th anniversary of the declaration of independence of #Artsakh. As a proud Member of the Congressional Armenian Caucus, I stand in solidarity with the people of Artsakh. https://t.co/Ny8QAhCcjg",BradSherman
240,2021-09-01 23:28:28+00:00,1433210175524163585,"Congress can act now, without waiting for action from SCOTUS, by passing the Women's Health Protection Act #WHPA -- a federal bill that will protect the right to access abortion care throughout the U.S. which I helped introduce. (2/2)",BradSherman
241,2021-09-01 23:28:28+00:00,1433210174450323458,"The failure of #SCOTUS to stop #SB8 is an egregious affront to women’s rights, health and reproductive freedoms. (1/2)
https://t.co/MR6Jm48v2s",BradSherman
242,2021-09-01 21:43:08+00:00,1433183669015941125,Was pleased to join my colleagues on the Congressional Ukraine Caucus in welcoming Ukrainian President Zelensky @ZelenskyyUa to the Capitol during his official visit to Washington. https://t.co/NpOYEfV8H0,BradSherman
243,2021-08-31 15:06:39+00:00,1432721501686575106,"Saddened to hear of the passing of legendary actor and the Valley's own, Ed Asner. My thoughts are with his family during this difficult time.

It’s been an honor to represent him in Congress. He will be missed.
https://t.co/FYGy6d1cwE",BradSherman
244,2021-08-30 19:46:07+00:00,1432429443205718019,"The historic #ChildTaxCredit, championed by @HouseDemocrats @SenateDems &amp; @POTUS, kept 3 million children out of poverty in just its first round of payments.

We will continue to build on this success and #BuildBackBetter #ForThePeople.
https://t.co/41LZT0zBbe",BradSherman
245,2021-08-29 02:14:41+00:00,1431802455306682368,https://t.co/YvGOcF1fDo,BradSherman
246,2021-08-28 16:24:51+00:00,1431654018225479687,"We commemorate the 58th anniversary of the #MarchOnWashington during a time where voter suppression laws are sweeping the nation. 

As we mark this solemn day, we must honor the Civil Rights heroes by passing:

🤝HR1 the For The People Act

🗳️HR4 the John Lewis Voting Rights Act",BradSherman
247,2021-08-27 15:47:22+00:00,1431282196585791490,"Reminder: This will NOT immediately impact California renters. The state’s eviction moratorium remains in effect until September 30th and the City of Los Angeles eviction protections remain in effect until August 1st, 2022. (2/2)",BradSherman
248,2021-08-27 15:47:21+00:00,1431282195319201792,A devastating blow to thousands at risk of eviction during a pandemic. We'll continue our work to ensure the immediate disbursement by states and localities of the over $45 billion allocated by Congress for rental assistance. (1/2) https://t.co/LCYqThreWx,BradSherman
249,2021-08-26 23:11:09+00:00,1431031492055076866,Does Kevin doubt our troops face imminent hostilities? (2/2) https://t.co/v85eVra32w,BradSherman
250,2021-08-26 23:11:08+00:00,1431031487533551620,".@GOPLeader says we should be called back to D.C. to pass Rep. Gallagher's bill to prohibit withdrawal until every American is out. Fails to mention the bill allows withdrawal if the Sec Def certifies that our troops “face imminent hostilities"". (1/2)
https://t.co/QNiygHS48r",BradSherman
