,Datetime,Tweet Id,Text,Username
0,2022-02-23 14:23:14+00:00,1496490838947418113,Seems weird that this is a technical foul. But who cares - awesome moment and the crowd was nuts after this. Great win for #UConn and having this clip replayed on TV all day is great too. https://t.co/gW09vir9GJ,ChrisMurphyCT
1,2022-02-23 14:20:44+00:00,1496490210212864013,"Every Republican needs Trump's support. It's what drives 95% of elected Republicans.

And Trump is telling them all - praise Putin, go soft on Russia's invasion of Ukraine. https://t.co/DuZY5ZxcWR",ChrisMurphyCT
2,2022-02-23 13:54:32+00:00,1496483616917962755,"The top GOP Senate candidates - who are competing for Trump's endorsement - are saying things like ""I don't really care what happens to Ukraine one way or another.""

This is the Republican mainstream. People like Graham and McConnell are the outliers.
https://t.co/Ped9Iud9qM",ChrisMurphyCT
3,2022-02-23 13:50:26+00:00,1496482585974878222,"Really proud to be co-chairing this effort. I've been working on this issue for years in Congress - putting city and state leaders back out on the frontlines of American diplomacy. China does this well. We used to, but don't anymore. 
https://t.co/51JnxlXdi4",ChrisMurphyCT
4,2022-02-23 13:47:40+00:00,1496481890915831812,"The thrust of the argument here is that I mistakenly labeled America as the ""good guy"" and Russia as the ""bad guy.""

Remember, Trump's crowd IS the Republican Party mainstream right now. And they are rallying to Putin's defense.
https://t.co/zy4bLQSp8B",ChrisMurphyCT
5,2022-02-19 18:59:22+00:00,1495110781658095620,Huh. https://t.co/QQXEBtNfCR,ChrisMurphyCT
6,2022-02-19 18:58:48+00:00,1495110635826388996,"Gulf countries hated Obama's Iran nuclear deal. Now they are rooting for Biden to restart it. Why?

1. They saw that it worked. To their surprise, Iran made good on its end.

2. They know a failure to get back into a deal sets off a cataclysmic nuclear weapons race in the region.",ChrisMurphyCT
7,2022-02-19 18:54:22+00:00,1495109522075095041,"Opponents of a renewed Iran nuclear deal will come at you with two alternatives:

(1) more ""maximum pressure""/sabotage - the two strategies the U.S. and Israel tried since 2018. They both resulted in Iran's nuclear weapons ""break out"" time going from a year to weeks.

(2) war",ChrisMurphyCT
8,2022-02-19 18:42:05+00:00,1495106429711224833,"The U.S. delegation met with the UN and the World Food Program in Munich. They told us that if the U.S. designates the Houthis as an FTO, they will have to cease food distribution to 13 million people and the commercial food market will also collapse. Starvation to follow. https://t.co/rJMcI7oqlu",ChrisMurphyCT
9,2022-02-19 14:42:11+00:00,1495046057536983045,The @VP has been a force in Munich. On her game. So awesome to watch. https://t.co/RSUiYySuOX,ChrisMurphyCT
10,2022-02-19 14:39:33+00:00,1495045396225265674,Well…that may technically be true since it will all have left Belarus for Ukraine. https://t.co/TDUFV0H1Ck,ChrisMurphyCT
11,2022-02-19 13:34:32+00:00,1495029031657476097,Great catching up w my friend Irish Foreign Minister @simoncoveney in Munich. Brought my colleague @DanSullivan_AK along too to make it clear there is bipartisan support for Ireland! https://t.co/5iQESsG1nk,ChrisMurphyCT
12,2022-02-18 17:41:59+00:00,1494728918267731968,Just appeared on @mitchellreports from #MSC2022. https://t.co/nnZ2KCLMvA,ChrisMurphyCT
13,2022-02-18 15:11:59+00:00,1494691167820128269,Now back to back meetings with Kiev Mayor (and former heavyweight champion) Vitali Klitschko and German Foreign Minister Annalena Baerbock. Talking about sticking together on Ukraine strategy. https://t.co/vUbYkWddlY,ChrisMurphyCT
14,2022-02-18 14:55:27+00:00,1494687008052039680,"Wheels down for the Munich Security Conference. There’s a big congressional delegation here and we do many meetings together. But I also do some meetings on my own. For instance, spent some time with Albanian Prime Minister Edi Rama. https://t.co/X5CjcKktIb",ChrisMurphyCT
15,2022-02-17 21:49:21+00:00,1494428782823890944,Take a minute to watch this. It's tempting to view Putin as some world-dominating mastermind. But that's not what's happening here. At all. https://t.co/3fvrkPCI4m,ChrisMurphyCT
16,2022-02-17 14:57:37+00:00,1494325164514832395,"This is true. But it has also been true about Syria, Yemen, Afghanistan. The U.S. loses its moral authority when we turn our back on refugees. https://t.co/xaLDigzsjg",ChrisMurphyCT
17,2022-02-17 14:56:00+00:00,1494324758371979273,"If Putin goes through with this, see it for what it is - an act of panicked weakness. Putin has tried everything to bully Ukraine back into his orbit. But Ukrainians don't want to be dependent on Russia. They know it's a dead end. Invasion is his last, disastrous resort.",ChrisMurphyCT
18,2022-02-17 13:14:41+00:00,1494299261240020995,Know your enemy. https://t.co/zKmrUxfIin,ChrisMurphyCT
19,2022-02-16 04:02:09+00:00,1493797825880244228,"Explain to me how five years of ""maximum pressure"" on Iran has worked out?

Iran's nuclear program is more advanced.
Iran's support to terrorists has increased.
Iran's government is more hardline.
Iran's regional provocation is more dangerous.

Why would we want more of this?",ChrisMurphyCT
20,2022-02-16 03:45:24+00:00,1493793608473976839,"GOP PLAYBOOK

Step one: beat Biden over the head on inflation

Step two: refuse to confirm anyone to fight inflation https://t.co/OCpQBNj5TN",ChrisMurphyCT
21,2022-02-16 01:37:15+00:00,1493761360521576448,"Tune in. On in a few minutes. Talking about Russia, Ukraine and the landmark settlement today for the Sandy Hook families. https://t.co/IN9A0MsWjY",ChrisMurphyCT
22,2022-02-15 17:46:21+00:00,1493642852483710986,This is amazing news and a warning sign for the makers of other military style weapons. They will be held accountable. https://t.co/mxudTC1rYJ,ChrisMurphyCT
23,2022-02-15 04:37:42+00:00,1493444381692645377,"10/ And all for what? To force a country back into your orbit against its wishes? A nation that used to rely on you willingly? All of this just to achieve pre-2013 status quo, but with thousands dead and a Russian economy in ruins?

And so how is Putin holding all the cards?",ChrisMurphyCT
24,2022-02-15 04:37:41+00:00,1493444380421726210,9/ And the sanctions from the U.S. and the rest of the world will be devastating - nothing like the relatively milquetoast sanctions Russia has endured so far. The combination of the cost of the war and the cost of the sanctions will destabilize Putin's hold on power.,ChrisMurphyCT
25,2022-02-15 04:37:41+00:00,1493444378580373505,"8/ It's hard to fathom what the biggest land war in Europe since 1945 will look like, but it could be cataclysmic for Putin. The battle itself will likely be long and deadly. The Ukrainian people will not submit - they will fight back in a long, bloody insurgency.",ChrisMurphyCT
26,2022-02-15 04:37:41+00:00,1493444377213026305,"7/ Now, Putin has two ways out. Back down, or proceed with a plan he never really wanted - an expensive, costly, and potentially disastrous invasion of the largest country in Europe.",ChrisMurphyCT
27,2022-02-15 04:37:40+00:00,1493444375925465091,"6/ In fact, the opposite happened. America and Europe rallied to support Zelensky, sending him more arms and money. NATO united, and sent more troops to its border with Russia. And Putin's demands went nowhere - the West did not capitulate.",ChrisMurphyCT
28,2022-02-15 04:37:40+00:00,1493444374700695554,"5/ By 2021, Putin had no options left. So he panicked again.

This time, he gambled that a threatened invasion would collapse Zelensky's government, create tensions and fissures within NATO, or result in the West folding and agreeing to his demands.

None of that happened.",ChrisMurphyCT
29,2022-02-15 04:37:40+00:00,1493444373195161600,"4/ That was the last straw, and Putin's toadies were run out of the country and the nation elected ardent pro-Europe and pro-U.S. leadership.

Putin invaded Crimea and eastern Ukraine, but that just hardened the people's anti-Russia sentiments.",ChrisMurphyCT
30,2022-02-15 04:37:39+00:00,1493444371257171968,"3/ The Ukrainian people realized that a political and economic dependence on Russia was a road to nowhere. So they rose up, and demanded to become part of the EU.

Putin and his stooges in Ukraine panicked, and they gunned down the protestors.",ChrisMurphyCT
31,2022-02-15 04:37:39+00:00,1493444369868853250,"2/ Remember how we got here. Ukraine used to be a Soviet republic, and then for most of its post-Soviet independence, its leaders operated in close association with Kremlin.

Then, in 2013 something happened.",ChrisMurphyCT
32,2022-02-15 04:37:38+00:00,1493444368593821699,"1/ It's maddening watching Putin hold these cards. It feels like he's in charge, holding us all hostage.

But not really - he is operating from a position of severe weakness. Having failed to coax Ukraine back into his orbit, a potentially disastrous invasion is his last resort.",ChrisMurphyCT
33,2022-02-14 20:58:54+00:00,1493328921760309248,I will be on @TheLeadCNN with @jaketapper in a few minutes to talk about Ukraine. Lots happening today. Tune in.,ChrisMurphyCT
34,2022-02-14 16:40:52+00:00,1493263987139559426,I will be on @cnni in a few minutes to talk about how the Biden Administration and Congress are working together to support Ukraine’s sovereignty.,ChrisMurphyCT
35,2022-02-13 17:44:40+00:00,1492917654939746309,"So amazing. Can’t wait to have you back in the Senate, Ben Ray!! https://t.co/tUGY5kqgnH",ChrisMurphyCT
36,2022-02-12 16:38:48+00:00,1492538688508768259,Amazing event this morning in Waterbury. We gave our awards to all our MLK essay contest winners. Thanks to the Waterbury NAACP for helping to put on a great program. https://t.co/Sx5K2znjh0,ChrisMurphyCT
37,2022-02-12 02:07:40+00:00,1492319464070725635,"I went with State Rep @mariahornct to Jumpfest at the Salisbury Ski Jump tonight. It was amazing! Did you know we have a professional ski jump in northwest Connecticut!? 

Come check it out - it’s going on all weekend. https://t.co/HddIl6DCB7",ChrisMurphyCT
38,2022-02-12 02:00:53+00:00,1492317755852349444,I got to hang out today with Steve Emt of Hebron. He’s on the U.S. Paralympic Curling Team. The U.S. team has a chance to medal this year and I was so lucky to wish Steve good luck in person today. He’s heading to a Beijing in a few weeks. https://t.co/HptCJFH0zb,ChrisMurphyCT
39,2022-02-11 23:37:54+00:00,1492281772717002757,"a. I have no future in this sport. 

b. The Norfolk Curling Club is an awesome place and I’m so grateful they welcomed me in today. Check them out! https://t.co/TE1Orf0fPA",ChrisMurphyCT
40,2022-02-11 13:48:35+00:00,1492133464161853444,"At 10:30 today in Hartford I’m going to give an update on our work in Congress to reform the Electoral Count Act. The current law is confusing and full of holes that allows a rouge party to steal the vote from the people. To protect democracy, we need a new ECA.",ChrisMurphyCT
41,2022-02-11 13:31:15+00:00,1492129102081531908,"I’m doing a winter sports tour of northwest Connecticut this afternoon! Visiting the Norfolk Curling Club and the Salisbury Ski Jump. 

My sense is ski jumping is much easier than it looks so even though I have no experience I’m going to give it a try. What could go wrong. 🤷‍♂️",ChrisMurphyCT
42,2022-02-10 22:26:46+00:00,1491901482546958346,FYI. My piece today in Time Magazine. https://t.co/pT6oU6m0Df,ChrisMurphyCT
43,2022-02-10 18:40:55+00:00,1491844647580311561,Re “longer and stronger” - the Administration has consistently said is that we should first restart the nuclear deal so that we can then work to enact a “longer and stronger” deal on the nuclear program and Iran’s other malevolent behavior. https://t.co/O0ZZAINLXX,ChrisMurphyCT
44,2022-02-10 17:29:12+00:00,1491826597854384130,Umm…I was expressing shock at the ongoing and accumulating cost to global security by President Trump’s decision to ignore his entire national security cabinet and tear up the the nuclear deal. https://t.co/8H8mbiV1pz,ChrisMurphyCT
45,2022-02-10 17:23:13+00:00,1491825094309683208,“There are a lot of people in Connecticut who have loved ones in Ukraine who may soon have to fight for their freedom. But the outcome of this crisis should matter to all of us.” https://t.co/q49kROOpyl,ChrisMurphyCT
46,2022-02-10 02:42:44+00:00,1491603511238447106,It was a really important hearing. More Afghans could die from the coming famine than the total that died from 20 years of war. American cannot stand by and let this happen. https://t.co/CouDDqkioX,ChrisMurphyCT
47,2022-02-10 02:39:03+00:00,1491602586587250694,I will be on @maddow (hosted tonight by @AliVelshi) in a few minutes to talk about national security issues. Tune in!,ChrisMurphyCT
48,2022-02-10 00:41:59+00:00,1491573123069714439,"How about this one:

Me: Waiter! My soup is cold!

Waiter: Sir, it's gazpacho!

Me: sigh….Fine. Gazpacho, my soup is cold. https://t.co/UqyavKracq",ChrisMurphyCT
49,2022-02-09 19:39:19+00:00,1491496953473028107,I’m about to gavel this hearing to order.  https://t.co/iirUUzRA72,ChrisMurphyCT
50,2022-02-09 17:12:23+00:00,1491459978145763328,"""President Trump gave us the gift of being able to test the theory of the nuclear deal's opponents, who said no deal was better than the JCPOA, and it turned out the strategy pushed by the deal's critics was a spectacular failure."" https://t.co/7LhtI04Bcc",ChrisMurphyCT
51,2022-02-08 23:06:23+00:00,1491186676462669824,So this is a big deal that gets almost zero attention. The postal service has been in perpetual crisis over the last decade and this bill puts them back on sound financial footing. American's economy can't function without a healthy USPS. The Senate should take this bill up ASAP. https://t.co/ok0DbdnD4r,ChrisMurphyCT
52,2022-02-08 23:04:12+00:00,1491186130058104832,"Thanks for the meeting yesterday, Ambassador. The U.S.-Serbia relationship remains strong and vital. https://t.co/EQnabmbGNm",ChrisMurphyCT
53,2022-02-08 22:55:36+00:00,1491183964291465216,I'm heading to the Senate floor in about 20 minutes to explain why it's so important for the United States and Iran to reconstruct a diplomatic agreement that prevents Iran from obtaining a nuclear weapon.,ChrisMurphyCT
54,2022-02-08 14:26:13+00:00,1491055774226960390,Great to share dinner last night w German Chancellor @OlafScholz. He told a small group of Senators that Germany will stand with us - shoulder to shoulder - in our efforts to stand up for Ukrainian sovereignty.,ChrisMurphyCT
55,2022-02-07 13:38:42+00:00,1490681429205962754,"When Iran hawks this week come after Biden, remind them that for four years Trump implemented the Iran policy they wanted and it was a total dumpster fire. Iran’s breakout time to a nuclear weapon is now 2 months.",ChrisMurphyCT
56,2022-02-07 00:16:36+00:00,1490479571963105280,He’s like the best egg. Thank you! https://t.co/iNLCFFkbY4,ChrisMurphyCT
57,2022-02-07 00:14:34+00:00,1490479062510452741,"Sorry I was de-leied in responding Cory.

Yes, let’s get it done for Bri. https://t.co/Xpq8G3hW4A",ChrisMurphyCT
58,2022-02-06 23:37:34+00:00,1490469748752199682,"Our friend @brianschatz has raised millions on Twitter for Dem candidates. Now it’s time to help him. 

Brian’s a climate leader, a super good guy, and up for re-election.

@CoryBooker and I hope you can help our friend. $50. $25. $10. Whatever you can do. https://t.co/vqlbpBmZJm",ChrisMurphyCT
59,2022-02-06 23:26:21+00:00,1490466927222919168,Link coming. Hold for a min. https://t.co/dGobsHtmBa,ChrisMurphyCT
60,2022-02-06 23:21:08+00:00,1490465614015700997,"Hey @CoryBooker I have an idea. A good one. 

Our pal @brianschatz has raised millions online for other candidates. He’s an online fundraising superhero, but he can be a little too selfless in his fundraising. 

He’s up for re-election this fall. Think we can help him out?",ChrisMurphyCT
61,2022-02-05 23:55:54+00:00,1490111973656248324,"Liz Cheney is not alone. There are many Republicans like her who know their party is going dangerously off the rails, endorsing violence as a means to stay in power. But most of them, unlike Cheney, are staying quiet. And that’s terrifying. https://t.co/fe0wmK8FlV",ChrisMurphyCT
62,2022-02-05 14:45:05+00:00,1489973356237578244,"There is nothing about the last four years that tells us America or the world is safer with no nuclear deal between the U.S. and Iran.

Once Trump ended the deal, Iran began shooting at our troops, sped up nuclear research, and increased support for dangerous regional proxies.",ChrisMurphyCT
63,2022-02-05 01:12:04+00:00,1489768756599566336,Whoa. https://t.co/LIekCZN3Po,ChrisMurphyCT
64,2022-02-05 01:07:16+00:00,1489767549189373953,This would be a good time for Republicans who don’t believe that beating the living hell out of cops is “legitimate political discourse” to step up and say so. https://t.co/BrWqTQjUdM,ChrisMurphyCT
65,2022-02-05 00:50:29+00:00,1489763323507843073,"Awesome visit to Bro’s Dough Pizza on New Britain Ave in Hartford today. Walden (who also coaches bb at Bulkeley High) and his team do a great job. 

Also great to catch up w two fantastic Hartford community leaders, Hyacinth Yennie and Raquel Calderon! https://t.co/lj7WWc6IGK",ChrisMurphyCT
66,2022-02-04 22:44:34+00:00,1489731636065415168,The numbers just don’t lie. We’ve never had a better jobs President than Middle Class Joe. https://t.co/GGzHEIf0gu,ChrisMurphyCT
67,2022-02-04 22:27:53+00:00,1489727438657622018,"When the Iran deal was in place, Iranian proxies in Iraq weren’t shooting at U.S. troops. In fact, for a while they were fighting side by side against ISIS.

As soon as we left the deal, the rockets started. Our soldiers were targets. One narrowly missed killing 100 of our guys.",ChrisMurphyCT
68,2022-02-04 22:24:03+00:00,1489726472264859648,"The only upside of Trump’s disastrous “maximum pressure” Iran policy was that it definitively proved that unilateral sanctions make things worse, not better. 

Iran got stronger and their behavior got more dangerous after we left the deal.",ChrisMurphyCT
69,2022-02-04 19:07:19+00:00,1489676963598028809,Who are these “American proponents of abandoning the Persian Gulf” I keep hearing about? https://t.co/0AoQoLPMHo,ChrisMurphyCT
70,2022-02-04 18:43:25+00:00,1489670949637181446,Came to the Connecticut Transit headquarters in Hartford today to say thank you to all the frontline workers and to announce $322 million in #AmericanRescuePlan funding to keep drivers and mechanics employed through the pandemic. https://t.co/EUNwVZU6hj,ChrisMurphyCT
71,2022-02-04 18:07:38+00:00,1489661944466399237,"Good piece by @joshrogin on Tunisia. 

In it, I express my belief that it’s time for America to take a firmer line on the dangerous disappearance of democracy there. 

I was in Tunis last fall and had a long meeting with President Saied. https://t.co/NpSPHz4CXT",ChrisMurphyCT
72,2022-02-04 17:57:30+00:00,1489659391041314820,Took a tour this morning of the Swift Factory in the north end of Hartford. Thanks to funding from the #AmericanRescuePlan this space will soon be a Hartford Library space for youth programming and adult job training. https://t.co/PVVHTHLV7j,ChrisMurphyCT
73,2022-02-04 15:49:43+00:00,1489627235518664704,"How far can I rise?
Through the roof, to the skies
Let's go https://t.co/E70oxgoE2d",ChrisMurphyCT
74,2022-02-03 23:50:54+00:00,1489385941894635524,@nahaltoosi We should probably do that. But we should also have a conversation about the difference between terrorist acts and war crimes.,ChrisMurphyCT
75,2022-02-03 22:19:09+00:00,1489362853052272652,"“Designating the Houthis as a terrorist organization” 

sounds better than 

“an American blockade of food imports to Yemen to intentionally cause mass civilian starvation”. 

But FYI under U.S. law they are the same thing.",ChrisMurphyCT
76,2022-02-03 21:44:50+00:00,1489354217206734851,Listen it’s just not a great idea to say that critics of national security policy are siding with the enemy. Engage on the policy argument instead.,ChrisMurphyCT
77,2022-02-03 21:40:01+00:00,1489353002691485704,Thanks @POTUS. https://t.co/bO8s8bRyGw,ChrisMurphyCT
78,2022-02-03 03:40:46+00:00,1489081400015966208,The NFL seems in the process of disappearing Brian Flores. Just pretending like he and the things he says don’t exist. Which is a pretty cruel way of proving his basic complaint true. https://t.co/rYcywuLkuV,ChrisMurphyCT
79,2022-02-02 23:03:45+00:00,1489011685725777921,Can confirm. https://t.co/hxh63XIlvL,ChrisMurphyCT
80,2022-02-02 20:36:38+00:00,1488974665716432898,"Tune in as @OxfamAmerica's @ScottTPaul, @hrw's @Afrahnasser, and I discuss the humanitarian crisis in Yemen – and why re-designating the Houthis as a foreign terrorist organization would set things back. https://t.co/Pqul9alb8I",ChrisMurphyCT
81,2022-02-02 19:52:12+00:00,1488963483383250945,I will be live with @OxfamAmerica's @ScottTPaul and @hrw's @Afrahnasser to discuss this devastating conflict and how re-designating the Houthis as a foreign terrorist organization would only make things worse. https://t.co/v8sE2SUdSq,ChrisMurphyCT
82,2022-02-02 13:15:11+00:00,1488863569617817606,"Quite honestly, it doesn't matter to America whether Ukraine wants to ally itself with Russia or Europe/America. All that matters is that the Ukrainian people get to make that choice for themselves, and not have it dictated to them by force. That's our interest.",ChrisMurphyCT
83,2022-02-02 13:11:36+00:00,1488862668404441094,"We are averaging more than one mass shooting a day in 2022. Two school shootings just yesterday.

Stop pretending this is bad luck or some inevitable feature of living in America. We choose this carnage. And we can change our laws to choose something different. https://t.co/aM9CplyvTB",ChrisMurphyCT
84,2022-02-02 12:26:34+00:00,1488851337127337984,Morning everybody! I will be on @Morning_Joe on @MSNBC in a few minutes to talk about the path forward on the crisis in Ukraine.,ChrisMurphyCT
85,2022-02-01 18:48:19+00:00,1488585018167418881,"I’m always amazed at the statistics on how effective universal gun backgrounds checks are. 

In states that do a check on every sale, 43% fewer women are shot and killed by their partner then in states with big loopholes.",ChrisMurphyCT
86,2022-02-01 15:16:45+00:00,1488531776192618504,"Last year, my legislation to cut down on the outsourcing of U.S. defense manufacturing passed the House and Senate, and was signed by the President. And it all started with a visit to a small manufacturer in Torrington. Here's the story. https://t.co/fAmscNBQtj",ChrisMurphyCT
87,2022-02-01 15:13:50+00:00,1488531039375007744,"The United States got nothing from Trump's ""maximum pressure"" sanctions on Iran. In fact, things got worse. More attacks on U.S. forces. Bigger nuclear program.

We should be ready to release those sanctions in exchange for Iran coming back into compliance with the deal.",ChrisMurphyCT
88,2022-02-01 13:21:37+00:00,1488502800019562503,"I’m case anyone is looking for a new castle, this one just came on the market in eastern Connecticut for $60M. 
https://t.co/5k5VOIvlbl https://t.co/eeFu0lhuCg",ChrisMurphyCT
89,2022-02-01 13:13:07+00:00,1488500663726268416,I’ve reviewed the U.S. proposal. It’s substantive and fair. A basis for real further negotiations. Russia should commit to sit down and talking this out. https://t.co/hJnLjhuAMz,ChrisMurphyCT
90,2022-02-01 04:03:44+00:00,1488362406686433280,"62% of Division 1 football players are athletes of color.

83% of their coaches are white.

Something stinks in big time college sports and it needs to be fixed.
 https://t.co/LX2bfvIAha",ChrisMurphyCT
91,2022-01-31 20:14:12+00:00,1488244244607381505,"My thoughts are with the Songs today. Their activism to #KeepKidsSafe is nothing short of heroic.

We won't rest until we pass Ethan's Law. https://t.co/o29qrEGSu3",ChrisMurphyCT
92,2022-01-31 17:10:35+00:00,1488198033770749952,Appearing on @mitchellreports on @MSNBC in a minute to talk about the the Ukraine crisis and the deal coming together in the Senate on Russia sanctions.,ChrisMurphyCT
93,2022-01-31 02:55:43+00:00,1487982900867911680,"Great to share dinner tonight with Sheikh Tamim bin Hamad Al Thani, the Emir of Qatar. Qatar has been an invaluable ally of the United States and his meeting this week @POTUS will help deepen our partnership.",ChrisMurphyCT
94,2022-01-29 23:26:04+00:00,1487567752323899398,"Really, when it comes down to it, all that matters when comparing the truly great, historical quarterbacks, is how they fared head in the head in the big games. And truthfully, according that that telling standard, Tom Brady doesn't hold a candle to Eli Manning.",ChrisMurphyCT
95,2022-01-29 16:01:42+00:00,1487455922712686599,Be careful out there today. Stay home and stay safe. https://t.co/4iyQiuxi59,ChrisMurphyCT
96,2022-01-29 14:23:03+00:00,1487431096052723715,This is a fun snowy morning watch. https://t.co/FemCQMhmAb,ChrisMurphyCT
97,2022-01-29 03:12:51+00:00,1487262436273147905,"How are we being ""played""? Here the Lebanon minister simply says he's friends with our ambassador. That's bad?

On the gas deal, it's a good deal bc it helps Lebanon, hurts Hezbollah, and likely doesn't require a Syria sanctions waiver. We must assure Lebanon does not collapse. https://t.co/YWvVRskMN3",ChrisMurphyCT
98,2022-01-28 16:28:11+00:00,1487100200288194563,"This was the right move, and one that I have been pushing the Administration to make. America needs to put its money where its mouth is on human rights in Egypt. https://t.co/ii1rpvi2Jk",ChrisMurphyCT
