,Datetime,Tweet Id,Text,Username
99,2022-01-28 00:25:09+00:00,1486857844389564418,"In the middle of this cold spell, I met today in New Haven with the folks who run the heating and fuel assistance programs in Connecticut. Thanks to the #AmericanRescuePlan there more help than ever this year for people who can’t afford to keep the heat on. https://t.co/BQjSBgrZJb",ChrisMurphyCT
100,2022-01-27 18:37:17+00:00,1486770300150820868,"Picked a 20 degree morning to go out with the crew of the Bollard, a U.S. Coast Guard ice breaker, to break ice on the Connecticut River. So grateful to the Coast Guard for what they do to keep Connecticut’s waters navigable. https://t.co/SS7ytKXngb",ChrisMurphyCT
101,2022-01-27 14:33:20+00:00,1486708911772160002,This is unequivocal and important. https://t.co/9lShSPk8yn,ChrisMurphyCT
102,2022-01-27 14:04:15+00:00,1486701590169935873,Today is #HolocaustRemembranceDay but every single day we must pay tribute to those who perished through our current actions and deeds. Standing up for human rights and against dangerous demagoguery is the key to making sure that this horror never happens again. https://t.co/35QaO3lhVb,ChrisMurphyCT
103,2022-01-27 14:00:08+00:00,1486700556148170753,The Biden economy is on fire. Fastest growth since 1984. https://t.co/xrZnEwcHY8,ChrisMurphyCT
104,2022-01-27 03:49:56+00:00,1486546991735787531,"The two big hits in the 2004 postseason get deservedly looped in Ortiz highlight reels. But if you rewatch every game of the playoffs that year (and I have) it's just incredible how many big hits he had. At almost every pivotal moment, Ortiz picked up the team by its bootstraps. https://t.co/n0ZOzj05by",ChrisMurphyCT
105,2022-01-27 03:46:56+00:00,1486546236375187457,"Listen, it's hard to negotiate with Putin when his complaint - that the West wants to invade Russia - is complete fantasy. The ""negotiation"" becomes a solution searching in the pitch dark for a problem.",ChrisMurphyCT
106,2022-01-27 01:20:00+00:00,1486509261593223170,True story! https://t.co/LZOtJFnDCH,ChrisMurphyCT
107,2022-01-26 21:26:43+00:00,1486450551302852610,"I was proud to recommend Vanessa Avery to the White House. She is an outstanding public servant, a fighter for justice, and will make a great leader of our U.S. Attorneys office. https://t.co/n6fO8jbpuf",ChrisMurphyCT
108,2022-01-26 21:22:05+00:00,1486449385726689283,"I met today in Trumbull with Connecticut grocers to talk about the supply chain crunch. Omicron is the primary culprit, but there just aren’t enough people going into supply chain jobs right now. We need to fix this, starting with better wages and more legal immigration. https://t.co/mM96VKzEQJ",ChrisMurphyCT
109,2022-01-26 18:31:16+00:00,1486406399299043330,Stopped into deliver some food to the workers at Norwalk Hospital today. Also listened to what they need from Congress right now. I’m so grateful for our frontline health workforce. https://t.co/0dBg4sIbtZ,ChrisMurphyCT
110,2022-01-26 17:11:04+00:00,1486386215343599623,"4/ We also leaned that the testing turnaround time is 2-3 days. For a packed prison, this is too long. Why hasn’t the BOP invested in quicker testing systems to better manage the populations?

So many questions that need to answered.",ChrisMurphyCT
111,2022-01-26 17:11:03+00:00,1486386214060052486,"3/ From what we gathered, around 40% of inmates are in either isolation or quarantine. Plus, the facility is badly understaffed. This poses a major risk to both inmates and staff and it must be addressed.",ChrisMurphyCT
112,2022-01-26 17:11:03+00:00,1486386212944363520,"2/ My impression is the decision to limit our access came from well above the warden. She is managing the best she can. 

DOJ and the Bureau of Prisons needs to fix this and assure that policymakers can view conditions, especially during crisis moments like this.",ChrisMurphyCT
113,2022-01-26 17:11:03+00:00,1486386211967184906,"1/ This morning Senator Blumenthal and I went to view conditions at Danbury Federal Prison, where there has been a massive COVID outbreak. 

We were denied access to the women’s facility and had to fight to get into a men’s unit. 

This is unacceptable.",ChrisMurphyCT
114,2022-01-26 03:27:57+00:00,1486179070836625413,This is a swingy district in Stamford. A big win for Hubert (get to know him - a rising star) and the Stamford Dems. https://t.co/LbFhcLS03i,ChrisMurphyCT
115,2022-01-25 22:47:57+00:00,1486108606542106630,Paul is a super decent guy who cares deeply about the shoreline. Loved working with him and I wish him well on his next chapter. https://t.co/ONoo1MANuB,ChrisMurphyCT
116,2022-01-25 22:45:04+00:00,1486107882143768582,"Great visit to Torrington this afternoon. Went to Charlotte Hungerford Hospital to talk about the stresses on frontline health workers and the need to strengthen the health workforce pipeline. 

Then I spent some time catching up with Mayor Carbone and Representative Cook. https://t.co/Ar2exLd5il",ChrisMurphyCT
117,2022-01-25 22:41:24+00:00,1486106958633578496,I spent some time today at the School for Young Children in West Hartford to talk about the child care staffing shortage and the need to pass legislation making child care more affordable. https://t.co/nnmJ3WSfFn,ChrisMurphyCT
118,2022-01-25 22:33:02+00:00,1486104853898276867,Excited for this. https://t.co/NZQI7QC6ZQ,ChrisMurphyCT
119,2022-01-25 16:35:11+00:00,1486014799217635338,"The Biden Administration held back military aid to Egypt pending fulfillment of a list of human rights conditions. 

It’s time to do the right thing and reprogram the aid if the conditions have not been fully met. https://t.co/VaZJSdr4QC",ChrisMurphyCT
120,2022-01-25 16:28:11+00:00,1486013035718352899,"The Ukrainian army is ready to fight, and America should do everything we can to help them. 

At the same time, there is a practical limit to the kind of technology we can transfer. There are some weapons and systems that they can’t learn in weeks or months.",ChrisMurphyCT
121,2022-01-25 16:11:30+00:00,1486008836708356097,"But we all understand the complexity of integrated air defense systems, right? The kind that would be effective in shooting down Russian missiles or planes? You can’t just ship that to the Ukrainian army and turn it on. https://t.co/Mdw6bRNiJb",ChrisMurphyCT
122,2022-01-25 03:39:09+00:00,1485819504617742339,Amazing. https://t.co/ynxtD881pv,ChrisMurphyCT
123,2022-01-25 03:17:20+00:00,1485814014919774209,"More guns don't save lives. Why do we know this? Because the data is crystal clear.

For every 1% increase in gun ownership in a community, a 1% increase in gun deaths comes with it.
https://t.co/auoi2ctmMv",ChrisMurphyCT
124,2022-01-25 03:09:03+00:00,1485811930321334278,"Let's stop pretending we don't know what to do.

In states with universal background checks, the firearm mortality rate is 35% lower than in states without universal background checks. Lives are saved in states that do a better job controlling the flow of illegal guns. https://t.co/gCMUbemlwL",ChrisMurphyCT
125,2022-01-25 02:21:16+00:00,1485799905562181632,This is good. https://t.co/GYYJPy46Dp,ChrisMurphyCT
126,2022-01-25 02:20:40+00:00,1485799753677946883,"With millions in Afghanistan on the brink of famine, this humanitarian crisis could kill more people than the past 20 years of war there.

I am recommending we find ways to send humanitarian aid, going around the Taliban. It's hard but not impossible.
https://t.co/f504ciKzq2",ChrisMurphyCT
127,2022-01-24 20:52:38+00:00,1485717202217189379,I’m still trying to figure if what I watched last night was the greatest game ever or just the worst defensive performance ever. https://t.co/QAQiRkvhOp,ChrisMurphyCT
128,2022-01-24 20:23:59+00:00,1485709989952069632,"Huge congratulations to @SaxeMS on being selected one of the winners of @NASA’s TechRise contest. Such a cool opportunity. NASA will actually test their experiment in-flight, either on a suborbital rocket or high-altitude balloon. https://t.co/lbvVKa09oV",ChrisMurphyCT
129,2022-01-24 16:21:22+00:00,1485648934303322120,⬇️⬇️⬇️ https://t.co/Bom6ySK3oK,ChrisMurphyCT
130,2022-01-24 13:20:36+00:00,1485603441892376577,"On Friday I visited @CCATInc in East Hartford. Congress is finally realizing that we need an industrial policy, linking the public and private sectors together, in order to compete w China. That’s what CCAT has been doing for years. I learned a lot during my visit. https://t.co/73IYstQAKx",ChrisMurphyCT
131,2022-01-24 13:13:58+00:00,1485601774459367429,"Listen, not all Republicans think things like this, but many do. And if the Gingrich/Taylor Greene wing of the party takes over (if they already haven't), then our democracy might be gone. https://t.co/h17pajVBzp",ChrisMurphyCT
132,2022-01-24 13:10:48+00:00,1485600975775797256,"A reminder that prior the this shipment, the U.S. had already sent $2 billion of military aid into Ukraine, and has had troops there training Ukrainian forces for almost a decade.

We can and should do more, but no country has done more to help Ukraine defend itself than the U.S. https://t.co/RuOXGm8q1Q",ChrisMurphyCT
133,2022-01-24 12:58:32+00:00,1485597890693275649,"Listen, these guys know better because people have begged them to stop doing this over and over. It’s not some series of random slip ups. 

But they keep belittling and diminishing the Holocaust by comparing it to vaccines. https://t.co/6KQxoiOPqo",ChrisMurphyCT
134,2022-01-23 03:36:11+00:00,1485093979251163136,"Trump’s withdrawal from the JCPOA, a decision opposed by his Secretary of State and Secretary of Defense, will go down as one of the dumbest, most dangerous foreign policy decisions of the last fifty years. https://t.co/jo6qW206gn",ChrisMurphyCT
135,2022-01-22 22:07:17+00:00,1485011210936504321,"When evaluating Ukraine/Russia policy options, ask - does it divide or unite NATO? I’m not saying there aren’t times when the U.S. must act unilaterally, but Putin’s top goal is to destroy NATO, and he’s always seen his actions in Ukraine as a means toward his most important end. https://t.co/CjIxD8zYwA",ChrisMurphyCT
136,2022-01-22 02:25:16+00:00,1484713745356136448,These strikes aren’t proportional. They aren’t legal. The Saudi coalition needs to end this offensive now.  https://t.co/md5hw4GLrP,ChrisMurphyCT
137,2022-01-21 17:37:12+00:00,1484580854206763009,"This is my first try @brianschatz. I think I’m a natural. 

⬜🟨⬜🟨⬜
🟩🟩⬜⬜⬜
🟩🟩⬜⬜🟩
🟩🟩🟩🟩🟩 https://t.co/dv84PVyMlz",ChrisMurphyCT
138,2022-01-21 17:27:57+00:00,1484578528150626308,"Thanks to @Matt_Blumenthal and @JillianG_CT for organizing today’s press conference to show Connecticut’s support for Roe v. Wade and the right to free and safe abortion. 

Also, great to see two generations of Blumenthals fighting for choice! https://t.co/v39x5s339O",ChrisMurphyCT
139,2022-01-21 17:16:41+00:00,1484575691312144384,My heart is still breaking for the Sport and Medical Sciences Academy family for their loss last week. I went there today to learn more about how we can keep kids away from poisonous drugs like fentanyl. I learned a lot. https://t.co/MDuM6GSRmb,ChrisMurphyCT
140,2022-01-21 00:46:26+00:00,1484326485238247434,"Whenever I travel overseas, on the plane back I write a behind-the-scenes account of the trip. My way to try to prompt a candid conversation about the importance of smart national security policy. 

Here’s my report from Ukraine.  https://t.co/1KJ0JlpHfg",ChrisMurphyCT
141,2022-01-20 19:23:10+00:00,1484245133851873280,"When U.S. drone strikes kill civilians abroad, it’s both a moral failure and a national security liability.

Senator Warren and I got our colleagues together and sent a letter to President Biden with a simple message: we must do better. https://t.co/1FZGuuXr4U",ChrisMurphyCT
142,2022-01-20 19:08:05+00:00,1484241338824642560,"""11 senators and 39 members of the House, led by Senators Elizabeth Warren and Christopher S. Murphy, cited the botched Kabul drone strike as “emblematic of this systemic failure that has persisted across decades and administrations.”
https://t.co/1nItS30Ch7",ChrisMurphyCT
143,2022-01-20 17:11:43+00:00,1484212055347548163,"Five years ago today. My then 5 year old getting ready for the women's march, with his bin of Transformers close by. https://t.co/dpB7HpkfFF",ChrisMurphyCT
144,2022-01-20 16:35:29+00:00,1484202935219367943,"This is why we care so much about the #FreedomtoVoteAct. 

The mainstream of the Republican Party doesn’t think a Democrat can ever legitimately win an election and is making sure it will never happen in key races. 

This would be an end to American democracy. https://t.co/JWDyIUtXvk",ChrisMurphyCT
145,2022-01-20 13:51:53+00:00,1484161762408779777,"Russia’s short term goal is to get Ukraine back into its orbit.

Russia’s long term goal is to smash NATO.

Biden understands that Putin is using the short term goal as a wedge to achieve the long term goal.

That’s why we must get NATO unified on Ukraine policy.",ChrisMurphyCT
146,2022-01-20 03:51:56+00:00,1484010782388105219,"""Our democracy is a tiny, fragile port in a raging storm, and none of us should be surprised that once in a while, some Americans, drawn to the old system of control by the strong and powerful, decide it’s time to give up and submit to the battering winds."" https://t.co/nTsBMq97GP",ChrisMurphyCT
147,2022-01-20 03:49:24+00:00,1484010143666819079,Please check this out tomorrow. https://t.co/TFNYZl1S0g,ChrisMurphyCT
148,2022-01-20 00:41:58+00:00,1483962976465993729,Joining @JoyAnnReid on @thereidout in a few minutes to talk Ukraine and voting rights. Big day in the Senate.,ChrisMurphyCT
149,2022-01-19 23:33:19+00:00,1483945697657470977,Our democracy is in peril. It just is. Today’s vote is one of the most important I will cast as a Senator. https://t.co/z2SIcabepZ,ChrisMurphyCT
150,2022-01-19 20:16:01+00:00,1483896046786916358,"Republican Senators keep reciting the part of the Constitution that says states set voting rules

but they stop reading the clause halfway through so they don’t have to say the second half:

“but the Congress may at any time by Law make or alter such Regulations”.

Just amazing.",ChrisMurphyCT
151,2022-01-19 16:10:15+00:00,1483834197378744325,"Just finished a meeting with @POTUS on our trip to Ukraine. I conveyed to him my impression that the Ukrainian people are ready to fight, but they will need clear signals that the U.S. is committed to the long fight for Ukrainian sovereignty. @POTUS gets it.",ChrisMurphyCT
152,2022-01-19 04:26:32+00:00,1483657100261826560,"They are telling you - proudly and openly - what they plan to do.

""The vote counter is more important than the candidate.""

Trump Republicans don't plan on winning the election. They plan on installing their people in power whether they win or lose.

Pass the #FreedomToVoteAct. https://t.co/MfSfz11n3Z",ChrisMurphyCT
153,2022-01-19 01:01:17+00:00,1483605449161248775,I will be on @andersoncooper @AC360 at 8:15 tonight to talk about my recent trip to Ukraine and the path forward on protecting voting rights. Tune in.,ChrisMurphyCT
154,2022-01-18 21:01:02+00:00,1483544987069464590,"Wheels down from 24 hours in Ukraine. If Putin thinks he’s marching to Kiev without a bloody, perhaps never ending fight, he has greatly underestimated the Ukrainian people and is getting terrible advice. https://t.co/i8yiOHMU8I",ChrisMurphyCT
155,2022-01-18 06:05:49+00:00,1483319699618287618,Wheels up from Ukraine. Our big bipartisan delegation (pictured here w President Zelensky) returns committed to finding a path forward to keep both parties together in support of Ukraine’s sovereignty. https://t.co/vBEIvY1WAn,ChrisMurphyCT
156,2022-01-17 20:57:19+00:00,1483181663639199745,I said it’s my 7th trip to Russia. Of course I meant Ukraine!,ChrisMurphyCT
157,2022-01-17 20:53:17+00:00,1483180650630946818,A beautiful Kiev snow shower as we enter the Ambassador’s residence for a working dinner with the Ukrainian Defense Minister and his team. https://t.co/Dw4lFfCy8O,ChrisMurphyCT
158,2022-01-17 20:26:10+00:00,1483173824166342657,Speaking with the Ukrainian press after our meeting with President Zelensky. We made clear to Zelensky that the United States Congress will give President Biden the authority he needs to build a set of massive deterrent sanctions to dissuade Russia from further invading Ukraine. https://t.co/ra6TQsEsAB,ChrisMurphyCT
159,2022-01-17 18:14:44+00:00,1483140747457142789,@komadovsky Maybe that too.,ChrisMurphyCT
160,2022-01-17 18:12:51+00:00,1483140273219715078,Just got on the bus to head to our meeting with President Zelensky. https://t.co/6tiSzQzleX,ChrisMurphyCT
161,2022-01-17 14:32:46+00:00,1483084886818889728,We just finished a meeting w Interior Minister Moanastyrskyy in Kiev to talk about the preparations for civilian defense in the case of a Russian invasion and how the U.S. can help. https://t.co/ickkvU4K9Y,ChrisMurphyCT
162,2022-01-17 13:12:11+00:00,1483064609653280773,A big part of this bipartisan trip to Ukraine is public diplomacy - speaking out through the press about our commitment to Ukraine. We did a joint press briefing and then split up to do a dozen one-on-one TV interviews. https://t.co/A7iLQagByY,ChrisMurphyCT
163,2022-01-17 13:07:41+00:00,1483063476637646855,We are told it’s likely not coincidental that the big rally protesting the charges recently brought against former President Poroshenko is outside our Kiev hotel. Trying to get the attention of the U.S. (Poroshenko is a big supporter Ukraine’s integration with the west). https://t.co/6R6t5xd8fI,ChrisMurphyCT
164,2022-01-17 09:53:22+00:00,1483014575662505987,"After an hour classified briefing at the U.S. embassy, our delegation heads to the Foreign Ministry to meet with @DmytroKuleba and his team to discuss how Congress can support Ukraine in the case of a further Russian invasion. https://t.co/99b4m2yg81",ChrisMurphyCT
165,2022-01-17 08:38:30+00:00,1482995734928633858,Wheels down in Ukraine. Here with a big Senate delegation -  @SenatorShaheen @senrobportman @SenatorWicker @SenAmyKlobuchar @SenBlumenthal @SenKevinCramer. Important to show bipartisan U.S. support for Ukraine in the face of Russian aggression.,ChrisMurphyCT
166,2022-01-15 15:07:43+00:00,1482368906518011911,"I was in Tunisia last summer, and I’m very troubled by the brutal scenes from yesterday. 

Tunisians fought hard to secure their democratic rights 11 years ago, and the authorities need to protect and uphold those rights. https://t.co/QCMr2itLwO",ChrisMurphyCT
167,2022-01-15 14:56:59+00:00,1482366206388670468,Not good. https://t.co/KlBnoYOTA3,ChrisMurphyCT
168,2022-01-15 14:48:56+00:00,1482364179642257412,"Connecticut has some of the best chili dogs in the country. Someday I will do a list. 

Yesterday @GovNedLamont @SenBlumenthal and I had lunch at one of the most famous spots - Augie and Ray’s in East Hartford. You have to come try their famous chili sauce. https://t.co/UainzUMWsF",ChrisMurphyCT
169,2022-01-14 19:03:02+00:00,1482065741604081671,"Nobody works harder than John. Nobody cares more about the Hartford region than John. 

So proud to have him as my mentor and colleague. Glad he’s all in for another term. https://t.co/liDpL5g4z1",ChrisMurphyCT
170,2022-01-14 19:01:07+00:00,1482065257715707912,"It was cold out there today, but I was in East Hartford w/ @GovNedLamont @SenBlumenthal and @RepJohnLarson earlier to announce that a half a billion dollars is coming to Connecticut from the Bipartisan Infrastructure Bill to help us rebuild our old, atrophying bridges. Big deal! https://t.co/9D41jZe1VL",ChrisMurphyCT
171,2022-01-14 16:02:03+00:00,1482020193232695296,"This is a really important dynamic to understand. The attacks on democracy, the attacks on Fauci…they all happen in part because of the $$. https://t.co/Chmvjk28HB",ChrisMurphyCT
172,2022-01-13 15:45:48+00:00,1481653715857653760,"Heading to the Senate floor right now to join @SenatorShaheen to explain why the Cruz Nordstream bill will make invasion of Ukraine more, not less, likely. Vote later today.",ChrisMurphyCT
173,2022-01-13 03:56:05+00:00,1481475109256847363,"Your nightly reminder that for the first 1459 days of Trump's presidency, he did virtually nothing to stop Russia's Nordstream pipeline. And it got 95% built. 

Then on his last day in office - January 19th - he sanctioned one ship and the company that owns the ship.

True story.",ChrisMurphyCT
174,2022-01-13 03:40:54+00:00,1481471291664310277,👀 https://t.co/zOYnH7sdJy,ChrisMurphyCT
175,2022-01-13 03:22:06+00:00,1481466557947600896,Thanks to my good friend @AymanHsafadi for stopping by today to discuss security in the Middle East. Always enjoy his wise counsel. https://t.co/PLmN1yVfci,ChrisMurphyCT
176,2022-01-13 01:51:28+00:00,1481443751755227140,"Today I went to the Senate floor to make the case why our Afghanistan policy must shift to avert a nightmarish humanitarian disaster there. 

The Afghan economy is collapsing, and we can save lives without unduly empowering the Taliban. https://t.co/lyGbpctzjO",ChrisMurphyCT
177,2022-01-12 23:38:15+00:00,1481410226062508034,About to talk with @wolfblitzer on @cnn about the upcoming debate on Russia and voting rights in the Senate.,ChrisMurphyCT
178,2022-01-12 19:32:30+00:00,1481348381486112769,"I'm LIVE with Dr. Juan Salazar, Physician-in-Chief at @ctchildrens, to discuss how COVID-19 is affecting children – and get his advice for how we can protect our kids. Drop your questions below. https://t.co/zWiQuWaXVF",ChrisMurphyCT
179,2022-01-12 19:21:37+00:00,1481345639392976902,"An important warning Nuland makes here is that Russia is planning ""false flag"" ops. In other words, they are going to try to create the pretext for an invasion, like inventing an attack on Russian troops that didn't happen. https://t.co/X9C9NdKt77",ChrisMurphyCT
180,2022-01-12 15:59:09+00:00,1481294689152159753,"As a father of two school age kids, I know how hard the pandemic has been on our children. Join me for this important discussion at 2:30 today. https://t.co/Ra7Ejg7KRs",ChrisMurphyCT
181,2022-01-12 15:16:57+00:00,1481284069212184580,"So crazy. 

Loved Jon Lester. Legend. He should have spent his whole career with the Sox. Congrats on his retirement. https://t.co/GHyYTk34Xx",ChrisMurphyCT
182,2022-01-12 15:08:10+00:00,1481281858298163201,"It's SOOOO easy to get your vaccination or your booster. 

Remember, omicron acts very differently on people who are vaccinated. In the hospitals I visit, 90% of the people who are really sick are unvaccinated or not boosted. https://t.co/Rj6s2DjEpN",ChrisMurphyCT
183,2022-01-12 15:06:37+00:00,1481281467208675330,"I'm glad Egypt finally released a number of political prisoners, but the overall trendlines for human rights in Egypt aren't getting better.

How will we know the scope of Egypt's human rights record if the government obliterates the human rights NGOs that document it? https://t.co/CUUEnIlJWh",ChrisMurphyCT
184,2022-01-12 02:04:25+00:00,1481084618820526081,"Let's be clear, the Cruz bill we are debating this week has nothing to do with stopping a Russian invasion of Ukraine.

In fact, it makes it more likely because the bill's chief impact is to break up transatlantic unity right at the moment that unity is key to deterring Russia.",ChrisMurphyCT
185,2022-01-12 00:47:14+00:00,1481065197876002831,😎 https://t.co/NfiIjRi8O9,ChrisMurphyCT
186,2022-01-11 19:18:34+00:00,1480982486456930307,"Yes, @jmartNYT, in fact @LoriTrahanMA and I have a bill to guarantee NIL rights permanently for college athletes. 

But Saban is looking for a bill that restricts endorsement deals and probably one that puts the NCAA back in charge, which would be terrible for players. https://t.co/KeRDhig090",ChrisMurphyCT
187,2022-01-11 18:48:31+00:00,1480974922457485313,"Take a moment to watch this. So grateful to @markbardenSHP, @kristinsong3 and all the advocates and survivors who continue to speak out.

We will pass Ethan's Law. We will expand background checks. We will fund community violence intervention programs.

We won't rest until we do. https://t.co/y0NroyUlQt",ChrisMurphyCT
188,2022-01-11 15:25:00+00:00,1480923705727459328,"This is the right call. The Afghan people are starving, and while blame lies with the Taliban, as a moral and just nation we should not stand by and let people die. 

More is necessary, but this is a good step. https://t.co/Z1QfbEaS63",ChrisMurphyCT
189,2022-01-11 02:34:30+00:00,1480729805511344132,"FYI the fight isn’t over “Russia sanctions”. It’s about Trump Republicans’ belief that we should sanction GERMANS. 

And why do that when the new German government just took our side on the pipeline? https://t.co/R7TRJg20Fb",ChrisMurphyCT
190,2022-01-10 23:35:20+00:00,1480684713031389184,5/ Passing the bill would also reward Republicans' year long blockade of State Department nominees and encourage more hostage taking. That's terrible for the U.S. Senate and U.S. security and and extra reason for the Senate to reject the bill this week.,ChrisMurphyCT
191,2022-01-10 23:35:19+00:00,1480684711492128774,"4/ Plus, the bill wouldn't have any impact on the pipeline. Why? 

BECASUE IT'S ALREADY BUILT (95% of it was built when Trump was President btw).

The Cruz bill sanctions can't stop the gas from flowing. But Germany can. So why break with Germany now?",ChrisMurphyCT
192,2022-01-10 23:35:19+00:00,1480684710061817856,"3/ The impact of the Cruz bill would be to divide the U.S. from Germany right at the moment we need Germany to be leading the readying of U.S./Europe sanctions on Russia that will deter them from invading Ukraine.

The bill's passage would be a gift to Russia.",ChrisMurphyCT
