,Datetime,Tweet Id,Text,Username
193,2022-01-10 23:35:18+00:00,1480684708581322761,"2/ The new German government has taken a new position on the pipeline. They have stopped it indefinitely, so why on earth would we pass a stale bill that applies sanctions on Germany for a policy they no longer hold? Makes no sense.",ChrisMurphyCT
194,2022-01-10 23:35:18+00:00,1480684706412834821,"1/ This week, the Senate will vote on @SenTedCruz's Nordstream pipeline bill, which would divide the U.S. from Europe right in the middle of the Ukraine/Russia crisis.

It's consistent with the GOP approach to foreign policy under Biden. They root for failure to hurt Biden.",ChrisMurphyCT
195,2022-01-10 23:11:04+00:00,1480678607047565317,See. Not that hard. https://t.co/Z5R1CHT7dt,ChrisMurphyCT
196,2022-01-09 02:17:35+00:00,1480000770774904834,"Thinking of you today, friend. Nobody in my life is stronger or more courageous than you. We have so many victories ahead of us. https://t.co/k93ieRAK4S https://t.co/zE99qCmS67",ChrisMurphyCT
197,2022-01-09 01:14:29+00:00,1479984892704436225,"Correct. And even with additional U.S. troops being sent after Russia's 2013 Ukraine invasion, we are still at 20% our Cold War troop numbers in Europe. Putin is seeing a threat from U.S. deployments that simply doesn't exist. https://t.co/rJqeZoVXJj",ChrisMurphyCT
198,2022-01-07 21:23:22+00:00,1479564339510185990,Me too. They went up 20 and then all of a sudden the offense stopped running through Tatum and the defense seemed to revolve around giving Fournier as many open 3s as humanly possible. It was bad. https://t.co/SCd17yM6S9,ChrisMurphyCT
199,2022-01-07 21:04:26+00:00,1479559577704312832,I’ve known @MayorEsposito for years. So glad to sit down with him today so we can get on the same page as he begins his new job as Danbury Mayor. Looking forward to working with him and his team. https://t.co/GsCtc3vAAc,ChrisMurphyCT
200,2022-01-07 20:36:13+00:00,1479552476420481024,"Thanks to the team at Danbury Hospital for hosting me today. Their hospital system has 800+ staff out with COVID right now. While the COVID patient surge is real, they only have 3 in ICU care now, which is positive. https://t.co/LPmFRK0C2e",ChrisMurphyCT
201,2022-01-07 15:14:04+00:00,1479471404621996044,"At least 8 inches so far here in Hartford. Thanks to all the crews out there cleaning up. Stay safe today, friends. https://t.co/AgwuN9sWh9",ChrisMurphyCT
202,2022-01-07 14:52:32+00:00,1479465983744036865,The scariest thing about this is it’s now 100% clear that you can’t win the Republican nomination for President if you oppose political violence. https://t.co/gNtZ1jx1OC,ChrisMurphyCT
203,2022-01-07 04:03:11+00:00,1479302571122737155,"My complaint on the headline aside, it’s a good piece by @joshrogin on how our nation’s security is compromised by this blockade on nominees. https://t.co/cZRDTzp5d3",ChrisMurphyCT
204,2022-01-07 03:39:53+00:00,1479296708249071620,I know writers don’t control headlines. But it’s not “congressional dysfunction” that is stalling nominees. It’s two Senate Republicans grinding the nomination process to a halt to advance their presidential candidacies. Headlines should be clear who the actual problem is. https://t.co/cZRDTzp5d3,ChrisMurphyCT
205,2022-01-07 03:34:40+00:00,1479295394723078148,A young man speaking truth to power. https://t.co/Nou2DYjCDB,ChrisMurphyCT
206,2022-01-07 03:30:40+00:00,1479294386903076869,"4/ This moment requires unity of purpose amongst the democracies of the world. Not just the U.S. and Europe, but democracies in Asia, Africa and the rest of the western hemisphere. We must be together in our effort to oppose Russia's attempts to smash international law.",ChrisMurphyCT
207,2022-01-07 03:30:40+00:00,1479294385355427840,"3/ Putin's attempts to rebuild the Soviet empire through troop deployments to Belarus, Ukraine and Kazakhstan will backfire. Just as the Soviet Union eventually collapsed of its own weight and corruption, so will Putin's ambitions.
https://t.co/fk1xxMd49b",ChrisMurphyCT
208,2022-01-07 03:30:39+00:00,1479294383727984648,"2/ Foreign militaries should leave the country immediately, and Kazakh authorities must end these unconscionable attacks on protesters. Kazakh citizens deserve a responsive government that doesn't murder and steal from its own people.",ChrisMurphyCT
209,2022-01-07 03:30:39+00:00,1479294382100598784,"1/ Like he did in Belarus, Putin is once again trying to ride to the rescue of a faltering kleptocrat, this time in Kazakhstan. Putin is extending himself unsustainably thin, and it's a matter of time before he pays a price.
https://t.co/0ByIuavXF0",ChrisMurphyCT
210,2022-01-06 23:46:40+00:00,1479238013683220484,Thank you to everyone who came out tonight in West Hartford for a vigil to remember January 6 and to recommit ourselves to the fight for American democracy. https://t.co/AxHeunMXcG,ChrisMurphyCT
211,2022-01-06 23:43:12+00:00,1479237141725069313,"Thank you, Mr. President. https://t.co/HfR4jBfXAs",ChrisMurphyCT
212,2022-01-06 19:59:34+00:00,1479180864110186497,"“What has driven such a large portion of Americans to this cataclysmic edge — this barren, apocalyptic precipice where facts are non-existent, democracy is secondary to cult, and mob violence is patriotic?” https://t.co/XkebtB32KV",ChrisMurphyCT
213,2022-01-06 19:48:36+00:00,1479178105910661127,"Came to St. Mary’s Hospital in Waterbury today to say thank you to the brave health care workers who are struggling to manage the latest surge.

At St. Mary’s right now, the unvaccinated are:

- 60% of inpatient COVID patients
- 90% of ICU COVID patients 
- 100% of COVID deaths https://t.co/xC3zCZOBeV",ChrisMurphyCT
214,2022-01-06 19:38:11+00:00,1479175483434622985,"Thank you to everyone who worked to keep us safe on January 6th, and to all the staff and workers at the Capitol who have kept showing up day after day despite the threats we face here. You are all patriots. https://t.co/6smDbV1FRs",ChrisMurphyCT
215,2022-01-06 18:21:18+00:00,1479156132769841155,Sorry…Liz not Lynn!,ChrisMurphyCT
216,2022-01-06 18:20:32+00:00,1479155941832548366,I joined @SenBlumenthal @SOTSMerrill @AGWilliamTong at the State Capitol today to talk about the lessons learned since January 6 and the ongoing threats to our democracy. https://t.co/7UYHFK9JZH,ChrisMurphyCT
217,2022-01-06 17:59:43+00:00,1479150703671132162,"At the moment of silence for the Capitol Police officers who died, there were only two Republicans who showed up. 

Rep. Lynn Cheney. And her father. The 80 year old former Vice President. 

An extraordinary image of where this country’s politics are right now. https://t.co/IJ2YS2y2yN",ChrisMurphyCT
218,2022-01-06 16:14:38+00:00,1479124258026627077,"I know some people want to forget this, but the President of the United States was rooting openly for the rioters. https://t.co/vW6HtecWUa",ChrisMurphyCT
219,2022-01-06 14:14:14+00:00,1479093957569171459,"Around 2:30 on Jan 6, a Capitol Police officer with blood running down his face burst into the Senate chamber and frantically announced that we had to evacuate.

Fast.

I will never forget the heroism of those that protected us that day. Thank you @CapitolPolice @DCPoliceDept.",ChrisMurphyCT
220,2022-01-06 14:00:34+00:00,1479090519942864900,"Listen, there are good decent Republicans in the Senate who despise what happened on Jan 6. 

But they are the dying limbs of the tree that will fall during the next slight wind. 

The healthy trunk of the GOP is Trump, Taylor Greene, Boebert.

I wish it weren’t true. But it is.",ChrisMurphyCT
221,2022-01-06 13:27:44+00:00,1479082255247159298,"“Today’s Republican Party believes that beating Joe Biden and other Democrats is more important than preserving democracy. That’s why they are working to clean up their mistakes from 2020, so that next election, the inconvenience of democracy cannot keep them from power.” https://t.co/wLg0QfKPws",ChrisMurphyCT
222,2022-01-06 04:01:11+00:00,1478939678699147266,"In the wake of January 6th 2021, Republican leaders had an opportunity to break with Trump and the dangerous lies he was spreading about the 2020 election. Instead, they chose to keep their mouths shut and let him take over total control of the party.

This is the result. https://t.co/D9hHkPMbb6",ChrisMurphyCT
223,2022-01-06 02:35:35+00:00,1478918137466834944,"Marjorie Taylor Greene, Ted Cruz, Matt Gaetz, etc aren't fringe. They represent the new Republican mainstream, where loyalty to Trump is more important than loyalty to country and preserving power matters more than preserving democracy.",ChrisMurphyCT
224,2022-01-05 22:55:30+00:00,1478862752840101890,Just remember the “lobster claw” is kind of a reverse partisan gerrymander - a district that looks a little funny to make sure it has relatively equal numbers of Republican and Democratic voters. https://t.co/IWYsAChARH,ChrisMurphyCT
225,2022-01-05 17:13:24+00:00,1478776660216492034,Welcome to our post January 6th world. https://t.co/NLAj3VL3kq,ChrisMurphyCT
226,2022-01-05 16:15:49+00:00,1478762168917102599,The Biden economy is on fire. https://t.co/IVi70aqB3T,ChrisMurphyCT
227,2022-01-05 02:28:48+00:00,1478554040594280453,"I wrote a book a few years ago about the roots of American violence. The why and how America became more violent than other countries. And what to do about it.
https://t.co/xnNqPckpeH https://t.co/BpmGWiueGY",ChrisMurphyCT
228,2022-01-05 01:55:14+00:00,1478545595635834882,"It’s like we probably need to just start listening to what they keep saying out loud, right? https://t.co/i5m6DJEWmy",ChrisMurphyCT
229,2022-01-04 00:23:01+00:00,1478159997871742977,"It’s like not a single Republican remembers they changed the rules to get done their top priority - flipping the Supreme Court. 

They could have never ever gotten three ultra-conservative judges through if they didn’t change the rules. https://t.co/LZhTuHPSG3",ChrisMurphyCT
230,2022-01-03 19:19:36+00:00,1478083641330782208,"A small Connecticut manufacturing company was having trouble winning federal contracts. It was because of a loophole in the Buy American law. So I wrote a bill, convinced my colleagues to support it, and got it passed. Here's the short story. https://t.co/SGXtxSL7ju",ChrisMurphyCT
231,2022-01-03 18:11:17+00:00,1478066450527096833,"This is my top recommended read for the new year. The fight to save American democracy is coming. We all need to understand the stakes.
https://t.co/q7HXLEz2de",ChrisMurphyCT
232,2022-01-03 16:54:54+00:00,1478047228933586947,Amazing. https://t.co/mqI8UyBNK9,ChrisMurphyCT
233,2022-01-01 17:30:32+00:00,1477331417822543873,"Like the “consequences” imposed by Trump? 

The “consequences” that caused Iran to start shooting at our troops at will, and restart their shuttered nuclear research program, and supersize their support for anti-American proxies?

You mean “consequences” like that? https://t.co/dI53Q4gFgM",ChrisMurphyCT
234,2021-12-30 19:44:04+00:00,1476640249375866880,"The right's January 6th mythology relies on no one ever seeing the results of the violent mob. Thank you, Staff Sergeant Gonell, for sharing this. https://t.co/7brIIrEqf5",ChrisMurphyCT
235,2021-12-30 19:22:50+00:00,1476634905421430784,"Omicron is not Delta. That doesn't mean we let our guard down. That doesn't mean this winter isn't going to be very difficult. And that certainly doesn't mean vaccinations aren't still the key. But Omicron is not Delta and policy can reflect this.
https://t.co/cK0CtUpsRr",ChrisMurphyCT
236,2021-12-30 18:45:34+00:00,1476625528329281553,I tried to fit into 120 seconds the highlights of what my office accomplished for Connecticut in 2021. Check it out and and RT pls. https://t.co/86N3LzI7QG,ChrisMurphyCT
237,2021-12-30 16:39:45+00:00,1476593864966295553,"Establishment DC Republicans can feign ignorance, but they know what's happening.

State Republicans are removing non-partisan or bi-partisan oversight of vote counting for one reason - to declare Donald Trump the winner of the 2024 election even if he loses.",ChrisMurphyCT
238,2021-12-30 16:24:38+00:00,1476590060376141828,"""Half a million Ukrainians have military experience; 24 percent of respondents in one recent poll said that they would resist Russian occupation 'with a weapon in hand.' Russia might succeed in taking Ukraine, but it is unlikely to hold it.""
https://t.co/nZ4dBPuo8F",ChrisMurphyCT
239,2021-12-30 16:21:19+00:00,1476589223738322952,"This isn't the Ukraine of 1941. Nor is it even the Ukraine of 2010. 

The Maidan massacre and Russian occupation of Crimea/eastern territory has created a resurgence of Ukrainian patriotism that will fuel a deadly counter-insurgency if Russia invades.
https://t.co/xutWooR6i3",ChrisMurphyCT
240,2021-12-29 20:38:38+00:00,1476291590868058130,"The legacy of Trump’s dumpster fire Iran policy:

“The difference between Iran’s reach in 2016 and in 2021 is “simply remarkable,” a senior naval intelligence officer said.

 https://t.co/6W3OYsmL2J",ChrisMurphyCT
241,2021-12-29 20:17:48+00:00,1476286349820968960,"Rand is a smart guy. This tweet wasn’t a goof or mistake. He didn’t take it down when it got lots of attention.

Mainstream national Republicans are now openly advocating for an end to democracy. They don’t support “voting” if “voting” elects anyone that’s not Trump. https://t.co/yVafDQVDlc",ChrisMurphyCT
242,2021-12-29 05:01:32+00:00,1476055764074651648,"7/ Then he hung up. 

He spent the rest of day relentlessly pressuring McConnell agree to my demands for votes on background checks bills. 

By midnight, Reid had succeeded. He got the votes.

The lesson I learned - there's nothing like having Harry Reid in your corner.",ChrisMurphyCT
243,2021-12-29 05:01:32+00:00,1476055762950660096,"6/ ""Chris,"" he said, ""A lot of people TALK about filibustering. A lot of people CALL ME about filibustering. But nobody actually DOES IT.""

""I can't tell you what to do. But what I can tell you is this - if you're going to do this, then stop calling people, and go DO IT.""",ChrisMurphyCT
244,2021-12-29 05:01:32+00:00,1476055761860050948,"5/ Harry didn't like grandstanding, and a filibuster is the ultimate ""look at me"" move. Harry preferred exercising power quietly. Forcefully but quietly. 

But I had no other options, so right before I went to the floor, I called Harry.",ChrisMurphyCT
245,2021-12-29 05:01:31+00:00,1476055760765345795,"4/ And for the next four years, he worked with me to try to advance the cause of anti-gun violence. 

But when I decided to launch a filibuster after the Orlando shooting, I was nervous, because I was going to grind the Senate to a halt. And I hadn't told Harry - my leader.",ChrisMurphyCT
246,2021-12-29 05:01:31+00:00,1476055759590989827,"3/ Harry was old school. His convictions mattered more than his politics. If something was right, he was ready to risk everything.

So after Sandy Hook - he took a big risk. He broke w the NRA and backed a background checks bill the NRA hated. He put it on the floor for a vote.",ChrisMurphyCT
247,2021-12-29 05:01:31+00:00,1476055758429200384,"2/ First, you've got to understand that Harry and the NRA started out as allies. His NRA endorsement was an important calling card for him for a long time.

But as the NRA got more extreme, Harry simply couldn't stomach it. He couldn't stay silent.",ChrisMurphyCT
248,2021-12-29 05:01:30+00:00,1476055756810170370,"I feel so lucky to have served under Harry Reid, and so sad he's gone.

You'll hear a ton of great Harry Reid stories in the next few days, but here's my favorite - my phone call with him in June 2016 to tell him I was about to launch a filibuster on guns.
https://t.co/7tIVY1Va0d",ChrisMurphyCT
249,2021-12-27 21:11:14+00:00,1475575020671967233,When you look up “impossible” in the dictionary. https://t.co/332d7wB7ga,ChrisMurphyCT
250,2021-12-27 00:55:46+00:00,1475269140285902852,HARTFORD COURANT: ‘Buy American’ that Sen. Murphy has pushed for years was tucked into the massive infrastructure bill. Now it’s law. https://t.co/rzdRiG4CaN,ChrisMurphyCT
