,Datetime,Tweet Id,Text,Username
86,2021-08-23 15:00:44+00:00,1429820911776116739,Amy &amp; I are praying for all of those impacted by the devastating floods that occurred over the weekend. My staff &amp; I will be working with the rest of the Tennessee delegation to support federal relief efforts and ensure that necessary resources are provided to the impacted areas. https://t.co/yF1EERUjOq,DesJarlaisTN04
87,2021-08-17 15:38:50+00:00,1427656173361278981,"President Biden has reinstated the release program from Guantanamo Bay prison allowing terrorists to return to their breeding grounds. 

This is an extremely dangerous policy for the safety of the American people and one of the biggest threats to our national security. (2/2)",DesJarlaisTN04
88,2021-08-17 15:38:50+00:00,1427656172044177409,"The Taliban takeover of Afghanistan was orchestrated by prisoners released from GITMO by Obama in 2014 in exchange for dishonorably discharged Army deserter Robert Bergdahl. Some were even seen inside the Afghan presidential palace this weekend. (1/2)
https://t.co/1SXclUPIev",DesJarlaisTN04
89,2021-08-16 22:29:42+00:00,1427397180952879104,"My statement on the Biden administration's disastrous withdrawal from Afghanistan.

https://t.co/kXtuydlRbV",DesJarlaisTN04
90,2021-08-13 16:10:58+00:00,1426214705308315648,"The president and his administration preach lockdowns, mask mandates and other restrictive actions but welcome in covid-positive illegal aliens. 

American taxpayers are tired of footing the bill and want to see an end to this pandemic. It starts with securing the border. (2/2)",DesJarlaisTN04
91,2021-08-13 16:10:57+00:00,1426214703571812361,"The #BidenBorderCrisis is a serious threat to public health. 

In Laredo, Texas 40% of migrants have tested positive for COVID-19. (1/2)
https://t.co/d0Lrn1fHMG",DesJarlaisTN04
92,2021-08-11 17:34:48+00:00,1425511027807035395,"President Biden is pulling all US troops out of Afghanistan on August 31st with no plan to keep terrorist groups like the Taliban under control. 

The US needs a strategic troop withdrawal from Afghanistan. Not an arbitrarily set deadline for the sake of scoring political points. https://t.co/wP6cdpHyBx",DesJarlaisTN04
93,2021-08-06 21:21:51+00:00,1423756226580647942,"Defense Secretary Austin is reportedly planning to implement a coronavirus vaccine mandate for members of the Armed Forces. 

I am strongly opposed to this. 

My full release here ➡️ https://t.co/x4LuVVesWa https://t.co/vHtHUSIEY7",DesJarlaisTN04
94,2021-08-02 17:40:18+00:00,1422250919668891655,"Our hearts go out to the Duncan family during this time. 

Lynn is famous for her firecracker spirit and keeping her husband, four children and nine grandchildren in line. 

I know she will be greatly missed by my good friend and mentor Congressman Duncan. https://t.co/zmMB85yYDP",DesJarlaisTN04
95,2021-07-29 17:21:48+00:00,1420796713040818179,"Yesterday, I had the opportunity to talk media bias &amp; coronavirus vaccination mandates with @JoeDonlonTV on @NewsNationNow, a network free from media bias!

📺 Watch the full clip here ➡️ https://t.co/YcNkqJMpAb https://t.co/cYwTOVXcdX",DesJarlaisTN04
96,2021-07-28 22:23:55+00:00,1420510357341278218,"I’ll be joining @JoeDonlonTV on @NewsNationNow TODAY at 7PM EST/6PM CST. 

📺 You can find your local channel here: https://t.co/rj8810mmSc

Make sure to tune in!",DesJarlaisTN04
97,2021-07-28 13:31:50+00:00,1420376454026641408,"Want to know the real truth about the January 6th committee? 

I joined @CuomoPrimeTime to discuss. 

WATCH ⬇️

 https://t.co/dM0bKgTQKu",DesJarlaisTN04
98,2021-07-26 15:30:45+00:00,1419681604268613637,"I signed on to @RepTenney’s brief because I know that every American has the constitutional right to keep and bear arms. I will always hold those in power accountable and ensure our Constitution is upheld. 

https://t.co/3gmMO1XW62",DesJarlaisTN04
99,2021-07-22 15:49:25+00:00,1418236752360321028,"With labor shortages due to our federal government paying people not to show up to work, it’s tough for employers to hire for open positions. 

It’s long-past time to get Americans back to work and begin to recover from #Bidenflation. https://t.co/7OSJF4njGp",DesJarlaisTN04
100,2021-07-21 18:59:40+00:00,1417922241711513619,Speaker Pelosi will stop at nothing to ensure that leftists control the narrative. Rejecting two GOP picks for the January 6th investigation proves that uncovering the truth is her last priority. This latest stunt is just yet another abuse of her office.,DesJarlaisTN04
101,2021-07-20 14:51:32+00:00,1417497406149644293,"Many moons ago the United States won the space race and proved its ability to lead on innovation by putting the first man on the 🌕! 

In the 52 years since, America has continued to take our exploration of space to new heights. 🚀👩‍🚀 https://t.co/rWgZUVA6aF",DesJarlaisTN04
102,2021-07-17 14:17:55+00:00,1416401783967133711,"Thank you @GovBillLee for leading the way to make Tennessee a top 5 state for business friendliness!

https://t.co/pPZxWd6JOW",DesJarlaisTN04
103,2021-07-15 15:28:38+00:00,1415694806626492417,Secretary Blinken needs a reality check. America is the freest and most fair nation in the world. To ask this of the UN is an embarrassment to our great Nation. (2/2),DesJarlaisTN04
104,2021-07-15 15:28:38+00:00,1415694805527576581,"The Biden administration has the audacity to call for the United Nations to investigate human rights in the United States while refusing to acknowledge that Cubans are fighting back against their own oppressive communist government. (1/2)
https://t.co/TWHWJfky0f",DesJarlaisTN04
105,2021-07-12 20:50:40+00:00,1414688682263683085,Representing the US in the Olympic Games is a great honor and privilege that should not be taken lightly. The hateful anti-American behavior a few athletes have exhibited is unacceptable. I signed on to a letter to the US Olympic &amp; Paralympic Committee to express this  concern. https://t.co/ArGZC86DDu,DesJarlaisTN04
106,2021-07-12 13:55:04+00:00,1414584095561162752,"Over the last six decades of living under the control of a communist regime, Cubans have suffered greatly. 

We as a country must stand with the people of Cuba and ensure that these same socialistic policies are not enacted in the US.

https://t.co/VcttLWTBi4",DesJarlaisTN04
107,2021-07-09 19:24:46+00:00,1413579902683652099,Good. Now let’s do this at the southern border. https://t.co/C9cRZzcKht,DesJarlaisTN04
108,2021-07-09 16:26:10+00:00,1413534955746037760,"I am baffled that our US Air Force Academy cadets are being subjected to this attempted anti-American indoctrination. 

Thankfully, I know that the bright young men &amp; women who answer the call to serve our country will reject #CRT propaganda. https://t.co/bqagpCGJXb",DesJarlaisTN04
109,2021-07-07 15:53:27+00:00,1412801946054975490,"They have not performed as neutral actors deserving of their Section 230 “good faith” protections, and I support efforts to highlight their manipulation of this protection and revoke it. (2/2)",DesJarlaisTN04
110,2021-07-07 15:53:26+00:00,1412801944196988928,There is a need to continue exposing the biased decision making behind what is allowed and what is not allowed on these platforms. (1/2) https://t.co/N73GuDeV5i,DesJarlaisTN04
111,2021-07-04 14:33:51+00:00,1411694753196949507,"Happy 4th of July! 🇺🇸

My very talented sister, Tami, hand painted this beautiful celebration of patriotism on a silo in Sturgis, South Dakota where I grew up. 

We are so blessed to live in the USA. Let us never forget freedom isn’t free! https://t.co/L3OfZck8hi",DesJarlaisTN04
112,2021-06-30 18:13:32+00:00,1410300486692003848,"I am proud to co-sponsor H.R. 4212 to bring our flag code up to date and allow Americans to put their patriotism on full display! In a time where woke-cancel culture is taking over, I want to be sure it’s easier for patriots to show just how much they love their country. 🇺🇸 https://t.co/TQzMYBJwWQ",DesJarlaisTN04
113,2021-06-30 01:00:14+00:00,1410040445992906754,"I voted against another leftist-led initiative to remove an additional batch of historical statues in Congress. 

Attempting to erase our nation’s history is how we end up repeating it. 

We must pay homage to the lessons we learned in the building of our great country.",DesJarlaisTN04
114,2021-06-25 17:23:43+00:00,1408476007833669644,"Don’t let today’s @VP border visit fool you into thinking she takes the crisis seriously. 

She’s spent the last 93 days 👇
-Laughing off a border visit 
-Visiting Guatemala &amp; Mexico
-Visiting SC
Instead of on the ground with law enforcement agents handling the #BidenBorderCrisis",DesJarlaisTN04
115,2021-06-24 20:46:21+00:00,1408164615943602190,Amy and I are sending our thoughts and prayers to the Spiegel family at this time. https://t.co/Dg7EQkpW18,DesJarlaisTN04
116,2021-06-23 20:50:47+00:00,1407803342345097224,"Gen. Milley and Secretary Austin agree with me that No First Use leaves the US without options. NFU would be destabilizing, alienate allies, undermine our extended deterrence guarantees &amp; would have no impact on Russia or China’s calculus. From today’s @HASCRepublicans hearing 👇 https://t.co/gbqfWvvoNH",DesJarlaisTN04
117,2021-06-15 22:18:57+00:00,1404926427238129669,"Texas A&amp;M University Agricultural and Food Policy Center evaluated the STEP Act and the 99.5 Percent Act. 

The findings show an incredibly negative impact on families that own and operate farms and ranches.

🌽🐄 Read the full study here ➡️ https://t.co/1KMs1kroPw (2/2)",DesJarlaisTN04
118,2021-06-15 22:18:56+00:00,1404926425665314816,"The Biden administration’s push to massively increase taxes on local farmers and ranchers will devastate the agriculture community. 

We must stand up to this progressive pandering and protect our local farmers who are the backbone of the American supply chain. (1/2) https://t.co/ZALSTk0JME",DesJarlaisTN04
119,2021-06-15 15:15:17+00:00,1404819810043768840,"I signed @RepRichHudson's letter to the DOJ &amp; ATF that these new directives would make millions of law-abiding citizens, including disabled veterans, criminals overnight. (2/2)",DesJarlaisTN04
120,2021-06-15 15:15:17+00:00,1404819808970067972,Many law-abiding citizens use stabilizing braces for recreational shooting. An attempt to create an overburdensome tax is another back door assault on the #2A. (1/2) https://t.co/NmwUdYF0Hi,DesJarlaisTN04
121,2021-06-15 02:48:54+00:00,1404631975189790724,Happy Flag Day to Old Glory! I am thankful to have the American flag as a symbol that represents all citizens of the United States. https://t.co/xuP6FFWtDg,DesJarlaisTN04
122,2021-06-14 16:21:08+00:00,1404473994846347273,"Thank you for 246 years of service and sacrifice, #USArmy.

I am grateful to all of the the brave men and women who answer the call to defend our great country! https://t.co/z62e2aTIfb",DesJarlaisTN04
123,2021-06-10 19:53:31+00:00,1403077889743069186,"Dangerous and anti-Semitic remarks like these deserve more than just a public finger-wag. 

Democratic leadership needs to remove Rep. Omar from her seat on the House Foreign Affairs Committee. https://t.co/KWg9aME8Uq",DesJarlaisTN04
124,2021-06-09 17:06:30+00:00,1402673468802469889,"Every day Biden shows that his commitment to being “tough on China” was nothing more than campaign propaganda. 

China poses a serious cyber security threat to the US. There is no need to give them more access to millions of Americans personal information.
https://t.co/09fxSbXMgm",DesJarlaisTN04
125,2021-06-01 13:59:49+00:00,1399727386023837701,"Happy 225th birthday to the best state in the Nation, Tennessee! I am grateful to call the Volunteer State home! https://t.co/GBvyzMu9zf",DesJarlaisTN04
126,2021-05-31 11:57:13+00:00,1399334144186925056,"Today we honor the brave men and women who made the ultimate sacrifice for the protection of our Nation. 

May we remember their loved ones and express our gratitude for their service to our country. #MemorialDay2021 https://t.co/x9Ds9GomJZ",DesJarlaisTN04
127,2021-05-28 22:09:25+00:00,1398401048029577216,"The #BidenBudget puts the American people last.

We must stand firm in principled economic policies in which our citizens do not bear a hefty tax burden and personal responsibility is demanded.

Read my full statement here ➡️ https://t.co/uCIYMB6MNi https://t.co/1iQSO9ujfl",DesJarlaisTN04
128,2021-05-27 15:42:15+00:00,1397941224431099910,"Those who protect and defend our Nation should never be without healthcare. I am proud to co-sponsor the Healthcare for our Troops Act. 

The very least we can do is make sure these brave men and women have the resources they need to stay healthy.
https://t.co/mDNkha2a6A",DesJarlaisTN04
129,2021-05-26 22:47:45+00:00,1397685917884858369,"Today @HouseAgGOP heard testimony from the @WateredGardens executive director.

I had the opportunity to question him on the dependency he sees everyday that certain government benefits can create.

A bigger government will never be the answer to solving our country’s crises. https://t.co/jtKuJsnJmb",DesJarlaisTN04
130,2021-05-20 10:54:27+00:00,1395332085947277313,"Iran wants to see the total destruction of Israel. 

We must not stand for Hamas to attempt to wipe out one of our most trusted allies. 

The president must take swift action to end this reign of terror before any more malign actors get involved.
https://t.co/djqfNApuyx",DesJarlaisTN04
131,2021-05-19 21:26:48+00:00,1395128830566834180,"Biden has quickly &amp; unsurprisingly backed down from his “tough on Russia” promise. On day one in office he made the decision to shutdown Keystone XL killing 11,000 US jobs. He’s laying the groundwork for the US to be foreign oil dependent &amp; keep hard working Americans unemployed. https://t.co/fotoos5X8J",DesJarlaisTN04
132,2021-05-19 16:33:41+00:00,1395055067737300993,As a member of the @GOPDoctors I am proud to support @GOPLeader’s effort to end this ridiculous mask mandate in the House. (2/2),DesJarlaisTN04
133,2021-05-19 16:33:41+00:00,1395055066307080193,"Pelosi is choosing to go against updated CDC guidelines that end mask mandates for fully vaccinated individuals. 

She is ignoring the science and sending the wrong message to the American people. (1/2) https://t.co/1NM1QfBIcL",DesJarlaisTN04
134,2021-05-18 21:10:56+00:00,1394762453003669510,A nine-member Supreme Court has long been precedent and needs to be codified into law. I am proud to co-sponsor H.J. Res. 11 and #KeepNine. 🏛 (2/2),DesJarlaisTN04
135,2021-05-18 21:10:56+00:00,1394762451598692354,"#SCOTUS serves as a non-partisan check on our legislative and executive branches. 

Adding members who will toss aside our Constitution to serve a political agenda sets an extremely dangerous precedent. (1/2)",DesJarlaisTN04
136,2021-05-18 17:00:53+00:00,1394699524120186884,"Taiwan continues to see increased threats from the Chinese Communist Party. We must do everything to protect our ally’s independence from CCP rule.

I joined several House colleagues in calling on Secretary Blinken &amp; Secretary Buttigieg to fully support Taiwan’s autonomy. https://t.co/6yCoXTdLrc",DesJarlaisTN04
137,2021-05-17 14:36:50+00:00,1394300885484855297,"Honored to be named a 2020 “Taxpayer Superhero” by the Council for Citizens Against Government Waste!

President Biden’s frivolous and wasteful spending cannot go unchecked. I am committed to continuing to be a watchdog for your tax dollars.
https://t.co/YASclfjiEE",DesJarlaisTN04
138,2021-05-16 16:54:32+00:00,1393973148924661769,"Amy and I send our condolences and are praying for the friends and family of Rep. Mike Carter. 

He was a dedicated public servant to Tennessee who will be greatly missed.",DesJarlaisTN04
139,2021-05-15 18:27:13+00:00,1393634089123688454,"Thank you to all of the many brave men and women who serve honorably in the Armed Forces. 

America is a free country because of those who tirelessly work to defend our great Nation. 🇺🇸#ArmedForcesDay 

@USArmy @USMC @USNavy @usairforce @SpaceForceDoD @uscoastguard https://t.co/aEZlFMF6uu",DesJarlaisTN04
140,2021-05-13 20:43:00+00:00,1392943480478048259,"The @SBAgov, @fema and @T_E_M_A have released some helpful information for those looking for assistance following the disaster declaration due to severe storms from March 25 through April 3. https://t.co/WRQU6bWpWC",DesJarlaisTN04
141,2021-05-13 16:19:55+00:00,1392877275599839234,"Thank you to co-sponsors: @RepRalphNorman, @RepMikeRogers, @RepGregSteube, @TXRandy14, @RepBobGibbs, @RepTedBudd, @RepHarshbarger, @RepMoBrooks, @RepScottPerry, @RepMcClintock, @RepFredKeller, @RepJohnRose, @Robert_Aderholt &amp; @RepMaryMiller",DesJarlaisTN04
142,2021-05-13 16:19:55+00:00,1392877274131795969,"Yesterday, I introduced a resolution calling on the House to oppose all of Biden's unconstitutional anti #2A policies. 

I am grateful that this resolution is supported by the @NRA and @GunOwners. 

You can read the full text here ⬇️
https://t.co/Yx06ndhuPd",DesJarlaisTN04
143,2021-05-13 13:36:01+00:00,1392836028734582784,"📺 I enjoyed joining my colleague @GReschenthaler on Chris Salcedo’s @newsmax show last night! 

Make sure to watch for my reaction to yesterday’s House GOP Conference chair vote ⬇️ https://t.co/KG89hkNEpM",DesJarlaisTN04
144,2021-05-12 17:57:47+00:00,1392539517014380551,"The Biden Administration is being soft on Hamas even after days of relentlessly bombing Israel. 
Israel is a key ally of the US and they are under attack. President Biden must condemn this reign of terror and hold Hamas accountable for its actions.
https://t.co/IsMInmfQPJ",DesJarlaisTN04
145,2021-05-12 13:15:36+00:00,1392468501068140547,"Thank you @GovBillLee for your bold leadership!

Tennessee is open for business with an abundance of jobs and a ready workforce. 

It’s time to get back to normal and continue to grow our state’s economy!
https://t.co/NVbuiinO4z",DesJarlaisTN04
146,2021-05-11 23:08:32+00:00,1392255332286672896,"I am thankful every day for all of the brave men and women who put their lives on the line to serve and protect our communities. 

Make sure to thank an officer this week for the sacrifices they make to keep us safe. #NationalPoliceWeek https://t.co/ogXwk0nSWJ",DesJarlaisTN04
147,2021-05-07 14:23:18+00:00,1390673602501136392,"Joshua Arnold from Rhea County High School is a standout student, athlete and leader in his community. 

I am proud to appoint him to the @AF_Academy. 

#TN04 looks forward to all that you will accomplish in your bright future! https://t.co/WtjXL6NQIq",DesJarlaisTN04
148,2021-05-06 18:28:39+00:00,1390372955473985536,"I am very grateful to hear there were no major injuries involved.

Thank you to the local first responders for their quick action to ensure everyone’s safety.
https://t.co/P7LUHHhXSs",DesJarlaisTN04
149,2021-05-03 21:05:41+00:00,1389325310324269056,"This is a direct threat to our national security and public health safety. This administration continues to put the safety and well being of Americans last.

We absolutely must fund the border wall and make it clear that those entering our country undocumented will be sent home.",DesJarlaisTN04
150,2021-05-03 21:05:40+00:00,1389325308474580992,"A month ago @POTUS committed to keeping Trump’s 15,000 refugee cap.

As the #BidenBorderCrisis continues, the president caved to pressure from the left and invited even more illegal migrants to the US. https://t.co/IFvCLUqTJs",DesJarlaisTN04
151,2021-04-30 18:46:03+00:00,1388203007930781700,"🎙I had a great time with Michael DelGiorno yesterday on @997wtn. 

We recapped President Biden’s socialistic policy proposals and the threat China poses to the world. 

Listen here 👇

https://t.co/5f58sNZpsC",DesJarlaisTN04
152,2021-04-29 11:34:12+00:00,1387731941592547337,"""Our best future won’t come from Washington schemes or socialist dreams. It will come from you, the American people. Black, Hispanic, white &amp; Asian. Repub. &amp; Dem. Brave police officers &amp; Black neighborhoods."" Great rebuttal, ⁦@SenatorTimScott⁩! https://t.co/pTEhjMBCPU",DesJarlaisTN04
153,2021-04-29 02:34:56+00:00,1387596229366976518,"President Biden’s socialistic agenda proposed tonight is a far cry from his promise to be a ‘president for all Americans.’ I will continue to vote down all policies that attempt to turn our country into the next Venezuela.

➡️ My full statement: https://t.co/nqJMGj9daH https://t.co/jhioexNmf9",DesJarlaisTN04
154,2021-04-28 16:20:14+00:00,1387441539002085379,"Make sure to check out my in-depth interview with @TnCoNews1 on the #BidenBorderCrisis. 

Every state had become a border state and every town has become a border town--including Tennessee.

Watch here 👇

https://t.co/lt7H4vxHj3",DesJarlaisTN04
155,2021-04-27 18:36:07+00:00,1387113346571325450,"If the left cracked down &amp; enforced laws already on the books—criminals wouldn’t be able to obtain guns easily. 

🛑 The hypocrisy must stop here.

I demand the ATF investigate Hunter Biden’s public brag that he lied about his drug use on a background check to obtain a firearm. https://t.co/IAsxUjdooL",DesJarlaisTN04
156,2021-04-27 13:49:51+00:00,1387041302693490688,"Congratulations to @Central_Magnet on being ranked as the second best high school in the state of Tennessee!

#TN04 is full of the best and brightest in our state. Keep up the great work! https://t.co/OrCZmnGaxY",DesJarlaisTN04
157,2021-04-23 20:13:06+00:00,1385688200233033729,"I am proud to be awarded a 96% rating by the @ACUFoundation and rank number one as Tennessee’s most conservative US House member! 

Our state is full of principled conservative leaders and I am humbled and honored to serve alongside them. 🇺🇸 

⬇️ https://t.co/hdKXpRSvPP https://t.co/cm5S9nwqFd",DesJarlaisTN04
158,2021-04-22 16:32:06+00:00,1385270197137907712,H.R. 51 is simply pandering to the far-left base. Hard working Americans did not send their representatives to Washington to waste time crafting meaningless legislation that’s nothing more than a stunt. I voted no today on D.C. statehood. (3/3),DesJarlaisTN04
159,2021-04-22 16:32:06+00:00,1385270196257046530,The notion that the swamp can become a state by passing a simple bill is naive. Leftists know that creating the Douglas Commonwealth requires a constitutional amendment that then has to be voted on by all 50 states. (2/3),DesJarlaisTN04
160,2021-04-22 16:15:55+00:00,1385266124560949251,"The District of Columbia was created to set up our country’s central system of government, not to be a colony. (1/3)",DesJarlaisTN04
161,2021-04-21 18:26:06+00:00,1384936496587841536,"Iranian unmanned air vehicles pose a great danger to Israel. 

We must prioritize developing technology that can better detect these UAVs and regain complete air superiority. 

This is vital to the protection of our greatest ally.
https://t.co/MhNP5luZsZ",DesJarlaisTN04
162,2021-04-21 15:15:19+00:00,1384888486843535360,It was great talking with electric co-op leaders on rural broadband and issues in #TN04 this morning! https://t.co/K3FJR1duD5,DesJarlaisTN04
163,2021-04-20 20:13:10+00:00,1384601054004776961,"Moving forward with Biden’s infrastructure bill, we need to avoid pitfalls that will hinder broadband in the long run. The private sector can do a better job than government providing this access. 

Watch my full questioning during this morning’s @HouseAgGOP hearing ⤵️ https://t.co/dExYagjF52",DesJarlaisTN04
164,2021-04-20 14:22:55+00:00,1384512910114820099,She used the power of her office to intimidate members of the court. The ruling judge in the Derek Chauvin trial has even said her comments may result in grounds for an appeal that could overturn the outcome of the trial.,DesJarlaisTN04
165,2021-04-20 14:22:55+00:00,1384512908869124096,"Maxine Waters’ message to protestors of “become more confrontational” is in stark contrast to President Trump telling supporters to go and make their voices heard “peacefully and patriotically.” 

I fully support Leader McCarthy’s plans to censure Rep. Waters. https://t.co/4f5ByN0oA7",DesJarlaisTN04
166,2021-04-16 22:36:19+00:00,1383187527893463040,"I had the opportunity to question Gen. VanHerck during a @HASCRepublicans hearing this week.

Read more about what he had to say about the treat of foreign terrorists due to the #BidenBorderCrisis👇 https://t.co/jzd8vHLbgd",DesJarlaisTN04
167,2021-04-16 15:28:58+00:00,1383079981656502273,"Thank you to @GM &amp; @LGUS for choosing Spring Hill’s ready workforce for the launch of your new joint venture, Ultium Cells LLC!

This will bring 1,300 new quality jobs to our district. 

Join me in welcoming them to #TN04! https://t.co/xUv83x3SdO",DesJarlaisTN04
168,2021-04-16 12:29:47+00:00,1383034890065694721,"Congratulations to Maj. Gen. Tommy H. Baker on his official appointment by @GovBillLee to serve as the new @TNDVS commissioner!

I look forward to seeing the great work you will do on behalf of Tennessee’s veterans. 🇺🇸
https://t.co/xu8gh3A6cg",DesJarlaisTN04
169,2021-04-15 21:55:37+00:00,1382814895511584770,I am a proud co-sponsor of this bill. Master Sgt. Roddie Edmonds answered the call of duty bravely. The leadership he showed saved the lives of over 200 Jewish soldiers. Edmonds’ heroic actions should be honored. https://t.co/H5H8ShuoQS,DesJarlaisTN04
170,2021-04-15 21:32:02+00:00,1382808962911772676,"I joined the @DanMandisShow to discuss the lack of civility in Washington, Biden’s border crisis, the left’s latest on court packing and more. 

My full interview 📻👇
https://t.co/Bm2zeeJalc",DesJarlaisTN04
171,2021-04-15 17:44:38+00:00,1382751733848408073,🎙Join me on the @DanMandisShow coming up at 1:35PM on @997wtn!,DesJarlaisTN04
