,Datetime,Tweet Id,Text,Username
0,2022-02-22 19:54:53+00:00,1496211913147047938,Russia's invasion of Ukraine is a direct result of Biden's weak leadership. Putin took the deadly Afghanistan withdrawal as confirmation that US interests can be walked over. The world has watched @POTUS consistently leave our allies behind &amp; hide from threats to our democracy.,DesJarlaisTN04
1,2022-02-18 16:51:14+00:00,1494716145844330502,"Amy and I are keeping Congressman Hagedorn’s family, friends, and staff in our thoughts and prayers during this difficult time. I am proud to have served with him on @HouseAgGOP, he will be greatly missed. https://t.co/iWxaoU91PI",DesJarlaisTN04
2,2022-02-15 16:00:17+00:00,1493616158989299714,"Thankful for the opportunity to join @TennesseeGuard and Major General Holmes at the ground breaking for the new armory in Warren County on Friday.

I am committed to making sure that our fighting men and women have the very best resources they need. https://t.co/OGo6jO2WFz",DesJarlaisTN04
3,2022-02-09 16:42:45+00:00,1491452522330222593,"Had a great time meeting with @FranklinCount11 Sheriff Tim Fuller and @putnamsheriffTN Sheriff Eddie Farris yesterday. 

Thank you for all you do to keep Tennesseans safe! https://t.co/XoKeJVH4tX",DesJarlaisTN04
4,2022-02-08 14:59:17+00:00,1491064093268385793,"VP Harris was appointed to serve as border czar 321 days ago &amp; has yet to step foot inside a detention facility. She has laughed off her lack of response &amp; put Americans at risk. I am proud to sign on to @RepRonnyJackson's bill to hold her accountable.
https://t.co/UAcBYrkA15",DesJarlaisTN04
5,2022-02-07 19:24:34+00:00,1490768466361602048,"Instead of focusing on the issues that you continue to tell me are your top concerns, this is what the Democratic leadership wants to focus on. These are not the issues that are being discussed as the most urgent priorities in #TN04. (2/2)

https://t.co/itcctm9Yu6",DesJarlaisTN04
6,2022-02-07 19:24:33+00:00,1490768464457478147,"🚨THREAD🚨

Which current issue is of most concern to you?

Biden crime wave/defund the police movement?

#Bidenflation?

Illegal border crossings/fentanyl influx?

Russian/China threats?

COVID lockdowns/vaccine mandates? 

(1/2)",DesJarlaisTN04
7,2022-02-04 19:32:58+00:00,1489683417897832454,The deadly Afghanistan withdrawal has now made the region a breeding ground for terrorism. Without a ground presence our adversaries will only continue to grow stronger. We must remain committed to protecting the safety of Americans by eradicating radical terrorists. (2/2),DesJarlaisTN04
8,2022-02-04 19:32:58+00:00,1489683416840814594,Our US military Special Forces teams are heroes. I want to congratulate them on a successfully executed operation to eliminate ISIS leader Abu Ibrahim al-Hashimi al-Qurayshi. The success of this mission shows how vital our on the ground counterintelligence operations are. (1/2),DesJarlaisTN04
9,2022-02-04 16:34:55+00:00,1489638609149906945,"Agriculture impacts every industry. 

Example: @JackDaniels_US &amp; @UncleNearest in #TN04 rely on white oak trees (currently in shortage) to make their barrels. 

We have to ensure our producers are not held back by big government regulations.

My latest in @HouseAgGOP 👇 https://t.co/8hAXcXmyqc",DesJarlaisTN04
10,2022-01-28 00:14:17+00:00,1486855110219161606,"Fauci is more of a politician than a physician.

📺 Watch my discussion with @LizMacDonaldFOX on @EveningEdit about why the American people do not trust Dr. Fauci. 👇 https://t.co/lbGFLKmyU6",DesJarlaisTN04
11,2022-01-26 20:58:57+00:00,1486443564888469510,"After seeing Biden’s approval ratings, the American people have made it clear they do not want far-Left policies. 

The president must nominate the most qualified person to interpret our Constitution devoid of an advocacy agenda to serve on #SCOTUS.",DesJarlaisTN04
12,2022-01-25 02:14:29+00:00,1485798196643258369,That’s from the president who will not tolerate talking down to anyone. https://t.co/K8WP1BjspO,DesJarlaisTN04
13,2022-01-24 17:49:28+00:00,1485671103070625794,"Last week I signed on to the GOP Doctors Caucus letter demanding Dr. Fauci apologize to Sen. Marshall for calling him a “moron.” 

Read here ⤵️ https://t.co/KjcbntN7gT",DesJarlaisTN04
14,2022-01-22 02:06:18+00:00,1484708975119671306,"Glad to see this is moving in the right direction. 

Hopefully we’ll see the same for our U.S. military members and health care workers soon. https://t.co/YduVJGKAL6",DesJarlaisTN04
15,2022-01-20 19:05:31+00:00,1484240692171968512,"“Over the past year, his team has attempted to paint a fairy tale picture of countless failures and the chaos that ensued. With each failure came the blame game.”

Read my latest for @newsmax here 👇https://t.co/exHra4PWNy",DesJarlaisTN04
16,2022-01-19 22:30:07+00:00,1483929791912980481,"Happy Birthday to Tennessee’s own, @DollyParton! https://t.co/BuIQ3iVS3y",DesJarlaisTN04
17,2022-01-19 19:50:14+00:00,1483889558756417541,We must make it clear that the U.S. stands with Ukraine and be proactive in our approach to de-escalate these tensions. (2/2),DesJarlaisTN04
18,2022-01-19 19:50:14+00:00,1483889557590401037,"Biden lacks a sense of urgency in the impending Russian invasion of Ukraine. After pushing to adopt a dangerous ‘no first use policy,' disastrous withdrawal from Afghanistan &amp; green-lighting Putin's Nord Stream 2 Pipeline, it's clear he can be bullied by our adversaries. (1/2)",DesJarlaisTN04
19,2022-01-18 16:30:38+00:00,1483476939260190730,The Leftist irony that you need a photo ID to prove your vaccination status but not to cast your ballot. https://t.co/LWpEPT3Gcf,DesJarlaisTN04
20,2022-01-13 20:09:09+00:00,1481719991443628037,"SCOTUS took a giant step in the right direction today by not upholding Biden’s oppressive vaccine mandate for large employers. 

Now it’s time to finish the job and prevent this socialistic government from imposing its will on health care workers, federal workers &amp; our military.",DesJarlaisTN04
21,2022-01-12 19:34:18+00:00,1481348832168448004,"Store shelves are empty, a dismal 199,000 were added to the American economy in December 2021 &amp; inflation hit a FORTY YEAR HIGH last month raising the CPI to 7%.

This is why the #BuildBackBroke Act is dead in the water. 

When will President Biden step up and lead?",DesJarlaisTN04
22,2021-12-25 14:34:52+00:00,1474750495235452928,Merry Christmas from the DesJarlais family! I always enjoy attending the midnight service with my family. Wishing #TN04 joy and happiness as you celebrate today. https://t.co/GzmPxwtI7O,DesJarlaisTN04
23,2021-12-20 19:48:03+00:00,1473017372424425481,"Happy Birthday, @SpaceForceDoD! We are grateful for the service of the men and women who work daily to protect our great Nation. https://t.co/gJJC7Ua93L",DesJarlaisTN04
24,2021-12-13 22:29:49+00:00,1470521367225323520,"Amy and I are thinking of and praying for those impacted by this weekend’s deadly and destructive storms.

I will join with our state’s congressional delegation to make sure Tennesseans impacted by the severe weather and tornadoes have access to all available federal assistance.",DesJarlaisTN04
25,2021-12-10 15:57:27+00:00,1469335462150131716,"Two years in and the Biden administration has decided to demonize the very people who have saved countless lives for making a personal decision.

I have signed on to @RepJeffDuncan’s bill to put an end to the president’s arbitrary mandate.

https://t.co/hfFrANtmt7",DesJarlaisTN04
26,2021-12-07 19:30:08+00:00,1468301822263795713,Today we remember the service and sacrifice of the honorable men and women who lost their lives defending our freedom. #PearlHarbor80 https://t.co/eQFmKnLk8D,DesJarlaisTN04
27,2021-12-05 18:55:45+00:00,1467568394132197393,"Bob Dole was an American hero.

He was a statesman until the end and remained active until his final days advocating for our veteran heroes. He will be missed, and Amy and I join all Americans in praying for his family and friends. https://t.co/kgFXP4kAvz",DesJarlaisTN04
28,2021-12-02 18:48:14+00:00,1466479335213350915,"I don’t think there’s any kidding here, Mr. President… https://t.co/Hdo4dCV0f3",DesJarlaisTN04
29,2021-12-02 13:00:57+00:00,1466391941302607881,"Had a great time speaking with the good people of #TN04 during last night’s Tele Town Hall!

We had over 10,000 people join and had several meaningful conversations with those voicing their concerns over what’s happening in Washington. https://t.co/1pHcRD4tce",DesJarlaisTN04
30,2021-11-26 01:57:53+00:00,1464050745486061568,"Happy Thanksgiving from the DesJarlais family!

Hoping everyone enjoyed the day celebrating with those they love most.

I’m thankful today, and every day, to represent #TN04. https://t.co/MZ1p9pDC8u",DesJarlaisTN04
31,2021-11-19 20:43:17+00:00,1461797246773649408,"This administration is more focused on jamming through another 2,300 page bill full of political payoffs rather than taking the time to address the economic crisis plaguing our Nation. 

My full statement on why I voted no on Biden's #BuildBackBroke ⬇️

https://t.co/qz0raGVsH1",DesJarlaisTN04
32,2021-11-17 21:37:29+00:00,1461086112320004099,"Proud to stand with @GOPLeader, @RepStefanik, @stevescalise and many other colleagues as Republicans made the case for why the #BuildBackBroke Act makes life worse for the everyday American. https://t.co/nbbgAg4XKg",DesJarlaisTN04
33,2021-11-17 17:01:02+00:00,1461016539365355529,Drug cartels are making their way into the US carrying massive amounts of fentanyl and other illegal drugs. Without Biden’s support our law enforcement agencies don’t have the resources to capture these criminals. I fear next year’s overdoses will dramatically increase. (2/2),DesJarlaisTN04
34,2021-11-17 17:01:01+00:00,1461016537435938816,"Last year we lost 100,000 Americans to overdoses, many due to fentanyl. Right now, we are seeing a record-breaking number of illegal migrants cross our southern border. (1/2)
https://t.co/aEx7ov58gN",DesJarlaisTN04
35,2021-11-11 21:31:29+00:00,1458910273188904961,Incredibly grateful for the service and sacrifice of our great nation’s veterans. Thank you to all of the brave men and women who answered the calling to protect our country. https://t.co/MLPvea2WNE,DesJarlaisTN04
36,2021-11-10 17:18:07+00:00,1458484125300580359,"Trying to visit family for the holidays?

🚗 Gas: ⬆️ 61%
✈️ Airline: ⬆️ 18% 

#ThanksgivingTax #Bidenflation 

(2/2)",DesJarlaisTN04
37,2021-11-10 17:18:07+00:00,1458484123840962562,"The consumer price index hit a 30-year high with 6.2% raise from October last year. 

What does that mean for hosting Thanksgiving in Biden’s America?

Prices are up 💸⬆️

🦃 Turkey: ⬆️ 27%
🥔 Russet Potatoes up: ⬆️ 17%
🥕 2lb bag of Carrots: ⬆️ 47%
 
(1/2)https://t.co/KAhpSrn7EW",DesJarlaisTN04
38,2021-11-09 16:36:02+00:00,1458111145685004291,"Members of the @GOPDoctors worked for two years to pass bipartisan legislation to protect patients from surprise medical bills. Biden is attempting to muddy the waters making health care less transparent. 

I’ve signed on to a letter to address this issue with the administration. https://t.co/pQQFN8FGVK",DesJarlaisTN04
39,2021-11-02 16:11:29+00:00,1455568253753962496,"It’s hard enough to find workers, I don’t believe that anyone who WANTS to work should not be allowed to.

Watch as I discuss Biden’s vaccine mandate on @EveningEdit 👇

https://t.co/Deh8FmUkzJ",DesJarlaisTN04
40,2021-10-28 14:24:02+00:00,1453729273303343112,"Our economy only grew 2% last quarter &amp; Biden has proposed a $1.75T socialist spending spree. This will slow economic growth &amp; send inflation through the roof. 

When will Biden learn Americans don’t want to be dependent on government for their livelihoods with social programs? https://t.co/09kzXGkFDQ",DesJarlaisTN04
41,2021-10-27 00:58:40+00:00,1453164207625719812,"Joined @EveningEdit with Elizabeth MacDonald to discuss the Biden vaccine mandates and the potentially devastating economic implications this will have.

📺 Watch ⬇️ https://t.co/l56XgjxeG5",DesJarlaisTN04
42,2021-10-26 14:00:10+00:00,1452998492557910022,"Had a great time with @SenatorHagerty at @LodgeCastIron on Friday right in the heart of #TN04!

I’m grateful for the many careers Lodge has provided our district over the past 125 years. https://t.co/XuL4JXfdiu",DesJarlaisTN04
43,2021-10-20 17:24:01+00:00,1450875465753841666,"Today, my friend, Rep. Phil Roe, was honored with a portrait unveiling for his service as the @HouseVetAffairs chair from 2017-2019. 

I am grateful to have served alongside such an honorable man who always did right by his constituents. We all wish him well in his retirement. https://t.co/47oCPd6XkO",DesJarlaisTN04
44,2021-10-14 17:37:52+00:00,1448704621703270401,"Appointing Vice President Harris “border czar” was nothing more than virtue signaling from the Biden administration. She has done absolutely nothing to end this crisis. 
https://t.co/H83zZiJg3P",DesJarlaisTN04
45,2021-10-13 16:29:53+00:00,1448325127154847744,I’m calling on the administration to enact strict sanctions and use our current immigration laws to block Chinese nationals from entering our country if China will not adhere to peacefully resolving the Taiwan Strait dispute. (2/2),DesJarlaisTN04
46,2021-10-13 16:29:53+00:00,1448325125858807810,"Since the collapse of Kabul caused by Biden's team, our adversaries have been testing the US. POTUS has been weak on China since day one. It's past time for Biden to take action against the CCP’s increased aggression towards our ally, Taiwan. (1/2) 
https://t.co/5Duvy7qx3R",DesJarlaisTN04
47,2021-10-12 16:25:39+00:00,1447961673818640387,"President Biden and Speaker Pelosi are incapable of calling out the nonsense in their own party.

Watch as I discuss progressives’ lack of civility and Democratic infighting in Washington on @TheDonlonReport👇 https://t.co/e90LcsT3ci",DesJarlaisTN04
48,2021-10-05 19:47:08+00:00,1445475664010760192,"Big Tech must be held accountable. 

The whistleblower testimony sheds an important light on the inner workings of Facebook operations and the dangers social platforms can cause to our national security, teen mental health and a plethora of other problems. https://t.co/07ZtUzj35D",DesJarlaisTN04
49,2021-10-04 18:56:55+00:00,1445100640070512643,Raising the debt ceiling just to immediately blow the roof off again with up to 5 Trillion in new social giveaways and Green New Deal initiatives could only be concocted in the new liberal fantasy land that Washington has become. (2/2),DesJarlaisTN04
50,2021-10-04 18:56:55+00:00,1445100638497615878,"Biden has no intention of reaching across the aisle &amp; working together on a reasonable solution to our Nation’s economic crisis. 

This administration will bully members of their own party for standing up to this attempted senseless spending spree. (1/2) https://t.co/tRgq9RGydf",DesJarlaisTN04
51,2021-09-30 13:05:51+00:00,1443562739327246340,"Thank you, Dan for giving me the opportunity to talk about my exchange with General Milley and Secretary Austin during yesterday’s hearings.

🎙Listen here 👇 https://t.co/ibwakZlhhh",DesJarlaisTN04
52,2021-09-30 13:01:06+00:00,1443561541073309702,"🚨 WATCH 🚨 I questioned Secretary Austin yesterday about why US military equipment was left behind in Afghanistan.

I’ll be discussing my full questioning during yesterday’s hearing coming up at 9amCT/10amET on @newsmax! https://t.co/KXiKCBbYFm",DesJarlaisTN04
53,2021-09-24 11:50:50+00:00,1441369534108078086,Thank you to my colleagues for joining me in putting HHS on notice that this policy change has the potential to prevent countless US citizens from receiving this lifesaving treatment. https://t.co/jx8KrEsGAg,DesJarlaisTN04
54,2021-09-24 11:50:48+00:00,1441369523555221505,"If the seven states targeted by an HHS policy change in monoclonal antibody distribution included Calif., N.Y., and Del., would there be a change? The Biden administration has a callous attitude towards the deaths of Americans living in Red states.
https://t.co/pJGlg9qKEn",DesJarlaisTN04
55,2021-09-23 19:47:33+00:00,1441127114741219329,"Chuck Fleischmann is a leader. Thank you for standing up against anti-Semitism and Democratic hypocrisy. 

Rep. Tlaib's remarks are disgusting and unAmerican. We must stand up and protect our Jewish allies. I fully support funding an iron dome for Israel. https://t.co/xeNPMvAo3O",DesJarlaisTN04
56,2021-09-23 16:25:06+00:00,1441076167843385349,"Yesterday, I faced off against AOC. 

Progressives are fighting for a $74 BILLION reduction to the defense budget and advocating for TRILLIONS of DOLLARS for their Green New Deal fantasy.

I’ll continue to fight for our U.S. military to be fully funded! 🇺🇸 https://t.co/AkYxzByUBe",DesJarlaisTN04
57,2021-09-23 16:21:43+00:00,1441075314638168066,"will receive the funds they need to carry out vital operations for our United States Military.

While I don’t support Democrat poison pills in this bill, I will be working with my colleagues to remove them during conference before its final passage. (2/2)",DesJarlaisTN04
58,2021-09-23 16:21:42+00:00,1441075308879224833,"Yesterday, I spoke in support of the 2022 National Defense Authorization Act.

I’m proud to say Arnold Air Force Base, @UTKnoxville Space Institute, @VanderbiltU, Fort Campbell Army Base, @ORNL and other Tennessee stakeholders…(1/2) https://t.co/DEbIytbK8z",DesJarlaisTN04
59,2021-09-17 17:47:42+00:00,1438922625175236614,Proud to stand with @GovBillLee and fight for full transparency from the Biden Administration. We must ensure Afghan refugees have been properly vetted for the safety of all Tennesseans. https://t.co/Z933dP73rj,DesJarlaisTN04
60,2021-09-15 21:13:34+00:00,1438249659886145539,Thank you to my colleagues @RepHarshbarger @RepTimBurchett  @RepChuck @RepJohnRose @RepMarkGreen @RepDavidKustoff  for signing on in support of this important issue.,DesJarlaisTN04
61,2021-09-15 21:13:34+00:00,1438249657306652674,I authored a letter to HHS Secretary Becerra over concerns in a change in HHS policy regarding distribution of the monoclonal antibody therapies. Tennesseans deserve to have every available option to combat the coronavirus. https://t.co/wliZHhqFko,DesJarlaisTN04
62,2021-09-13 17:52:29+00:00,1437474275934576652,"This reconciliation process has been anything but thoughtful or collaborative. Democrats crafted this fiscally irresponsible bill behind closed doors with no bipartisan input. 

My full thoughts on why I voted NO on the House Agriculture committee bill.
https://t.co/Hus7f6retu",DesJarlaisTN04
63,2021-09-11 13:52:40+00:00,1436689149197758470,America was at her best as we saw citizens from all walks of life come together in a time of great need in our country. We will never forget 9/11.,DesJarlaisTN04
64,2021-09-11 13:52:39+00:00,1436689147276713996,"Twenty years ago today the course of American history was forever altered by the acts of terrorism that took place. Today, we remember the bravery and resolve of the 2,997 lives our country lost and continue to pray for their loved ones. https://t.co/3FdZdbwG5l",DesJarlaisTN04
65,2021-09-10 13:31:01+00:00,1436321312683798529,"Afghan refugees and illegal migrants crossing our southern border are granted more medical freedom than our own United States citizens.

My full statement on President Biden's new COVID-19 vaccine mandates 👇    
https://t.co/YD2W5GAiIP",DesJarlaisTN04
66,2021-09-09 14:38:09+00:00,1435975822737821707,"I was proud to present Decherd Elementary School with a flag flown over the U.S. Capitol in their honor. The students, faculty and staff have worked tremendously hard to earn a Model School status. You have made #TN04 very proud!
https://t.co/A4loXYwIJC",DesJarlaisTN04
67,2021-09-08 18:51:26+00:00,1435677175588470785,"With the Biden administration’s rushed exit from Afghanistan, there are serious questions as to whether or not potential terrorists slipped through the cracks. 

It is imperative for the safety of every American that we ensure no terrorists enter our country. (2/2)",DesJarlaisTN04
68,2021-09-08 18:51:26+00:00,1435677173285892096,Last week I signed on to @RepAndyBiggsAZ letter to Secretary Mayorkas regarding the vetting process for Afghan refugees entering the US. (1/2) https://t.co/VXVPhzotn8,DesJarlaisTN04
69,2021-09-08 13:23:06+00:00,1435594544695873538,"Yesterday, I joined my Lincoln County friends at the Friends of Fayetteville-Lincoln County Veterans Inc for a tour of the Warrior Exhibit.

I am incredibly grateful for the service and sacrifice of the veterans right here in Tennessee’s Fourth District. 🇺🇸 https://t.co/sU4BpcEY2q",DesJarlaisTN04
70,2021-09-07 13:29:06+00:00,1435233667257970690,"I was grateful to be a part of the grand opening of the TCAT Franklin County campus on Friday!

I had the opportunity to present the school with a flag flown over the U.S. Capitol in honor of their opening.

We are lucky to have TCAT in Winchester! https://t.co/SVXukgaHlU",DesJarlaisTN04
71,2021-09-02 20:30:39+00:00,1433527817438892036,"I plan to re-introduce this amendment when the NDAA is brought to the House floor for a vote. (2/2)

My full release 👇

https://t.co/wdYj7JQgcx",DesJarlaisTN04
72,2021-09-02 20:30:39+00:00,1433527813978705920,"Biden has proposed a disastrous ‘No First Use’ nuclear declaratory policy. Our allies are unsupportive &amp; it makes the US weaker. 

During last night’s @HASCRepublicans hearing I withdrew my amendment on ‘No First Use’ after it was blocked by the Foreign Affairs Committee. (1/2) https://t.co/lhGAVSftdL",DesJarlaisTN04
73,2021-09-02 00:58:58+00:00,1433232952280993793,"Border Security = National Security

Tonight I argued in favor of an amendment to the NDAA during @HASCRepublicans bill markup that makes securing the US-Mexico border a top priority for our military.

Watch 👇 https://t.co/ctgCnAKvgp",DesJarlaisTN04
74,2021-09-01 14:08:59+00:00,1433069377306480642,"Today we begin bill markup for the National Defense Authorization Act. As we have seen over the past few weeks it's more important than ever that we prioritize a strong national defense against our adversaries such as China, Russia, the Taliban &amp; others.
https://t.co/5bh5V24VSp",DesJarlaisTN04
75,2021-08-31 15:20:46+00:00,1432725055658733575,Please continue to keep the Knauss family in your prayers. Army Staff Sergeant Ryan C. Knauss was a Tennessee native who gave his life for his country during last week’s deadly attack in Afghanistan. https://t.co/ddmtET73nE,DesJarlaisTN04
76,2021-08-30 21:35:51+00:00,1432457061003141120,My team and I will remain steadfast in our efforts in working with other congressional members and military leaders to continue rescue efforts. (2/2),DesJarlaisTN04
77,2021-08-30 21:35:51+00:00,1432457059602243586,It is unfathomable that the president of the United States would leave any American behind that wanted to evacuate in a country now overrun by terrorists who vow to kill our citizens. (1/2) https://t.co/yEaPxU6Kcd,DesJarlaisTN04
78,2021-08-30 13:17:52+00:00,1432331739268059137,We will always remember their sacrifice for our freedom. Thank you for your service to our country. https://t.co/NV1SYPj7U4,DesJarlaisTN04
79,2021-08-29 18:13:36+00:00,1432043774725734406,"Amy and I are praying for all those impacted by Hurricane Ida.

As the storm makes its way towards Middle Tennessee I encourage everyone to stay vigilant and up to date through local news and weather channels. https://t.co/frOTV6xgdM",DesJarlaisTN04
80,2021-08-26 20:32:50+00:00,1430991648142635010,"Today we tragically lost US service members to Taliban facilitated attacks at the Kabul airport in Afghanistan. My condolences go out to the families who lost loved ones &amp; I am praying for those injured. Read my full statement on these senseless attacks.
https://t.co/xSFXpBW6QW",DesJarlaisTN04
81,2021-08-26 15:52:36+00:00,1430921124662099979,"As I continue to monitor the attacks at the Kabul airport I ask everyone to keep our American citizens, US troops and Afghan allies in your thoughts and prayers. 

The Biden administration must answer for this disastrous withdrawal and avoidable tragedy that is unfolding.",DesJarlaisTN04
82,2021-08-24 19:40:46+00:00,1430253771553181700,"I joined I joined Michael DelGiorno last week to discuss the Biden administration’s disastrous withdrawal from Afghanistan on @997wtn.

🎙Listen here ⬇️

https://t.co/6UZfRXjlt7",DesJarlaisTN04
83,2021-08-24 12:45:31+00:00,1430149271781888155,"The Pfizer COVID-19 vaccine has been granted full FDA approval. I encourage everyone to consult with their doctor when deciding whether to receive the vaccination.

Following extensive research, my family &amp; I have all been fully vaccinated to help protect ourselves from COVID-19. https://t.co/j8weabNTSq",DesJarlaisTN04
84,2021-08-23 23:58:41+00:00,1429956290831388677,"This is a lie. There are Americans still stranded in Afghanistan. 

The Biden administration made massive mistakes in their withdrawal from Afghanistan and have put the lives of countless Americans in danger. https://t.co/qbVl8xALCA",DesJarlaisTN04
85,2021-08-23 19:00:45+00:00,1429881313323061257,"Phil Valentine made a major impact on Middle Tennessee and beyond. 

He was a true conservative fighter who will be greatly missed. My thoughts and prayers are with his family, friends,  SuperTalk 99.7 WTN team and all of those impacted by his loss. https://t.co/INEuAeLzhC",DesJarlaisTN04
