,Datetime,Tweet Id,Text,Username
172,2021-04-14 21:53:23+00:00,1382451945433133056,Happy 73rd Birthday to the @USAFReserve! America thanks the brave men and women who stand ready to protect our country. 🇺🇸 https://t.co/aHJy5bEAV1,DesJarlaisTN04
173,2021-04-14 02:12:43+00:00,1382154820677603334,"This crisis can be stopped. It is on Biden to make it clear to migrants you must immigrate to the US through proper legal channels. 

We need policies that protect both American citizens &amp; migrant minors from being subjected to the horrors experienced on their journey. (2/2)",DesJarlaisTN04
174,2021-04-14 02:12:42+00:00,1382154819130044423,"Every town is a border town. Every state is a border state. 

The Biden administration has been careless to offer illegal aliens refuge in our country and caused the endangerment of millions of children. (1/2) https://t.co/zczPwxwxxy",DesJarlaisTN04
175,2021-04-13 20:55:16+00:00,1382074935129047050,"Great piece by @sectrehargett on what the passage of HR/S1 means for the future of U.S. election integrity. 🗳👇
https://t.co/ojUwr8T4si",DesJarlaisTN04
176,2021-04-13 20:28:35+00:00,1382068217426890752,"You would think that Biden and his team should know that a thriving economy will do more to save Americans than a rescue check. Unfortunately, their agenda includes one item: The repeal of all Trump-era policies. (2/2)",DesJarlaisTN04
177,2021-04-13 20:28:34+00:00,1382068215409430536,"This month was the largest increase in a decade for a single month for the consumer price index.

Policies that create mass amounts of inflation are ramping up &amp; middle-class Americans are only beginning to see the impact of the 'tax and spend' mentality. (1/2) https://t.co/3Rzc25Z8Zs",DesJarlaisTN04
178,2021-04-13 12:39:37+00:00,1381950199359279106,Amy and I are praying for the Austin-East community and the injured Knoxville Police officer in the difficult days ahead.,DesJarlaisTN04
179,2021-04-08 17:40:42+00:00,1380214030518878215,"Biden’s attempt to disguise stripping #2A rights through executive order under the HHS definition of a public health emergency is both insulting &amp; inaccurate. 

Add this to his long list of far-left pandering policies that have nothing to do with unification or bipartisanship. https://t.co/evv85aPxgg",DesJarlaisTN04
180,2021-04-07 17:25:06+00:00,1379847717015461896,"Army Sgt. Charles H. Coolidge was a decorated war hero who deservedly earned a Medal of Honor for his brave actions during WWII.

He was a pillar in the East Tennessee community and will be missed by so many. I thank him for his service to our country.
https://t.co/BM8KbNluKu",DesJarlaisTN04
181,2021-04-06 18:12:34+00:00,1379497275240632330,"Local farming will always be the backbone of ensuring a secure food supply chain. 

I’m proud to see folks like the Neales meet the needs of their community with a farm to table product.

They have proved just how vital the agricultural community is.
https://t.co/6VRzhjPIU6",DesJarlaisTN04
182,2021-04-05 17:08:43+00:00,1379118816391757825,"Hardworking Tennesseans will not be fooled by this socialist propaganda. 

The #BidenBailout is a handout to House &amp; Senate Democratic Leaderships’ special interest projects that now middle-class Americans are going to be paying for with a hefty tax raise.
https://t.co/wQ4IpDYNU5",DesJarlaisTN04
183,2021-03-25 19:23:30+00:00,1375166469256970249,"🛑 Bradley Co. Public Storm Shelters
NOW— Ohh Yeah! Fitness Complex
4:30pm—Walker Valley High School
5:00pm—Fire Stations at Georgetown Road, Minnis Road &amp; Dalton Pike

🛑 Rhea Co. Public Storm Shelters
5:00pm— Graysville City Hall Community Room

https://t.co/kJ0pmt05aq",DesJarlaisTN04
184,2021-03-25 18:07:04+00:00,1375147235130945539,Amy and I are praying for the friends and family of Sen. Bill Brock. We send our deepest condolences. https://t.co/kkJODEASk7,DesJarlaisTN04
185,2021-03-25 16:18:22+00:00,1375119879720816643,"The people who were looted, vandalized &amp; assaulted by Antifa probably think that they are hateful &amp; violent. I doubt many feel that way about @ACPeds.

The SPLC should not have the authority to define extremism, let alone be the standard for defining it within our own military. https://t.co/nCsQxTHjt1",DesJarlaisTN04
186,2021-03-25 14:28:35+00:00,1375092251026669570,"In honor of National Medal of Honor Day, I joined the TN delegation in asking President Biden to designate a state funeral for the last surviving WWII Medal of Honor Recipient, US Army Technical Sergeant Charles H. Coolidge of Signal Mountain, TN. 

Thank you for your service!🇺🇸 https://t.co/4edMENOo0k",DesJarlaisTN04
187,2021-03-25 13:03:28+00:00,1375070830003118089,Please stay alert and up to date with local news today regarding severe weather threats across the state. Be prepared and stay safe! https://t.co/Legs3wUWTI,DesJarlaisTN04
188,2021-03-24 16:38:08+00:00,1374762465259630601,I’ve joined my Senate and House colleagues in asking the GAO to investigate the Biden Administration’s violation of the Impoundment Control Act. (2/2) https://t.co/M9H7tswEqm,DesJarlaisTN04
189,2021-03-24 16:38:07+00:00,1374762460129980420,Border wall funds were allocated by Congress to ensure our nation’s security. President Biden is illegally cutting funding for this project. (1/2) https://t.co/ZvTSfaQOeG,DesJarlaisTN04
190,2021-03-24 13:10:33+00:00,1374710225534644231,"If you have questions regarding your stimulus check you can contact the IRS online or by phone. 

If you need further assistance, please feel free to call one of my district offices. https://t.co/hpI5ONtL1p",DesJarlaisTN04
191,2021-03-23 20:50:11+00:00,1374463508797034499,"It is time for the rhetoric to stop, there will be no way to put a spin on the numbers. I call on President Biden to release the facts.",DesJarlaisTN04
192,2021-03-23 20:50:10+00:00,1374463505840017409,"After troubling DHS reports that illegal aliens are being released into our country with no court date, I joined some of my colleagues in demanding answers from the Biden administration.

The American people deserve to know why these criminals are getting a free pass. https://t.co/fOggljjHv0",DesJarlaisTN04
193,2021-03-23 13:08:44+00:00,1374347382234746880,"Wishing a happy #NationalAgricultureDay to all of our Tennessee farmers!

Thank you for all you do to keep our food supply secure and economy growing! 🌾👩‍🌾👨‍🌾🐄 https://t.co/ci7xQwAWxF",DesJarlaisTN04
194,2021-03-22 15:51:47+00:00,1374026026985140226,"The #BidenBorderCrisis will continue until we make it clear to those attempting to cross the border illegally that they will not be welcomed.

Law enforcement agencies need proper resources and the southern border secured in order to keep Americans safe. https://t.co/tvED7PSEPN",DesJarlaisTN04
195,2021-03-19 22:49:13+00:00,1373043914387685377,"Congratulations @LadyBlazeHoops on your AAA State Championship win! You have made your school and all of #TN04 proud! 🏀🏆
https://t.co/wa2WcnvZoW",DesJarlaisTN04
196,2021-03-19 01:04:23+00:00,1372715542524596226,I voted no on H.R. 6 &amp; H.R. 1603 because I believe in a constitutional solution to solving our immigration problem. (4/4),DesJarlaisTN04
197,2021-03-19 01:04:23+00:00,1372715541790654473,There is a crisis at our border right now. Law enforcement agents are overwhelmed with the influx of those attempting to enter our country undocumented. Creating policies that reward this type of behavior will only worsen this &amp; weaken our immigration system as a whole. (3/4),DesJarlaisTN04
198,2021-03-19 01:04:23+00:00,1372715540825931776,Immigrants who came to our country illegally must be sent home &amp; go through the legal process for reentry. Any sort of exception to this rule is not only unconstitutional but also unfair to the millions of people going through the proper legal channels to enter the U.S. (2/4),DesJarlaisTN04
199,2021-03-19 01:04:23+00:00,1372715539559288842,"The US needs immigration reform that is constitutional &amp; protects our American interests. H.R. 6, the American Dream and Promise Act, &amp; H. R. 1603, the Farm Workforce Modernization Act, encourage the continuation of illegal behavior with incentivization &amp; no repercussions. (1/4)",DesJarlaisTN04
200,2021-03-18 20:54:12+00:00,1372652579902124045,"The safety of our country depends on him being completely removed from one of the most crucial committees in Congress. 

I stand by @GOPLeader’s call for his removal.",DesJarlaisTN04
201,2021-03-18 20:54:12+00:00,1372652578480218115,"Rep. Swalwell sitting on the House Intelligence Committee poses a grave danger to our national security. 

His relationship with a suspected Chinese spy that FUNDRAISED for him makes it beyond clear that he should not be trusted with confidential information. https://t.co/6lnmWh1RdT",DesJarlaisTN04
202,2021-03-18 15:11:05+00:00,1372566233288151040,"🚨 Federal income tax filings and payments will now be due May 17, 2021. Visit their link for more information ⬇️🇺🇸 https://t.co/WQ61OgTYTE",DesJarlaisTN04
203,2021-03-17 17:43:46+00:00,1372242269374386178,"President Biden is putting Americans last. He has invited a massive surge of migrants to come across our border during a global pandemic. 

We need to provide support and resources to law enforcement agents who are working tirelessly to ensure our safety. (2/2)",DesJarlaisTN04
204,2021-03-17 17:43:46+00:00,1372242268279689218,"The Biden administration is reverting back to Obama era policies fueled by the incessant need to reverse any progress made by the Trump team. (1/2)
https://t.co/HQkv6Z8LZl",DesJarlaisTN04
205,2021-03-17 14:50:48+00:00,1372198738538684417,"President Trump delivered Operation Warp Speed in less than a year. 

He ensured the brightest minds worked together to come up with a safe &amp; effective vaccine.

I encourage everyone to consult with their doctor to determine if receiving the COVID-19 vaccine is best for them. https://t.co/BdempkFPap",DesJarlaisTN04
206,2021-03-17 01:32:45+00:00,1371997906249654277,"🚨 Make sure to go over your emergency weather plan with your family and keep up with local news as severe weather moves into the district tomorrow. 

Stay informed and stay safe! https://t.co/yWwLsnMowp",DesJarlaisTN04
207,2021-03-16 21:35:52+00:00,1371938291050815491,"The Swamp is home to our nation’s most untrustworthy bureaucrats. They will always vote for a bigger government that will keep a paycheck coming their way. 

This is why our founding fathers set up DC as the seat of government, not a colony. https://t.co/p7WXlyFdTD",DesJarlaisTN04
208,2021-03-16 13:41:49+00:00,1371818993372303367,"Tyler Andrews of Murfreesboro was also recognized for donating nearly 20 gallons of blood. His selfless donation has had the potential to save almost 480 lives over the years, thank you!",DesJarlaisTN04
209,2021-03-16 13:41:49+00:00,1371818991812022283,"Congratulations to @TennesseeGuard Maj. Gen. Holmes on being named the @RedCrossTN 2021 Heroes Award Honoree! Thank you for always answering the call of service to your country and local community.

https://t.co/upbgoEUDIV",DesJarlaisTN04
210,2021-03-11 21:26:58+00:00,1370124109934387205,"I believe law-abiding citizens have the right to be able to protect themselves and their families. 

My full statement on why I voted no on H.R. 8 &amp; H.R. 1446 👇 https://t.co/CHmRHsIvz0",DesJarlaisTN04
211,2021-03-11 17:16:06+00:00,1370060978843422721,US farmers are the backbone of ensuring our food security. Overburdensome government agricultural regulations are at the forefront of Democrats’ agenda. I’m committed to making sure that farmers and stakeholders have a seat at the table. Thank you @ZippyDuvall for your testimony. https://t.co/m5D6sbxrbu,DesJarlaisTN04
212,2021-03-10 20:21:19+00:00,1369745202152374275,"The American taxpayer will now be saddled with the burden of bailing out a handful of mismanaged liberal states. 

H.R. 1319 is the first coronavirus relief package to pass without bipartisan support. I voted no on this socialistic wealth redistribution package. (3/3)",DesJarlaisTN04
213,2021-03-10 20:21:19+00:00,1369745201414221826,91% of this progressive payoff package will NOT be used for coronavirus relief. This legislation is funding for House and Senate Democratic leaderships’ special interest projects. (2/3),DesJarlaisTN04
214,2021-03-10 20:21:19+00:00,1369745200139145228,"Today the House passed the final version of the fifth COVID-19 relief bill, which now heads to President Biden’s desk. (1/3)",DesJarlaisTN04
215,2021-03-10 01:29:17+00:00,1369460316325740547,"Every worker has the constitutional right to organize, this does not mean that they should be forced by law to join unions that do not represent their values. (3/3)

Tonight I voted no, on H.R. 842.",DesJarlaisTN04
216,2021-03-10 01:29:17+00:00,1369460315650416644,Under this bill companies would be mandated to share employee information with unions. This is a direct violation of an individual’s personal privacy. The federal government should never have this much control over a private business or person. (2/3),DesJarlaisTN04
217,2021-03-10 01:29:17+00:00,1369460315000365056,Businesses are thriving in right to work states like Tennessee. The PRO Union Bosses Act would destroy years of progress and undermine states’ authority to legislate on this issue. (1/3),DesJarlaisTN04
218,2021-03-09 17:41:45+00:00,1369342656388734979,"God speed to the brave men and women of the @TennesseeGuard’s 1st Batallion, 181st Field Artillery. 

Thank you for your service to our state and country. We are looking forward to welcoming all of you home in 11 months.🇺🇸 https://t.co/d13UND7FpE",DesJarlaisTN04
219,2021-03-08 16:45:07+00:00,1368966015959375879,"The new administration feels the need to do everything they can to reverse this so they can thoughtlessly pander to the far-left. 

I joined some of my colleagues in calling on Biden and his team to reinstate policies that protect our southern border.",DesJarlaisTN04
220,2021-03-08 16:45:06+00:00,1368966014105452550,"The crisis at the US-Mexico border is a direct result of President Biden’s multiple executive orders that do nothing to keep Americans or migrants safe. 

President Trump had the border under control with common sense protocols and the construction of a barrier wall. https://t.co/qzmLkX48zG",DesJarlaisTN04
221,2021-03-04 20:47:38+00:00,1367577496993075201,"🚫 #HR1 is an overreach by the federal government on states’ rights to conduct their own elections. Pelosi &amp; every other progressive wants the law changed to weaken the election system to ensure victory every time. 

Read more in my @newsmax column here 👇 https://t.co/sSHnS501yB",DesJarlaisTN04
222,2021-03-04 04:20:12+00:00,1367329004026527746,"Tonight I voted no H.R. 1280 and H.R. 1, both bills give an absurd amount of control over to the federal government. 

Read my full statement ⬇️ https://t.co/uRYuhMqzMu",DesJarlaisTN04
223,2021-03-03 19:32:03+00:00,1367196089565249542,"Both sides of the aisle must see that this will cut funding for necessary programs that ensure the well being of their constituents—especially seniors. 

I urge my Senate colleagues to look at what their own states stand to lose if this were to pass.",DesJarlaisTN04
224,2021-03-03 19:32:03+00:00,1367196088713834497,This progressively partisan legislation will result in $164 million less in direct funding to the state of Tennessee than it would have in previous bipartisan coronavirus relief bills.,DesJarlaisTN04
225,2021-03-03 19:32:03+00:00,1367196087388418048,"If the #BidenBailout passes the U.S. Senate, Tennessee seniors stand to lose $8.4 billion in Medicare cuts over the next 10 years.",DesJarlaisTN04
226,2021-03-03 17:39:28+00:00,1367167758056779784,Great work by the TBI! 150 missing children recovered over the course of a month. Operation Volunteer Strong was successful because of their partnership with other state and local agencies. You have made our state safer! https://t.co/byFGJI4DR1,DesJarlaisTN04
227,2021-03-03 15:32:05+00:00,1367135698885750784,This is an important analysis with statistical backing on how voter ID and mail-in ballot laws compare across other developed countries by the Crime Prevention Research President John R. Lott. https://t.co/HSQxk6K5tS,DesJarlaisTN04
228,2021-03-03 12:14:06+00:00,1367085873460838400,Happy 106th birthday to the @navy_reserve! Americans are humbled and honored to have such brave men and women serve our country. https://t.co/RBSh34JazC,DesJarlaisTN04
229,2021-03-02 20:48:30+00:00,1366852941081153539,"📚 For National Read Across America Day the Library of Congress has put together numerous resources for families to enjoy and celebrate this day together. 

You can find these resources at https://t.co/xPRB8JGf0U",DesJarlaisTN04
230,2021-03-02 13:16:39+00:00,1366739226675589130,I want my constituents in the Fourth District to know I stand opposed to any legislation that leaves our election system vulnerable.,DesJarlaisTN04
231,2021-03-02 13:16:38+00:00,1366739225949921280,We have a tough fight ahead of us today. Conservative lawmakers will attempt to offer amendments and convince our colleagues on the other side of the aisle to look at how dangerous this will be to our election security.,DesJarlaisTN04
232,2021-03-02 13:16:38+00:00,1366739225262055428,"Under this legislation the D.C. Swamp will be given sole authority and central control of election regulation, which belongs to the states. It also takes away voter ID laws, gives 16-year-olds the right to vote and government matches campaign donations from your tax dollars.",DesJarlaisTN04
233,2021-03-02 13:16:38+00:00,1366739224259686401,"Today the House will begin consideration of H.R. 1, For the Politicians Act.

This bill seeks to weaken our democracy by overhauling our election system.",DesJarlaisTN04
234,2021-03-01 14:04:44+00:00,1366388940429807617,"I joined @HeatherChilders &amp; @BobSellersTV on @newsmax last week to discuss the ridiculous protection of Fort Pelosi. 

Watch here ⬇️ https://t.co/0FHcrGoGk9",DesJarlaisTN04
235,2021-03-01 01:52:52+00:00,1366204758831284229,"President Trump’s speech tonight was  spot on. It is on myself and all elected officials to stand up to the radical leftist agenda that over the last 39 days has put America last. Thank you for your leadership tonight, President Trump! Patriots across the country are hopeful. https://t.co/UNJZH9ZLXy",DesJarlaisTN04
236,2021-02-27 15:58:23+00:00,1365692767494696962,My statement on Pelosi’s Payoff to Progressives Act. https://t.co/8xEb8e8fiF,DesJarlaisTN04
237,2021-02-26 21:06:43+00:00,1365407972344619008,"For those who have consulted with their doctor and made the decision to receive the coronavirus vaccine—there is a walk-in COVID-19 vaccine clinic at the TVHS Nashville and Murfreesboro locations tomorrow from 8 a.m.-3 p.m.

Read more details here ⬇️ https://t.co/4W186DtMLz",DesJarlaisTN04
238,2021-02-26 17:27:10+00:00,1365352721180733450,"With DOD officials on record saying there are no credible threats, it’s time the @USNationalGuard return home after serving admirably.",DesJarlaisTN04
239,2021-02-26 17:27:09+00:00,1365352719360401410,"Everyday I receive more and more calls, texts and emails asking how much money Congress is spending to protect Fort Pelosi, so I joined several other members in asking these very questions to the House Speaker and Defense Secretary Austin. https://t.co/BNpMYbHk3v",DesJarlaisTN04
240,2021-02-25 21:47:28+00:00,1365055841494331399,"I voted no on H.R. 5. 

This piece of legislation did anything but provide more equality. 

It sought to encroach on the religious freedoms of churches, schools, and other faith-based institutions. It is not the role of government to force individual values upon people of faith.",DesJarlaisTN04
241,2021-02-25 17:22:57+00:00,1364989274492440576,"Only 9% of the #BidenBailout goes directly to COVID relief.

Outlandish spending in the $1.9 TRILLION plan:
-$670 BILLION NOT being spent this year 
-$12 BILLION in foreign aid
-$112 MILLION for Pelosi’s Silicone Valley underground rail
 
More @GOPpolicy: https://t.co/oWKLXXVcHu",DesJarlaisTN04
242,2021-02-25 15:36:04+00:00,1364962372771790848,"I met with @WorldWar2Salute National Chairman Bill McNutt and National Board Member Scott Mexic who are advocating for President Biden to sign off on a state funeral for the last surviving Medal of Honor recipient from WWII. 

I have given them my full support! https://t.co/CbwIA5ASGK",DesJarlaisTN04
243,2021-02-25 14:16:04+00:00,1364942240792141828,"Some of my staff will be back out in Bedford County today for our weekly mobile office day. 

Come out from 10-11AM to discuss your legislative or casework concerns! https://t.co/O5s8wJazYS",DesJarlaisTN04
244,2021-02-24 20:21:21+00:00,1364671782507204611,"UPDATE: With the ongoing House hearing regarding Newsmax, Fox, OANN and other conservative news outlets I will be rescheduled to appear on another day soon. https://t.co/iSkQa2BC4W",DesJarlaisTN04
245,2021-02-24 18:17:05+00:00,1364640508828614659,"I’ll be joining @BobSellersTV &amp; @HeatherChilders on @newsmax today at 3:15 EST/2:15 CST. 

Make sure to tune in! 📺",DesJarlaisTN04
246,2021-02-23 16:05:54+00:00,1364245104635088907,"The #BidenBailout is a partisan political prop. Roughly $1 TRILLION is sitting in the bank, unspent from the last COVID relief bill. I’m hard-pressed to find a reason another $1.9 TRILLION is needed when we haven’t used all the money from the first round.
https://t.co/nNR9zIyQzW",DesJarlaisTN04
247,2021-02-23 13:21:55+00:00,1364203836680855553,I joined some of my House colleagues &amp; sent a letter to Biden warning him about the dangers of his far-left immigration policies. The US is taking steps to end the pandemic. A loose border protection plan will put American lives at risk. We must protect our citizens first. https://t.co/u729cXxEKA,DesJarlaisTN04
248,2021-02-22 00:57:08+00:00,1363654020968177665,"The @SBAgov is conducting a webinar for Tennesseans on the PPP &amp; EIDL.

This is a free webinar. The next one is tomorrow, but there are multiple dates available. See the link for more details. https://t.co/4Ccee9cizY",DesJarlaisTN04
249,2021-02-21 17:15:27+00:00,1363537831562461196,@chuck4congress Thank you!,DesJarlaisTN04
250,2021-02-19 19:38:20+00:00,1362849016569069568,Optimistic news coming out about the COVID-19 vaccine! New studies find that one dose of the vaccine is up to 85% effective in preventing the disease &amp; can be stored in normal freezers. Let’s continue this research in hope for a quick return to normal life!https://t.co/wpKNPlhy2i,DesJarlaisTN04
