,Datetime,Tweet Id,Text,Username
200,2021-11-24 15:00:22+00:00,1463522887915249667,"We value American children and their parents, and are using reconciliation to drastically lower child care costs and provide access to preschool for every kid.",GerryConnolly
201,2021-11-24 15:00:21+00:00,1463522886904336391,"We value working Americans, and are using reconciliation to cut their taxes—not the super-rich.",GerryConnolly
202,2021-11-24 15:00:21+00:00,1463522885943926789,"Republicans have stated their values loudly and clearly. 

But here are the values that @POTUS and @HouseDemocrats fighting for.",GerryConnolly
203,2021-11-24 15:00:21+00:00,1463522884975050753,"When Republicans last used the budget reconciliation process, it was to pass a $2 trillion tax cut for corporations and the ultra-wealthy.
 
Before that, they used it to rip health care away from more than 20 million Americans.",GerryConnolly
204,2021-11-24 15:00:20+00:00,1463522883167260679,"When I served in local government, I helped to write and pass 14 consecutive budgets.

If I learned one thing from that process, it’s that budgets truly are statements of values.

Thread:",GerryConnolly
205,2021-11-23 23:02:43+00:00,1463281890547453955,"Are you over 18? Has it been six months since your second Pfizer or Moderna shot? Or two months since your J&amp;J shot?

Your level of protection is starting to diminish — stay safe with a booster shot!

https://t.co/azyWiw1eV9",GerryConnolly
206,2021-11-23 21:47:35+00:00,1463262982465630208,"The fascists and white supremacists who stormed the Capitol on January 6th planned for violence. There is no doubt about it. 

The January 6 Select Committee will leave no stone unturned in its pursuit of truth and justice. https://t.co/mXr3gSEpNE",GerryConnolly
207,2021-11-23 18:31:23+00:00,1463213606888218625,It’s time to catch up with the rest of the world. It’s time for paid leave in America. #BuildBackBetter,GerryConnolly
208,2021-11-22 22:16:56+00:00,1462907981113270278,"The #BuildBackBetter Act will change lives. But it can only do so quickly if it’s implemented well — and that comes down to dependable IT.

I made sure BBB included provisions to bolster federal IT — including $250m for the Technology Modernization Fund👇

https://t.co/CaoUXibg1o",GerryConnolly
209,2021-11-22 15:06:55+00:00,1462799761778647046,"Federal employees remain ready to serve—with public health at the forefront.

Already, 95% of feds are in compliance with vaccine mandates that go into effect today. Some agencies are near 100% compliance.

(Thank you, @POTUS!)

https://t.co/rBgEQfPCDO",GerryConnolly
210,2021-11-21 00:46:05+00:00,1462220739906519044,"On this Transgender Day of Remembrance, we remember the lives cut short by bigotry and violence. And we recommit ourselves to fighting for the right to live authentically—for every American.",GerryConnolly
211,2021-11-20 16:49:59+00:00,1462100923174506499,"Hosting my 13th annual Open Season town hall for federal employees, federal retirees and veterans. This forum features a panel of experts, Walt Francis and Edward DeHarden, who have decades of experience in this area. https://t.co/BHWpFIbE0I",GerryConnolly
212,2021-11-20 01:21:35+00:00,1461867284914389004,"Today’s verdict is a miscarriage of justice. Vigilantism endangers everyone, and those who celebrate this decision further the threat. 

We must not lose hope and choose instead to continue our push for progress.",GerryConnolly
213,2021-11-19 23:06:42+00:00,1461833338814087176,"Let me make sure it’s sinking in. This would be a monumental achievement in and of itself for any Congress. 

But we’re doing it with universal pre-k.

And expanded health coverage.

And paid leave.

And the largest investment to fight climate change in history.

And much more. https://t.co/u85pEcnzt3",GerryConnolly
214,2021-11-19 22:52:28+00:00,1461829758107492361,"Under the #BuildBackBetter Act, you won’t pay more than $35 per month for insulin.",GerryConnolly
215,2021-11-19 15:43:24+00:00,1461721781614661635,"I am tickled pink that two DeJoy enablers have been replaced and thank President Biden for his leadership. This action is a good thing for the Postal Service and, most importantly, a great thing for the American people. https://t.co/4YqB12h0TJ",GerryConnolly
216,2021-11-19 15:00:34+00:00,1461711002232315907,"The moment we’ve been waiting for, folks:

The Build Back Better Act: ✅",GerryConnolly
217,2021-11-19 14:45:58+00:00,1461707325971050502,We’re Building Back Bettah! https://t.co/KRYqfiLTdk,GerryConnolly
218,2021-11-19 13:37:52+00:00,1461690187260612617,"Good morning. @HouseDemocrats are about to pass universal pre-k, lower prescription drug costs, paid family leave, expanded health coverage, middle class tax cuts, and the biggest effort to fight climate change in history. 

A good morning, indeed.",GerryConnolly
219,2021-11-19 04:32:08+00:00,1461552851671519233,"BREAKING: Early first look at tomorrow's front page.

cc. @GOPLeader https://t.co/pkBXgN34wy",GerryConnolly
220,2021-11-19 00:07:04+00:00,1461486143057371136,"Budgets are statements of values. 

GOP budgets have slashed taxes for the wealthy and ripped health care from 20m Americans. Those are their values. 

Today, Democrats are cutting taxes for working Americans, expanding health care, and lowering costs. Those are our values. https://t.co/K8n28vyosn",GerryConnolly
221,2021-11-18 20:53:10+00:00,1461437347711668229,"Let me say it again for the people in the back:

📢📢 We are the only major economy IN THE WORLD to have already exceeded our pre-COVID levels of GDP 📢📢 https://t.co/ottYJDl3nh",GerryConnolly
222,2021-11-18 20:34:24+00:00,1461432623427985409,"Virginia and the Biden-Harris Administration are taking collective action to address maternal mortality head-on. 

This is fantastic news. https://t.co/8CdkcOTEk8",GerryConnolly
223,2021-11-18 18:22:13+00:00,1461399358205829126,"The #BuildBackBetter Act is lifechanging.

Expanded Child Tax Credit.
Child care &amp; universal pre-K. Expanded health coverage.
Lower prescription drug costs. 

These investments will raise the quality of life and lower the cost of living for parents &amp; kids across the country.",GerryConnolly
224,2021-11-18 16:11:03+00:00,1461366352497844224,"The NATO Parliamentary Assembly stands in total solidarity with Ukraine. We continue to firmly support its independence, sovereignty, and territorial integrity.  

My full statement:

https://t.co/LU7r53nMYu @natopapress",GerryConnolly
225,2021-11-18 00:46:44+00:00,1461133737492721666,"A few days ago, @RepGosar posted an animated video wherein he kills @AOC and threatens President Biden.

Today, @GOPLeader—and I use “leader” very lightly—couldn’t even bring himself to condemn this vile conduct.

The @HouseGOP took the hint. 99% voted against Gosar’s censure.",GerryConnolly
226,2021-11-17 17:19:32+00:00,1461021195730657288,"Raise your hand if you’re excited for new and improved roads &amp; bridges, universal access to high-speed internet, cleaner drinking water nationwide, and huge investments in public transit

🙋‍♂️🙋‍♂️🙋‍♂️",GerryConnolly
227,2021-11-17 14:36:22+00:00,1460980134165553153,"After a year of self-dealing and deliberate sabotage, PMG DeJoy was rewarded with a bonus! No one in Congress and no American supports this. This is a failure of leadership and yet another reason DeJoy and the Chairman of the Board must be removed.

https://t.co/K3EALy7vPw",GerryConnolly
228,2021-11-16 13:49:24+00:00,1460605925870518283,"🚧 Road &amp; bridge repairs
✈️ Port &amp; airport improvements
🚉 Huge public transit investments
🚰 100% lead pipe replacement
🔋 Electric vehicle charging network
💻 High speed internet for all
💉Mass COVID testing and vaccines
💵 Stimulus checks &amp; CTC payments

Democrats deliver.",GerryConnolly
229,2021-11-15 20:29:22+00:00,1460344193105207305,"After four years of broken promises and more “Infrastructure Weeks” than I can count, President Biden is about to sign into law the single most significant investment in American infrastructure in a generation. 

Trump promised, but #BidenDelivers.",GerryConnolly
230,2021-11-15 18:04:15+00:00,1460307675686780936,"Together, @POTUS and Democrats in Congress expanded the #ChildTaxCredit and set up monthly payments to millions of American families. 

Today is the last day for non-filers to sign up for the monthly payments, so don't miss out!

Sign up here: https://t.co/FOmvozI3LY",GerryConnolly
231,2021-11-15 17:20:41+00:00,1460296711168040965,"Looking forward to joining @POTUS at the White House this afternoon as he signs the historic Bipartisan Infrastructure Deal into law. 

From repairing roads and bridges to ensuring access to high-speed internet for all, this legislation is a huge win for Virginians. https://t.co/UXLWR9dg3d",GerryConnolly
232,2021-11-15 00:00:14+00:00,1460034872723087365,"Excited to be back with the Fairfax County Federation of Citizens Association for their Annual Citizen of the Year Awards Banquet. Congratulations to all the honorees, &amp; a special congratulations to the 2019 and 2020 Citizen of the Year! https://t.co/K8SxDgoDLH",GerryConnolly
233,2021-11-14 02:14:46+00:00,1459706340092301312,"When we say the #BuildBackBetter Act will transform lives, this is what we mean 👇🏘 https://t.co/7FKScZnVnY",GerryConnolly
234,2021-11-12 22:45:51+00:00,1459291379092406276,"Let this be a warning to others who refuse to share information and testimony demanded by congressional subpoena. 

American rule of law will be enforced. 

https://t.co/YsfhfmB2up",GerryConnolly
235,2021-11-12 17:26:36+00:00,1459211035899015168,"The #BuildBackBetter Act will expand access to free, high-quality pre-K to an additional 142,882 kids in Virginia—setting them up for lifelong success (and saving their parents thousands of dollars).

Let's get it done. https://t.co/YZPhJDPiuX",GerryConnolly
236,2021-11-11 16:32:49+00:00,1458835112158769157,"Thank you VFW Post 8469 &amp; American Legion Post 177 for hosting a great Veteran’s Day Ceremony. Today we honor &amp; remember those who have defended our democracy. As a nation, we have a sacred obligation to care for both our veterans and their families. Thank you to all who served. https://t.co/xIo6M3X0K7",GerryConnolly
237,2021-11-11 14:33:38+00:00,1458805120234311688,To all who have answered the call to serve — thank you. Happy #VeteransDay  🇺🇸 https://t.co/wT7T4JnqyB,GerryConnolly
238,2021-11-11 12:11:20+00:00,1458769307308068866,"This #VeteransDay, we remember the brave men &amp; women who gave their lives in service to our country and pledge to honor their sacrifice—today and every day. https://t.co/OoF8icIjvq",GerryConnolly
239,2021-11-10 01:30:13+00:00,1458245580434690051,"Things fall apart; the centre cannot hold;
Mere anarchy is loosed upon the world,
The blood-dimmed tide is loosed, and everywhere
The ceremony of innocence is drowned;
The best lack all conviction, while the worst
Are full of passionate intensity...
—William Butler Yeats",GerryConnolly
240,2021-11-09 20:03:24+00:00,1458163331945181188,"You are a disgrace to the country and the Congress, @RepGosar. I am genuinely ashamed to call you a colleague.

Deal with this, @GOPLeader.

https://t.co/baEbD2oONq",GerryConnolly
241,2021-11-09 14:13:33+00:00,1458075291608395783,"Doctors and nurses were wearing trash bags, Kellyanne. https://t.co/7FjPZlgRA1",GerryConnolly
242,2021-11-08 15:01:27+00:00,1457724955706155015,"NARRATOR: Pelosi did, in fact, have the votes. https://t.co/rxnpFeJ2dV",GerryConnolly
243,2021-11-08 14:32:02+00:00,1457717552415711233,"We’re building back better to the tune of 700,000 new jobs a year.

Thank you, @POTUS. https://t.co/G4zJiTEm0P",GerryConnolly
244,2021-11-07 22:25:52+00:00,1457474409837518851,"Extreme weather events cost Virginians up to *$10 billion* in damages over the last decade.

Our infrastructure deal takes unprecedented steps to protect us from and prevent the effects of climate change. https://t.co/4w5cSypCOc",GerryConnolly
245,2021-11-07 21:34:03+00:00,1457461371512184838,"ICYMI, Joe Biden just secured reliable, high-speed internet for every single American. https://t.co/cCpek8EbAD",GerryConnolly
246,2021-11-07 13:58:17+00:00,1457346670799294476,Thank you Supervisor @KennyBoddye. Let’s get this done for PWC! https://t.co/9qsIyM31Af,GerryConnolly
247,2021-11-06 20:37:18+00:00,1457084698870566918,"Last night's Infrastructure bill is a huge win for Virginia, especially for Metro. 

From @washingtonpost

""The infrastructure package includes Connolly’s legislation, the Metro Accountability and Investment Act.""

https://t.co/tuMnqufdRo",GerryConnolly
248,2021-11-06 20:02:08+00:00,1457075848947765250,"History says don’t hope
On this side of the grave
But then, once on a lifetime
The longed for tidal wave
Of justice can rise up
And hope and history rhyme
— Seamus Heaney, Irish poet",GerryConnolly
249,2021-11-06 04:18:52+00:00,1456838470886903815,"Tonight, we did what the previous Administration tried and failed to do for four long years.

The biggest infrastructure investment in decades will soon be law.",GerryConnolly
250,2021-11-06 03:30:59+00:00,1456826418889908230,Pass the Infrastructure Investment and Jobs Act: ✅,GerryConnolly
