,Datetime,Tweet Id,Text,Username
191,2021-11-30 14:06:14+00:00,1465683593968111620,"The Biden Admin can't even hide their disdain for everyday Americans anymore. 
 
Amid an inflation crisis, energy crisis, and chip shortage, the Rhodes Scholar's big idea is working families should cough up cash for an expensive EV...
https://t.co/rcaUQEjtvd",GReschenthaler
192,2021-11-29 22:00:01+00:00,1465440436676345862,"Seniors and working families are paying the price for Biden's war on energy. 
https://t.co/gjIjGag6Cg",GReschenthaler
193,2021-11-29 19:01:28+00:00,1465395503361835015,"314 days into his presidency and illegal immigration is still surging in Joe Biden's America.
https://t.co/BYy1u8FB4a",GReschenthaler
194,2021-11-28 22:00:01+00:00,1465078048491851777,"As the first candle is lit tonight, I want to wish everyone a happy Hanukkah. 
 
I hope you have a joyous and safe holiday filled with blessings for you and your family. 
 
Chag Sameach. https://t.co/O4NzvjuugN",GReschenthaler
195,2021-11-25 15:00:01+00:00,1463885189323661314,"Happy Thanksgiving. I hope you enjoy a safe and relaxing holiday with your family.
 
I am incredibly thankful for this time with my family as we reflect on this year's blessings. 
 
And to our service members, thank you for sacrificing this time with your families to defend us. https://t.co/vz2VLPhYJr",GReschenthaler
196,2021-11-24 23:00:00+00:00,1463643594091380736,"I understand the pain you're feeling this holiday season. 
 
I understand the pain you're feeling at the pump and the grocery store.
 
I am doing everything I can in Congress to stop the reckless spending and policies crushing our communities. 
https://t.co/tUQyf5spIc",GReschenthaler
197,2021-11-24 17:00:01+00:00,1463552998584455170,"I'm honored to receive a 100% on my @HumaneSociety scorecard. 
 
I will never stop fighting to end animal cruelty. 
https://t.co/gGGfbrkVHF",GReschenthaler
198,2021-11-23 23:00:01+00:00,1463281211623690240,"While Americans pay astronomical airfare prices or wait for hours to clear TSA, Biden is rolling out the red carpet for illegal immigrants. 
 
He's made it harder to see your family over the holidays yet prioritizes lawbreakers.
 
It's a slap in the face. 
https://t.co/4Tx19ef3PS",GReschenthaler
199,2021-11-23 17:00:00+00:00,1463190609942962181,"If you ever want to know the progressive left's vision for the country, look to San Francisco. 
 
Brazen mobs looted scores of retail stores before the holiday shopping season. 
 
SF Democrats' answer? 
 
Limit vehicle access to the shopping district...
https://t.co/vz4lU7temy",GReschenthaler
200,2021-11-22 23:00:01+00:00,1462918820721397764,"“The Party told you to reject the evidence of your eyes and ears. It was their final, most essential command.”
 
- George Orwell, 1984
https://t.co/1VdEJbZKBM",GReschenthaler
201,2021-11-22 16:41:52+00:00,1462823657408020484,"307 days into his presidency and crime is still surging in Joe Biden's America. 
https://t.co/yQHkrz3wE9",GReschenthaler
202,2021-11-21 23:00:02+00:00,1462556437247369218,"Biden insists we're just in a friendly competition with China.
 
Nothing about this is friendly.
 
The United States is a beacon of freedom.
 
China is a brutal authoritarian regime.
https://t.co/wg0ST44PcG",GReschenthaler
203,2021-11-21 17:00:02+00:00,1462465840708825089,"Dems ignored critical investments in real transportation needs.
 
Less than half of this new spending goes towards traditional infrastructure. 
 
This bill puts billions into slush funds and promotes crony capitalism by subsidizing EV charging stations.
https://t.co/3jn0RUd1iF",GReschenthaler
204,2021-11-20 17:00:00+00:00,1462103446031536131,"It's great to hear Covestro will partner with Pitt to create a Circular Economy Program, the first of its kind in the U.S.
 
This cutting-edge graduate program will ensure Pittsburgh remains a center of innovation for generations to come.
https://t.co/Znj1cQofhY",GReschenthaler
205,2021-11-19 14:52:52+00:00,1461709060915486724,"Americans are experiencing the highest inflation in 31 years, &amp; it's a direct result of Biden &amp; Dems’ reckless spending.

Their willingness to add $800B to the national debt over the next 5 years is irresponsible.

This is money we do not have, for policies Americans do not want.",GReschenthaler
206,2021-11-19 14:00:02+00:00,1461695767840763908,"The Biden Admin congratulated itself for issuing new testing and vaccination requirements for foreign visitors. 
 
Meanwhile, illegal immigrants don't face the same requirements at our border.
 
That's why I joined @Rep_Clyde's letter asking when this will change. https://t.co/9Rv9RpOElT",GReschenthaler
207,2021-11-18 23:22:53+00:00,1461475026134355976,"Americans are facing the most expensive Thanksgiving on record.
 
Yet here we are, about to consider the most expensive bill in American history.
 
Instead of addressing the problems facing Americans, Dems are doubling down on policies that'll make Biden’s economic crisis worse. https://t.co/nZHztOffNc",GReschenthaler
208,2021-11-18 21:01:01+00:00,1461439322658422787,"Biden may have campaigned as a unifier, but his vaccine mandate pits Americans against one another.
 
It's an illegal overreach that punishes our neighbors and small business owners.
 
I'm proud to join @RepFredKeller's Congressional Review Act to nullify the mandate. https://t.co/Rp26MY1rZx",GReschenthaler
209,2021-11-18 18:44:29+00:00,1461404964920647681,"COMING UP: I’ll be joining American Agenda on @Newsmax TV to respond to disturbing new numbers on the Opioid Crisis.
 
Tune in below at 3:15 PM.
 
➨ Xfinity Ch. 1115
➨ DirecTV Ch. 349
➨ DISH Ch. 216
➨ FiOS Ch. 615
➨ U-verse Ch. 1220
https://t.co/JGaiiN4afv",GReschenthaler
210,2021-11-18 15:27:03+00:00,1461355276456501252,"For the first time, more than 100k Americans died from drug-related deaths in 12 months.
 
There are now more overdose deaths from fentanyl than there were from all drugs in 2016.
 
Draconian lockdowns and the #BidenBorderCrisis have deadly consequences. 
https://t.co/0kzO6Nb0vk",GReschenthaler
211,2021-11-17 23:30:00+00:00,1461114427961327619,"In Democrats’ “Infrastructure” bill, they only spend $2B upgrading U.S. ports.
 
To give you some perspective, Singapore committed $20B to upgrade ONE port.
 
Democrats aren’t serious about infrastructure - just handouts to wealthy elites for EVs.
https://t.co/blmo4Y39bc",GReschenthaler
212,2021-11-17 20:47:30+00:00,1461073534915158016,"This is sickening. Petty tyrants know no bounds.

It's another example of why we must stand up to petty tyrants in our local, state, and federal government pushing COVID-zero, draconian lockdowns, vaccine mandates, and senseless masking policies.
https://t.co/H5QGH4rY2j",GReschenthaler
213,2021-11-17 19:06:07+00:00,1461048019294560259,"The real meaning of BBB isn’t Build Back Better, it’s Building Bigger Bureaucracy.",GReschenthaler
214,2021-11-17 15:41:24+00:00,1460996502856380419,"""Don’t tell me what you value, show me your budget, and I’ll tell you what you value.”
 
- Joe Biden 
https://t.co/TCLFbTJNy5",GReschenthaler
215,2021-11-17 00:00:00+00:00,1460759589046009857,"“I can’t think of a single [price] that has either stayed the same or gone down,” – Tyson Foods CEO
 
301 days into his presidency and inflation is still surging in Joe Biden's America.
 
https://t.co/hIuzYzN3Ww",GReschenthaler
216,2021-11-16 22:30:38+00:00,1460737102052827140,"Another day, another lie from the Biden White House.
 
Biden's tax and spend agenda can't pay for itself - it's $280 billion short.
 
That isn't a clerical error. It's deliberate.
 
Biden and Congressional Democrats tried to pull a fast one and got caught.
https://t.co/7wYRi0jb5x",GReschenthaler
217,2021-11-16 21:08:06+00:00,1460716329179176962,"A president's #1 responsibility is keeping Americans safe.
 
Instead, Biden created a humanitarian crisis and put Americans in danger. https://t.co/b4pVU3YUaY",GReschenthaler
218,2021-11-15 19:10:44+00:00,1460324404546752514,"The Biden Admin this Summer: 
 
❌ Skyrocketing inflation was ""transitory"" 
❌ ""The virus is on the run"" 
❌ A Taliban takeover was ""not inevitable"" 
 
Even the Washington Post recognizes Biden has been catastrophically wrong about everything. 
https://t.co/wIaqvShIhP",GReschenthaler
219,2021-11-15 16:45:13+00:00,1460287784124616708,"It's no surprise Biden's weakness resulted in further tragedies in Yemen.
 
It's clear, Americans and our allies are less safe with Joe Biden at the helm.
 
The media's refusal to cover this is just the latest example of their efforts to cover for Biden.
 
https://t.co/nUirfych26",GReschenthaler
220,2021-11-14 23:00:01+00:00,1460019718404784129,"Biden insisted he could deal with emerging threats in Afghanistan ""over-the-horizon.""

Now, the Biden Admin must beg for some semblance of capability in the region.

Biden's over-the-horizon plan was just lip service, and now America is less secure.

https://t.co/UOM75nEqSB",GReschenthaler
221,2021-11-14 17:00:00+00:00,1459929117269413893,"This is excellent news for our region.

Thank you to everyone in SWPA and across the country who decided to donate.

This important landmark will continue to overlook the Allegheny River thanks to your generosity.

https://t.co/EBcYRRIezo",GReschenthaler
222,2021-11-13 23:00:01+00:00,1459657329033584646,"Biden claimed he'd be a unifier, but now he wants coworkers to spy and tattle on each other to enforce his unconstitutional vaccine mandate.

Encouraging Americans to expose each other and deprive those who do not comply of their livelihood is despicable.
https://t.co/dKqFZ1NVmb",GReschenthaler
223,2021-11-13 17:00:02+00:00,1459566736512933888,"Congratulations to Linda Hagyari of Legion Post 954 in Jefferson, Pennsylvania. 

Check out her story below ⬇️

https://t.co/YBKvuFvF5R",GReschenthaler
224,2021-11-12 20:00:00+00:00,1459249640516329475,"When 13 service members died in Afghanistan, Kristy Dubinsky used her talents to create moving portraits for their families. 
 
I was proud to recognize Kristy's story in the Congressional Record. 
 
https://t.co/YroKl1kIM1",GReschenthaler
225,2021-11-12 18:30:00+00:00,1459226993241718786,"Democrats want to subsidize and reward their wealthy donors at the expense of working-class families.
 
In their reconciliation package, millionaires and billionaires would see a tax cut next year due to an increase in the SALT cap.
 
https://t.co/zdzVGKybkM",GReschenthaler
226,2021-11-12 17:06:54+00:00,1459206077816389639,"The NBA loves China’s money more than they love freedom of speech and standing up against tyranny.
 
Stay strong, @EnesKanter. https://t.co/kp50RGEBqY",GReschenthaler
227,2021-11-11 14:00:02+00:00,1458796664110657542,"I want to wish everyone a Happy Veterans Day.

As a Navy vet, I'm proud to see our nation support our veterans. I'm extremely grateful for my time in the Navy and for all the brave men and women I served alongside.
 
You are true heroes. Thank you for preserving American freedom. https://t.co/IMDnmD5NVK",GReschenthaler
228,2021-11-10 16:29:54+00:00,1458471991120334855,"Happy 246th birthday @USMC.
 
Founded on November 10th, 1775, the #MarineCorps has defended our nation with distinction, even before our nation's founding.
 
Thank you to all the Marines who served, continue to serve, and their families. https://t.co/hVzOzl7mxy",GReschenthaler
229,2021-11-10 15:16:58+00:00,1458453636250488834,"𝗜𝗡𝗙𝗟𝗔𝗧𝗜𝗢𝗡 𝗜𝗦 𝗔𝗧 𝗔 𝟯𝟬 𝗬𝗘𝗔𝗥 𝗛𝗜𝗚𝗛.
 
It’s getting worse - not better.

Biden and Congressional Democrats failed the American people.
 
https://t.co/d0fNxmmKi9",GReschenthaler
230,2021-11-10 00:00:02+00:00,1458222881591136256,"PPI hit an all-time high thanks to Biden's mismanagement of our economy &amp; Democrats' insatiable appetite for reckless spending.

Sadly, it's working-class families, seniors on fixed incomes, &amp; small businesses that suffer the most from soaring inflation.
https://t.co/ELtJkIO2vj",GReschenthaler
231,2021-11-09 19:08:10+00:00,1458149431044460549,Liberal journalists would rather blame the American people than confront the failings of the man they helped elect. https://t.co/JUckv1wdQQ,GReschenthaler
232,2021-11-09 02:25:29+00:00,1457897101145292800,"""Reality exists in the human mind, and nowhere else. Not in the individual mind...only in the mind of the Party.""
 
""Whatever the Party holds to be the truth, is truth.""
 
- George Orwell, 1984 https://t.co/LbYjcuBLMJ",GReschenthaler
233,2021-11-08 21:40:50+00:00,1457825466300108800,Sound on 🔊 https://t.co/GwbKT96nd7,GReschenthaler
234,2021-11-08 18:44:05+00:00,1457780985399889923,"293 days into his presidency, and crime is still surging in Joe Biden's America.
https://t.co/0AsVEeRSCb",GReschenthaler
235,2021-11-07 23:00:01+00:00,1457483003559432194,"Dems insist they care about our climate but refuse to mention China.

We can't work towards real solutions without discussing the #1 polluter. 

Instead, Dems merely attack traditional domestic energy sources.

Their priorities are showing.
https://t.co/dgkE0jfUNy",GReschenthaler
236,2021-11-07 17:00:01+00:00,1457392408187097097,"As a Navy veteran, I am honored to recognize November as #MilitaryFamilyMonth.

When a loved one serves, their family serves too.

We are forever grateful for the sacrifices military families make to defend our nation. https://t.co/HMS4yOTOlU",GReschenthaler
237,2021-11-06 22:00:00+00:00,1457105513863319559,"I'm proud that my bill, the Confidentiality Opportunities for Peer Support (COPS) Counseling Act, passed the House.

Our nation's police officers deserve access to confidential &amp; private mental health resources.

This legislation will make sure they do.
https://t.co/bfpnbJexWa",GReschenthaler
238,2021-11-06 16:00:00+00:00,1457014915714228232,"Thank you to K-9 officer Obie who has protected our community since 2016.
His retirement from the Washington County Sheriff's office is well deserved.
https://t.co/mdNY9yjgyo",GReschenthaler
239,2021-11-06 04:09:17+00:00,1456836056775544834,"Tonight’s vote was nothing more than an attempt by Pelosi to pave the way for Dems’ socialist tax and spending spree that is estimated to cost $3.9T. 

While American families face record-high inflation rates, Democrats prioritize woke policies that will only make things worse. https://t.co/XmTotLTyps",GReschenthaler
240,2021-11-05 20:47:05+00:00,1456724776261652488,"Rewarding illegal immigrants who willingly broke the law is absurd.
 
Paying them more than the families of our fallen service members is reprehensible. 
 
Proud to join @RepMcClintock's effort as an original co-sponsor. 
https://t.co/QJd5KBJPwZ",GReschenthaler
241,2021-11-05 17:57:07+00:00,1456682000513966083,"House Democrats aren’t getting much done – but they are breaking records🎉

Just not records they should be proud of. 

Congrats to @SpeakerPelosi for holding the longest vote in modern Congressional history.

https://t.co/XIw3ZBROTd",GReschenthaler
242,2021-11-05 16:04:49+00:00,1456653740765761537,On days like today I’m glad to have the office dogs around. https://t.co/0NKETYISGx,GReschenthaler
243,2021-11-05 13:39:35+00:00,1456617188379533312,"Biden and Democrats always put China first, America last. https://t.co/CnaNbY2Cq1",GReschenthaler
244,2021-11-04 19:49:01+00:00,1456347772379140096,"Biden's #TurkeyTax will make it harder to gather around the Thanksgiving table with your family this year.
 
Prices are up:
 
Turkey📈 27% 
Potatoes📈13%
Carrots📈47%
Apples📈7.8%
Gas📈60%
Airfare📈18% 
 
While Americans struggle, Dems are spending taxpayer dollars with impunity.",GReschenthaler
245,2021-11-04 15:33:02+00:00,1456283351283810317,"A couple in NJ earning $1 million owes about $72,500 in state taxes – the exact SALT relief amount Dems included in their socialist spending spree.
 
Tell me again how this isn’t a giveaway to blue state millionaires?",GReschenthaler
246,2021-11-03 23:00:02+00:00,1456033456241233926,"Biden bet his reputation on the last week and failed miserably.
 
“I don’t think it’s hyperbole to say that the House and Senate majorities and my presidency will be determined by what happens in the next week.”
 
-Joe Biden, less than a week ago
 
https://t.co/4Yski9sbTA",GReschenthaler
247,2021-11-03 19:16:37+00:00,1455977231545733120,"Congress should not vote on a bill before we know its budgetary impact. 
 
I’m proud to join @RepTimBurchett on this critical effort. https://t.co/WPnI3brC0x",GReschenthaler
248,2021-11-03 17:06:35+00:00,1455944506906456069,"Democrats' latest socialist spending spree:      
 
➡️$420B in taxes on Main Street
➡️$800B in tax hikes on American businesses 
➡️A new tax on retirement plans 
 
Under their tax scheme, the U.S. tax rate would eclipse communist China's. 
 
Everyday Americans can't afford this.",GReschenthaler
249,2021-11-03 15:38:35+00:00,1455922360045998081,"Terry McAuliffe: “I don’t think parents should be telling schools what they should teach.” 
 
Biden’s Secretary of Education: parents are not the primary stakeholder in “determining educational programming.”  
 
Looks like Americans disagree.",GReschenthaler
250,2021-11-03 13:57:16+00:00,1455896863169814528,"Politico Playbook: ""A top aide to House progressives on the McAuliffe defeat: 'It’s absurd to blame progressives for Virginia. A) This was a culture war election, not about federal issues.'""

It is a culture war - and Democrats are losing.",GReschenthaler
