,Datetime,Tweet Id,Text,Username
95,2022-01-14 17:34:42+00:00,1482043510882807812,"This has been a good week for transparency—and a bad week for Dr. Anthony Fauci.
 
Check out my latest op-ed with @WhiteCoatWaste ⬇️
 
https://t.co/uQoXssMJe3",GReschenthaler
96,2022-01-14 15:13:17+00:00,1482007923295498252,"The Biden economy continues to crush working-class families and small business owners.

https://t.co/MGduAhChpK",GReschenthaler
97,2022-01-13 20:41:04+00:00,1481728024366415872,"Americans are too smart to believe the spin they get from the media and the White House.
https://t.co/aTlY9YxSWh",GReschenthaler
98,2022-01-13 19:44:41+00:00,1481713833332850694,"All vaccine mandates are unconstitutional.

RT if you agree. https://t.co/NEBKXhH1OX",GReschenthaler
99,2022-01-13 16:46:53+00:00,1481669090435641344,"Year-over-year average hourly pay is down 2.4%.
 
Raises for American workers can't even keep pace with Bidenflation. 
 
Biden continues to stick the working-class with the bill for his reckless spending spree.   
https://t.co/5xpcRpefxm",GReschenthaler
100,2022-01-12 22:08:12+00:00,1481387562711322627,"American families' hard-earned dollars aren't going as far as they used to thanks to Biden's failures. 
https://t.co/BtfqJeVJuY",GReschenthaler
101,2022-01-12 17:53:35+00:00,1481323486249422858,"Americans have felt rising inflation for months, but the Biden Admin said they were crazy. 
 
Now, inflation has reached the highest level in 40 years. 
 
If you can't listen, you can't lead. 
https://t.co/NnZoOSS1oJ",GReschenthaler
102,2022-01-11 21:29:28+00:00,1481015427631398921,"Happy #NationalMilkDay to dairy farmers in PA14 and around the country. 
 
Thank you for all you do to provide for American families.",GReschenthaler
103,2022-01-11 19:57:51+00:00,1480992370653020162,"On #HumanTraffickingAwarenessDay, we recommit to finally ending this heinous practice. 
 
But we can't stop human trafficking without securing our southern border.
 
Any message of solidarity that doesn't mention our border is just lip service.",GReschenthaler
104,2022-01-11 18:46:57+00:00,1480974530478755855,"Closing schools has devastating effects on our students.
 
Loss of learning, dropping out, increased stress, and mental health problems are just a few.
 
@RepAshleyHinson's The Reopen Schools Act solves these problems by reopening our schools. ⬇ https://t.co/HUcR4Y2naP",GReschenthaler
105,2022-01-11 17:49:59+00:00,1480960191470395396,"Vaccine mandates needlessly divide families, pit neighbors against one another, and deny hardworking Americans a livelihood.
 
What vaccine mandates don't do - stop the spread of COVID.
https://t.co/nrCPy4vfNW",GReschenthaler
106,2022-01-10 21:20:49+00:00,1480650863152701442,"A year ago, anyone interested in this distinction was labeled a COVID denier.
 
Now, when Dems realize they're not beating the virus they politicized, the data is ""forthcoming.""
 
The ""party of science"" at work.
https://t.co/yQ5BIhK9iX",GReschenthaler
107,2022-01-09 23:00:00+00:00,1480313434210287619,"It's ridiculous that the IOC can't confirm this. 

It's wrong for the free-world to give the CCP an Olympic platform given what we know and disturbing information continues to come to light.
https://t.co/xY9prMonZf",GReschenthaler
108,2022-01-09 17:00:00+00:00,1480222836929306634,"On Law Enforcement Appreciation Day, I want to thank our officers.  

They put their lives on the line each day to keep our communities safe. 

I will always back the blue and fight for our nation's law enforcement in Congress.",GReschenthaler
109,2022-01-08 17:00:01+00:00,1479860452783972355,"Some retailers reported shoplifting now accounts for the equivalent of 2-3% of their total sales.

Nothing about this is normal. 

Democrats' soft on crime policies have consequences; brazen theft is only one of them. 

https://t.co/BHMtlkhAme",GReschenthaler
110,2022-01-07 20:00:02+00:00,1479543368166383619,"The left has created a society so steeped in virtue signaling and COVID zeal that four-year-olds are now being branded as unvaccinated. 
 
It's insane. https://t.co/hEb45vPnXI",GReschenthaler
111,2022-01-07 18:00:00+00:00,1479513160839151617,"Biden's economy – just like his presidency – continues to disappoint.
https://t.co/Ni4QqHoz8P",GReschenthaler
112,2022-01-07 16:33:23+00:00,1479491365285339139,"Biden's refusal to secure our border continues to endanger American families.
https://t.co/kvTCebnQb6",GReschenthaler
113,2022-01-06 13:57:32+00:00,1479089755249852420,"Republicans tried to have this conversation nearly two years ago. 
 
The mainstream media and teachers unions wouldn't let us.
 
They fought school reopenings at every turn but now have the audacity to act like they're sounding the alarm?
https://t.co/gUXvsi8VSr",GReschenthaler
114,2022-01-05 15:29:22+00:00,1478750478938873857,"The Biden Administration said this was a high-class problem.
https://t.co/izmWHO0gb4",GReschenthaler
115,2022-01-04 17:32:23+00:00,1478419047192707072,"Fentanyl is the leading cause of death for Americans aged 18-45.  
 
Biden created a border crisis which directly fuels this deadly trend. 

He still can't be bothered to care. 

Americans shouldn’t die for open borders or any other progressive pipe dream.
https://t.co/T6vknhJ2KI",GReschenthaler
116,2022-01-04 15:20:29+00:00,1478385856029278221,"It’s shocking Biden can even utter this while so many are struggling under the weight of inflation. 
 
He caused an economic crisis and wants to take a victory lap while Americans are suffering. 
 
It’s disgraceful. 
https://t.co/c8y8QhiySv",GReschenthaler
117,2021-12-29 23:00:00+00:00,1476327168066166790,"We are on track to experience the worst illegal immigration levels ever recorded on Biden's watch. 
 
Whenever his admin tells you our border is secure, they're lying.
 
Biden continues to lie about the crises he created.
https://t.co/tTbiHVTjqc",GReschenthaler
118,2021-12-29 17:25:15+00:00,1476242925747060742,"A diplomatic boycott was never enough. 

What's worse, Biden's confusing rollout of this half measure is arming CCP propagandists. 

He had an opportunity to deny the world's worst human rights abuser a platform.

Instead, he gave them a slap on the wrist.
https://t.co/RjPqd6LQXi",GReschenthaler
119,2021-12-28 23:43:03+00:00,1475975613601177600,"Meanwhile, Biden wants to give the IRS an additional 80 billion to spy on law-abiding Americans. https://t.co/6xDZvwLY31",GReschenthaler
120,2021-12-27 22:00:00+00:00,1475587294874771459,"The Biden Admin has been flying unvaccinated illegal immigrants across the country for months...
https://t.co/WCEzk1gMKa",GReschenthaler
121,2021-12-26 17:00:01+00:00,1475149410229235715,"What a great way to celebrate the legacies of Robert R. Forrest and Joyce Ellis, two of Washington's most prolific givers.
https://t.co/iMJaHfuKil",GReschenthaler
122,2021-12-25 17:00:01+00:00,1474787025748475914,"Merry Christmas!
 
I hope everyone has a joyous Christmas holiday surrounded by family.
 
I'd particularly want to recognize our service members who will not be able to celebrate at home this year.
 
Thank you for sacrificing this time with your families. https://t.co/tURREhv3zL",GReschenthaler
123,2021-12-24 17:00:02+00:00,1474424639199846401,"Veterans and volunteers in our area played an important part in continuing a beautiful American tradition.
 
Thank you to everyone who participated in Wreaths Across America this year.
https://t.co/TJ8UJtjFRx",GReschenthaler
124,2021-12-23 23:00:02+00:00,1474152850066448384,"You know things are bad when even the liberal Washington Post admits President Biden is responsible for the crisis at our southern border.
https://t.co/aOGjYVK4uI",GReschenthaler
125,2021-12-23 17:00:03+00:00,1474062256069648388,"The left will always put their progressive political agenda above legal standards and ethics.
 
Mischaracterizing a text message for political gain is appalling.

The fact that Adam Schiff isn't facing calls for his resignation shows you how radical the Democrat party has become. https://t.co/30Zw9lTbvB",GReschenthaler
126,2021-12-22 23:00:00+00:00,1473790452822421513,"After Hong Kongers took to the streets in droves to defend democracy, China wants us to believe communists swept the election…
https://t.co/wLEonQSSjd",GReschenthaler
127,2021-12-22 18:45:17+00:00,1473726350548770830,"School closures hurt working-class families hardest.

The affluent had pod schools, but everyday Americans were forced to help their kids through zoom classes and work to put food on the table.

Meanwhile, Dems were colluding with teachers unions to keep schools closed. https://t.co/pzmnCnRo5q",GReschenthaler
128,2021-12-20 21:27:43+00:00,1473042451954872325,"Biden’s constant refusal to secure our border continues to put American lives at risk.
 
https://t.co/jE6eNr5Qzk",GReschenthaler
129,2021-12-19 23:00:02+00:00,1472703296628482050,"Well, criminals think they can get away with it on her party’s watch…
 
https://t.co/4u992bEAYq",GReschenthaler
130,2021-12-19 17:00:01+00:00,1472612698076680192,"First responders &amp; teachers sacrifice so much for our communities.
 
Skyrocketing housing prices shouldn't stop them from realizing the American Dream.
 
That's why I co-sponsored @RepRutherfordFL's HELPER Act, which provides critical mortgage assistance. 
https://t.co/LGrNMmLIAa",GReschenthaler
131,2021-12-18 23:00:01+00:00,1472340905273307150,"Putin and Xi are having a grand ol’ time thanks to Biden's weakness.
 
https://t.co/Peuxs7WGXi",GReschenthaler
132,2021-12-18 18:00:54+00:00,1472265630804021256,"COMING UP: I’ll be joining @JosephPinion on @Newsmax TV to discuss how the Biden Admin conspired with special interests to keep schools closed even though the science said it was safe to get our kids back in the classroom.
 
Tune in below at 2:17pm.",GReschenthaler
133,2021-12-18 18:00:00+00:00,1472265406404386821,"Today we recognize National Wreaths Across America Day – a beautiful tradition. 
 
Volunteers across the country and around the world will place wreaths on our veterans’ graves. 
 
We will never forget their sacrifice. https://t.co/Uj46lSuFzI",GReschenthaler
134,2021-12-17 22:00:01+00:00,1471963417854590976,"Dems' war on energy is directly responsible for skyrocketing gas prices.
 
Biden tapped into our strategic oil reserves to save his party from the crisis they caused.
 
When Republicans proposed a plan to replenish it, Dems chose to double down on their war on energy instead. https://t.co/nO1UlomLjk",GReschenthaler
135,2021-12-17 20:14:36+00:00,1471936891498946569,"Woke policies have forced Americans in San Francisco to accept crime in their daily lives.
 
This is disgusting.
https://t.co/W29y6uDF07",GReschenthaler
136,2021-12-17 17:48:28+00:00,1471900113752702980,"No American family should have to bury a loved one because of this heinous drug.
 
We have to stop this scourge at the source.
 
That's why @SenToomey and I secured new punishments for fentanyl-producing countries in the FY2022 NDAA.
https://t.co/6kUWXzEgu6",GReschenthaler
137,2021-12-16 23:00:00+00:00,1471616125729390592,"Remember this story when the CCP downplays its authoritarianism during the Olympics.

They threatened the family of a Chinese grad student, some 7K miles away, for commemorating Tiananmen Square.

Thankfully Perdue fought against this predictable behavior from CCP sympathizers. https://t.co/AkZEbfQkKg",GReschenthaler
138,2021-12-16 20:09:03+00:00,1471573106296774663,"NYC's draconian and discriminatory vaccine and personal ID mandates clearly don't stop the spread.
 
They do stop the elites from dining with those they deem undesirable because of their personal beliefs and political affiliation.
https://t.co/C79eHbMtAB",GReschenthaler
139,2021-12-16 17:17:53+00:00,1471530031063220224,"Remember when Joe Biden assured us repeatedly that Build Back Better would cost zero dollars?
 
According to the CBO, it turns out it’ll add $3.5 trillion to the deficit over the next decade.
 
https://t.co/IhsEnRMIbQ",GReschenthaler
140,2021-12-16 00:00:01+00:00,1471268841242218496,"Hey Siri, what’s the definition of gaslighting? https://t.co/zoC3PsC7cz",GReschenthaler
141,2021-12-15 22:00:01+00:00,1471238643473793028,"Democrats supported efforts to defund the police and championed soft on crime policies. 
 
Now, they've forced Americans to account for their own safety. 
 
Any politician or DA that put law-abiding Americans in this position should be ashamed. 
https://t.co/4XwtYlA50e",GReschenthaler
142,2021-12-15 20:30:00+00:00,1471215989861851152,"Time and time again, the Biden Administration chooses to appease China without regard for our allies. 
 
It's shameful. 
https://t.co/t8FRTYsUHm",GReschenthaler
143,2021-12-15 19:06:32+00:00,1471194983579459589,"230 years ago today, the Bill of Rights became an integral part of our Constitution. 
 
I will never stop defending our God-given rights codified within it. https://t.co/YhMVaRclhO",GReschenthaler
144,2021-12-14 23:30:00+00:00,1470898901259468801,"Remember when Biden lied to us and ensured us inflation was “transitory?”
 
This Administration can be summed up in one word – incompetent.
 
https://t.co/2zahrrQJgj",GReschenthaler
145,2021-12-14 20:30:18+00:00,1470853677820915712,".@SteveScalise: ""We were exporting oil to our friends all around the world, helping our friends geopolitically… That was undermined when President Biden cut off the Keystone pipeline, cut off production of federal lands, but he greenlighted the Russian pipeline."" https://t.co/htdAJNrmPO",GReschenthaler
146,2021-12-14 20:15:54+00:00,1470850055137542146,"The Biden Administration continues to break records you don't want to break…
https://t.co/e41P8gggAI",GReschenthaler
147,2021-12-14 18:40:13+00:00,1470825974581313548,".@RepFredUpton: “Before this president came into office, the U.S. was more energy-independent than ever before… Today, America’s energy security is under siege by President Biden and the Democrats.” https://t.co/E0CtqVeA5q",GReschenthaler
148,2021-12-14 16:07:01+00:00,1470787421885378563,"The people of Philadelphia should not be subject to tyrannical vaccine requirements from a mayor who can’t follow his own guidelines.
 
No American should be banned from a restaurant for not having a covid vaccine.
 
https://t.co/zMpUqSroIF",GReschenthaler
149,2021-12-14 00:30:00+00:00,1470551611424579584,"Happy 385th Birthday to the Army National Guard.
 
Since 1636, the men and women of the @NationalGuard have dutifully served our country and their communities.
 
Thank you for your tireless service. https://t.co/ZmgcEWrH3q",GReschenthaler
150,2021-12-13 23:02:46+00:00,1470529661042053135,"Hardworking Americans continue to pay the price for Biden's disastrous economic policies. 
 
What's worse, his Twitter trolls insisted the average American was crazy and there was actually a ""Biden Boom."" 
 
Working families see through the lies. 
https://t.co/bgTRM5pQxS",GReschenthaler
151,2021-12-13 18:07:09+00:00,1470455265262714883,"You couldn’t find a better example of the absurdity of the zoom class and coastal elites if you tried…
 
https://t.co/Pz0NG2tvhr",GReschenthaler
152,2021-12-12 23:00:00+00:00,1470166576724729857,"Biden simply doesn't care that his unconstitutional vaccine mandates will put hardworking Americans on the street.
 
Even when they affect his beloved Amtrak, he's still unfazed.
 
Cold indifference has come to define his presidency.
https://t.co/jPJIrq2KOu",GReschenthaler
153,2021-12-12 20:00:01+00:00,1470121280091435015,"234 years ago today, Pennsylvania ratified the Constitution and became the second state.
 
While we weren’t the first in, we're still the best state in the Union. 
 
I am immensely proud to represent the people of Pennsylvania's 14th Congressional District in Washington, D.C.",GReschenthaler
154,2021-12-12 17:00:00+00:00,1470075979368333318,"The tyranny of Governor Wolf and Alison Beam has gone on long enough.
 
Regardless of how the court rules, we know these mandates are nonsensical, unscientific, and cruel.
 
PA's children have already lost far too much during this pandemic.
https://t.co/F0kna9EvCv",GReschenthaler
155,2021-12-11 22:00:01+00:00,1469789090027479040,"Joe Biden: the Neville Chamberlain of our time.
https://t.co/q1AqskGDOB",GReschenthaler
156,2021-12-11 17:00:01+00:00,1469713594661019654,"Our region's patriotism is a sight to behold.
 
I'm incredibly proud to see such a moving tribute to these 13 service members.
https://t.co/BmSwVs4Riv",GReschenthaler
157,2021-12-10 19:30:46+00:00,1469389144086482950,The Biden boom is a figment of the left’s imagination. https://t.co/zSacKXvawT,GReschenthaler
158,2021-12-10 19:00:01+00:00,1469381404978941953,"No American, especially those on the frontlines of this pandemic, should lose their livelihood over a personal medical choice. 
 
That's why I joined @RepJeffDuncan and demanded Biden halt his authoritarian mandate for CMS Providers. 
https://t.co/pYqzGH70Jw",GReschenthaler
159,2021-12-10 17:42:47+00:00,1469361969207652360,".@WHCOS is spouting propaganda from a flipchart of lies while 45% of all U.S. households experience financial hardship. 
 
Struggling Americans can't afford to entertain these fantasies.
 
They actually have to live with the reality of Biden’s crushing economic policies each day. https://t.co/e3RBqG4MOY",GReschenthaler
160,2021-12-09 22:00:02+00:00,1469064318276747272,"These 12 cities have something in common.

Anti-police, Democrat mayors.

Defunding and demoralizing police makes our communities less safe. https://t.co/yJXoniXCuT",GReschenthaler
161,2021-12-09 20:26:11+00:00,1469040704139808768,"This week, the Biden Admin demanded the media reshape coverage of their failed economic policies.
 
Looks like they answered the call.
https://t.co/w8QuF9wpIZ",GReschenthaler
162,2021-12-08 21:35:58+00:00,1468695876214398983,"Headlines like these are popping up across the country thanks to Democrats' soft on crime policies.
 
Joe Biden's backyard is no exception...
https://t.co/JfLGfc1MuB",GReschenthaler
163,2021-12-08 17:19:04+00:00,1468631225585782789,"The US tragically surpassed a record 100K overdose deaths this year. Most due to illicit fentanyl from countries like China.

I’m proud to announce @sentoomey &amp; I secured an amendment in the NDAA that will punish countries involved in the smuggling of deadly fentanyl into the US.",GReschenthaler
164,2021-12-08 14:28:48+00:00,1468588376987033605,The party of tolerance… https://t.co/m0HCjj82bX,GReschenthaler
165,2021-12-08 03:33:54+00:00,1468423563627610115,"This bill ensures servicemembers are able to defend our nation and take care of their families.
 
The NDAA will: 

➡️ preserve readiness
➡️ stop fentanyl from China
➡️ hold China accountable for their human rights violations
➡️ prevent dishonorable discharges over vaccine status",GReschenthaler
166,2021-12-08 03:33:54+00:00,1468423562734276609,"As a former Navy JAG, I'm proud to vote for National Defense Authorization Act.
 
It reverses Biden’s reckless defense cuts by authorizing $768.2 billion in funding and provides a 2.7 % pay raise for our troops.",GReschenthaler
167,2021-12-08 01:00:00+00:00,1468384836226359298,"The Biden Admin is patting themselves on the back for slapping China on the wrist.
 
This is nowhere near an appropriate response to flagrant human rights violations.
 
China shouldn't have the Olympic platform at all.
 
https://t.co/vb9A8XOjAm",GReschenthaler
168,2021-12-07 22:18:37+00:00,1468344221727924229,"John Kerry gallivants across the world on his private jet in the name of climate change, while Uyghur Muslims are held in reeducation camps and subjected to forced labor.

Which is more important, @SpeakerPelosi? 
https://t.co/TRJnU9yH7g",GReschenthaler
169,2021-12-07 19:14:55+00:00,1468297992838914051,"Biden thinking he can ""reshape coverage"" to change peoples' opinions towards his failed economic policies is insulting and shows just how out of touch he is with the suffering, struggles, and difficult choices facing American families and senior citizens.
https://t.co/zShLwrKa7d",GReschenthaler
170,2021-12-07 17:19:49+00:00,1468269026375839747,"Today, we remember the 2,403 Americans who died in the attack on Pearl Harbor 80 years ago. 
 
We also recognize the more than 16 million Americans who served during World War II. 
 
Without the selfless dedication of America's Greatest Generation, tyranny would have prevailed. https://t.co/gkWwcaInLL",GReschenthaler
171,2021-12-06 20:19:21+00:00,1467951817292189701,"“The past was erased, the erasure was forgotten, the lie became the truth.”
― George Orwell, 1984
https://t.co/sQkkSL5WeJ",GReschenthaler
172,2021-12-06 17:07:57+00:00,1467903652849455114,"Biden invited disaster at our southern border.
 
On average, more than 𝟏,𝟕𝟎𝟎 𝐢𝐥𝐥𝐞𝐠𝐚𝐥 𝐢𝐦𝐦𝐢𝐠𝐫𝐚𝐧𝐭𝐬 𝐚 𝐝𝐚𝐲 avoided apprehension by the Border Patrol in November.
 
This isn't safe or sustainable.
https://t.co/TpzHmbhx6o",GReschenthaler
173,2021-12-06 14:37:16+00:00,1467865729571733506,.@WHO I’ll do your job since you decided to kowtow to China’s brutal authoritarian leader and skip a letter in the Greek alphabet… https://t.co/SfEYyCYixD,GReschenthaler
174,2021-12-05 23:00:01+00:00,1467629864467550213,"The Biden Admin is taking cues from Jimmy Carter's playbook.
 
When you can't confront your failures, blame the American people.
 
It's shameful.
https://t.co/BT1yQWw8TT",GReschenthaler
175,2021-12-05 17:00:02+00:00,1467539269417795590,"The wrong decisions to institute draconian lockdowns and pay our workforce to stay home continue to have consequences for our neighbors, region, and country.
https://t.co/rugieBN2OV",GReschenthaler
176,2021-12-04 23:00:01+00:00,1467267475263959043,"Does this mean Democrats will finally make a serious attempt at fixing their supply chain crisis?
https://t.co/hn02CEJaZc",GReschenthaler
177,2021-12-04 17:00:01+00:00,1467176878645690372,"The LeMoyne Community Center has been an integral part of our community for 65 years.
 
Thanks to the extraordinary vision of the late Joyce Ellis, the center continues to serve the Washington area.
 
I'm so proud to represent it.
https://t.co/WZr6w7BfNx",GReschenthaler
178,2021-12-03 18:20:09+00:00,1466834658163937303,"42 names were added to the National Law Enforcement Officers Memorial this November.
 
It's a sobering reminder that each day, our law enforcement officers put their lives on the line, and some don't make it home.  
 
Thank an officer today. 
https://t.co/IfuFC3SQ9G",GReschenthaler
179,2021-12-03 17:10:17+00:00,1466817075926732813,"In November, the U.S. was expected to add 550,000 new jobs.
 
It turns out we fell short, adding only 210,000 jobs.
 
Biden always insists the buck stops with him.
 
So where is he?
https://t.co/2NBrbFxhOV",GReschenthaler
180,2021-12-02 22:23:44+00:00,1466533571108098052,"Thanks, @JoeBiden. https://t.co/ERt7HCfzQS https://t.co/iwFNZCIMeC",GReschenthaler
181,2021-12-02 21:14:08+00:00,1466516053614383109,"Working families are struggling because of Dems' reckless spending. 
 
45% of all U.S. households are experiencing financial hardship. 
 
71% of households making less than 40K say rising prices hurt them.
 
And Dems are plotting to spend more...
https://t.co/d68mpr9Ao7",GReschenthaler
182,2021-12-02 19:23:08+00:00,1466488121462333443,"We are ten months into the Biden Admin and the media is still resorting to their favorite pastime.

They belittled Operation Warp Speed and encouraged vaccine hesitancy, but somehow Trump is to blame.

They should do their jobs and stop covering for Biden.
https://t.co/wVucdQ1CS3",GReschenthaler
183,2021-12-02 17:53:47+00:00,1466465633009348615,"Defunding and demonizing law enforcement has deadly consequences.
 
Officers were ripped away from their loved ones, and record numbers of homicides, shootings, and other crimes are plaguing American communities.
 
This has to end.
 
https://t.co/xoooTvNPwQ",GReschenthaler
184,2021-12-01 21:56:12+00:00,1466164254122389506,"With the average shopper expected to pay 9% more this year &amp; inflation skyrocketing, it's no wonder Americans are taking on debt to put presents under the tree.

Dems had a chance to change course but doubled down on the policies that led to this instead.
https://t.co/WJVnBpBFgD",GReschenthaler
185,2021-12-01 16:47:16+00:00,1466086507152916485,"Amid an inflation crisis, crime crisis, energy crisis, border crisis, and supply chain crisis, Dems prioritized amnesty.
 
They're doubling down on issues that created the #BidenBorderCrisis and sending struggling Americans to the back of the line.
https://t.co/VGn1mkTG28",GReschenthaler
186,2021-12-01 01:14:08+00:00,1465851678226329600,"Hey @ChrisCuomo, sorry about your suspension. Maybe you could learn to code? https://t.co/Lj0sC5vFOp",GReschenthaler
187,2021-11-30 23:30:00+00:00,1465825470948151297,"DA Chisholm: ""Is there going to be an individual I divert...who's going to go out and kill somebody? You bet.""

Innocent lives shouldn't be collateral damage in progressive prosecutors' sick pursuit of woke fantasies.

Violent criminals belong behind bars.
https://t.co/0R1zohBRqA",GReschenthaler
188,2021-11-30 21:48:52+00:00,1465800019806670851,https://t.co/kKqFfrpyqY https://t.co/MuUGRxdqTF,GReschenthaler
189,2021-11-30 19:33:59+00:00,1465766075321266176,"Hey, @TheAtlantic. I fixed this for you. https://t.co/rLErugqSLH",GReschenthaler
190,2021-11-30 18:55:20+00:00,1465756347971035137,"Now is not the time to let up on one of the largest state sponsors of terrorism. 
 
That's why I joined @RepPatFallon in a letter demanding answers on the Biden Admin's plan to lift sanctions on Iran. https://t.co/dppSKMbRUb",GReschenthaler
