,Datetime,Tweet Id,Text,Username
0,2022-02-23 16:19:43+00:00,1496520154364231685,"The CDC is withholding data from the American public because they’re worried it’ll be misinterpreted.
 
Sounds like they’re not interested in following the science.
https://t.co/Re94DGaavR",GReschenthaler
1,2022-02-23 01:12:29+00:00,1496291840940781571,Here’s a thought: How about you reopen the Keystone Pipeline that you shut down on day one of your administration? https://t.co/8bpkcge99D,GReschenthaler
2,2022-02-23 00:37:13+00:00,1496282967714537472,"Proof that Russia always viewed Nord Stream 2 as a geopolitical weapon.
https://t.co/efpfNYLQfA https://t.co/xDuhyqJCqi",GReschenthaler
3,2022-02-22 20:07:30+00:00,1496215089342566400,"Biden promised swift and severe sanctions against Russia if Putin chose to invade Ukraine.
 
He's failed to deliver that.
 
Biden’s continued weakness will further embolden our adversaries and invite aggression around the globe.",GReschenthaler
4,2022-02-22 18:11:46+00:00,1496185965915918338,"The majority of Democrats are comfortable freezing the bank accounts of those they disagree with.
 
That is scary.
 
https://t.co/R4D6rdI1cY",GReschenthaler
5,2022-02-21 14:32:00+00:00,1495768270238060556,"Happy President's Day.

As the left tries to tarnish the legacies of Washington and Lincoln, this holiday couldn't be more important.

I hope you're able to spend quality time with family and friends.",GReschenthaler
6,2022-02-20 21:51:00+00:00,1495516359840518147,"There's now a dedicated helpline for PA farmers struggling with mental health.

If you or a loved one works in the agriculture industry and are facing a crisis, please call 833-897-2474. The line is staffed 24/7.

https://t.co/S9dhIXOgSQ",GReschenthaler
7,2022-02-20 16:04:00+00:00,1495429035157073923,"Thanks to Bidenflation, gas prices continue to rise.

Pennsylvanians are paying about $3.63 per gallon – 82 cents more than a year ago.

https://t.co/6u2TLQQYt5",GReschenthaler
8,2022-02-19 20:28:00+00:00,1495133084387356677,"All Americans should have access to affordable and reliable internet.

I'm proud that $1 million from the CARES Act that I voted for will go to Fayette County's initiative to provide free high-speed internet to folks living in extremely underserved areas.
https://t.co/9g4WIePuY3",GReschenthaler
9,2022-02-19 14:15:00+00:00,1495039215977091075,"Great news for Westmoreland County gun owners.

https://t.co/Mho5lNZPAF",GReschenthaler
10,2022-02-18 21:54:29+00:00,1494792461113335808,"A gun-control advocate highlighted by Obama and Joy Reid tried to murder a Jewish politician. 
 
The far-left raised $100k to bail him out. 
 
And the media is silent as another violent, would-be killer is released onto American streets.
https://t.co/DBzmoT4sB3",GReschenthaler
11,2022-02-18 19:39:25+00:00,1494758471513817090,Understatement of the year. https://t.co/5IYhFCxo46,GReschenthaler
12,2022-02-18 18:59:52+00:00,1494748520338923529,"I'm deeply saddened by the passing of my friend Jim Hagedorn. Like his father, Jim dedicated his life to serving his country and the people of Minnesota. He will be missed greatly. Please join me in praying for Jennifer and the Hagedorn family.",GReschenthaler
13,2022-02-17 22:47:20+00:00,1494443374472007682,"Biden's reckless spending has caused inflation to soar to 7.5%, the highest rate we’ve seen in 40 years.
 
It's costing hardworking Americans $276 a month.
 
Remember this when Democrats try to say they're the party of the working class.
 
https://t.co/PPy4BOpeD5",GReschenthaler
14,2022-02-16 21:53:00+00:00,1494067311770279939,"President Biden may have threatened Russia with Nord Stream 2 sanctions, but don’t forget that he’s the one who gave them the pipeline in the first place.",GReschenthaler
15,2022-02-16 18:47:00+00:00,1494020503417151490,"“We’ll also do whatever is necessary to reinforce the principles, values, and institutions that keep all Canadians free.” – Justin Trudeau
 
What’s happening in Canada should alarm us all. https://t.co/Mq4ar0xm4A",GReschenthaler
16,2022-02-16 17:39:58+00:00,1494003637114314756,"I’d like to thank the @ModernizeCmte for allowing my district director, Sarah Youngdahl, to testify at today’s hearing. I look forward to working with the committee to modernize district office operations. https://t.co/Atc8b8A30Z",GReschenthaler
17,2022-02-16 17:03:11+00:00,1493994377819176960,"Bloom Raskin wants the Fed to enact radical regulatory policies that would bankrupt coal, oil, &amp; gas companies &amp; raise gas &amp; electricity costs for Americans across the U.S.
 
It's great to see such bold action by this group of Senators led by @SenToomey.
https://t.co/0hB3sIDKbi",GReschenthaler
18,2022-02-16 15:49:13+00:00,1493975764932440077,"President Biden’s weakness on the global stage has emboldened our adversaries and significantly destabilized national security in Eastern Europe, Asia, and the U.S.

https://t.co/GIYztsTO3Q",GReschenthaler
19,2022-02-15 23:30:00+00:00,1493729336020459522,"The Producer Price Index soared 1% month over month – doubling the expected .5% rise &amp; clocking in at 9.7% year over year.
 
This reading shocked wall street, the Fed, &amp; Biden's economists. 

I can tell you who wasn't surprised – main street, small businesses, &amp; working families. https://t.co/4alnnL1A4H",GReschenthaler
20,2022-02-15 21:15:31+00:00,1493695491468664840,The American people deserve the truth. Every conspirator in the Clinton Campaign’s political espionage scheme must be held accountable and prosecuted to the full extent of the law.,GReschenthaler
21,2022-02-15 20:08:09+00:00,1493678540507779075,"Why is mainstream media not covering the biggest political corruption scheme of our generation? Because they were the ones who spread the misinformation.
https://t.co/w8iqIfmB81",GReschenthaler
22,2022-02-15 02:51:56+00:00,1493417767160225793,"If politicians can conspire with tech companies to spy on a sitting president, what do you think they can do to you?",GReschenthaler
23,2022-02-15 02:15:44+00:00,1493408657949827072,This is one of the most diabolical political corruption schemes in American history. https://t.co/Nvd2pvqLf9,GReschenthaler
24,2022-02-14 18:34:44+00:00,1493292643459252228,"Looking forward to joining @toddstarnes at 2 pm ET to discuss evidence that Hillary Clinton and her campaign paid tech companies to plant evidence and fabricate a false narrative linking Donald Trump with Russia.
 
Tune in here: https://t.co/ddZdJeiN7X",GReschenthaler
25,2022-02-13 22:46:00+00:00,1492993486097772546,"Thanks for telling Pittsburghers what we already know. 
https://t.co/3StGpocTWU",GReschenthaler
26,2022-02-13 16:43:00+00:00,1492902134068625410,"T.J. Watt and the @Steelers' kindness meet the resilience of a Waynesburg University senior. 
 
Glad to see Corey is headed to Super Bowl LVI. 
https://t.co/11QSBDHcMI",GReschenthaler
27,2022-02-12 22:17:00+00:00,1492623800244092933,"Thanks to Joe Biden’s radical agenda, inflation has soared to 7.5%, the highest rate since 1982. 

Inflation is a tax on all Americans, but hurts low-income workers, families, and senior citizens the most. https://t.co/rY0XJAlrf7",GReschenthaler
28,2022-02-12 15:16:00+00:00,1492517852234100748,"Americans know that well-funded and appreciated police departments keep communities safe.
 
Biden and Democrats just refuse to accept it.
https://t.co/03OjicEnB6",GReschenthaler
29,2022-02-11 21:16:00+00:00,1492246061351641097,"In 2021, illegal immigrant deportations decreased by 70% and illegal immigrant apprehensions increased by 271%. 

The Biden Administration has abandoned the rule of law and threatened the safety of families and communities across the nation.",GReschenthaler
30,2022-02-11 20:04:00+00:00,1492227942155390976,"The Biden Administration removed “protecting Americans” and “securing the homeland” from the U.S. Citizenship and immigration Services’ mission statement.

Protecting Americans and securing the homeland are not priorities for this Administration.",GReschenthaler
31,2022-02-11 17:28:00+00:00,1492188683016933379,"President Biden and Democrats’ far-left policies have created:
✔️ a crime crisis 
✔️ a border crisis
✔️ a drug crisis
✔️ an energy crisis
✔️ an economic crisis
✔️ a national security crisis",GReschenthaler
32,2022-02-11 16:20:50+00:00,1492171780429131779,"The science didn’t change, but the politics did.
https://t.co/2A438teVY1",GReschenthaler
33,2022-02-10 18:01:14+00:00,1491834657834512387,"Inflation has skyrocketed every month of Joe Biden’s failed presidency, crushing hardworking Americans everywhere.
 
https://t.co/UaOUhE7bZK",GReschenthaler
34,2022-02-10 17:41:49+00:00,1491829773399699458,"The civil disobedience in Canada is the result of everyday people’s frustration with petty tyrants’ overreach into their lives.
 
These mandates needlessly divide us. They must end.
 
RT if you support Canada’s truckers.
https://t.co/VBJ0roKAe5",GReschenthaler
35,2022-02-09 23:45:13+00:00,1491558836184010752,"If confirmed, Bloom Raskin’s radical and anti-American agenda would drive up inflation and increase the cost of energy, harming workers, families, and senior citizens around the country. The Fed should not have the power to pick winners and losers.",GReschenthaler
36,2022-02-09 23:45:12+00:00,1491558834158059528,"Today I led a letter with Coal Caucus Chairman @RepMcKinley, Pennsylvania Republicans, and 40 of our colleagues to President Biden condemning his continued war on U.S. energy producers and his nomination of Ms. Sarah Bloom Raskin to be the Federal Reserve’s top banking regulator. https://t.co/j69dFM6R5i",GReschenthaler
37,2022-02-08 22:54:13+00:00,1491183615375732736,"Joe Biden was born on the Marcellus Shale but is looking to foreign countries for energy.
 
You can’t make this up. https://t.co/LunBshW5U5",GReschenthaler
38,2022-02-08 22:28:05+00:00,1491177038333546506,"After three years of Democrats writing major legislation behind closed doors, today's bipartisanship is refreshing. 
 
The majority should continue working with @HouseGOP to address the serious and pressing issues facing Americans across the nation. https://t.co/tPgaLSrmj4",GReschenthaler
39,2022-02-08 17:18:51+00:00,1491099215912914945,"In the past 2 years, fentanyl overdose deaths doubled in 30 states, becoming the leading cause of death for adults 18-45.

In 2021, @CBP seized 11,200+ lbs of fentanyl.

Skyrocketing rates of overdose deaths and fentanyl seizures are direct consequences of the #BidenBorderCrisis.",GReschenthaler
40,2022-02-07 23:01:31+00:00,1490823065495822340,"EcoHealth Alliance has repeatedly prioritized the agenda of the CCP over the interests of the American people.

I’m deeply concerned by USAID’s decision to award the organization additional federal funding. We need answers.
https://t.co/xuqx7tGNWP",GReschenthaler
41,2022-02-07 19:54:14+00:00,1490775932491206656,"Utter hypocrisy. 

End the mandates. Unmask our children. 

RT if you agree. https://t.co/5FJwly7MiQ",GReschenthaler
42,2022-02-07 16:44:17+00:00,1490728130767691783,EcoHealth has proven they can't be trusted to put the American people ahead of the demands of the CCP and they shouldn’t receive another cent from the U.S. government.,GReschenthaler
43,2022-02-07 16:44:16+00:00,1490728127886147592,"Today my colleagues and I sent a letter to @USAID demanding answers on their decision to continue to funnel taxpayer dollars to EcoHealth Alliance, an organization that funded dangerous, gain-of-function coronavirus research at the Wuhan Institute of Virology before the pandemic. https://t.co/MvHYjuBgaq",GReschenthaler
44,2022-02-06 23:00:02+00:00,1490460303192166406,"The DOD has started to expel unvaccinated service members.
 
Let's call this what it is: a nonviolent purge of conservatives from the armed services.   
 
RT if you agree. https://t.co/TBKKu55Mia",GReschenthaler
45,2022-02-06 17:00:00+00:00,1490369699456028674,"The CCP should not have been allowed to host the Olympics. 
 
Historically, aggressive regimes with a record of human rights abuse have always been emboldened after hosting the Olympics. 
 
China will be no different. 
https://t.co/p8qVosoxOB",GReschenthaler
46,2022-02-05 23:00:00+00:00,1490097907151740933,"Big Tech does not represent the American people; they shouldn't be able to silence those who do. 

AT&amp;T or Verizon can't shut off your phone lines for saying something they disagree with. 

The same should be true for tech companies.",GReschenthaler
47,2022-02-05 17:00:02+00:00,1490007317965856772,"Pennsylvania's 16 casinos secured $1.93 billion in taxes for our state. 

This revenue will have a positive impact in our local community. 
https://t.co/g0dW7tAJJf",GReschenthaler
48,2022-02-04 15:16:48+00:00,1489618951508312064,"When the American people end Democrats' one-party rule in November, Republicans must reign in Big Tech.
 
That has to start with repealing section 230, stripping them of their legal shields. https://t.co/NJWhwgfw7U",GReschenthaler
49,2022-02-03 21:57:48+00:00,1489357479221809159,"We were given a false choice at the beginning of COVID-19.
 
We could have saved lives and avoided costly one-size-fits-all lockdowns.
 
Instead, petty tyrants and unelected bureaucrats leaped at the opportunity to crush small businesses and confine us in our homes. https://t.co/3j31qSxTTV",GReschenthaler
50,2022-02-02 22:30:01+00:00,1489003199709294592,"We are expelling well-trained and committed service members over a vaccine that doesn't stop transmission.
 
It's undeniable this misguided decision will unnecessarily affect our ability to fight future conflicts. 
https://t.co/HAqhEb76YG",GReschenthaler
51,2022-02-02 19:46:59+00:00,1488962169475588104,"Hours before the Taliban took Kabul, the Biden Admin was still assigning basic tasks for a civilian evacuation. 
 
13 service members died implementing their last-minute plan.
 
Biden's incompetence puts Americans last. 
https://t.co/S9eI2OM2N9",GReschenthaler
52,2022-02-02 18:02:41+00:00,1488935923299590151,"The CCP is the greatest threat to freedom &amp; democracy.

Yet House Dems put forward a bill that mentions coral reefs &amp; climate change more than China.

In Biden’s Statement of Admin Policy for this bill,  China is not mentioned.

Calling this bill tough on China is laughable. https://t.co/93hw9yIJEb",GReschenthaler
53,2022-02-01 23:07:47+00:00,1488650313775128580,".@amnesty's new report essentially denounces Israel’s right to exist as a Jewish state, fueling antisemitism. 
 
They're more interested in attacking our democratic ally than promoting human rights. 
 
I stand with Israel against this hateful discrimination.",GReschenthaler
54,2022-02-01 20:27:00+00:00,1488609852708605952,"Democrats claim they want to compete with the CCP but their CONCEDES Act would only enrich China. 
 
They can't be trusted to hold our greatest adversary accountable. https://t.co/Xo3qEURwgL",GReschenthaler
55,2022-02-01 17:42:04+00:00,1488568345045655556,"Democrat politicians in Pennsylvania hiding from Biden is the height of hypocrisy.
 
Biden is unpopular because of his failed policies - the very same policies these Democrats support.
https://t.co/DJsCO2IAg7",GReschenthaler
56,2022-02-01 14:26:04+00:00,1488519022354255890,"Americans feel unsafe in their communities, and the Biden Admin is laughing… https://t.co/CwZCHxNb6i",GReschenthaler
57,2022-01-31 16:33:44+00:00,1488188759237668870,"The Biden economy has made it harder to:
 
❌Go out to dinner with your spouse
❌Visit an amusement park with your kids
❌Go to the game with your friends
 
American families are paying more to make memories.
https://t.co/ENiA1781JS",GReschenthaler
58,2022-01-30 23:00:00+00:00,1487923582189592585,"Biden and his woke base want all the technology made by critical minerals - they just aren't willing to mine it here. 

Their nonsensical stance jeopardizes our national security and kills American jobs. 

https://t.co/6mT09yACOt",GReschenthaler
59,2022-01-30 17:00:01+00:00,1487832988436029441,"Used car prices jumped 39% last year, reaching an average price of $29,011. 

They used to be a budget-friendly option for hardworking Americans but thanks to the Biden economy, not anymore. 

SWPA families are left to struggle as a result.

https://t.co/J42mHZPnK0",GReschenthaler
60,2022-01-29 23:00:01+00:00,1487561198383996928,"As a Navy veteran, this is deeply concerning. 

In November, I joined two letters urging the Biden Admin and DOD to reverse course. 

They refused and are now expelling experienced and patriotic sailors, diminishing our readiness. 

https://t.co/jQGuO4M93b",GReschenthaler
61,2022-01-29 17:00:00+00:00,1487470596355096579,"I'm proud to see this effort take shape. 

Pennsylvanians should have a say in whether the Liquor Control Board stays or goes. 

https://t.co/JYqs8ngazc",GReschenthaler
62,2022-01-28 20:59:02+00:00,1487168362677473280,"Dems' 2,912 page China bill:
 
❌Provides $8 billion for a green climate fund (China's eligible) 
❌Reauthorizes the Coral Reef Conservation Act 
❌Includes marine mammal research
 
Can anyone tell me how this holds the CCP accountable?",GReschenthaler
63,2022-01-28 19:13:09+00:00,1487141715429535750,"Parents are a critical partner in educating America's children. 

Whether it's due to radical CRT, poor performance, or special-interest fueled closures, parents know when their child is underserved by their education. 

American families deserve #SchoolChoice. https://t.co/zcfCfwNP8e",GReschenthaler
64,2022-01-28 16:51:46+00:00,1487106134532136962,"Radical environmentalists in the U.S. and Europe called for a war on energy production. 

Biden and other weak Western leaders were happy to wage it for them. 

Our adversaries grew stronger as a result. 

https://t.co/oM7ktbRWo7",GReschenthaler
65,2022-01-27 21:11:49+00:00,1486809192367284233,"On Holocaust Remembrance Day, we mourn the six million Jews systematically murdered by the Nazis. 
 
I will always stand against anti-Semitism and support the state of Israel.  
 
We must ensure young Americans continue to learn about this painful chapter of world history.",GReschenthaler
66,2022-01-27 20:11:48+00:00,1486794086304653312,"If the Biden Administration really wanted to end human trafficking, securing the southern border would be a great place to start. https://t.co/bYneoj7bDF",GReschenthaler
67,2022-01-27 17:38:16+00:00,1486755449500311554,"A majority of Americans believe China is the greatest threat we face.

With their latest COMPETES Act, House Dems proved they don't take those concerns seriously.

The legislation mentions climate 364 times &amp; only references our national security 136 times.https://t.co/Cq40dMSexs",GReschenthaler
68,2022-01-26 20:44:26+00:00,1486439911557406726,"❌7% inflation 
❌Schools closed 
❌Russia poised to invade Ukraine 
❌Olympics hosted by a genocidal regime
❌16 cities with new homicide records 
 
Joe Biden: Let's get some ice cream. https://t.co/GYSuVkvaGH",GReschenthaler
69,2022-01-25 18:32:58+00:00,1486044438052884480,"CNN won't say this, so I will: Biden is directly responsible for our adversaries' sudden resolve. 
 
Biden's abysmal leadership has convinced our foes we're a retreating power that they can line up and test.
https://t.co/XYxdnfq2wd",GReschenthaler
70,2022-01-25 16:41:03+00:00,1486016274849271809,"Biden removed the terrorist designation for Iran-backed Houthi rebels. 
 
Now they're targeting bases with American service members. 
 
Listening to woke activists isn't a foreign policy strategy. 
https://t.co/updM6eOIDg",GReschenthaler
71,2022-01-25 15:12:51+00:00,1485994077531291657,"“I make the most money I’ve ever made, but I’m still broke and struggling."" 
 
“That raise meant nothing.”
 
The stories of Americans beaten down by the Biden Economy are as endless as they are heartbreaking.  
https://t.co/4zCMWcZjZ4",GReschenthaler
72,2022-01-24 23:00:01+00:00,1485749258661863426,"It isn't just Putin; Biden's inept leadership has emboldened Xi too. 

Biden continues to put America’s national security, and that of our allies, at risk.
https://t.co/LH57i2Mgpy",GReschenthaler
73,2022-01-24 19:46:13+00:00,1485700486489686021,"Between broken promises and manufactured crises, Biden's presidency is a disaster. 

Even Meet the Press acknowledges it.

https://t.co/zZ7B8UaBXF",GReschenthaler
74,2022-01-24 17:03:05+00:00,1485659433266991109,"Joe Biden continues to put Americans last. 
https://t.co/4ILH0nStCr",GReschenthaler
75,2022-01-23 23:00:00+00:00,1485386865368657922,"Even CNN is tired of the CDC's nonsensical COVID guidance...  
https://t.co/XpxUnyIyMa",GReschenthaler
76,2022-01-23 17:00:00+00:00,1485296269107077122,"Life Changing Service Dogs for Veterans does incredible work for our community. 
 
These stories of veterans getting a new lease on life thanks to a service dog are incredibly touching.  
https://t.co/PuD4PY6KdA",GReschenthaler
77,2022-01-22 23:00:01+00:00,1485024479642333186,"They're sending in the JV team to walk back Biden's green light to Putin.  
 
Unfortunately, that isn't how geopolitics works.  
 
Biden's ""minor incursion"" blunder will haunt his presidency and the European continent for years to come.  
https://t.co/lutIPfRguF",GReschenthaler
78,2022-01-22 17:00:00+00:00,1484933882046734342,"This is excellent news for Vandergrift's young families.  
 
Follow the link below for more information.  
https://t.co/yJ6Fuifr1E",GReschenthaler
79,2022-01-21 20:05:15+00:00,1484618114084089859,"The right to life is sacred and I will always defend it in Congress.
 
RT if you’ll stand with me. https://t.co/4V3wfbya9F",GReschenthaler
80,2022-01-21 16:26:24+00:00,1484563038187442177,"China is our greatest geopolitical adversary, but you wouldn't know it based on Pelosi's actions.
 
The U.S. House of Representatives shouldn't be propping up Communist Chinese suppliers.
 
https://t.co/rpkm4Ry1Cl",GReschenthaler
81,2022-01-21 14:57:19+00:00,1484540618823118858,"Biden’s latest security blunder, signaling he wouldn’t act on a ""minor incursion"" in Ukraine, further destabilizes Eastern Europe, Asia, and American national security.
 
https://t.co/GIYztsTO3Q",GReschenthaler
82,2022-01-20 20:35:08+00:00,1484263246760660998,"Biden promised to ""rebuild the middle class."" 
 
❌Lie 
 
On his watch:

➡️The economic crisis cost the average family $3.5K
➡️Inflation sits at 7%, the highest level in 40 years
➡️Year-over-year hourly pay is down 2.4% 
➡️PA is paying $3.52 a gallon vs. $2.69 last year",GReschenthaler
83,2022-01-20 17:26:32+00:00,1484215780610871296,"Biden: ""Together, we shall write an American story of hope, not fear. Of unity, not division.""
 
❌Lie
 
Biden has:

➡️Falsely claimed this a pandemic of the unvaxxed
➡️Lied about voting laws in GA and TX
➡️Used the FBI to target concerned parents",GReschenthaler
84,2022-01-20 16:22:16+00:00,1484199607747989507,"Today marks one year of Joe Biden and Democrats' one-party reign in Congress and it's safe to say Americans are suffering greatly because of it.
 
All they have to show for it is self-inflicted crisis after self-inflicted crisis.",GReschenthaler
85,2022-01-20 14:05:22+00:00,1484165158016532481,"Joe Biden: ""For the first time in a long time, this country's working people actually got a raise.""
 
The reality: average hourly pay is down 2.4% when adjusted for inflation. 
 
Hardworking Americans know Biden isn't telling them the whole truth.",GReschenthaler
86,2022-01-19 20:06:30+00:00,1483893652707549191,"I'm proud to share I earned an A+ rating with @SBAList for my 2021 voting record. 
 
I will never stop fighting for the rights of the unborn and will always defend American taxpayers who don't want their tax dollars funding abortion. #WhyWeMarch https://t.co/oLWdKN9w89",GReschenthaler
87,2022-01-19 17:55:38+00:00,1483860718323748864,"Isn't it time to start getting more answers? 
 
Unfortunately, we're already more than two years into the pandemic. 
 
For the sake of the American people, we hope the adage ""better late than never"" is true.
https://t.co/uQoXssMJe3",GReschenthaler
88,2022-01-18 22:22:54+00:00,1483565588593135616,"Of Dems surveyed:

➡️59% would support confining the unvaccinated in their homes

➡️45% would favor requiring them to temporarily live in designated facilities
 
Biden's base, much like the president, has no interest in unity. 
https://t.co/sKeoaer0aY",GReschenthaler
89,2022-01-18 19:33:43+00:00,1483523014339833870,"Did Dr. Fauci use his position and his public platform to chill debate about the possibility that COVID-19 leaked from the Wuhan Institute of Virology?
 
It certainly appears so.
 
Check out my op-ed with @WhiteCoatWaste⬇️
https://t.co/uQoXssMJe3",GReschenthaler
90,2022-01-17 15:00:03+00:00,1483091754706481154,"Today we honor Rev. Dr. Martin Luther King Jr.

I encourage everyone to take a moment to reflect on Dr. King’s unmatched courage. https://t.co/eCPs9DRzuW",GReschenthaler
91,2022-01-16 23:00:01+00:00,1482850156416430083,"Biden let illegal immigrants enter our country and trusted them to start the deportation process themselves.

As anyone could've predicted, it was a complete failure.

https://t.co/Q1DLwFlIrI",GReschenthaler
92,2022-01-16 17:00:00+00:00,1482759552378368004,"If you're in a position to donate blood, please consider doing so.

Follow the link below for information on where you can give blood in our area.

https://t.co/IsualzxcDE",GReschenthaler
93,2022-01-15 23:00:00+00:00,1482487762255110146,"The Biden Admin is sitting on 50M COVID tests, while PA families struggle to get tested…
https://t.co/w2yo28td8X",GReschenthaler
94,2022-01-14 20:53:01+00:00,1482093420114067458,"Biden had the audacity to go on a reckless spending spree and claim, with a straight face, it wouldn’t affect Americans’ wallets. 
 
He was wrong. https://t.co/9sTAaz0PsR",GReschenthaler
