,Datetime,Tweet Id,Text,Username
0,2022-02-23 01:39:00+00:00,1496298515672281091,"Our greatest strength is our unity. In Munich, we affirmed that our NATO alliance and relationship with the transatlantic community are strong and united.",KamalaHarris
1,2022-02-22 22:57:00+00:00,1496257747607867396,"On my visit to Munich, we strengthened and affirmed relationships with our allies and partners worldwide as we demonstrated our unity in the face of Russian aggression.",KamalaHarris
2,2022-02-18 21:37:01+00:00,1494788064920711168,"More than 42 million people in our country do not have access to high-speed internet. 

That’s why our Bipartisan Infrastructure Law will expand internet access, lower prices for internet service, and help close the digital divide.",KamalaHarris
3,2022-02-17 00:22:00+00:00,1494104810471280641,"The Affordable Connectivity Program means that more entrepreneurs can build digital businesses, and more children can do their homework at home.

If you believe you are eligible to receive affordable broadband support, visit https://t.co/viMAVwZGRV.",KamalaHarris
4,2022-02-16 18:45:02+00:00,1494020008770523145,"More than 10 million American households have signed up for the Affordable Connectivity Program, which lowers high-speed internet costs for working people. 

Visit https://t.co/viMAVwZGRV to see if you are eligible. 
https://t.co/eo4NhgeCz9",KamalaHarris
5,2022-02-15 22:32:00+00:00,1493714741251948545,"In the 21st century, high-speed internet is a necessity. 

That’s why, since day one, the President and I have fought to make it easier for everyone to access and afford high-speed internet. Now, the Bipartisan Infrastructure Law will help make it happen.",KamalaHarris
6,2022-02-13 21:40:00+00:00,1492976879598551046,"We’re not just getting rid of lead pipes. We’re creating jobs.

Through the Bipartisan Infrastructure Law, we will invest in job training, upgrade our workforce's skills, partner with our labor unions, and establish apprenticeships—all to create jobs replacing lead pipes.",KamalaHarris
7,2022-02-13 15:58:00+00:00,1492890812388200452,"Lead exposure affects multiple generations within one household.

Grandparents shouldn’t have to worry about their grandbabies drinking water poisoned by lead, especially during their formative development years. That's why we're working towards removing lead pipes nationwide.",KamalaHarris
8,2022-02-12 18:37:00+00:00,1492568437515821061,"For far too long, homeowners or renters have had to suffer the burden of investing their own money to fix lead service lines on their property. 

The investments in the Bipartisan Infrastructure Law will begin to change this by replacing lead pipes nationwide.",KamalaHarris
9,2022-02-12 15:30:14+00:00,1492521434740137986,We must eliminate lead pipes. https://t.co/gCbTGYrtuf,KamalaHarris
10,2022-02-10 15:14:02+00:00,1491792583391014920,"We have made historic strides to strengthen the judicial bench, with over 70% of our nominees being women.

Soon, the President will nominate the first Black woman—who will be eminently qualified—to sit on the Supreme Court. 

It's about time.",KamalaHarris
11,2022-02-10 01:53:00+00:00,1491590996504756233,"The Executive Order on Project Labor Agreements will ensure federal construction projects are built on time—improving construction work around the country and job quality for nearly 200,000 workers.

We’re fulfilling our promise to build a more skilled and productive workforce.",KamalaHarris
12,2022-02-09 22:28:00+00:00,1491539406808879104,"When the President and I took office, we understood the challenges facing our nation and planned to get America back on track.

While there's more work to be done, businesses and schools are back open, and America is getting back to work.",KamalaHarris
13,2022-02-08 22:35:00+00:00,1491178781041647619,"From putting food on the table to helping families cover daily expenses, the Child Tax Credit has delivered real relief for so many working families and children—and we want to make sure you receive it if you’re eligible. 

Visit https://t.co/RE29m36gqV to learn more.",KamalaHarris
14,2022-02-08 20:50:19+00:00,1491152437138231298,"To find out if you are eligible for the Child Tax Credit and the Earned Income Tax Credit, visit https://t.co/RE29m2OF2l. https://t.co/lPX2lx0n24",KamalaHarris
15,2022-02-07 20:44:00+00:00,1490788458742394882,Our Lead Pipe and Paint Action Plan in the Bipartisan Infrastructure Law will start removing and replacing lead pipes across America so our kids will be safe from lead poisoning.,KamalaHarris
16,2022-02-06 19:56:00+00:00,1490413992401158144,"With free-at-home COVID-19 tests available to households across the country who sign up, you and your family will be able to test from your home. 

Visit https://t.co/Peq1SEiXEt and order yours today.",KamalaHarris
17,2022-02-06 16:00:09+00:00,1490354635353296897,"Americans are back at work at a record-setting pace. Our economy created 467,000 jobs in January, and 6.6 million jobs have been created since we took office.

While there’s more work to be done, we are focused on rebuilding an economy that will lift up all Americans.",KamalaHarris
18,2022-02-06 01:42:00+00:00,1490138676545961994,"The latest jobs report shows America’s economy created 6.6 million jobs within the last year, exceeding expectations. 

We are making historic strides to build our country back better than before.",KamalaHarris
19,2022-02-05 18:25:01+00:00,1490028703941898241,"Over the past two years, so many have lost loved ones.

Our faith has been tested. But it is that same faith—our faith in God, our faith in humanity, and our faith in what is possible—it is that same faith that has seen us through and helped us to see the light in one another.",KamalaHarris
20,2022-02-05 17:37:01+00:00,1490016627131363330,"The Cancer Moonshot will work to reduce the death rate from cancer by at least 50% over the next 25 years and improve the experience of people and families living with and surviving cancer. 

These goals are not abstract. They will transform and save lives.",KamalaHarris
21,2022-02-05 16:49:00+00:00,1490004543203155972,"Since @JoeBiden and I took office, the economy has grown at the fastest rate in nearly 40 years.

There’s more work to do, but America is on its way back.",KamalaHarris
22,2022-02-05 02:19:00+00:00,1489785600181952515,"Now is the time for all of us to get to work to elect Democrats up and down the ballot. We have the power to make a difference for our country today and in the future.

Donate to help elect Democrats who'll fight for working families up and down the ballot.https://t.co/TvXRbP9nSN",KamalaHarris
23,2022-02-04 17:18:19+00:00,1489649533067870212,"I stood witness as my mother, a scientist, worked to end breast cancer. 

My mother’s discoveries helped save women’s lives. And I am so proud of the work she did to bring our nation and our world closer to the goal of ending breast cancer as we know it. https://t.co/ESgWSA8Gp8",KamalaHarris
24,2022-02-04 01:12:00+00:00,1489406351243628546,"If you are unvaccinated and test positive for COVID-19, you are 17 times more likely to be hospitalized.

Get vaccinated if you haven’t already done so, and urge your family members, friends, and neighbors to get vaccinated.",KamalaHarris
25,2022-02-03 23:15:02+00:00,1489376913713938433,"Over the past 20 years, more people are surviving and enduring cancer after being diagnosed than ever before, and the death rate has fallen by about 25%.

Our Cancer Moonshot initiative lays out ambitious and achievable goals for our nation to end cancer as we know it.",KamalaHarris
26,2022-02-03 21:15:05+00:00,1489346727530348544,"There’s more work to be done, but, so far, our economy has added more than 6 million jobs. 

Together, we are helping Americans get back to work.",KamalaHarris
27,2022-02-03 01:33:00+00:00,1489049248566067208,"We still have a lot of work ahead of us, but we are focused on getting Americans back to work and rebuilding the middle class.

The economy has added more than 6 million jobs this past year, and the unemployment rate dropped to 3.9%.",KamalaHarris
28,2022-02-02 20:52:01+00:00,1488978537046552581,"It’s unacceptable that in 2022 our children are still drinking water from toxic lead pipes. 

Thanks to the investments of the Bipartisan Infrastructure Law, generations of Americans will forever benefit from the work of removing lead pipes across the country.",KamalaHarris
29,2022-02-02 17:00:53+00:00,1488920370749005826,We will work together to ensure that all Americans who are eligible to vote have access to the ballot. https://t.co/UbOLY80RGL,KamalaHarris
30,2022-02-02 15:00:22+00:00,1488890041237655558,"Over these last two years, many of our nation’s governors have been presented with the greatest challenges, but did not relent.

They are leaders who do not throw up their hands, but they roll up their sleeves for their state.",KamalaHarris
31,2022-02-02 00:02:00+00:00,1488663959527960582,"Happy Lunar New Year! Sending warm wishes for a happy, healthy, and prosperous Year of the Tiger to all those celebrating in the United States and around the world.",KamalaHarris
32,2022-02-01 22:05:15+00:00,1488634577228865542,"Black history is American history. 

As Black History Month begins, we honor those who built America from its foundation and still work every day to make this country stronger and more free. We must remember our history, not just this month but every month. https://t.co/y2VX11mhE7",KamalaHarris
33,2022-01-31 20:36:00+00:00,1488249730975031300,"Getting rid of lead pipes in our communities is about public health. It’s about keeping our kids safe in schools. It’s about strengthening apprenticeship programs and creating jobs. 

We’re working to strengthen our infrastructure and replace lead pipes across the country.",KamalaHarris
34,2022-01-30 01:18:00+00:00,1487595921579941892,"New small business applications have increased by 30% since before the pandemic. 

While there’s more work to be done, we’re rebuilding our economy to lift up all Americans.",KamalaHarris
35,2022-01-29 17:19:01+00:00,1487475379287863296,"The bottom line is that eliminating lead exposure in our nation must be among our highest priorities.

Why? Because millions of people in America are exposed to lead every day.

Our Lead Pipe and Paint Action Plan will remove and replace all lead pipes over the next ten years.",KamalaHarris
36,2022-01-29 00:12:03+00:00,1487216936727494662,"Yesterday, I met with Honduran leaders to discuss how we can work together on a number of issues. Both countries are committed to strengthening an enduring partnership. https://t.co/IXQGyFkujn",KamalaHarris
37,2022-01-28 19:13:00+00:00,1487141679790444544,"Last year was the greatest year of job growth in American history. 

Our economic plan is creating good jobs for Americans, rebuilding our manufacturing, and helping make our companies more competitive.",KamalaHarris
38,2022-01-28 01:59:00+00:00,1486881464222466056,"President Biden is keeping his promise—the next person who fills this seat will be the first Black woman nominated to the United States Supreme Court.
https://t.co/6arybJGRmJ",KamalaHarris
39,2022-01-27 21:30:01+00:00,1486813773725896704,"We have a lot of work ahead of us, but this past year, America saw the fastest economic growth since 1984, with a record number of jobs added to the economy and a record drop in the unemployment rate. 

America is on the move.",KamalaHarris
40,2022-01-27 14:49:01+00:00,1486712854845616128,"Pregnant women who live in rural communities are about 60% more likely to die before, during, or after childbirth.

We’re facing a maternal health crisis, and President Biden and I are treating it as a matter of public health.",KamalaHarris
41,2022-01-26 22:02:20+00:00,1486459518305423363,"Getting rid of lead pipes is an environmental justice issue in rural communities, in poor communities, and communities of color. https://t.co/gBagcQif1e",KamalaHarris
42,2022-01-26 15:00:21+00:00,1486353319295655943,"With the Bipartisan Infrastructure Law, we are finally taking action on an issue that has impacted our children and seniors—removing lead pipes across America.",KamalaHarris
43,2022-01-26 00:05:00+00:00,1486128000823349252,"The best way to fight against natural disasters is through preparedness. 

We are investing $1.3 billion to disaster relief funding, including $600 million for California, for wildfire preparedness and to help make communities more resilient.",KamalaHarris
44,2022-01-25 22:35:21+00:00,1486105438911352832,"The climate crisis has almost everything to do with what we’re seeing with wildfires. We’re experiencing it now, and we must be prepared. https://t.co/R16UwvO93V",KamalaHarris
45,2022-01-25 15:20:01+00:00,1485995881136599040,"As a daughter of California, I know the devastation that wildfires bring.

I understand the seriousness of quickly responding when faced with such disasters. That’s why we are investing over $5 billion in wildfire preparedness and mitigation to address the wildfire crisis.",KamalaHarris
46,2022-01-25 01:30:01+00:00,1485787007611809799,"Thanks to the Bipartisan Infrastructure Law, we are going to make a record investment in rebuilding America’s infrastructure to help people get to where they need to go.",KamalaHarris
47,2022-01-24 18:58:00+00:00,1485688353467113479,"The vaccine is safe, effective, and saves lives. It’s that simple. 

If you haven’t already received your vaccine or booster shot, roll up your sleeve and get it done.",KamalaHarris
48,2022-01-24 01:46:00+00:00,1485428640829607940,"As President @JoeBiden says, despite facing the biggest challenges we have faced as a nation, we are going to get through this. 
https://t.co/WoRPMQcCMI",KamalaHarris
49,2022-01-23 16:56:00+00:00,1485295262734209032,"Children across the country are exposed to water from lead pipes which creates real health problems as they grow.

The Bipartisan Infrastructure Law will replace lead pipes, removing lead paint from schools and across our communities so our kids can live in a healthy environment.",KamalaHarris
50,2022-01-23 01:19:14+00:00,1485059517733867524,We will continue to fight to protect the right to vote with every tool at our disposal. https://t.co/K2PUqIWtNp,KamalaHarris
51,2022-01-22 18:08:01+00:00,1484950995855716364,"Roe v. Wade gave women the ability to control their own bodies, to plan their own families, and to determine their own futures. On this 49th anniversary, let us recommit to doing everything we can to protect those constitutional rights.
https://t.co/Zm2k5SRcXn",KamalaHarris
52,2022-01-22 00:17:00+00:00,1484681467766710272,"From vaccines, boosters, masks, and tests, we have been doing everything we can to save lives and keep businesses and schools open.",KamalaHarris
53,2022-01-21 15:37:01+00:00,1484550607600037889,"From adding 6 million new jobs to the unemployment rate dropping to 3.9%, last year was a year of enormous progress.

We’re getting America’s economy back on track.",KamalaHarris
54,2022-01-21 01:42:36+00:00,1484340622995513351,"In our first year in office:

—More than 6 million jobs created 
—The unemployment rate is down to 3.9%
—Unemployment claims are at their lowest level since 1969

We’re making historic progress for workers, small businesses, and our economy—and it’s only just the beginning.",KamalaHarris
55,2022-01-20 22:54:13+00:00,1484298244406579203,"Both Republican and Democratic administrations have tried for years to pass a comprehensive infrastructure package that upgrades our roads and bridges, replaces our lead pipes, and repairs America’s crumbling infrastructure. 

President Joe Biden got it done. https://t.co/4dXTW1Fkfu",KamalaHarris
56,2022-01-20 21:10:02+00:00,1484272025720041481,"This past year, America has seen record job creation, economic growth, and small business creation. 

We’re rebuilding our economy to lift up all Americans.",KamalaHarris
57,2022-01-20 19:18:01+00:00,1484243838847836165,"Since President Biden and I took office, we have gotten shots in arms, got people back to work, and passed laws that will rebuild our crumbling infrastructure while creating good-paying jobs.

We are delivering on our promises for America’s working families.",KamalaHarris
58,2022-01-20 17:35:01+00:00,1484217915641638920,"Together, we are moving our country towards a brighter future. 
https://t.co/rZm7aIzdez",KamalaHarris
59,2022-01-20 17:00:22+00:00,1484209197537497089,"On January 20, 2021, we set off to heal, rebuild, and strengthen the democracy that we all cherish. 

The work continues.
https://t.co/NEAuiKd3qQ",KamalaHarris
60,2022-01-20 15:00:31+00:00,1484179034284064768,"One year ago, this moment, in many ways, embodied our character as a nation. It demonstrated who we are.

We are undaunted in our belief that we shall overcome; that we will rise up. This is American aspiration. https://t.co/n5Zaabt94q",KamalaHarris
61,2022-01-19 17:35:01+00:00,1483855528568799244,"It’s been one year since the inauguration. This Thursday, join President @JoeBiden and me for a virtual event as we reflect on the first year and what’s ahead. Sign up now. 
https://t.co/ECchswM4sh",KamalaHarris
62,2022-01-19 00:27:00+00:00,1483596821893206017,"Wearing a mask is an important tool to control the spread of COVID-19. 

We can all do our part to help get a hold of the Omicron variant—please stay vigilant and wear a tight-fitting mask.",KamalaHarris
63,2022-01-18 20:10:02+00:00,1483532151308144640,Our vote is our power. We must continue Dr. Martin Luther King Jr.’s legacy to fight for its freedom. https://t.co/LS0VGFSCzg,KamalaHarris
64,2022-01-18 16:30:03+00:00,1483476792170225668,"We promised better infrastructure to the American people and delivered with our Bipartisan Infrastructure Law. Communities will begin to see improvements in roads and bridges, public transit, and clean drinking water.",KamalaHarris
65,2022-01-17 14:15:06+00:00,1483080443490672645,"I often turn to the words of Dr. Martin Luther King, Jr. for inspiration. 

Today, I’m keeping these words in mind: the arc of the moral universe is long, but it bends toward justice. https://t.co/HcXneeQSL2",KamalaHarris
66,2022-01-15 17:41:01+00:00,1482407486107926537,"A son of Georgia, Dr. King spent his life fighting for economic and racial justice. His fight for equality and dignity lives on in those today who organize for freedom and justice for all.

To truly celebrate his birth on this day in 1929, we must carry out his work.",KamalaHarris
67,2022-01-15 00:14:01+00:00,1482144000702357504,"Every American child, no matter where they live or their economic status should have access to high-speed internet. 

Our Bipartisan Infrastructure Law has invested $65 billion to get every corner of our country connected—helping students, small businesses, and families.",KamalaHarris
68,2022-01-14 19:32:14+00:00,1482073086501523459,We are not where we were a year ago—we are building back up. https://t.co/nAS3b4YKiC,KamalaHarris
69,2022-01-14 01:12:00+00:00,1481796207328604164,"Today, President Biden announced that we are in the process of purchasing an additional 500 million more tests to meet future demand. 

The American people will now have more access to convenient COVID-19 at-home tests.",KamalaHarris
70,2022-01-13 23:57:00+00:00,1481777332260118528,"Upholding one of the most important tenets of our democracy—access to the ballot for all eligible voters—should not be a partisan issue.

It’s an American issue.",KamalaHarris
71,2022-01-13 22:05:10+00:00,1481749185925898252,50 Republicans should not be absolved from the responsibility of preserving and protecting our democracy. https://t.co/buvYxSpjK8,KamalaHarris
72,2022-01-13 15:07:02+00:00,1481643958723702785,"Like so many others, I stand on the shoulders of giants like Congressman John Lewis and remind myself of the work we have left to do. Democracy is stronger when everyone participates—and is weaker when people are left out.",KamalaHarris
73,2022-01-12 21:12:01+00:00,1481373423658061824,"Years from now, our children and grandchildren will ask us what we did at this moment in history.

The U.S. Senate must act with the urgency this moment demands and safeguard our democracy for generations to come. https://t.co/8abqBXw03c",KamalaHarris
74,2022-01-12 18:30:05+00:00,1481332672635015168,"The John Lewis Voting Rights Advancement Act and the Freedom to Vote Act represent the first real opportunity to secure the freedom to vote since the Supreme Court gutted the Voting Rights Act.

We don't know when we'll have this opportunity again—the Senate must act now.",KamalaHarris
75,2022-01-12 15:30:03+00:00,1481287366463692804,"Make no mistake: There is nothing normal about laws that prevent the American people from exercising their constitutional right to vote. 

Two landmark voting rights bills sit before the Senate. The Senate must act to protect the will of the people. https://t.co/ijeYvXGiZF",KamalaHarris
76,2022-01-12 14:45:01+00:00,1481276033387024386,"We will fight to safeguard our democracy and secure our most fundamental freedom: the freedom to vote. 

The Senate must pass the John Lewis Voting Rights Advancement Act and the Freedom to Vote Act to protect our right to vote.",KamalaHarris
77,2022-01-10 22:43:00+00:00,1480671545525637120,"The Freedom to Vote Act and the John Lewis Voting Rights Advancement Act are about ensuring that all Americans—wherever they live, whatever party they are registered to vote with—have the  ability to exercise their vote.

The Senate must act to protect this sacred right.",KamalaHarris
78,2022-01-10 20:39:18+00:00,1480640412780011528,"We must protect voting rights. 

That’s why the Senate must pass the Freedom to Vote Act and the John Lewis Voting Rights Advancement Act to ensure that everyone can count on  access to the ballot box. https://t.co/1re8h3gpGa",KamalaHarris
79,2022-01-10 14:34:00+00:00,1480548484570828802,"Our democracy is being threatened by an attack on voting rights. 

We must fight to save our democracy by fighting for the right for all people, whoever they vote for, to vote.",KamalaHarris
80,2022-01-10 01:29:00+00:00,1480350932953178116,"For the sake of one of the most important pillars of our democracy, we must put politics aside, step up, and act. 

The Senate must pass the Freedom to Vote Act and the John Lewis Voting Rights Advancement Act.",KamalaHarris
81,2022-01-09 20:19:00+00:00,1480272919280472064,"Activists and leaders including Dr. Martin Luther King, John Lewis, and Rosa Parks have fought to expand voting rights. 

We owe it to future generations to continue to fight for every American’s right to vote and have their vote counted.",KamalaHarris
82,2022-01-09 18:52:00+00:00,1480251024610713600,"The unemployment rate fell to 3.9%—the sharpest one-year drop in unemployment on record. 

We’re making progress for workers, small businesses, and our economy.",KamalaHarris
83,2022-01-08 00:33:00+00:00,1479612065136492544,"States across our nation have passed laws that would make it harder to vote.

We are in a critical moment, and that is why we must pass the Freedom to Vote Act and the John Lewis Voting Rights Advancement Act. It will not be easy, but we must fight back.",KamalaHarris
84,2022-01-07 23:29:19+00:00,1479596038893842433,"What was at stake on January 6, and now, is the right to have our future decided the way the Constitution prescribes it: By We, the People. All the people. https://t.co/a6c4LHn1Qh",KamalaHarris
85,2022-01-07 22:15:02+00:00,1479577345161932806,"Today’s jobs report: 

—Added 6.4 million jobs since January of last year 
—Lowest unemployment rate since the beginning of the pandemic
—Regained 84% of jobs lost in the pandemic 

Today is a historic day of our economic recovery as Americans are getting back to work.",KamalaHarris
86,2022-01-07 19:18:00+00:00,1479532792308457478,We must defend and strengthen the right that unlocks all other rights: the right to vote.,KamalaHarris
87,2022-01-07 01:19:12+00:00,1479261301142695943,We must pass the voting rights bills that are before the U.S. Senate to ensure free and fair elections. https://t.co/CiHAUPxX8t,KamalaHarris
88,2022-01-07 00:00:18+00:00,1479241447811567616,"How will January 6 be remembered in the years ahead?

The American spirit is being tested and the answer to whether we will meet that test resides where it always has resided in our country, with you, the people. https://t.co/XtIhwDFoEe",KamalaHarris
89,2022-01-06 22:28:00+00:00,1479218218929725441,"January 6 reflects the dual nature of democracy—its fragility and strength. 

The fragility of democracy is that if we are not vigilant, democracy will not stand.

The strength of democracy is that everyone should be treated equally and that elections should be free and fair.",KamalaHarris
90,2022-01-06 21:05:22+00:00,1479197424853917706,"On January 6, we all saw what our nation would look like if the forces who seek to dismantle our democracy are successful—we cannot let our future be decided by those bent on silencing our voices. https://t.co/xWxQQHh62J",KamalaHarris
91,2022-01-06 01:35:00+00:00,1478902892169998346,"President @JoeBiden has made it clear: Take advantage of what’s available. 

Protect your family and your loved ones. Get vaccinated. https://t.co/ESoPVN8tmy",KamalaHarris
92,2022-01-05 22:02:00+00:00,1478849288952324096,Children ages 12 to 15 are now eligible to receive a COVID-19 booster shot. This is an enormous step forward in our fight to defeat this virus and protect our kids.,KamalaHarris
