,Datetime,Tweet Id,Text,Username
93,2022-01-05 21:12:02+00:00,1478836712910594050,"We all know what it means to miss a bus by just one minute—being at least an hour late to work, school, or visiting family during the holidays. 

The Bipartisan Infrastructure Law will invest in our public transit systems to ensure folks can get where they’re going. https://t.co/wXMTckHlAd",KamalaHarris
94,2022-01-05 18:00:21+00:00,1478788475285610514,"The COVID-19 vaccine and booster shots are our best defense in ending this pandemic. 

We need everyone to do their part. Please get vaccinated and get your booster shot.",KamalaHarris
95,2022-01-05 15:30:04+00:00,1478750655892369410,"The best protection against the Omicron variant for yourself, your neighbors, and your family is getting vaccinated and getting a booster shot. Get yours now.",KamalaHarris
96,2022-01-05 01:43:00+00:00,1478542516135813122,"In 2021, we reduced the unemployment rate to 4.2%, reduced the deficit by over $300 billion, and created 6 million jobs.

We’re keeping that progress going as we move into 2022.",KamalaHarris
97,2022-01-05 00:07:01+00:00,1478518360681979910,"We have the power today to have an impact on tomorrow, and we can’t shortchange the significance of that. 

Get vaccinated.",KamalaHarris
98,2022-01-04 18:30:05+00:00,1478433569219489793,"Vaccines are safe, they are free, and they save lives. Get your booster shot today. https://t.co/04ZMHyWTSe",KamalaHarris
99,2022-01-03 21:05:01+00:00,1478110173172486147,"A new year to continue building a better America. 

Let’s get to work. https://t.co/Zqb2yJ0J0y",KamalaHarris
100,2022-01-03 01:25:00+00:00,1477813210640265219,"In states across our nation, public transportation is not as fast or as frequent, as safe or as healthy as it can be—our Bipartisan Infrastructure Law will change that.",KamalaHarris
101,2022-01-01 17:39:02+00:00,1477333559425875968,May every single day of 2022 be filled with love and joy as we continue our work to build a better America. Wishing you and your loved ones a happy and healthy new year! https://t.co/rHZTi6aQBO,KamalaHarris
102,2021-12-27 20:38:00+00:00,1475566658399911942,"The Bipartisan Infrastructure Law will modernize our airports, roads, and bridges, helping  people get to where they need to go during future holiday seasons.",KamalaHarris
103,2021-12-26 17:11:01+00:00,1475152181267505154,"Our Kwanzaa celebrations are some of my favorite childhood memories. 

As families across the United States light the red, black, and green candles of the Kinara this week, our family sends our wishes and blessings for a happy and healthy new year.",KamalaHarris
104,2021-12-25 15:26:03+00:00,1474763377855631367,"From our family to yours, wishing you a safe and very merry Christmas filled with hope, happiness, and the comfort of loved ones. https://t.co/5fGnEECe66",KamalaHarris
105,2021-12-24 19:19:00+00:00,1474459613198266376,"To our health care and frontline workers who are working tirelessly this Christmas Eve to save lives, we thank you. Your work does not go unnoticed.",KamalaHarris
106,2021-12-24 16:45:03+00:00,1474420868864520195,My sister Maya and I have always loved Christmas—and there’s no greater gift than spending the holidays with loved ones. Have a safe and joyous holiday season. https://t.co/WAl4V0b9IA,KamalaHarris
107,2021-12-23 21:25:00+00:00,1474128934790959109,"We are working to ensure that Americans have access to free testing, including convenient COVID-19 at-home tests.",KamalaHarris
108,2021-12-23 14:45:02+00:00,1474028279938043904,"Our vaccines are the most powerful tools we have: they work to protect people from serious illness and death, and boosters provide us the strongest protection. 

As we head into the holiday season, let’s all do our part. Get vaccinated.",KamalaHarris
109,2021-12-23 01:15:15+00:00,1473824490794754053,"America’s children are breathing polluted air on their way to school.

By investing in electric school buses with our Bipartisan Infrastructure Law, we will be helping our children’s health. https://t.co/78wuk4trdc",KamalaHarris
110,2021-12-22 21:12:01+00:00,1473763277800886278,"Let it be clear: healthy economies require helping mothers and healthy children.

By investing in maternal health and child care, we will help get working mothers back to work and set our economy up for sustainable, long-term growth.",KamalaHarris
111,2021-12-22 18:30:02+00:00,1473722516011110401,"We must lower the cost of living for working people in America. And to do that, Congress must pass the Build Back Better Act.",KamalaHarris
112,2021-12-22 14:00:22+00:00,1473654648934481924,"1️⃣ Increased Support for Hospitals 
2️⃣ Robust Access to Free Testing 
3️⃣ Expanding Capacity to Get Shots in Arms 

Together, we're working to protect people from the Omicron variant and building a path out of this pandemic.",KamalaHarris
113,2021-12-22 02:08:00+00:00,1473475377544765445,"More than 200 million Americans have been fully vaccinated. 

Let’s not stop here: get vaccinated, and get your booster shot if you haven’t already.",KamalaHarris
114,2021-12-22 00:29:00+00:00,1473450463370653698,"Vaccines are free, convenient and save lives. 

Get vaccinated—not just for yourself, but for your family members and your community.",KamalaHarris
115,2021-12-21 20:26:00+00:00,1473389310443507715,"The maternal mortality crisis has been a big part of my life’s work.

As a U.S Senator, I crafted one of the first bills in history to target racial disparities in maternal mortality and address implicit bias in our health care delivery system—and we continue to do so today.",KamalaHarris
116,2021-12-21 01:29:00+00:00,1473103174726823947,"The Bipartisan Infrastructure Law will soon fix our roads and bridges, replace lead pipes, and connect families in urban and rural areas with accessible high-speed internet—and we will do all of this while creating good-paying jobs.",KamalaHarris
117,2021-12-20 18:54:12+00:00,1473003821152493577,This is the beginning of the end for lead in America. https://t.co/YoJ8fQgl2O,KamalaHarris
118,2021-12-19 01:21:00+00:00,1472376385956102146,"Our Lead Pipe and Paint Action Plan will coordinate the efforts of local, state, and federal partners toward a single goal:

Accelerating the removal of lead pipes and paint over the next ten years, particularly in communities that have historically been left out and left behind.",KamalaHarris
119,2021-12-18 18:21:00+00:00,1472270691382743047,"Republicans in Congress claim to want to lower costs and address inflation.

But not one supports the Build Back Better Act, which will lower costs on everything from health care to child care—which 17 Nobel Prize-winning economists say will ease long-term inflationary pressures.",KamalaHarris
120,2021-12-18 17:37:01+00:00,1472259619246456847,"In the United States, we are believers. We have faith in one another, in our nation, and our future. We believe a better future is possible—and are determined to build that future.",KamalaHarris
121,2021-12-18 00:32:11+00:00,1472001714924531714,There is absolutely no good reason why people in 21st century America should still be exposed to lead in their drinking water. https://t.co/LpEWtrxAD6,KamalaHarris
122,2021-12-17 19:38:00+00:00,1471927680899686409,"People who use public transportation spend more of their time in transit rather than spending time with their family, helping their children do their homework, running errands, or even relaxing after a hard day at work.

The Bipartisan Infrastructure Law will change that.",KamalaHarris
123,2021-12-17 16:16:01+00:00,1471876847436804102,"The future of transportation in our nation and around the world is electric.

Our nation’s ability to manufacture, charge, and repair electric vehicles will help determine the health of our communities, the strength of our economy, and the sustainability of our planet.",KamalaHarris
124,2021-12-17 14:00:19+00:00,1471842699124920329,"From establishing San Francisco's first environmental justice unit to working in the Senate to replace toxic drinking water infrastructure, I’ve long worked to clean up pollution.

Now, I’m thrilled to launch our effort to replace every lead pipe in America.",KamalaHarris
125,2021-12-17 02:16:00+00:00,1471665452665483265,"When union wages go up, everybody’s wages go up. 

President Biden and I are determined to be the most pro-labor, pro-union administration in American history.",KamalaHarris
126,2021-12-17 01:30:01+00:00,1471653877942571008,"Our Build Back Better Act will lower costs families have to pay every month—for prescription drugs, home care, child care, and more. And it will level the playing field by making corporations and the wealthiest pay their fair share.",KamalaHarris
127,2021-12-16 23:39:09+00:00,1471625980691238915,"The right to vote cannot be taken for granted—it must be safeguarded and strengthened.

Congress must pass the Freedom to Vote Act and the John Lewis Voting Rights Advancement Act. https://t.co/lGgUDStEU4",KamalaHarris
128,2021-12-16 20:47:01+00:00,1471582662045409283,"Our economy is growing faster than it has in decades. Unemployment is down to 4.2%, and nearly 6 million jobs have been added since January.

We must make sure that everyone shares in this growth by lowering costs for families and removing barriers to success in all communities.",KamalaHarris
129,2021-12-16 18:00:45+00:00,1471540818364227590,"Here’s the bottom line: When we unlock the economic power of communities across America, there is nothing we cannot achieve. https://t.co/4jnHqN1rSX",KamalaHarris
130,2021-12-16 16:07:01+00:00,1471512194223386624,"Democracy is neither an abstract concept nor a static state. 
Democracy lives in the people. 
Democracy is the people.
Democracy is our best hope.",KamalaHarris
131,2021-12-16 14:46:01+00:00,1471491810400747531,"Since Democrats came together to pass the American Rescue Plan, the Biden-Harris Administration has rolled out the most effective vaccination program in history.

Every Republican in Congress voted against it.",KamalaHarris
132,2021-12-16 01:15:01+00:00,1471287714691665923,The Bipartisan Infrastructure Law will start replacing 100% of our nation’s lead pipes and service lines so every child across America can turn on the faucet in their homes and schools and drink clean water.,KamalaHarris
133,2021-12-15 23:35:00+00:00,1471262548255297543,Our investment in electric vehicles will be a transformative down payment on our transition to a zero-emission future. https://t.co/PLr88cUT7j,KamalaHarris
134,2021-12-15 16:30:03+00:00,1471155606069334018,"When we ask people, what's the biggest barrier for them to buy an electric car? The answer is almost always figuring out where and how to charge it.

The Bipartisan Infrastructure Law will invest in a network of 500,000 chargers for all Americans for local &amp; long-distance trips.",KamalaHarris
135,2021-12-14 22:36:14+00:00,1470885369017159683,"By developing and deploying chargers for electric vehicles in communities across the country, we’ll ensure that nobody’s left behind as we lead America into the electric future. https://t.co/jof1RemMad",KamalaHarris
136,2021-12-14 19:00:23+00:00,1470831049588498433,"Yesterday, I headed to Prince George’s County, Maryland to discuss the electric vehicle investments in the Bipartisan Infrastructure Law and the Build Back Better Act.

The future of transportation is electric.",KamalaHarris
137,2021-12-14 14:51:00+00:00,1470768291648000013,"We know the path to controlling COVID-19 and limiting variants: get people vaccinated, get them boosted, and get our children over 5 vaccinated. Now is the time.",KamalaHarris
138,2021-12-14 01:48:00+00:00,1470571241400590337,"Seventeen Nobel Prize-winning economists wrote a letter affirming that the Build Back Better Act would reduce longer-term inflationary pressures in the economy.

Congressional Republicans are united against the bill.",KamalaHarris
139,2021-12-13 20:59:00+00:00,1470498512517443591,"Our Build Back Better Act invests in maternal health care by:

-Extending mandatory postpartum Medicaid coverage
-Investing in the maternal, prenatal, and postpartum workforce
-Improving maternal mental health
-Supporting community-based programs

We must act.",KamalaHarris
140,2021-12-13 18:00:28+00:00,1470453581694312460,"Our Build Back Better Act addresses the needs, concerns, and conversations around kitchen tables that are happening across our country—it's time to deliver results for American families. https://t.co/4vkpm9s94Q",KamalaHarris
141,2021-12-12 22:09:00+00:00,1470153741630332928,Every American deserves access to clean drinking water. The Bipartisan Infrastructure Law will help make that a reality by creating jobs that will start to replace lead pipes across the country.,KamalaHarris
142,2021-12-12 18:52:00+00:00,1470104164567031818,"We must do everything we can to protect and to strengthen both maternal health and reproductive health—our Build Back Better Act will do just that.
https://t.co/0eNA4x1pFQ",KamalaHarris
143,2021-12-11 02:36:00+00:00,1469496157722365956,"No parent should have to sit outside a fast-food restaurant so their child can do their homework online. The Bipartisan Infrastructure Law will create good-paying jobs that will help connect every American to affordable, high-speed internet.",KamalaHarris
144,2021-12-11 00:11:00+00:00,1469459669001420804,"Black women are more than 3x as likely to die from pregnancy-related complications. 

Native American women are more than 2x as likely to die.

Women in rural America are about 60% more likely to die.

Our Build Back Better Act will do something about that.",KamalaHarris
145,2021-12-10 20:23:00+00:00,1469402289089695746,"Democracy protects human rights and promotes human dignity. It’s a means to create peace and prosperity. It’s a means to solve our greatest challenges, from COVID-19 to the climate crisis. 

Democracy is our world’s best hope.",KamalaHarris
146,2021-12-10 14:45:03+00:00,1469317241846083595,"Every day we wait, every day we don’t address maternal mortality, is a day that a mother could die. We’re working on ending this trend. 
https://t.co/PChqiLYI1q",KamalaHarris
147,2021-12-10 02:18:00+00:00,1469129239958069254,"Our National Space Council will focus on three particular areas: 

1️⃣ Building our STEM workforce 
2️⃣ Addressing the climate crisis
3️⃣ Promoting rules and norms that govern space

These will guide our work as we venture through space exploration.",KamalaHarris
148,2021-12-09 22:06:01+00:00,1469065825940299790,"From bringing down the costs of prescription drugs, child care, elder care, we designed the Build Back Better Act to help address the reality of the needs of the American people.",KamalaHarris
149,2021-12-09 20:12:00+00:00,1469037134405382148,"1️⃣ Expanding the nationwide booster campaign
2️⃣ Launching new family vaccination clinics 
3️⃣ Making at-home tests covered by insurance 
4️⃣ Increasing our surge response teams 
5️⃣ Accelerating our efforts to vaccinate the rest of the world

Together, we can beat COVID-19.",KamalaHarris
150,2021-12-09 01:14:00+00:00,1468750746359369732,"The unemployment rate fell to 4.2%—a level experts didn’t expect us to achieve until 2024.

We’re making progress for workers, small businesses, and our economy.",KamalaHarris
151,2021-12-08 20:53:00+00:00,1468685064758255617,"If you’re a parent of one of the nearly 200,000 children in this country with type 1 diabetes, insulin can cost you hundreds of dollars a month. 

With the Build Back Better Act, you won’t pay more than $35 a month for your insulin.",KamalaHarris
152,2021-12-08 16:39:15+00:00,1468621204105973762,It’s simple: The Bipartisan Infrastructure Law and Build Back Better Act invests in our people. https://t.co/YGDvEmdHpa,KamalaHarris
153,2021-12-08 02:08:00+00:00,1468401947434758146,"1️⃣ Capping insulin costs at $35 per month for millions of Americans
2️⃣ Allow Medicare to negotiate drug prices 
3️⃣ Penalize companies for rapid price increases

Our Build Back Better Act takes these three key steps to lower the cost for families dealing with diabetes.",KamalaHarris
154,2021-12-07 19:00:22+00:00,1468294331832455170,"Under the House’s Build Back Better Act, the cost of insulin will be capped at $35 a month for millions of Americans. https://t.co/LoxPiB3Eib",KamalaHarris
155,2021-12-07 14:40:00+00:00,1468228808083968010,"President Biden said it best: Nothing will be more expensive for American families than a NO vote on the Build Back Better Act.
https://t.co/b4GBh1huMN",KamalaHarris
156,2021-12-07 01:33:00+00:00,1468030751757283330,"If you’re a typical family of four with two kids, our Build Back Better Act will provide up to $7,400 in tax cuts and savings for you.",KamalaHarris
157,2021-12-06 23:01:00+00:00,1467992500812013568,"We made a commitment that we were going to work to bring down the cost of prescription drugs with a particular emphasis on insulin.

Under our Build Back Better Act, the cost of insulin will be capped at $35 a month for millions of Americans.",KamalaHarris
158,2021-12-06 20:44:00+00:00,1467958024048459776,Checks in pockets. Tax cuts for working families. That’s all thanks to the American Rescue Plan. https://t.co/vfheEkG2c4,KamalaHarris
159,2021-12-06 18:53:00+00:00,1467930089199394829,"The climate crisis is not slowing down, and neither can we. 

Our Build Back Better Act will make a historic investment to help families weatherize their homes, help businesses produce clean energy, and put our nation on a path to reduce emissions.",KamalaHarris
160,2021-12-06 16:40:01+00:00,1467896620993945602,"Access to high-speed internet can also account for the purposes of telemedicine, so folks in rural communities can have access to the kind of care that they deserve and need.",KamalaHarris
161,2021-12-06 01:54:00+00:00,1467673648517558275,"With free at-home COVID-19 testing, you and your family will be able to test from the comfort of your home and have some peace of mind this holiday season. 
https://t.co/ZI5UPrbnwk",KamalaHarris
162,2021-12-05 01:21:00+00:00,1467302955892236290,"As a nation, we have an obligation to our veterans; to care for them and their families when they return home. 

President Biden has done so by signing three bipartisan bills into law to help our veterans and their families get the support they need. https://t.co/I3kjZBqAWv",KamalaHarris
163,2021-12-04 22:16:00+00:00,1467256400715857934,"Here’s the bottom line: World-class cities like Charlotte, North Carolina, deserve world-class transit systems, and our Bipartisan Infrastructure Law will make the most significant investment to fix our roads and bridges in 70 years.",KamalaHarris
164,2021-12-04 19:42:00+00:00,1467217644227121152,"Nearly 6 million million new jobs since President @JoeBiden and I took office. 

While there’s more work to be done, we are making tremendous strides to build our country back better than before.",KamalaHarris
165,2021-12-04 17:38:14+00:00,1467186496964804617,"For millions of Americans, riding the bus is part of their everyday routine—our Bipartisan Infrastructure Law will make the investments needed to upgrade our public transit systems. https://t.co/XppoUETmEV",KamalaHarris
166,2021-12-04 15:32:00+00:00,1467154730958958601,"I visited Charlotte, North Carolina to talk about the investments we’re making in public transit and jobs.

The Bipartisan Infrastructure Law will help people get to where they need to go.",KamalaHarris
167,2021-12-04 02:13:19+00:00,1466953733292662787,"Through our work in space, we have the opportunity to benefit not only the American people but all of humanity. https://t.co/bc49Vw8kQW",KamalaHarris
168,2021-12-04 00:38:00+00:00,1466929746487525376,"Happy Hanukkah, everyone. 

Through these periods where we experience darkness, always remember what each of us has and can give to each other: light. https://t.co/zRDddvYQjA",KamalaHarris
169,2021-12-03 03:11:00+00:00,1466605862693310468,"No one should have to pay $1,000 per month for insulin. 

The Build Back Better Act would lower costs for prescription drugs and make sure no one pays more than $35 a month for their insulin.",KamalaHarris
170,2021-12-02 21:40:01+00:00,1466522567410388996,"For too long, infrastructure in our country has gone overlooked. We now have the opportunity to act with the Bipartisan Infrastructure Law. 

Let’s get to work. https://t.co/g9Lla0RfAT",KamalaHarris
171,2021-12-02 19:00:21+00:00,1466482386573660172,"Hanukkah is one of our family’s favorite holidays, and every year, our family—like so many around the world—gathers to reflect on the lessons of the Hanukkah story. 

The power of the people, the belief that, even in despair, there is hope, that even in darkness, there is light.",KamalaHarris
172,2021-12-02 14:45:03+00:00,1466418137184751631,"To compete in the 21st century we need to invest in our infrastructure—in our roads, bridges, highways, ports, and airports. The Bipartisan Infrastructure Law will make that investment.",KamalaHarris
173,2021-12-02 01:10:00+00:00,1466213024260366336,"For years, I have led the fight to address the tragedy of maternal mortality among our women veterans.

With the Protecting Moms Who Served Act signed into law, we'll help expand and diversify the maternal health workforce and improve mental health.",KamalaHarris
174,2021-12-01 20:54:01+00:00,1466148605039984646,"President @JoeBiden is working to address high gas prices and lower the costs Americans face at the pump. 

In the long run, we will reduce our dependence on oil and create good-paying jobs by transitioning to a clean energy economy. That’s why we must pass Build Back Better.",KamalaHarris
175,2021-12-01 00:28:00+00:00,1465840067847589889,"There’s still time to get your first shot, your booster shot, and get your children vaccinated before Christmas so you can celebrate the holidays safely. 

Go to https://t.co/sohfL3zr12 to find a vaccine provider near you.",KamalaHarris
176,2021-11-30 20:44:01+00:00,1465783697978896385,"Unbought and unbossed, the late Congresswoman Shirley Chisholm paved the way for me and the Black women who came before me. Honored to be included in @HigherHeights’ 2021 Chisholm List alongside so many strong women leaders. https://t.co/Z8kAr9WKDv",KamalaHarris
177,2021-11-30 17:30:05+00:00,1465734895892942852,"The best protection against the Omicron variant for yourself, your neighbors, and your family is getting fully vaccinated—and getting a booster shot.",KamalaHarris
178,2021-11-30 16:09:03+00:00,1465714500049461250,"President @JoeBiden took action to get two of our largest ports, Los Angeles and Long Beach, operating 24/7—and reduce congestion at the Port of Savannah, our 4th largest port.

This will reduce supply chain congestion, get goods to market faster, and lower costs for Americans.",KamalaHarris
179,2021-11-30 02:28:00+00:00,1465507877393776642,"Our administration has seen 5.6 million jobs created by the economy—more jobs in our first nine months than any other administration in American history. 
https://t.co/ZQ3SVFnlzO",KamalaHarris
180,2021-11-30 01:27:00+00:00,1465492526513725442,Unemployment claims fell to their lowest level in more than 50 years. President @JoeBiden’s economic plan is working.,KamalaHarris
181,2021-11-29 22:45:01+00:00,1465451760508719111,President @JoeBiden has a message for all Americans concerned about the Omicron variant. https://t.co/Ep87GeukUg,KamalaHarris
182,2021-11-29 20:58:00+00:00,1465424831399276546,"We have an opportunity to lower costs, cut middle-class taxes, and invest in our children’s future. 

We must pass the Build Back Better Act.",KamalaHarris
183,2021-11-28 20:00:06+00:00,1465047869971636224,"Happy Hanukkah! Sending my warmest wishes to those celebrating in the United States and around the world. May you find peace, love, and happiness this season as you gather with friends and family.",KamalaHarris
184,2021-11-27 17:39:00+00:00,1464649976164798464,"As President Biden says, America’s small businesses are the primary job creators, innovators, and drivers that power our nation’s economic progress. On Small Business Saturday and throughout the holidays, be sure to shop local and support the backbone of our communities.",KamalaHarris
185,2021-11-27 00:20:00+00:00,1464388502964084740,"Under the Biden-Harris administration, America has seen record job creation, economic growth, and small business creation. 

We’re rebuilding our economy to lift up all Americans.",KamalaHarris
186,2021-11-25 21:37:00+00:00,1463985093802967041,"Today, President @JoeBiden and I are thinking about all the families who have an empty seat at Thanksgiving this year after losing a loved one to COVID-19—each of you is in our hearts.",KamalaHarris
187,2021-11-25 15:00:41+00:00,1463885358303793155,"To our military families whose loved ones are serving overseas, and to all Americans across the country, wishing you and yours a happy Thanksgiving. We hope your day is filled with blessings, laughter, and gratitude.",KamalaHarris
188,2021-11-25 01:19:00+00:00,1463678574360203269,"By delivering vaccines that are effective, safe, and free, our administration has worked to ensure Americans can be together again with their loved ones this Thanksgiving.",KamalaHarris
189,2021-11-24 21:11:14+00:00,1463616221870440448,"Thanks to the American Rescue Plan, we will invest $1.5B to help build our health care work force and address the urgent shortage of doctors, nurses, and behavioral health care providers in urban and rural areas across the country. https://t.co/Y1zWWa89pd",KamalaHarris
190,2021-11-24 19:12:00+00:00,1463586216515878913,"President Biden is taking action to help moderate the price of oil and reduce the price of gas.
https://t.co/OKUPuKjipc",KamalaHarris
