,Datetime,Tweet Id,Text,Username
157,2021-10-01 13:45:00+00:00,1443934977322795013,"The death of our democracy begins with deliberate attacks on truth.

The erasure of norms and elimination of checks and balances.

We can’t allow our democracy to falter. We must shore up our institutions against those who would destroy them.

#ProtectingOurDemocracyAct. https://t.co/9SVCs7ea7o",RepAdamSchiff
158,2021-10-01 00:44:55+00:00,1443738664396369923,"Behind-the-scenes workers are the heart of the entertainment industry.
 
Yet their work often goes unrecognized – and should be fairly compensated.
 
Living wages and humane working conditions must be the standard.
 
We must have dignity and respect for all. https://t.co/5eWtHwwg7i",RepAdamSchiff
159,2021-09-30 15:29:17+00:00,1443598835171971075,"I'm in awe of my colleagues, Cori, Barbara, and Pramila, for sharing their personal stories.

They have shown such courage and strength by speaking out.

Their truths are a powerful statement on why we can't lose an inch in the ongoing fight to protect the right to choose. https://t.co/6CSx3K8IHK",RepAdamSchiff
160,2021-09-29 22:38:13+00:00,1443344392098619399,"Democrats will make sure we don’t default on our debt.

GOP leaders in Congress just don’t care. 

They will torpedo our economy if they think it will help them. 

It won’t. It will just harm the American people.

The GOP must never be allowed to govern.

Because they can’t.",RepAdamSchiff
161,2021-09-29 19:31:48+00:00,1443297478535692292,"YouTube’s curbing of anti-vaccine content is a strong first step.

But this doesn't mark the end of our fight against deadly misinformation.

These policies must be enforced.

And we must keep pushing for other companies to follow suit.

What do you say, @Amazon and @Facebook?",RepAdamSchiff
162,2021-09-29 01:40:47+00:00,1443027945963114509,"Let’s not overcomplicate this:

Republicans passed a $2 trillion tax cut for billionaires and corporations.

And now they’re refusing to pay for it.

It’s really that simple.",RepAdamSchiff
163,2021-09-28 18:45:06+00:00,1442923336099512321,"Crack &amp; cocaine are chemically identical.

The only difference? How we punish their use.

80% of those in federal prison on drug charges are Black or Hispanic.

This disparity is the stark reality of the racial biases plaguing our justice system.

It's past time to root them out.",RepAdamSchiff
164,2021-09-28 12:12:01+00:00,1442824412852625409,"A government shutdown and default means:

Millions of jobs lost
Families pushed into poverty
Our economy in a downturn

A catastrophe. 

But Mitch McConnell, Kevin McCarthy, and Republicans have a different term for it:

A win - at least in their craven brand of politics.",RepAdamSchiff
165,2021-09-27 22:02:13+00:00,1442610555311722509,"Dreamers are Americans. And proudly so.
 
This is their home. It will always be.
 
Protecting DACA is a moral imperative.
 
And this is just the beginning of our efforts to create a pathway to citizenship for those seeking refuge, safety, and stability.

https://t.co/Z43An4lFwk",RepAdamSchiff
166,2021-09-24 16:36:45+00:00,1441441485103280128,"Republicans across the nation are working tirelessly to rob women of their right to choose.
 
These bans on abortion are draconian – and just plain wrong.
 
We cannot let them stand.
 
That's why I just voted YES on the Women’s Health Protection Act.",RepAdamSchiff
167,2021-09-23 22:29:30+00:00,1441167870784901121,"The #ProtectingOurDemocracy Act isn’t about one man, one party, or even one moment in time.
 
It’s about ensuring that our democracy endures — no matter who’s in the White House.
 
And we should all be able to get behind that.

https://t.co/yFbFZ9auxT",RepAdamSchiff
168,2021-09-23 16:38:08+00:00,1441079444580483079,Tallulah appreciates your support for her policy priorities. https://t.co/PPHcVPGY8D https://t.co/Xfl9OtHo9P,RepAdamSchiff
169,2021-09-23 14:04:14+00:00,1441040717279805446,"We must do everything in our power to bring the horrific conflict in Yemen to an end.
 
And we must start by cutting off funding to the coalition fueling this devastating war.
 
We cannot be a party to such suffering. https://t.co/PQcA5N5x31",RepAdamSchiff
170,2021-09-22 22:17:25+00:00,1440802441629290499,"For four years, our democracy was tested by a man with no moral compass.

But Trump’s most dangerous act was leaving a roadmap for a future executive to abuse the power of the presidency.

Congress must respond — and we are — with the #ProtectingOurDemocracy Act. https://t.co/0ulLO78sn5",RepAdamSchiff
171,2021-09-22 14:25:20+00:00,1440683638740320257,"Try not to punch down, but Jim Jordan’s obsession with me borders on unhealthy.

Want evidence? How about providing internal polling to Kremlin intelligence while they ran a social media campaign for Trump?

Or is that business as usual for the GOP? 

https://t.co/vua2e1mLsu https://t.co/bwPXLjrLBn",RepAdamSchiff
172,2021-09-21 22:48:32+00:00,1440447882222444549,"There is no higher priority than protecting our people. None.

As we examine the cause of the illness known as Havana Syndrome, we must ensure those impacted get the care they deserve.
 
My HAVANA Act will do just that. And it's on its way to President Biden's desk for signature.",RepAdamSchiff
173,2021-09-21 22:00:52+00:00,1440435888291414017,"I want to thank @SpeakerPelosi, @RepJerryNadler, @RepMaloney, @RepJohnYarmuth, @RepZoeLofgren, @RepGregoryMeeks, @RepRichardNeal, and so many of my other colleagues for ensuring that protecting democracy is a priority for this Congress and our country.

6/6",RepAdamSchiff
174,2021-09-21 22:00:52+00:00,1440435886731059215,"Our democracy is in critical danger. 

And so, we must act. With fierce urgency.

Because if we don’t, we stand to lose everything.

And I fear we won’t be able to get it back.
 
5/6",RepAdamSchiff
175,2021-09-21 22:00:51+00:00,1440435885321822211,"That’s why I JUST introduced the #ProtectingOurDemocracy Act.

A landmark package of reforms that will root out corruption, rein in presidential abuses of power, and strengthen our system of checks and balances.

It's big, bold, and badly needed.
 
4/6",RepAdamSchiff
176,2021-09-21 22:00:51+00:00,1440435884042510342,"Fortunately, the former president no longer holds that office.

But the weaknesses he exploited remain.

And we cannot wait for the next demagogue or wannabe authoritarian to come along before we take decisive action.

We must act. Now. Before it's too late.

3/6",RepAdamSchiff
177,2021-09-21 22:00:51+00:00,1440435882675228673,"Trump was not the architect of the systemic failures that weakened our country and tore at our national fabric. 

He simply exposed and exploited vulnerabilities that have lingered for decades.

And proved just how ruinous these cracks in our democratic foundation can be.

2/6",RepAdamSchiff
178,2021-09-21 22:00:50+00:00,1440435879755927562,"It’s no secret Donald Trump held little regard for our country, our Constitution, or our democracy.

He only cared about himself.

He trampled on our norms and institutions, violating laws and breaking long-standing precedent with shocking ease.

🧵 Here’s how we fix it: 
 
1/6 https://t.co/8Ve46JCTba",RepAdamSchiff
179,2021-09-21 20:43:06+00:00,1440416319963234313,"We will be judged by how we treat our most vulnerable. 
 
Refugees are at great risk, and come in search of a better life, inspired by the promise of the American dream.

Reports of their mistreatment are a stain on our legacy.

Those responsible must be held to account. https://t.co/rEkhGin25J",RepAdamSchiff
180,2021-09-21 14:34:51+00:00,1440323643578339329,"Democracy is the defining ideal of our nation. Our lifeblood.
 
But right now, that sacred legacy is in grave danger.
 
So, we must take aggressive action to defend it.
 
We must pass the #ProtectingOurDemocracyAct.",RepAdamSchiff
181,2021-09-18 14:30:57+00:00,1439235500078944261,"It seems impossible that we’ve been without our lioness of law for a year.
 
Justice Ruth Bader Ginsburg led a truly remarkable life.
 
She was a trail-blazer in every sense of the word.
 
And though she may be gone, her legacy continues to inspire millions –  including me. https://t.co/yH2gfncnQ9",RepAdamSchiff
182,2021-09-17 22:20:10+00:00,1438991192100950016,"I'm horrified that a U.S. strike killed 10 Afghan civilians, most of them children.
 
We must conduct thorough oversight into this matter and press for answers and accountability.
 
I will continue to pray for the victims and their families.
 
My full statement: https://t.co/eXJPGhdlbb",RepAdamSchiff
183,2021-09-15 21:20:19+00:00,1438251355966218240,"From my family to yours, may all those who observe have an easy fast and a meaningful Yom Kippur.
 
We’ve been through so much in the past year, and I hope you find peace during this moment of reflection.
 
G'mar Chatima Tovah.",RepAdamSchiff
184,2021-09-14 22:46:46+00:00,1437910724932739074,"Despite the financial strain caused by COVID-19, the overall poverty rate in the U.S. fell in 2020.

How is that possible?

Two words: direct relief.

Putting money into the pockets of struggling Americans builds a more equitable economy.

Now let’s make these efforts permanent. https://t.co/dw26aNp0EE",RepAdamSchiff
185,2021-09-13 17:07:50+00:00,1437463040732155910,"As Trump spread lies about the 2020 election, one GOP official asked: “What’s the downside for humoring him?”

Well, there’s insurrection. 

And this. This is the downside.

Even now, Republicans continue to parrot these baseless conspiracies.

Further undermining our democracy. https://t.co/GQCA5e00nw",RepAdamSchiff
186,2021-09-11 13:01:44+00:00,1436676331958423554,"Two decades later, the memory of September 11, 2001 is as painful as ever and the loss is just as acute.
 
Our hearts are with the loved ones of all those we lost on that tragic day.
 
We will never forget their stories, their legacies, or their courage.",RepAdamSchiff
187,2021-09-09 20:55:37+00:00,1436070811543166980,"We must spare no effort to restore the right to choose in Texas.
 
Because let’s be clear: banning abortion doesn’t actually end abortion. 
 
Just safe ones.
 
We can never return to the days of back alleys and coat hangers.
 
Never.",RepAdamSchiff
188,2021-09-09 14:23:23+00:00,1435972106223767560,"Vaccine hesitancy stands between us and the end of this pandemic.
 
And companies like @amazon and @facebook must do far more to tackle the viral spread of misinformation online.
 
We need transparency. And we need accountability.
 
Lives are on the line.
 
Read my letters. ⤵ https://t.co/yo0iBcTw2p",RepAdamSchiff
189,2021-09-08 17:52:27+00:00,1435662331451674626,"Trump just said the California recall is “probably rigged.” It's not.
 
And even this week, Elder said “we know there were shenanigans” in 2020. There weren't.
 
It’s the same darn cynical playbook.
 
Spread misinformation. Confuse the voters. Subvert our democracy. Repeat.",RepAdamSchiff
190,2021-09-07 00:10:03+00:00,1435032580609515524,"Rosh Hashanah is a time for hope.

A celebration of the sweet things in life and the sweeter things still to come.

And for me, there’s nothing sweeter than spending time with family.

L'shanah tovah!",RepAdamSchiff
191,2021-09-06 14:30:36+00:00,1434886756097220613,"The labor movement helped build a better America.

By fighting for paid time off, health benefits, and so much more.

So as you enjoy this long weekend, take time to thank those who work to keep our country running and the unions who’ve got their backs.",RepAdamSchiff
192,2021-09-03 16:55:42+00:00,1433836107779776513,"Here are the facts: 

1. People of color tend to live closer to polluters and hazardous waste sites.

2. Those communities often don’t have the infrastructure for extreme weather.

3. The climate crisis is here. But its impact is not equal.

Climate justice is racial justice.",RepAdamSchiff
193,2021-09-01 14:16:16+00:00,1433071209982402561,"This is what we feared.

When Republicans stole a Supreme Court seat from the American people, they did it for exactly this purpose:

To erase a woman’s right to choose.

And early this morning, at 12:01AM, Texas did just that.

This cannot stand.",RepAdamSchiff
194,2021-08-31 23:41:39+00:00,1432851107496275970,"Republicans are scared. Absolutely terrified.

They know that most people don’t support them or their backward policies.

So they’re trying like hell to suppress the vote.

And blocking our efforts in Congress to stop them.

There’s no accommodating them. They must be defeated.",RepAdamSchiff
195,2021-08-31 00:14:37+00:00,1432497016559611906,"With just one round of child tax credit payments, the child poverty rate was slashed by 25%.

You read that right: 25%.

And it reminds us of a simple fact: we have the power to end childhood poverty.

All we need is the will to act.",RepAdamSchiff
196,2021-08-29 17:00:16+00:00,1432025319779807236,"Our fallen servicemembers have returned home.

Their bravery helped evacuate over 100,000 people and saved countless lives.

They were the best of us. And we will not forget them. 

May God give comfort to their families. https://t.co/GvEUQbN2rp",RepAdamSchiff
197,2021-08-27 14:13:50+00:00,1431258661024931850,"California has always been a shining beacon of hope for refugees and immigrants in need of safe harbor.

And today that obligation is perhaps more sacred than ever before.

That's why we sent a letter to @POTUS to let it be known:

Afghan refugees are welcome here. https://t.co/Apc8TnIx8M",RepAdamSchiff
198,2021-08-26 18:01:57+00:00,1430953677834051584,"Devastating to learn of the loss of U.S. servicemembers and Afghans at Kabul Airport.

While it is too early to draw any conclusions, ISIS-K had a clear motivation to disrupt our efforts.

My prayers are with our brave servicemembers as they continue these vital evacuations. https://t.co/iliCK2Y0u1",RepAdamSchiff
199,2021-08-25 22:10:48+00:00,1430653916228853763,"My office is helping constituents get loved ones out of Afghanistan, along with interpreters, journalists, women leaders, activists, and others at great risk. 
 
And we’ll continue to do this vital work.

No effort must be spared to evacuate all Americans and our Afghan allies: https://t.co/mN1pPp81hA",RepAdamSchiff
200,2021-08-25 19:33:10+00:00,1430614244651896834,"Just an unfriendly reminder:

Every single House Republican voted against protecting the right to vote.

Every. Single. Republican.

Don’t let them forget it.",RepAdamSchiff
201,2021-08-25 14:01:52+00:00,1430530870000201728,"The House has passed a budget to invest in:

🌎 Green energy &amp; jobs
🎓 Free community college &amp; early childhood education
🇺🇸 A pathway to citizenship
👨‍👩‍👧‍👦 Paid family &amp; medical leave

And more.

It’s time to invest in our communities to build an economy that works for everyone.",RepAdamSchiff
202,2021-08-24 14:06:33+00:00,1430169664076791818,"The right to vote is under attack. Our democracy is in unprecedented peril.

History will remember us by how we meet this moment.

Are we willing to stand up for democracy?

I am.

Let’s pass the John Lewis Voting Rights Advancement Act. Before it's too late.",RepAdamSchiff
203,2021-08-23 16:17:35+00:00,1429840250654937094,"The FDA has officially granted full approval to the Pfizer vaccine, confirming what experts already knew:
 
These vaccines are SAFE. And these vaccines WORK.

If you haven’t already, please go get your shot TODAY.

It’s FREE. It’s EASY. And you very well may SAVE A LIFE.

YOURS.",RepAdamSchiff
204,2021-08-19 23:51:56+00:00,1428505041120468996,"Erasing student loan debt for people with disabilities is a win in the fight for a more just society.

It ensures that the doors of higher education stay open to all—no matter their ability to pay.

This is just the beginning of our work to erase the burden of student loan debt. https://t.co/fr2vDqtsWf",RepAdamSchiff
205,2021-08-18 18:17:39+00:00,1428058525243215875,"As we evacuate Americans and Afghan allies, we must help journalists who risked their lives in pursuit of the truth.

Today, @RepSteveChabot and I delivered a letter to @POTUS calling on the administration to offer safe passage to the press.

We must ensure no one is left behind. https://t.co/RlyxjxfqSQ",RepAdamSchiff
206,2021-08-17 22:35:59+00:00,1427761151664926723,"I believe every American has the right to vote. Period.
 
Republicans vehemently disagree. 
 
They’d prefer to pick their voters, rather than letting the voters pick them.
 
They’re waging war on democracy. That must end.
 
It’s time to pass the John Lewis Voting Rights Act. Now.",RepAdamSchiff
207,2021-08-16 16:44:27+00:00,1427310297996570628,"FireGuard helps firefighters react to wildfires before they spiral out of control.

And when lives and livelihoods are on the line, every second counts.

If we don’t act, this program will expire — we can’t let that happen.

Read our letter to @DeptofDefense. ⤵️ https://t.co/KMxdCnVtrn",RepAdamSchiff
208,2021-08-16 00:21:15+00:00,1427062864846675968,"The scenes unfolding in Afghanistan are heartbreaking. 

As we evacuate U.S. personnel, we have an obligation to our Afghan partners, allies and women in serious danger.

My statement: https://t.co/U8r3QdRcrt",RepAdamSchiff
209,2021-08-13 18:44:40+00:00,1426253385125203971,"No child should ever go hungry. Full stop.
 
The Child Tax Credits – now hitting the bank accounts of millions – will help end childhood hunger.
 
We must make these middle class tax cuts permanent. Failing to do so amounts to nothing more than failing the most vulnerable kids. https://t.co/8KW1ymrkh6",RepAdamSchiff
210,2021-08-10 17:58:56+00:00,1425154711930347522,"The Senate just passed a bipartisan infrastructure bill.

That’s a big deal. But the next step must be an investment in our people, too.

We need to address climate, health care, housing, education and childcare.

Investing in our people, our country and our planet.

Let’s do it.",RepAdamSchiff
211,2021-08-09 19:15:18+00:00,1424811545247158281,"Too many impacts from climate change are now “irreversible,” says a new UN report.

But that doesn’t mean we give up. Far from it. It means we act.

Right now to ensure action on climate is part of any infrastructure investment.

Right now to include it in any budget.

Right now.",RepAdamSchiff
212,2021-08-07 01:09:23+00:00,1423813490385563650,"Our democracy faces its greatest threat in generations.

Republicans across the country are working to suppress the vote, particularly for Black, Hispanic, and Indigenous Americans.

It’s Jim Crow 2.0. It’s despicable and dangerous, and it cannot stand.

We must restore the vote.",RepAdamSchiff
213,2021-08-06 22:55:17+00:00,1423779740536741891,"For 10 years, my student loans were more than my rent.

And it’s gotten so much worse.

Pausing student loan payments will help thousands of students.

But we must do more to ease the burden — and cancel up to $50,000 in student debt — before it crushes a whole new generation.",RepAdamSchiff
214,2021-08-06 14:40:42+00:00,1423655276801110016,"We must close the Guantanamo Bay detention facility.

It can be done safely and it’s continued operation is inconsistent with our commitment to the rule of law.

That’s why I joined 72 colleagues to call on @POTUS to fulfill his promise and close its doors.

Read our letter. ⤵️ https://t.co/5YIeV8BhcB",RepAdamSchiff
215,2021-08-05 17:28:19+00:00,1423335070018965506,"Richard Trumka dedicated his life to elevating working Americans.

He was an exceptional leader — and an even better person.

My heart breaks for his family and for the country, which just lost one of the foremost champions for the rights of working families. https://t.co/XBiHOHspYV",RepAdamSchiff
216,2021-08-04 23:25:50+00:00,1423062654571192322,"@SunriseLAYouth Thanks for dropping by and for continuing to lead the way! I look forward to fighting alongside you for a Green New Deal, a Civilian Climate Corp, and a better future for all of us. 🌅",RepAdamSchiff
217,2021-08-03 22:16:07+00:00,1422682720866639877,"This eviction moratorium will keep millions of people in their homes.

And it wouldn’t be possible without leadership from @RepMaxineWaters, @RepCori, and so many others.

Now, we must seek permanent solutions to help our unhoused neighbors.

Because we can, and must, do better. https://t.co/XryAovqczt",RepAdamSchiff
218,2021-08-02 22:39:16+00:00,1422326160613122053,"On January 6, Officer Gunther Hashida fought valiantly to defend our nation’s Capitol from a violent mob of domestic terrorists.

He risked his life in service of his country.

May his memory be a blessing — for his family and for this country.",RepAdamSchiff
219,2021-08-02 18:47:38+00:00,1422267867404308492,"Michael Freedy will never marry his fiancé or watch his kids grow up.
 
His life was cut needlessly short by COVID-19.
 
One of his final texts: ‘I should have gotten the damn vaccine.'
 
Please, go get the damn vaccine. https://t.co/f3wGBWPjVW",RepAdamSchiff
220,2021-08-01 17:00:10+00:00,1421878434469457927,"Making light of striking the Speaker after a mob broke into the Capitol intent on doing her violence?

Real funny @GOPLeader

Questioning the life-saving science on wearing a mask? 

Real smart @GOPLeader

The GOP under Trump and McCarthy is a dangerous cult.

And that’s no joke.",RepAdamSchiff
221,2021-07-30 18:51:59+00:00,1421181798692921351,"Housing is a fundamental right. Everyone deserves a roof over their head.
 
If we don’t act, more than 3 million Americans could face eviction.
 
And forcing people out of their homes during a global pandemic is exceptionally cruel.
 
Congress must step in before it’s too late.",RepAdamSchiff
222,2021-07-28 18:25:16+00:00,1420450299169345544,There’s still more to learn about what happened on January 6. https://t.co/7vfzHe6Fhc,RepAdamSchiff
223,2021-07-27 18:08:03+00:00,1420083577249832971,"Officer Dunn asked, is this America?

Is it? Resorting to violence when we lose an election? 

So driven by hate that we attack those who look or vote different?

If so, God help us.

I believe in America. These officers are why. They are the future. 

Not those who attacked us. https://t.co/CQexrNP020",RepAdamSchiff
224,2021-07-27 13:28:44+00:00,1420013283730460681,"I was on the floor as the Capitol was under siege.

I was evacuated by police, along with my House colleagues, staff, and members of the press.

Those courageous individuals saved lives — mine may have been one of them.

They're heroes. And their stories deserve to be told. https://t.co/9sAhYREgp0",RepAdamSchiff
225,2021-07-25 18:12:33+00:00,1419359932617576448,"Speaker Pelosi’s decision to appoint @RepKinzinger to the Jan. 6 Select Committee is the right one.

This investigation is a moral and constitutional imperative that should transcend partisan politics.

Congressman Kinzinger knows that — and I look forward to working with him. https://t.co/R6dHhslezj",RepAdamSchiff
226,2021-07-24 21:42:25+00:00,1419050360824553472,"The Delta variant doesn’t care if you're a Democrat or Republican.
 
It’s infectious. It’s deadly. And it’s on the rise.
 
If you are unvaccinated, you are at risk.
 
I strongly encourage everyone to get vaccinated.
 
Find out more: https://t.co/GsoUsR0xnk",RepAdamSchiff
227,2021-07-23 18:08:30+00:00,1418634139532775431,"The Republican Party is a shell of its former self.

What we see today is a cult of personality beholden to the whims of a disgraced, former president.

Republicans of good conscience — both in power and out — must take their party back.

America needs two functional parties.",RepAdamSchiff
228,2021-07-23 13:59:32+00:00,1418571487158673410,"Speaking truth to power takes courage. Especially when it subjects you to vile, racist hate.

Officer Dunn is a patriot who risked his life to protect the Capitol and our democracy, and continues to fight for the truth.

That’s far more than anyone can say about @TuckerCarlson.",RepAdamSchiff
229,2021-07-22 19:31:03+00:00,1418292527908757515,"Our most sacred value – the right to vote – is on the line.

@RepHankJohnson and activists know the stakes. And they're willing to risk their own freedom to preserve ours.

We cannot let that sacrifice be in vain.

We must end the filibuster. We must protect our democracy. https://t.co/eTCiJJJds0",RepAdamSchiff
230,2021-07-22 14:57:44+00:00,1418223741730017280,"As we withdraw from Afghanistan, we must do right by our Afghan partners who served alongside us.

Today, we took action, led by @RepJasonCrow, to expand the visa program and ensure our Afghan partners can be evacuated to safety.

Their lives depend on us keeping our promises.",RepAdamSchiff
231,2021-07-22 01:50:15+00:00,1418025567119630340,"McCarthy is scared. Stefanik, too. They never wanted an investigation into Jan. 6 to go forward because they are afraid of what America will learn.

Now they’re throwing pointless partisan bombs hoping no one realizes they’ve once again put Trump before country.",RepAdamSchiff
232,2021-07-21 18:54:06+00:00,1417920840440680453,"Investigating January 6 is a sober endeavor. One demanding good faith participation from both parties. 

Time after time, McCarthy has shown he is not up to that task. 

But we cannot allow him to derail our important work or appoint others who will.

We will uncover the truth.",RepAdamSchiff
233,2021-07-21 00:16:00+00:00,1417639459647115266,"Listen, I’m all for space exploration and it must have been an amazing view.

But maybe – and I’m just spitballing here – if Amazon and other companies paid their fair share in taxes, we could lift all kids — if not into space — at least out of poverty.

Sincerely,

Earthlings",RepAdamSchiff
