,Datetime,Tweet Id,Text,Username
0,2022-02-23 17:56:59+00:00,1496544632716644359,"Trump is again cozying up to Putin.

It’s part of an ugly pattern.

He welcomed and used Russian help in his 2016 campaign.

He withheld military aid to Ukraine to get help in his 2020 campaign.

And it won’t be the last time that Trump undermines US security.

If we let him.",RepAdamSchiff
1,2022-02-23 15:09:30+00:00,1496502484080156673,"It’s disturbing that SF police may have used DNA from a sexual assault survivor to link her to an unrelated crime.

Survivors show immense courage in coming forward.

We should support them completely – not treat them as suspects.

The FBI must address this abuse of DNA evidence.",RepAdamSchiff
2,2022-02-22 22:53:22+00:00,1496256833387999232,"The Biden admin has delivered serious consequences for Russia following its invasion of Ukraine.

But we must be prepared to go further. Because all indications are that Putin won't stop without more punitive measures.

We must meet this challenge head-on and stand with Ukraine.",RepAdamSchiff
3,2022-02-22 15:55:08+00:00,1496151580793577476,"Bear with me here, folks:

Back in 2012, Meatball the Bear wandered into Glendale homes to eat IKEA meatballs.

Hank the Tank just wants leftover pizza.

Who doesn’t?

Meatball was taken to a sanctuary. Hank the Tank should be taken to one, too. Anything else would be unbearable. https://t.co/6h2PXmSr45",RepAdamSchiff
4,2022-02-21 23:17:58+00:00,1495900633571938304,"Putin’s unilateral declaration that territories within Ukraine are now independent republics is an arrogant and dangerous move by the Kremlin dictator.

The U.S. and our NATO allies are united in our determination to punish this blatant violation of Ukraine’s sovereignty.",RepAdamSchiff
5,2022-02-21 18:19:26+00:00,1495825506951966730,"Any diplomatic effort is worthwhile if it can prevent war.

A war in Ukraine would be a humanitarian disaster.

I applaud President Biden for all his efforts to achieve peace.

Standing strong means never closing the door to diplomacy. https://t.co/WhgaBswdQ3",RepAdamSchiff
6,2022-02-20 23:31:36+00:00,1495541677116772362,"The DOJ investigated Clinton over her emails. Repeatedly.

Now it’s been confirmed that Trump took classified materials to Mar-a-Lago in violation of law.

It’s one thing for Trump to be breathtakingly hypocritical.

But the DOJ must enforce the law – consistently.",RepAdamSchiff
7,2022-02-18 22:50:29+00:00,1494806555623141379,"The past few days indicate our worst fears about Russia’s intentions toward Ukraine may be coming true.

There is still time for Putin to choose diplomacy. He must.

But make no mistake – we will stand united with our NATO allies in response to whatever comes next.",RepAdamSchiff
8,2022-02-18 17:46:17+00:00,1494730001182298113,"3.7 million children have fallen back into poverty since Senate Republicans let the Child Tax Credit expire.

3.7 million kids who now have less to eat and more to worry about.
 
Imagine being so interested in scoring political points that you let kids go hungry.

Shameful.",RepAdamSchiff
9,2022-02-16 20:37:45+00:00,1494048376022831105,"@davidhogg111 You’re absolutely right.

Ending the filibuster needs to be the first order of business. 

It stands in the way of major action on everything - anything - including ending gun violence.",RepAdamSchiff
10,2022-02-16 17:39:50+00:00,1494003601534078976,"The settlement between Remington and families of Sandy Hook victims is a win that holds the gun industry to account.

And it underscores the vitality of my Equal Access to Justice for Victims of Gun Violence Act which will help others seek redress.

We must seize this momentum.",RepAdamSchiff
11,2022-02-14 18:23:16+00:00,1493289757496983558,"Four years ago, an act of evil stole 17 people from us in Parkland.

Today, we honor the memory of those lost in the Marjory Stoneman Douglas shooting.

And rededicate ourselves to fighting for the gun safety measures that could've saved their lives... and can still save others.",RepAdamSchiff
12,2022-02-10 00:30:00+00:00,1491570107729936384,"There were multiple lines of effort to overturn the 2020 election.

The violent attack on January 6 was only the last.

DOJ should investigate any credible allegation of illegality concerning these efforts.

By anyone. Including the former president.",RepAdamSchiff
13,2022-02-09 22:23:33+00:00,1491538287114305538,"Congressional staffers put so much effort and energy into serving our country.

And, like every worker, they should be able to organize for better working conditions and a brighter future.

Proud to join @RepAndyLevin's bill to recognize their right to form a union.",RepAdamSchiff
14,2022-02-09 17:09:23+00:00,1491459224559587329,"Florida lawmakers just passed a blatantly discriminatory anti-LGBTQ+ bill.

Legislation designed to dehumanize vulnerable LGBTQ+ kids.

And it’s just one piece of a larger campaign of hatred led by GOP politicians.

One we are obligated to speak out against.",RepAdamSchiff
15,2022-02-06 17:00:01+00:00,1490369700601212928,"California was right to put a moratorium on the death penalty in 2019. As was Biden in 2021.

And @CAGovernor is right to start closing the nation’s largest death row.

We must continue to reform our criminal justice system.

And California must continue to lead the way.",RepAdamSchiff
16,2022-02-05 23:30:00+00:00,1490105457645535235,"We can't accept thoughts and prayers in place of policy on gun violence.

Not when more than 100 are shot and killed every day.

I have a bill to crack down on the gun industry which has gotten away with murder for far too long. Literally.

And I won't rest until it becomes law.",RepAdamSchiff
17,2022-02-04 21:06:32+00:00,1489706964926017540,"This is what Republicans call “legitimate political discourse.”
 
Don’t let them rewrite history. https://t.co/2cHSAY3vS9",RepAdamSchiff
18,2022-02-04 19:49:29+00:00,1489687574318825473,"Today, House Democrats passed a bill to fix our supply chains, spur American innovation and reaffirm our global leadership.

It's called the America COMPETES Act.

It's good for the economy and jobs.
Good for science and innovation.
And most important — good for working families.",RepAdamSchiff
19,2022-02-04 15:56:21+00:00,1489628905141149697,"Very strategic use of intel by the Biden admin to reveal Russian plans to stage an elaborate ruse to justify an invasion of Ukraine.

Likewise for the British regarding Kremlin plans to install a puppet regime. 

Syncing up with our allies on intel, as well as sanctions.

Smart.",RepAdamSchiff
20,2022-02-04 15:05:11+00:00,1489616026732056580,"Every worker must have the right to unionize. Full stop.

If congressional staff want to unionize, they’d have my full and total support.

The doors of the labor movement should be open to all.",RepAdamSchiff
21,2022-02-04 00:35:22+00:00,1489397132968841218,"If Jeff Bezos can pay to dismantle a bridge in the Netherlands to fit his super yacht…

Then his company should have no trouble paying its fair share in taxes so we can build bridges in America.",RepAdamSchiff
22,2022-02-03 01:53:36+00:00,1489054432549556224,"First, Cruz begs forgiveness for saying Jan 6 attackers were terrorists.

Now, Hawley echoes the Kremlin, questioning if Ukraine should be allowed in NATO.

Welcome to Trump’s GOP, where propaganda is policy and Senators grovel at the feet of despots.",RepAdamSchiff
23,2022-02-03 00:46:19+00:00,1489037500593147906,"The bomb threats against HBCUs have been deeply traumatic.

I'm glad the FBI will investigate them as racially-motivated violent extremism and potential hate crimes.

We must find those responsible, and put an end to this campaign of terror against the Black community.",RepAdamSchiff
24,2022-02-02 15:54:11+00:00,1488903583349231623,"Trump just doubled down, saying he would “absolutely” pardon those responsible for Jan 6.

People who beat police officers. Who wanted to hang his VP.

He called them patriots.

Every day he reminds us of his dangerous unfitness.

When a despot threatens democracy, believe him.",RepAdamSchiff
25,2022-02-01 16:00:01+00:00,1488542665612398594,"In February, we celebrate the rich history, culture, and contributions of Black Americans.

But we must also reflect on the injustices Black Americans have faced throughout our history.

And pledge ourselves to the work of dismantling the many inequities that persist today.",RepAdamSchiff
26,2022-02-01 01:48:50+00:00,1488328457138364419,"The bomb threats against HBCUs are deeply disturbing.

Today, @RepAndreCarson and I requested a briefing from the FBI to ensure steps are being taken to apprehend the culprits.

We must do all that we can to combat the scourge of white supremacist violence and terrorism.",RepAdamSchiff
27,2022-01-31 03:05:36+00:00,1487985388471861254,"What an incredible game between the @RamsNFL and @49ers. Not that we expected anything less after these playoffs. If it couldn’t be my Raiders, then it should have been one of you. 

Let’s go Rams!",RepAdamSchiff
28,2022-01-30 21:36:18+00:00,1487902515790327815,"The 1/6 Committee is examining how the insurrection took place and why. 

To ensure our democracy never again comes so close to the brink. 

Trump’s offer to pardon those responsible shows we’re still at risk.

And suggests his only regret about Jan 6 is that it did not succeed.",RepAdamSchiff
29,2022-01-27 15:30:00+00:00,1486723169851297801,"On Holocaust Remembrance Day, we remember the six million Jews and millions other individuals murdered by the Nazis.
 
Let us use this day to honor their lives.
 
And to pledge ourselves to work against the evil, hatred, and antisemitism behind that atrocity.
 
Never again.",RepAdamSchiff
30,2022-01-22 16:02:35+00:00,1484919432656916481,"The Supreme Court’s ruling in Roe v. Wade protected the right to choose 49 years ago.

Or so we thought.

Today, the right to choose is threatened like never before.

But we won't - and can’t - sit idly by as Republicans attempt to reverse reproductive freedoms.",RepAdamSchiff
31,2022-01-21 16:38:47+00:00,1484566154937049094,"Twelve years ago, the Supreme Court’s Citizens United decision removed critical limits on corporate campaign spending.

Allowing dark money to pour into our elections.

I have a constitutional amendment to overturn that disastrous ruling.

It's time to return power to the people.",RepAdamSchiff
32,2022-01-20 23:39:07+00:00,1484309544088260608,"Just hours before the anniversary of Roe v. Wade, the Supreme Court rejected an attempt to block Texas' draconian abortion ban.

When it comes to reproductive choice, this Court has prioritized politics over precedent.

And their gravely misplaced priorities are a danger to all.",RepAdamSchiff
33,2022-01-20 02:09:12+00:00,1483984927641194499,"The Supreme Court’s decision is an important affirmation that Congress’s need to know about a violent attack on our democracy outweighs the interests of a former president in hiding the truth.

Document production from the Archives has begun, and we hope to get a lot more soon.",RepAdamSchiff
34,2022-01-19 16:00:50+00:00,1483831827299196931,"Get four free at-home COVID tests. Tell your family and friends.
 
https://t.co/thjwctzoYD
 
That’s it. That’s the tweet.",RepAdamSchiff
35,2022-01-18 22:16:59+00:00,1483564099896320005,"Facebook uses content monitors to stop misinformation from flourishing.

But 5.8 million accounts are exempt - meaning they can spread false info without meaningful consequences.

What could possibly go wrong?

I joined @RepLoriTrahan to call for significant reforms to XCheck.",RepAdamSchiff
36,2022-01-17 15:32:40+00:00,1483099962095321097,"Martin Luther King Jr. was a champion for justice.

Someone who saw America for what it could be and worked tirelessly to achieve that dream.

We keenly feel his absence as our country fights for the right of all to live equally.

May his memory strengthen our resolve.",RepAdamSchiff
37,2022-01-16 16:04:38+00:00,1482745619143929858,"We’re all relieved the hostages at Congregation Beth Israel were freed safely.

And hope to learn more about this attack in the coming days.

But one thing is certain: 

Anti-semitism has been dangerously on the rise for years. And its up to all of us, to stop it.",RepAdamSchiff
38,2022-01-13 20:04:07+00:00,1481718725363609600,"Some Senators defend the filibuster as a means of encouraging bipartisanship.

Are they kidding?

It’s use hasn’t prevented partisanship — only made it worse. 

It’s a vehicle for minority rule, nothing more.

And Senators who can’t recognize that, need to get out of the way.",RepAdamSchiff
39,2022-01-13 15:20:20+00:00,1481647308819165184,"When you think of the genius of our democracy, what comes to mind?
 
I’m willing to bet it’s not the filibuster.
 
No, it’s the right of the people to choose their representatives. The right to vote.
 
A right under attack - a right we must protect by abolishing the filibuster.",RepAdamSchiff
40,2022-01-13 00:44:57+00:00,1481427012124389380,"Here's a quick PSA for members of Congress (and anyone else):

If you're thinking of comparing the Holocaust – the systematic slaughter of millions of Jews – to public safety measures designed to stop the spread of a dangerous virus, might I suggest that you…

…Don't.",RepAdamSchiff
41,2022-01-12 15:00:02+00:00,1481279812408905732,"Here’s the thing:

Nothing else matters if we fail to protect the right to vote.

If we lose that right, we will have failed to honor our oaths as members of Congress. 

And, worse, we will have failed the American people.",RepAdamSchiff
42,2022-01-12 00:00:31+00:00,1481053440700817408,"Today, on the 20th anniversary of the arrival of the first detainees at Guantanamo Bay, we renew our call to shutter the detention facility permanently.

America must stand for the rule of law at home and abroad.

The cost of maintaining Gitmo, moral and otherwise, is too high.",RepAdamSchiff
43,2022-01-11 21:45:48+00:00,1481019536543526915,"The filibuster and the right to vote aren’t equals.
 
One is the bedrock of democracy. The other allows a minority to ignore the will of the people.
 
So when it comes to preserving one or the other, it isn’t a hard choice.
 
The filibuster must die so that democracy can live.",RepAdamSchiff
44,2022-01-11 00:07:32+00:00,1480692818272264192,"The explosive spread of Omicron shows just how vulnerable we are to this virus. 

We must do more to help everyone protect themselves and their loved ones. 

@SenSanders, @RepRoKhanna and I are calling on @WhiteHouse to further expand access to COVID-19 rapid tests.

Read more: https://t.co/QGTHLdGyAA",RepAdamSchiff
45,2022-01-10 16:03:26+00:00,1480570991273148418,"Today, the 117th Congress begins its second year.

We've got quite the to-do list before us:

Voting rights.
Affordable childcare.
Expanded health care.
Aggressive climate action.
An extended Child Tax Credit.
And more.

Let's get to work.",RepAdamSchiff
46,2022-01-07 18:39:09+00:00,1479523014651695105,"Yesterday, we recounted the horrors of January 6.

It was a difficult remembrance.

One that reminded us how fragile our democracy is – and how vital it is to protect it.

Let us hold onto that shared purpose and press on, determined as ever to preserve our most sacred ideals. https://t.co/uXZTnoRplY",RepAdamSchiff
47,2022-01-07 02:42:30+00:00,1479282264093515777,"Translation for people in the real world:

Tucker: You called this a terrorist attack. That was the truth. You told the truth on purpose. I’m wondering why you did that?

Cruz: It was sloppy and frankly it was dumb. 

Tucker: I don’t buy that. https://t.co/3IoqDp2yn8",RepAdamSchiff
48,2022-01-06 21:35:27+00:00,1479204995253821441,"The Justice Department has pledged to hold all Jan 6 perpetrators to account. 
 
But it is equally important that the department investigate those who may have broken the law in other ways, when they tried to overturn our election. https://t.co/9Zo3XcIIBO",RepAdamSchiff
49,2022-01-06 19:00:00+00:00,1479165872983797769,"One year later, the memory of January 6 is as painful as ever.
 
But, difficult as it may be, I wanted to share what it was like to be there during the attack.
 
Because we cannot forget January 6.
 
Not without dooming ourselves to repeat it.

https://t.co/KspP8QMh0R",RepAdamSchiff
50,2022-01-06 14:46:42+00:00,1479102130568916995,"One year ago, a mob stormed our Capitol to overturn an election.
 
And since then, the Big Lie behind that inspired the attack has only metastasized.
 
On this solemn anniversary, the danger to our democracy is greater than ever.
 
So must be our resolve to protect it.",RepAdamSchiff
51,2022-01-02 23:15:23+00:00,1477780593345708037,"Grateful to have a White House standing shoulder-to-shoulder with our democratic ally, Ukraine,

And standing up to Putin.

We must carry the mantle of championing democracy — both at home and abroad. https://t.co/qjDQM70C51",RepAdamSchiff
52,2022-01-01 17:15:00+00:00,1477327508970246151,"May 2022 be our best year yet:
 
A year of progress. Of healing and hope.
 
A year spent with loved ones, old and new.
 
A year that we will remember fondly, forever.

Happy New Year, everyone!",RepAdamSchiff
53,2021-12-31 22:45:00+00:00,1477048168307171330,"2021 was defined by remarkable challenges and perseverance.
 
And I end this year with an abundance of gratitude:
 
For the health of my family and friends.
For the communities I serve in Washington. 
And for the promise of a better year ahead.",RepAdamSchiff
54,2021-12-25 17:15:00+00:00,1474790793927962625,"I want to wish a very Merry Christmas to all those celebrating!

May your day be full of joy, peace, and love.

Stay safe, and have a wonderful holiday.",RepAdamSchiff
55,2021-12-22 18:31:24+00:00,1473722859520417805,"Thank you, @POTUS. Extending the pause on student loan payments is a wonderful holiday gift for millions of people.

The only thing better?

Canceling $50,000 of that debt for every borrower. Now, that would be a Christmas miracle!",RepAdamSchiff
56,2021-12-19 17:55:04+00:00,1472626549283168261,"Americans elected us to legislate like our future depended on it.

We can’t live up to that obligation by killing action on climate change.

Ending help for children, families, and seniors.

We must find another way to get the job done. 

Too much depends on it.",RepAdamSchiff
57,2021-12-17 22:47:16+00:00,1471975311285833729,"There’s a lot we don’t know about the omicron variant.
 
But here’s what we do know about the pandemic:
 
Getting vaccinated and boosted is the best way to stay healthy.
 
It’s free. It’s safe. And it’s the best way to protect you and your family.",RepAdamSchiff
58,2021-12-16 15:03:35+00:00,1471496233487253514,".@RonWyden and I call for sanctions against mercenary tech companies enabling human rights abuses.
 
By selling surveillance services to authoritarian regimes, they threaten journalists and dissidents.
 
We must stand up to human rights abusers and those who enable them.",RepAdamSchiff
59,2021-12-15 16:07:41+00:00,1471149976667500551,"Millions of young people will soon have to begin making student loan payments again.

Payments they cannot afford.

We need to continue the freeze on repayments until the pandemic is over. 

Better yet, we should cancel $50,000 in debt for every student.",RepAdamSchiff
60,2021-12-15 04:07:49+00:00,1470968815211237380,"Last week, Mark Meadows informed @January6thCmte he would not cooperate further – abandoning his duty to country.

Tonight, the House voted him in contempt and referred him for criminal prosecution.

We acted with urgency.

The Justice Department must do the same.",RepAdamSchiff
61,2021-12-15 01:36:34+00:00,1470930750652493825,"Like so many forms of bigotry, Islamophobia is, tragically, on the rise.

Our Muslim friends and neighbors deserve to feel safe at home and abroad, at school, at work, at worship – everywhere.

Which is why I support a special envoy to root out anti-Muslim hate.",RepAdamSchiff
62,2021-12-14 18:00:00+00:00,1470815854543589378,"Today, the House holds a moment of silence for the 800,000 lost to COVID-19.
 
If we held one minute for each individual, we'd be silent for a year and a half.
 
Honor their memory by protecting yourself and your loved ones.
 
Please, go get vaccinated (and boosted).",RepAdamSchiff
63,2021-12-14 01:23:06+00:00,1470564973764136960,"Republican Members of Congress were texting Mark Meadows before, during, and after the insurrection.

None of this is privileged. All of it is damning. All of it must be exposed. 

And if he refuses to discuss it, he should answer for it.",RepAdamSchiff
64,2021-12-14 00:48:57+00:00,1470556382432837637,"Mark Meadows' decision to stonewall the @January6thCmte has forced us to proceed with a contempt referral.
 
A refusal to appear when subpoenaed by Congress will result in potential prosecution and jail time.

No one is above the law.",RepAdamSchiff
65,2021-12-12 15:04:47+00:00,1470046984572706824,"My heart breaks for the communities devastated by these catastrophic tornadoes.

I join millions of individuals across the nation in praying for your swift recovery and for the continued safety of your loved ones.

We are with you.",RepAdamSchiff
66,2021-12-11 18:37:26+00:00,1469738110237958147,"Workers who go on strike to fight for the wages and hours they deserve should never be permanently replaced. Period.

It’s unacceptable for Kellogg’s — or any company — to retaliate and threaten their livelihoods.",RepAdamSchiff
67,2021-12-10 18:03:12+00:00,1469367107934724098,"A political high court is putting the right to choose in danger.

Playing games with Roe as Republicans desperately seek new ways to control women’s health.

We can’t let them.

Losing the right to choose will place thousands of women at risk.",RepAdamSchiff
68,2021-12-10 16:00:26+00:00,1469336210388705283,"Yesterday, a Republican said he’d be excited if I would share the facts of Trump’s Russia collusion with him.

I was more than happy to take him up on his offer.

He was less happy when I did. https://t.co/D74zC044at",RepAdamSchiff
69,2021-12-09 21:53:08+00:00,1469062582334115841,"By passing the #ProtectingOurDemocracy Act, the House has delivered an unequivocal message:
 
Our democracy is worth fighting for.
 
Now, the Senate must show the same conviction to root out corruption and end presidential abuses of power.
 
The price of inaction is calamity.",RepAdamSchiff
70,2021-12-09 16:53:00+00:00,1468987052553347077,"Protecting our democracy must be a whole of government effort.

Because the task before us is much bigger than any one branch, person, or party.

It’s going to take all of us to get the job done.

I’m grateful to the @WhiteHouse for supporting the #ProtectingOurDemocracy Act.",RepAdamSchiff
71,2021-12-09 12:30:42+00:00,1468921041506426883,"Today, the House will take up the #ProtectingOurDemocracy Act.
 
It will root out corruption, curtail presidential abuses of power, and strengthen our system of checks and balances.
 
Our democracy is in a moment of great peril.
 
Time to do something about it.",RepAdamSchiff
72,2021-12-08 21:46:05+00:00,1468698422211399683,"Before I log off, I want to cover how the #ProtectingOurDemocracy Act will strengthen the emoluments clauses of the Constitution. 

@RepRaskin, can I tap you in for this one?",RepAdamSchiff
73,2021-12-08 19:32:47+00:00,1468664876516139008,"@RepSwalwell All you, @RepSwalwell.",RepAdamSchiff
74,2021-12-08 19:26:51+00:00,1468663382903603204,"@trumpcrazyaf One of the most important provisions of PODA is a provision that expedites the enforcement of congressional subpoenas.

This would attack the problem of presidents who wish to stonewall all subpoenas.

Another reason we need this bill now.",RepAdamSchiff
75,2021-12-08 19:26:04+00:00,1468663186018770952,"@Moehoffenstein The #ProtectingOurDemocracy Act will:
 
-Root out corruption.
-Rein in presidential abuses of power.
-Strengthen our system of checks and balances.
 
You can find more info on it here: https://t.co/yLKFsy11ub",RepAdamSchiff
76,2021-12-08 19:24:48+00:00,1468662868107304967,"@LycoPsycho When we get court decisions, they are usually in our favor (holding Congress’s right to testimony).

The problem is how long it takes. This bill goes directly to that problem by expediting court review.

It’s designed to attack the problem of justice delayed being justice denied.",RepAdamSchiff
77,2021-12-08 19:22:33+00:00,1468662301884661764,"@HTortorici They should. This isn’t a partisan vote.

Many of the provisions in the bill had GOP authorship in the past.

This will test whether Republicans care more about our democracy than they fear the former president.",RepAdamSchiff
78,2021-12-08 19:19:52+00:00,1468661623674085376,"@softlikewater PODA is the third pillar of our Democracy Agenda.

It's a complement to the John Lewis Voting Rights Act, which was written to put a stop to these truly despicable efforts by the Republican party to suppress the vote.

We need the entire agenda to get the job done.",RepAdamSchiff
79,2021-12-08 19:15:19+00:00,1468660480449425417,"@RepTedLieu I think you’re the expert on that one, @RepTedLieu. 

Why don't you take it from here?",RepAdamSchiff
80,2021-12-08 19:07:00+00:00,1468658386099216388,"@alikat747 @BDGarp I hope that some Republicans will sign on, but I know better than to hold my breath.

So we're going to keep pushing to abolish or carve out the filibuster for pro-democracy bills.

Senators who would preserve an archaic rule over our democracy need a serious reality check.",RepAdamSchiff
