,Datetime,Tweet Id,Text,Username
153,2021-12-20 17:01:09+00:00,1472975369556963329,"Stronger transportation infrastructure in NH means more tourists coming in &amp; a quicker recovery for our economy.

Thrilled NH airports will receive $9 million from the Bipartisan Infrastructure Law to bolster services &amp; ensure everyone flying into NH has a safe, efficient trip. https://t.co/e6mR64Vbaa",RepAnnieKuster
154,2021-12-20 16:15:50+00:00,1472963966527840262,"This is worth watching — our hospitals are dealing with some of the highest #COVID19 case numbers they have seen, and it is essential we all recognize the scope of this crisis and take steps to stop the spread and keep our communities safe. https://t.co/4Kpc7cRQgI",RepAnnieKuster
155,2021-12-19 19:15:24+00:00,1472646768433283077,My full statement on the #BuildBackBetter negotiations ⬇️ https://t.co/tNQWpAMrl0,RepAnnieKuster
156,2021-12-18 14:48:12+00:00,1472217137150193664,"Looks like ❄️ for towns across New Hampshire!

With up to 8 inches of snow expected and a chance for strong wind, be sure to plan ahead and stay safe!
https://t.co/zVQkGrtqDl",RepAnnieKuster
157,2021-12-17 17:57:03+00:00,1471902274448412673,"At a time when reproductive freedoms are under attack, the @US_FDA’s decision to permanently lift restrictions on #MedicationAbortionCare is a win for health equity—especially for those who already struggle to access care.
https://t.co/m30mV7D71P",RepAnnieKuster
158,2021-12-16 22:06:16+00:00,1471602603477946386,"While we've taken steps to address addiction &amp; substance use, this crisis has persisted — especially during #COVID19.

I’m proud to help introduce the CARE Act, ambitious legislation to expand treatment access &amp; create sustained funding to end this crisis.
https://t.co/GqnMvWKey6",RepAnnieKuster
159,2021-12-16 21:28:18+00:00,1471593050103234571,"I joined @ProtectCareNH to talk about how #BuildBackBetter would close the Medicaid coverage gap to help millions gain health insurance &amp; extend the American Rescue Plan’s health insurance premium reductions.

I urge the Senate to take action &amp; get this plan over the finish line. https://t.co/4uPJgLH4dd",RepAnnieKuster
160,2021-12-15 22:20:49+00:00,1471243879785586695,"Today, as the final installment of the #ChildTaxCredit hit bank accounts across NH, moms &amp; advocates shared how their families used the tax cut. 

From child care to fresh foods, the Child Tax Credit is a lifeline for families – that’s why I’m working to extend it. https://t.co/ygnEZ7wdjR",RepAnnieKuster
161,2021-12-15 21:12:27+00:00,1471226672582168581,"🚨REMINDER🚨

Today is the *final day* to update your existing health care plan or #GetCovered with a new plan by Jan 1, 2022! If you miss the deadline, #OpenEnrollment for coverage that begins Feb 1 will remain open until Jan 15. 

For more info, visit ➡️ https://t.co/X3VaOo9BC1 https://t.co/ic2OaCDyY5",RepAnnieKuster
162,2021-12-15 15:52:01+00:00,1471146034801827850,"This is exciting progress for Franklin 🛶🌊

Mill City Park at Franklin Falls will enhance outdoor industry while ensuring Franklin realizes economic opportunities – I was proud to support this project, and cannot wait to see the final product!
https://t.co/bBTHntT0BJ",RepAnnieKuster
163,2021-12-14 23:38:48+00:00,1470901115000602625,"Today we hit a sobering milestone—800,000 Americans have died from #COVID19. Here in NH, there were 22 new COVID-19-related deaths announced today. 

We must work together to stop the spread &amp; prevent further tragedy—vaccines, boosters, masks, distancing &amp; testing can save lives. https://t.co/sFEKk3DXtb",RepAnnieKuster
164,2021-12-14 22:48:53+00:00,1470888554251227136,"The #ChildTaxCredit delivered an estimated $159M in tax cuts to 66,000 families in #NH02.

These targeted payments helped families afford child care &amp; much more—I’m working to extend this tax cut to lift Granite State families &amp; build a better future for all. https://t.co/7gUK85e5W9",RepAnnieKuster
165,2021-12-14 20:32:20+00:00,1470854189324685327,"Tomorrow, December 15, 2021, is your LAST DAY to get covered by January 1, 2022, and enroll in a new health care plan through https://t.co/O73hQyoUhK.
 
A high-quality plan may be more affordable than you think!
 
➡️ https://t.co/E8fJpd35Uy https://t.co/zeOAWFQlnW",RepAnnieKuster
166,2021-12-14 18:56:43+00:00,1470830125155508240,"Nine years ago, twenty 6 &amp; 7-year-old children &amp; six adults were murdered at #SandyHook Elementary School.

On the anniversary of this unspeakable tragedy, we remember the lives lost &amp; our thoughts are w/ the Newtown community. We must take meaningful action to end gun violence. https://t.co/JNydmLy3gg",RepAnnieKuster
167,2021-12-14 18:10:55+00:00,1470818600026050571,"JUST IN: NH health care providers will receive $41M to offset revenue losses &amp; expenses from #COVID19.

Our doctors, nurses &amp; health workers have been on the frontlines of this pandemic—as cases rise, it's essential we support them as they continue to care for our communities. https://t.co/wAZMzbTkV4",RepAnnieKuster
168,2021-12-14 14:49:31+00:00,1470767917612601345,"I was proud to secure funding in the #AmericanRescuePlan for @samhsagov to create a grant program to address the overdose epidemic through harm reduction.

I'll continue working on @BAMHTF to increase access to evidence-based treatment, as well as prevention &amp; recovery efforts. https://t.co/v4WOtjXreI",RepAnnieKuster
169,2021-12-13 21:54:14+00:00,1470512413216759811,"This morning I joined @SecretaryPete in NH to talk about how the Bipartisan Infrastructure Package will transform NH’s infrastructure &amp; create opportunities for hardworking families.

From broadband to commuter rail, this is a once in a lifetime investment in our state &amp; economy. https://t.co/2veuZLyXFs",RepAnnieKuster
170,2021-12-13 19:35:15+00:00,1470477433707114497,"As a founder of the @BAMHTF, I’m glad to be working across the aisle with @RepDavidTrone and our fellow co-chairs to advance our 2021 Legislative Agenda and address the #addiction and substance use epidemic.

Read the 2021 Agenda ➡️https://t.co/G89AkjdMyS
https://t.co/eEzEa9HHXp",RepAnnieKuster
171,2021-12-13 17:54:43+00:00,1470452134768488463,"Happy 385th Birthday to @USNationalGuard!

Thank you to all the guardsmen and women for being 'Always Ready, Always There.' https://t.co/wMX1wBWGby",RepAnnieKuster
172,2021-12-13 16:18:38+00:00,1470427956531113990,I'm proud to welcome @SecretaryPete to NH today to talk about how the Bipartisan Infrastructure Package will support the Capitol Corridor Project to plug NH into the Boston commuter rail system &amp; ensure businesses across our state can attract the brightest minds in the region. https://t.co/F4I46fBTyG,RepAnnieKuster
173,2021-12-10 21:15:48+00:00,1469415575399108609,"As we head into the holidays &amp; you gather with loved ones, I encourage you to take precautions to stay safe. 
 
Everyone 5+ is eligible for the vaccine &amp; everyone 16+ who received their vaccine more than six months ago is eligible to receive their boost.
https://t.co/HlvDjVt9bQ",RepAnnieKuster
174,2021-12-10 21:14:43+00:00,1469415303541047303,"As pandemic misinformation continues to spread, so does the virus—NH has more than 10K active #COVID cases for the first time.
 
I urge you to not believe everything you read—fact-check any COVID-related information before sharing it &amp; seek news &amp; resources from trusted sources. https://t.co/0EnNMzo1Pc",RepAnnieKuster
175,2021-12-10 19:52:45+00:00,1469394678172819460,"I’m working to get the #BuildBackBetter Act over the finish line to lift up our economy, invest in our future, and support Granite State families.",RepAnnieKuster
176,2021-12-10 19:52:15+00:00,1469394550007517189,"“Congress can alleviate some of the strain caused by inflation by passing the #BuildBackBetter Act, which will lower everyday costs for families, including child care, health care, utility bills, prescription drugs, and education.” https://t.co/rJ15ydnaXq",RepAnnieKuster
177,2021-12-10 15:56:55+00:00,1469335325600325643,"A threat to reproductive freedom anywhere is a threat to it everywhere.

The decision of when and how to have a family should be free from government interference. We will keep working to ensure it stays that way.
https://t.co/vEGCuzIB7m",RepAnnieKuster
178,2021-12-10 14:36:45+00:00,1469315151765688320,"Wishing this brave Nashua firefighter a full &amp; speedy recovery after the floor collapsed &amp; his crew pulled him to safety while fighting a fire in Hudson.

Thank you to all our NH firefighters &amp; first responders who put themselves in harm’s way to keep our communities safe. https://t.co/H15KhvQdC5",RepAnnieKuster
179,2021-12-10 02:25:06+00:00,1469131025074823171,"Tonight, I paid my respects to Senator Bob Dole as he lies in state in the U.S. Capitol. A World War II veteran and distinguished Member of Congress, he embodied the fundamental ideals of service and selflessness that define America.

Rest In Peace, Senator. https://t.co/IYRwaIL5M7",RepAnnieKuster
180,2021-12-09 22:52:12+00:00,1469077446372769795,"Thank you @stepville, author of #MAID, for joining the Bipartisan Task Force to End Sexual Violence &amp; sharing your perspective.

Even after escaping abusers, a world of challenges is waiting for survivors—we must do more to support them as they recover.

📺https://t.co/TC0asPNVzi https://t.co/s1Kkame44h",RepAnnieKuster
181,2021-12-09 22:16:30+00:00,1469068465193603077,"Don’t miss your chance to #GetCovered in 2022!

Thanks to the #AmericanRescuePlan, quality health care coverage may be more affordable than you think. Enroll by Dec 15 to be covered starting Jan 1!

Learn more: https://t.co/X3VaOo9BC1 https://t.co/uRe0KS8BbP",RepAnnieKuster
182,2021-12-09 20:25:20+00:00,1469040486451224579,"This is wonderful news for the North Country!

This funding will support our health care workers on the frontlines of this pandemic &amp; help Coos County Family Health Services deliver critical care to our rural communities.
https://t.co/Olrsyi2NAs",RepAnnieKuster
183,2021-12-08 21:44:37+00:00,1468698050961018887,"Don’t miss your chance to #GetCovered in 2022!

Access to affordable health coverage is more important than ever—&amp; thanks to the #AmericanRescuePlan, quality coverage may be more affordable than you think. Enroll by Dec 15 to be covered starting Jan 1!

➡️ https://t.co/E8fJpd35Uy https://t.co/jpI8vM8FQx",RepAnnieKuster
184,2021-12-08 20:03:14+00:00,1468672537534124034,"ICYMI: Monday, I was in Franklin with @usdaRD to celebrate new solar arrays made possible by federal investments in renewable energy.

These solar panels are a win-win-win for NH &amp; will lower energy costs, create jobs &amp; make our energy grid more reliable.
https://t.co/bz7N5KuTpv",RepAnnieKuster
185,2021-12-08 16:50:23+00:00,1468624007821996036,"Especially around the holidays, we are reminded of how important nutrition assistance programs are for families in NH &amp; across the country.

Today in @HouseAgDems, I urged continued support for our NH organizations that provide millions of meals to Granite Staters every year. https://t.co/u1r9F1IT7c",RepAnnieKuster
186,2021-12-08 16:01:54+00:00,1468611803999608840,"Everyone aged 5 &amp; older is eligible to get the vaccine. As the Omicron variant continues to spread &amp; the weather gets colder, it’s more important than ever to get vaccinated.

To schedule a vaccine — including boosters — or find a walk-in clinic, visit https://t.co/mVKSHR7eaf.",RepAnnieKuster
187,2021-12-08 16:00:46+00:00,1468611518556221441,"More patients are hospitalized w/ #COVID19 in NH now than at any other point during the pandemic.

Deeply grateful to NH health care providers on the frontlines.

I encourage everyone to take steps to keep each other safe, including getting vaccinated &amp; wearing masks when needed. https://t.co/cFPAoEc4Vt",RepAnnieKuster
188,2021-12-08 03:16:05+00:00,1468419083066650630,"I voted for the 2022 National Defense Authorization Act to:

🇺🇸Increase Pay for Troops
🛑Combat Military Sexual Assault
🌍Address Climate Change
⚓️Strengthen Our Navy

Funding our armed services is essential—I was proud to vote for this bipartisan measure.
https://t.co/uDobKaPkvo",RepAnnieKuster
189,2021-12-07 23:39:09+00:00,1468364486511894536,"I’m pleased NH will receive more than $400K to combat child sexual exploitation online.

Earlier this year, I reintroduced the bipartisan END Child Exploitation Act to help law enforcement &amp; tech companies respond to child sexual abuse images and hold perpetrators accountable. https://t.co/RYXt9Oe7bs",RepAnnieKuster
190,2021-12-07 19:14:23+00:00,1468297855878189057,"This year, Congressional Democrats have made tremendous progress for the American people, from the expanded #ChildTaxCredit to investments in our roads, bridges, and broadband. 

And the best is yet to come. https://t.co/SQv42Opwtm",RepAnnieKuster
191,2021-12-07 16:04:27+00:00,1468250057556344838,"Yesterday, I was in Franklin to celebrate two new solar arrays made possible by federal investments in renewable energy.

These new solar panels will lower energy costs, create jobs, &amp; make our energy grid more reliable—a win-win-win for the Granite State.
https://t.co/5l1EYFEgC6",RepAnnieKuster
192,2021-12-07 14:41:30+00:00,1468229184254267395,"Today marks the 80th anniversary of the attack on #PearlHarbor.

We will never forget the valor &amp; patriotism of the more than 2,300 sailors, soldiers &amp; civilians who died in the horrific attack &amp; will forever honor the service &amp; sacrifice of our service members &amp; their families. https://t.co/sMtaTI1gvl",RepAnnieKuster
193,2021-12-06 20:01:27+00:00,1467947316216844288,"Today, I welcomed @usdaRD Under Sec Torres Small to NH to announce new federal investments in renewable energy.

During the visit, we toured a solar site in Franklin that benefits from this funding &amp; discussed the importance of clean energy to grow &amp; support rural communities. https://t.co/tzfIxrw9ay",RepAnnieKuster
194,2021-12-06 18:03:03+00:00,1467917518400630786,"Great news in our efforts to stop the spread of COVID-19 in our State.

NH has one of the highest #COVID19 case rates in the U.S.—everyone who chooses to receive their safe, effective vaccine or booster gets us closer to crushing this virus.

Learn more: https://t.co/HlvDjVt9bQ https://t.co/jp1jlqEEdT",RepAnnieKuster
195,2021-12-05 22:53:31+00:00,1467628227514585088,"Bob Dole lived his entire life in service to our country.

A WWII veteran and long-time Member of Congress, he embodied the ideals of service and selflessness that define America. My condolences to his loved ones. May he Rest In Peace.
https://t.co/xjEaKUx8ry",RepAnnieKuster
196,2021-12-04 19:48:21+00:00,1467219243137736706,"Today I joined the launch of NH Health Care Workers for Climate Action to help educate Granite Staters about climate change &amp; its impact on health.

The link between well-being &amp; climate change goes beyond headlines—that's why we must pass #BuildBackBetter &amp; take climate action. https://t.co/AonEzmvLaM",RepAnnieKuster
197,2021-12-03 19:17:34+00:00,1466849104970010624,"This is a wake-up call.
 
To keep our communities safe, children in school &amp; the economy moving, it's essential we all take steps to stop the spread of #COVID19.
 
If you want more info on the safe, effective vaccines, or to schedule an appointment, visit https://t.co/mVKSHR7eaf. https://t.co/6788YRHlPq",RepAnnieKuster
198,2021-12-02 22:23:48+00:00,1466533584962043908,"Yesterday, I spoke on the House Floor in support of reproductive freedom. 

How and when to start a family is a deeply personal decision and one that should be made free from government interference. https://t.co/wNIoFJdQYI",RepAnnieKuster
199,2021-12-02 21:10:30+00:00,1466515138060640257,"NH is expected to receive $72M from the Bipartisan Infrastructure Package to improve water infrastructure.

It's essential that every Granite Stater has access to clean drinking water &amp; I'm thrilled this funding is heading to NH to make that a reality.
https://t.co/lszvy9d1RH",RepAnnieKuster
200,2021-12-02 02:29:42+00:00,1466233082923606025,"This is a wake-up call—We must pass legislation to codify the rights of women to make their own reproductive decisions &amp; prevent a return to dangerous back-alley abortions, give women control over their own bodies, the same as men, &amp; take the government out of our personal lives.",RepAnnieKuster
201,2021-12-02 02:27:57+00:00,1466232640403652612,"If #RoeVWade is overturned, the court will effectively legalize government-mandated pregnancy for women who live in states where abortion is illegal — even in the case of rape, incest, or non-viable pregnancy —disproportionately impacting low-income families &amp; women of color.",RepAnnieKuster
202,2021-12-02 02:26:47+00:00,1466232345560817666,"As an adoption attorney, I saw the impact that access to safe, legal abortion has on families. 

Today's SCOTUS oral arguments showed what reproductive rights advocates have long-feared: the conservative justices are prepared to overturn Roe v. Wade &amp; undermine women’s autonomy. https://t.co/lQm8alo219",RepAnnieKuster
203,2021-12-01 21:37:38+00:00,1466159581751611403,"The Bipartisan #Infrastructure Package is a big deal for NH &amp; delivers critical funding to upgrade our roads, bridges, highways, &amp; more.

I was proud to get this plan over the finish line &amp; deliver this investment in our state for generations to come.
https://t.co/WRaJcpRvVJ",RepAnnieKuster
204,2021-12-01 20:30:45+00:00,1466142748671680516,"Today, I joined Granite State reproductive rights advocates in DC as #SCOTUS is poised to make one of the most consequential rulings in its history.
 
We must codify the constitutional right to #abortion &amp; stop government interference in our personal lives. https://t.co/bW4CAxXZ9b",RepAnnieKuster
205,2021-12-01 16:03:38+00:00,1466075524602683396,"My thoughts are with the families of those who were killed, the injured &amp; the entire Oxford, Michigan community. Thankful to the first responders who acted quickly to save lives.

This is every parent's worst nightmare &amp; reality for far too many. We must work to end gun violence. https://t.co/Eypk4JwfBf",RepAnnieKuster
206,2021-12-01 15:24:18+00:00,1466065628087865349,"#COVID19 booster shots help bolster immunity &amp; keep you safe. NH’s ‘Booster Blitz’ will be held on Saturday, December 11 &amp; aims to get as many Granite Staters protected against this disease as possible.

To register, visit: https://t.co/LoH7yMskEP https://t.co/DA2NuQSpgc",RepAnnieKuster
207,2021-12-01 00:56:30+00:00,1465847237859282948,"Learn more ⬇️

 https://t.co/Ty8tqbGq0f",RepAnnieKuster
208,2021-12-01 00:55:55+00:00,1465847090144284680,"The House passed my #bipartisan bill to bolster vaccine infrastructure in the wake of #COVID19.

This bill will improve info-sharing between state &amp; federal governments &amp; care providers to ensure vaccines are administered efficiently.

I urge the Senate to quickly pass this bill. https://t.co/CS9ubf8yzW",RepAnnieKuster
209,2021-11-30 19:15:10+00:00,1465761339738140675,"Nearly three generations of women have come to rely on the precedent of Roe v. Wade.

Tomorrow, SCOTUS will hear a case that threatens reproductive freedoms across the U.S. It’s essential we stand up for our rights so no woman can be told when or how to start a family. https://t.co/CllhEU8K4Z",RepAnnieKuster
210,2021-11-30 16:55:31+00:00,1465726194138107906,"Today, the House will vote on my bipartisan legislation to bolster our nation’s vaccine infrastructure in the wake of #COVID19 and allow patients and providers to communicate securely in real-time.
 
I urge my colleagues to vote for this bill to support our health care workforce. https://t.co/B88Wjd5OYC",RepAnnieKuster
211,2021-11-29 21:36:02+00:00,1465434401467154438,I’m looking forward to meeting with @ONDCP Director @DrGupta46 later this week to discuss my work as founder and co-chair of @BAMHTF and steps that Congress and the administration can take to address the overdose crisis.,RepAnnieKuster
212,2021-11-29 20:35:31+00:00,1465419173446758400,"Starting today, Granite Staters have access to free at-home #COVID tests through a @HHSGov partnership program.
 
Accurate, reliable testing is a critical tool to stop the spread of COVID-19 — I was proud to help secure the federal funds for this project.
https://t.co/rbQ9ofxOMI",RepAnnieKuster
213,2021-11-29 19:33:33+00:00,1465403578496004104,"Nashua Mayor Bernie Streeter lived a life of public service — his legacy and leadership will live on in New Hampshire for generations to come.

My thoughts and prayers are with his family and loved ones. May he rest in peace.
https://t.co/TEvg8rKhtw",RepAnnieKuster
214,2021-11-29 18:43:37+00:00,1465391012218642432,"This year, I helped pass the Women’s Health Protection Act—legislation to codify the constitutional right to an abortion established in Roe v. Wade.

Regardless of SCOTUS’s decision, it's essential we get this bill signed into law to permanently protect reproductive freedoms.",RepAnnieKuster
215,2021-11-29 18:42:50+00:00,1465390816021688333,"Today, I joined NH family planning providers to talk about the challenge to Roe v. Wade &amp; what it means for Granite Staters.

For nearly 50 years, Granite Staters have lived in a country where access to safe, legal abortion is a right—today, those protections are on the line. https://t.co/L4DyfNQhd0",RepAnnieKuster
216,2021-11-29 18:16:30+00:00,1465384186458644481,It is wonderful to see the @WhiteHouse celebrating the holidays with decorations inspired by our nation’s frontline workers and the values that unite us all as Americans. https://t.co/jG3BVv0PiD,RepAnnieKuster
217,2021-11-28 21:39:56+00:00,1465072995765035009,"Happy #Hanukkah to all celebrating! 

May this be a time of joy for you and your family. https://t.co/Jrre30b5xx",RepAnnieKuster
218,2021-11-28 21:16:51+00:00,1465067185244672009,"Congratulations to Mikaela Shiffrin for winning the women’s slalom on home snow this weekend!

An exciting victory for team USA 🇺🇸!
https://t.co/hS0fTH0pvb",RepAnnieKuster
219,2021-11-28 18:30:14+00:00,1465025256037527565,"It’s wonderful to see young Granite Staters honoring our veterans and remembering their service this holiday season.

I’m wishing these Girl Scouts luck as they work to get to 900 wreaths!
https://t.co/dqXytbKoAA",RepAnnieKuster
220,2021-11-27 15:05:12+00:00,1464611269097447435,"Happy #SmallBusinessSaturday to all the Granite State shops, restaurants, and more that make New Hampshire such a wonderful place to live!

As we head into the holiday season, I encourage you to #ShopSmall and explore some of the amazing small businesses in our state. https://t.co/4l04L9V7tZ",RepAnnieKuster
221,2021-11-25 12:22:50+00:00,1463845633052360705,"Happy Thanksgiving, New Hampshire!

I hope you have a safe and joyful celebration today. https://t.co/QT3XadskMU",RepAnnieKuster
222,2021-11-24 22:07:50+00:00,1463630464728678408,"It was wonderful to join the dedicated volunteers at the @FriendlyKitchNH in Concord today to help prepare Thanksgiving meals for Granite Staters in need.

Filled with gratitude as we had into the holiday season! https://t.co/UQ21cEcZbJ",RepAnnieKuster
223,2021-11-24 13:19:00+00:00,1463497380133838849,"No one should have to pick between heating their home or putting food on the table.

I fought for additional funds to support NH families &amp; pushed for the release of more fuel supply to lower costs. 
 
To learn more &amp; apply, visit https://t.co/F7tRpct2l8
https://t.co/256ejfvnWP",RepAnnieKuster
224,2021-11-23 20:02:31+00:00,1463236538385457154,"The expanded #ChildTaxCredit created by the #AmericanRescuePlan is helping hardworking families weather this crisis.
 
217,000 NH children qualified in November, totalling $54M in relief for families.
https://t.co/C32JSu9Xv9",RepAnnieKuster
225,2021-11-23 18:41:40+00:00,1463216193079234562,"This is great news for our rural communities.
 
As NH sees the highest number of #COVID19 cases since the peak last winter, this federal support from the #AmericanRescuePlan will help Granite State doctors, nurses, &amp; frontline workers save lives. https://t.co/n4M69QnYp3",RepAnnieKuster
226,2021-11-23 17:39:15+00:00,1463200484542619659,"It’s the season of giving here in New Hampshire!

Every child deserves to have a happy holiday this year, and I’m proud to support Toys For Tots at the @ShopMallofNH to bring joy to children across the Granite State! https://t.co/kN2sJ9gRJG",RepAnnieKuster
227,2021-11-23 17:10:26+00:00,1463193233933185035,"Teachers, nurses, &amp; public servants dedicate their careers to the betterment of our country — thanks to @POTUS, our public loan forgiveness programs are beginning to work better for those who serve our communities. 
https://t.co/XWgzaKFgTd",RepAnnieKuster
228,2021-11-23 13:33:34+00:00,1463138657066496008,"Earlier this month, I joined my colleagues in sending a letter to the administration urging immediate action to ease home heating costs for New England families.
https://t.co/1BRuLoTylN",RepAnnieKuster
229,2021-11-23 13:32:13+00:00,1463138316350636039,"I’m glad to see @POTUS take this step to lower oil and gas prices as we head into the holidays. 

Global demand has been exceeding supply which has driven up prices, and the United States is working alongside other countries that are facing rising prices to lower costs. https://t.co/7uekBw6yV9",RepAnnieKuster
