,Datetime,Tweet Id,Text,Username
81,2021-12-08 19:04:10+00:00,1468657675156299778,"@GovAcctProj PODA enhances protections for whistleblowers.

It also clarifies the right of government workers to provide information directly to Congress and creates a right of action for whistleblowers who are outed by government officials

And that's just a start!",RepAdamSchiff
82,2021-12-08 19:01:32+00:00,1468657012523290633,"@ArtDevil313 Great point - one that really gets to the heart of this bill.

PODA is designed to close those loopholes and codify those norms, so we can push back meaningfully when a president abuses their power.

And yes, it requires candidates to give their tax returns to the FEC.",RepAdamSchiff
83,2021-12-08 19:00:00+00:00,1468656627242962949,"Hi folks.
 
I've got some time, so I'll be taking a few minutes to respond to your questions on the Protecting Our Democracy Act.
 
Drop a question below or use #ProtectingOurDemocracy and I'll do my best to answer as many as possible. 👇 https://t.co/SyiNPZ1mjr",RepAdamSchiff
84,2021-12-08 17:43:30+00:00,1468637373814779910,"The House votes on the #ProtectingOurDemocracy Act tomorrow.

A bill I wrote with @RepCohen, @GerryConnolly, @RepDean, @RepJeffries, @RepTedLieu, @RepKatiePorter, @RepRaskin, @RepMGS, @RepSpeier, @RepSwalwell, &amp; @RepAnnaEshoo.

We're ready to get this done.

Democracy demands it.",RepAdamSchiff
85,2021-12-08 13:00:51+00:00,1468566242160168960,"The House is set to vote on the #ProtectingOurDemocracy Act - legislation to root out corruption and protect against abuses of power.
 
These reforms will help secure our democracy. And today, I’ll answer your questions on PODA. #AMA, and I’ll bring in some House colleagues too!",RepAdamSchiff
86,2021-12-08 02:41:50+00:00,1468410463738281986,"Tonight's vote paves the way for increasing the debt limit, so we can pay the bills we’ve already incurred.
 
Playing games with the faith and credit of the U.S. could cost millions of individuals their jobs.
 
That's what's at stake here.

The GOP would do well to remember that.",RepAdamSchiff
87,2021-12-07 22:31:09+00:00,1468347376205275138,"Today, the @January6thCmte learned that Mark Meadows will not further cooperate.

Why he can discuss Jan 6 in a book, but not with Congress, is inexplicable. His deposition will proceed as planned.

If he fails to appear, he will be subject to criminal contempt.",RepAdamSchiff
88,2021-12-06 22:01:16+00:00,1467977468447502345,"As Hanukkah comes to a close, I’m wishing everyone observing in California and beyond a joyful, peaceful evening of celebration.

Enjoy your last round of latkes and sufganiyot — and above all else, the time with family.

Have a wonderful night.",RepAdamSchiff
89,2021-12-03 20:37:28+00:00,1466869213394522117,"Trump put a target on the backs of two nonpartisan election workers.

Both got death threats. It’s sick. Sadly, I know what it’s like to be threatened because of Trump’s lies.

After Jan 6, people need to wake up to the threat of political violence.

It’s real - and increasing. https://t.co/43d7DYtwOL",RepAdamSchiff
90,2021-12-02 22:39:02+00:00,1466537420535439365,"The House just averted a government shutdown.

This continuing resolution will ensure that we uphold our promise to workers, families, veterans, and seniors.

And it will allow us to stay focused on passing critical legislation like expanding child care and improving health care.",RepAdamSchiff
91,2021-12-02 00:22:15+00:00,1466201005507420166,"The Jan 6 committee just voted to recommend the House hold Jeffrey Clark in contempt. 
 
Clark has direct knowledge of Trump’s efforts to utilize the DOJ to prevent a peaceful transfer of power.
 
By refusing to appear, he's violating the law. He will be held accountable.",RepAdamSchiff
92,2021-12-01 23:11:32+00:00,1466183210308714499,"It's time to say ""no more"" and mean it.

No more families with empty chairs at their kitchen tables.

No more missed graduations and weddings.

No more broken communities.

No more trauma. No more violence. No more death.

We have the power to break the cycle.

Let's do it.

5/5",RepAdamSchiff
93,2021-12-01 23:11:32+00:00,1466183209276878848,"Getting these laws through the Senate may seem difficult.

It doesn't have to be. The difficulty is of our own making. And a belief that an archaic rule is more important than our children’s safety.

If we end the filibuster, we can pass these gun safety laws and more.

4/5",RepAdamSchiff
94,2021-12-01 23:11:31+00:00,1466183208291258370,"Then, we must hold gun manufacturers accountable when they act negligently.

I have a bill that will put an end to the liability shield allowing manufacturers &amp; dealers to get away with murder.

We should give victims their day in court.

(President Biden supports it, too!)

3/5",RepAdamSchiff
95,2021-12-01 23:11:31+00:00,1466183207116759043,"First, we should enact commonsense measures that already enjoy broad support:

-Universal background checks.
-Closing the ""Charleston"" loophole.
-Banning assault-style weapons.
-Red flag laws to keep guns away from abusers.

These are the bare minimum. Not the end.

2/5",RepAdamSchiff
96,2021-12-01 23:11:31+00:00,1466183206047301632,"Yesterday, yet another horrific act of violence changed a community forever.

It doesn’t have to be this way. And yet it is.

Because Republicans refuse to act.

We have the power to end the scourge of gun violence.

Here’s how we can start:

1/5",RepAdamSchiff
97,2021-12-01 20:44:29+00:00,1466146203750604801,"PrEP and PEP are highly effective at preventing HIV.

But too often, these medications are out of reach for those who need them most. 

That's why I just introduced legislation to make these life-saving medications available to all in need.

Because everyone deserves protection. https://t.co/QGal0zuo8B",RepAdamSchiff
98,2021-12-01 17:55:05+00:00,1466103572689473539,"Today, the Supreme Court considered a case that could ultimately overturn Roe.

A “conservative” court would uphold precedent. But a “partisan” court may not — and this may be the most partisan court in history.

We must protect a woman’s right to choose.",RepAdamSchiff
99,2021-11-30 22:14:28+00:00,1465806461397835776,"I'm closely monitoring the news out of Oxford, Michigan.

And I am praying for the survivors and victims of this horrific attack.

It's every parent's worst nightmare. And a devastating reality for far too many.

Gun violence is killing our children.",RepAdamSchiff
100,2021-11-30 17:59:45+00:00,1465742362014060545,"Mark Meadows has a legal and moral obligation to cooperate with our committee.

I’m glad he has now agreed to appear and has already provided documents. 

We will evaluate the extent of his compliance after his testimony. 

We must reveal the full truth of what led to January 6.",RepAdamSchiff
101,2021-11-28 22:17:26+00:00,1465082433334743044,"During Hanukkah we celebrate the many miracles in our lives with the ones we love most.

And tonight, millions of families will light the first candle on their menorah and welcome in this special holiday.

So from my family to yours: Hanukkah Sameach!",RepAdamSchiff
102,2021-11-25 21:26:28+00:00,1463982444638453784,"Wishing you all a happy, healthy Thanksgiving.
 
Today, I'm thankful for the everyday things: Meals shared with family. Long hikes under blue skies. The health of loved ones.
 
I hope your day is also filled with blessings and joy.",RepAdamSchiff
103,2021-11-24 23:31:21+00:00,1463651482301976579,"What’s actually in the Build Back Better Act?

🖍 Universal pre-k.
👪 Affordable, quality childcare and paid family leave.
🏘️ Rental and down payment assistance.
🌎 Clean energy investments and climate action.

It will cut your costs and help your family. And it’s just the start.",RepAdamSchiff
104,2021-11-24 19:40:43+00:00,1463593441250529281,"Our justice system too often fails Black individuals.

But today, truth prevailed and Ahmaud Arbery’s murderers are being held to account.

We know this verdict won’t erase the grief of Ahmaud’s family and friends.

But I pray it will bring comfort to know justice was served.",RepAdamSchiff
105,2021-11-19 17:18:05+00:00,1461745607211692035,"It's impossible to overstate the magnitude of this moment.

We just passed this generation's New Deal. 

It will help every family. In a big way.

This is a promises made, promises kept moment.

Democrats have delivered for the country. And for the people.",RepAdamSchiff
106,2021-11-19 14:58:41+00:00,1461710527319715841,"I just voted YES on President Biden’s Build Back Better agenda:

Establishing universal pre-k.
Lowering prescription drug costs.
Expanding family leave.
Protecting our planet.
Expanding health care. 
Cutting child poverty.

The Senate must act. Without delay.",RepAdamSchiff
107,2021-11-19 13:01:23+00:00,1461681008357560325,"Good morning!

It’s a beautiful day for the House to make the biggest investment in the American people since the New Deal.

I’ve had my caffeine. And I’m ready to vote yes. 

Let’s do this.",RepAdamSchiff
108,2021-11-19 03:58:55+00:00,1461544489357651977,"If you took the worst orator in the world

Gave him the worst speech in the world

And made him read it for the longest time in the world 

That would be a lot like listening to Kevin McCarthy tonight. 

Except, probably better.",RepAdamSchiff
109,2021-11-18 17:26:20+00:00,1461385296059248645,"Building Back Better isn't just a slogan.

It's a promise.

A promise of expanded, affordable health care.
A promise of climate action and green jobs.
A promise of paid leave and child care.

A promise of a brighter future – for everyone.

We must make good on that promise.",RepAdamSchiff
110,2021-11-17 21:33:26+00:00,1461085091594125319,"Paul Gosar made a video about killing one of our colleagues.

That’s just wrong. But the GOP thinks otherwise.

Hell, they’re more upset about members who voted for a BIPARTISAN infrastructure package.

In any other workplace, he’d be punished or out. 

Should be the same here.",RepAdamSchiff
111,2021-11-17 15:59:55+00:00,1461001162732322817,"Two million students go to school without the glasses they need.

How can kids succeed if they can’t see the board at the front of the classroom?

Today @RepJahanaHayes &amp; I introduced a bill to bring no-cost optometry care to students.

Because every child deserves to thrive.",RepAdamSchiff
112,2021-11-15 21:24:39+00:00,1460358106240667650,"President Biden just signed the infrastructure deal. 

And let me just say: It’s a big deal.

Roads and bridges, yes. But also clean water, broadband and climate investments.

We need to keep up the momentum, and pass the Build Back Better Act. ASAP.

Nothing less will do.",RepAdamSchiff
113,2021-11-14 16:41:43+00:00,1459924515396464644,"If our law is to mean anything, it has to be applied equally.

Steve Bannon’s indictment is a badly needed affirmation of that principle. And Congress’ oversight power.

It sends a clear message to every prospective witness:

Refusal to obey a subpoena is not an option. https://t.co/isPjTflP8v",RepAdamSchiff
114,2021-11-12 21:54:23+00:00,1459278425118625794,"A grand jury just indicted Steve Bannon for contempt of Congress.

Let this send a message to all those with knowledge of the attack on our democracy:

The days of defying subpoenas with impunity are over.

We will expose those responsible for Jan 6.

No one is above the law.",RepAdamSchiff
115,2021-11-11 15:57:46+00:00,1458826290644099082,"Veterans and service members are the best of us.
 
Their selfless commitment to defending our country deserves nothing less than our utmost respect and gratitude.
 
So on this Veterans Day, let's all join together to thank these brave individuals for their service and sacrifice.",RepAdamSchiff
116,2021-11-10 00:02:39+00:00,1458223540507926529,"After Columbine, the NRA faced a choice: reckon with their role in a massacre or double down.

We know what they chose.
                                          
231 school shootings later, they're running the same play:

No remorse. No accountability. No regard for human life. https://t.co/N700LC3vQq",RepAdamSchiff
117,2021-11-09 17:23:50+00:00,1458123175779315718,"There was a time when making light of murdering a colleague would elicit unified outrage.

But not in McCarthy’s GOP.

In McCarthy’s GOP they want to punish members who voted for infrastructure.

That’s right, infrastructure.

But condoning violence — that’s A-okay.

It’s sick.",RepAdamSchiff
118,2021-11-06 16:39:12+00:00,1457024778393505795,"– Funds to repair crumbling roads &amp; bridges
– Broadband access for students &amp; rural communities
– Green energy infrastructure investments
– And much more

And it's just our first act.

We're committed to passing the Build Back Better agenda to complete the investments in people.",RepAdamSchiff
119,2021-11-06 16:39:11+00:00,1457024777353375750,"This $1 trillion investment in infrastructure will reach all communities, both big and small, creating a stronger economy that lifts up workers and families.

It will mean:

– Clean drinking water for all
– Largest-ever investment in transit
– Two million new good-paying jobs",RepAdamSchiff
120,2021-11-06 16:39:11+00:00,1457024775960907779,"Last night, the House passed the bipartisan infrastructure package. It’s on its way to the President’s desk.

There’s no understating the importance of this moment.

This is a historic investment – the first chapter of a new, New Deal, that Democrats are writing for this country.",RepAdamSchiff
121,2021-11-06 03:25:07+00:00,1456824943010791431,"I just voted yes on the infrastructure package. It will benefit millions of workers and families. 

But unless we invest in our people too, the job is not even half finished.

We can’t stop until we pass the Build Back Better Act.

We need a new, New Deal.",RepAdamSchiff
122,2021-11-05 15:04:50+00:00,1456638645402746884,"We’re on the verge of passing bills that will benefit every single person in this country.

So naturally, Republicans are trying to adjourn Congress before that happens.

If they want to sit this out, so be it.

But Democrats showed up to work today. And we’re getting this done.",RepAdamSchiff
123,2021-11-05 13:30:33+00:00,1456614918485118983,"Today’s job numbers show our recovery is continuing. 

And once we pass the Build Back Better agenda, we’ll create even more good-paying jobs.

2 million of them.

Jobs in clean energy, IT, infrastructure, and child care.

Jobs that will change lives and bring us into the future.",RepAdamSchiff
124,2021-11-03 20:10:19+00:00,1455990747157737477,"Time for a reality check:
 
Senate Republicans will NEVER vote to protect voting rights.
 
We have to stop waiting for the fever to break. It’s time to end the filibuster and start legislating like our democracy is on the line.
 
Because it is.",RepAdamSchiff
125,2021-11-03 18:13:25+00:00,1455961328359723013,"Domestic terrorism is one of the gravest threats to America.

But we cannot separate that threat from the white supremacist movement that often fuels it.

We must break the cycle of radicalization, and keep America safe — for everyone. https://t.co/8UvK5KLW5V",RepAdamSchiff
126,2021-11-03 16:01:50+00:00,1455928214908506112,"Look, I get it. It’s easy to be cynical these days. But we have a lot to be hopeful about.

We’re going to pass a New Deal-level investment in people.

We’re going to put our children and grandchildren on a course for a better future.

We’re going to get this done. We have to.",RepAdamSchiff
127,2021-11-02 20:13:42+00:00,1455629211172053000,"Democrats have been working for years to lower our nation’s unconscionably high prescription drug prices.

Pharma has fought us every step of the way.

And now, we are — at long last — on the precipice of delivering real relief.

This is how you truly Build Back Better.",RepAdamSchiff
128,2021-11-02 17:27:46+00:00,1455587451825754112,"An election is an election, whether for candidates or ballot measures.

That the FEC would allow foreign money and interference in our elections is utterly incomprehensible. 

It would set a dangerous precedent ripe for abuse.

Americans must decide American elections.",RepAdamSchiff
129,2021-11-02 16:09:10+00:00,1455567672670830592,"If you've ever had a pet, you know how special the bond is between families and their four legged friends.
 
And how devastating it is when that tie is broken.
 
My Pets Belong with Families Act would end the impossible choice between beloved companions and secure housing.",RepAdamSchiff
130,2021-11-01 20:09:32+00:00,1455265774399102979,"The climate crisis is the single most dire threat we face.
 
Now is the time for aggressive action.
 
President Biden just showed the world the U.S. recognizes the urgency of this moment.

And the unimaginable peril that lies ahead should we fail.

Let's get this done.",RepAdamSchiff
131,2021-10-28 23:38:58+00:00,1453868929252798486,"The GOP's flirtation with white supremacy didn't end after January 6.
 
No. It's at the core of their efforts to overturn our democracy.
 
It fuels their media ecosystem. It energizes their base.
 
And unless they cast it out, it will take hold of their party for good. https://t.co/ldTUqMLpwj",RepAdamSchiff
132,2021-10-27 14:34:28+00:00,1453369510065487883,"The GOP calls Build Back Better a ""liberal wish list.""

What they’re really saying is they’re against paid family leave and childcare, health care, and climate action.
 
As for me, I don’t view this as a wish list.

It’s a to-do list — and one that needs to get done right now.",RepAdamSchiff
133,2021-10-26 20:07:40+00:00,1453090975744659461,"The Facebook Papers are shocking and yet, not surprising.

The industry is built on engagement, which grows with anger and hate.

They have a multi-billion dollar incentive to stay the course.

And with over 35% of the world using their platform -

What could go possibly wrong?",RepAdamSchiff
134,2021-10-26 16:12:49+00:00,1453031874142646274,"Federal law protects against discrimination in housing, schooling and employment.

Health care, however, remains broadly unprotected.
 
That omission costs lives.
 
Our #EqualHealthCareforAll Act makes health care a civil right, ensuring equitable care for all.",RepAdamSchiff
135,2021-10-22 00:50:41+00:00,1451350258596859907,"Holding Steve Bannon in criminal contempt was an early test of our democracy’s recovery. 

Now, it is in the hands of the Department of Justice. 

To do justice. https://t.co/isp9KkW121",RepAdamSchiff
136,2021-10-21 20:18:12+00:00,1451281686822522887,"Today, the House found Steve Bannon in criminal contempt for defying a subpoena.

That charge will now be sent to the Justice Department for prosecution. 

The DOJ should take the matter before the grand jury without delay and bring Bannon to justice.

No one is above the law.",RepAdamSchiff
137,2021-10-20 22:25:53+00:00,1450951431993835523,"Today Senate Republicans blocked a bill to expand the right to vote, end partisan gerrymandering, and expose dark money in politics.

They wouldn’t even allow debate.

Why?

Because Republicans know that when people vote — they lose.

It’s as simple as that.",RepAdamSchiff
138,2021-10-19 23:58:21+00:00,1450612312407257089,"Steve Bannon was given every opportunity to comply with a lawful subpoena.

He chose instead to make specious claims of executive privilege.

Tonight, we voted to hold him in criminal contempt.

Despite what he and Trump may believe, no one is above the law.",RepAdamSchiff
139,2021-10-18 17:28:18+00:00,1450151766872502272,"General Colin Powell was a man of deep intellect, courage and patriotism, whose life was defined by service to country. 

America will miss him dearly – but his incomparable legacy will live on. 

My prayers are with his family and friends, and those he inspired to service.",RepAdamSchiff
140,2021-10-16 17:18:15+00:00,1449424463561437194,"This isn’t a “moderate” vs. “progressive” thing.

This is a “survival” vs. “complete and utter catastrophe” thing.

Reconciliation might be our last, best chance to fight climate change through transformative investments.

The next generation looks to us.

We can’t let them down.",RepAdamSchiff
141,2021-10-16 00:18:15+00:00,1449167771921788932,"Here’s why this matters:

The Biden Administration has already waived executive privilege on many documents, and allowed top former DOJ officials to testify.

Now Biden supports strong enforcement of lawful subpoenas.

Accountability is back, along with the rule of law. https://t.co/vK5xnflNDW",RepAdamSchiff
142,2021-10-15 16:22:48+00:00,1449048122118782977,"A minority can use the Electoral College to elect a president who loses the popular vote.

A minority can gerrymander control of the House.

A minority can stop the majority from governing the Senate.

Does that sound like a successful democracy to you?",RepAdamSchiff
143,2021-10-14 17:51:30+00:00,1448708053348540425,"We’ve said it before, and we’ll say it again:

We’re not messing around here.

People with relevant information to our investigation into January 6 must comply with lawful subpoenas.

If they don’t, we will use all the tools at our disposal — including criminal contempt.",RepAdamSchiff
144,2021-10-14 14:39:20+00:00,1448659694826835982,"You’ve probably heard a lot about the reconciliation debate.

But chances are you haven’t heard what’s actually IN the bill:

- Paid family medical leave.
- Childcare.
- Lower drug prices.
- Expanded Medicare.
- Climate action.

And so much more.

Enough noise. Let’s get it done.",RepAdamSchiff
145,2021-10-12 23:28:33+00:00,1448068098075004929,"Tonight, Democrats voted to avert a default, which would have sent our economy into a tailspin.
 
Republicans instead proved they’re just fine with chaos, even a default – and the harsh consequences to families – if it moves them closer to power.",RepAdamSchiff
146,2021-10-12 18:56:13+00:00,1447999566301761541,"History will not be kind to today’s Republican Party.

A party whose members endorse sedition.

A party that lionizes insurrectionists.

A party that eagerly blocks progress on everything from climate to health care.

So much for the party of Lincoln.",RepAdamSchiff
147,2021-10-12 01:00:21+00:00,1447728813144776707,"Thanks for the shout-out, Mr. Former President.

As for your statement that the attack on the Capitol would never have happened if “the people in charge had done their job”

You do realize that you were in charge on January 6th? Right?

Just checking.",RepAdamSchiff
148,2021-10-10 18:34:44+00:00,1447269383286497286,"It’s a simple question with a simpler answer: Was the 2020 election stolen from Donald Trump?

No. Unequivocally no.

But Republicans are so beholden to their disgraced demagogue that they dare not speak the truth.

They are an authoritarian cult. And a danger to our democracy.",RepAdamSchiff
149,2021-10-09 15:06:24+00:00,1446854565857484803,"Proud to join @POTUS yesterday as he signed my bill, the HAVANA Act, into law.

Every day, brave diplomats, intelligence officers, and servicemembers make great sacrifices.

We must care for them as we investigate these troubling incidents and hold those responsible to account. https://t.co/mqcSOYfSeO",RepAdamSchiff
150,2021-10-07 20:13:33+00:00,1446207086556295173,"The former president is still trying to stonewall subpoenas.

But this time, we have a Justice Department devoted to the rule of law.

This time, lawbreaking witnesses must weigh the prospect of criminal prosecution.

Americans deserve answers. We will make sure they get them. https://t.co/19Ls6aYNhp",RepAdamSchiff
151,2021-10-07 16:55:35+00:00,1446157265531191297,"Donald Trump tried to overturn the 2020 election.

He weaponized our government against the American people. And the worst part? He almost succeeded.

Republican leaders in Congress know all of this.

They just don’t care. And they continue to stand by as his attacks continue.",RepAdamSchiff
152,2021-10-07 02:11:09+00:00,1445934694286209027,"A federal judge just affirmed what so many of us already knew:

Texas’s abortion ban is morally wrong — and legally wrong.

This marks important progress in the ongoing effort to protect the right to choose. 

We will not go back. https://t.co/yTLKpRuVCb",RepAdamSchiff
153,2021-10-06 21:44:32+00:00,1445867597400985606,"Four of Donald Trump’s associates have been subpoenaed to testify about January 6.

If they refuse to comply, they can be subject to criminal contempt.

What are they hiding? What are they afraid of?

The truth will come out. We will make certain of that.",RepAdamSchiff
154,2021-10-05 22:32:30+00:00,1445517279270031365,They. Tried. To. Kill. You. Mister. Vice. President. https://t.co/K6xsd2oBpr,RepAdamSchiff
155,2021-10-04 21:41:46+00:00,1445142123062431751,"Today, @IATSE members voted to authorize a strike.
  
This is the next chapter in their efforts to secure living wages and better working conditions.
 
It is my hope an agreement can be struck soon, and that this will lead to badly-needed changes for these talented individuals.",RepAdamSchiff
156,2021-10-04 19:37:38+00:00,1445110885136097283,"According to this Facebook whistleblower, shutting down the civic integrity team and turning off election misinformation tools contributed to the Jan 6 insurrection. 

The Select Committee will need to hear from her, and get internal info from Facebook to flesh out their role. https://t.co/b9ZLhf9lMX",RepAdamSchiff
