,Datetime,Tweet Id,Text,Username
234,2021-07-20 22:31:56+00:00,1417613269959942144,"After four years of unfettered corruption, justice is finally catching up to the former president's criminal associates.

Thomas Barrack may be the latest Trump aide held responsible for his crimes —

But he certainly won't be the last. https://t.co/uyGeAXYoCi",RepAdamSchiff
235,2021-07-19 22:59:59+00:00,1417257944127885316,"Just 12 people are responsible for the majority of anti-vaccine disinformation on social media.

And 99% of all COVID deaths are among unvaccinated individuals.
 
Social media companies can—and must— stop the deadly spread of misinformation.

These lies cost lives.",RepAdamSchiff
236,2021-07-17 15:02:06+00:00,1416412903293521922,"A year ago, we lost one of our greatest leaders in Congress, an American hero, and a dear friend.

While we feel his absence, his spirit will never leave us.

It inspires us to keep making good trouble. And fighting to protect the vote.

We miss you, John. https://t.co/wJ9kfvqft9",RepAdamSchiff
237,2021-07-16 23:41:30+00:00,1416181224960413698,"The American dream belongs to all of us, including those brought here as children.

This terrible and heartbreaking ruling only reaffirms what we’ve long known: These protections need the force of law.

Congress must create a pathway to citizenship for Dreamers. https://t.co/oLtfpn2Hc2",RepAdamSchiff
238,2021-07-16 13:32:11+00:00,1416027886839074822,"If our citizens can’t vote, how can our democracy thrive? 

If people don’t have health care, a living wage, or clean air and water, how can they thrive?

Democracy isn't just a system of government. It's a promise.

And it's up to all of us — each generation — to fulfill it.",RepAdamSchiff
239,2021-07-15 21:53:39+00:00,1415791695875256323,"Nine voting rights activists arrested for peacefully demonstrating.

For standing up for our democracy.

We've seen this before. And we know how it ends: democracy WILL prevail.

Proud to stand in solidarity with @RepBeatty and all those fighting for our democracy. https://t.co/PJn01xlIKO",RepAdamSchiff
240,2021-07-15 15:47:30+00:00,1415699553504923651,"Every Republican in Congress voted against expanding the Child Tax Credit.

Every. Single. One.

But despite their opposition, those checks are hitting American families' bank accounts today.

And they're projected to cut child poverty in HALF.",RepAdamSchiff
241,2021-07-14 15:53:22+00:00,1415338641841442817,"I don’t know about you, but I’m pro-vaccines and anti-COVID, anti-flu, anti-HPV ... well, really anti-diseases killing people.

How on earth is that partisan opinion now? https://t.co/L2uFkBG3qh",RepAdamSchiff
242,2021-07-14 00:13:27+00:00,1415102103190654989,"The stakes are high. Voting rights, health care, climate change, and so much more — they’re all on the line.

The people who voted and organized and marched expect action. The country demands it. 

The path is clear. We must end the filibuster.

There is simply no other way.",RepAdamSchiff
243,2021-07-13 14:06:09+00:00,1414949272236302348,"BIG NEWS: On July 15, the first Child Tax Credit payments will go out.
 
For millions of families, that means:
✔️ More food on the table.
✔️ Less financial anxiety.
✔️ Better long-term outcomes.
 
We can cut child poverty in half. Learn more at https://t.co/JlZbiVt8TG.",RepAdamSchiff
244,2021-07-13 00:11:18+00:00,1414739174679367686,"Cubans are suffering devastating food, medicine, and power shortages — made worse by the pandemic and an authoritarian regime enriching itself rather than supporting its people.

We stand with peaceful Cubans in their continued struggle for freedom, dignity, and a better life.",RepAdamSchiff
245,2021-07-09 14:18:21+00:00,1413502790182264832,"Heatwaves like this aren’t a matter of inconvenience: they’re a matter of life-and-death.

So we must act like lives are at stake.

We must fight for a #GreenNewDeal. https://t.co/t4mqaowEBU",RepAdamSchiff
246,2021-07-07 14:01:46+00:00,1412773840158179329,"Gun violence never takes a holiday.

500 shootings. 618 injuries. 233 deaths. 1 weekend.

It’s time for Republicans in Congress to stop pretending and see the gun violence epidemic for what it is:

A national emergency.

https://t.co/bZ6LlQEWfX",RepAdamSchiff
247,2021-07-06 16:06:27+00:00,1412442829847158788,"Six months ago, a violent mob stormed the Capitol trying to undermine our democracy. Lives were lost and countless more endangered.

And Republicans are desperate as ever to keep the truth of that dark day hidden.

Enough.

It’s time to follow the facts, wherever they lead.",RepAdamSchiff
248,2021-07-04 15:07:08+00:00,1411703127582068739,"After a year of so much hardship and sacrifice, what a joy it is to be able to celebrate freedom, liberty, and the promise of America safely together again with friends, neighbors, and loved ones.
 
Happy 4th of July to you and yours! https://t.co/FRQ1w1stFG",RepAdamSchiff
249,2021-07-01 18:41:05+00:00,1410669808325214210,"Trump’s business and chief financial officer indicted.

Can anyone be surprised?

Trump also used his charitable foundation as a personal and political slush fund.

His corruption didn’t start in the Oval Office.

He just brought it with him.

A con man from start to finish. https://t.co/Jk4bw3c0Rq",RepAdamSchiff
250,2021-07-01 15:01:48+00:00,1410614621489139712,"On January 6, our democracy survived its greatest threat since the Civil War.

We’ve yet to learn the truth of that sad day.

But we will have a full accounting.

I’m humbled to serve on the January 6 Select Committee. It's time to get to work.",RepAdamSchiff
