,Datetime,Tweet Id,Text,Username
77,2022-01-25 20:05:41+00:00,1486067771360358401,"Climate disasters cost $145B last year—yet, a partisan lawsuit heading to SCOTUS is seeking to gut the #CleanAirAct &amp; its life-saving protections.

I'm joining 190+ of my Democratic colleagues to oppose this dangerous lawsuit &amp; help ensure clean air for every American. https://t.co/ntcRDWbyR2",RepAnnieKuster
78,2022-01-25 19:31:41+00:00,1486059217266032644,"Congratulations to the six skiers from New Hampshire’s @dartmouth — alumni and current students — who were named to the 2022 Olympic Team!

You’re making the Granite State proud! ⛷️
https://t.co/xMfuI6CHpo",RepAnnieKuster
79,2022-01-25 18:02:10+00:00,1486036686853267457,"📁 The 2022 tax filing season is here! 📁
 
The filing deadline is April 18, which means you and your family will have more time to file this year.

Find more info on how to file below ⤵️
https://t.co/uTUTrQ76X1",RepAnnieKuster
80,2022-01-25 16:33:53+00:00,1486014471264997377,"Addressing the mental health crisis in NH means expanding access to treatment &amp; resources like Monadnock Family Services’ mobile mental health unit.

I'll continue working in Congress to support our Granite State mental health &amp; substance use providers.
https://t.co/009kRgMmX2",RepAnnieKuster
81,2022-01-24 19:58:33+00:00,1485703590572433411,"#COVID19 booster shots have been shown to bolster protection against serious illness &amp; hospitalization.

If you or a loved one have not yet received your booster shot &amp; are eligible, you can find a vaccine appointment near you: https://t.co/HlvDjVt9bQ.
https://t.co/p1mW2JpuLS",RepAnnieKuster
82,2022-01-22 14:40:18+00:00,1484898721733226498,"For 49 years, generations of women have relied on #RoeVWade to make reproductive decisions without government interference—that freedom is in jeopardy. 

On the anniversary of this ruling, I remain committed to defending reproductive freedom for all.

➡️https://t.co/IvvNkXbMCQ https://t.co/kzGp5uwB7T",RepAnnieKuster
83,2022-01-21 21:55:48+00:00,1484645934713786378,"The services @ppnnehealth provides are essential—but, partisan attacks on reproductive freedom have kept these services painfully underfunded. 

These dollars for PPNNE are key to protecting safe access to reproductive &amp; preventive care—proud to stand up for reproductive freedom. https://t.co/JApyzq3ENS",RepAnnieKuster
84,2022-01-21 21:17:53+00:00,1484636392768647175,"Today I met with NH libraries to talk about how they're using the American Rescue Plan to stay open &amp; serving families.

I was proud to secure critical relief to help NH libraries expand programming &amp; thank all the librarians who joined me today for their dedication to our state. https://t.co/jEei4aud6j",RepAnnieKuster
85,2022-01-21 20:46:39+00:00,1484628532148031491,"Here in NH, the COVID-19 Omicron variant is pushing our hospitals &amp; health care workers to their limits—&amp; has been for weeks.

We can all play a role in easing the burden on our hospitals by getting vaccinated, wearing masks &amp; staying home if you feel sick.https://t.co/3F5QWu9hhx",RepAnnieKuster
86,2022-01-21 17:57:28+00:00,1484585952983060488,"Today, we heard from @Surgeon_General during a bipartisan @EnergyCommerce briefing on health misinformation.

Misinformation on #COVID19 &amp; other medical issues harms our ability to make decisions about our health &amp; poses an urgent threat to all Americans. It must be addressed. https://t.co/nvk4Y70jXe",RepAnnieKuster
87,2022-01-20 22:14:55+00:00,1484288356460769283,"Today in @EnergyCommerce, I questioned cryptocurrency experts about the rapid utilization of cryptocurrencies &amp; their environmental impact.

While we know there are some bad actors who utilize carbon-intensive mining, there are industry leaders focused on reducing emissions. https://t.co/kEKJtL0PaF",RepAnnieKuster
88,2022-01-20 21:18:20+00:00,1484274118140870660,"Today in @HouseAgDems, I questioned USDA @SecVilsack about steps the administration is taking to support local farms &amp; ongoing efforts to utilize green farming initiatives.  

I thank Sec Vilsack for joining us &amp; look forward to working with @USDA to support our nation’s farms. https://t.co/W82N7HOgJx",RepAnnieKuster
89,2022-01-20 17:17:16+00:00,1484213451513905155,"ICYMI: Congress passed my Ghost Army Congressional Gold Medal Act, sending the bill to @POTUS.

The top-secret Ghost Army saved thousands of lives during WWII by fooling German troops—&amp; this bill gives these men the long-overdue recognition they deserve.
https://t.co/bKkNJW35jl",RepAnnieKuster
90,2022-01-19 19:39:30+00:00,1483886856458620934,"I’m proud that the incredible story and contributions of the Ghost Army will finally be honored, and the brave men of the unit will receive the long-overdue recognition they deserve. 

I look forward to @POTUS signing this legislation into law in the coming days.",RepAnnieKuster
91,2022-01-19 19:38:32+00:00,1483886612970889231,"JUST NOW—The House passed my Ghost Army Congressional Gold Medal Act, sending the bill to @POTUS.

The Ghost Army saved thousands of lives during WWII through innovative maneuvers—because their missions were secret for decades, they were never recognized.

This bill changes that. https://t.co/DVyYp7hkXs",RepAnnieKuster
92,2022-01-18 20:28:45+00:00,1483536862539096067,"Frequent COVID-19 testing can help to keep you and your loved ones safe and slow the spread of this virus. Now, at-home testing kits are available to ship for FREE directly to your home.

You can put in an order for your household today ➡️ https://t.co/PduUwmTkKI https://t.co/exjMNAqIHK",RepAnnieKuster
93,2022-01-17 16:30:19+00:00,1483114473107988496,"“Change does not roll in on the wheels of inevitability, but comes through continuous struggle.”

On #MLKDay, we remember the lessons of Dr. Martin Luther King Jr. and honor his life and legacy of standing up for equal treatment for every American. https://t.co/dsw0PiawZO",RepAnnieKuster
94,2022-01-15 20:56:23+00:00,1482456651953283074,"📢 Don’t forget! Today is the LAST day to update your existing health care plan or sign up for a new one through the Health Insurance Marketplace.

Visit https://t.co/zCJIpwjukK to #GetCovered for 2022. https://t.co/7LcyYIMJPl",RepAnnieKuster
95,2022-01-15 15:00:34+00:00,1482367110084976642,"Bundle up, New Hampshire!

Another winter storm is sending temperatures across the state below zero this weekend. 

If you are in need of heating assistance or a warm place to shelter, call 211.
https://t.co/DCymaBH9az",RepAnnieKuster
96,2022-01-14 21:41:18+00:00,1482105569867669505,"2021 was a year like no other, but we got through it, together. 

Learn more about my work in Congress on behalf of the Granite State ➡️ https://t.co/5BL69ycuP8 https://t.co/FetGVOOKXT",RepAnnieKuster
97,2022-01-14 19:29:04+00:00,1482072290699448323,"NH health providers have been on the frontlines of #COVID for nearly two years—it's essential we support them as they work to keep our communities safe.

Thrilled NH will receive $76M from the American Rescue Plan to support providers in rural communities.https://t.co/Xx7Q0Eso8S",RepAnnieKuster
98,2022-01-14 15:41:20+00:00,1482014982082543621,"JUST IN: NH will receive $225M to upgrade bridge infrastructure!

NH’s bridges are a key part of our state’s economy &amp; economic competitiveness. I was proud to secure this funding in the Bipartisan Infrastructure Law &amp; look forward to seeing the positive impact of these dollars. https://t.co/TnGhE7l0iO",RepAnnieKuster
99,2022-01-13 19:45:48+00:00,1481714116679110657,"Every life lost to overdose is a tragedy—my heart goes out to all the NH families who lost a loved one to addiction.

As founder &amp; co-chair of the @BAMHTF, I'm working across the aisle to take evidence-based action to address the substance misuse crisis.
https://t.co/xFR4nHmdsf",RepAnnieKuster
100,2022-01-13 17:29:45+00:00,1481679876822384645,"Don’t forget ➡️ #OpenEnrollment ends at midnight on January 15th! 

Since the enrollment period began, more than 51,000 Granite Staters have signed up for an affordable health insurance plan. Don’t miss your chance to #GetCovered in 2022. 

➡️https://t.co/dKdBzGaYAj",RepAnnieKuster
101,2022-01-13 17:08:13+00:00,1481674458821705735,"Today the House passed the Freedom to Vote: John R. Lewis Act, legislation that takes the hallmarks of NH elections &amp; ensures those across the country are held to the same high standard.

Proud to support this bill &amp; protect every American's right to vote.https://t.co/qLZt7wikEn",RepAnnieKuster
102,2022-01-12 22:54:42+00:00,1481399263250759686,"Starting soon!

Join me and @RepChrisPappas for a telephone town hall at 6:15 PM to discuss the Omicron variant and New Hampshire’s COVID-19 response.

All are welcome — we hope to hear from you! 

Call (866) 478-3366 to join. https://t.co/HxZQyQDSSC",RepAnnieKuster
103,2022-01-12 21:26:25+00:00,1481377047863775233,"In recent years, the National Guard has been utilized at record levels—yet Guardsmen &amp; reservists have unequal access to GI Bill benefits.

I voted for the Guard &amp; Reserve GI Bill Parity Act to ensure all service members receive the benefits they deserve. #EveryDayInUniformCounts https://t.co/R249DzLGcj",RepAnnieKuster
104,2022-01-12 19:58:12+00:00,1481354846326374402,"Today in @HouseAgDems, I questioned transportation &amp; energy experts about building out our nation’s electric vehicle (EV) infrastructure for the benefit of rural communities and our planet.

​​I will continue working to create the clean energy economy of the future. https://t.co/DoDDcOnwUl",RepAnnieKuster
105,2022-01-11 22:56:28+00:00,1481037322053472257,"WEDNESDAY: Join @RepChrisPappas &amp; me at 6:15 PM for a telephone town hall on the Omicron variant &amp; NH’s #COVID response.

We'll be joined by public health officials to provide updates &amp; hear directly from you. All are welcome—we hope to hear from you! Call (866) 478-3366 to join. https://t.co/Yry59YedZx",RepAnnieKuster
106,2022-01-11 17:34:42+00:00,1480956346774212613,"Congratulations to Susan Stearns on being named the new executive director of @NAMI_NH!
 
Susan is a fierce advocate with the experience to bolster NH’s mental health system &amp; expand access to resources. I look forward to working with her in this new role!
https://t.co/2YYriyqwDK",RepAnnieKuster
107,2022-01-11 15:27:51+00:00,1480924423318294530,"🚨There are only 4 days left of #OpenEnrollment!

Whether you want to update an existing plan or find a new one, health coverage is more affordable than ever! You have until Jan 15 to enroll in the ACA Marketplace—don’t miss your chance to #GetCovered.

➡️ https://t.co/84fv2w1FQc",RepAnnieKuster
108,2022-01-11 14:23:45+00:00,1480908293635723267,"Cassie Levesque represents the next generation of Granite State leaders, and her efforts are already making a difference. Thanks to Cassie’s activism and hard work, forced or coercive child marriages are in the national spotlight. 

Keep it up, Cassie!
https://t.co/e5COLusy3G",RepAnnieKuster
109,2022-01-10 21:45:29+00:00,1480657071649562637,"Attention New Hampshire: an arctic cold front is expected to bring dangerously cold temperatures to NH by Tuesday morning.

Make sure you and your loved ones are prepared: stay indoors when possible and bundle up if you have to go outside.

Learn more ⬇️
https://t.co/HHlVVLQyOU",RepAnnieKuster
110,2022-01-10 15:36:41+00:00,1480564258995937281,"I’m pleased to see expanded LIHEAP funding from the American Rescue Plan coming to NH to help families stay warm this winter.

I was proud to get these dollars over the finish line &amp; will continue working to ensure no one is left behind.
https://t.co/72zbCDa3CD",RepAnnieKuster
111,2022-01-10 14:07:50+00:00,1480541898666356736,"NH had nearly 15k active COVID cases last week. Reinforcements from @NHNationalGuard cannot come soon enough for our hospitals &amp; long-term care facilities. If you have not received your vaccine or booster, find a shot near you: https://t.co/mVKSHR7eaf.
https://t.co/1EzIDhnbg7",RepAnnieKuster
112,2022-01-07 22:30:23+00:00,1479581208111718404,"January 6th was a dark day—thanks to the bravery of U.S. Capitol &amp; DC police officers, democracy prevailed. Our country is forever grateful for their sacrifice.

Yesterday, I was honored to thank our Capitol police officers for all they do and serve them a well-deserved meal. https://t.co/joWHlZyuGh",RepAnnieKuster
113,2022-01-07 22:25:47+00:00,1479580046742405127,"January 6th was a dark day—thanks to the bravery of U.S. Capitol &amp; DC police officers, democracy prevailed. Our country is forever grateful for their sacrifice.

Yesterday, I was honored to thank our Capitol police officers for all they do and serve them a well-deserved meal. https://t.co/OUtrRu1Jm7",RepAnnieKuster
114,2022-01-07 21:23:32+00:00,1479564384624156677,"ICYMI: Yesterday, I joined @WMUR9 to talk about the first anniversary of the January 6th attack on our democracy, and the steps forward for our country to ensure nothing like it can ever happen again. https://t.co/b5PyZWn9hD",RepAnnieKuster
115,2022-01-07 16:52:35+00:00,1479496196267913216,"Thinking of U.S. Capitol Police Officer Brian Sicknick’s family, loved ones, friends, &amp; the entire @CapitolPolice community today.

Officer Sicknick, his USCP colleagues, &amp; members of the @DCPoliceDept fought valiantly to save our democracy on Jan 6th. Our hearts are with them. https://t.co/BUEx69GQ3K",RepAnnieKuster
116,2022-01-06 20:33:15+00:00,1479189341910056968,"One thousand acts of courage saved my life and our democracy one year ago today during the January 6th attack on the U.S. Capitol.

On today's anniversary, I spoke as both a survivor and a witness.

Watch below 📺⬇️ https://t.co/OLMeDfKpU4",RepAnnieKuster
117,2022-01-06 15:29:31+00:00,1479112903894568962,My full statement ⬇️  https://t.co/tOmz0tN2R7,RepAnnieKuster
118,2022-01-06 15:29:12+00:00,1479112822449606656,"January 6th was a dark day, but thanks to a thousand acts of courage, democracy prevailed &amp; Congress returned that night to ensure the peaceful transition of power.

On the anniversary of the failed insurrection, we remember how fragile our democracy is &amp; unite to protect it. https://t.co/rnCwVeEDWU",RepAnnieKuster
119,2022-01-06 11:06:49+00:00,1479046792188678144,"This morning, I will be joining CNN @NewDay with @RepDanKildee to talk about the first anniversary of the January 6th attack on our U.S. Capitol.

Tune in 📺 https://t.co/ArmJ37C7hQ",RepAnnieKuster
120,2022-01-06 01:36:57+00:00,1478903381167120391,"More than 2,000 Granite Staters have died as a result of COVID. My thoughts &amp; prayers are with the families who lost a loved one to this virus.

We have the tools needed to help save lives—I encourage you to get vaccinated, not just to protect yourself, but also our communities. https://t.co/4e1Ce0dn1T",RepAnnieKuster
121,2022-01-05 23:00:59+00:00,1478864130803183617,"From replacing stormwater systems to upgrading broadband, this project will lift Keene for generations to come! I was proud to secure funding for NH in the American Rescue Plan &amp; Bipartisan Infrastructure Law &amp; will continue working to ensure NH can thrive.https://t.co/8HLBjoqPJR",RepAnnieKuster
122,2022-01-05 22:00:52+00:00,1478849002938511366,"Tomorrow is the anniversary of the January 6 attack on our U.S. Capitol when a thousand acts of bravery saved countless lives &amp; our democracy.

Let us never forget how close we came. Let us carry these acts of courage in our hearts &amp; work to save our democracy. God Bless America. https://t.co/ookQraO67w",RepAnnieKuster
123,2022-01-05 18:18:40+00:00,1478793085601689604,"I was proud to help get the #NoSurprises Act over the finish line to protect Granite Staters from surprise medical bills.

Learn about what this new law means and your consumer rights ➡️ https://t.co/LiKqKLcyfA. #NoSurpriseBills https://t.co/iVkqEw2y6u",RepAnnieKuster
124,2022-01-05 00:01:20+00:00,1478516930529091589,"“...more bodies than the morgue can hold.”

This is beyond alarming. Safe, effective #COVID vaccines are key to preventing severe illness and saving lives. 

If you have been waiting to get your shot or booster, you can find a vaccination site near you: https://t.co/mVKSHR7eaf. https://t.co/g9ZDwg9dm2",RepAnnieKuster
125,2022-01-04 23:15:36+00:00,1478505423154073605,"NH students should be focused on what they're learning in school, not worried about having food to eat at lunch.

Pleased to see @POTUS deliver $4.2M to NH to bolster food security &amp; combat COVID-related supply chain issues &amp; ensure no student goes hungry.
https://t.co/hpFAKIod7L",RepAnnieKuster
126,2022-01-04 17:29:19+00:00,1478418276787134469,"Each day, our health care workers are on the frontlines of the pandemic working tirelessly to protect our communities.

Let’s all join in honoring our Health Care Heroes by getting vaccinated &amp; recognizing their service w/ #LightsUp4Heroes by keeping holiday lights up until 1/31! https://t.co/4p5UIOdKgY",RepAnnieKuster
127,2022-01-04 15:42:43+00:00,1478391451281235971,"Congratulations to Susan Arnold on being named interim CEO of the @AppMtnClub!

Susan is an accomplished conservation advocate, and I look forward to working with her to preserve our lands and expand outdoor recreation in the Granite State and beyond!
https://t.co/zQwzbQZnPK",RepAnnieKuster
128,2022-01-03 23:05:19+00:00,1478140446807318530,"#COVID vaccines are key to preventing serious illness—this Saturday, clinics around NH will open for Granite Staters to receive their vaccine or get a booster to protect themselves &amp; their loved ones.

Shots are available by appointment. Learn more ➡️ https://t.co/LoH7yMskEP https://t.co/wYHKdSslyC",RepAnnieKuster
129,2022-01-03 21:46:15+00:00,1478120547816984583,"This is exciting news in our efforts to keep students in school &amp; teachers &amp; staff safe. As cases reach all-time highs, the booster shot is a critical tool to keep you safe.

Learn more about getting you &amp; your child a booster shot—https://t.co/mVKSHR7eaf.https://t.co/jjNlBrKus1",RepAnnieKuster
130,2022-01-03 19:19:19+00:00,1478083571235627018,"Congratulations to Aditya Prasad, a Junior at Bishop Guertin HS, winner of #NH02's 2021 Congressional App Challenge!

Aditya’s app identifies a real problem facing health care &amp; creates an accessible solution that could be utilized across the country.
https://t.co/eUBQGFtocZ",RepAnnieKuster
131,2022-01-03 18:17:16+00:00,1478067953824378886,"We will not stand by while reproductive freedom is stripped away in NH. I'll continue to fight for legislation to protect women’s access to reproductive care.

We cannot allow the clock to be turned back on the progress we’ve made to ensure bodily autonomy &amp; reproductive freedom.",RepAnnieKuster
132,2022-01-03 18:16:42+00:00,1478067813172531200,"On Saturday, unprecedented restrictions on the right to reproductive health care went into effect in NH. This far-right, extremist attack on women’s autonomy comes as SCOTUS is poised to erode the constitutional right to an abortion protected by Roe v Wade.https://t.co/3iI9J59f9q",RepAnnieKuster
133,2022-01-01 13:23:35+00:00,1477269272263110657,"Happy New Year, #NH02!

As we ring in 2022, I hope you find time to reflect on all we have accomplished in the past year. It hasn’t been easy, but we’ve made tremendous progress for our country—progress we will carry into the new year! https://t.co/hRdpH3U7MG",RepAnnieKuster
134,2021-12-31 13:41:03+00:00,1476911279847751683,"The best way to protect yourself, your family &amp; your community from #COVID is to get vaccinated &amp; get boosted.

“The people that are coming in unvaccinated have a much larger burden of illness in the lungs than those who are vaccinated.” - Dr. Joseph Varon
https://t.co/8BT1NsULSK",RepAnnieKuster
135,2021-12-31 13:07:22+00:00,1476902805294272513,"Congressman Jamie Raskin is a tireless defender of our country and our democracy. Thank you @RepRaskin for always standing up for what is right.
https://t.co/l02mfcFBao",RepAnnieKuster
136,2021-12-25 12:56:08+00:00,1474725650414153730,"To everyone celebrating here in New Hampshire and across the country, I am wishing you a very Merry Christmas! https://t.co/5slcZe8Ibv",RepAnnieKuster
137,2021-12-23 22:32:18+00:00,1474145870979506182,"Last night following calls from NH’s federal delegation, FEMA approved additional COVID support for our state, including monoclonal antibodies (mAb) administration sites.

Every resource helps as we work to combat this virus—I’ll continue to advocate on behalf of Granite Staters. https://t.co/GwiaawGYl4",RepAnnieKuster
138,2021-12-23 17:31:20+00:00,1474070128644042755,"That’s why I introduced my Humane Correctional Health Care Act, and what I will continue working toward in Congress. 
https://t.co/wFsutoqwQs",RepAnnieKuster
139,2021-12-23 17:30:48+00:00,1474069996166959109,"The Medicaid Inmate Exclusion strips justice-involved individuals of their health coverage from Medicaid, contributing to a cycle of addiction &amp; incarceration.

We must fix this broken system &amp; ensure those involved in the justice system can recover &amp; rejoin our communities. https://t.co/OsCrwsm1Jw",RepAnnieKuster
140,2021-12-23 16:13:51+00:00,1474050632151715840,"This is great news for the millions of Americans in need of student loan relief as the country continues to address the #COVID19 pandemic and bolster our economic recovery.
https://t.co/LNd5EnCM28",RepAnnieKuster
141,2021-12-22 22:15:21+00:00,1473779215845806090,"I will continue working to ensure every Granite Stater has access to the reproductive care they need and combat the consequences of today’s decision.
https://t.co/zavI9H64Cr",RepAnnieKuster
142,2021-12-22 22:14:45+00:00,1473779064804626436,"The EC’s vote to defund NH family planning contracts demonstrates state Republicans' efforts to undermine women’s reproductive freedom. The care that family planning providers offer—including birth control, STI treatment, &amp; cancer screening—is essential to our health care system. https://t.co/QdAZBAttC4",RepAnnieKuster
143,2021-12-22 19:45:23+00:00,1473741478178476043,"Throughout his career, Richard Flynn worked to keep our citizens and our communities safe. His passing will be felt across New Hampshire by the countless people he impacted. 

My thoughts and prayers are with his family and loved ones during this time.
https://t.co/2KShAR1GKX",RepAnnieKuster
144,2021-12-22 17:00:41+00:00,1473700026870288392,"Every child deserves the chance to attend school &amp; be a kid.

Pleased NH will receive $2.2M through the American Rescue Plan to help school districts identify homeless students &amp; provide them with the support they need to participate with their classmates.
https://t.co/HfD6HtJg8f",RepAnnieKuster
145,2021-12-22 15:59:26+00:00,1473684614245978115,"By deploying clinical personnel to NH, @POTUS is offering a reprieve for health care workers facing some of the highest hospitalization rates of this pandemic.

This will provide key relief for frontline workers pushed to their limits handling the surge.
https://t.co/lJUetMN7kU",RepAnnieKuster
146,2021-12-22 14:27:57+00:00,1473661590687858688,"Looking for a fun, safe way to gather with loved ones this winter? New Hampshire has you covered!

From beautiful hikes to exciting ski hills, I encourage you to bundle up and get outdoors to explore all the Granite State has to offer! https://t.co/86FuJxdG1N",RepAnnieKuster
147,2021-12-21 21:03:20+00:00,1473398707576049669,"As more Granite Staters make the choice to get vaccinated &amp; boosted, @POTUS’s plan will help get more shots into arms to put this surge behind us faster. 

I welcome the steps POTUS announced today &amp; will continue working to deliver much-needed resources to our communities.",RepAnnieKuster
148,2021-12-21 21:02:32+00:00,1473398504882118665,"Today, @POTUS addressed the nation on the country’s COVID-19 response &amp; announced new measures to keep our communities safe:

1️⃣ More testing sites &amp; vaccine clinics
2️⃣ Deployment of clinical personnel to support hospitals 
3️⃣ 500 million at-home rapid tests for American families https://t.co/dWqLU14oKU",RepAnnieKuster
149,2021-12-21 16:51:02+00:00,1473335210464976897,"Congratulations to the seven Granite State students from Rundlett Middle School whose artwork is representing New Hampshire in the National Christmas Tree Display 🎄!
 
You’ve done your state proud!
https://t.co/qE73ZieUnw",RepAnnieKuster
150,2021-12-20 22:59:25+00:00,1473065529233522704,"To end the addiction epidemic, we must expand access to treatment &amp; reduce recidivism.

Today I was proud to help announce that NH’s Drug Court Program will receive more than $1.6M to connect rural communities to recovery services &amp; bolster existing tools.
https://t.co/HnPISP1vFK",RepAnnieKuster
151,2021-12-20 22:40:29+00:00,1473060766911799304,"Our service members &amp; their families sacrifice so much for our country—it’s important we honor their service, especially around the holidays.

My Holiday Cards for Heroes drive is an opportunity for students to learn about those who serve &amp; honor them with handmade holiday cards. https://t.co/9IPo1GwO68",RepAnnieKuster
152,2021-12-20 18:15:49+00:00,1472994160546353162,"Outdoor recreation &amp; skiing are cornerstones of NH’s economy &amp; way of life. 

I'm proud to lead the Bipartisan Ski &amp; Snowboard Caucus to help protect the winter season &amp; ensure local ski areas can continue to be economic engines for our rural communities.
https://t.co/o6NbLOWhuB",RepAnnieKuster
