,Datetime,Tweet Id,Text,Username
175,2021-12-09 17:53:27+00:00,1469002267487617026,"Great having @nprpolitics stop by this morning to check out our Happy Holi-maize display! 🌽🎄

Hey @RepPerlmutter, good luck winning second place! https://t.co/nVhA9oqp2m",RepCheri
176,2021-12-09 00:57:06+00:00,1468746494492692482,"Deere Olivia, 🚜 

It's a-maize-ing what a little tape and construction paper can do! 🌽🎄 https://t.co/4FBYJysNd4",RepCheri
177,2021-12-08 23:15:12+00:00,1468720847728922624,"I’m proud to vote for the Ocean Shipping Reform Act to bolster the Federal Maritime Commission, strengthen the overseas supply chain and ensure fairness in the global ocean shipping industry.",RepCheri
178,2021-12-08 23:14:00+00:00,1468720547026640898,"Thank you, President Biden. https://t.co/9m6RCj2ICF",RepCheri
179,2021-12-08 19:34:58+00:00,1468665423243665412,"Today I spoke on the House floor to recognize the heroism of Lieutenant Garrett Ramos of the Sterling Fire Department, who tragically lost his life fighting a house fire. I brought a red light to join the Sterling community in honoring his life.

My condolences to his loved ones. https://t.co/fIgv6pEZJn",RepCheri
180,2021-12-08 18:49:33+00:00,1468653996713914383,Last night I voted for the National Defense Authorization Act because the bicameral package will continue to support defense installations and manufacturers across NW &amp; Central Illinois.,RepCheri
181,2021-12-08 03:11:59+00:00,1468418049996955655,"Proud to vote for the NDAA — this critical defense package makes good on our commitments to boost pay for our service members, combat sexual assault in the military and invest in national defense programs.",RepCheri
182,2021-12-08 02:37:17+00:00,1468409315635744770,"Proud to vote to extend additional relief to Medicare providers, ensure farm support programs stay strong and lift up our working families.",RepCheri
183,2021-12-08 01:35:52+00:00,1468393861986852867,"@RepPerlmutter @RepJasonCrow @RepGallagher @RepMGS @RepConorLamb Sorry Ed, but first place for ""most on-brand"" has been taken. Have yourself an Agriculture Christmas! 🌽🎄 https://t.co/aStHpY496N",RepCheri
184,2021-12-07 22:04:39+00:00,1468340707895164930,Read my statement on the Renewable Volume Obligations released today by @EPA &amp; @WhiteHouse below: https://t.co/8o2vlxt1uQ,RepCheri
185,2021-12-07 19:25:01+00:00,1468300532750209039,"As a former journalist — the lessons here are critical for us all.

“The media talks about the “lack of civility” in politics. But when do Democrats post videos depicting violence against Republicans?”

https://t.co/dmf45HtuFq",RepCheri
186,2021-12-07 17:45:39+00:00,1468275528197103625,"🚨 It's health care open enrollment season, but the deadline is approaching! For health coverage that begins on Jan. 1st, you must enroll by Dec. 15th. Sign up today at https://t.co/9uxbJSMGv5. https://t.co/u1XmL24JeD",RepCheri
187,2021-12-07 13:18:01+00:00,1468208176294207488,"Eighty years ago, the course of our country's history was changed.

We honor the servicemembers who lost their lives at #PearlHarbor and continue to honor the millions of servicemembers from different walks of life who served our country in the days and years that followed. https://t.co/Iaq2OjLFHX",RepCheri
188,2021-12-07 00:27:09+00:00,1468014179902758917,"I spoke with ⁦⁦@USDA⁩ Under Secretary Torres Small today to explore how the bipartisan infrastructure law will help rural communities.

WATCH ⬇️! https://t.co/Eolw6qNLfS",RepCheri
189,2021-12-06 20:35:49+00:00,1467955964192210952,"My condolences are with the family of Sterling Fire Department Lieutenant Garrett Ramos who tragically lost his life on Friday while on duty. The Sterling community has lost a hero and my prayers are with his friends and loved ones as they mourn.

https://t.co/xtDJ2jCiLl",RepCheri
190,2021-12-06 19:48:37+00:00,1467944086564851715,"The bipartisan infrastructure law delivers $25 billion for airport improvement projects across the country.

Thank you to @FLYPIA for having me today to talk about how these investments can help modernize airports and improve safety right here in our community. #BuildBackBetter https://t.co/Kc7OU30IGp",RepCheri
191,2021-12-06 15:45:57+00:00,1467883015258918921,Join @USDA Undersecretary Xochitl Torres Small and me on FB live at 4 PM CST as we discuss what the bipartisan infrastructure law means for rural development. https://t.co/mvJXhwp0cj,RepCheri
192,2021-12-06 15:29:19+00:00,1467878829456826369,"Congratulations to Rockford-native @mlebear for being Grammy-nominated for co-creating Bridgerton the Musical.

Your talents have inspired many young girls Emily, keep being a trailblazer! ⭐️ https://t.co/E98wspfbaR",RepCheri
193,2021-12-05 14:43:10+00:00,1467504827542425611,"DID YOU KNOW: Democrats’ #BuildBackBetterAct includes a series of tax cuts &amp; cost protections that will have an outsized effect on working &amp; middle-income families with children.

From expanding the #ChildTaxCredit to reducing prescription drug prices — we are getting it done.",RepCheri
194,2021-12-04 15:53:44+00:00,1467160199018524672,"More than $33M in funds from the Rebuild Illinois capital program will revitalize our airports in NW &amp; Central Illinois.

This historic investment will help improve safety &amp; efficiency at our local airports while creating good-paying jobs in our communities. #BuildBackBetter https://t.co/MzFJWPgknI",RepCheri
195,2021-12-03 23:23:28+00:00,1466910990759604225,"Proud to join my colleagues on this congressional delegation trip to attend the Reagan National Defense Forum.

This forum brings leaders, key stakeholders and the defense community together to discuss how the US can continue to lead the world in national defense. 🇺🇸 https://t.co/VDft7I4dUV",RepCheri
196,2021-12-03 18:42:38+00:00,1466840315164299266,"On this day in 1818, Illinois became the 21st state of the United States of America. Since then, our great state has become a national leader in agriculture production, manufacturing jobs AND MORE!

Happy Birthday Illinois! 🎈 https://t.co/xLNrlPaxHE",RepCheri
197,2021-12-03 16:12:24+00:00,1466802506617528332,"Sorry, can't hear you over this 45...

🎶...I don't want a lot for Christmas...🎶 https://t.co/44ycGmHkwJ",RepCheri
198,2021-12-03 14:22:50+00:00,1466774934856912902,"Initial unemployment claims are now down MORE THAN 70% since @POTUS Biden took office.

America’s jobs recovery is strong as we #BuildBackBetter!",RepCheri
199,2021-12-02 22:35:32+00:00,1466536539383418884,BREAKING: The House just helped prevent a government shutdown by passing the Further Extending Government Funding Act with bipartisan support.,RepCheri
200,2021-12-02 19:16:07+00:00,1466486354158792705,"From reducing drug costs for our seniors to expanding health care coverage for families, the #BuildBackBetterAct will improve the health care system in NW &amp; Central Illinois.

Life-saving medication shouldn't be a financial burden. https://t.co/bK3wrAXmia",RepCheri
201,2021-12-02 15:55:37+00:00,1466435896996208640,"Investments in working families are critical to delivering economic growth at home.

That's why @HouseDemocrats passed the #BuildBackBetterAct to bring down costs, put more money in working families’ pockets and ensure big corporations pay their fair share.",RepCheri
202,2021-12-02 00:32:33+00:00,1466203599223017473,"Proud to have joined IL leaders this morning for the grand opening of the new I-74 bridge!

The I-74 bridge has provided an important east-west link in our nation's transportation network. This new bridge will improve transportation for families &amp; businesses across the Midwest! https://t.co/82qR1sfuqB",RepCheri
203,2021-12-01 22:45:20+00:00,1466176615944269834,"Today was an exciting day!

After more than 4 years of construction, the new I-74 bridge is now OPENED! With our new bridge, and the passage of the Infrastructure Investment &amp; Jobs Act, we will continue to #BuildBackBetter across NW &amp; Central Illinois!",RepCheri
204,2021-12-01 21:39:43+00:00,1466160105758597133,"Our airports are a critical part of the infrastructure equation.

A strong air transit system is necessary for a strong economy. Proud to be here with @GovPritzker to announce Rebuild Illinois funding coming to airports throughout the district I serve. https://t.co/B0vqMA4qAC",RepCheri
205,2021-11-30 13:45:21+00:00,1465678336362000387,"From debt relief to support for the future, the #BuildBackBetterAct delivers results to agricultural workers across NW &amp; Central Illinois.

Take a look at the ag investments ⬇️: https://t.co/yKtcY3ye3M",RepCheri
206,2021-11-29 21:43:29+00:00,1465436277923270656,"For many, insulin is a lifesaving drug. But for some, the high prices can mean skipping doses.
 
By capping insulin prices at $35 a MONTH, the #BuildBackBetterAct can help build a healthier America. https://t.co/3QFGA1JXiS",RepCheri
207,2021-11-29 00:09:05+00:00,1465110530956402694,"I’m saddened by the loss of Rockford native Virgil Abloh, a global trailblazer whose legacy will live on by those he touched and inspired.

My thoughts and prayers are with his family during this difficult time. https://t.co/EraQPaMgZY",RepCheri
208,2021-11-28 14:37:34+00:00,1464966702282780681,"Since January, we have:
 
Cut child poverty
Created more jobs
Decreased COVID cases
Strengthened our economy
Invested in our infrastructure
 
And we’re just getting started. @HouseDems are delivering results #ForThePeople. https://t.co/6Oz2g0WAbL",RepCheri
209,2021-11-27 16:01:19+00:00,1464625393596575748,"Hundreds of thousands of older Americans &amp; Americans with disabilities are on waiting lists for home care services or struggling to afford the care they need.

The #BuildBackBetterAct will permanently improve Medicaid coverage for home care services for seniors. https://t.co/Sstf98DoDK",RepCheri
210,2021-11-26 23:23:28+00:00,1464374273624129537,"The #BuildBackBetterAct includes nearly $40 billion in critical investments focused on combatting environmental emergencies and improving the resiliency of our infrastructure.

Take a look at some of the investments coming your way: https://t.co/RgLo1Tc6e6",RepCheri
211,2021-11-26 17:27:54+00:00,1464284794175561731,"The #BuildBackBetterAct will make a generational investment in small businesses, giving them support to recover from COVID and thrive in the future. This includes investments in:

— Small business lending
— Entrepreneurial development
— Capital access for underserved businesses",RepCheri
212,2021-11-25 16:11:54+00:00,1463903278937346050,"I want to wish a #HappyThanksgiving to all who are celebrating this year.

May this year’s gathering be filled with many blessings, gratitude and laughter. https://t.co/hy4FnhCqJi",RepCheri
213,2021-11-24 23:01:45+00:00,1463644033717256200,"Let’s protect our communities this holiday season by getting vaccinated! 💉

To find a vaccine center near you, please visit https://t.co/nNUzvNz7y4",RepCheri
214,2021-11-24 17:17:51+00:00,1463557487777488900,"The Infrastructure Investment &amp; Jobs Act provides nearly $2B in additional funding to @USDA’s ReConnect program. 

This means $1.15B in loans &amp; grants are available to access high-speed internet in rural areas. To learn more about the application visit https://t.co/dscraiLrfh! https://t.co/xld4vxoj4c",RepCheri
215,2021-11-24 14:02:11+00:00,1463508249383219200,"Bob reflects the best of America by raising funds to feed about 3,000 Illinoisans each year at the SouthPark Mall in Moline.

Thank you for what you do for our community Mr. Thanksgiving. 🦃

https://t.co/1161VDUnDI",RepCheri
216,2021-11-23 21:48:19+00:00,1463263165249212416,"What’s in the #BuildBackBetterAct?

Let’s take a look 👀⬇️! https://t.co/revHIIGejC",RepCheri
217,2021-11-23 17:08:11+00:00,1463192668582944777,"🌱 960M to invest in biofuels infrastructure

💼 1B to support rural revitalization 

🧑‍🌾 12B for economically distressed farmers &amp; producers

The #BuildBackBetterAct will help us take on the issues impacting our farmers &amp; expand our ag markets.

https://t.co/M3E7JvIGmA",RepCheri
218,2021-11-23 13:16:16+00:00,1463134306147221504,"133,000 children in NW &amp; Central Illinois benefitted from expanded Child Tax Credit payments this month.

From covering food and rent expenses to child care costs, these investments put money back in the pockets of low- and middle-income Illinois families.",RepCheri
219,2021-11-22 22:00:54+00:00,1462903944183787522,"“Internal disputes rarely come to light, employees allege, and lawsuits are uncommon because Tesla requires many workers to sign mandatory arbitration agreements.”

The fine print in a contract shouldn't tell survivors how or if they can seek justice. @elonmusk, it’s time to: https://t.co/Uv6JngyKp5",RepCheri
220,2021-11-22 15:37:12+00:00,1462807382237589504,".@Tesla is pushing the boundaries of modern technology... So why is it pushing outdated arbitration clauses on employees who've been harassed and abused?

@elonmusk, its time to #EndForcedArbitration.",RepCheri
221,2021-11-22 14:21:25+00:00,1462788310884143108,"The #BuildBackBetterAct will invest $5 BILLION in the VA’s workforce and provide much-needed support for our veterans.

From creating more jobs in VA facilities to improving access to health care — this bill will lift our veterans up across NW &amp; Central Illinois. https://t.co/LCPl93AI3y",RepCheri
222,2021-11-21 18:00:10+00:00,1462480975619936258,"The high cost of child care is straining family budgets &amp; pushing many out of the workforce.

The #BuildBackBetterAct will make historic investments to lower the cost of child care for working families and help prepare up to 6M children for a successful start to school. https://t.co/oLCLYPGe8B",RepCheri
223,2021-11-21 14:02:05+00:00,1462421057567141892,"Physical assault, rating colleagues' attractiveness, preying on women ""like a piece of meat""...
 
What's happening at @Tesla sounds like a bad episode of Mad Men.
 
@elonmusk — let your employees speak up. Let's #EndForcedArbitration. https://t.co/i1MbCmgv8U",RepCheri
224,2021-11-20 20:36:32+00:00,1462157937238069257,"Nearly 60M Americans are subjected to forced arbitration clauses that rob them from seeking justice in the courtroom.

That’s why I’m proud that @HouseJudiciary passed my bill to #EndForcedArbitration. https://t.co/TnxSNCdyNu",RepCheri
225,2021-11-20 14:40:22+00:00,1462068305783660552,"This week, @POTUS Biden signed into law the Infrastructure Investment &amp; Jobs Act and the House passed the #BuildBackBetterAct.

Proud to continue delivering results and supporting historic investments #ForThePeople alongside my friend @RepKClark. https://t.co/e8Mr6ukayl",RepCheri
226,2021-11-19 16:41:56+00:00,1461736512362582016,"The #BuildBackBetterAct includes critical investments in agriculture for NW &amp; Central Illinois.

From improving the quality of life in our rural communities to committing millions of dollars to agricultural education, this bill will invest in our farmers. 🌾 https://t.co/5GZGMcOp66",RepCheri
227,2021-11-19 14:47:40+00:00,1461707755392274436,"🏡 Housing affordability
🧸 Universal &amp; free preschool
🏥 Medicaid coverage
📚 Pell grant increases
💰 Child Tax Credit expansion
🍎 Nutrition security

I’m proud to have voted for the transformational #BuildBackBetterAct, with more investments are coming to Illinois. https://t.co/ukfHYa3pIO",RepCheri
228,2021-11-19 14:41:48+00:00,1461706276962979852,BREAKING: The Build Back Better Act has passed the House and is heading to the Senate. I was proud to vote for this bill with a framework that will lift working families across the country.,RepCheri
229,2021-11-19 03:39:40+00:00,1461539646328954882,It's time to vote to #BuildBackBetter.,RepCheri
230,2021-11-18 16:20:29+00:00,1461368726280978439,Me every week on @HouseAgDems... https://t.co/PmAxL7zsUe,RepCheri
231,2021-11-18 03:06:01+00:00,1461168789714870272,"John Deere is part of the very fabric of the Quad Cities, and the @UAW workers that make up this company are an integral part of their success and identity.

Great news tonight that UAW ratified their contract with @JohnDeere — glad both parties were able to reach an agreement. https://t.co/H5qjRjtWgq",RepCheri
232,2021-11-17 23:17:47+00:00,1461111355700875268,"We did it!

All thanks to brave survivors like @GretchenCarlson, @HouseJudiciary just passed the Ending Forced Arbitration of Sexual Assault &amp; Sexual Harassment Act. This bill will lift the voices of survivors across the country.

Next stop, the House floor. https://t.co/ckXxRKaDBw",RepCheri
233,2021-11-17 20:53:22+00:00,1461075010487996418,"Hidden fine print shouldn’t determine whether a sexual abuse survivor is allowed to tell their story.

We must come together and #EndForcedArbitration. https://t.co/4js9gzpktp",RepCheri
234,2021-11-17 18:43:37+00:00,1461042359249121293,"Forced arbitration clauses are the still-silenced part of the #MeToo movement, denying people their day in court. But the Ending Forced Arbitration of Sexual Assault &amp; Sexual Harassment Act would change that.

Let’s work together to #EndForcedArbitration. https://t.co/zbzk2WpntT",RepCheri
235,2021-11-17 16:39:17+00:00,1461011067958669319,".@RepJayapal ""I am so proud to co-lead this bipartisan, bicameral bill with my fantastic colleague, Congresswoman Cheri Bustos, as well as @RepCicilline and @RepMGriffith which preserves the right for sexual assault and harassment survivors to choose how they seek justice..."" https://t.co/IYXnZstGvZ https://t.co/rnnAIHhprR",RepCheri
236,2021-11-17 15:43:09+00:00,1460996940125069317,"It’s time — today, I’m with @GretchenCarlson at @HouseJudiciary to support advancing the Ending Forced Arbitration Sexual Assault &amp; Sexual Harassment Act to the House floor.

Let’s lift the voices of our survivors. Tune in to watch at: https://t.co/4JvbDEeajB! 📺 https://t.co/cN99SaFphV",RepCheri
237,2021-11-17 15:11:37+00:00,1460989006959812613,"Here with my friend @GretchenCarlson for the @HouseJudiciary markup of my bill — the Ending Forced Arbitration Sexual Assault &amp; Sexual Harassment Act. 

It’s time we #EndForcedArbitration and give all survivors their day in court. ⚖️ https://t.co/NlQahQPAHS",RepCheri
238,2021-11-17 01:02:03+00:00,1460775207149441024,"Great to catch up with @RepSchneider &amp; @GovPritzker at yesterday’s signing ceremony.

The Infrastructure Investment &amp; Jobs Act will help modernize and repair Illinois' highways, roads, bridges, waterways AND MORE! Proud to #BuildBackBetter with my colleagues. https://t.co/XbgG0RNDXJ",RepCheri
239,2021-11-16 22:07:42+00:00,1460731330573049866,"@MattHill46 @RepSchneider @POTUS Matt — so happy to see a former Bustos intern at the @WhiteHouse communications shop working #ForThePeople!

Keep up the good work as we #BuildBackBetter, Team Bustos is proud of you!",RepCheri
240,2021-11-16 18:24:03+00:00,1460675044644900867,"The bipartisan Infrastructure Investment &amp; Jobs Act is a blue print to rebuild rural communities across Illinois.

From repairing our highways to expanding broadband, take a look at the investments coming to Illinois ⬇️! https://t.co/aNgw98HAJC",RepCheri
241,2021-11-16 00:01:55+00:00,1460397684632739840,"The Infrastructure Investment &amp; Jobs Act = historic investments in Illinois.

Take a look at the help coming our way ⬇️! #BuildBackBetter https://t.co/g22dWFN9OT",RepCheri
242,2021-11-15 21:59:51+00:00,1460366965596475393,"The historic Infrastructure Investment &amp; Jobs Act will make life better for millions of Illinois residents.

From creating a generation of good-paying union jobs to repairing and rebuilding our roads and bridges &amp; more — today we deliver results for the American people. https://t.co/Z4My9DWTrv",RepCheri
243,2021-11-15 19:04:45+00:00,1460322901702451205,"On the way to the @WhiteHouse to attend @POTUS Biden’s signing ceremony for the Infrastructure Investment &amp; Jobs Act.

From road improvements to expanding broadband &amp; MORE — this bill will pump at least $17B into projects across Illinois and help our nation #BuildBackBetter. https://t.co/8v0sFGxJzX",RepCheri
244,2021-11-15 15:42:49+00:00,1460272079845089281,"This weekend I was inducted into the Springfield High School Hall of Fame.
 
I never imagined I'd join so many other incredible alumni on this list. Serving Illinois has been my pleasure and receiving this award has been my honor. Thank you, Springfield High! https://t.co/9WJyvFXIMv",RepCheri
245,2021-11-15 01:00:03+00:00,1460049925962612741,"Last Friday, we passed historic investments for the American people. Now, I’m ready to head back to Washington, DC and support the #BuildBackBetterAct. Why? ⬇️
 
🧸 Child care
📚 Early education
💉 Health care
📉 Lower taxes
🌱 Climate impact",RepCheri
246,2021-11-14 22:49:50+00:00,1460017154846343169,"“I believe when we pass this Build Back Better Act, and I see it as a Jobs Act...every single cent will be paid for. I think this is the path to a better to bring down that inflation and a better economy.” https://t.co/vaSk7kPaqy",RepCheri
247,2021-11-14 17:00:06+00:00,1459929144272302081,Tune in to @FoxNews at 12 PM CT as I discuss the bipartisan infrastructure package &amp; the #BuildBackBetterAct with @MikeEmanuelFox. 📺,RepCheri
248,2021-11-14 15:29:19+00:00,1459906294673031169,"In just 10 months, @POTUS Biden has ushered in an unprecedented era of recovery and growth #ForThePeople.

How will the Infrastructure Investment &amp; Jobs Act rebuild our nation’s badly deteriorated roads and bridges and MORE? Well, look ⬇️! https://t.co/CqUEeJ4asw",RepCheri
249,2021-11-13 15:16:55+00:00,1459540788694720513,"The Infrastructure Investment &amp; Jobs Act will create millions of good-paying jobs across NW &amp; Central Illinois, including in construction.

Proud to have attended the Highway Construction Careers Training Program graduation &amp; show support to those joining the workforce. 🚧 https://t.co/798rmnImpe",RepCheri
250,2021-11-12 17:46:32+00:00,1459216051355410442,"Our office is looking to hire interns for the Spring 2022 semester.

If you are interested in gaining experience in Congress, we encourage you to apply at https://t.co/oQ8EFIWbCj. For any questions, contact our DC office at (202) 225-5905. ☎️ https://t.co/oBqKLzFosJ",RepCheri
