,Datetime,Tweet Id,Text,Username
84,2022-01-20 16:27:57+00:00,1484201037993062404,"When Veterans leave military service, re-adjusting to civilian life can be challenging. Enrolling in @DeptVetAffairs services they've earned shouldn't be another barrier.

I support @RepMarkTakano’s EVEST Act, bc we should make it easier for our Vets to get what they need. https://t.co/VJ0QjZmKo2",RepCheri
85,2022-01-20 14:12:19+00:00,1484166905371967491,"Congratulations to @RepKinzinger &amp; Sophia on the birth of your son Christian. As a mom and a grandma, there is no greater joy than a new baby! https://t.co/hfhUGtMZfk",RepCheri
86,2022-01-20 00:51:55+00:00,1483965480595558405,"Thanks to the bipartisan infrastructure law, the Mississippi River’s locks and dams will see an $829 MILLION investment! 

That's good news for our economy, jobs, trade, climate and American farmers! #RiversMoveAmerica https://t.co/oj3tSQfQWo",RepCheri
87,2022-01-19 21:50:50+00:00,1483919909008650241,"Tune in SOON! 

https://t.co/tHh4EtQTQt https://t.co/i5rtieTvY7",RepCheri
88,2022-01-19 21:34:23+00:00,1483915765715816453,"In his first year in office, @POTUS Biden has:

— created 6 million jobs
— expanded access to health care
— reduced hunger by 32%
— cut child poverty by half
— invested the most funding to rebuild and strengthen our infrastructure AND MUCH MORE!

#BuildBackBetter",RepCheri
89,2022-01-19 17:46:21+00:00,1483858380758343687,"Tune in TODAY at 4:00 PM CST for a LIVE chat about waterways infrastructure with Tracy Zea, President &amp; CEO of the @WaterwaysCouncil ⬇️ ! 

https://t.co/tHh4EtQTQt https://t.co/eZ1jUppGoN",RepCheri
90,2022-01-19 16:31:36+00:00,1483839569279733764,This morning I joined @RaquelMartinTV from @NXSTMediaGroup to talk voting rights and all @POTUS Biden has accomplished in his first year in office. 📺 https://t.co/ZSg3YdheNQ,RepCheri
91,2022-01-19 00:12:09+00:00,1483593084654993408,"🚨 NEWS: @USPS is now delivering up to four FREE COVID-19 tests to your home with the link below ⬇️ !

https://t.co/JYxvwQOYHJ",RepCheri
92,2022-01-18 21:07:05+00:00,1483546508410691591,"📁 STARTING JANUARY 24 📁

The 2022 tax filing season is almost here! The filing deadline is April 18, which means Americans will have more time to file this year.

See the link below for more details:
https://t.co/GTL2pNm9g6 https://t.co/ZoTxZiGCuZ",RepCheri
93,2022-01-18 00:41:41+00:00,1483238127619690496,"The Wolf Moon over the Mississippi River from my front porch in Moline.

My last night at home for a week before heading back to Washington. https://t.co/rlgRodo7md",RepCheri
94,2022-01-17 14:01:03+00:00,1483076905196834826,"As we fight to preserve our democracy, the lessons he taught us are more important than ever.

We all have a part to play in advancing Dr. King’s vision -- keep up the good fight and Happy MLK Day!",RepCheri
95,2022-01-17 14:00:02+00:00,1483076651890135044,"Today, we honor Dr. Martin Luther King Jr.’s life, legacy and leadership.

A man who committed himself fully to working against all forms of racism in our country, his teachings continue to guide us. https://t.co/ivw1rLDaPh",RepCheri
96,2022-01-16 15:03:26+00:00,1482730219291226113,"Thanks to the Bipartisan Infrastructure Law, Illinois will receive $1.4B over the next five years to upgrade our bridges, which will:

👷‍♂️Create jobs
🌉Connect communities
🌐Increase global competitiveness
📈Bring Illinois into the 21st century

Together, we will #BuildBackBetter.",RepCheri
97,2022-01-15 16:11:16+00:00,1482384902746165254,"The Omicron variant is still spreading, so keep yourself and your family healthy by getting tested and vaccinated.💉

Starting January 19th, every U.S. household will have the opportunity to order four FREE at-home COVID-19 tests by using the link below: https://t.co/VX4MHssV0H",RepCheri
98,2022-01-14 22:29:57+00:00,1482117810671300611,"We owe our veterans a great deal of gratitude, which is why I’m excited to launch our 9th annual Valentines for Veterans.

I encourage everyone to join me in thanking our local veterans for their service, by sending a card to any of the addresses below! https://t.co/nQkFXSeczt",RepCheri
99,2022-01-14 19:44:56+00:00,1482076282686951427,"The #ChildTaxCredit is a lifeline for the middle class and has helped lift HALF of children out of poverty while also fighting inflation.

It’s time to pass #BuildBackBetter and put money back in the pockets of working families.",RepCheri
100,2022-01-14 18:17:11+00:00,1482054200225939458,"Having reliable, affordable health insurance is more important than ever during the COVID19 pandemic.

Visit https://t.co/lgS4ZUOCGG to #GetCovered before the deadline ends TOMORROW, Jan. 15th.",RepCheri
101,2022-01-14 15:06:13+00:00,1482006144973430784,"I’m thrilled to join my Illinois colleagues today to announce that our state will receive a historic $1.4B to repair bridges &amp; improve driving conditions.

With 2,374 of our bridges in poor condition, these funds will make a huge difference for folks across IL! #BuildBackBetter https://t.co/Kd7fEsJRXK",RepCheri
102,2022-01-13 17:17:54+00:00,1481676896446578688,"Proud to have voted for the John R. Lewis Voting Rights Advancement Act &amp; Freedom to Vote Act — because our democracy depends on it.

The right to vote is at the heart of what makes America great.",RepCheri
103,2022-01-12 14:49:15+00:00,1481277098526396416,"Additive manufacturing has the potential to revolutionize our supply chain.

Proud of the innovative work being done at the @Arsenal_Island on the next generation combat vehicle!

https://t.co/aP6urT89vz",RepCheri
104,2022-01-11 23:39:35+00:00,1481048173040881666,"🚨 NEWS: Last year Congress passed the Bipartisan Infrastructure Law, which included a program to help families struggling to afford internet service.

I was proud to support it, and encourage residents to find out if you qualify: https://t.co/2XQEkXOupO",RepCheri
105,2022-01-11 19:48:09+00:00,1480989930549653505,"On #January6th, the brave women &amp; men of the @CapitolPolice defended our democracy.

To honor their hard work and ensure such an attack never happens again, @HouseDemocrats are ready to equip Capitol Police with what they need to keep our nation and democracy safe. https://t.co/NjJP3bd3zU",RepCheri
106,2022-01-11 17:14:57+00:00,1480951374326153219,"There are 71,000 families I serve who won’t see the Child Tax Credit deposited in their bank accounts this month.

That’s why reinstating the Child Tax Credit is on the top of my list in my final year in Congress. https://t.co/dSLnpnituA",RepCheri
107,2022-01-11 00:09:22+00:00,1480693278076977158,"Being a mentor has been one of the most valuable experiences in my life.

That’s why I proudly support National #MentoringMonth, because mentoring amplifies positive youth development and transforms the change-makers of tomorrow. https://t.co/Zw0VRA39Dp",RepCheri
108,2022-01-10 22:34:06+00:00,1480669306832756752,"Back in Washington to kick of the second session of the 117th — my last year in Congress.

Let’s get to work! https://t.co/8qzLz4xsb1",RepCheri
109,2022-01-09 15:51:47+00:00,1480205672973221895,"🚨 In his first year, @POTUS Biden has added 6.4 MILLION jobs to our economy.

We have a lot of work ahead as we #BuildBackBetter, but this is a remarkable achievement on the road to recovery!",RepCheri
110,2022-01-08 14:41:47+00:00,1479825666321391624,"This is incredible news!

@POTUS Biden’s economic plan is strengthening our economy and getting Americans back to work. https://t.co/lHKV3U5vmT",RepCheri
111,2022-01-07 23:55:40+00:00,1479602668402315265,"Our local media tour has been a great success — highlighting our accomplishments from 2021, like the infrastructure law. Looking forward to the work ahead in 2022!

A big thank you to @25NewsWEEK, @shawlocalnews, @WMBDNews, @pjstar, @GeneseoRepublic, Big Radio &amp; WKEI Radio. https://t.co/U6nCpN6OfG",RepCheri
112,2022-01-07 21:50:08+00:00,1479571076170625026,"Officer Brian Sicknick is a hero — and our nation is better because of his service.

My heart is with his loved ones and the @CapitolPolice community today. https://t.co/18dq4GjGtA",RepCheri
113,2022-01-07 15:56:11+00:00,1479482003884056581,ICYMI: I spoke with @LACaldwellDC to talk about Jan. 6th and it’s continued impact on Congress. https://t.co/4ySBr2uK8z,RepCheri
114,2022-01-07 00:33:10+00:00,1479249719297777665,"Today I joined the Sterling community to open a brand-new VA Outpatient Clinic!

This new clinic will expand and improve services offered to our local Veterans &amp; I'm so grateful to everyone who helped make this amazing facility a reality. #BuildBackBetter https://t.co/6za7xmWbxj",RepCheri
115,2022-01-06 23:37:47+00:00,1479235781298475009,"One thing is clear about Jan 6 — this was a moment in our history that will always serve as a stark reminder that democracy is never a guarantee.

Read my op-Ed on @thehill ⬇️:

https://t.co/BTDIHcEBBy",RepCheri
116,2022-01-06 22:43:20+00:00,1479222078171668489,"How does wearing a mask help protect you against #COVID19?

Check out this @WSJ graphic to help you navigate what you need as Omicron spreads.

Please continue to mask up &amp; get vaccinated! 💉 https://t.co/ocTDqafrJa",RepCheri
117,2022-01-06 18:59:25+00:00,1479165725185093637,"This will help corn farmers improve water quality and reduce costs by supporting the “split application” of nitrogen — benefiting our environment. 🌽 

To learn more about PACE, visit https://t.co/78fih8BNqQ!",RepCheri
118,2022-01-06 18:58:49+00:00,1479165576832499712,"🧵 As Chair of the General Farm Commodities &amp; Risk Management Subcommittee, I’m excited to see all 14 counties in NW &amp; Central Illinois are eligible for @usdaRMA’s new Post Application Coverage Endorsement.",RepCheri
119,2022-01-06 16:32:36+00:00,1479128780585283588,"This moment in our history will continue to serve as a stark reminder that democracy is never a guarantee.

It’s fragile, and it's up to all of us to treasure and protect it.

At the end of that long, dark night, democracy prevailed. Let's make sure it never fails.",RepCheri
120,2022-01-06 16:32:06+00:00,1479128652394778627,The Capitol was stormed and our democracy — the foundation of America — was threatened.,RepCheri
121,2022-01-06 16:31:43+00:00,1479128557829996545,"“Get your gas masks out.”

That’s what I heard as an angry mob crashed through the House Floor’s glass windows.

It was Jan 6 and I was at the Capitol working to certify the 2020 election results — my constitutional duty. The violence forced us to pause our work.",RepCheri
122,2022-01-05 19:54:06+00:00,1478817098780577810,"""This is what we do: We stay and report.""
 
Journalists document our history and those at the Capitol on January 6th risked their lives to do so. I was proud to thank them &amp; all our news staff with a resolution recognizing their bravery and service to the truth that day. https://t.co/syyekVx1tJ",RepCheri
123,2022-01-05 17:16:35+00:00,1478777461076856832,"Nothing is more important to our nation than protecting our democracy, so every American can have their voice heard.

Today I spoke with @RockIslandHigh2 students about my experience on January 6th &amp; the importance of civic engagement in preserving our democratic institutions. https://t.co/jYFpv67re7",RepCheri
124,2022-01-05 13:55:51+00:00,1478726945928097800,"With a spike in COVID cases across the country, testing sites &amp; hospitals in our community are overwhelmed.

Please play your part in protecting your community by getting vaccinated TODAY. 💉 https://t.co/rfnpeXPkeP",RepCheri
125,2022-01-05 00:29:14+00:00,1478523952989356034,"🚘 Today we traveled to the Quad-Cities, Aledo, Monmouth &amp; Galesburg for day two of our semi-annual media tour. 

Thank you @qctimes, @wrmj, @WGILNews &amp; WRAM Radio for meeting with me today, looking forward to driving results for our communities in 2022! https://t.co/OgMtE8JTrZ",RepCheri
126,2022-01-04 22:15:41+00:00,1478490344757116939,"Heartbroken to learn about this shooting today. My prayers are with the victims, their loved ones and the entire Rockford community. As we wait for further details, I want to thank our first responders and law enforcement who acted swiftly. https://t.co/ifD9ackydf",RepCheri
127,2022-01-04 21:45:34+00:00,1478482762130669569,"ICYMI: In the first year of @POTUS Biden’s presidency, we added 6 MILLION jobs and unemployment claims are at a 50-year low.

We still have a lot of work ahead for a full economic recovery, but we're on the right track. https://t.co/hAnjsEAkcE",RepCheri
128,2022-01-04 02:33:38+00:00,1478192869232062465,"And this is just the beginning! 

Looking forward to a 2022 full of infrastructure projects and jobs right here in NW &amp; Central Illinois. https://t.co/0M9Bpog6iN",RepCheri
129,2022-01-03 22:21:43+00:00,1478129475112120321,"Today I kicked off my semi-annual local media tour in NW &amp; Central Illinois to highlight what we accomplished together in 2021 and what I hope to achieve this year.

I may be entering my final year in office, but my foot is on the gas pedal as I keep driving results! https://t.co/rJfWUVxdwg",RepCheri
130,2022-01-01 16:17:56+00:00,1477313147358879746,"Congratulations to Rockridge High School grad Max Schultz, who will lead the Marching Utes in today's Rose Bowl Parade. 

You can learn more about his story ⬇️! 

https://t.co/GzsUHn6SBT.",RepCheri
131,2022-01-01 00:10:28+00:00,1477069679554408457,"This year was filled with challenges, but we also achieved successes along the way — like expanding the child tax credit, strengthening the economy &amp; beginning to rebuild our infrastructure.

May 2022 bring good health and many more successes for our nation. Happy New Year!",RepCheri
132,2021-12-31 21:22:54+00:00,1477027507501211659,Thank you for being a friend. https://t.co/nkddPsZdRp,RepCheri
133,2021-12-30 14:10:00+00:00,1476556178540933127,"From being awarded the Democracy Award for Constituent Services to recovering more than $253,500 on behalf of constituents — we accomplished many goals this year.

I’ll continue to lift the stories of NW &amp; Central Illinoisans this new year and #BuildBackBetter. https://t.co/Nas4nJpnbO",RepCheri
134,2021-12-29 17:25:14+00:00,1476242922349764609,Take a look at what we accomplished this year ⬇️: https://t.co/DKVfEj1Lle,RepCheri
135,2021-12-29 01:30:05+00:00,1476002549127954444,"Senator Harry Reid was a trailblazer, a leader and above all, a true public servant. It was an honor to serve in Congress with him.

My prayers and condolences to his family, may his legacy live on. https://t.co/5yOaVfjEps",RepCheri
136,2021-12-28 16:12:51+00:00,1475862319347425291,"This year, I submitted 47 constituent stories to the Congressional Record to highlight the hard work and accomplishments of our stars in NW &amp; Central Illinois. 

Their stories will forever be part of this historic record so that future generations can enjoy them. https://t.co/sEGZAkSO5L",RepCheri
137,2021-12-27 16:37:10+00:00,1475506048970772492,"The district I serve has 14 counties and each year, I travel thousands of miles to hear the stories of my constituents. 

This year, my team and I traveled 7,500 miles visiting our communities! https://t.co/5ykzoe61wv",RepCheri
138,2021-12-27 03:33:29+00:00,1475308829575462915,"Unemployment is the lowest in a generation. Wages are going up. 

While we have a lot of work ahead of us for a full economic recovery, @POTUS has us on the right track. https://t.co/D8iVRws79K",RepCheri
139,2021-12-26 19:35:00+00:00,1475188416509886465,"Each year, I have the privilege of nominating rising stars from our communities to our nation’s service academies. 

This year, I nominated five young Illinoisans to pursue their education at these hallowed institutions and become the leaders of tomorrow. https://t.co/2nAvQpPxbv",RepCheri
140,2021-12-26 18:06:51+00:00,1475166229967036429,"TUNE IN: I'm joining @AlexWitt on @MSNBC to talk about voting rights, student loans and our agenda in Congress for 2021. 📺",RepCheri
141,2021-12-25 19:43:32+00:00,1474828174076878860,"My office recovered $253,590.34 this year that constituents were owed from federal agencies like the IRS, SSA and the VA. 

I’m proud to make sure the people I serve receive what’s owed to them! https://t.co/HLc2FlupCv",RepCheri
142,2021-12-25 15:25:50+00:00,1474763320930582528,"Merry Christmas 🎄 and #HappyHolidays.
 
May your celebration be cheerful. https://t.co/AuUwTxbl8y",RepCheri
143,2021-12-24 21:41:07+00:00,1474495377944551425,"Yesterday our region had the most new COVID-19 cases since the start of the pandemic.

This holiday season, give the gift of keeping your loved ones safe. Get vaxed &amp; mask up.",RepCheri
144,2021-12-24 18:06:02+00:00,1474441251168694277,"Heartbroken to learn of @IBEW member Scott Adams' passing following an accident on the job. My condolences to his family, loved ones and IBEW during this time.",RepCheri
145,2021-12-24 14:42:49+00:00,1474390109831237632,"This year, my team closed 403 constituent cases &amp; I was ranked the top Democrat in Congress for constituent services.

Every morning, my staff &amp; I show up to work motivated by the belief that government should work for the people — it is an honor to be recognized for that work. https://t.co/zUbDW10eoY",RepCheri
146,2021-12-23 15:11:28+00:00,1474034929746989068,"As @HouseAgDems Subcommittee Chair on General Farm Commodities &amp; Risk Management, I chaired five events this year. 

Subcommittee hearings and roundtables are essential to help create the framework for the next farm bill and help lift up our farmers and rural communities. https://t.co/VaFE1n2GZu",RepCheri
147,2021-12-22 14:01:32+00:00,1473654943798206467,"Eighteen – that’s the amount of bills I introduced this year! Some highlights:

— A bill to end forced arbitration and lift up survivors
— A bill to boost our use of corn ethanol &amp; drive down carbon emissions
— A bill to address the social factors that impact our overall health https://t.co/W2xSU9Rod8",RepCheri
148,2021-12-21 23:12:00+00:00,1473431083719004173,"“Chicago Rockford International Airport’s expansion over the years is not only creating jobs, but it’s having one of the biggest economic impacts in the state.” ✈️ 

Our economy is getting back on track. #BuildBackBetter

https://t.co/QI4wktDvz1",RepCheri
149,2021-12-21 14:17:53+00:00,1473296670750294021,"From doing Cheri on Shifts at local businesses to hosting @SecVilsack to announce historic investments in our communities — I attended 215 district events this year.
 
Hearing directly from businesses and families is one of the most important parts of my job. https://t.co/FtrnRMlkzt",RepCheri
150,2021-12-20 18:16:23+00:00,1472994301336563719,"I'm joining @GarrettHaake on @MSNBC in just a few minutes! 

Tune in 📺",RepCheri
151,2021-12-20 14:00:10+00:00,1472929825618857989,"Whether it was through phone or email — we connected with our constituents 26,651 times this year.
 
These contacts are important because they help me understand the priorities of the people I serve &amp; what our communities need, such as help with Social Security or the VA. https://t.co/vkYUBGswCZ",RepCheri
152,2021-12-19 21:37:53+00:00,1472682623654940675,We must move the #BuildBackBetterAct forward. My statement ⤵️: https://t.co/shvJiJjCWC,RepCheri
153,2021-12-19 20:46:24+00:00,1472669667391062018,Tune in TOMORROW at 8AM CST as I talk with my friend Lonnie about how the bipartisan infrastructure law supports our workforce! https://t.co/U0CkvNnXvU https://t.co/Fis4S6jOKS,RepCheri
154,2021-12-18 19:19:39+00:00,1472285447971905538,Tune in this Monday to https://t.co/U0CkvNnXvU for a chat with @IBEW President Lonnie Stephenson on what the bipartisan infrastructure law means for jobs &amp; workforce development! https://t.co/yrHxriUdDO,RepCheri
155,2021-12-18 14:44:12+00:00,1472216131842854915,"Congratulations to my good friend Betsy Dirksen Londrigan &amp; to Scott Halpin for being appointed by @POTUS Biden to serve in key regional leadership roles at @USDA.

Two incredible leaders to lift our ag workers and producers here in Illinois. 🌽 

https://t.co/z6GLXkshAd",RepCheri
156,2021-12-17 23:12:19+00:00,1471981615266082817,"Today, we invested in Peoria’s future by welcoming OSF’s new building which will house more than 500 of our community members. 🏥 

Grateful for OSF's commitment to Peoria! I look forward to continuing work with them to improve health outcomes in our communities. https://t.co/XXyZAj3UnP",RepCheri
157,2021-12-17 22:13:35+00:00,1471966834379444228,"How does @POTUS Biden’s #BuildBackBetterAct impact families across NW &amp; Central Illinois? Here’s how ⬇️:

🌞 Ensures our children have a healthy planet to learn and play in
⚡️ Lowers energy bills for families &amp;
👷 Creates clean energy jobs for workers",RepCheri
158,2021-12-16 22:05:55+00:00,1471602514768367616,"NEWS: I’m joining my @NewDemCoalition colleagues in calling for the U.S. Innovation and Competition Act to:

— Secure Our Supply Chains 
— Create Jobs and Spur Innovation 
— Invest in Scientific Research &amp;
— Strengthen American Global Leadership",RepCheri
159,2021-12-16 19:26:48+00:00,1471562471580311553,"Thirteen service members were killed on duty during the Afghanistan evacuation.

Today, @POTUS Biden signed into law a bill that will award them all a Congressional Gold Medal. Proud to have voted for this, I’m keeping their families close to my heart. https://t.co/giOhP4Tvr0",RepCheri
160,2021-12-16 01:33:16+00:00,1471292311451713542,"I spy my office… 👀🌽

Regardless of tonight’s results, I’m proud that our Christmas display highlights the very best of NW &amp; Central Illinois. https://t.co/lpGN36UarU",RepCheri
161,2021-12-15 22:23:29+00:00,1471244549154562059,"Congratulations to Knoxville, IL native Todd Gorman and @sandburgesports on bringing home their school's FIRST national title. What an accomplishment! https://t.co/9BN8FGhA4n",RepCheri
162,2021-12-15 17:13:36+00:00,1471166564951076871,"Lower energy bills mean more $$$ in families' pockets.

The #BuildBackBetter Act offers clean energy solutions to make utility bills cheaper, create millions of good-paying American jobs and protect future generations. https://t.co/Bq0fXVU51J",RepCheri
163,2021-12-15 04:35:38+00:00,1470975813495447552,"Standing up for those who experience discrimination and oppression is our duty -- regardless of who you are, where you come from or how you worship.
 
I was proud to vote tonight to help make fighting Islamophobia a priority in our foreign policy.",RepCheri
164,2021-12-15 03:14:52+00:00,1470955488795934721,"As of today, 800,000 Americans have died from COVID-19. That's more than the number of people who live in the congressional district I serve.
 
This evening, I joined colleagues for a moment of silence honoring each of the friends, neighbors &amp; loved ones lost to this pandemic. https://t.co/MzsNJPMnOT",RepCheri
165,2021-12-14 23:24:11+00:00,1470897438194032643,"Here's what the #BuildBackBetterAct could mean for YOU:
 
#ChildTaxCredit expansion = more 💰 in your pockets

Pre-school for all 3- and 4-year olds = better education for your kids 📚 

Resources for child care providers = cheaper, more accessible care for your family 🧸",RepCheri
166,2021-12-13 21:48:29+00:00,1470510966202896385,"Happy Birthday to my long-time friend @SecVilsack! 🍰

Thanks to your leadership, @USDA is training the next generation of agricultural leaders and investing in science and research to mitigate climate impact on our farmlands and produce. https://t.co/5hFMqQTQps",RepCheri
167,2021-12-13 19:44:25+00:00,1470479741899755529,"I’m joining @HASCDemocrats &amp; my @AppropsDems colleagues in wishing the @USNationalGuard a Happy Birthday! 🎈

National Guard service members continue to protect our communities and lend disaster relief support across the country. https://t.co/5SW3R7b5IY",RepCheri
168,2021-12-13 15:47:53+00:00,1470420218426150925,"ICYMI: We’ve added nearly six million jobs this year — the most of any first year President in history.

🙌🏻 #BuildBackBetter",RepCheri
169,2021-12-13 00:49:57+00:00,1470194245453684738,"The #BuildBackBetterAct saves Illinoisans money by unleashing cleaner, cheaper energy:

☀️ $500/yr saved through lower utility bills AND 
🚗 $700/yr saved in gas &amp; repairs by switching to an electric car

^ That's PER FAMILY, on average!",RepCheri
170,2021-12-11 16:56:51+00:00,1469712795658764295,Thank you Congressman @KaiKahele for getting us in the holiday spirit. Mele kalikimaka to you and your team! 🎄 https://t.co/kJAm4L1vSS,RepCheri
171,2021-12-11 16:47:23+00:00,1469710414900609031,"Let’s be clear: #CleanEnergyIsCheapEnergy.

With the #BuildBackBetter Act, we’re going to unleash the potential of clean energy to help working Illinoisans — saving families across the country hundreds of dollars on their energy bills. https://t.co/PMGANBBHP9",RepCheri
172,2021-12-10 19:21:03+00:00,1469386696567533570,A warm welcome to my new @NewDemCoalition colleagues @RepNikema and @RepShontelBrown. I’m excited to work together as we #BuildBackBetter! https://t.co/5JehF7DAwh,RepCheri
173,2021-12-10 15:33:23+00:00,1469329402710396929,"The Protecting Our Democracy Act will:

— Prevent presidential abuses
— Restore our system of checks and balances
— Strengthen accountability in government AND
— Protect our elections

Proud to have voted for this sweeping package of democracy reforms.",RepCheri
174,2021-12-10 13:12:22+00:00,1469293917493514242,"🎶 All I want for Christmas is for #BuildBackBetter to pass the Senate 🎶

Thank you @RepKClark &amp; #BuildBackBetter bill for stopping by to check our a-maize-ing Christmas decorations! 🌽🎄 https://t.co/97L5PQ3A7p",RepCheri
