,Datetime,Tweet Id,Text,Username
82,2021-09-29 13:17:08+00:00,1443203188929273864,"Across the nation, technology, consolidation and nonbank competition for financial services are reshaping the banking system. Today, @FSCDems are examining the impact of these emerging factors on American consumers and the future of banking.
 
Tune in | https://t.co/gyWtDMfC8i https://t.co/xa7TLASRsi",repdavidscott
83,2021-09-27 22:07:30+00:00,1442611886286049280,"Together, the #BIF and the #BuildBackBetter Act represent a once-in-a-generation investment to make our economy more inclusive and resilient. 

This is our moment to prove to American families that their government works for them –– not just those at the top.
 
Let’s get it done.",repdavidscott
84,2021-09-27 20:07:30+00:00,1442581687700017153,"Taking the debt hostage and playing games with the full faith and credit of the United States is reckless, dangerous and unacceptable.

We can’t play games. We have to prevent default. https://t.co/RcavpvwYfR",repdavidscott
85,2021-09-24 18:18:44+00:00,1441467150661791746,"Today I proudly voted to pass the #WHPA and defend every woman’s basic health freedoms.

A woman’s right to choose is sacred. With reproductive rights nationwide under attack, the Senate must step up to ensure it remains a decision between her &amp; her doctor –– not the US govt. https://t.co/psV4z9k4CK",repdavidscott
86,2021-09-24 14:20:36+00:00,1441407221418512399,"With yesterday's passage of #FY22NDAA, Congress once again delivered on our bipartisan commitment to provide our service members with the support they deserve. https://t.co/MiVu32kFpl",repdavidscott
87,2021-09-22 21:32:37+00:00,1440791165251457025,"The #FY22NDAA makes unprecedented investments in our national security. 

When we invest in our U.S. service members, alliances and partnerships, we are securing a better future for all Americans.",repdavidscott
88,2021-09-22 15:38:05+00:00,1440701945761595395,"Yesterday's vote to pass @HouseDemocrats government funding bill delivered on our duty #ForThePeople. I am proud to support working families through continued investments in emergency assistance, housing relief, public education, childcare and other vital services for Americans. https://t.co/quBC6RSLWo",repdavidscott
89,2021-09-21 17:46:54+00:00,1440371974476218380,Congratulations to Elite Scholars Academy on being named a National Blue Ribbon School for 2021. This outstanding recognition commemorates a commitment to academic excellence and exemplary teaching and learning. Keep up the great work #GA13 scholars -- you make us proud! https://t.co/Lyfqzugl7M,repdavidscott
90,2021-09-21 13:05:25+00:00,1440301138905997317,Thank you Leticia for reaching out! My office has been working hard to help #GA13 small business owners and entrepreneurs access federal funding from @SBAgov. Please call on me and my staff if we can ever be of assistance to you or your community. https://t.co/JC6rJp20aB,repdavidscott
91,2021-09-15 20:19:26+00:00,1438236036274982914,"As communities in #GA13 and across the nation prepare for #YomKippur at sundown, may all those whom observe have an easy and a meaningful fast. G’mar Chatimah Tovah. https://t.co/sIJAn2iPDL",repdavidscott
92,2021-09-15 16:57:15+00:00,1438185155076792324,"This #HispanicHeritageMonth, I am proud to celebrate and honor the histories, cultures and contributions of Hispanic Americans in #GA13 and across the nation. https://t.co/TWDtnSPOhK",repdavidscott
93,2021-09-13 22:52:23+00:00,1437549748366495745,https://t.co/z8Bk1NqsCq,repdavidscott
94,2021-09-13 22:52:15+00:00,1437549717211205634,"Today, on the 27th anniversary of the #VAWA, I call for Senate support of the bipartisan, House-passed VAWA reauthorization so that all survivors of violence and abuse have the resources and support they need to seek justice, receive care and rebuild their lives. https://t.co/BB1zgUqXw5",repdavidscott
95,2021-09-11 17:11:03+00:00,1436739077156528138,"On this solemn day, we pay our respects to those who 20 years ago lost their lives in the tragic events of September 11, 2001. May we #NeverForget the attacks on our fellow Americans or the strength and perseverance of the American people in our nation’s darkest hour. https://t.co/Do7FKDcqRC",repdavidscott
96,2021-09-10 20:35:41+00:00,1436428187010060294,"We can and must reduce barriers to access in the agricultural industry, combat entrenched structural and systemic racism and create a more equitable and more just agricultural community. Read my full op-ed with @SecVilsack for @AJC: ⬇️
https://t.co/nBUrCWNqi8",repdavidscott
97,2021-09-09 13:40:27+00:00,1435961300044161026,"This National #SuicidePrevention Week, I encourage you to reach out to your family, friends and neighbors to make sure they know that help is always available when they are in need. Visit https://t.co/6RRLZOMI7r for more information. https://t.co/WHGt2LIyAu",repdavidscott
98,2021-09-08 18:09:36+00:00,1435666644538429442,"As our hospitals face a critical tipping point in the fight against the Delta variant, @RepHankJohnson and I sent @GovKemp a letter urging swift action to address the recent surge in #COVID19 related hospitalizations across the state of Georgia. https://t.co/0l2k9qkmAk https://t.co/X9tdymS3Oi",repdavidscott
99,2021-09-06 20:41:33+00:00,1434980107995828225,Happy New Year to all those celebrating #RoshHashanah in #GA13 and across the nation!,repdavidscott
100,2021-09-06 14:50:03+00:00,1434891651755958277,"On Labor Day, we pay tribute to the hard-fought achievements of the labor movement, remembering that the American middle class has a union label on it.
 
To all the hard-working Americans in #GA13 and across the nation – I wish you a happy, healthy &amp; safe #LaborDay! https://t.co/Fi3Ma0Qbop",repdavidscott
101,2021-09-03 13:58:35+00:00,1433791537369042963,"As the Chairman of the @HouseAgDems, I am working to ensure that we continue to secure federal resources for our 1890's Land Grants &amp; HBCUs. 

Read more: https://t.co/65XicFQV7F https://t.co/14Q9FcY9GG",repdavidscott
102,2021-09-02 21:22:01+00:00,1433540742199250945,"Today, as we recognize #VJDay, we honor the American heroes who bravely contributed to securing our nation's freedom during WWII. Thank you to all of our troops for your sacrifice and courage. https://t.co/cOk46JTQBI",repdavidscott
103,2021-09-01 16:10:58+00:00,1433100074029129729,"As a member of the @BMHCaucus, I was proud to introduce H.Res.471, to recognize the impact of polycystic ovary syndrome (PCOS) and designate September 2021 as #PCOSAwarenessMonth.

Read More: https://t.co/GmeNOIcBNv https://t.co/dM9CmDP3vf",repdavidscott
104,2021-08-27 16:48:59+00:00,1431297702231425031,"This week, I was pleased to host our inaugural virtual College and Career Fair to highlight the merits of post-secondary options at 1890 HBCUs and other institutions throughout Georgia. Special thanks to our #GA13 high school seniors &amp; partners at @GoodwillNG! https://t.co/61Q5RkIIlp",repdavidscott
105,2021-08-27 00:41:26+00:00,1431054212205535239,"As the threat level on the ground increases, my team remains committed to working to secure the safe evacuation of U.S. nationals and Afghan partners from Afghanistan as swiftly as possible.",repdavidscott
106,2021-08-27 00:41:26+00:00,1431054209965776900,I strongly condemn today’s terrorist attack outside Kabul airport. My deepest condolences go out to the families of all those who were killed or injured in this horrific act of violence. https://t.co/aAbhLCYbti,repdavidscott
107,2021-08-26 19:41:58+00:00,1430978847403560963,We must continue to fight for fair access to the ballot box and work to defeat dangerous voter suppression tactics that impact communities of color.,repdavidscott
108,2021-08-26 19:41:57+00:00,1430978845935554567,"Today marks the 101st anniversary of the #19thAmendment, granting women the right to vote. As we celebrate the brave suffragists who led in the struggle to achieve this historic milestone, we are reminded this #WomensEqualityDay that our nation’s work is far from over. https://t.co/wf2wlEMNVq",repdavidscott
109,2021-08-25 00:22:11+00:00,1430324591029886976,"Today, I was proud to vote for passage of H.R. 4, the John R. Lewis Voting Rights Advancement Act, to restore the full strength of the Voting Rights Act and protect the sacred right to vote for all Americans. #RestoreTheVote https://t.co/DbyI5qAflQ",repdavidscott
110,2021-08-24 20:20:37+00:00,1430263800167550978,"My staff and I have been working around the clock to help alleviate the suffering of our vulnerable Afghan allies. I am calling on @POTUS to radically accelerate the evacuation process. 

Abandoning our allies is not an option. These families trusted us, let's honor that promise. https://t.co/4rHn1rrZHS",repdavidscott
111,2021-08-21 17:45:29+00:00,1429137594353340418,"On Tuesday, 8/24, at 6 p.m. I will be hosting a live, toll-free Telephone Town Hall to answer questions and talk with you about my work in Congress this year to keep our community safe and provide relief for  GA-13 during this difficult time. RSVP today at https://t.co/NHeUdlf7Mi https://t.co/uDfhHYvyzT",repdavidscott
112,2021-08-17 20:36:40+00:00,1427731123803729931,"I am proud to be an original co-sponsor of the #VotingRightsAct to ensure that every voter’s voice is heard. For voters today, voters tomorrow, and all those who sacrificed so that we could cast a ballot freely and fairly, we must pass #HR4 to #RestoreTheVote. https://t.co/kSOJ7QSRei",repdavidscott
113,2021-08-16 22:54:32+00:00,1427403432059625472,"America has a moral and humanitarian duty to facilitate a safe evacuation and resettlement for vulnerable Afghans fleeing unimaginable horrors at the hands of the Taliban. May God bless the sacrifices of our U.S. service members, their families and our allies.

Full statement: https://t.co/E7fO5TVct7",repdavidscott
114,2021-08-12 18:14:31+00:00,1425883411684659202,"The Special Enrollment Period at https://t.co/LW23vifKcC is only open until this Sunday, August 15, 2021! I encourage all GA-13 residents to take advantage of this opportunity to make sure that you #GetCovered before the deadline. https://t.co/h9dcEEK6cm",repdavidscott
115,2021-08-10 20:36:28+00:00,1425194358706475012,"Congress must act to make robust investments in K-12 infrastructure for America’s schools. Together, we can reopen classrooms the right way and give students the inclusive and safe environments they need to learn and prosper. #ReopenAndRebuildAmericasSchools https://t.co/klHSFcLonK",repdavidscott
116,2021-08-09 16:15:05+00:00,1424766192066125824,"Thank you for reaching out Lynn, I’m glad my office could assist you! For more information about how we can be of service to you and your community, please visit https://t.co/UWlNLPPO5n. https://t.co/vxTY3kwDJm",repdavidscott
117,2021-08-06 20:17:08+00:00,1423739942228930565,"Today is the anniversary of the Voting Rights Act of 1965, landmark legislation that prohibited racial discrimination in voting. More than half a century later, @HouseDemocrats are working to #RestoretheVote and ensure that voting remains a RIGHT FOR ALL. https://t.co/ygRksbuYmk",repdavidscott
118,2021-08-05 19:03:52+00:00,1423359114906906624,"Today, the nation mourns the loss of @AFLCIO President Richard Trumka. His legacy will live on in the shared spirit and mission of all those who fight for America’s working families. May he rest in peace. https://t.co/6ZTZehzQj9",repdavidscott
119,2021-08-04 20:03:17+00:00,1423011679663702016,Wishing @BarackObama a Happy 60th Birthday! https://t.co/h6TgRjoU83,repdavidscott
120,2021-08-03 20:44:34+00:00,1422659680749375488,"When Black women are paid less than their white counterparts, they have less money to put away in savings, making it even harder to weather unexpected financial storms (like a global pandemic and historic national job loss).

It's past time for #BlackWomensEqualPay. https://t.co/bKpaxUZP1W",repdavidscott
121,2021-08-03 19:02:28+00:00,1422633988896743435,"As the Delta variant continues to spread across the country, Georgia families are facing both health and housing EMERGENCIES. Our government must act now to #ExtendTheMoratorium and prevent Americans from losing their homes in the middle of a pandemic. https://t.co/LxbkqED6iZ",repdavidscott
122,2021-08-03 17:19:26+00:00,1422608057738084358,"My thoughts and prayers are with the loved ones of officers Gunther Hashida and Kyle DeFreytag, who stood against the Jan. 6 insurrection at the U.S. Capitol. The nation unites in their memory and our shared resolve to ensure that such an assault cannot happen again. https://t.co/Db4SBf2JKV",repdavidscott
123,2021-08-03 13:36:41+00:00,1422552000462479367,"The best way to curb the spread of the coronavirus is to #GetVaccinated. As the nation works to beat back the new, highly contagious Delta variant, we must take measures to protect ourselves and our communities.
 
Find a vaccination site near you at https://t.co/nHkE07Vle0. https://t.co/u34nGX3Sai",repdavidscott
124,2021-08-02 21:17:19+00:00,1422305535106420738,"Thank you, Mary, for trusting our team to assist with this case! If you need help with the IRS or another federal agency, please reach out to my office for help or visit https://t.co/UWlNLPPO5n for more information. https://t.co/K1e83C96PH",repdavidscott
125,2021-07-31 17:34:55+00:00,1421524790914031616,"With our neighbors in my mind and my heart, I fully support extending the CDC’s eviction moratorium and delivering immediate relief for those in our communities facing the brunt of the nation’s twin housing and health emergencies. https://t.co/izlHl6WO4J",repdavidscott
126,2021-07-29 22:10:05+00:00,1420869262458118146,"To my long time friend, @JovitaMoore –– You stay strong in the Lord and in the power of his might. God bless you! @wsbtv 

https://t.co/OKkNvV8Usi",repdavidscott
127,2021-07-29 20:00:18+00:00,1420836602239193092,"Today, I voted to support the @HouseDemocrats funding bill to make transformative investments #ForThePeople. This legislation, which includes my amendment to expand apprenticeships, will help create good-paying jobs &amp; provide a lifeline for Americans hit hardest by the pandemic. https://t.co/LJHUuu6TKu",repdavidscott
128,2021-07-29 00:18:21+00:00,1420539154782433282,"I am proud to support @HouseDemocrats appropriations package #ForThePeople which includes over $100 million in funding that will have a direct impact on veterans, working families, students and teachers in Georgia’s 13th Congressional District. https://t.co/zePsypZAA2",repdavidscott
129,2021-07-27 15:05:33+00:00,1420037651063877632,"Service academies provide our students a distinguished and rigorous education with a value that exceeds $400,000. I strongly encourage all interested #GA13 students to contact my office to learn more about the unique opportunities our military academies offer. https://t.co/89c2Xe3Rxg",repdavidscott
130,2021-07-23 14:22:18+00:00,1418577216389197824,"Wishing all the best to @riseofdrob and @KennySelmon from #GA13, and all #TeamUSA athletes competing in the #TokyoOlympics this summer! You make our nation proud. https://t.co/pYfnnYBjoI",repdavidscott
131,2021-07-21 18:22:33+00:00,1417912900170260482,"Communities in metro Atlanta and across the nation are struggling with skyrocketing housing prices. Yesterday, I asked @SecFudge how @FSCDems can help @HUDgov #BuildBackBetter and provide affordable housing infrastructure for American families. https://t.co/MBrnGhCHwU",repdavidscott
132,2021-07-20 22:50:20+00:00,1417617900828086272,Wishing a healthy and peaceful #EidMubarak to all who commemorate Eid al Adha in #GA13 and across the nation! https://t.co/V5Wb6CEnSo,repdavidscott
133,2021-07-19 16:58:30+00:00,1417166970097704971,Congratulations to this year’s #GA13 @TheBlackCaucus scholarship recipients. It is a great honor to be able to celebrate and contribute to the academic achievements of an exciting new class of gifted young CBC scholars. I am confident that the future is in good hands. https://t.co/rm8ewCDTeb,repdavidscott
134,2021-07-17 17:22:21+00:00,1416448196432248832,"With vision, strength and fearless dedication to the pursuit of justice, Rep. John Lewis defined for a generation the face and story of American courage. Today, we honor his incredible life of service and sacrifice and recommit to the noble legacy of #GoodTrouble he left behind. https://t.co/gweTf2LU2n",repdavidscott
135,2021-07-15 19:23:24+00:00,1415753885206077445,"It’s time to bridge the digital divide for rural American communities most in need and deliver access to robust, reliable broadband to every corner of our nation. Let’s get this bill passed.",repdavidscott
136,2021-07-15 19:22:31+00:00,1415753661741940745,"This week, I was pleased to lead @HouseAgDems in a unanimous vote to send the Broadband Internet Connections for Rural America Act to the House Floor for consideration. https://t.co/qGRkyW6MiL",repdavidscott
137,2021-07-14 17:41:42+00:00,1415365904712577024,"HAPPENING NOW: @HouseAgDems are meeting to consider H.R. 4374, the Broadband Internet Connections for Rural America Act. 📺 Tune in live: https://t.co/5XoxkhKWKh",repdavidscott
138,2021-07-13 18:56:07+00:00,1415022242199744517,https://t.co/unuPiNQQVI,repdavidscott
139,2021-07-13 18:56:06+00:00,1415022239687266304,TOMORROW: Don’t miss the @HouseAgDems markup of the Broadband Internet Connections for Rural America Act. I am proud to work with @POTUS in the effort to erase the digital divide and look forward to discussing ways to further expand broadband access in rural areas. https://t.co/CEDrElQhBl,repdavidscott
140,2021-07-12 20:18:37+00:00,1414680616994496514,"Applications are open now for #GA13 students seeking a Congressional nomination to attend a military academy in 2021-2022. Completed applications must be submitted to my office by Friday, October 29 for consideration. Get started today at https://t.co/J21zCt969a https://t.co/N9PlenNowu",repdavidscott
141,2021-07-12 18:46:44+00:00,1414657495772106754,"🗓Parents, mark your calendars! Starting July 15, working and middle-class families will receive monthly advance #ChildTaxCredit payments (via direct deposit or mail) up to $250/child between the ages of 6-17 or up to $300/child under the age of 6.",repdavidscott
142,2021-07-09 21:01:30+00:00,1413604244729573386,"What a wonderful follow up! Thank you to Chinmay P. from Douglasville, GA for the glowing remarks. As always, my staff and I are here to serve you and your #GA13 community. Call on us when we can be of assistance! https://t.co/ShMSxhZXzG",repdavidscott
143,2021-07-09 18:43:58+00:00,1413569633785946113,"#OnThisDay in 1868, our nation took a monumental step forward toward equality under the law, paving the way for desegregation, reproductive freedom &amp; marriage equality. As we reflect on our progress, may we re-commit to advancing a future of dignity, respect and justice for all. https://t.co/hIrMmfPwYB",repdavidscott
144,2021-07-08 21:00:31+00:00,1413241609060290561,"Our nation’s future depends on the success of our students, and I am immensely proud to lead the charge to establish permanent funding for scholarship programs at 1890 HBCUs, including my alma mater @FAMU_1887. Let’s get this done.
 
Read the full article: https://t.co/JyhN10VZ4R",repdavidscott
145,2021-07-07 19:09:43+00:00,1412851338204135425,"Last week, I introduced a bill to authorize permanent funding for scholarship programs to help students attend 1890 HBCUs. These institutions are vital to our agriculture economy &amp; Congress must ensure they have the resources needed to educate the next gen of American agriculture https://t.co/43GYLyXFbU",repdavidscott
146,2021-07-06 18:22:59+00:00,1412477190629908483,"If you are preparing to travel and need assistance with a passport, please give us ample time to connect with the State Department. For more information on the status of your application, please visit https://t.co/DfDS8gckKx.",repdavidscott
147,2021-07-06 18:22:59+00:00,1412477188755136513,"As more families travel abroad this summer, we are doing everything we can to assist #GA13 constituents with passport inquiries. However, we can only move as fast as @TravelGov. https://t.co/7Dsk3MvItk",repdavidscott
148,2021-07-04 18:05:15+00:00,1411747951014207489,"This #IndependenceDay we celebrate our nation’s resilience and our enduring pursuit to make the vision of the Declaration of Independence a reality for all Americans.

I am proud of the progress we’ve made to allow us to enjoy this #4thOfJuly with family and friends. https://t.co/lHOqOmr8mr",repdavidscott
149,2021-07-01 20:47:18+00:00,1410701571642568714,"I am proud to announce that $19 million I requested for projects in #GA13 were included in the #INVEST in America Act passed today in the U.S. House. This funding will enhance the flow of traffic, support public safety and increase sustainability for communities across metro ATL. https://t.co/NOhRW1wiRz",repdavidscott
150,2021-06-30 17:22:45+00:00,1410287707297832972,"Thank you to Italy V. for reaching out! If you live in the 13th District and need assistance resolving issues with a federal agency, please contact my office. Our GA-13 casework team is here to serve you. https://t.co/x5aEPgyGGP",repdavidscott
151,2021-06-28 17:33:31+00:00,1409565638272638978,"Thousands of Georgia women and millions more across our nation are impacted by uterine fibroid tumors, and I am proud to support the work of advocacy organizations to raise awareness about this condition by promoting July 2021 as Uterine Fibroids Awareness Month. https://t.co/sXcmLsFzdA",repdavidscott
152,2021-06-25 14:46:59+00:00,1408436567996354560,The 8th anniversary of the Supreme Court’s landmark Shelby County v. Holder decision is yet another reminder that the time for action against voter suppression is always now. We must continue the fight #ForThePeople to ensure every American has a voice in our democracy. https://t.co/qqS8aiWpgq,repdavidscott
153,2021-06-24 22:03:42+00:00,1408184079837765642,"Entrepreneurs are essential to the diversity and success of our modern workforce, but there is little data about the challenges that LGBTQ-owned businesses face. Today, I voted YES on #HR1443 to ensure that LGBTQ-owned small businesses are included in fair lending practices. https://t.co/nepx308UqM",repdavidscott
154,2021-06-24 21:22:46+00:00,1408173781881868289,Congress must continue to do more to secure equal care and access to treatment for our veterans. Proud to join my colleagues to pass #HR239 and eliminate the additional costs women veterans are charged by VA health services for basic contraception. https://t.co/zj7CS2hyyW,repdavidscott
155,2021-06-23 20:26:47+00:00,1407797304762015747,"The #INVESTAct will help rebuild our nation’s roads, bridges, transit, rail and water systems and will create millions of good-paying American jobs to support construction workers, engineers, steel workers, bus drivers, rail workers and their families. Let’s get it done!",repdavidscott
156,2021-06-22 15:35:49+00:00,1407361693001388034,"One of the most important ways I serve my constituents is by helping them resolve issues with federal agencies. If you live in #GA13 and need assistance with federal casework, please contact my office. We are here to serve you. https://t.co/QGGSwmKqrn",repdavidscott
157,2021-06-21 20:15:50+00:00,1407069771628224519,"Thanks to the #AmericanRescuePlan, help is on the way for low-income, working and middle-class American families with young children. Visit https://t.co/uU1dSW1X17 to learn more about the impact of the expanded #ChildTaxCredit in #GA13 and across the nation! https://t.co/cvCeWy01W1",repdavidscott
158,2021-06-20 15:07:28+00:00,1406629779932123141,The gift of fatherhood has been one of my life’s greatest joys. Wishing all the dads out there a Happy #FathersDay from my family to yours! https://t.co/vvykVaQXbk,repdavidscott
159,2021-06-19 14:57:06+00:00,1406264785222705153,"As we celebrate the first #Juneteenth recognized as a federal holiday, let us honor the late Reverend Dr. Martin Luther King, Jr.’s challenge to, “Let freedom ring!” across our nation and continue to march forward together in a new era of freedom, justice and unity. https://t.co/KQlrfK4z9T",repdavidscott
160,2021-06-17 18:45:13+00:00,1405597416804454405,"Increasing awareness about polycystic ovary syndrome is critical to our efforts in addressing the maternal mortality crisis in Georgia and across the U.S. As a member of the @BMHCaucus, I am proud to sponsor H.Res. 471, to designate September 2021 as “PCOS Awareness Month”. https://t.co/NUmips6HS0",repdavidscott
161,2021-06-17 16:03:48+00:00,1405556795951681544,"With yesterday’s bipartisan House vote to make Juneteenth a federal holiday, we reaffirm with one resounding voice and hope in our hearts that we are one people and one nation –– united, indivisible and free. I look forward to seeing @POTUS sign it into law. #JuneTeenth2021 https://t.co/3R2KJd67OU",repdavidscott
162,2021-06-16 22:39:04+00:00,1405293880833097734,"I am so delighted with the outpouring of information that came from today’s hearing with our 1890’s Land-Grant HBCU presidents. Together, and through discussions like these, we will be able to sustain, grow and diversify the agricultural workforce for generations to come. https://t.co/cCvUa5ev3Q",repdavidscott
163,2021-06-15 13:36:14+00:00,1404794880954675204,"One year ago, in a watershed victory for equality, the Supreme Court affirmed that LGBTQ Americans are protected from workplace discrimination under federal law. Regardless of who we are or whom we love, each of us deserves the right to live, work &amp; thrive without retribution. https://t.co/FfBk3yYUNH",repdavidscott
