,Datetime,Tweet Id,Text,Username
0,2022-02-23 20:16:33+00:00,1496579754782334991,This headline is outrageous! No one is buying that the Russia-Ukraine crisis is to blame for these issues. The crisis is only affecting the United States because the Democrats and President Biden have made us reliant on Russia. https://t.co/z9yi9k6IMy,RepDLesko
1,2022-02-23 18:26:12+00:00,1496551986724061185,"I proudly presented a Congressional Recognition to Dennis Bash, who is on my Military &amp; Veterans Advisory Council, for his hard work in supporting our veterans &amp; his induction into the 2021 Arizona Veterans Hall of Fame. Thank you for your service, Dennis!
https://t.co/21IZZvLEgz",RepDLesko
2,2022-02-22 21:47:00+00:00,1496240129169498112,President Biden’s disastrous open border policies are incentivizing illegal immigration! #BidenBorderCrisis https://t.co/9RMJ70S2EJ,RepDLesko
3,2022-02-22 21:02:33+00:00,1496228942520492040,"As the Co-Chair of the Women in STEM Caucus, I was honored to participate in a roundtable with @LockheedMartin, @AerojetRdyne, @northropgrumman, Jacobs, Boeing, @NASA, &amp; other Artemis suppliers about the importance of women in STEM &amp; taking women to the moon. #WeAreGoing https://t.co/NAjFnV8i8S",RepDLesko
4,2022-02-22 19:24:00+00:00,1496204142427189249,"Under Democrat leadership, Arizonans are paying more to fill up their gas tanks. Last year gas in Arizona was $2.73 per gallon and today it is $3.71 per gallon! https://t.co/yAEETFCNty",RepDLesko
5,2022-02-22 18:05:11+00:00,1496184309245431818,"🚨 Germany has suspended Putin’s Nord Stream 2 Pipeline. 🚨
 
President Biden MUST act swiftly to reimpose sanctions on the pipeline to send Putin a clear message. Biden should’ve never waived these sanctions to begin with! https://t.co/2vtHTGKp4c",RepDLesko
6,2022-02-22 17:47:02+00:00,1496179739417104386,I am so excited to have the opportunity to see @NASA_SLS and @NASA_Orion that will be used to explore more of space than ever before! #MadeInAmerica https://t.co/2x7IRlKLGD,RepDLesko
7,2022-02-22 17:35:44+00:00,1496176896924602378,I am very excited to be at @NASAKennedy in Florida to learn more about @NASA’s #Artemis mission. I will keep you updated throughout the day on all that I am doing while I’m here! 🚀 #SpaceUSA https://t.co/2b3Hn6UYCZ,RepDLesko
8,2022-02-22 14:52:38+00:00,1496135849972535296,"Great evening speaking to Artemis Suppliers and celebrating their hard work to get America back to the moon! Suppliers from all 50 states, including Arizona, have contributed to this mission. #AllStates4Artemis https://t.co/li0SulYw6Z",RepDLesko
9,2022-02-22 00:35:00+00:00,1495920019791745031,I had a lot of fun going on a ride-along with @UPS where I delivered packages on a delivery route. I also enjoyed speaking with @UPSers and learning about their operations in our district. I am grateful for all of their hard work to ensure our community receives their packages! https://t.co/TmcunzQCpQ,RepDLesko
10,2022-02-21 22:02:22+00:00,1495881610461597701,"Border Patrol agents in Arizona have seized nearly 880 pounds of methamphetamine &amp; over 110 pounds of suspected fentanyl. I am proud of our brave Border Patrol agents’ commitment to prevent these dangerous drugs from hitting our communities. Well done!
https://t.co/oro42OO5UY",RepDLesko
11,2022-02-21 15:00:01+00:00,1495775323161604099,"Happy Presidents’ Day! Today, we honor all of our nation’s presidents who have led our nation throughout history. https://t.co/ggobcrVZAy",RepDLesko
12,2022-02-20 23:32:40+00:00,1495541945472634883,I was honored to be selected as @AssyrianUA’s “Friends of Assyrians” Person of the 2021 Assyrian Universal Alliance 30th Worldwide Congress. Arizona’s 8th Congressional District is home to a great Assyrian community! https://t.co/oaGbIlH8FO,RepDLesko
13,2022-02-20 21:09:28+00:00,1495505909891674120,"I had a great time touring @gcu! Arizona is proudly home to a variety of excellent schools, including GCU. https://t.co/Zz4AvgVpTq",RepDLesko
14,2022-02-20 01:43:46+00:00,1495212550782439429,"I am saddened to hear of the passing of former AZ State Senator David Bradley. I had the honor of serving with him during my tenure in the AZ State Legislature. I extend my deepest condolences to his family and loved ones during this time.
https://t.co/6oUyLG18F0",RepDLesko
15,2022-02-19 15:00:00+00:00,1495050542174937093,"The United States is an oil producing nation. There is no reason for us to be undermining domestic energy production, especially as war looms in Europe! https://t.co/5RsZ2aloeN",RepDLesko
16,2022-02-19 00:37:00+00:00,1494833359519895555,WATCH: Democrats' mandates to close schools and require masks are harming our children. #UnmaskOurKids https://t.co/1VoKLBXrNQ,RepDLesko
17,2022-02-19 00:00:00+00:00,1494824050903949316,"READ my latest op-ed in the @WashTimes on holding China accountable HERE:⬇️
https://t.co/B7wpD4D29E",RepDLesko
18,2022-02-18 23:36:00+00:00,1494818008270786566,"DEMS IN DISARRAY: Poll numbers for Democrats continue their journey to the center of the earth, inflation &amp; soaring gas prices are crushing working &amp; middle-class Americans, &amp; now Democrats are trying their best to do damage control before the elections. https://t.co/X9PIhoqPOD",RepDLesko
19,2022-02-18 22:56:16+00:00,1494808009473675270,I am saddened to hear of the passing of my colleague @RepHagedorn. It was an honor to serve with him in Congress. Please join me in praying for his family and loved ones during this time.,RepDLesko
20,2022-02-18 22:50:06+00:00,1494806457518280711,Our office presented the Southwest Valley Chamber of Commerce with a Congressional Recognition for their contributions to the businesses of our community. Keep up the great work! https://t.co/dpl9GDTmHt,RepDLesko
21,2022-02-18 22:24:50+00:00,1494800097942675461,"GREAT NEWS: Republican-led Arizona’s economy is operating at 97% of where it was prior to the pandemic. 
 
Republican economic policies work. https://t.co/M7aP3I1Jbm",RepDLesko
22,2022-02-18 19:16:39+00:00,1494752741985603584,Inflation affects those who can least afford it the most. Democrats’ economic policies have led to the highest prices in 40 years for Americans. https://t.co/f31fj8lLRB,RepDLesko
23,2022-02-18 17:24:00+00:00,1494724391623696386,"Border Czar Kamala Harris hasn’t addressed the root cause of fentanyl flooding into our communities – the Biden Administration’s open border policies.
https://t.co/SZlEsRCFiC",RepDLesko
24,2022-02-18 17:24:00+00:00,1494724391535398913,"🚨 BREAKING: In January, DHS encountered 153,941 illegal immigrants at the border according to court documents obtained by Fox News. This is what Biden doesn’t want you to see. 👇 #BidenBorderCrisis https://t.co/wzCmk96gje",RepDLesko
25,2022-02-18 16:56:00+00:00,1494717345083789316,"I had a wonderful time touring @CarringtonEdu, which offers a variety of hands-on health care training programs. https://t.co/KdEfmbf12w",RepDLesko
26,2022-02-18 16:16:00+00:00,1494707278871625730,"BREAKING: Arizona Border Patrol agents have found 600 POUNDS of cocaine in cucumbers. 

Due to President Biden’s open border policies, drugs keep flooding into our communities.
https://t.co/q432e6JkzS",RepDLesko
27,2022-02-18 15:00:00+00:00,1494688155655495680,"📻 LISTEN to my interview on @KTAR923 with @BroomheadShow where I discuss President Biden’s open border policies, the fentanyl crisis, and Biden's efforts to undermine American energy independence. https://t.co/C70Rl7heeM",RepDLesko
28,2022-02-18 01:27:47+00:00,1494483751895805966,"Gas prices in Arizona are almost at $4 PER GALLON due to Biden’s anti-energy policies.

The solution is simple: we must produce more American energy. https://t.co/lP5Dq01J9G",RepDLesko
29,2022-02-17 22:35:00+00:00,1494440269487521801,"I am calling for DHS Sec. Mayorkas to RESIGN! He has abandoned our southern border and put American lives at risk by failing to secure it. Read more about my letter with @repkevinhern HERE:
https://t.co/fzD5ZZvMSP",RepDLesko
30,2022-02-17 21:17:00+00:00,1494420640119410688,I joined @RepBoebert's No Taxpayer Funds for Illegal Immigrants Act to prevent federally funded legal aid from going to illegal immigrants. Taxpayers should NOT foot the bill for those who break our laws and illegally cross our southern border! https://t.co/MihqAQR6JE,RepDLesko
31,2022-02-17 21:02:21+00:00,1494416954190446593,"In the @HouseCommerce briefing, I also pressed Dr. Fauci on why the NIH is having scientific collaborations in China when the Chinese government won't cooperate with the World Health Organization and why are we sending any U.S. funds to the Wuhan lab.",RepDLesko
32,2022-02-17 20:03:49+00:00,1494402222490365953,"I attended a @HouseCommerce Subcommittee on Oversight and Investigation briefing. I pressed Dr. Fauci on whether or not he now agrees that it is highly likely that COVID-19 was released from the Wuhan lab in China and if he doesn’t agree, then why not? https://t.co/Bthqaxymox",RepDLesko
33,2022-02-16 23:36:00+00:00,1494093232732528643,"Monica from our office attended a ribbon cutting for @HospicePromise1 in Glendale, Arizona. Hospice Promise provides end-of-life care to their patients. Thank you for taking care of our community. https://t.co/f3APLRRYcu",RepDLesko
34,2022-02-16 22:35:00+00:00,1494077881701572608,"President Biden keeps talking about the Ukrainian border, but what about OUR own border? He should be addressing BOTH the Ukrainian border AND our southern border.",RepDLesko
35,2022-02-16 21:47:00+00:00,1494065801908924423,The American people deserve answers on how the Biden Administration plans to secure our southern border. The #BidenBorderCrisis is putting American lives at risk every day. https://t.co/WDAFXFb2RZ,RepDLesko
36,2022-02-16 20:36:00+00:00,1494047934135955457,"‼️ Inflation is probably costing you $276 A MONTH! How are our hourly workers supposed to keep up with this significant cost of living increase? ⬇️
https://t.co/Ue2Flz3vjZ",RepDLesko
37,2022-02-16 19:37:00+00:00,1494033086308237312,GREAT NEWS: The Arizona Senate has passed a 15-week abortion ban. This is a significant step towards fighting against the Democrats’ increasingly radical abortion agenda! ⬇️ https://t.co/p2cni2LL0R,RepDLesko
38,2022-02-16 18:39:15+00:00,1494018553267240960,"The last time inflation was this high, I was using THIS phone to complain about inflation! ⬇️ https://t.co/db2qvlYZDb",RepDLesko
39,2022-02-16 00:00:01+00:00,1493736888066351106,"Monica from our office attended a ribbon cutting for @EmployBridge, an industrial staffing company in Glendale, Arizona. This is a great addition for our local economy. Welcome to the 8th Congressional District! https://t.co/SUU6MxQ8uG",RepDLesko
40,2022-02-15 23:36:00+00:00,1493730844774735875,"I had a fantastic discussion with my Military and Veteran Advisory Board, where we discussed my continued efforts to support veterans and their families in our community. https://t.co/aqheFNbhkC",RepDLesko
41,2022-02-15 23:07:42+00:00,1493723723253235715,"The Drug Enforcement Administration has announced that a “tidal wave” of fentanyl is pouring into AZ. In 2021, law enforcement seized nearly 12M fentanyl pills in AZ. Pres. Biden, I am calling on you to secure our border NOW to protect our communities from this dangerous drug! https://t.co/JufcXOm8Bl",RepDLesko
42,2022-02-15 23:03:00+00:00,1493722540325355522,I was delighted to meet with the Arizona Civil Air Patrol to discuss their operations in our state and their search and rescue capabilities. Thank you for all the great work you do for Arizonans! https://t.co/9VJVczlHzl,RepDLesko
43,2022-02-15 22:35:00+00:00,1493715493911363585,"BREAKING: Wholesale prices jumped 9.7% in January. 

President Biden was wrong when he said that the crushing inflation created by his policies was “transitory."" His policies have directly led to this economic disaster! https://t.co/UNVdaqHJXl",RepDLesko
44,2022-02-15 21:07:00+00:00,1493693347952836618,"It is cruel to force kids, who have the least risk of serious illness from COVID, to wear masks. Our kids must have a NORMAL childhood!

I will always fight for our kids in Congress. https://t.co/HNLMqfJpUb",RepDLesko
45,2022-02-15 20:16:00+00:00,1493680513109876738,"Democrat logic: Fight inflation by reckless spending.
 
Republican logic: Fight inflation by STOPPING reckless spending.

https://t.co/534b5PXLWD",RepDLesko
46,2022-02-15 19:40:22+00:00,1493671547072090117,"WATCH: The Capitol Police are suspected of inappropriately surveilling lawmakers, staff, &amp; visitors. I am concerned about whether this violates very basic constitutional rights. If the accusations are true, this is unacceptable &amp; we must figure out who is behind these actions! https://t.co/lWsCHdG00p",RepDLesko
47,2022-02-15 18:56:59+00:00,1493660627042197517,"REMEMBER: If they can spy on Trump while he was the President of the United States, they can also spy on you. https://t.co/AfzCEczEFJ",RepDLesko
48,2022-02-15 17:37:51+00:00,1493640715997483009,"Austin from our office attended a ribbon cutting for Benehealth Wellness and Aesthetics in Surprise, Arizona. Welcome to the 8th Congressional District! https://t.co/SDtRha6yGh",RepDLesko
49,2022-02-15 16:46:15+00:00,1493627727584415753,"Monica from our office attended a ribbon cutting at @EatGoodcents in Goodyear, Arizona! Goodcents specializes in serving fresh sub sandwiches to its customers. Welcome to the 8th Congressional District! https://t.co/qHmNOdMzB9",RepDLesko
50,2022-02-15 15:05:13+00:00,1493602301059207174,"📻 LISTEN to my interview with @RussellHunterAZ on Phoenix's 550 KFYI. We discussed the rising tensions between Russia and Ukraine, President Biden’s failed withdrawal from Afghanistan, spying on Congressmembers, and more! https://t.co/RZNboyy6G6",RepDLesko
51,2022-02-14 22:35:00+00:00,1493353105982832641,Democrats’ radical anti-police rhetoric and soft-on-crime policies are responsible for our nation’s crime surge. https://t.co/b4duKDrOpO,RepDLesko
52,2022-02-14 20:36:00+00:00,1493323158547537920,"President Biden’s approval ratings continue their journey to the center of the earth. Even Democrats are fed up! According to a new poll, 51% of Democrats do NOT want Biden as their 2024 nominee. https://t.co/aoFgvsH3Ri",RepDLesko
53,2022-02-14 19:58:00+00:00,1493313595500859396,"You can’t make this up: When President Biden was asked if the risk of a Russian invasion was higher than ever, he responded by saying, “Happy Valentine’s Day!” Are you kidding me?! https://t.co/dXXGCRzzFO",RepDLesko
54,2022-02-14 19:07:00+00:00,1493300760960020489,"🚨 In 2021, rising wages could not keep up with Arizona’s rising prices. 🚨
 
This crushing inflation, which is caused by Democrats’ lousy economic policies, is hurting Arizonan families from the grocery store to the gas station. ⬇️
https://t.co/3lRf7Lu1Ve",RepDLesko
55,2022-02-14 18:09:45+00:00,1493286353555136514,"🌹Roses are red. Violets are blue. Under Biden, Valentine’s Day is more expensive too!
 
This Valentine’s Day, expect to pay more for dinner and roses.
 
Happy Valentine’s Day from the Democrats!
https://t.co/hkz3fZMDSx",RepDLesko
56,2022-02-14 16:47:00+00:00,1493265528814718978,"🌵ARIZONA FACT #5: In the United States, Arizona is the one and only home to the saguaro cactus! https://t.co/pLIFeIDUTj",RepDLesko
57,2022-02-14 16:17:00+00:00,1493257979092606981,"🌵 ARIZONA FACT #4: Sandra Day O’Connor, who is the first woman to serve on the United States Supreme Court, first served as a judge and elected official in Arizona! https://t.co/6aiioFc8t7",RepDLesko
58,2022-02-14 15:55:47+00:00,1493252639684976640,"🌵 ARIZONA FACT #3: The Arizona Trail is 800 MILES LONG and you can go hiking, horseback riding, mountain biking, and cross-country skiing! https://t.co/3WAxR5Ayo2",RepDLesko
59,2022-02-14 15:36:00+00:00,1493247660987461640,🌵 ARIZONA FACT #2: Arizona’s Grand Canyon National Park is ONE of the SEVEN Natural Wonders of the World. It is also the only one of those seven that are in the United States! https://t.co/xaLKvMlLsj,RepDLesko
60,2022-02-14 15:16:00+00:00,1493242627931660290,🌵 ARIZONA FACT #1: Arizona is home to 22 national parks and monuments!,RepDLesko
61,2022-02-14 15:00:03+00:00,1493238613823221763,"Happy Birthday, Arizona! 🌵

On this day 110 years ago, Arizona officially became a state. 

God bless the great state of Arizona! #ArizonaStatehoodDay https://t.co/Mh7fWutLqS",RepDLesko
62,2022-02-13 18:24:00+00:00,1492927551685156864,"President Biden STILL hasn’t visited our southern border. Meanwhile, fentanyl is flooding our communities and killing a record number of Americans!",RepDLesko
63,2022-02-12 21:04:00+00:00,1492605429456719875,READ: I joined @HouseCommerce Leader @cathymcmorris and my other House Republican colleagues to call on President Biden and his administration to show leadership in moving us to pre-pandemic life and ending the public health emergency for COVID-19. https://t.co/aYNQtdK5jP,RepDLesko
64,2022-02-12 16:16:00+00:00,1492532951678164995,A reporter confronts President Biden about his claim back in July 2021 that inflation was going to be “temporary.” Biden responds to the reporter by calling him a “wise guy” instead of admitting that he was wrong about inflation. https://t.co/krkraSvXGV,RepDLesko
65,2022-02-11 23:00:00+00:00,1492272234563473408,I had a great time speaking at the El Dorado Independent Living Facility today! I spoke with constituents about recent legislative activity in the House and informed them of what I have been doing to uphold our constitutional freedoms in D.C.! https://t.co/YAk4fsIKr3,RepDLesko
66,2022-02-11 22:35:00+00:00,1492265942465851407,"Today is February 11, 2022, and there are still Americans trapped behind enemy lines in Afghanistan because they were abandoned by President Biden.",RepDLesko
67,2022-02-11 21:01:00+00:00,1492242286545186828,I am saddened to hear that former AZ lawmaker Olivia Cajero Bedford has passed away. I had the pleasure of serving with her in the AZ State Legislature. She was always friendly and professional. I send my deepest condolences to her family and loved ones. https://t.co/ov6bda4SNm,RepDLesko
68,2022-02-11 20:36:00+00:00,1492235994913021962,"President Biden claimed that his withdrawal from Afghanistan was an “extraordinary success.” 
 
Now, President Biden has REJECTED an army report blaming the Biden Administration for failing to prepare for the withdrawal. https://t.co/RrurkeS9zL",RepDLesko
69,2022-02-11 19:58:00+00:00,1492226431824252929,"Paychecks aren’t going as far as they used to. Democrat policies have driven up the cost of routine expenses, such as groceries, gas, and heating our homes. https://t.co/TUvL4WGUgH",RepDLesko
70,2022-02-11 19:24:51+00:00,1492218091635458048,"Please join me in praying for the five @PhoenixPolice officers injured this morning. 
 
Every day, our brave police officers risk their lives to keep our community safe. Acts of violence against our officers are unacceptable.
https://t.co/mTNGxBfEI8",RepDLesko
71,2022-02-11 16:16:00+00:00,1492170563791441920,"I joined @GReschenthaler in DEMANDING answers on USAID’s continued use of taxpayer dollars to fund EcoHealth Alliance, the group that funded gain-of-function coronavirus research at the Wuhan Institute of Virology prior to the pandemic! https://t.co/CRPx3RQIMH",RepDLesko
72,2022-02-11 15:16:00+00:00,1492155464301395970,FACT: The average product made in China today requires 3 times as much carbon as American made products. https://t.co/zKZZobs3U3,RepDLesko
73,2022-02-11 00:53:04+00:00,1491938302404014083,"Our office presented a Congressional Recognition to A Mighty Change of Heart for their work providing duffel bags filled with essential items to children entering the foster care system. To date, they've provided bags to over 7,000 children across AZ! https://t.co/lKoLOkNMq5",RepDLesko
74,2022-02-10 22:35:00+00:00,1491903554327662594,"BREAKING: A new report finds that Mexico is the DOMINANT SOURCE for fentanyl in the U.S. 

""The drug is manufactured in illegal laboratories there using precursors from Asia – mainly the PRC – and is trafficked principally by land into the United States."" 
https://t.co/6jIrzpRp1N",RepDLesko
75,2022-02-10 21:52:04+00:00,1491892750429659142,"Drug overdoses in America are at record highs. In border communities in Arizona, fentanyl is the leading cause of death among teens. READ about @RepBryanSteil's letter I joined to address this crisis HERE: 👇
https://t.co/5LQ8a08OT5",RepDLesko
76,2022-02-10 21:47:00+00:00,1491891474740379653,FACT: U.S. manufactured products are 40% more carbon-efficient than the world average. https://t.co/MZZBv1qwWh,RepDLesko
77,2022-02-10 20:16:00+00:00,1491868574083862538,"While you may want to eat at home during #Bidenflation to save money, it will not make a big difference. Inflation levels for eating at home and eating out are very similar! ⬇️ https://t.co/CQIUeMb9Me",RepDLesko
78,2022-02-10 19:24:00+00:00,1491855487637372944,"ANOTHER incident of President Biden being caught in untruths: President Biden claimed that “when the federal government spends taxpayer dollars, we are going to buy American.” 
 
FACT: President Biden paid China $1.2 BILLION for COVID tests for Americans. https://t.co/0OyNf0hrq0 https://t.co/990zlz9DYW",RepDLesko
79,2022-02-10 18:58:00+00:00,1491848944439201799,"BREAKING: The cost of food, electricity, and rent have surged again! Democrats’ reckless spending has resulted in #inflation spiking to 7.5% in January, reaching a four-decade high.

This is wiping out the wage gains of working Arizonan families. https://t.co/zOoPFRAT1R",RepDLesko
80,2022-02-10 18:24:02+00:00,1491840398922338308,"Democrats’ policies have ruined our nation’s economy! #Bidenflation
https://t.co/nNkiBWFEb5",RepDLesko
81,2022-02-10 16:16:00+00:00,1491808175942561795,"I cosponsored @RepJimBanks' Putin Accountability Act of 2022 to sanction Putin and his enablers and prevent an invasion of Ukraine BEFORE it occurs.
https://t.co/g8smPdmJZl",RepDLesko
82,2022-02-10 00:37:00+00:00,1491571868687642626,"REMEMBER: Democrats are the party of mask mandates, but as long as you are an elected Democrat official, you don’t have to follow your own mask mandates. HYPOCRISY! https://t.co/6AI7gb0QRZ",RepDLesko
83,2022-02-10 00:02:00+00:00,1491563061118836739,I was proud to attend a virtual meeting with the @SOArizona to build awareness for the special programs and educational benefits they offer Arizonans. I have always been a supporter of the Special Olympics and it was great to see them again today. https://t.co/vke8A2ZF3h,RepDLesko
84,2022-02-09 23:47:00+00:00,1491559285897285632,"We MUST hold the International Olympic Committee accountable for financially supporting a communist nation known for its egregious human rights abuses and putting Olympic athletes, reporters, and others at risk.
https://t.co/8OjroOO9FE",RepDLesko
85,2022-02-09 23:03:00+00:00,1491548213446336521,BREAKING: Russian warships are headed to the Black Sea for military drills. This is yet another concerning development for Ukraine! https://t.co/szK0pmPCfY,RepDLesko
86,2022-02-09 22:35:00+00:00,1491541166533357570,"I joined @RepAndyBiggsAZ in demanding that Speaker Pelosi and Chairwoman Lofgren investigate the OUTRAGEOUS reports of U.S. Capitol Police spying on Members of Congress, their staff, and constituents. Read more HERE:
https://t.co/bMwIzHhgR7",RepDLesko
87,2022-02-09 21:58:00+00:00,1491531855107084294,"The Biden Administration’s plan to advance racial equity is to use our taxpayer dollars to give away crack pipes to drug addicts. This is unacceptable!
https://t.co/a6DawkqBn2",RepDLesko
88,2022-02-09 21:23:41+00:00,1491523218615771142,"The science has changed AGAIN: A new study from Cambridge University claims that wearing WOMEN’S PANTYHOSE over your mask gives you more protection.

At this point, they want to find out how far they can push people with their fear-mongering. 
https://t.co/gAIHp8kV1v",RepDLesko
89,2022-02-09 17:16:00+00:00,1491460887630209024,"Democrats are lifting mask mandates and lockdown restrictions ONLY because they are worried about the midterm elections. 

Let’s be clear: the data on masking and vaccines didn’t change, the polling for Democrats did.
https://t.co/77x66MqR9X",RepDLesko
90,2022-02-09 16:33:00+00:00,1491450066300776452,"🏈 JUST IN TIME FOR THE SUPER BOWL: Inflation gobbles up our favorite snacks, driving up the price of Super Bowl favorites. https://t.co/sU52yjL7UD",RepDLesko
91,2022-02-09 15:16:00+00:00,1491430688754700289,"🚨 Fentanyl is pouring across our southern border at alarming rates; contributing to rising overdose deaths and other heartbreaking circumstances that impact families across America. 

WATCH my remarks about this deadly substance on the House Floor below: https://t.co/l16z9MlElR",RepDLesko
92,2022-02-09 15:00:01+00:00,1491426669038608386,🚨 ATTN: Our office is having Mobile Office Hours TODAY from 9 AM – 11 AM AZ Time at the City of Peoria Development and Community Services Building Benchmark Conference Room. Stop by for help with individual issues related to federal agencies! https://t.co/orzyNVLTVk,RepDLesko
93,2022-02-09 14:29:54+00:00,1491419086504529925,"Crime is skyrocketing, fentanyl is killing Americans, and what is Biden's response?

Spending $30M to pass out free crack pipes. Are you kidding me?! https://t.co/8sgGwr7nTg",RepDLesko
94,2022-02-09 00:47:00+00:00,1491211997328801794,"Due to President Biden unleashing war on American energy, gas is above $3 PER GALLON in every single state in our nation! https://t.co/YEzjGgcHFC",RepDLesko
