,Datetime,Tweet Id,Text,Username
95,2022-02-08 23:38:32+00:00,1491194768931844097,I had a great time at the @RepublicanStudy's member lunch today! My Republican colleagues and I discussed all that we are doing to fight for our nation. https://t.co/9iG6NPV5ET,RepDLesko
96,2022-02-08 19:24:00+00:00,1491130711981506560,"It’s UNACCEPTABLE that VP Harris has been border czar for over a year, yet the #BidenBorderCrisis has become the worst border crisis in all of DHS history! 

She can't even answer a question asking, “What has gone wrong?” Her being appointed as border czar is what has gone wrong! https://t.co/LoGhRF3RcS",RepDLesko
97,2022-02-08 19:07:00+00:00,1491126433904685057,"Monica from our office attended the grand opening for Aroga, which specializes in wellness products. Welcome to Arizona’s 8th Congressional District! https://t.co/vXMlTMJxCs",RepDLesko
98,2022-02-08 17:47:00+00:00,1491106301056888833,"Michael from our office attended a packing party at Packages From Home in Glendale, Arizona. These packages go to U.S. military members who are deployed overseas and include requested food, hygiene, and entertainment items! Over 550 packages were packed at this event. 🇺🇸 https://t.co/Gl4KGb0LwV",RepDLesko
99,2022-02-08 17:02:31+00:00,1491095106644242432,"Austin from our office attended a ribbon cutting for A to Z Polish Market, a grocery store in Surprise, Arizona that offers authentic Polish and German items for sale. Wishing this new business a warm welcome to the #AZ08 community! https://t.co/FF2R8dt7p9",RepDLesko
100,2022-02-08 15:10:00+00:00,1491066790964727813,"REMINDER: Our office is hosting Mobile Office Hours at the City of Peoria Development and Community Services Building Benchmark Conference Room on Wednesday, February 9, 2022, from 9 AM – 11 AM AZ Time! Come out and let us know how we can assist you! https://t.co/PZR68O7psE",RepDLesko
101,2022-02-08 14:21:04+00:00,1491054476060684289,"MUST-READ: According to a Border Patrol agent, “We’re releasing people all day. We go from arresting people in the woods, pulling over fully loaded vehicles, to releasing people onto the streets of America. The smugglers look at us and laugh at us.” 👇https://t.co/yf9wUfIUwF",RepDLesko
102,2022-02-07 22:35:00+00:00,1490816390797922311,"Due to President Biden’s failed leadership, Americans are facing:

🔘 Rising crime.
🔘 Rising prices.
🔘 Bare shelves.
🔘 Record illegal border crossings.
 
EVERY American is affected by these issues!",RepDLesko
103,2022-02-07 21:47:00+00:00,1490804311076458497,"DID YOU KNOW that just 2 milligrams of fentanyl can be enough to kill a human being?
 
Democrats’ open border policies are allowing this poison to flood into our nation. To save our kids, we MUST take swift action and secure our borders! https://t.co/TZLUanezhZ",RepDLesko
104,2022-02-07 20:06:00+00:00,1490778893690843139,"Every day, Americans are paying the price at the pump for President Biden’s anti-energy policies. https://t.co/hzhXhRhDNM",RepDLesko
105,2022-02-07 19:16:00+00:00,1490766310921416706,"In 2021, drug overdose deaths in our nation topped 100,000. 
 
If Democrats allow the emergency class-wide scheduling order for fentanyl to expire on February 18, 2022, there will be deadly consequences.
 
Political games have no place when it comes down to saving American lives!",RepDLesko
106,2022-02-07 18:28:37+00:00,1490754385550397444,"Over the weekend our brave Border Patrol agents were shot at by Mexican drug cartels, yet President Biden still can’t be bothered to go to our southern border! https://t.co/clYX1slrze",RepDLesko
107,2022-02-07 16:00:02+00:00,1490716996174028809,Stop by our Mobile Office Hours WEDNESDAY at the City of Peoria Development and Community Services Building Benchmark Conference Room! Our team is ready to assist constituents who need help with individual issues related to federal agencies! https://t.co/6uRXUJmRvK,RepDLesko
108,2022-02-07 15:45:54+00:00,1490713438347313158,"Human trafficking is a horrendous crime that happens everywhere, including in Arizona. WATCH my informational interview with @ASP to find out more about this form of modern-day slavery here: https://t.co/blKZyeDr85",RepDLesko
109,2022-02-06 16:27:00+00:00,1490361392490242051,"Stop by our Mobile Office Hours on Wednesday, February 9, 2022, from 9 AM – 11 AM AZ Time! Our team is ready to assist constituents who need help with individual issues related to federal agencies. https://t.co/gF25jLffKA",RepDLesko
110,2022-02-05 16:58:00+00:00,1490006806252466183,"It’s UNACCEPTABLE that VP Harris has been border czar for over a year, yet the #BidenBorderCrisis has become the worst border crisis in all of DHS history! 

She can't even answer a question asking, “What has gone wrong?” Her being appointed as border czar is what has gone wrong! https://t.co/nDf8Y63bJq",RepDLesko
111,2022-02-05 15:00:02+00:00,1489977119996358657,"ATTN AZ: Stop by the City of Peoria Development and Community Services Building Benchmark Conference Room on Wednesday, February 9, 2022, from 9 AM – 11 AM AZ Time for our Mobile Office Hours. Our team is ready to assist you! https://t.co/ilRyJoyNIe",RepDLesko
112,2022-02-05 03:37:00+00:00,1489805227767123969,"ICYMI: I criticized the Biden Administration for continually being caught in untruths and their mishandling of our southern border.

You can watch my interview with @STEPHMHAMILL on @OANN here ⬇ https://t.co/8toKzWHuwS",RepDLesko
113,2022-02-05 00:17:00+00:00,1489754896492634113,Monica from our office attended the Kiwanis Club of Glendale’s 50th Anniversary. Please join me in wishing them a happy 50th anniversary! https://t.co/7DxrbH8fvg,RepDLesko
114,2022-02-04 23:36:00+00:00,1489744578462855173,Gas prices in Arizona continue to rise under President Biden’s watch! #BidenEnergyCrisis https://t.co/xmvz5LarrS,RepDLesko
115,2022-02-04 23:03:00+00:00,1489736273921290243,"‼️ The emergency class-wide scheduling order for fentanyl-related substances expires on February 18th, 2022. Yet Dems BLOCKED the HALT Fentanyl Act that I cosponsored from coming to the House floor on Wednesday. This is disgraceful!

We MUST save our kids!
https://t.co/9SOFhxjY4z",RepDLesko
116,2022-02-04 22:35:00+00:00,1489729227150659586,"L.A. Mayor Garcetti’s response to his maskless photo with Magic Johnson is that he held his breath. I guess it’s fine to not wear a mask as long as you don’t exhale!
 
Democrats won’t even follow their COVID mandates! https://t.co/Gens0oUBDN",RepDLesko
117,2022-02-04 21:36:52+00:00,1489714597586210822,"Despite January’s jobs report, don’t be fooled:
 
→ Inflation is soaring.
→ Fewer jobs were created in 2021 than what Biden promised.
→ Unemployment has gone up.
→ Gas prices are at a 7-year high.",RepDLesko
118,2022-02-04 16:16:00+00:00,1489633848723918852,"‼️ I urged the National Cancer Institute to renew its Cancer Center Support Grant to help @UAZCancer conduct cancer research and treatment for Arizona's cancer patients.
https://t.co/tGR1nA1F4X",RepDLesko
119,2022-02-04 15:00:03+00:00,1489614735423127552,"Today on World Cancer Day, we pause and reflect on those who have battled or are currently battling cancer. This disease has taken too many loved ones and affected countless families worldwide. https://t.co/QGcGU7od2d",RepDLesko
120,2022-02-04 03:17:21+00:00,1489437898059436036,"Today, I participated in a classified briefing with Secretaries Blinken, Austin, and Mayorkas, Joint Chiefs of Staff Chair Milley, and Director of National Intelligence Haines on the ongoing situation with Ukraine and Russia.",RepDLesko
121,2022-02-04 02:09:46+00:00,1489420888378335239,I was happy to attend a virtual meeting with teachers from Arizona during @JNCLInfo's Advocacy Day to discuss world language education programs! #LAD22 https://t.co/JskSLNKP2O,RepDLesko
122,2022-02-04 00:56:00+00:00,1489402323285671939,"It was an honor to be asked to speak at @TheCHLI's energy briefing to discuss ways to make the energy industry more consumer-friendly. Our priority has to be first and foremost, reliable, affordable energy for every American! https://t.co/M8HWVh7Xwc",RepDLesko
123,2022-02-04 00:37:00+00:00,1489397541527437312,"Our nation faces:

→ Soaring inflation.                        
→ Higher gas prices.
→ Record illegal border crossings.
→ Rising crime.

Yet Dems are holding a roundtable to discuss a FOOTBALL TEAM’S WORK CULTURE!

Much more urgent matters should be addressed with this time! https://t.co/y9Ki9PZERm",RepDLesko
124,2022-02-03 23:57:00+00:00,1489387475139284994,"Under Democrat leadership:
 
📈 Inflation is at a 40-year high.
📈 Gas prices are at a 7-year high.
📈 Homicides are at a 25-year high.
📈 Border crossings are at a 21-year high.
 
This is our nation under a one-party rule.",RepDLesko
125,2022-02-03 23:00:00+00:00,1489373133752741890,"Under President Biden’s watch, energy prices are up 30%. 
 
President Biden and the Democrats’ war on our energy affects EVERY American! https://t.co/GzWoMgdEg7",RepDLesko
126,2022-02-03 22:12:23+00:00,1489361149174898694,"‼️ A man who drew swastika symbols on D.C.’s Union Station is a Mexican immigrant with a 15-year criminal history who has been deported TWICE! He was arrested and immediately released. The Biden Administration won’t deport this man. 
 
This is SHAMEFUL! https://t.co/Rc5FOQvIqK",RepDLesko
127,2022-02-03 21:47:00+00:00,1489354759618260992,"In the Democrats’ latest war on our education system, “Black Lives Matter at School” will force children as young as five to learn how to be political activists.
https://t.co/NADNcWYhGQ",RepDLesko
128,2022-02-03 20:49:00+00:00,1489340163675230209,"The nearly 3,000-page, hyperpartisan America Concedes Act is a foreign policy FAILURE that omits key national security and foreign policy tools. It does nothing to hold Communist China accountable! https://t.co/0AVx4PAFk6",RepDLesko
129,2022-02-03 19:59:00+00:00,1489327580503236615,"The Biden Administration’s failure to secure our border is exacerbating human smuggling, child sex trafficking, and the drug trade. 
 
This is one of the many reasons why President Biden’s approval ratings are on a journey to the center of the earth! 
https://t.co/s5qBKLchQ1",RepDLesko
130,2022-02-03 18:57:00+00:00,1489311977717460994,"🚨 According to a new ABC News/Ipsos poll, the MAJORITY of Americans reject President Biden’s Supreme Court identity politics. 🚨
https://t.co/VrYRoGWr1K",RepDLesko
131,2022-02-03 18:24:00+00:00,1489303673108938752,"‼️ 30 TRILLION ‼️
 
For the first time in American history, our country’s debt has exceeded $30,000,000,000,000.
 
This is America under a one-party rule.",RepDLesko
132,2022-02-03 17:48:37+00:00,1489294770015031296,"Yesterday, soft-on-crime House Dems BLOCKED consideration of @RepMGriffith's HALT Fentanyl Act, which I cosponsored!
 
This bill makes the emergency scheduling of fentanyl-related substances permanent. We MUST save Americans from this deadly substance! https://t.co/3Z8l5DCmO1",RepDLesko
133,2022-02-03 17:17:39+00:00,1489286976440307712,"In China, there are over a MILLION religious minorities currently locked away in prison. It is SHAMEFUL that the Olympics are still being held in Communist China! 
 
Our nation should boycott the Olympics this year!
https://t.co/MbuHqS1LeW",RepDLesko
134,2022-02-03 16:01:00+00:00,1489267686643142659,"Due to the Dems’ defund and disrespect the police movement, police departments are losing officers and struggling to replace them. 
 
The result is higher crime.
https://t.co/lHOQrgakHt",RepDLesko
135,2022-02-03 15:16:00+00:00,1489256361431117826,"At our Arizona border, 2022 is set to be worse than 2021. 
 
In Yuma, AZ, “Reuters witnessed hundreds of migrants walking through a gap in the border barrier.” ↓↓↓
https://t.co/nLUzw8uqJR",RepDLesko
136,2022-02-03 01:37:00+00:00,1489050253068226565,I sat down with @NAIOPArizona to discuss issues related to their industry and how they are adapting to challenges presented by the COVID-19 pandemic. https://t.co/HSwK00DgoM,RepDLesko
137,2022-02-03 01:07:00+00:00,1489042703451054083,"Gas prices have risen for the 5th week in a row thanks to President Biden’s energy policies.
 
I am very disappointed with Biden’s decision to undermine American energy. He has declared war on our oil &amp; gas industry, which is financially harming Americans. https://t.co/Me3I6sfvpf",RepDLesko
138,2022-02-03 00:45:07+00:00,1489037195373645824,WATCH me ask questions on our over-reliance on China and how the Biden Administration's energy policies are causing increased prices. https://t.co/X6aKIxv3Ce,RepDLesko
139,2022-02-03 00:19:47+00:00,1489030821151481864,"READ my latest op-ed in the @dcexaminer on President Biden’s disastrous first year in office. ⬇️
 https://t.co/8LCMyABv5j",RepDLesko
140,2022-02-02 20:17:13+00:00,1488969777439821828,Monica from our office presented Dustin Barron with a Congressional Recognition for his efforts to help those who are victims of human trafficking or enduring homelessness. Thank you for all that you do to help our community! https://t.co/4DGDVWIseL,RepDLesko
141,2022-02-01 20:47:00+00:00,1488614884401041408,The Dems' America Concedes Act allows members of the Communist China Party to take advantage of a new visa program to conduct malign activities in our nation! This is OUTRAGEOUS! https://t.co/XE9YypjMn7,RepDLesko
142,2022-02-01 19:47:00+00:00,1488599784885657601,"Democrats’ America Concedes Act FAILS to hold China accountable for unleashing COVID-19. The ONLY mention of investigating COVID's origin is the requirement that Biden gives a report to Congress.

No independent investigation, sanctions, or punishments are mentioned! https://t.co/bLTwquQlCS",RepDLesko
143,2022-02-01 19:09:00+00:00,1488590221830541312,"I joined @RepLaHood's letter to Treasury Secretary Yellen raising concern about the current IRS backlogs and its potential impact on the 2022 Tax Filing Season. ⬇️ 
https://t.co/pmatnS656Z",RepDLesko
144,2022-02-01 18:37:52+00:00,1488582387483258884,The Democrats’ America Concedes Act diverts our military’s attention away from China by having the U.S. Armed Forces train to combat CLIMATE CHANGE EVENTS! This is insanity! https://t.co/EpqMoMj2qc,RepDLesko
145,2022-02-01 17:29:00+00:00,1488565056119861251,"The Democrats' America Competes Act should be called the America Concedes Act instead, considering it does nothing to hold Communist China accountable.

In fact, it adds fuel to the inflation fire and wastes taxpayer dollars!",RepDLesko
146,2022-02-01 16:34:24+00:00,1488551314665746433,Today marks National Freedom Day. President Abraham Lincoln signed the 13th Amendment that led to the abolition of slavery on this day in 1865. https://t.co/L6RgEzQR51,RepDLesko
147,2022-02-01 16:24:34+00:00,1488548842693926913,"The America Concedes Act doesn’t even call for the Olympics to be held outside of China. Instead, it calls for a “diplomatic boycott.”
 
Are you kidding me? That’s a slap on the wrist! https://t.co/wr0lbBtNbZ",RepDLesko
148,2022-02-01 15:39:36+00:00,1488537524930818050,"Democrats’ America Concedes Act allocates:
 
→ $8 BILLION for the U.N. Green Climate Fund.
 
→$2 MILLION PER YEAR in foreign aid to countries to combat climate change.
 
This bill wastes American taxpayer dollars on issues completely unrelated to China!",RepDLesko
149,2022-02-01 00:37:00+00:00,1488310377855078404,Democrats’ America Concedes Act is a legislative gift to Communist China!,RepDLesko
150,2022-01-31 23:36:00+00:00,1488295026744434697,"I had a great time meeting with the @PeoriaPanthers band. I nominated them to represent Arizona in this year’s National Memorial Day Parade in Washington, D.C. I’m looking forward to their excellent performance! https://t.co/yqxREunyz5",RepDLesko
151,2022-01-31 23:13:00+00:00,1488289238630080515,I had a great time speaking at the @PeoriaChamberAZ's Reception in support of @PeoriaPoliceAZ and @PeoriaFire. Thank you to our brave first responders and law enforcement officers for all you do for our community! https://t.co/mXy3zV8IfQ,RepDLesko
152,2022-01-31 22:35:00+00:00,1488279675893862403,Speaker Pelosi’s America Concedes Act will surrender our nation’s competitive edge to China and further exacerbate inflation!,RepDLesko
153,2022-01-31 21:47:00+00:00,1488267596101079040,"→ One in four Americans have sacrificed basic expenses to pay their energy bills.
 
→ One in five reported that they were unable to pay their entire energy bill.
 
Biden’s anti-energy policies are to blame!
https://t.co/fRLHgPZyGc",RepDLesko
154,2022-01-31 20:53:59+00:00,1488254253932101639,"Due to the Democrats’ #DefundThePolice rhetoric, in 2021: 
 
→ 346 officers have been shot in the line of duty.
→ Crime has skyrocketed.
→ A record number of officers are retiring.
https://t.co/T1dvZ1wyAO",RepDLesko
155,2022-01-31 19:07:00+00:00,1488227330833231874,President Biden's decision to unleash war on American energy has led to skyrocketing energy prices! https://t.co/R1ombY3oo3,RepDLesko
156,2022-01-31 18:24:21+00:00,1488216597504401408,"🚨A man who is accused of killing a Texas cop entered our nation ILLEGALLY!🚨
 
This is yet another consequence of our borders being open resulting in the unnecessary loss of American life by someone who is not supposed to be in our country to begin with.
https://t.co/pjadKoBMcr",RepDLesko
157,2022-01-30 22:35:00+00:00,1487917287986376706,"A little over a year into Biden's presidency, DHS Sec. Mayorkas FINALLY visited Arizona's border!
 
The Biden Administration left Arizona to fend for ourselves with Arizona declaring a state of emergency and having to deploy the National Guard to our border. #BidenBorderCrisis https://t.co/hTBMjBNey1",RepDLesko
158,2022-01-30 17:17:00+00:00,1487837260464549890,I joined @RepGregPence in a letter to President Biden to oppose his efforts to implement the Green New Deal using American taxpayer dollars! https://t.co/Hw8KUx74U1,RepDLesko
159,2022-01-30 17:00:01+00:00,1487832986124832769,"‼️ The emergency scheduling order on fentanyl-related substances is expiring soon! I am a cosponsor of @RepMGriffith’s HALT Fentanyl Act to make this scheduling order permanent.
https://t.co/TgSlwrciv6",RepDLesko
160,2022-01-30 15:00:00+00:00,1487802783692636161,"🚨BREAKING🚨

Border Patrol is bracing for record arrests at the border this spring. Their resources are already stretched thin, with more agents processing immigrants than doing their real job—patrolling the border.

⬇️ READ my tweet on the #BidenBorderCrisis in this article: ⬇️ https://t.co/BSSQWJqLuO",RepDLesko
161,2022-01-30 01:15:00+00:00,1487595165288210434,"I had a wonderful time meeting with the Liberty Ladies, a group of women located in Sun City, Sun City West, and Sun City Grand. We discussed the current state of our nation and how I'm fighting to uphold our constitutional freedoms! https://t.co/uHFKUaz5Jk",RepDLesko
162,2022-01-30 00:15:00+00:00,1487580065680408576,"Congratulations to @United and their new pilot training program, the United Aviate Academy!  It's great to see this one-of-a-kind academy here in @GoodyearAZGov. https://t.co/66DoG8D0YW",RepDLesko
163,2022-01-29 22:35:00+00:00,1487554899965530113,"🚨🚨 Remember those test kits Biden bought for the American people using taxpayer dollars? Well, those tests are “Made in China.”
 
I wonder if Hunter Biden owns stock in this company? China is responsible for COVID, and now they’re making BILLIONS. They must be held accountable! https://t.co/C9ns183Ze5",RepDLesko
164,2022-01-29 20:12:00+00:00,1487518912778432514,"I joined @RepGuthrie in a letter to the Centers for Medicare and Medicaid Services Administrator Chiquita Brooks La-Surge to urge CMS to preserve and strengthen the Medicare Advantage Program.
https://t.co/D4YwnNLK4l",RepDLesko
165,2022-01-29 16:59:00+00:00,1487470342712954882,"In the aftermath of Biden’s calamitous, failed retreat from Afghanistan, half of the population now “faces acute hunger, with one million children in danger of dying from malnutrition” and the economy is “set to contract by another 20% this year.” 
https://t.co/hx5nHshY3F",RepDLesko
166,2022-01-29 15:56:14+00:00,1487454546125369352,President Biden and Senate Democrats have waived sanctions on Putin’s Nord Stream 2 Pipeline while undermining American energy. Energy security is national security. #BidenEnergyCrisis https://t.co/SepwzLAM1A,RepDLesko
167,2022-01-29 00:36:00+00:00,1487222962855968768,"I fully support @HouseCommerce Ranking Member @cathymcmorris and @boblatta's letter to NBCUniversal questioning how much influence Communist China and the International Olympic Committee will have on the coverage of the Olympic games. ⬇️
https://t.co/NgVmG4wEuT",RepDLesko
168,2022-01-29 00:02:00+00:00,1487214406551293953,"The Biden Administration is secretly transporting illegal immigrants around our nation!

The only destination these illegal immigrants should be going to is BACK HOME! 
https://t.co/19XR9ucHgR",RepDLesko
169,2022-01-28 23:40:00+00:00,1487208870069948416,I had a great time meeting with pastors from across our community and other local leaders at Surprise Mayor @skiphall2's Mayor’s breakfast! https://t.co/DgO2J0kA3D,RepDLesko
170,2022-01-28 23:17:00+00:00,1487203081649459200,"I joined @RepBentz and @RepFredKeller in a letter to the National Personnel Records Center to DEMAND that they fully reopen for veterans to get their records and benefits!
https://t.co/rZShs0FvLK",RepDLesko
171,2022-01-28 23:03:31+00:00,1487199688424099841,"The Republican Study Committee's China Bill focuses on holding Communist China accountable. Our nation needs to stand up to China and tell China that they need to play by the rules.
 
Pelosi’s China Bill FAILS to hold China accountable. She is wasting taxpayer money! https://t.co/55vZYnEONK",RepDLesko
172,2022-01-28 21:51:26+00:00,1487181547312717826,"Now it’s President Biden’s turn to release the full, unedited transcript between him and Ukrainian President Zelensky’s call. #ReleaseTheTranscript https://t.co/7zliF2LwkJ",RepDLesko
173,2022-01-28 18:24:00+00:00,1487129345772634117,"President Biden and VP Harris obviously want open borders! Illegal immigrants are openly walking the streets and being flown around the country.

The #BidenBorderCrisis is jeopardizing our safety and national security! https://t.co/I3U7a14EA5",RepDLesko
174,2022-01-28 17:29:00+00:00,1487115504611332098,"I am a proud supporter of #SchoolChoiceWeek because I believe parents are the primary stakeholders in their children’s education! This week, we celebrate the wide range of options available to Arizona families. https://t.co/mIJmWWGIth",RepDLesko
175,2022-01-28 16:16:00+00:00,1487097133786411009,I can’t think of any other administration that has made as many disastrous mistakes in such a short amount of time as the Biden Administration. It has been a little over a year and the Biden Administration has been riddled with crises!,RepDLesko
176,2022-01-28 15:31:00+00:00,1487085809127747587,"‼️ The price of oil has hit $90 per barrel for the first time since 2014. Arizonans are paying for the Biden Administration’s failed policies every day at the pump. #BidenEnergyCrisis
https://t.co/sT96MlEApW",RepDLesko
177,2022-01-28 01:15:02+00:00,1486870397740064769,"‼️ There have been more than 2,700 POUNDS of fentanyl seized just within the first three months of FY22! This number reflects only what was caught, not what made it through our border successfully. https://t.co/OPAVyK6e0p",RepDLesko
178,2022-01-28 00:00:01+00:00,1486851521048317954,"🚨 This week is Arizona School Choice Week! 🚨
 
Arizona School Choice Week is imperative to ensure educational freedom for families in Arizona. https://t.co/Q5D4sO34Oa",RepDLesko
179,2022-01-27 22:09:03+00:00,1486823595124920320,Our brave Border Patrol agents are tired of DHS Secretary Mayorkas’ failure to secure our border. He is endangering the lives of our Border Patrol agents and Americans! https://t.co/aGRGFvMAGA,RepDLesko
180,2022-01-27 20:17:00+00:00,1486795395414044672,‼️ I joined @RepAndyBiggsAZ to demand President Biden cease the use of a records system that stores the NAMES and RELIGIOUS INFORMATION of those who applied for religious exemptions from the COVID-19 vaccine. This is unacceptable! https://t.co/lsUH3wwTlD,RepDLesko
181,2022-01-27 18:47:00+00:00,1486772746516373505,#SchoolChoiceWeek has partnered with hundreds of schools and organizations in Arizona to raise awareness for K-12 education options for Arizonan families! https://t.co/ZRZbco2r8n,RepDLesko
182,2022-01-27 17:47:00+00:00,1486757646661206021,"I joined @RepMoolenaar's resolution to designate January 23-29, 2022, as National School Choice Week. I firmly believe parents should have options for their children’s education! https://t.co/psWuMMUirT",RepDLesko
183,2022-01-27 15:00:01+00:00,1486715625409945602,"Today on International Holocaust Remembrance Day, we pause to reflect and remember some of the darkest days in history. We remember the survivors and those lost in the Holocaust. #NeverAgain https://t.co/61YK6KJQ6r",RepDLesko
184,2022-01-27 01:29:00+00:00,1486511524780912643,"China's official mandatory app for monitoring ""the health"" of Olympic athletes has been found to have security flaws. I am not surprised! Chinese government officials want access to our data to use against our nation.
https://t.co/YNjtSwLSll",RepDLesko
185,2022-01-27 00:58:00+00:00,1486503723585060866,"GREAT NEWS! According to the newly released December state jobs numbers, Republican-led Arizona has ranked number four for jobs recovered since the start of the pandemic! 
 
Republican policies work. #RedStateRecovery https://t.co/epVsleRMGD",RepDLesko
