,Datetime,Tweet Id,Text,Username
0,2022-02-21 17:11:17+00:00,1495808354077270020,"As our nation’s first Commander in Chief once stated, “Example, whether it be good or bad, has a powerful influence.”

This #PresidentsDay, I am proud to highlight the work of @POTUS &amp; @VP to rebuild our infrastructure, fight COVID-19 &amp; restore U.S. leadership on the world stage. https://t.co/FAwHhyECHP",repdavidscott
1,2022-02-18 14:44:42+00:00,1494684303472701442,"Thank you Eugene C. for reaching out! Whether you need help with a federal agency, housing assistance or anything else, please call my office –– my team is here to serve you and your family however we can. https://t.co/2vHqzn11Sa",repdavidscott
2,2022-02-14 16:55:51+00:00,1493267755025510404,Congratulations to Douglas County’s very own @eamslider24 for bringing home silver 🥈 in monobob! We are all so proud of your persistence and incredible achievement. Way to represent #GA13 and the United States in the 2022 Winter Olympic Games! https://t.co/FQoxSp8cIr,repdavidscott
3,2022-02-05 18:42:42+00:00,1490033153821618183,"American goods made by US workers benefit consumers, blue-collar families and businesses across the country.
 
#AmericaCOMPETES provides the bold &amp; strategic investments we need to bolster US manufacturing, fix our supply chains &amp; invest in the next generation. Let’s get to work. https://t.co/mOvCZNyXRf",repdavidscott
4,2022-02-03 15:56:54+00:00,1489266655540744193,"ICYMI: Last week, @POTUS announced that each household in the U.S. can now have four free COVID-19 at-home tests shipped directly to their home at no cost! 

Know your status to protect yourself and others. Visit https://t.co/vJrwNb4BVz to order your free tests today! https://t.co/5kPxdOHF2Y",repdavidscott
5,2022-02-01 16:26:57+00:00,1488549442122878981,"This #BlackHistoryMonth, we honor the contributions of Black Americans to the rich tapestry of American culture, and our legacy of perseverance and progress amidst the ongoing fight for equality and justice. In that same spirit, let us march on ‘til victory is won. https://t.co/OUx7ycnGJA",repdavidscott
6,2022-01-27 19:19:23+00:00,1486780898012020745,"My team joined Veterans Village for their ribbon cutting ceremony in Douglas County. 

Our district staff works hard to secure resources for service-members &amp; I am thankful for the many organizations and individuals that work with us to assist nearly 12,000 veterans across #GA13. https://t.co/RxMPVIoLJh",repdavidscott
7,2022-01-25 19:46:27+00:00,1486062931234152451,"Next month SCOTUS will consider a lawsuit to gut the #CleanAirAct, which has helped protect the health of Americans for 50+ years. 

Proud to join 190+ colleagues today in an amicus brief to defend American families from those who would put polluters’ profits before public health",repdavidscott
8,2022-01-22 23:26:38+00:00,1485031179191570432,"49 years ago, in #RoevWade, SCOTUS reaffirmed that a woman’s right to choose is sacred.

From TX to GA, reproductive rights are under fire like never before. It's time for the Senate to step up &amp; ensure it remains a decision between her and her doctor, not the U.S. government.",repdavidscott
9,2022-01-20 20:01:18+00:00,1484254731321155585,"Last year, I led legislation to secure $354 million to assist working and middle-class homeowners in Georgia struggling to stay afloat on their mortgages due to COVID-19.

Today, for millions of Georgians, help is here. 

Apply now at https://t.co/MreJ4aDwc9 https://t.co/g7t96kXmEN",repdavidscott
10,2022-01-19 18:30:46+00:00,1483869560142970882,"Congress cannot stand idle while state legislatures across the nation seek to suppress the vote, especially in Black communities. Last week, I joined @RolandsMartin to discuss @POTUS call for filibuster reform in the Senate and a path forward to pass voting rights legislation. https://t.co/WMrkYDtkjH",repdavidscott
11,2022-01-17 15:23:38+00:00,1483097688069623817,"As a lighthouse is a beacon of hope to ships at sea, the enduring legacy of Dr. King will continue to illuminate our path to a better future. We must alchemize the moment to create more justice, more fairness &amp; more equity for all, starting with securing the sacred right to vote. https://t.co/JtummKcJZR",repdavidscott
12,2022-01-17 15:23:36+00:00,1483097682163994625,"Challenging a divided nation to believe that our estimation of one another should be more than skin-deep, Dr. King’s vision of an America that would dare to live out the true meaning of its creed — that all people are created equal, remains a moral compass &amp; guiding light for all https://t.co/7loIKFjes6",repdavidscott
13,2022-01-15 16:45:01+00:00,1482393395796615175,"Deeply saddened by the loss of MARTA CEO Jeff Parker. We owe a debt of gratitude for his leadership &amp; vision at MARTA, his commitment to public service &amp; his extraordinary efforts to expand metro Atlanta public transit. My thoughts &amp; prayers are with his family &amp; colleagues. https://t.co/EWCobbN9Q6",repdavidscott
14,2022-01-11 21:25:10+00:00,1481014344947322889,"With states across the nation implementing blatant voter suppression tactics, the integrity of our elections is at stake. Senate action on voting rights legislation is long overdue. Let’s carve out the filibuster and safeguard our precious Democracy. 📺: @ABC https://t.co/AgNNIFCbWn",repdavidscott
15,2022-01-11 19:50:11+00:00,1480990441424179204,"Congratulations to our 2022 College Football National Champions, the Georgia Bulldogs! This is a great victory for the University and our entire state. Way to turn the tide!
 
Thanks to my friend @RepTerriSewell, I'm looking forward to enjoying Alabama BBQ and sweet potato pie! https://t.co/Aquy9pjYxL",repdavidscott
16,2022-01-10 19:51:30+00:00,1480628387421257729,May we continue to honor the women of color who have contributed so much to our American history!,repdavidscott
17,2022-01-10 19:51:30+00:00,1480628384803790859,"Today, the @USMint enshrined the life and legacy of Maya Angelou on the quarter! I was honored to support @RepBarbaraLee’s bill to make this a reality for our nation, and I am incredibly proud to see it come to fruition. https://t.co/WDCyGtVCsX",repdavidscott
18,2022-01-10 17:48:18+00:00,1480597379707510786,"There is truly nothing sweeter than a rematch victory against a great rival — especially in the National Championship. Wishing all the best to our Georgia Bulldogs in tonight's game!
 
Here we go Dawgs, sic ‘em! https://t.co/s5ac8uiAYS",repdavidscott
19,2022-01-06 15:44:02+00:00,1479116555858288641,"On the anniversary of the January 6th Insurrection, I am calling on the Senate to pass the John Lewis Voting Rights Advancement Act. It's time. 

Pass it on.",repdavidscott
20,2022-01-06 15:07:58+00:00,1479107478788870145,"However, because of the heroism of our Capitol Police and other first responders, we showed the world that we will never be diverted from our solemn duty to the U.S. Constitution and the American people.",repdavidscott
21,2022-01-06 15:07:57+00:00,1479107476133867521,The violent and deadly insurrection targeting our nation’s Capitol was one of the most profound tragedies in our nation’s history.,repdavidscott
22,2022-01-04 20:26:15+00:00,1478462802746650628,"Throughout the pandemic, I have worked to deliver drive-thru COVID-19 testing, vaccination and food distribution events to help keep our communities safe and healthy. 

Here’s a look back on what we accomplished together for #GA13: https://t.co/daOIbMuAyn",repdavidscott
23,2021-12-29 17:53:43+00:00,1476250090495000584,"This year, my team and I closed 1,880 cases for #GA13 constituents and sent over 22k letters to answer your questions. Remember, whenever you need us, we are here for you and all our communities. I am looking forward to hitting the ground running in 2022!

#DeliveredforGA13✅ https://t.co/FZDBkrdp2a",repdavidscott
24,2021-12-27 14:17:25+00:00,1475470881333948422,"We can’t allow modern-day slavery in Georgia. Last week, in a letter to @USEEOC and @USCIS, I urged support for additional governmental oversight of the H-2A guest worker program following recent allegations of forced labor in our state. @ViceNews
https://t.co/iXI4vNZXQH https://t.co/9Mv1D4ENbp",repdavidscott
25,2021-12-24 23:24:49+00:00,1474521475197644810,"Wishing everyone who celebrates a #MerryChristmas and #HappyHolidays from my family to yours! I hope your day is filled with laughter, cheer, health and happiness! https://t.co/LzL1TdOACC",repdavidscott
26,2021-12-19 19:24:06+00:00,1472648955741753344,"Today, Georgia mourns the loss of a great statesman and stalwart public servant who for decades worked diligently across the aisle for the common good of our communities. 

I thank God for sending Johnny Isakson our way and may God bless him.

https://t.co/PBszlhtl6Z https://t.co/YWMO6VfjHD",repdavidscott
27,2021-12-15 17:50:03+00:00,1471175735633186821,The science is clear: Congress cannot afford to drag our feet on addressing the climate crisis. GA has experienced 50 major disasters in the last decade – it's time to act on #BuildBackBetter and deliver the bold action we need to win on climate and secure a clean future. https://t.co/9jXpyJ6bzj,repdavidscott
28,2021-12-14 17:50:03+00:00,1470813350372298753,"The CTC is a lifeline for many, and I am proud to support the #BuildBackBetter Act to extend this relief for my constituents and families across the nation.",repdavidscott
29,2021-12-14 17:50:03+00:00,1470813347654295563,"The #ChildTaxCredit has already made a major impact in #GA13, cutting child poverty in half and delivering over $267M in tax cuts to over 92,000 families. https://t.co/gXkiW7qgGm",repdavidscott
30,2021-12-10 17:50:10+00:00,1469363825795387397,"This week, I met with @EPAMichaelRegan &amp; members of the EtO Task Force to discuss solutions for communities in Smyrna and across the country impacted by EtO health hazards. Pleased with the continued commitment of the @EPA to engage the threat of air pollution on public health. https://t.co/VqflhUsBRo",repdavidscott
31,2021-12-09 15:43:46+00:00,1468969629439516672,"The #ChildTaxCredit that delivered the largest reduction in child poverty in American history expires Dec. 31.
 
More than 39 million families are counting on us. We can’t let them down. The Senate must pass the #BuildBackBetter Act &amp; renew the CTC for the American people. https://t.co/CGxDE5H0tM",repdavidscott
32,2021-12-08 17:02:17+00:00,1468627003138093060,https://t.co/D4nwVdS7oj,repdavidscott
33,2021-12-08 17:02:17+00:00,1468627001309380617,"Addressing our nation's STEM skills gap is vital to our position in the increasingly competitive global economy. With new opportunities for HBCU &amp; MSI students to experiment with cutting-edge tech, the MAKERS Act can help bridge that divide &amp; create a more inclusive STEM industry https://t.co/DUmTeyssE0",repdavidscott
34,2021-12-07 21:28:01+00:00,1468331486285897728,"Nearly 9 in 10 Americans agree, Congress must act to #LowerDrugCosts. By empowering Medicare to negotiate prices, capping the amount seniors pay out-of-pocket for medications &amp; holding accountable pharma companies who unfairly raise prices, the #BuildBackBetter Act gets it done. https://t.co/ZR2Yfwv8Iw",repdavidscott
35,2021-12-07 18:48:53+00:00,1468291441407500290,Our country was forever changed by the attack on Pearl Harbor 80 years ago today. We continue to honor the lives and bravery of all those who sacrificed in service to our nation. https://t.co/8wh2SSMZnY,repdavidscott
36,2021-12-04 17:22:57+00:00,1467182651136266252,"The biggest shame of all of this is that my AL colleagues will be deprived of a chance to taste our GA Pecans, Peanuts, and Peaches, which like our Bulldogs, are the best in the country. #GoDawgs",repdavidscott
37,2021-12-04 17:22:57+00:00,1467182649223622659,"My friend @RepTerriSewell and I joined @WOTSonWSB to talk all things UGA-Bama ahead of our friendly wager on the SEC championship game in Atlanta tomorrow.
 
Listen here: https://t.co/AG0FINCjoa",repdavidscott
38,2021-12-04 13:07:11+00:00,1467118285368041479,"Blessed to be a part of @apa1906NETwork’s 115 year legacy of Manly Deeds, Scholarship, and Love for all Mankind. Happy Founders’ Day! https://t.co/k5oCqo3lBQ",repdavidscott
39,2021-12-03 16:44:01+00:00,1466810463342235649,Game on! #GoDawgs🐶 https://t.co/dmPaZjZXu9,repdavidscott
40,2021-12-02 22:31:01+00:00,1466535401582125059,"With high-quality green jobs &amp; meaningful investments toward a sustainable future, the #BuildBackBetter Act will put the U.S. back on the map as a global leader in the climate crisis. Let’s build a clean energy economy that works for everyone &amp; protects our planet for generations https://t.co/SyBOFCTfAo",repdavidscott
41,2021-12-02 14:24:21+00:00,1466412927032995851,"Whether you are behind the wheel of an EV or an 18-wheeler, the Bipartisan Infrastructure Deal will make your ride safer &amp; smoother with $225M invested over the next 5 years to service the 374 bridges in Georgia that are in need of replacements or repairs.
 
#DeliveredforGA13 ✅ https://t.co/SbA8qfmBpq",repdavidscott
42,2021-12-01 19:46:41+00:00,1466131659368144899,Great having @FederalReserve Chairman Powell and @USTreasury @SecYellen with us at today's @FSCDems hearing where we discussed how solutions like the child tax credit are making a meaningful difference for families in Georgia and across the country. https://t.co/6BNqEbWlFo,repdavidscott
43,2021-12-01 17:17:38+00:00,1466094148432367625,"My prayers are with the families of each victim of this terrifying gun violence. We must put these guns down, support our brave police officers, and love one another.",repdavidscott
44,2021-12-01 17:17:37+00:00,1466094145945100299,"Yesterday, Clayton County lost four of our neighbors, including two women and Clayton County Police officer, Henry Laxson, and a 12 year old child is in the hospital fighting for life.

Press Release: https://t.co/GyvZDn5p8l",repdavidscott
45,2021-12-01 15:11:47+00:00,1466062478668976128,"GA's public transit options just got a big boost from the Bipartisan Infrastructure Bill. With the help of a $1.4B federal investment, commuters in #GA13 &amp; across the state will see improvements in the buses and trains used to travel and connect every day.
 
#DeliveredforGA13 ✅ https://t.co/QOspR5Ki3q",repdavidscott
46,2021-11-30 14:37:33+00:00,1465691474960564225,"The recent Bipartisan Infrastructure Bill signed into law by @POTUS delivers BIG for Georgia's roads, bridges &amp; highways with more than $8.9 billion in federal aid for state highways and $225 million for bridge replacement and repairs.
 
#DeliveredforGA13 ✅ https://t.co/lm5bM24IsO",repdavidscott
47,2021-11-29 19:37:01+00:00,1465404450986729486,"The #BipartisanInfrastructureDeal signed into law by @POTUS last week is a major step forward for our country—one that delivers BIG on broadband, transportation, cleaning drinking water, environmental sustainability, jobs &amp; more for those here in #GA13 and across the nation. https://t.co/AV7zohANYK",repdavidscott
48,2021-11-28 21:58:52+00:00,1465077759005368326,"Wishing a #HappyHanukkah to all who celebrate in #GA13 and across the nation! May this joyful time be filled with laughter, light and warmth. https://t.co/9xKnWZoiRW",repdavidscott
49,2021-11-27 14:31:45+00:00,1464602853394296832,"ICYMI: Sunday, I joined @WSBSlade of @WSBRadio to discuss the current status of our supply chain and my bipartisan push to bridge the nationwide truck driving shortage by expediting @USDOL grant applications for aspiring truck drivers. https://t.co/gEOCIuZFgg",repdavidscott
50,2021-11-25 16:39:53+00:00,1463910320599089159,"What a wonderful time of the year! As family and friends come together this weekend to give thanks and share their appreciation for the many blessings in our lives, I would like to extend a happy and healthy #Thanksgiving to all of our #GA13 families. https://t.co/rbtkXXSPfW",repdavidscott
51,2021-11-24 22:44:06+00:00,1463639591693557762,This is one of the greatest days in the history of our nation. Read my full statement on the verdict in the Arbery case below. https://t.co/Nw7bfurxMS,repdavidscott
52,2021-11-19 17:52:40+00:00,1461754309692076033,"With House passage of the #BuildBackBetterAct today, American families are one step closer to an expanded Child Tax Credit, child care and universal pre-K, expanded health care and lower prescription drug costs.

 Read More: https://t.co/T8h71HVNi8 https://t.co/A8qXYvhGrW",repdavidscott
53,2021-11-18 18:49:33+00:00,1461406236918878208,"This week, 60+ colleagues joined a bipartisan letter I led urging @USDOL @SecMartyWalsh to prioritize labor grants for aspiring truck drivers. Let’s cut through the red tape and get folks eager to help alleviate our nationwide truck shortage on the road. 
https://t.co/7AHFHuFYP2 https://t.co/1dfqYQoo1G",repdavidscott
54,2021-11-11 15:01:26+00:00,1458812114404003847,"This #VeteransDay I would like to thank all of the military veterans in #GA13 and across the country for their courage and heroism in serving our great nation. You are the defenders of our democracy, and we honor you for protecting the rights and freedoms of all Americans. https://t.co/ebomYavY8Z",repdavidscott
55,2021-11-10 18:56:19+00:00,1458508839578488834,"🚨Only 5 days remain to get your #ChildTaxCredit in 2021🚨

Visit https://t.co/HBnjsmIivu to learn more about how the #CTC is investing in our nation’s future and helping more than 61 million American families #BuildBackBetter. https://t.co/fHqqJdQFtw",repdavidscott
56,2021-11-09 15:54:05+00:00,1458100591385841672,"Today, we mourn the loss of Max Cleland, a decorated Vietnam War veteran and American patriot. First as Administrator of the VA and later in the Senate, he was a champion for veterans across the nation and his legacy will live on as a true embodiment of the American spirit. https://t.co/9PcEcaQfUN",repdavidscott
57,2021-11-09 00:58:41+00:00,1457875256488730630,"For too long, Congress has failed
to act boldly on infrastructure, leaving our country w. congested roads, failing sewer systems, lead in our pipes, unsafe bridges, unreliable broadband and slow-moving trains. Today we begin to
#BuildBackBetter for the
American people. @AJC https://t.co/daRLySOAVt",repdavidscott
58,2021-11-08 20:15:15+00:00,1457803925705400323,"ICYMI: I joined @CNNNewsroom to discuss the historic bipartisan infrastructure bill passed last week. This is a major victory for all Americans, &amp; I am proud to help @POTUS deliver clean water, rural broadband and good paying jobs to communities in #GA13 &amp; across the country. https://t.co/0jkxAgSXFN",repdavidscott
59,2021-11-05 21:54:43+00:00,1456741793060605961,"More than 15k commercial truck driver vacancies need to be filled right away to get meat, produce and commodities from our agriculture industry to communities across the country. 
 
Our nation's supply chain can't wait. We need action now. Full interview @MadisonSiriusXM. https://t.co/fbZveyu6TX",repdavidscott
60,2021-11-05 19:18:04+00:00,1456702373200637955,I'm in. https://t.co/0KfJOW5ur1,repdavidscott
61,2021-11-04 20:52:01+00:00,1456363627506769926,"Wishing a Happy #Diwali to all who celebrate the Festival of Lights in #GA13 and across the nation. May the Diwali lights remind us all of the power of our shared values –– that even in the midst of darkness, light will ultimately prevail. https://t.co/VDKzO5T17w",repdavidscott
62,2021-11-04 13:40:52+00:00,1456255127514325002,"Are you a college student or recent graduate interested in gaining experience with legislative affairs, communications or community outreach?
 
Apply TODAY to join our #GA13 team for a semester-long internship in Washington, Smyrna or Jonesboro. https://t.co/7CxUy9A4Fl https://t.co/J5fZ2huawN",repdavidscott
63,2021-11-03 20:05:52+00:00,1455989626175463433,"Congrats to the @Braves for a remarkable season &amp; for carrying forward the club’s longstanding legacy of sportsmanship, comradery &amp; the drive to be the best in the world. The sun is shining a little brighter over #BravesCountry today.

#For44 #BattleATL https://t.co/sjyYJ1MzPB",repdavidscott
64,2021-11-02 18:51:31+00:00,1455608529386156034,"Investments in veterans and military families are investments in our national security. This month, we honor the sacrifices our service members and their loved ones make for our country and look forward to the passage of a robust #FY22NDAA that will help meet their needs. https://t.co/5IL5Dt0E6X",repdavidscott
65,2021-10-29 15:13:30+00:00,1454104109674639366,"We all thank God for sending Jovita Moore our way, and we all say thank you and God bless Jovita Moore.",repdavidscott
66,2021-10-29 15:13:29+00:00,1454104107862659089,"I am deeply saddened by the passing of my good friend Jovita Moore. Jovita impacted homes across metro-Atlanta for a generation with her special brand of top-notch journalism, wit and dazzling personality. https://t.co/7sVPaRgZ5J",repdavidscott
67,2021-10-26 20:52:56+00:00,1453102366908104708,Congratulations to our 2021 Atlanta @Braves on winning the NL pennant! All of #BravesCountry in #GA13 is rooting you on and we wish you the best of luck tonight in Game 1 of the World Series. You make Atlanta and our entire state proud! #BattleATL https://t.co/FRYt8iJUfi,repdavidscott
68,2021-10-26 16:24:10+00:00,1453034731294138377,"We can’t afford to put the food security of American families at risk. 

This week, I sent a letter to @ApppropsDems urging them to make sure critical programs like SNAP and TEFAP remain funded in FY2022. https://t.co/EVVDlLDSSe",repdavidscott
69,2021-10-22 21:07:41+00:00,1451656528013008898,"With more than 1 in 3 households in the U.S. renting their homes, it is vital that we provide federal support for families working toward financial stability as we #BuildBackBetter for the American people.

📺 | @FSCDems hearing remarks on 10.21.21 https://t.co/vbWmaj4ver",repdavidscott
70,2021-10-22 15:48:49+00:00,1451576284157517828,"This October, I am proud to recognize #BreastCancerAwareness Month and organizations like @GABreastCancer that are raising awareness &amp; supporting prevention strategies, like regular mammography screenings, to make sure that we reduce the threat of breast cancer for our families. https://t.co/WaKyNH7uoO",repdavidscott
71,2021-10-20 20:28:39+00:00,1450921927703470080,"Wishing you a Happy Birthday, Madame @VP! https://t.co/qZTiRcTp7f",repdavidscott
72,2021-10-19 20:08:00+00:00,1450554344353452035,"My office is proud to serve our #GA13 community. If we can assist you or someone you know in getting in touch with a federal agency or department, please visit us online to learn more about how we can help at https://t.co/9RtclDjB2b. https://t.co/L9lRfj2HF3",repdavidscott
73,2021-10-18 18:31:41+00:00,1450167716917166086,"Today we pause to reflect on the historied life of Secretary Colin Powell and his distinguished service to our nation as an esteemed general and diplomat, and as the first Black U.S. Secretary of State. Our country has lost one of its brightest lights. May he rest in peace. https://t.co/fjRqzUTvfJ",repdavidscott
74,2021-10-17 02:47:48+00:00,1449567796229287936,"As chairman of @HouseAgDems, I am proud to stand with our farmers, community food banks and all other #FoodHeroes by reaffirming my commitment to addressing food insecurity &amp; malnutrition in #GA13 and across the globe. 

#WorldFoodDay https://t.co/sTFn48o5g7",repdavidscott
75,2021-10-15 20:43:59+00:00,1449113849098121219,"Livable wages, reasonable working hours, safe working conditions, and strong benefits should be standard for our workers. I stand in support of @IATSE members and the thousands of film and television industry workers who call Georgia home. #UnionStrong #IATSESolidarity",repdavidscott
76,2021-10-13 19:22:35+00:00,1448368589342396416,Congrats to @ArthurTrippGA on his well-deserved @WhiteHouse appointment to serve as State Executive Director in Georgia of the @USDA Farm Service Agency. I know he will be ready on day-one to get to work on the challenges facing Georgia farms. https://t.co/nXgLlgPLMc,repdavidscott
77,2021-10-04 14:12:39+00:00,1445029098867286028,"🚨 #GA13 Veterans: Appointments are NOW OPEN to veterans and their families to schedule one-on-one assistance with VA claims representatives at the virtual VA Atlanta claims clinic on Thurs. 10/21 from 4 to 6 p.m.
 
Call 404.929.3100 and schedule your appointment today! https://t.co/kIlZETiZPE",repdavidscott
78,2021-10-01 20:37:16+00:00,1444038727345508353,"Happy birthday to the 39th President of these United States and one of Georgia’s very best, President Jimmy Carter. Wishing you all the best today, President Carter! https://t.co/pZSUGheJvJ",repdavidscott
79,2021-09-30 16:06:16+00:00,1443608141346873350,"Our nation’s banking and credit framework should provide opportunities and security for all Americans. To meet this challenge, we must address detrimental biases in new financial technology algorithms on minority homeowners. https://t.co/wSEgL0GGxx",repdavidscott
80,2021-09-29 18:29:08+00:00,1443281705889116165,"ICYMI: Yesterday, @UCMayorVince from #GA13 testified before @FairGrowthCmte on the effects of globalization on U.S. economic disparities and the importance of interconnectedness between localities and the federal government.
 
Watch the full hearing. 📺 | https://t.co/iuiN16OQg0",repdavidscott
81,2021-09-29 17:49:27+00:00,1443271718542495758,"Economic disparities are far too prevalent in our nation’s homeownership rates. Today at our @FSCDems Hearing, I inquired about how U.S. financial services and banking systems can do more to ensure that communities in need are included in our country’s efforts going forward. https://t.co/bjruJPK5F0",repdavidscott
