,Datetime,Tweet Id,Text,Username
186,2022-01-27 00:10:01+00:00,1486491650851549190,"Americans are paying for the Democrats’ reckless spending every day. The money that Democrats in Congress are spending isn’t coming from the sky, it’s coming from the pockets of hardworking Americans! https://t.co/48Abpa9gzp",RepDLesko
187,2022-01-26 22:43:07+00:00,1486469780886278144,"Instead of President Biden addressing the many issues at hand, he decides to partake in a photo-op where he enjoys his Chocolate Chip ice cream. 
 
This is one of the many reasons why President Biden’s poll numbers are on a journey to the center of the earth! https://t.co/iZYekVzS0F",RepDLesko
188,2022-01-26 21:44:47+00:00,1486455098364633098,"🎉HUGE VICTORY FOR THE AMERICAN WORKER! 🎉
 
The Biden Administration has announced it is withdrawing its unconstitutional vaccine mandate for private employers.
https://t.co/Y8qJlfdsCc",RepDLesko
189,2022-01-26 20:29:49+00:00,1486436234830483458,Arizona Governor @dougducey has officially proclaimed this week as Arizona School Choice Week! Arizona is blessed to have leadership that supports #SchoolChoice! https://t.co/fRaWXdo5oZ,RepDLesko
190,2022-01-26 20:16:00+00:00,1486432755831476242,"@RepStefanik and I asked the DHS Inspector General to investigate the poor decisions that have led to the catastrophe at our southern border. Americans deserve answers!
https://t.co/ruMpb4ZhYC",RepDLesko
191,2022-01-26 16:16:00+00:00,1486372357828591618,"I joined @RepDavid in a letter to Treasury Secretary Yellen to push back against the Biden Administration’s threat to take back federal funding meant for Arizonan children and schools. It is up to Arizonans to decide what is best for our children!
https://t.co/WcGdqCWa1B",RepDLesko
192,2022-01-26 15:08:52+00:00,1486355465277788161,Happy Birthday to @GOPLeader! I am thankful to be fighting for our nation together in Congress. Thank you for your leadership! https://t.co/8FBOlkIFko,RepDLesko
193,2022-01-26 15:00:00+00:00,1486353234210009094,"This week marks National @schoolchoicewk! School choice puts kids first and empowers families to choose from:

- Public schools.
- Private schools.
- Public charter schools.
- Online schools.
- Homeschooling.
- Public magnet schools.",RepDLesko
194,2022-01-26 00:27:00+00:00,1486133534100279304,"Monica from our office attended a ribbon cutting for @OldChicago1976 in Goodyear, AZ. Welcome to the 8th Congressional District! 🍕 https://t.co/fBYMKbv2gb",RepDLesko
195,2022-01-25 23:03:00+00:00,1486112395336556549,"We are flying illegal immigrants around our nation while we have an escalating border crisis. What if just ONE of these individuals with no documentation is a terrorist? There is no record of who is coming and going.
 
Democrats continue to put American lives in danger. SHAMEFUL! https://t.co/mcIJPlnxkq",RepDLesko
196,2022-01-25 22:35:00+00:00,1486105348700348416,"During the COVID-19 pandemic, President Biden opened our southern border, yet shut down American schools and businesses. 
 
Biden forced healthcare workers out of work while attempting to pay illegal immigrants.
 
President Biden has constantly shown he puts America last!",RepDLesko
197,2022-01-25 22:03:00+00:00,1486097295682813952,It was an honor to speak to constituents in Phoenix last night and discuss my opposition to vaccine mandates and the Democrats’ reckless spending. I always love getting a chance to meet and talk with constituents from across our district. https://t.co/sY8F9emLJY,RepDLesko
198,2022-01-25 21:43:00+00:00,1486092262165532672,"I am proud to advocate for @schoolchoicewk, which provides parents and families the option of choosing the best school for their children. #schoolchoiceweek https://t.co/jHyIpqcUUv",RepDLesko
199,2022-01-25 21:24:00+00:00,1486087480692535296,"BREAKING: There were over 2 MILLION illegal border encounters in 2021, yet Biden still won’t go down to the border to see what’s going on. 
 
President Biden can continue to ignore this crisis, but it isn’t going away. #BidenBorderCrisis 
https://t.co/3XoAj5L0Gu",RepDLesko
200,2022-01-25 20:36:03+00:00,1486075414556651522,"In 2016, Biden claimed that Russia’s Nord Stream 2 pipeline will “destabilize Ukraine.” Now, Biden has waived sanctions on the Nord Stream 2 Pipeline as the Keystone XL Pipeline remains cancelled. 
 
Biden has declared war on American energy independence, and he needs to stop it! https://t.co/DiluXnPKeK",RepDLesko
201,2022-01-25 19:23:22+00:00,1486057121858924544,President Biden continually blames everything but his own policies for rising inflation. What is he going to blame inflation on next?,RepDLesko
202,2022-01-25 18:59:00+00:00,1486050990243475456,"What do you get when you don’t prosecute criminals who steal under $950? Emboldened criminals and blatant robberies like this that make our nation look like a third-world country.
 
Blue state policies are running up the crime rate and ruining our nation!
https://t.co/cKvcKyZ9rt",RepDLesko
203,2022-01-25 00:27:00+00:00,1485771146175913984,"According to Politico, Capitol Police are running background checks on people, including visitors &amp; staff, who meet with lawmakers. There must be a hearing on this to determine exactly what is being done and if any constitutional rights are being violated! https://t.co/vc6Ra7C38q",RepDLesko
204,2022-01-24 23:36:00+00:00,1485758311731544066,"Jen Psaki tells Americans who are angry over the state of our nation to get a margarita and go to a kickboxing class.

Are you kidding me? The majority of Americans can’t AFFORD to get a margarita or go to a kickboxing class due to the inflation caused by Biden! https://t.co/6ATt9waaxN",RepDLesko
205,2022-01-24 21:49:00+00:00,1485731384236806146,"President Biden failed Americans on his promise to “crush the virus.” Instead:

→ He shut kids out of the classroom.
→ He imposed unconstitutional vaccine mandates.
→ He constantly gives muddled guidance regarding masks and booster shots. https://t.co/vKMN29uwbI",RepDLesko
206,2022-01-24 20:16:00+00:00,1485707980096086025,"After a year of witnessing President Biden’s actions in office, it is safe to say that he runs a pretty tight shipwreck! https://t.co/FnOSJtLwzG",RepDLesko
207,2022-01-24 19:24:00+00:00,1485694893754228737,"I know you shouldn’t brag about going to expensive places, but this morning I went to one: the gas station.

Gas in Arizona is now $3.57 per gallon thanks to Biden’s war on American energy!",RepDLesko
208,2022-01-24 18:47:00+00:00,1485685582651179008,I am a proud supporter of #schoolchoiceweek! A child’s education should not be determined by their zip code. Parents should have the power to decide the best type of education for their child! https://t.co/OKIvccmdoU,RepDLesko
209,2022-01-24 17:46:24+00:00,1485670332279177218,"Biden heads to ANOTHER vacation as Americans in Ukraine are struggling to evacuate. 
 
Biden was also on vacation when the American embassy in Afghanistan was evacuated. 
 
This is one of the many reasons Biden’s approval ratings are heading down to the center of the earth! https://t.co/AcOgWVwB5z",RepDLesko
210,2022-01-24 00:29:00+00:00,1485409261643608065,"Ending the pre-born’s life shouldn’t be:

- Subsidized.
- Legal.
- Celebrated.",RepDLesko
211,2022-01-23 19:27:59+00:00,1485333510269415431,"After Biden made senseless comments regarding Ukraine during his press conference, Biden poured a giant can of gasoline on the fire by saying NOTHING when reporters asked him about the Ukrainian president's comments that “there are no minor incursions.” https://t.co/GMUostnmLC",RepDLesko
212,2022-01-23 16:16:00+00:00,1485285194227609603,"I sponsored the Born-Alive Abortion Survivors Protection Act, which requires doctors to give medical attention to a baby born alive after a botched abortion.

Democrats have prevented this bill from coming to the house floor over 80 times!",RepDLesko
213,2022-01-22 22:46:58+00:00,1485021198106963968,"In an @HouseCommerce subcommittee hearing, I question Federal Energy Regulatory Commission Chairman Blick on pipeline review decisions, development timelines, and preventing pipeline project cancellations. Pipelines are crucial to American energy independence! https://t.co/ghde99YOe2",RepDLesko
214,2022-01-22 20:24:05+00:00,1484985239646650368,"“Before I formed you in the womb I knew you, before you were born I set you apart.” Jeremiah 1:5

What can be more important than protecting every God-given human life? WATCH as I discuss with @family_policy why it’s important to fight for the sanctity of human life every day. https://t.co/GZppJEmL53",RepDLesko
215,2022-01-22 19:47:00+00:00,1484975906292645891,Every life is a precious gift from God. I reintroduced the Dismemberment Abortion Ban Act last year to prohibit dismemberment abortions. The preborn are the most vulnerable among us. https://t.co/2AWUZs00uD,RepDLesko
216,2022-01-22 18:58:00+00:00,1484963575038947328,Democrats in Congress want to abolish the nearly 50-year-old Hyde Amendment. This would force American taxpayers to fund abortions!,RepDLesko
217,2022-01-22 18:24:00+00:00,1484955018629419010,BREAKING: A Texas federal judge has temporarily BLOCKED Biden’s brazenly illegal COVID-19 vaccine mandate for federal workers. https://t.co/zs6pglFWnG,RepDLesko
218,2022-01-22 17:35:03+00:00,1484942702118637568,"As we mark the 49th anniversary of Roe v. Wade today, I am proud to join @RepTedBudd and @RepRalphNorman's resolution recognizing today, January 22, as National Sanctity of Human Life Day. I am committed to protecting human life at every stage.
https://t.co/113ZoHGOri",RepDLesko
219,2022-01-22 01:39:00+00:00,1484702101984874496,"Today, our office attended Goodyear Mayor Georgia Lord’s Celebration of Life to honor her life and legacy. She is greatly missed and will be remembered as a great leader and role model. https://t.co/3YBlwxu84f",RepDLesko
220,2022-01-22 00:37:00+00:00,1484686499283013634,"BREAKING: TSA confirms they are allowing illegal immigrants to use arrest warrants as I.D. at airport security checkpoints in a statement to Fox News.

They should be entering a jail, not an airplane, if they have an arrest warrant. This is insanity! https://t.co/PMHZKRPgEt",RepDLesko
221,2022-01-22 00:01:11+00:00,1484677484834656262,Policy and culture changes have shattered the myth that women and babies have competing interests. #ProtectLifeEmpowerWomen https://t.co/NjPJdGJseZ,RepDLesko
222,2022-01-21 23:17:00+00:00,1484666366586204163,You could not create a better advertisement for Republicans to take back the House this year than the Democrats’ own actions. https://t.co/cfVhJuClD3,RepDLesko
223,2022-01-21 22:44:40+00:00,1484658232706666498,I enjoyed speaking at the March for Life Action Breakfast this morning! I discussed how I am fighting each day to protect the sanctity of life and how just one person can change someone’s mind about abortion. Thank you to everyone who works to spread the pro-life message! https://t.co/Z3ACigZTrO,RepDLesko
224,2022-01-21 22:42:16+00:00,1484657626273259525,"Americans don’t want the government laundering their hard-earned tax dollars to abortion providers. I will always defend the sanctity of life, especially for the most vulnerable. https://t.co/Mhzsfiotbz",RepDLesko
225,2022-01-21 22:03:17+00:00,1484647816349769736,"Each preborn baby is a human life, not a “clump of cells.” There should be NOTHING controversial about defending the lives of our most vulnerable. I will always stand for defending life! #EmpowerWomenProtectLife https://t.co/6i5ZyaWRoQ",RepDLesko
226,2022-01-21 20:09:40+00:00,1484619221740961797,"I’m glad to hear that another company involved in semiconductor production is coming to Arizona’s 8th Congressional District! This will bring in new jobs, grow our local economy, and help address the chip shortage.
https://t.co/CxWvJos2Ux",RepDLesko
227,2022-01-21 18:49:32+00:00,1484599057339326469,"Now that Biden has finally done a press conference after nearly 80 DAYS, I guess that means we’ll tune into his next press conference in the spring, and that’s if we are lucky! https://t.co/aFebJ3ip52",RepDLesko
228,2022-01-21 17:24:00+00:00,1484577531529502721,"After Biden’s first year in office, now we know why Biden always says that “America is back.” 
He meant “America is back” as in America is back to the 80s!
https://t.co/SRbUWwP82o",RepDLesko
229,2022-01-21 17:06:00+00:00,1484573001467060229,"American families, workers, and businesses are suffering from Democrats' policies, which have led to the highest inflation in 40 years.

The only type of policy that Democrats excel at is lousy policy.",RepDLesko
230,2022-01-21 16:40:10+00:00,1484566499645865985,"I attended a press conference with @GOPLeader, @SteveScalise, @RepStefanik, and other @HouseGOP colleagues to call out the many crises that our nation is facing as a DIRECT result of failed leadership under a year of one-party rule. https://t.co/wa0s3rcOo4",RepDLesko
231,2022-01-21 15:23:07+00:00,1484547109147889666,"There is a typo in this tweet. Replace “Senate Republicans block voting rights bill” with...
 
“Senate Republicans block the Democrats’ bill that would rig elections in the Democrats’ favor and fund their own elections.” https://t.co/KWFkdE6Krj",RepDLesko
232,2022-01-21 00:47:56+00:00,1484326863526764552,"Why is it that Dems suddenly wish to abolish the filibuster now that it is convenient for them? Why did they advocate for the filibuster when it was convenient for them? 
 
Because Dems want the POWER to ram their radical agenda through Congress!
https://t.co/uf6v8Z2jhN",RepDLesko
233,2022-01-20 19:47:00+00:00,1484251130779652098,"🚨 GOOGLE’S CENSORSHIP EXPOSED! 🚨

A member of my staff googled ""OANN program schedule” but only made minor typos to “program schedule.” The search results showed CNN's TV schedule. Yet, if the same typo is made with CNN instead of OANN, the results make no difference! https://t.co/nHLoe8M3sY",RepDLesko
234,2022-01-20 19:07:00+00:00,1484241064261206019,"Americans must show valid identification to board a plane, but illegal migrants do not. Americans have tighter flight security regulations than illegals. This poses a national security risk for Americans! https://t.co/nJek3zeXHN",RepDLesko
235,2022-01-20 18:24:00+00:00,1484230242960961536,"CHINA unleashed COVID-19 onto the world. As a result, MILLIONS of lives have been unjustly taken! Everyone knows a friend or family member who has gotten COVID-19.

Why has the Biden Administration refused to hold China accountable or cut ties with them? #ChinaLiedAmericansDied https://t.co/QwrMW0OB4I",RepDLesko
236,2022-01-20 17:58:00+00:00,1484223699775414272,"Just under a year of one-party rule, at least 16 U.S. cities have set new homicide records in 2021. Democrats’ failed policies and defund the police rhetoric have led to this! #BidenCrimeCrisis https://t.co/V0Gdx9ffX8",RepDLesko
237,2022-01-20 17:25:43+00:00,1484215577522675717,"EXCELLENT NEWS: According to a recent Gallup poll, Americans realize that Democrat policies don’t work. Republican policies work.

Q1: Democrats +9
Q4: Republicans: +5

This is the largest one-year swing in 30 years! ⬇️ https://t.co/pVY3Tw1Dzj",RepDLesko
238,2022-01-20 16:07:00+00:00,1484195765836652549,"President Biden’s solution to his record-high inflation levels is a multi-TRILLION dollar spending package. Biden still doesn’t realize that more spending will further exacerbate inflation.

Americans CANNOT afford another reckless spending bill by Democrats!",RepDLesko
239,2022-01-20 15:44:02+00:00,1484189988455473154,"WATCH my full interview on @OANN with @NatalieJHarp where I talk about Democrats’ hypocrisy to advocate for a vaccine passport with an ID to get into a restaurant, but not to vote. I also discuss Democrats’ Freedom to CHEAT Act. ⬇ https://t.co/RZHHvG9J5A",RepDLesko
240,2022-01-20 01:38:00+00:00,1483977074624942081,"Biden claims his report card looks “pretty good.” Remember Biden’s:

- Border crisis?
- Economy crisis?
- Energy crisis?
- Education crisis?
- Crime crisis?
- COVID crisis?
- Afghanistan crisis?

The list goes on! “Pretty good”? I’d say pretty disastrous! #BidenPressConference https://t.co/0jJNlzEDzE",RepDLesko
241,2022-01-20 01:23:00+00:00,1483973299881361408,"Democrats don’t want law and order. Democrats want open borders, amnesty, and voting for illegal immigrants. WATCH my remarks below at @GOPLeader's Republican Roundtable on how Democrats refuse to work with my Republican colleagues and I to SECURE our borders: https://t.co/bJbyKDqiUV",RepDLesko
242,2022-01-20 01:17:00+00:00,1483971789873049607,"The policies of the Biden Administration and my Democratic colleagues are incentivizing people to cross the border illegally! WATCH as I discuss the #BidenBorderCrisis at @GOPLeader's Republican Roundtable on ""Law and Order."" ⬇ https://t.co/YV5nQsBCxZ",RepDLesko
243,2022-01-20 00:59:00+00:00,1483967259903152140,"During Biden's first year in office:

• Gas, grocery, and utility prices have soared.
• Criminals keep crossing through our open borders.
• Human and drug trafficking are at record highs. https://t.co/TTnwGJkA4U",RepDLesko
244,2022-01-20 00:46:00+00:00,1483963991089160194,"President Biden claims to have not overpromised. Didn’t he promise to “shut down the virus”? The only thing Biden has shut down is the American people’s confidence in Democrat leadership! #BidenPressConference

https://t.co/uTOYKwcptm",RepDLesko
245,2022-01-20 00:29:15+00:00,1483959774681214980,President Biden is proud of getting the number of vaccinated Americans from 2 million to 210 million. The vaccine was barely on the market when he took office! Biden needs to get serious. #BidenPressConference,RepDLesko
246,2022-01-19 23:35:53+00:00,1483946343102095360,"President Biden claims he has OUTPERFORMED what anyone thought was possible in his first year in office.

Well, he isn’t lying… I didn’t imagine this much damage being done to our nation in just one year! #BidenPressConference",RepDLesko
247,2022-01-19 21:53:00+00:00,1483920453047566340,"My office recently presented @Thrive_az with a Congressional Recognition for all of the great work they have done to help keep families in our community together. When times are tough, it's great to see people step up to help one another. Read more HERE: https://t.co/Sc85FJyELp",RepDLesko
248,2022-01-19 17:19:16+00:00,1483851564204892164,I am proud to earn an A+ on the @SBAList #ProLife Scorecard! The pre-born are the most vulnerable among us. I will always fight to protect innocent human life. https://t.co/I2QpAvO9WD,RepDLesko
249,2022-01-19 16:11:39+00:00,1483834549725544448,"President Biden declared a proclamation against human trafficking, yet the largest source of human trafficking is from Biden's open border policies. In a letter to Biden, I called him out for his human trafficking hypocrisy! https://t.co/scsNFgwky7",RepDLesko
250,2022-01-18 23:07:46+00:00,1483576881454755842,"Instead of addressing the energy crisis on their own soil, Democrats are emboldening Putin to expand Russian control over Europe's energy markets. Meanwhile, Democrats shut down the Keystone XL pipeline and killed American jobs. #BidenEnergyCrisis
https://t.co/V0rPFbYLV1",RepDLesko
