,Datetime,Tweet Id,Text,Username
164,2021-06-14 18:11:12+00:00,1404501694277431301,"Since its adoption in 1777, the American flag has served as a beacon of hope, freedom, and prosperity. Today, we celebrate #FlagDay to honor the stars and stripes and to commemorate our pursuit of building a more perfect union. https://t.co/zU3XpmX8e7",repdavidscott
165,2021-06-13 13:30:00+00:00,1404068540261539840,"🚨 All Georgians 12+ are currently eligible for COVID-19 vaccinations. If someone you know is still seeking an appointment, please visit https://t.co/tmDUusfiYG or call my office at 770-210-5073. #VaccineMonthOfAction https://t.co/BShwCWmwds",repdavidscott
166,2021-06-12 13:38:12+00:00,1403708213845970947,We remember today the 49 lives taken four years ago in the tragic Pulse nightclub massacre. We must continue to condemn violence against LGBTQ people — and demand the common-sense reform needed to stem the rising tide of gun violence in America. https://t.co/DwL0PL1bCR,repdavidscott
167,2021-06-12 13:06:07+00:00,1403700140444164100,"Today, as we remember the landmark ruling in Loving v. Virginia 54 years ago and reflect on the historic story of Richard and Mildred Loving, we are reminded of the ongoing fight for equal rights and liberties for all, regardless of race, gender, orientation or creed. https://t.co/BXJDcfpW6F",repdavidscott
168,2021-06-11 14:59:10+00:00,1403366200088858624,Do you or someone you know need support working with a federal agency? Visit https://t.co/J21zCt969a to learn more about how my office can assist you.,repdavidscott
169,2021-06-11 14:59:09+00:00,1403366198205718528,"This week, my office was able to help Addie S. from Mableton, GA get in touch with the Department of Education to clarify an issue. https://t.co/T0nlirQpw1",repdavidscott
170,2021-06-10 20:46:05+00:00,1403091118313676807,"Tens of thousands of American citizens born in another country call GA-13 home, and I am proud to recognize #ImmigrantHeritageMonth to celebrate the diversity, culture and traditions that they bring to our communities. https://t.co/8i423InS32",repdavidscott
171,2021-06-09 22:25:00+00:00,1402753625236049921,"Today, I am proud to announce that the $19 million that I requested for local infrastructure projects in GA-13 has been included in the upcoming INVEST in America Act. https://t.co/N2MUmrGC6K https://t.co/3j213Ri9qO",repdavidscott
172,2021-06-09 19:32:13+00:00,1402710140558757892,"Hundreds of @DCGASchools students have transformed their lives at @WGTC through the power of technical education. These union-backed training programs lead to high-quality jobs right here at home, and it’s time for Congress to expand, strengthen &amp; diversify their talent pipeline. https://t.co/WjYcgRILL0",repdavidscott
173,2021-06-08 19:24:32+00:00,1402345820041646086,"Today, I joined leaders from the Atlanta North Georgia Labor Council (IBEW), SMART Transportation Georgia, local education leaders and elected officials at @WGTC to discuss the importance of Registered Apprenticeships for young black professionals in GA-13 and across the nation. https://t.co/GnOFxeBZwp",repdavidscott
174,2021-06-04 20:17:46+00:00,1400909665253445634,A secure and resilient food and agricultural supply chain is critical to the nation’s welfare and national security. I will be working closely with USDA and @POTUS to get to the bottom of the recent cybersecurity attack on JBS. https://t.co/xI0WP0WOQB,repdavidscott
175,2021-06-04 16:59:08+00:00,1400859679106940930,"Congress must do more to ensure the safety of our communities, and I call on the Senate to swiftly take up the reform measures that passed in the House of Representatives earlier this year. 

Together, we can save lives.",repdavidscott
176,2021-06-04 16:59:08+00:00,1400859676837699584,"I am proud to #WearOrange today in support of a future free from gun violence. The tragedy brought into communities, families and neighborhoods by gun violence is preventable. https://t.co/VuHAoz7uku",repdavidscott
177,2021-06-02 13:28:48+00:00,1400081968444936193,"Thank you for giving us a call, Sheita!
 
Do you need assistance with a federal agency? For more information on how my office can be of service to you and your community, visit https://t.co/UWlNLPPO5n. https://t.co/BPpQFIoVjY",repdavidscott
178,2021-06-01 21:42:46+00:00,1399843891709452290,"Our laws must protect the rights of all of our neighbors to live open, honest and free lives without fear of discrimination or harassment. I am proud to be an ally in this fight.",repdavidscott
179,2021-06-01 21:42:45+00:00,1399843887573778432,"This #PrideMonth, I am proud to celebrate decades of progress in the long struggle toward equality and inclusion for LGBTQ people in GA-13 and across the nation. https://t.co/X5erhlYu1W",repdavidscott
180,2021-06-01 17:10:09+00:00,1399775285881475074,"Thank you @RepHankJohnson, for your leadership in commemorating the survivors of the Tulsa/Greenwood Massacre. https://t.co/9p1YTutZud",repdavidscott
181,2021-06-01 16:57:36+00:00,1399772128803688453,"As we reconcile with our nation’s troubling past and work toward a future that is free from racial violence, we commemorate the courageous survivors of the Tulsa Race Massacre and recommit to our shared fight for social justice, peace and prosperity for all Americans.",repdavidscott
182,2021-06-01 16:57:36+00:00,1399772126769516547,"One hundred years ago today, in one of the darkest chapters of American history, hundreds of Black Americans were killed and thousands of Black businesses, homes and livelihoods were destroyed by a white mob in the Greenwood neighborhood of Tulsa, Oklahoma. https://t.co/gRSNjYAEl2",repdavidscott
183,2021-05-31 13:02:24+00:00,1399350550781644800,Wishing you and your family a Happy #MemorialDay! Please stay safe and take time to remember our fallen heroes from Georgia’s 13th Congressional District and across the country who made the ultimate sacrifice and gave their lives in uniform for our freedom. https://t.co/4l1wTCfaok,repdavidscott
184,2021-05-27 20:17:04+00:00,1398010385530228746,Thank you also to each of our community partners for investing in the bright futures of our young artists. https://t.co/1aEfKDaqo9,repdavidscott
185,2021-05-27 20:17:03+00:00,1398010382611005448,"From the bottom of my heart, I would like to thank every student who submitted their artwork for this year’s GA-13 Congressional Art Competition. Congratulations to this year’s winners—what a wonderful display of talent! https://t.co/tGLZPHZsnU",repdavidscott
186,2021-05-27 17:27:10+00:00,1397967629214797828,"We mourn the loss of Clayton County Commissioner Sonna Singleton Gregory. Over more than a decade of public service, Commissioner Singleton dedicated her time and talent to uplifting our communities as a champion for women, the arts and working families. She will be missed.",repdavidscott
187,2021-05-26 16:38:32+00:00,1397593001807994889,My colleagues and I will continue the fight to ensure our constituents receive the help they need and the transparency they deserve.,repdavidscott
188,2021-05-26 16:38:31+00:00,1397592999589199878,"Yesterday, I led members of the Georgia Congressional Delegation in a letter to Georgia Department of Labor (DOL) Commissioner Mark Butler, urging GDOL to share its plan to address backlogged unemployment benefits for Georgians. https://t.co/eU64rWC9WB",repdavidscott
189,2021-05-26 13:29:40+00:00,1397545472437456896,"Georgia, #WeCanDoThis. 

Currently, over 7 million shots have been administered in the state and 31% of the population is fully vaccinated, but we can’t stop now in the fight against COVID-19. Visit https://t.co/py5GdfbqJs to find a COVID-19 vaccination site near you! https://t.co/xZVockIFuD",repdavidscott
190,2021-05-25 18:30:42+00:00,1397258843688775680,"One year ago, George Floyd’s murder challenged us all to demand accountability for police violence in America. Let’s get the George Floyd #JusticeinPolicing Act signed into law and make clear once and for all that no one should be above the law because they wear a badge. https://t.co/iUEpA6ETIC",repdavidscott
191,2021-05-24 14:39:14+00:00,1396838206092595203,"This legislation closes a dangerous loophole used to block competition, drive up prescription prices and prevent innovative treatments from coming to market.",repdavidscott
192,2021-05-24 14:39:14+00:00,1396838203089461248,"#ICYMI: Lawmakers on both sides of the aisle agree: misuse of the Orphan Drug Act has deadly implications. Last week, I was proud to join my colleagues and pass the Fairness in Orphan Drug Exclusivity Act to help ensure drug developers play fairly. https://t.co/At6osXfXlA",repdavidscott
193,2021-05-21 16:25:18+00:00,1395777734236950529,"#HR3445 puts forth pragmatic solutions to help #ClosetheEmploymentGap and curb the barriers Black workers face toward participation in registered apprenticeships. 

Read more: https://t.co/WteLPfIEra https://t.co/2RLKCIEpdY",repdavidscott
194,2021-05-20 19:41:49+00:00,1395464801598558209,"Congressman David Scott (GA-13), today issued the below statement following the announced closure of the Irwin County detention center as mandated by the Biden administration. https://t.co/F5SURdsbKM",repdavidscott
195,2021-05-19 18:02:35+00:00,1395077438904930306,"This legislation will begin the work of closing the longstanding gaps in banking access and ensure every American has a fair shot at the opportunity, capacity and resources needed to achieve financial stability.",repdavidscott
196,2021-05-19 18:02:34+00:00,1395077436509990913,"Yesterday evening, I was pleased to join my House colleagues in voting to pass my Financial Inclusion in Banking Act. https://t.co/NKrsKTt9WY",repdavidscott
197,2021-05-19 14:36:35+00:00,1395025596611272712,"HAPPENING NOW: @FSCDems are urging prudential regulators to improve diversity and inclusion at America’s biggest banks and ensure an equitable pandemic recovery.
Join us: https://t.co/DW521UXi2I https://t.co/Xa7E6BmYSL",repdavidscott
198,2021-05-17 20:06:34+00:00,1394383866559975424,"Last week, I joined my House colleagues in passing the Comprehensive Debt Collection Improvement Act to address gaps in consumer protections from both predatory debt collection practices and the debt buyers seeking to cash in on this crisis. https://t.co/S7a2bOZVcE",repdavidscott
199,2021-05-11 19:48:04+00:00,1392204882321543179,"I am proud to support @POTUS’ call for Congress to make a historic investment in HBCUs, TCUs and MSIs to ensure that the talent pool in agriculture and STEM fields reflects the diversity of our country. 

Read more: https://t.co/Bj6nefvW6u",repdavidscott
200,2021-05-11 14:43:58+00:00,1392128353013014532,https://t.co/axUM3zC3L6,repdavidscott
201,2021-05-11 14:43:58+00:00,1392128351381463042,"Georgia’s working and middle-class families can breathe easier knowing that with advance monthly payments of the Child Tax Credit, help is here. Families are encouraged to file a 2020 tax return before May 17, 2021, to ensure that the IRS can calculate and issue payments. https://t.co/MRdEfotCaX",repdavidscott
202,2021-05-09 16:25:51+00:00,1391429217821368324,Today we celebrate all of the mothers and grandmothers across the world. You are truly appreciated. Happy Mother’s Day! https://t.co/QpVTQA633h,repdavidscott
203,2021-05-07 19:14:17+00:00,1390746827238952961,"During our recent @FSCDems hearing, I asked SEC Chair Gensler what we can do to make sure that our regulatory system provides adequate protections for retail investors amid rapid technological changes. Read more: https://t.co/vKOz2oK4HQ",repdavidscott
204,2021-05-07 19:14:16+00:00,1390746824525426690,The recent market volatility in the GameStop security exposes a serious hole in our regulatory process. When social media posts and erroneous and inaccurate information move the market more than financial indicators—thousands of investors risk serious consequences. https://t.co/KLlgsRryF7,repdavidscott
205,2021-05-07 16:36:34+00:00,1390707136611635200,"The submissions from this year’s GA-13 Congressional Art Competition are above and beyond, exhibiting exceptional creativity, passion and talent. Watch the virtual ceremony here: https://t.co/7qwWiEmV1j",repdavidscott
206,2021-05-06 21:35:28+00:00,1390419969465364481,"This #NationalNursesDay, I’d like to thank our Thirteenth District nurses for their time and dedication to serving our community. Now more than ever, we value and appreciate their compassion and heroism. https://t.co/9qaV8jSbnf",repdavidscott
207,2021-05-06 15:02:39+00:00,1390321116703494154,"Today at noon, I will join @FSCDems for a virtual hearing entitled, “Game Stopped? Who Wins and Loses When Short Sellers, Social Media, and Retail Investors Collide, Part III”. Tune in: https://t.co/gyWtDMfC8i https://t.co/zOjRXLSuKE",repdavidscott
208,2021-05-05 20:10:05+00:00,1390036096344543235,"Thank you to our GA-13 Teachers! Even when many classrooms went virtual last year, you stepped up to the plate to maintain curriculums and helped keep our students from falling behind. You change the lives of our children every day and we all appreciate you. https://t.co/tFD7z96JHW",repdavidscott
209,2021-05-04 16:21:23+00:00,1389616153929072640,"Protecting our children is vital to the long-term success of our communities, large and small. The expanded child tax credit from the American Rescue Plan will help provide food, shelter, clothing, and other necessities for 180,800 children in Georgia’s Thirteenth District. https://t.co/KAw4R2ayLE",repdavidscott
210,2021-05-03 15:15:25+00:00,1389237166568574978,"Beginning today, restaurants and other food service-related businesses in Georgia can apply for direct relief through the Restaurant Revitalization Fund. Applicants can visit https://t.co/4ZodMuyozj to learn more. https://t.co/Nfu98ZgKCw",repdavidscott
211,2021-04-29 16:45:10+00:00,1387810197834551303,This week I spoke with @AgriPulse about my upcoming priorities as Chairman of the House Agriculture Committee. Read more here: https://t.co/71OA5nIyTZ,repdavidscott
212,2021-04-23 18:58:12+00:00,1385669350389174272,"This #NationalParkWeek, I am proud to celebrate the beauty and significance of America’s national parks, monuments, memorials, and historical sites across the country. 

Learn more at https://t.co/Bg3SGtUNF2.",repdavidscott
213,2021-04-22 14:57:36+00:00,1385246415140556808,"Happy #EarthDay! Today we want to share our appreciation for our farmers, ranchers, and foresters, who protect and preserve our natural resources. https://t.co/Gl8hQFtEg4",repdavidscott
214,2021-04-21 14:27:02+00:00,1384876334288093184,"My staff was able to assist Darlene B. from Smyrna, GA in helping her find the status of her stimulus check. For more information on how my office can assist you, please visit https://t.co/UWlNLPPO5n. https://t.co/GXaA0Ja9MM",repdavidscott
215,2021-04-20 17:13:45+00:00,1384555903639293959,"A fast internet connection isn’t just about streaming videos or playing games – for many rural residents, it‘s the difference between access to telemedicine or online education, or going without. We must ensure that all rural communities have fast and reliable broadband service. https://t.co/NlkogdlAQv",repdavidscott
216,2021-04-16 18:40:06+00:00,1383128082572308485,"This week, I am proud to join @BMHCaucus, @RepAdams, @RepUnderwood, and Senator @CoryBooker in recognizing #BlackMaternalHealthWeek to highlight the importance of reducing maternal mortality and morbidity among Black women and women of color. #BMHW21 https://t.co/9mHU3GhM6c",repdavidscott
217,2021-04-15 21:26:33+00:00,1382807581043929089,"Today, I was proud to vote for the #PaycheckFairnessAct to help bridge the gender wage gap. This legislation is long overdue. It’s time to strengthen workplace protections for women and break harmful patterns of pay discrimination. https://t.co/i1be3qLiRi",repdavidscott
218,2021-04-15 14:06:48+00:00,1382696916941742082,"UPDATE: The IRS has postponed the federal tax filing deadline to May 17, 2021, for individual federal income tax returns and tax payments. Learn more at https://t.co/mVILHvYfAG. https://t.co/5C75NHPfel",repdavidscott
219,2021-04-14 13:57:52+00:00,1382332278316150793,"Housing is essential to the infrastructure of our country. Today, @FSCDems will discuss plans to expand affordable housing options to ensure that housing infrastructure serves our nation for generations to come. 📺: https://t.co/OkCb6W6QiZ",repdavidscott
220,2021-04-13 18:03:48+00:00,1382031784490250243,"Today, I join all Americans in honoring U.S. Capitol Police Officer William ‘Billy’ F. Evans, an 18-year veteran of the Capitol Police, who died in the line of duty on April 2, 2021. https://t.co/9HLnCU4wI0",repdavidscott
221,2021-04-05 20:14:48+00:00,1379165647477866498,"Today, we honor the surviving military spouses who lost loved ones in service to our nation. Their sacrifice and bravery will not be forgotten. #GoldStarSpousesDay https://t.co/9FGxUOBn5d",repdavidscott
222,2021-04-01 17:43:57+00:00,1377678131163725831,"The American Rescue Plan will help Georgians mitigate the negative economic impacts associated with the COVID-19 pandemic. Take a look at some of the key figures that will provide direct financial relief for GA families, workers, schools, and businesses. https://t.co/YYWZ2EYoi3",repdavidscott
223,2021-03-31 13:29:49+00:00,1377251792082366465,"My office was able to assist Devora J. from Stockbridge, GA in recovering her 1099 tax form from the SSA. Assisting with casework is one of the most important duties that I have as your GA-13 Representative, so please call on me and my staff when we can be of assistance to you. https://t.co/gHrj6BYsiL",repdavidscott
224,2021-03-30 20:01:51+00:00,1376988062224412673,"Last week, I was proud to chair a historic hearing to help bring justice to our Black farmers. By addressing the effects of past discrimination, we can improve the state of our entire agriculture industry for generations to come. https://t.co/YzkvNpzwVW https://t.co/fD2bt2JDIO",repdavidscott
225,2021-03-26 02:53:54+00:00,1375279816019214337,"SB 202 is a terrible bill that harks back to the years of Jim Crow, and it is truly unconscionable that in this day and age Georgia State Legislators would attempt to disenfranchise eligible voters.",repdavidscott
226,2021-03-24 18:38:55+00:00,1374792863893049347,"On average, the annual gender wage gap in Georgia is $9,865 for adults working full time. 

The #PaycheckFairness Act could help women cover approximately 6.7 months of health insurance premiums, 1.4 years of childcare, or 4 years of student loan debt. #EqualPayDay https://t.co/saRe8cR5iT",repdavidscott
227,2021-03-23 15:52:17+00:00,1374388539626983433,"Today, I am proud to recognize #NationalAgDay to acknowledge and celebrate the essential role that U.S. farmers have in providing nutritious, abundant, and affordable food for our communities. Visit https://t.co/rEry668sHH to learn more. https://t.co/08un0TSqGK",repdavidscott
228,2021-03-19 15:27:53+00:00,1372932848764776451,"Do you receive my e-Newsletter updates? 

Visit https://t.co/J21zCt969a to sign up to receive regular updates on what’s happening in GA-13. https://t.co/q9DO5A21jD",repdavidscott
229,2021-03-17 19:54:44+00:00,1372275228122955784,The American Rescue Plan’s $10 billion in homeowner assistance supports Georgians and Americans across the nation who are still feeling the consequential financial impacts of the coronavirus pandemic and previous recessions. https://t.co/NtBObz8Mgv,repdavidscott
230,2021-03-17 17:26:42+00:00,1372237975107555328,"Today, we feel the pain and loss throughout Atlanta, as 8 families wake up without their loved ones. May it echo across Georgia and the nation: We must expel hate and discrimination in all its forms.",repdavidscott
231,2021-03-16 22:24:58+00:00,1371950648200159233,"The #AmericanRescuePlan will help Georgians stay in their homes. Direct housing assistance, including funding from my bill that establishes a $10 billion Homeowner Assistance Fund, is on its way. Visit https://t.co/1KQEAGzhIS or call my office for more information. https://t.co/BBykDm9Ayb",repdavidscott
232,2021-03-11 21:45:57+00:00,1370128888609800192,"Today, I was proud to chair a critical bipartisan hearing to take an in-depth look at food insecurity in America. It’s going to take all of us to beat the food crisis in our nation, but today’s panel helped us take a significant step in the right direction. https://t.co/UKfXrs4Wid",repdavidscott
233,2021-03-11 15:56:24+00:00,1370040920876388352,Thank you to @NPRatc for hosting me to talk about aid for farmers of color in the American Rescue Plan. Listen to the full interview at https://t.co/45qNLzA24G https://t.co/15myhr7gcJ,repdavidscott
234,2021-03-10 20:59:51+00:00,1369754901039955970,"@HouseDemocrats heeded Americans’ calls for help by passing the American Rescue Plan. Together, we will put an end to this pandemic, rebuild our economy, safely send children back to school, and get Americans back to work. https://t.co/NyMbzOuzav",repdavidscott
235,2021-03-10 19:49:01+00:00,1369737073104666630,"@HouseDemocrats heeded Americans’ calls for help by passing the American Rescue Plan. Together, we will put an end to this pandemic, rebuild our economy, safely send children back to school, and get Americans back to work. https://t.co/gv8qeluXlG",repdavidscott
236,2021-03-10 13:42:51+00:00,1369644925453668353,"The American Rescue Plan will begin to right the long history of discrimination in agriculture, and I am proud to fight for justice for our Black farmers.",repdavidscott
237,2021-03-10 13:42:51+00:00,1369644924090597376,"The number of Black farmers in the U.S. plummeted from nearly 1 million in 1920 to less than 46,000 almost a hundred years later. They are the original pioneers of American agriculture, and we must make sure to uplift them and make them whole. https://t.co/YLEHwSBDEh",repdavidscott
238,2021-03-09 22:53:43+00:00,1369421167682060297,"I am proud to join @RepAdams in welcoming my alma mater, @FAMU_1887 and our HBCUs to Capitol Hill for the 4th Annual HBCU + STEAM Day of Action. https://t.co/T2xZnBGtD1",repdavidscott
239,2021-03-09 20:00:21+00:00,1369377539282632704,"We are now a year into this public health crisis, and Americans are facing down enormous financial hurdles. Providing this critical assistance will enable struggling families to protect their health from the safety of a warm home with a roof over their heads.",repdavidscott
240,2021-03-09 20:00:21+00:00,1369377537894330372,"Today, I introduced the Coronavirus Homeowner Assistance Act to aid homeowners harmed by the global coronavirus pandemic. https://t.co/PrDB8lEmIb",repdavidscott
241,2021-03-09 14:27:32+00:00,1369293782953365504,"Last weekend, I joined @CCFES and @ClaytonSeniors to distribute 500 doses of the COVID-19 vaccine to seniors in Clayton County. https://t.co/cpKQq5GZ86 https://t.co/0aEen8qcIY",repdavidscott
242,2021-03-08 22:11:30+00:00,1369048156848193542,The passage of SB 241 and its statute to end no-excuse absentee voting is precisely why the Georgia delegation and I expressed concern about voter suppression tactics in our letter to the State Legislature last month. Georgians and our nation deserve better. https://t.co/Irz6QMPAck,repdavidscott
243,2021-03-08 20:48:25+00:00,1369027245193494529,"This #InternationalWomensDay, we honor and celebrate the women in the United States and around the world who paved the way to social, economic, cultural, and political advancements in our global community. https://t.co/A0GGoEvA1H",repdavidscott
244,2021-03-08 01:52:52+00:00,1368741477602521089,"On the 56th anniversary of Bloody Sunday, we remember John Lewis, Rev. C.T. Vivian, and the hundreds of brave souls who marched for justice and equality on the Edmund Pettus Bridge. We will continue to build on their legacy and fight against injustice in our American democracy. https://t.co/oLZ0t72y2V",repdavidscott
245,2021-03-05 16:16:11+00:00,1367871571159900162,Learn more at https://t.co/DrKLb3KyeL,repdavidscott
246,2021-03-05 16:08:48+00:00,1367869715775959046,"Today, my office announced our 18th Annual Congressional Art Competition. High school students who live or attend school in GA-13 are invited to submit artwork to my office by April 16, 2021. https://t.co/huzuMS3b51",repdavidscott
247,2021-03-04 18:02:32+00:00,1367535947336867846,"For far too long, pleas for justice and reform have fallen by the wayside in Congress. The #JusticeInPolicing Act re-imagines what just policing looks like in our country and its passage is a meaningful step towards reconstructing policing in the 21st Century. https://t.co/WSsOU9ajaz",repdavidscott
248,2021-03-04 13:57:26+00:00,1367474268901113859,"I joined @HouseDemocrats in proudly voting to pass #HR1 to ensure security in American elections, improve access to the ballot box, and to restore the Voting Rights Act. #ForThePeople https://t.co/ov7aZXRjX0",repdavidscott
249,2021-03-03 19:28:35+00:00,1367195217011605516,"My staff was able to help Phyllis T. from Hampton, GA, get in touch with the Office of Personnel Management. If you live in the Thirteenth District and need assistance, please contact my office. We are here to serve you. https://t.co/voIgtIgL3M",repdavidscott
250,2021-03-03 14:13:26+00:00,1367115904736251910,"Learn more about the work that my staff and I do in Georgia’s Thirteenth District and in Washington, D.C. by signing up for my Newsletter. Visit https://t.co/KFtCCyzAnV for more information. https://t.co/Xkd02yTcLj",repdavidscott
