,Datetime,Tweet Id,Text,Username
0,2022-02-23 19:10:11+00:00,1496563054963838978,"While @POTUS blames the situation in Ukraine for higher energy prices, the energy crisis goes much farther back. Don't forget that the first thing he did on Inauguration Day was cripple American energy production. The blame rests on his shoulders.

https://t.co/UsU6hi1YaO",repkevinhern
1,2022-02-22 20:38:24+00:00,1496222865800278022,"One thing is clear: weak leadership in the White House ripples across the globe. 

See my full statement on Biden's inadequate response to Putin ⬇️⬇️ https://t.co/udGvzs9PwG",repkevinhern
2,2022-02-22 17:07:49+00:00,1496169873101266944,"Even CNN says Romney was right - 10 YEARS LATER

Obama &amp; Biden mocked him for calling Russia our greatest geopolitical foe. It's been true for well over 10 yrs, but Democrats are just now catching up. 

Biden's incompetence puts every American in danger. 

https://t.co/uqcRmsVfv4",repkevinhern
3,2022-02-22 16:59:25+00:00,1496167756986781698,"Should opportunistic leaders in China or Iran decide to further test the US, it would spell disaster.",repkevinhern
4,2022-02-22 16:59:25+00:00,1496167756055597071,"Putin's received the assurances he wanted regarding Ukraine's NATO status; even before the invasion began, Putin was already the victor. 

He's shown that his tactics work. A weak @POTUS is unable to stop him.",repkevinhern
5,2022-02-22 16:59:24+00:00,1496167755191656456,We're only in this situation because Putin is taking advantage of Biden's weak leadership.,repkevinhern
6,2022-02-22 16:52:13+00:00,1496165944560963591,"Russia is invading Ukraine at this very moment. 

World leaders are speaking out, levying intense sanctions on Russia, but we have heard nothing from @POTUS. 

This is a moment for true leadership. The world is watching. Our allies are watching. 

What will @JoeBiden do?",repkevinhern
7,2022-02-18 14:09:38+00:00,1494675479944740873,"I join countless friends and family members across the country in mourning the passing of @RepHagedorn. He dearly loved his country and dedicated his life to building a better future for the people of Minnesota.

Please keep his loved ones in your prayers.",repkevinhern
8,2022-02-17 20:52:38+00:00,1494414508990898179,".@RepChipRoy is right.  Overreaching COVID-19 policies have been a disaster for our country.  It's time for them to go.  I strongly encourage all of my colleagues in the Senate to vote against any measure that funds vaccine mandates.

https://t.co/OeEcg97OaA",repkevinhern
9,2022-02-14 20:40:23+00:00,1493324261691432962,"It's a shame to see what DC did to small businesses like @thebigboarddc over a ridiculous mandate they reversed days later.

I enjoyed meeting Eric a few weeks ago - a Navy veteran who loves his community &amp; his employees. I hope the city restores his business &amp; gives him justice!",repkevinhern
10,2022-02-13 19:30:00+00:00,1492944161884024832,People are flooding to our southern border from over 160 countries worldwide because the Biden Administration has sent them an open invitation.  Plain and simple.,repkevinhern
11,2022-02-12 23:31:00+00:00,1492642422052077568,"I'm back on @newsmax in a few minutes discussing the dire situation at our Southern border.

It's time for @SecMayorkas to go!",repkevinhern
12,2022-02-12 20:00:01+00:00,1492589328156921857,This Administration has gone as far as allowing illegal immigrants to use arrest warrants as a form of ID to board planes.  Can you imagine if we used a parking ticket to try to get on an airplane?,repkevinhern
13,2022-02-12 18:00:00+00:00,1492559125896744961,This is not just a border issue anymore.  Every state in our country is dealing with this Administration's failures at our Southern Border.,repkevinhern
14,2022-02-12 00:00:00+00:00,1492287333172846593,"I've been to the border multiple times and seen what's going on.  I've seen how effective President Trump's border policies were.  As a leader, you should move forward with policies that have a proven record of success, not repeal them for purely political reasons.",repkevinhern
15,2022-02-11 23:08:37+00:00,1492274403731775489,"The border crisis poses a very real danger to millions of Americans. Biden &amp; Mayorkas continue ignoring it, but Americans are demanding accountability. 

Thanks to @jimmyfailla &amp; @foxnewsradio for having me on to discuss this important topic today!

https://t.co/0WgTEEmGwx",repkevinhern
16,2022-02-11 22:15:00+00:00,1492260909384830976,@SecMayorkas has turned ICE Agents into travel agents.,repkevinhern
17,2022-02-11 21:00:00+00:00,1492242035062947840,@SecMayorkas' lack of action on the Southern Border is literally killing Americans.  It's amazing that this Administration simply will not send anybody down there to see what's actually going on.,repkevinhern
18,2022-02-11 19:26:37+00:00,1492218533442465796,I'll be on @foxnewsradio with @jimmyfailla at 1:35pm CT - there's a lot to talk about today!,repkevinhern
19,2022-02-11 19:10:04+00:00,1492214370583162884,A weak Commander-in-Chief puts the entire world in danger. Our enemies are emboldened &amp; our allies have lost faith in us under Biden's leadership. https://t.co/OuEQIcwePK,repkevinhern
20,2022-02-11 15:54:52+00:00,1492165248303968263,@RepPfluger @RepDLamborn @RepBethVanDuyne @RepCarlos @RepRussFulcher,repkevinhern
21,2022-02-11 15:54:52+00:00,1492165247142146050,@RepJerryCarl @RepTimBurchett @RepBenCline @RepRosendale @RepBarryMoore @RepSpartz @RepHarshbarger @RepBentz @RepJackBergman @RepDLesko @RepRWilliams @RepBobGibbs @RepDonaldsPress @RepLisaMcClain @congbillposey @RepCawthorn @RepGregMurphy @RepRalphNorman @RepChipRoy @RepJohnRose,repkevinhern
22,2022-02-11 15:54:52+00:00,1492165246018072579,@RepBrianBabin @RepAndyBiggsAZ @RepTiffany @RepTomRice @RepClayHiggins @RepHerrell @RepBobGood @RepBoebert @RepScottPerry @RepRonnyJackson @RepGrothman @RepMTG @replouiegohmert @TXRandy14 @RepMaryMiller @RepAndyBarr @RepLoudermilk @RepLaMalfa @RepJacobs @RepDanBishop,repkevinhern
23,2022-02-11 15:54:52+00:00,1492165244633952257,"When a company's employees lose faith in their CEO, it's time to step down. The government should be no different - that's why I led a letter with 45 of my colleagues calling on @SecMayorkas to resign. 

https://t.co/isJv7V2O7C",repkevinhern
24,2022-02-11 13:53:53+00:00,1492134798818947076,I’ll be live on @newsmax in a few minutes - tune in!,repkevinhern
25,2022-02-10 15:09:12+00:00,1491791368280182786,"To recap, in just over one year, #OnePartyOneRule has brought us:
 
❌Highest inflation in 40 years
❌Open southern border
❌Nationwide rise in crime
❌Enough fentanyl in our country to kill every American 5x
❌13 dead American soldiers in Kabul",repkevinhern
26,2022-02-10 14:50:07+00:00,1491786564258521088,".@POTUS wanted an FDR Presidency.  Instead, he's on a fast track to becoming our next Jimmy Carter. https://t.co/4CcoKwZDwa",repkevinhern
27,2022-02-09 18:34:14+00:00,1491480574627876864,"Yesterday, I voted against yet another short-term spending bill that would fund the Department of Labor's unconstitutional vaccine mandate. In October, I pledged to vote against any federal funding for DoL until Biden abandons the mandates - I stand by that commitment.",repkevinhern
28,2022-02-09 16:32:11+00:00,1491449861019176960,"Before @POTUS crippled America's domestic oil &amp; gas production, Oklahoma was a leader in our country's energy sector.  Thanks to his prioritization of foreign energy over domestic production, energy costs are at an all time high, and the American people are feeling the effects. https://t.co/Lh1r8MRUxE",repkevinhern
29,2022-02-08 20:32:32+00:00,1491147961153499137,"Shared my vision for our FY ‘23 Budget with my @RepublicanStudy colleagues today. 

Pelosi has failed to write a budget every year as Speaker, but we have a clear, conservative vision to restore fiscal responsibility &amp; avoid a debt crisis! https://t.co/JZKNW8D8Jr",repkevinhern
30,2022-02-08 18:18:23+00:00,1491114198558195713,"While the Democrats continue to use piecemeal short-term spending measures to inch our government along, the Budget and Spending Task Force, which I chair for @RepublicanStudy, WILL produce ANOTHER balanced budget this year.  Last year we produced the only budget in Congress. https://t.co/Oecg5TlixJ",repkevinhern
31,2022-02-07 21:25:07+00:00,1490798803343101961,"Fentanyl is now the leading killer of Americans aged 18-45.  The opioid crisis is at an all-time high, our Southern Border is wide open, and the Biden Admin’s solution is to use leftover COVID-19 relief funds to send people drug paraphernalia.  Unbelievable. https://t.co/tMo79Aw5PE",repkevinhern
32,2022-02-07 18:11:57+00:00,1490750195113541639,"How can millions of Americans across our country be expected to go along with constantly changing rules and regulations when members of the party that controls 2/3 of the government won’t practice what they preach?

https://t.co/DLYGaEulMS",repkevinhern
33,2022-02-04 20:01:42+00:00,1489690650111008769,"It’s a shame we cannot pass a clean bipartisan bill to accomplish a very bipartisan goal, but this is par for the course with Speaker Pelosi.",repkevinhern
34,2022-02-04 20:01:42+00:00,1489690649108619273,"Our number one priority in any bill targeting China should be to limit the threat from the CCP. Unfortunately, the Democrats’ bill did very little to combat China, but included many progressive wish-list items from the Green New Deal.",repkevinhern
35,2022-02-04 20:01:42+00:00,1489690647984549889,"Today I voted against the America CONCEDES Act.  Every member of this Congress recognizes the imperative need for the United States to be the preeminent global power, and the threat China poses the U.S.",repkevinhern
36,2022-02-04 16:33:49+00:00,1489638332153929733,"Thank you to my good friend @SteveScalise for the cake celebrating the passage of my bill, H.R. 1298, to rename the Owasso Post office after 1st District hero Technical Sergeant Marshal Roberts! https://t.co/0q6bLVAwqr",repkevinhern
37,2022-02-03 21:42:20+00:00,1489353585452273665,"Americans fight for freedom and defend the voiceless - if our athletes can't display those American values while representing @TeamUSA in the Olympics, why are we there at all?

https://t.co/3NC4ChDNgm",repkevinhern
38,2022-02-03 21:16:17+00:00,1489347032645046280,Pretty soon we're going to run out of characters to fit all of Biden's crises in one tweet.,repkevinhern
39,2022-02-03 18:57:57+00:00,1489312219313623043,"Human trafficking is morally wrong, illegal, and a huge issue at our southern border.  Biden's open border policies have exponentially worsened the problem.  ANY company who is complicit in the smuggling of human beings in ANY regard is on the side of the cartels - not America. https://t.co/dTeatWfSzj",repkevinhern
40,2022-02-03 17:55:07+00:00,1489296405164404736,"This Administration is continuing to lie to the American people with the goal of passing trillions of dollars in progressive wish-list spending.  Unfortunately for them, the American people are smarter than that. https://t.co/zHCPmZK1UW",repkevinhern
41,2022-02-03 17:44:26+00:00,1489293716850360325,"I, along with nearly 50 of my fellow Republican lawmakers, also recently signed a letter led by @RepChipRoy reaffirming our commitment to vote down ANY measure that provides funding for vaccine mandates.  We will not stop until the mandates are wholly abandoned.",repkevinhern
42,2022-02-03 17:44:26+00:00,1489293715709607937,"I have been opposed to all federal vaccine mandates since their inception.  In November, I led a press conference with over 30 of my colleagues where we affirmed our commitment to stand against this heinous attempt at government overreach from the Biden Administration.",repkevinhern
43,2022-02-02 22:17:58+00:00,1489000165243604994,Handing off this special bill to @SenatorLankford to get through the Senate and onto @POTUS’s desk! https://t.co/Qm8shlAraS,repkevinhern
44,2022-02-02 20:35:16+00:00,1488974321456496640,"America is facing a mental health crisis - among countless others that have arisen during the past year of one party, one rule.  Today I had the opportunity to question witnesses at the @WaysandMeansGOP hearing on the Mental Health Crisis in America.  Watch below 👇 https://t.co/1BLyCqSkxR",repkevinhern
45,2022-02-02 19:31:54+00:00,1488958374754590721,"Democrats have taken an agreeable, bipartisan idea - increasing socioeconomic competition with China - and produced a partisan progressive wish-list bill.  Unfortunate, but typical of our current leadership.  #AmericaCONCEDESAct",repkevinhern
46,2022-02-02 14:36:12+00:00,1488883956758069251,Returning jobs that were lost due to the pandemic is NOT the same as job growth. https://t.co/nD8UaGSBRM,repkevinhern
47,2022-02-02 12:45:53+00:00,1488856194785628160,"As Oklahoma prepares for a major winter storm, be alert for the possibility of power outages and other risks that accompany a storm like this. Please visit https://t.co/qzePGp1qJC for more info on best practices during inclement weather. Stay safe!",repkevinhern
48,2022-02-02 01:52:03+00:00,1488691653452111873,"DC is shutting down a veteran-owned small biz for the crime of welcoming everyone, regardless of vax status.

It’s sad to see good people who care about their employees &amp; customers like Eric treated so badly by @MayorBowser

@thebigboarddc @timburchett @RepRonnyJackson @RepSpartz https://t.co/4hBaTGYTTJ",repkevinhern
49,2022-02-01 21:48:40+00:00,1488630405112676356,"Our national debt has just hit a mind-boggling $30 TRILLION.  Instead of trying to alleviate that debt, the only pieces of legislation that Democrats have introduced and passed the House this year increase it, crippling generations to come.

https://t.co/0In8TQfnj1",repkevinhern
50,2022-02-01 21:17:59+00:00,1488622682333761541,Very proud to report that my bill to rename the Owasso Post Office after Oklahoma hero Technical Sergeant Marshal Roberts has passed the House!  This small but meaningful gesture will ensure that his heroism and sacrifice are remembered for generations to come. https://t.co/hKKY9gqrfv,repkevinhern
51,2022-02-01 20:17:51+00:00,1488607550740344844,"About to speak on the House floor about my bill to rename the Post Office in Owasso after the late Technical Sergeant Marshal Roberts - tune in! 

https://t.co/tjtNoAXfvv",repkevinhern
52,2022-02-01 19:32:58+00:00,1488596254393311236,Truckers kept our country running while most other industries were shut down; they’re the lifeblood of this country and continent.  I’m proud to stand with our Canadian friends fighting for their freedoms!  Stripping people of their livelihood over this personal choice is WRONG.,repkevinhern
53,2022-01-27 22:09:34+00:00,1486823725555232769,Thank you! Oklahoma will always stand with our friend Israel. https://t.co/Th40CGOYvo,repkevinhern
54,2022-01-27 18:00:01+00:00,1486760922508980227,"Today is International Holocaust Remembrance Day. On this solemn day of reflection, we remember the millions of innocent lives taken in the 1930s and 1940s, as well as reaffirm our responsibility to fight antisemitism in all forms. https://t.co/8mi9vLV0Ze",repkevinhern
55,2022-01-27 16:17:03+00:00,1486735009037828099,"Congratulations to the Bixby Middle School Cheerleading Team on winning the NCA National Championship!  Go Spartans!
 
https://t.co/1WKEyE4x7G",repkevinhern
56,2022-01-26 19:57:58+00:00,1486428217544167429,Happy birthday @GOPLeader!  I look forward to continuing to work with you to improve America! https://t.co/cldnUzmCap,repkevinhern
57,2022-01-26 19:09:58+00:00,1486416137348866055,Happy National School Choice week! I'm a staunch believer that parents know what's best for their children and have a right to be involved at every level of their education.  #SchoolChoice,repkevinhern
58,2022-01-26 14:17:17+00:00,1486342484468842509,@CoachMarley Congratulations Caden!,repkevinhern
59,2022-01-24 21:48:24+00:00,1485731233510342658,I hope that the President can figure that out before our global competitors take advantage of his willful lack of action.,repkevinhern
60,2022-01-24 21:48:23+00:00,1485731232336035847,"My fellow Republicans and I remain committed to our international allies and will condemn acts of aggression from those who wish them harm, even if the White House refuses to do so. Appeasement is not a rational or sustainable policy – deterrence through strength is.",repkevinhern
61,2022-01-24 21:48:23+00:00,1485731231178313729,"At his press conference last week, the same man said that he would possibly tolerate a “minor incursion” into Ukraine.  Now, Russian forces are positioned along their border, poised to invade at any time. It’s clear what Mr. Putin thinks of our esteemed Commander-in-Chief.",repkevinhern
62,2022-01-24 21:48:23+00:00,1485731229949476865,It's almost hard to remember the Joe Biden who said on the campaign trail: “Vladimir Putin doesn’t want me to be President… because I’m the only person in this field who’s ever gone toe-to-toe with him.”  What a change a year makes.,repkevinhern
63,2022-01-24 21:48:23+00:00,1485731228871442433,"To our enemies around the world, it proved that our current leadership has weakened our resolve – America is not the international superpower we used to be.",repkevinhern
64,2022-01-24 21:48:22+00:00,1485731227671928833,"Thanks to the President’s weak leadership, our enemies are emboldened, &amp; our allies are losing faith in us. Our catastrophic withdrawal from Afghanistan resulted in the deaths of US servicemembers and our Afghan allies, leaving the country in the hands of a terrorist regime.

🧵",repkevinhern
65,2022-01-20 17:40:01+00:00,1484219174394150915,"Yesterday, the President said he probably “overperformed” expectations in his 1st year, but his approval rating is 33%: the lowest first-year approval rating for any President in history.  His presidency is defined by failure, &amp; his party will see the consequences this November.",repkevinhern
66,2022-01-20 17:40:00+00:00,1484219173085630470,"Biden promised that he'd “end the opioid crisis”. Due to his negligent border policies, the cartels have near-total control. Fentanyl is flowing into our country at the highest volumes ever &amp; it is now the leading cause of death for Americans aged 18-45.

https://t.co/LOMpMXSMWK",repkevinhern
67,2022-01-20 17:40:00+00:00,1484219171638550537,"Biden promised to remove all Americans from Afghanistan. After a disastrous and poorly planned withdrawal, there are currently hundreds of Americans still stranded and 13 American servicemembers dead. 
 
https://t.co/N4LwS1eYgk",repkevinhern
68,2022-01-20 17:40:00+00:00,1484219170187268105,"Biden promised to advocate for the American worker, but his policies are harming working class Americans the most. Due to #Bidenflation, real wages have shrunk by at least 3%, and American families are paying an average of $3,500 more on basic goods.
 
https://t.co/6lL0lw64CF",repkevinhern
69,2022-01-20 17:40:00+00:00,1484219169096798211,"Biden said he would not mandate vaccination against COVID-19.  8 months later, he reversed course. If it weren’t for the Supreme Court, all businesses with 100+ employees would be forced to comply. His mandate on the healthcare sector remains in place.",repkevinhern
70,2022-01-20 17:39:59+00:00,1484219167721115657,"Biden promised to “shut down the virus, not the country”.  A year later, more Americans have died of COVID-19 during his presidency than under the previous Administration, and our economy remains stagnant under Biden’s punitive economic policies. 
 
https://t.co/QmvZ6q79FV",repkevinhern
71,2022-01-20 17:39:59+00:00,1484219165909172238,"Biden promised to unify our country &amp; said we “have to stop treating our opponents as enemies”. Now, the country is as divided as ever, and the President continues to stoke that flame with repeated attacks on the Americans who disagree with his agenda.  

https://t.co/HlwlEElmG3",repkevinhern
72,2022-01-20 17:39:58+00:00,1484219164730482699,"Today marks the 1-year anniversary of Joe Biden’s Presidency.  During his campaign, the President made numerous grandiose promises to the American people.  After 365 days in office, let’s see how it’s going: 

🧵",repkevinhern
73,2022-01-20 17:01:04+00:00,1484209375095017472,"Proud to stand with @GOPLeader, @SteveScalise, and @HouseGOP as we look back on President Biden’s disastrous first year in office.

We will continue to fight everyday for the American people. https://t.co/SHnhr8gplP",repkevinhern
74,2022-01-20 15:41:34+00:00,1484189366461210630,"A President's words carry immense weight. No amount of cleanup from White House staff will change the alarming comments @POTUS made about Ukraine &amp; Russia yesterday. Our allies and friends must be able to trust us, but this president continues to prove we are an unreliable ally.",repkevinhern
75,2022-01-19 22:23:19+00:00,1483928081261895689,"How can the President possibly claim that he's gotten the ""critical crises"" out of the way when inflation is reaching the highest levels it's been in 40 years, our southern border is wide open, and our store shelves are empty?",repkevinhern
76,2022-01-19 22:17:39+00:00,1483926655450103812,"The President, who is directly responsible for the deaths of 13 of our heroic servicemembers in Afghanistan, is refusing to apologize.  Unbelievable. https://t.co/A1DvvuLbw8",repkevinhern
77,2022-01-19 21:29:14+00:00,1483914470200070147,"@POTUS: ""Name one thing Republicans are for.""
 
Border security, lower inflation, lowering federal spending, and protecting the American people against gross government overreach, just to name a few.",repkevinhern
78,2022-01-19 18:57:00+00:00,1483876160043945989,"You're still 4 million jobs short of pre-pandemic levels, Mr. President.

https://t.co/8u1KmfrbAl https://t.co/ke96hwislH",repkevinhern
79,2022-01-19 17:13:43+00:00,1483850167178702857,Very proud to receive an A+ rating from @SBAList!  I will always fight to protect life! https://t.co/XzjcH8QwNe,repkevinhern
80,2022-01-19 17:05:50+00:00,1483848185189650435,President Biden's first year in office has been an unmitigated disaster.  His Administration has time and time again refused to address real problems that the American people care about.  Our country would be much better off if he simply got out of the way. @RepublicanStudy https://t.co/1wmFsJ3rEI,repkevinhern
81,2022-01-18 23:22:22+00:00,1483580555421794306,Involvement in the education of your child is a basic component of parenting – not a reason to be placed on an FBI watchlist. The Biden Admin attacking parents for making decisions for their own kids is unacceptable. I am proud to join @RepScottPerry’s letter demanding answers. https://t.co/YhIiawL1Q2,repkevinhern
82,2022-01-18 19:30:32+00:00,1483522213449973760,Glad to join @RepGregMurphy on this important issue! https://t.co/Dynyv9Zcbq,repkevinhern
83,2022-01-18 16:37:42+00:00,1483478718634987531,"Despite the President's victory tour on jobs ""created"", zero (0) of the jobs he's taking credit for are new. We are still nearly 4 million jobs short of pre-pandemic levels.",repkevinhern
84,2022-01-17 17:09:05+00:00,1483124227049938945,Today we honor the incredible life and eternal legacy of Dr. Martin Luther King Jr.  May his vision continue to inspire us to work together for the common good. #MLKDay,repkevinhern
85,2022-01-14 18:41:29+00:00,1482060315667931137,"It was an honor to receive the ""Friend of the Family"" award from @FaithandFreedom this past Wednesday!  I received this award as recognition of my strong voting record of protecting life, defending religious liberty, and strengthening family values. https://t.co/VGZydgN1Xo",repkevinhern
86,2022-01-13 20:34:19+00:00,1481726323684950018,"Recap of Democrats’ major legislative agenda so far:

#BuildBackBroke: dead

Unconstitutional Vaccine mandate: blocked

Federal takeover of elections: soon to be defeated

#DemsInDisarray",repkevinhern
87,2022-01-13 19:43:05+00:00,1481713431283646467,BREAKING: I'm extremely pleased that the Supreme Court has ruled in favor of the Constitution and blocked the OSHA vaccine mandate for employers. This is a huge victory for Americans' personal freedoms!,repkevinhern
88,2022-01-13 15:01:26+00:00,1481642549743783940,"As Democrats push to pass a radical federal takeover of elections, the irony is not lost on me that they want to ban Voter ID – claiming it's racist – in the same city where you now need to have a photo ID AND a vaccine card to go to the gym, go out to eat, or buy groceries.",repkevinhern
89,2022-01-12 18:06:06+00:00,1481326636087881729,"It's nothing more than big talk as long as Americans families are paying an average of $3,500 more on basic necessities than they were a year ago. President Biden continues to prove he's completely out of touch with Americans. https://t.co/rp0iWIW5iY",repkevinhern
90,2022-01-12 15:40:37+00:00,1481290022762467336,"December saw inflation rise to 7%.  This is the highest it's been in 40 YEARS, and a continuation of the rise that we've seen every single month since the President took office.  #Bidenflation is stifling growth, destroying small businesses, and suffocating American families. https://t.co/j7ayYSZMpg",repkevinhern
91,2022-01-12 15:10:53+00:00,1481282541168599042,"The only way to fix inflation is to immediately halt Biden &amp; Pelosi’s reckless spending pattern and unshackle American small businesses to energize local economies. 

See my full statement on 40-year-high inflation ⬇️⬇️ https://t.co/JIdWf6YWGV",repkevinhern
92,2022-01-12 13:34:20+00:00,1481258243137708034,"I’m on @cspanwj for the next half hour discussing Biden’s vaccine mandates, the labor shortage, and the struggle of small businesses in Biden’s America. 

Tune in!",repkevinhern
