,Datetime,Tweet Id,Text,Username
197,2021-11-04 17:42:02+00:00,1456315818409615361,President Biden’s unconstitutional vaccine mandate will completely cripple an economy that’s already struggling.  Forcing businesses to comply or be heavily fined is NOT Building Back Better.  I will do everything I can to fight this mandate for small businesses everywhere.,repkevinhern
198,2021-11-03 18:44:29+00:00,1455969146617974789,"We just got another draft of the #BuildBackBroke bill. It’s over 2k pages, up from 1.8k.  The Rules Committee will review it at 3:00 PM.  How can anyone be expected to make a reasonable decision on a piece of legislation they had an hour to read?  This is ridiculous.",repkevinhern
199,2021-11-02 19:04:54+00:00,1455611897043111939,Proud to join @GOPLeader this afternoon for his roundtable discussion about protecting small businesses.  Tune in! https://t.co/99pwDDMzQA,repkevinhern
200,2021-11-02 18:16:57+00:00,1455599829216862210,Just finished speaking at @RepDonaldsPress press conference with @SteveScalise and many other members of @RepublicanStudy about Democrats’ #BuildBackBroke agenda https://t.co/yMMFcb8sIV,repkevinhern
201,2021-11-02 17:44:15+00:00,1455591599203930115,"This afternoon I advocated for small businesses.  All Democrats claim to fight for small businesses – until it’s time to vote.  Then, they’re all about raising taxes and encouraging people not to work.  I will ALWAYS fight for small businesses in both words AND actions. https://t.co/s6NEAY2pe8",repkevinhern
202,2021-10-29 18:13:11+00:00,1454149329074151429,"Our southern border is completely wide open, our economy is stagnant, prices are rising, and Democrats still can't agree on their radical #BuildBackBroke agenda.  I joined @newsmax to discuss #DemocratsInDisarray: https://t.co/1WAuY7Vuc1",repkevinhern
203,2021-10-29 14:22:56+00:00,1454091383590031362,"Our economy is completely stagnated and the Biden Administration's solution is to use American taxpayers' money to pay illegal immigrants $450k. Unbelievable.

https://t.co/Dv9aBXgS7h",repkevinhern
204,2021-10-28 22:15:00+00:00,1453847795551674373,"Typical DC - Democrats started the day with big talk about their fake infrastructure plan &amp; socialist reconciliation bill, but it's been an afternoon of chaos and confusion on the Hill and we're ending the day without a vote on either proposal. #DemsinDisarray #BuildBackBroke",repkevinhern
205,2021-10-28 21:42:28+00:00,1453839609532669965,"Biden's doing absolutely nothing to stop caravans of migrants from illegally entering our country. The vast majority of those apprehended are being released into the country anyways -- no wonder they're coming! 

Biden needs to secure the border NOW. 

https://t.co/cTjD77gAqE",repkevinhern
206,2021-10-28 17:58:50+00:00,1453783328457363460,"1,353 mentions of the word ""tax"" in the legislative text that was just released. #BuildBackBroke",repkevinhern
207,2021-10-28 15:45:43+00:00,1453749830581424130,"""It's fiscally responsible and fully paid for."" - @POTUS @JoeBiden is misleading the American people from the White House.

This bill will be the most expensive, useless, unnecessary spending bill in history. #BuildBackBroke",repkevinhern
208,2021-10-28 14:45:26+00:00,1453734660178022403,So the framework doesn't even include something as bad as SALT - what else was left out? #DemsInDisarray https://t.co/Mz2At9Xg1k,repkevinhern
209,2021-10-28 14:08:11+00:00,1453725283706499088,"2.0% 3rd Quarter GDP growth proves what we already knew: Biden's plan is really to #BuildBackBroke

https://t.co/uK7IpJxOlm",repkevinhern
210,2021-10-28 13:40:21+00:00,1453718278589845508,"Reckless spending is the heart of our debt problems - I’ve been saying this all along! 

Our country doesn’t have a revenue problem, it has a spending problem. https://t.co/MC6lDWtEL5",repkevinhern
211,2021-10-26 19:16:28+00:00,1453078091136393216,"The fact that we're debating whether or not parents should have a say in what their children are taught is ridiculous.  Parents should always have a voice in what their children are learning at school.  I stand with @GOPLeader, @Jim_Jordan, and @VirginiaFoxx supporting parents.",repkevinhern
212,2021-10-25 23:25:07+00:00,1452778277920284681,"Biden is desperate to pass something - anything - before leaving for Europe this week. 10 months in office and nothing to show for it but rampant inflation, terrorist control of Afghanistan, dismal employment numbers, open borders, and skyrocketing energy costs. https://t.co/7tU4itYtVR",repkevinhern
213,2021-10-25 20:33:32+00:00,1452735098395181056,Catch me on @FoxBusiness tonight at 5 PM ET/4 PM CT. I’ll be talking about Biden’s #BuildBackBroke agenda and why it’s a bad idea for the American taxpayer.,repkevinhern
214,2021-10-25 13:01:44+00:00,1452621399705767939,Big tech must be held accountable! https://t.co/1xKwXgwSUf,repkevinhern
215,2021-10-22 17:09:03+00:00,1451596473267888137,"This week, the Senate passed a bill with a bipartisan vote that would allow states &amp; local entities to use existing COVID relief funds on local infrastructure projects.

Pelosi refuses to give it a vote in the House.

It was never about infrastructure, it was always about power.",repkevinhern
216,2021-10-21 20:34:15+00:00,1451285727510208512,Democrats just rejected legislation to prevent the IRS from spying on Americans' bank accounts.,repkevinhern
217,2021-10-21 15:22:20+00:00,1451207228938149890,"This morning I remembered Oklahoma radio legend Pat Campbell on the House floor.  Pat was a monumental figure in the state political scene; more importantly, he was a good friend.  My condolences to his friends and family.  May he Rest in Peace. https://t.co/YxemoCCLka",repkevinhern
218,2021-10-19 23:01:34+00:00,1450598022908452865,"Tonight, I'll be hosting members of @RepublicanStudy on the House floor to talk about Biden's dangerous Reconciliation Package. 
#BuildBackBroke https://t.co/uinaBeceDE",repkevinhern
219,2021-10-18 21:36:28+00:00,1450214218486198276,"“The Biden administration’s policies are ensuring job creators will not recover from forced lockdowns""

Read more on the supply chain crisis from @RepHarshbarger &amp; me here:

https://t.co/KE465K6oBD",repkevinhern
220,2021-10-15 19:31:54+00:00,1449095709790199808,I am proud to celebrate #PoliceWeek. The men and women who protect our communities put their lives on the line every day to keep us safe - we’ll never forget their sacrifice.,repkevinhern
221,2021-10-15 16:10:05+00:00,1449044919629328391,"Breast cancer effects all of us.  October is #BreastCancerAwareness Month, and today is #NationalMammographyDay.  Women at average risk of breast cancer should begin annual mammograms at age 40. Please don’t delay, get screened.  Learn more at https://t.co/cYZ1QHHAX1",repkevinhern
222,2021-10-14 18:02:56+00:00,1448710933040205824,"I joined @RepRickAllen and others on a letter to DHS Secretary Mayorkas demanding to know why the highly successful Remain in Mexico policy is being terminated.  He claims that our borders aren’t open; unfortunately, he’s wrong.  #BidenBorderCrisis https://t.co/j64OcL1ZCY",repkevinhern
223,2021-10-14 15:45:00+00:00,1448676218384142341,"If you need the media to help “sell” the American people the biggest expansion of the Federal Government since the 1930s, it’s probably not a good bill.

https://t.co/arcBPfUpqN",repkevinhern
224,2021-10-14 15:12:17+00:00,1448667986534010882,How is it possible to be this out of touch with reality?  American families are spending $175+ more per month on living expenses and the White House’s answer is “well it could be worse”?! https://t.co/aCzndcgCbM,repkevinhern
225,2021-10-13 20:51:17+00:00,1448390909649952776,"In summary:

1.) Biden slashes U.S. oil and gas production.

2.) Prices skyrocket.

3.) Biden begs OPEC for more oil.

4.) They refuse, prices keep rising.

5.) Biden reportedly begs American companies for help.

https://t.co/aLq86tluVT",repkevinhern
226,2021-10-13 15:31:51+00:00,1448310522110164993,"#Bidenflation is bad, and it’s only going to get worse.  How long until this Administration acknowledges that their bad economic policies are slashing growth and crippling our economy?

https://t.co/79fr6NlAUB",repkevinhern
227,2021-10-12 21:18:27+00:00,1448035361100378112,"Today, @SpeakerPelosi confirmed millions of Americans' worst fears and announced the creation of a surveillance state monitoring the financial transactions of American families.

This overreach is unprecedented and wholly unacceptable. https://t.co/6exywjGqMj",repkevinhern
228,2021-10-12 19:39:09+00:00,1448010370845708294,Happy #NationalFarmersDay to all our great farmers! Agriculture is critical to Oklahoma’s economy: we have the 4th most farms in the country. Oklahoma farmers feed the world. We appreciate your year-round hard work! https://t.co/iXOgqhPlNL,repkevinhern
229,2021-10-12 17:37:19+00:00,1447979711322378240,Looking forward to voting against this “rule” later today! 👀 https://t.co/PnJKTNR4nL,repkevinhern
230,2021-10-08 16:19:16+00:00,1446510516759846917,"American households are losing out on ~$175 a month due to #Bidenflation.  That’s more than a new pair of shoes, a night out, or a day out at the ballpark that families are missing out on every single month because of bad economic policy.",repkevinhern
231,2021-10-08 14:57:39+00:00,1446489975248330760,"It's time to admit what we've all known from the start - socialist policies don't work. 

Here's my full statement on September's dismal jobs report ⬇️⬇️ https://t.co/nNFLEqm6mt",repkevinhern
232,2021-10-07 16:45:37+00:00,1446154759329796104,"Remember a few days ago when the White House claimed that the proposed government spending would cost $0?  Inflation is already suffocating our economy; Biden’s plan will only make it worse.

https://t.co/F6iTZqqXFW",repkevinhern
233,2021-10-05 15:19:50+00:00,1445408395759136778,"These are only some of the many ridiculous items that this bill would fund.  If passed, it will be by far the largest expansion of the federal government since the New Deal and result in catastrophe for our country.  I will be a firm NO on this bill. (10/10)",repkevinhern
234,2021-10-05 15:19:04+00:00,1445408201399316480,Creates a $3.5T Green New Deal youth patrol to give unemployed climate activists “jobs”.  (9/10),repkevinhern
235,2021-10-05 15:18:52+00:00,1445408151382155265,Increases our dependency on foreign oil by slowing and stopping domestic energy and mineral production.  (8/10),repkevinhern
236,2021-10-05 15:18:40+00:00,1445408101742546953,Creates a cradle-to-grave welfare state while providing the Democrats’ wealthy friends with tax breaks.  (7/10),repkevinhern
237,2021-10-05 15:18:20+00:00,1445408018443685897,Imposes over $2.1 TRILLION dollars in taxes on American families and small businesses. (6/10),repkevinhern
238,2021-10-05 15:18:01+00:00,1445407937019719690,"Increases natural gas taxes, which will increase the cost of pretty much everything. (5/10)",repkevinhern
239,2021-10-05 15:17:48+00:00,1445407885387837446,Establishes a new IRS surveillance program to monitor the financial transactions of American citizens. (4/10),repkevinhern
240,2021-10-05 15:17:28+00:00,1445407798968393732,Promotes amnesty for over 8 million illegal immigrants. (3/10),repkevinhern
241,2021-10-05 15:17:11+00:00,1445407728894189581,Ignores the bipartisan Hyde Amendment by allowing taxpayer-funded abortions. (2/10),repkevinhern
242,2021-10-05 15:16:50+00:00,1445407639781920774,"The 881 page-long $3.5T Democrat wish-list reconciliation package is incredibly long and filled with dense language to try and discourage people from reading it.  Unfortunately for them, that’s not going to work.  Here’s just a few of the things the bill does: (1/10)",repkevinhern
243,2021-10-01 22:59:15+00:00,1444074458692689922,Keep your eyes peeled for some sneaky work from @SpeakerPelosi! 👀 #DemsInDisarray,repkevinhern
244,2021-10-01 16:21:26+00:00,1443974348025511936,"This is incredibly encouraging for anyone who wants the government to work for the PEOPLE instead of the politicians! There is an appetite for reform in Congress, and I hope to get my colleagues in the House on the record on this issue soon.",repkevinhern
245,2021-10-01 16:21:26+00:00,1443974346771505163,"The Senate voted on @SenatorBraun's No Budget, No Pay legislation, and while it didn't reach the 60-vote threshold, it did earn the support of a bipartisan majority.",repkevinhern
246,2021-10-01 16:21:26+00:00,1443974345609695232,"A lot of people in DC told me that bill would never go anywhere, that politicians would never vote to hold themselves accountable. 

Well, yesterday, 53 Senators did, including 8 Democrats.",repkevinhern
247,2021-10-01 16:21:26+00:00,1443974344217174038,"Earlier this year, I introduced the No Budget, No Pay Act as a part of my Roadmap to Congressional Reform package. 

This bill would withhold pay from Congress if we don't pass a budget by October 1, a deadline laid out in the Congressional Budget Act of 1974.",repkevinhern
248,2021-10-01 01:17:26+00:00,1443746845562478594,"The bipartisanship &amp; camaraderie we had on the field last night was incredibly short-lived. 

Tonight, the Democrats can’t even agree among themselves, let alone with those of us across the aisle. https://t.co/TO5UP1eZfD",repkevinhern
249,2021-09-30 15:38:11+00:00,1443601075718787077,"If the Democrat majority really cared about passing infrastructure, they'd make it a clean bill and take everything out that's not infrastructure That would get 435 votes.

Unfortunately, that's not what they want, and that's why we're in this mess.",repkevinhern
250,2021-09-29 19:20:08+00:00,1443294541050785793,"Biden can’t be bothered to help those living with the real consequences of his actions, but he’s more than willing to spend more of their dwindling tax dollars and force oppressive mandates on them.

Read more of my thoughts in the @dcexaminer ➡️➡️➡️

https://t.co/yoeN0QJ0k5",repkevinhern
