,Datetime,Tweet Id,Text,Username
93,2022-01-11 21:14:11+00:00,1481011581626589184,"This is a complete invasion of Americans' privacy and violation of their First Amendment right to freely practice religion.  I strongly oppose this action as well as any like it.

https://t.co/DsgOp1aDhi",repkevinhern
94,2022-01-11 18:37:46+00:00,1480972215977971720,"Closing schools has been a disaster for students across the country. We need to reopen and get back to doing what's best for our children immediately.

Today I spoke on the House floor about this important issue.  Watch my speech here 👇 https://t.co/uFG7xd8yVf",repkevinhern
95,2022-01-10 16:29:29+00:00,1480577546349469697,"The CDC just confirmed what most Americans have known for a long time: COVID-19, while a serious health issue, has been largely politicized from the beginning.  It's time to do away with using politics to fight a pandemic and get back to our normal lives. https://t.co/WDncqUH6uV",repkevinhern
96,2022-01-10 14:40:28+00:00,1480550112875225093,"The Chicago Public Schools System received nearly $3B of Federal COVID-19 funds, including tax dollars from Oklahomans. If they are not going to open their schools, they should return the taxpayer dollars that they received.

https://t.co/oW36NVKJxk",repkevinhern
97,2022-01-07 16:07:22+00:00,1479484817574146055,"Another month, another dismal jobs report as Biden’s economy added a meager 199k jobs in December.  His refusal to abandon his unconstitutional vaccine mandate coupled with unwillingness to end expanded welfare benefits are stifling economic recovery.

https://t.co/3QWv1a6mkD",repkevinhern
98,2022-01-07 14:42:03+00:00,1479463346265018376,"The President cannot have it both ways. He cannot absolve himself of responsibility for a solution while mandating vaccination on private employers.

Read more from my new Op-Ed in @FoxNews here 👇

https://t.co/CWq4EB0i3O",repkevinhern
99,2022-01-04 17:54:13+00:00,1478424544180379649,"Proud but not surprised to see the 1st District featured on a list of the best destinations to travel to in 2022!

https://t.co/ciwThG5JwK",repkevinhern
100,2022-01-01 22:48:41+00:00,1477411482996551681,Congrats to @CowboyFB on their amazing comeback victory in the @Fiesta_Bowl! #GoPokes,repkevinhern
101,2022-01-01 15:00:03+00:00,1477293548127010819,Happy New Year! https://t.co/r0dnLf0mSm,repkevinhern
102,2021-12-31 19:00:02+00:00,1476991553965105157,"On the last day of the year, we are thankful for all the blessings that 2021 has afforded us as well as hopeful that 2022 will be filled with new opportunities, peace, and prosperity. I hope that everyone enjoys a happy and safe New Year’s Eve!",repkevinhern
103,2021-12-28 14:37:37+00:00,1475838352628801537,Happy birthday to @GovStitt - a great friend and a terrific leader for Oklahomans!,repkevinhern
104,2021-12-25 14:00:00+00:00,1474741722517327879,"On behalf of myself, my family, and my staff,  I’d like to wish everyone a Merry Christmas! https://t.co/VJA86JGvQj",repkevinhern
105,2021-12-21 23:31:00+00:00,1473435868698398723,@RepAndyHarrisMD @JayObernolte @RepPerlmutter @RepJudyChu,repkevinhern
106,2021-12-21 23:31:00+00:00,1473435867259842567,@RepJimCosta @RepHorsford @CongressmanRaja @RepBlakeMoore @TXRandy14 @RepTomEmmer @RepStefanik @RepSpartz @RepJoeCourtney @RepBethVanDuyne @TomReedNY23 @RepBice @RepArmstrongND @RepGonzalez @RepJamesComer @RepTedBudd @USRepLong @RepYoungKim @RepCloudTX @RepKayGranger,repkevinhern
107,2021-12-21 23:31:00+00:00,1473435865519210499,@RepAshleyHinson @RepChipRoy @RepLaHood @RepRonKind @RepRalphNorman @RepRWilliams @congbillposey @RepDaveJoyce @KenCalvert @RepFredUpton @RepArrington @RepAGonzalez @RepJohnKatko @RepFranklin @RepCardenas @RepCardenas @NormaJTorres @RepGrothman @RepSteveChabot @RepSmucker,repkevinhern
108,2021-12-21 23:30:59+00:00,1473435864277651462,@RepDavidValadao @RepMMM @RepScottPerry @RepMcKinley @BettyMcCollum04 @RepLouCorrea @RepTimmons @RepRonnyJackson @RepFeenstra @RepDLesko @RepJimmyPanetta @RepDavid @WarrenDavidson @michaelcburgess @RepDanBishop @RepBenCline @RepLarryBucshon @RepDonBacon @RepJohnRose,repkevinhern
109,2021-12-21 23:30:59+00:00,1473435862054625281,@RepBrianHiggins @repdinatitus @RepJacobs @RepBobGibbs @RepMikeTurner @RepBillJohnson @RepBrianFitz @RepRickAllen @RepDLamborn @RepMaryMiller @RepWalberg @RepDavidKustoff @RepMeijer @DrNealDunnFL2 @RepBradWenstrup @RepBost @RepDavids @RepCindyAxne @RepWalorski @RepBurgessOwens,repkevinhern
110,2021-12-21 23:30:58+00:00,1473435860477612041,"It is the duty of both governments to return to the negotiating table and work together on solutions, especially at a time when American families are suffering under the weight of record-high inflation.  We are ready &amp; willing to discuss this problem and its potential solutions.",repkevinhern
111,2021-12-21 23:30:58+00:00,1473435859085107200,The Department of Commerce’s decision to increase antidumping and countervailing duties on certain softwood lumber products from Canada will have severe consequences on new housing construction and the costs faced by hardworking American families.,repkevinhern
112,2021-12-21 23:30:58+00:00,1473435857017356297,Yesterday I led a bipartisan letter with over 80 of my colleagues to @SecRaimondo expressing our concern with the recent decision to increase tariffs on certain lumber products being imported from Canada. https://t.co/u8LOBxoaP9,repkevinhern
113,2021-12-21 02:41:49+00:00,1473121501771673601,Congrats to our new Myrtle Beach Bowl Champions! @TulsaFootball you make us all proud!,repkevinhern
114,2021-12-20 20:00:00+00:00,1473020381216731142,Happy 2nd birthday @SpaceForceDoD! Our country has benefited greatly from President Trump's decision to bring America into the modern age by ensuring the defense of our valuable assets &amp; national interests both in cyber space and in outer space. #SemperSupra,repkevinhern
115,2021-12-20 19:15:13+00:00,1473009110002110477,"The White House's recent statement telling Americans who have chosen not to get the vaccine to prepare for a ""winter of severe illness and death"" is unprecedented hostility from the President to the people he serves - and all from the man who promised unity.",repkevinhern
116,2021-12-20 19:00:00+00:00,1473005280384458755,Excited to cheer on @TulsaFootball as they take on Old Dominion in the @MBBowlGame at 1:30 PM CT today! #ReignCane,repkevinhern
117,2021-12-19 18:11:29+00:00,1472630684187607040,"#BuildBackBroke is officially dead - hopefully, the end of this bill marks a return to fiscally responsible leadership.",repkevinhern
118,2021-12-19 18:11:29+00:00,1472630683147411457,Only 1 House Democrat was willing to do what Manchin is doing and vote against their party’s bad bill.,repkevinhern
119,2021-12-19 18:11:29+00:00,1472630681788420103,"If we learned anything this year, it’s that MORE spending isn’t the answer. It doesn’t work; in fact, the spending from this year has left us worse off than we were at the start.",repkevinhern
120,2021-12-19 18:11:28+00:00,1472630679791976455,"I applaud @Sen_JoeManchin for sticking to his conscience and his values, putting the future of our nation above partisan games.

He’s absolutely correct that #BuildBackBroke would make America less competitive and more vulnerable to threats of all kinds. https://t.co/rgxJG3QBvE",repkevinhern
121,2021-12-17 19:21:59+00:00,1471923649816969217,"Democrats in Congress and the Biden Administration are continuing to lie to the American people, telling them that #BuildBackBroke will cost nothing.  Unfortunately for them, the American people aren't buying it.
 
Watch my full interview on @newsmax this morning here 👇 https://t.co/6KjF0ab2gz",repkevinhern
122,2021-12-16 21:29:22+00:00,1471593317620195336,"According to a new analysis by @BudgetModel, in Joe Biden's economy American families spent an average of $3,500 more this year than they did in recent years when buying the same products.  #Bidenflation is absolutely crushing American taxpayers.",repkevinhern
123,2021-12-16 14:47:35+00:00,1471492205978308608,"The biggest barrier, Madam @VP, is that most Americans can't afford a luxury EV, due in large part to the 6.8% inflation rate which YOUR Administration has written off as a ""high class problem"".

The Biden Administration is impossibly out of touch with the American people. https://t.co/gTQLr81vuk",repkevinhern
124,2021-12-15 00:01:59+00:00,1470906948463833089,"This afternoon, I surprised a student I nominated for attendance @WestPoint_USMA with the great news that he was accepted! This is one of the best parts of my job. https://t.co/wb1fvfdBku",repkevinhern
125,2021-12-14 14:34:33+00:00,1470764148648824837,Raising the debt limit so you can spend more taxpayer money is the exact opposite of paying our debts. https://t.co/CsmuCFyekr,repkevinhern
126,2021-12-13 22:33:36+00:00,1470522318971707396,"Praying for all the communities devastated by storms across multiple states this weekend, especially with @RepJamesComer and his constituents. Thank you to all the first responders and community members who responded swiftly with courage and kindness.",repkevinhern
127,2021-12-13 15:24:21+00:00,1470414296307875845,"$3,000,000,000,000.00 ≠ $0.00 https://t.co/p4LbELhg5b",repkevinhern
128,2021-12-13 14:55:24+00:00,1470407007547047943,"For 385 years the brave men and women of our National Guard have been ready to answer the call to defend our freedoms at a moment's notice.
 
Happy birthday, @USNationalGuard!",repkevinhern
129,2021-12-10 19:06:38+00:00,1469383068486090752,"Our current leadership should be taking common sense steps to solve the inflation crisis.  Instead, they're blaming small businesses for their problems and claiming that wasting trillions of taxpayer dollars will cost nothing.",repkevinhern
130,2021-12-10 19:06:37+00:00,1469383067253018629,"The Biden Administration laying the inflation blame at the feet of businesses is further proof that they have no idea how business actually works.  

Raising prices due to increased taxes and production costs isn’t “absurd and unfair.”

It’s simple math.",repkevinhern
131,2021-12-10 17:56:45+00:00,1469365482717429769,"America is experiencing the highest inflation rates in 39 years, and the only solution that Democrats have offered is an expanded debt ceiling and trillions of dollars’ worth of federal spending.  

It’s glaringly obvious: our current leadership puts taxpayer needs last.",repkevinhern
132,2021-12-10 15:09:19+00:00,1469323349704810496,"#Bidenflation 

https://t.co/4I02NkgOj4",repkevinhern
133,2021-12-09 19:34:25+00:00,1469027674530230278,Proud to join onto this bill as an original cosponsor! https://t.co/JyXbmdl1Sj,repkevinhern
134,2021-12-09 16:00:05+00:00,1468973737076838400,"Today we celebrate the inspiring life of Senator Bob Dole as he lies in State at the Capitol. Bob was an American hero who exemplified Patriotism, honor, dignity, and respect. May his legacy inspire us all to serve the American people with strength and integrity.",repkevinhern
135,2021-12-08 03:01:14+00:00,1468415345207746561,Every crisis in our nation’s capital can be traced back to the budget.,repkevinhern
136,2021-12-08 03:01:14+00:00,1468415344175992836,"All this could have been avoided had @SpeakerPelosi written a budget this spring. Not only did she fail to draft a budget, she instructed her Budget Committee Chairman not to even attempt it.",repkevinhern
137,2021-12-08 03:01:14+00:00,1468415343047630850,The American people don’t trust these swampy maneuvers; they see through the false statements from Democrats who control the White House and both chambers of Congress yet blame their gridlock on Republicans.,repkevinhern
138,2021-12-08 03:01:14+00:00,1468415341969739781,"Instead of working ahead to avoid a default on our debts, Democrats waited until the last minute and are trying to rewrite the rules of the Senate instead of using the tools already at their disposal, like the reconciliation process.",repkevinhern
139,2021-12-08 03:01:13+00:00,1468415340770119684,"Earlier this year, I led over 100 of my colleagues in the House in the commitment against voting for a debt limit increase. 

Our GOP colleagues in the Senate signed a similar commitment, giving the Democrats several months’ notice that they would need to do this on their own.",repkevinhern
140,2021-12-08 03:01:13+00:00,1468415339654520837,"Tonight, I voted against a swampy maneuver that allows the Democrats to circumvent the filibuster in the Senate in order to raise the debt limit - something they already have the power to do using reconciliation, the process they’re already using for #BuildBackBroke",repkevinhern
141,2021-12-07 14:59:24+00:00,1468233688106295304,"80 years ago today over 2000 Americans made the ultimate sacrifice at Pearl Harbor.  Today and everyday we remember our brave soldiers who answered the call when our nation was attacked on this ""date that will live in infamy"". https://t.co/u2ZnXmWjAF",repkevinhern
142,2021-12-07 14:51:33+00:00,1468231713646075916,"Congratulations to Lt. Col. Coloney on receiving the Distinguished Flying Cross this past weekend! Lt. Col. Coloney's heroic actions saved the lives of countless Americans in Afghanistan. Your country is eternally grateful for your bravery and heroism.

https://t.co/BU4gTK72DT",repkevinhern
143,2021-12-06 21:28:31+00:00,1467969224870182923,"While I agree that no diplomat should attend the 2022 Beijing Winter Olympics, this boycott is the bare minimum. China’s repeated human rights violations cannot continue to go unaddressed. It’s time to get serious about standing up to the CCP.",repkevinhern
144,2021-12-05 17:24:21+00:00,1467545389318512646,Saddened to learn of Bob Dole’s passing today.  I had the honor of meeting Bob on Capitol Hill a few years ago. He was a true American hero who exemplified everything that makes our country great. May he Rest In Peace. https://t.co/OQuT5acCeB,repkevinhern
145,2021-12-03 19:34:23+00:00,1466853338528501767,Democrats control the White House and both chambers of Congress and Biden is still blaming his failures on Republicans. The American people know exactly who's to blame! #BuildBackBroke https://t.co/P3o61qLlTs,repkevinhern
146,2021-12-03 17:55:20+00:00,1466828412698431488,"Democrats have crippled small businesses struggling to get back on their feet post-pandemic with overreaching policies and an expanded welfare state.  Simply put: our current administration has no idea how businesses actually work.

Watch my interview on @newsmax here 👇 https://t.co/7fPLYq03MN",repkevinhern
147,2021-12-03 15:01:04+00:00,1466784555478753290,About to go on @newsmax.  Tune in!,repkevinhern
148,2021-12-03 14:22:42+00:00,1466774903399620609,"Joe Biden's economy is in shambles.  The dismal November jobs report, which showed that our country added less than HALF of the jobs that it was projected to, further demonstrates that America is suffocating under the weight of bad economic policies and government overreach.",repkevinhern
149,2021-12-02 21:34:59+00:00,1466521300101382144,https://t.co/1blPt00oCK https://t.co/73KtTEVGEB,repkevinhern
150,2021-12-01 21:54:04+00:00,1466163714483228673,"The Biden Administration is now claiming that government overreach, including lockdowns and mandates, leads to a stronger economy.  Every American, no matter what side they're on, knows this isn't true. https://t.co/2Ey4RSvEhl",repkevinhern
151,2021-12-01 15:09:30+00:00,1466061904158339072,Today is a huge day for the Pro-Life movement in our country.  I stand with everybody fighting for life!,repkevinhern
152,2021-11-30 23:01:34+00:00,1465818315956400128,"Congratulations @EnesFreedom, we miss seeing you in blue and orange! https://t.co/sOKFPLVG55",repkevinhern
153,2021-11-30 16:18:21+00:00,1465716841360379904,"Proud of @heritage for doing the right thing, fighting for the Constitution &amp; the rule of law! This war is not over, and it's going to take every one of us to ensure this vaccine mandate is completely abandoned. https://t.co/RoxPQHBZo3",repkevinhern
154,2021-11-29 20:38:38+00:00,1465419957899087877,"Struggling to make ends meet with rising inflation and soaring gas prices? Don't worry, all you have to do is spend tens of thousands of dollars on a luxury electric vehicle and your problems will be solved!  Don't worry about rising electricity costs either! https://t.co/68yPfr49rG",repkevinhern
155,2021-11-29 16:37:00+00:00,1465359147898130437,"If the President really cared about keeping Americans safe he'd take action to close our southern border, which is wide open due to his bad policies and inaction.

https://t.co/OJlsOMbNH9",repkevinhern
156,2021-11-28 22:22:19+00:00,1465083661351542787,Chag Sameach to everyone celebrating the start of Hanukkah tonight!,repkevinhern
157,2021-11-26 16:14:47+00:00,1464266394254589957,Who do you have winning Bedlam tomorrow?,repkevinhern
158,2021-11-25 15:30:00+00:00,1463892734347862023,Tammy and I would like to wish everyone a happy and healthy Thanksgiving holiday! https://t.co/zf5VNpqAm9,repkevinhern
159,2021-11-23 17:14:46+00:00,1463194323508473869,"I’m proud to support @JobCreatorsUSA &amp; all the small businesses fighting back against this unconstitutional mandate. 

The American people are DONE with @JoeBiden’s anti-American attack on freedom! https://t.co/TTjiaizMG2",repkevinhern
160,2021-11-23 16:35:06+00:00,1463184341694042114,"Reminder: @POTUS caused this problem when he canceled the Keystone Pipeline, stopped drilling on federal land, and made it harder for domestic oil producers to provide low-cost energy to Americans. 

Releasing a few days’ worth of oil from the reserves won’t solve this problem. https://t.co/dk8x4DexdL",repkevinhern
161,2021-11-22 23:59:44+00:00,1462933850200367117,🚨🚨🚨 https://t.co/VxJZJlwCo7,repkevinhern
162,2021-11-22 19:37:03+00:00,1462867744727179264,"That's a strange way to say 'high inflation, supply chain crisis, open borders, failed withdrawal from Afghanistan, and government overreach presidency' https://t.co/EHclfhIH85",repkevinhern
163,2021-11-22 15:50:52+00:00,1462810822359535627,"Please join me in praying for all of the victims, their families, and anyone affected by the horrific tragedy that occurred in Waukesha, Wisconsin yesterday.",repkevinhern
164,2021-11-19 14:56:32+00:00,1461709984144760832,I just voted NO against the largest expansion of the federal government in our great nation’s history.  My Republican colleagues and I will not be complicit in creating a cradle-to-grave welfare state and crippling future generations with debt. #BuildBackBroke,repkevinhern
165,2021-11-19 08:04:41+00:00,1461606341185789956,"👇👇👇

https://t.co/2ZqgQPHl1b",repkevinhern
166,2021-11-19 07:58:27+00:00,1461604772176347141,"The House is set to vote on the largest spending bill in the history of the U.S. and @SpeakerPelosi only allotted 20 minutes of debate. 20 minutes! Americans deserve to know what’s in this bill, and they deserve to hear a rigorous debate.",repkevinhern
167,2021-11-19 07:58:27+00:00,1461604771194974209,It’s 3am in Washington &amp; the sleepy socialists have gone to bed - but I’m here with @GOPLeader on the House floor as he continues to fight for the America our children &amp; grandchildren deserve.,repkevinhern
168,2021-11-18 20:04:38+00:00,1461425135194456071,"Madame Vice President, you KNOW this isn’t true! #BuildBackBroke https://t.co/YM7rwl7xDw",repkevinhern
169,2021-11-18 17:16:51+00:00,1461382910162964481,The Build Back Broke bill will be the largest expansion of the federal government in American history. A vote on this bill represents a clear choice: the American people or D.C. bureaucrats. https://t.co/R4BRRnae8m,repkevinhern
170,2021-11-18 16:39:00+00:00,1461373382876975105,"About to join @WaysandMeansGOP to debate the #BuildBackBroke tax-and-spend bill.  Tune in! 

https://t.co/eXu25omBTj",repkevinhern
171,2021-11-17 23:53:06+00:00,1461120242290237440,"Biden &amp; his puppeteers knew their unconstitutional vaccine mandate would not hold up in court, but they did it anyways, proving their allegiance to the socialist mob rather than the Constitution &amp; the United States. https://t.co/SxAn1T8PZ3",repkevinhern
172,2021-11-17 17:46:20+00:00,1461027940293132298,"The Biden Administration is proposing hiring 87,000 new IRS Agents.  That’s enough to fill the @BOKCenter more than 4 times or the @TulsaFootball H.A. Chapman Stadium nearly 3 times.  The American people do not want or need this gross expansion of IRS surveillance in their lives.",repkevinhern
173,2021-11-17 16:58:47+00:00,1461015975093063681,"On Friday November 5 I led a press conference featuring former OMB Director Russell Vought as well as over 30 of my Republican colleagues addressing this issue.  You can watch the full press conference here 👇

https://t.co/JtZOgTcs90",repkevinhern
174,2021-11-17 16:56:24+00:00,1461015373785010178,"I’m proud to join my colleagues in both the House and the Senate in opposing the President's unlawful and overreaching vaccine mandate.  The government forcing recovering businesses to choose between being fined and firing employees is NOT ok, and we will not stand for it. https://t.co/kekR7DKnl9",repkevinhern
175,2021-11-17 01:02:27+00:00,1460775305514303492,The Biden economy 👇👇 https://t.co/D13nLrMW2v,repkevinhern
176,2021-11-16 21:26:04+00:00,1460720852752871428,"Today I met with @LtGovPinnell and Oklahoma's Secretary of Commerce Scott Mueller in my DC office. I'm proud to continue the successful, productive relationship between our state and federal officials. We're in good hands with strong leaders like these Okies! https://t.co/rcsFo6UtRW",repkevinhern
177,2021-11-16 16:47:58+00:00,1460650863643566087,Source: https://t.co/zBrWVQBSQJ https://t.co/pgi4Rw9K5S https://t.co/yc4wfhUmMF,repkevinhern
178,2021-11-16 15:42:08+00:00,1460634298529239044,"For 114 years, the Sooner State has been a national symbol of excellence in industry, agriculture, and people.  Happy birthday, Oklahoma! https://t.co/ocL3S5E71Y",repkevinhern
179,2021-11-16 14:50:32+00:00,1460621310632071177,#BuildBackBroke https://t.co/zGTuvSPneW,repkevinhern
180,2021-11-15 23:30:00+00:00,1460389653278650371,"The President met with Xi Jinping today and discussed anything BUT the global pandemic, which began in Wuhan and has defined our lives for the past year and a half.  Biden bending the knee to the CCP is disgraceful – but not surprising.",repkevinhern
181,2021-11-15 22:58:04+00:00,1460381615440515074,Who could’ve seen this coming?! https://t.co/B6HkiPXkXH,repkevinhern
182,2021-11-15 20:45:18+00:00,1460348202796867594,Fact check: FALSE https://t.co/kWtE7bnmwV,repkevinhern
183,2021-11-15 20:04:16+00:00,1460337878928703495,#BuildBackBroke https://t.co/d2iILzxAlE,repkevinhern
184,2021-11-12 15:56:15+00:00,1459188296710565888,"When you give up autonomy, bit by bit, it becomes irreversible.

Read my thoughts on Biden's IRS snooping proposal with @RepAshleyHinson in @FoxNews today ➡️➡️

https://t.co/g21fnlYI0Z",repkevinhern
185,2021-11-11 14:00:02+00:00,1458796663342993412,Today we honor all of our brave men and women in uniform who have fought and continue to fight for our liberties.  We will never forget the sacrifices that all of you have made in defense of our nation and its people.  Thank you. https://t.co/8klNr0lr2U,repkevinhern
186,2021-11-10 16:39:35+00:00,1458474428371775488,"For 246 years our brave Marines have been defending our freedoms both at home and abroad.  Happy birthday, @USMC! https://t.co/65sjFVw0jI",repkevinhern
187,2021-11-10 15:40:56+00:00,1458459666749460492,"#BuildBackBroke 

https://t.co/gQMRskth1G",repkevinhern
188,2021-11-06 18:31:35+00:00,1457053062930083847,Americans are sick &amp; tired of Democrats weaponizing government to impose their will on our families &amp; businesses. We cannot allow Pelosi to get away with this.,repkevinhern
189,2021-11-06 18:31:35+00:00,1457053061717843968,"Pelosi is one step closer to passing the even larger Build Back Broke agenda, which would raise taxes on ALL Americans for a socialist spending plan no one wants.",repkevinhern
190,2021-11-06 18:31:35+00:00,1457053060551880713,"I voted no because this is a bad bill. To make a bad situation worse, it was brought to the floor in the middle of the night. These are the swampy tactics Americans hate.",repkevinhern
191,2021-11-06 18:31:34+00:00,1457053059117371393,"Around midnight last night, the Democrats finally passed their fake infrastructure bill - a $1 TRILLION bill that funds key policies from the Green New Deal &amp; largely ignores the true infrastructure projects that need funding.",repkevinhern
192,2021-11-05 18:51:15+00:00,1456695625681195012,👀 https://t.co/PnJKTNR4nL,repkevinhern
193,2021-11-05 17:08:58+00:00,1456669884448919552,"Quick Update: We are at a standstill.  A small number of Democrats are requesting that they have time to read the bill and understand what the bill's cost is, which we will not know for weeks.  What a novel idea!  #BuildBackBroke",repkevinhern
194,2021-11-05 16:01:23+00:00,1456652876403679241,"Just wrapped a press conference with 30 of my colleagues talking about how dangerous Biden’s vaccine mandate is for every single American.  I will not vote to fund the Dept. of Labor until this mandate is reversed.

https://t.co/TIRELdlXdW",repkevinhern
195,2021-11-05 02:41:05+00:00,1456451472179220481,"in less than 10 hours, we’re supposed to vote on a bill that will spend TRILLIONS of taxpayer dollars. In classic Pelosi fashion, we don’t even have the final text yet. No wonder people don’t trust Congress. #BuildBackBroke",repkevinhern
196,2021-11-04 17:50:00+00:00,1456317821097426945,"Going on @NEWSMAX at 2:00 PM EST to talk about Biden's Build Back Broke Agenda, vaccine mandates, and more.  Tune in!",repkevinhern
