,Datetime,Tweet Id,Text,Username
0,2022-02-23 19:56:56+00:00,1496574820745723904,"As Pres. Biden prepares for his State of the Union speech and Democrats keep the Capitol closed to constituents, I want to hear from you.
 
Use this form to send me your input on the state of our country and how you and your family have been affected👇 

https://t.co/oStP4d0HPZ",RepMikeJohnson
1,2022-02-21 15:22:46+00:00,1495781047967129602,Let us never take it for granted.,RepMikeJohnson
2,2022-02-21 15:22:25+00:00,1495780960020930562,"“The name of American, which belongs to you in your national capacity, must always exalt the just pride of patriotism. . . the independence and liberty you possess are the work of joint counsels, and joint efforts of common dangers, sufferings, and successes.”",RepMikeJohnson
3,2022-02-21 15:21:26+00:00,1495780709428043783,Presidents’ Day is an opportunity now to reflect on the unparalleled legacy and blessings we have been afforded in this exceptional country of ours--and to pass that along to our children and grandchildren. As Washington admonished in his Farewell Address:,RepMikeJohnson
4,2022-02-21 15:20:34+00:00,1495780493073207302,"Today is also the day that Washington's famous Farewell Address is read in its entirety on the floor of the U.S. Senate--which is a tradition that began on February 22, 1862, during the darkest days of the Civil War, as an effort to remind America of our unity and greatness.",RepMikeJohnson
5,2022-02-21 15:19:22+00:00,1495780190450069509,"Since we included the observance of Abraham Lincoln’s birthday (February 12) at that time, the joint celebration became known as “Presidents’ Day.”",RepMikeJohnson
6,2022-02-21 15:18:25+00:00,1495779952620449792,The stated purpose of the statute creating more 3-day weekends was to “bring substantial benefits to both the spiritual and economic life of the Nation.”,RepMikeJohnson
7,2022-02-21 15:17:44+00:00,1495779780393934858,"In 1968, Congress passed the Monday Holiday Law to “provide uniform annual observances of certain legal public holidays on Mondays.”",RepMikeJohnson
8,2022-02-21 15:16:32+00:00,1495779478878007299,"Our nation began celebrating George Washington’s birthday on February 22, 1800, just two months after his death in December 1799. The tradition was observed annually until 1879, when Congress officially declared it a federal holiday.",RepMikeJohnson
9,2022-02-21 15:15:38+00:00,1495779250162573312,A little background on this uniquely American holiday: https://t.co/jjTjYUIzbx,RepMikeJohnson
10,2022-02-21 13:42:10+00:00,1495755732075040770,"Today, we honor those who have served our great nation in its highest office. 

Happy Presidents' Day! https://t.co/rZ7lbquRNO",RepMikeJohnson
11,2022-02-20 01:53:04+00:00,1495214892558831617,#TheGTakesDaytona! https://t.co/aF6aOcv3Sm,RepMikeJohnson
12,2022-02-18 19:22:07+00:00,1494754116647665665,"This month, we celebrate #BlackHistoryMonth, and recognize the invaluable contributions black Americans have made to our country. https://t.co/5e3UbV5Mpm",RepMikeJohnson
13,2022-02-18 15:36:25+00:00,1494697317911470082,"We are deeply saddened to hear of the passing of our dear friend and colleague, @RepHagedorn. Jim was a truly faithful and humble public servant who gave his all to serving others. He will be deeply missed. Kelly and I are praying for his family and countless friends. https://t.co/PqELZpjcy1",RepMikeJohnson
14,2022-02-17 21:42:46+00:00,1494427124786253825,"It was an honor to speak today at the Shreveport-Bossier Military Affairs Council Quarterly Members Luncheon.

I am proud to represent Barksdale Air Force Base and the Global Strike Command in Congress and look forward to the continued work on behalf of our servicemen and women. https://t.co/agBO87Ta1h",RepMikeJohnson
15,2022-02-17 15:40:00+00:00,1494335831833649167,"In Louisiana, opioid deaths increased 40% from 2020 to 2021, driven by an increase in illicit Fentanyl.

To help reverse this growing crisis, we need a full-court press on our streets, at our borders, and abroad.

My op-ed in today’s @ShreveportTimes ⬇️

https://t.co/hl5hnyMZrT",RepMikeJohnson
16,2022-02-16 22:11:58+00:00,1494072087425830915,"I enjoyed speaking today to the AP Government and Liberal Arts students at my alma mater, Captain Shreve—and it was surreal to be back on the stage where I started 30 years ago.

These students are sharp and asked great questions! Thanks for being such gracious hosts. Go Gators! https://t.co/7LYxzOLhqg",RepMikeJohnson
17,2022-02-16 20:49:21+00:00,1494051295229091854,"In case you missed it: This leaked presentation reveals that the Democrat party’s strategy for November is to *lie to voters.
 
Good luck with that. https://t.co/5YnT1a6GOm https://t.co/s9yqgeYRPu",RepMikeJohnson
18,2022-02-16 17:18:01+00:00,1493998112012128262,Why?? https://t.co/W7RG3UmKvM,RepMikeJohnson
19,2022-02-15 21:08:21+00:00,1493693688769249280,"To the mainstream media outlets that devoted years of coverage to every accusation of Trump-Russia collusion but can’t be bothered to cover exculpatory information:

This is why Americans don’t trust you. https://t.co/j1bkoaZu4B",RepMikeJohnson
20,2022-02-15 20:02:19+00:00,1493677070328774665,"Drug overdoses recently became the leading cause of death for Americans aged 18-45, driven by an increase in fentanyl.

And despite having ample jurisdiction, @HouseJudiciary has held no hearings on fentanyl this Congress.

Today I called for @RepJerryNadler to take action 👇 https://t.co/Lj9dCKskc7",RepMikeJohnson
21,2022-02-14 20:37:17+00:00,1493323483924811779,"Last week, I had the privilege of meeting with @NAICUtweets and @LAICU_US representatives from across Louisiana to hear about their priorities to improve higher education opportunities within our state. 

Thank you for all you do! https://t.co/YSOlNj8Iue",RepMikeJohnson
22,2022-02-14 17:48:29+00:00,1493281000859877377,"GREAT NEWS!

This year the Minden St. Jude Auction continued its leadership tradition and raised a whopping $2,415,317 for the St. Jude Children's Research Hospital! What an incredible achievement for such a worthy cause. https://t.co/mbbOJ7qOp8",RepMikeJohnson
23,2022-02-14 13:29:40+00:00,1493215870306422785,This is bigger than Watergate. https://t.co/CEEorwSULr,RepMikeJohnson
24,2022-02-14 03:04:07+00:00,1493058442810040323,This guy will be back again. Count on it. https://t.co/4mXLkP4J0i,RepMikeJohnson
25,2022-02-13 19:05:39+00:00,1492938033854877707,#GeauxTigers https://t.co/z8LwpRRyTd,RepMikeJohnson
26,2022-02-13 15:52:29+00:00,1492889422739779586,"I dropped by @KNOE8 to discuss the legislation I introduced last week to permanently classify illicit fentanyl as an illegal deadly substance.

My bill gives our law enforcement agencies more certainty when pursuing and prosecuting fentanyl offenses. Check it out ⬇️ https://t.co/qIqfqbkYwx",RepMikeJohnson
27,2022-02-12 17:58:32+00:00,1492558757297074177,"LA-04 is heading to the Super Bowl! Robert Rochell will suit up for the Rams, while Trent Taylor, Brandon Wilson, and Winter-Noelle Grant will represent the Bengals.

I’m proud of these young folks and the great example they have set for the youth of our region. https://t.co/jI6Lun6Pdn",RepMikeJohnson
28,2022-02-11 16:37:16+00:00,1492175915480195076,"Doing so will help our law enforcement agencies get control of the crisis that is destroying so many American families and communities.

Read more about my bill here:

https://t.co/4KgqW2PFHD",RepMikeJohnson
29,2022-02-11 16:36:51+00:00,1492175812002516992,"Drug overdoses recently became the leading cause of death for Americans aged 18 to 45, driven in large part by an increase in illicit fentanyl.

Today, I introduced the CEASE Overdose Act to permanently classify fentanyl at the highest level under the Controlled Substances Act. https://t.co/PVPxZvRXOC",RepMikeJohnson
30,2022-02-11 15:15:55+00:00,1492155442998530049,"If I sound like a broken record, it’s because inflation has gotten worse every month of Biden’s presidency.

From Shreveport to St. Landry, Louisianians are forfeiting more &amp; more of their paychecks because of Democrats’ out of control spending.

We must get this under control. https://t.co/dIALaJMYnQ",RepMikeJohnson
31,2022-02-10 17:41:55+00:00,1491829799718957058,"It was great to have so many Union Parish leaders and friends join us for a thoughtful discussion at today’s Town Hall event in Farmerville.

We love this area and look forward to the next time we are together! https://t.co/WpTopHCZrN",RepMikeJohnson
32,2022-02-10 17:16:57+00:00,1491823515288354826,@LARuralHealth It was our pleasure! Thank you for all you do to faithfully serve the people of Louisiana.,RepMikeJohnson
33,2022-02-10 15:39:44+00:00,1491799049753677824,"Remember when the White House said inflation is a ""high-class problem""?

The actual drivers of inflation:

Increasing prices for food, electricity, and rent. https://t.co/xUzSkBCP4h",RepMikeJohnson
34,2022-02-10 15:09:07+00:00,1491791343504351237,Washington Democrat policies are robbing you of two paychecks per year in broad daylight. https://t.co/Qj8b74EZIH,RepMikeJohnson
35,2022-02-09 22:58:33+00:00,1491547095081361410,"🚨

Proud to stand with conservative leaders @RepChipRoy &amp; @SenTedCruz against President Biden’s unconstitutional vaccine mandates.

Every time Biden’s mandates are examined by the courts, they fail. We urge the Court to defend the 1st Amendment rights of government contractors. https://t.co/Bs8uaKgcJh",RepMikeJohnson
36,2022-02-09 21:32:56+00:00,1491525548450926599,"Tragically, 16 American cities set new homicide records in 2021.

Meanwhile, Democrats CONTINUE to call for defunding police.

While some Dems are changing their talking points because it’s an election year, they can’t hide from the real world consequences of their philosophy. https://t.co/WRCQqDEzBD https://t.co/n6t722twIa",RepMikeJohnson
37,2022-02-09 19:49:20+00:00,1491499474304348161,"Democrats are asleep at the wheel when it comes to addressing the growing fentanyl crisis. 

It’s time to wake up and take immediate steps:
✅ Secure our border
✅ Prosecute criminal offenders
✅ Work with localities to prevent drug abuse rather than accommodate it https://t.co/LoOCoIJ2Wx",RepMikeJohnson
38,2022-02-09 17:37:28+00:00,1491466292376780803,"Under President Biden’s energy policies:

• American energy supply is down
• American energy jobs are down
• American energy demand is unchanged
• So American energy prices are up

The irony?

Russia and OPEC are strengthened and our environment is no better off. https://t.co/henAQ1i6eR",RepMikeJohnson
39,2022-02-09 16:29:02+00:00,1491449069080027139,Tell me you're retiring without telling me you're retiring. https://t.co/GRsdvum9G1,RepMikeJohnson
40,2022-02-08 23:31:12+00:00,1491192924268556290,"TUNE IN: 

@HouseGOP members are taking to the House Floor to address America’s rising fentanyl crisis and Biden’s failing presidency.

📺 WATCH: https://t.co/WLmzpz0NXw",RepMikeJohnson
41,2022-02-08 21:46:43+00:00,1491166629354668032,"Drug overdoses are on the rise, fueled by fentanyl-related causes.

And yet, House Democrats have blocked legislation to effectively ban the selling of illicit fentanyl manufactured by criminals.

This isn’t an issue for gamesmanship. It’s a crisis that requires bipartisanship. https://t.co/6lX8KWNJwo",RepMikeJohnson
42,2022-02-08 19:45:06+00:00,1491136023543181313,"Drug overdose deaths rose by nearly 40%(!) in Louisiana from 2020 to 2021.

If we don’t pull together to curb this crisis, the tragedy will continue to grow. https://t.co/FXGWPZL0eI",RepMikeJohnson
43,2022-02-08 18:52:14+00:00,1491122717969743872,"Friends, my next Town Hall meeting will be in Union Parish on Thursday.

This will be an excellent opportunity for constituents to come out and hear about what’s happening in Washington and to provide input and ask questions, and everyone is welcome! https://t.co/5V5hst5juz",RepMikeJohnson
44,2022-02-08 13:27:20+00:00,1491040952969949189,"Illegal drug overdoses are now the leading cause of death for Americans aged 18-45.

And yet, President Biden and Congressional Democrats’ open-border policies are allowing illegal fentanyl to flow across our borders and into our community.

This is not sustainable. https://t.co/Y1VK7g85aL",RepMikeJohnson
45,2022-02-07 15:40:35+00:00,1490712100645351426,"The flight out of Shreveport early this morning was delayed, but being seated near “Brees” made everyone on the flight feel a little more at ease. 😊 He’s on his way to Shriners Hospital in Boston to visit some children there. Geaux Brees! https://t.co/mCYpHlNVeZ",RepMikeJohnson
46,2022-02-04 21:08:07+00:00,1489707363334606849,No Administration has ever inspired less confidence. https://t.co/GPGdpQ1jW0,RepMikeJohnson
47,2022-02-04 17:35:04+00:00,1489653748213456902,"Congrats to @DucksUnlimited for 85 years and over 15M acres of wetland and waterfowl conservation!

Louisiana is home to many vast wetlands and migratory bird habitats, and we are grateful for the extraordinary work you are doing to protect and preserve our natural resources. https://t.co/pMRoamiVUD",RepMikeJohnson
48,2022-02-04 16:18:47+00:00,1489634549915168774,"Today is #WorldCancerDay, a day to spread awareness and focus on cancer prevention, detection, and treatment across Louisiana, our country, and the world. https://t.co/nXiaHN7w5H",RepMikeJohnson
49,2022-02-04 14:12:22+00:00,1489602734793842689,"The Biden Administration is trying to blame rising crime on everything except the true causes:

Dem policies that are enabling criminals &amp; hurting police.

❌Open borders
❌Personnel shortages
❌Defund police rhetoric
❌Weakened bail policies
❌Downgraded felonies to misdemeanors https://t.co/ODkkC98Vce",RepMikeJohnson
50,2022-02-03 20:51:33+00:00,1489340807287123980,"Democrats have introduced a bill “to counter the Chinese Communist Party,” but the truth is their 2,900-page, $325 billion legislation is terribly counterproductive and would force America to CONCEDE to China.

Take a look for yourself: https://t.co/eGp4XsgA67",RepMikeJohnson
51,2022-02-03 19:12:32+00:00,1489315889073856513,A Republican majority will bring back AGGRESSIVE ACCOUNTABILITY to ensure Washington works for the people again! https://t.co/dKvb6155Yk,RepMikeJohnson
52,2022-02-03 17:06:29+00:00,1489284165795209218,"📺 ICYMI: 20! @HouseGOP members took to the Floor last night to address the Democrats’ America CONCEDES Act, the Biden Administration’s failure to stem the flow of fentanyl into our country, and Pres. Biden’s ongoing economic and national security crises! https://t.co/Pg0lMM4yXR",RepMikeJohnson
53,2022-02-02 18:18:04+00:00,1488939794461777926,"The Biden Administration’s war on American energy production has put OPEC in the driver’s seat once again.

It’s simple Mr. President: we need American workers, American pipelines, and American truckers in order to lower energy prices.

Must watch @CNBC segment from this morning: https://t.co/tHAqFOeS67",RepMikeJohnson
54,2022-02-02 16:49:39+00:00,1488917543129600006,"Instead of competent government, liberal Democrats have produced:
❌Underfunded local police departments
❌Closed &amp; part-time public schools
❌Delayed tax returns and benefits

Americans are ready for a change! https://t.co/ToN8bjrMkj",RepMikeJohnson
55,2022-02-02 13:16:14+00:00,1488863833997418506,"The data now proves that Fauci was wrong, and our common sense objections were right.

The implications of this are staggering. https://t.co/mSXie4UDu5",RepMikeJohnson
56,2022-02-01 22:54:14+00:00,1488646905378787333,"On #NationalFreedomDay, we recognize that pivotal day in our nation's history and reaffirm our commitment to liberty for ALL.",RepMikeJohnson
57,2022-02-01 22:53:53+00:00,1488646816065335300,"157 years ago today, President Abraham Lincoln signed a resolution abolishing slavery, which was later ratified to become the 13th Amendment of the U.S. Constitution. https://t.co/i733QOj9tO",RepMikeJohnson
58,2022-02-01 17:55:51+00:00,1488571813336535043,"Fentanyl is now the leading cause of death for Americans aged 18-45.

Yet the Biden Admin. refuses to change their policies and secure our border to help stem the flow of these deadly drugs &amp; stop this crisis!

The shocking truth: Their political posturing is killing our country. https://t.co/fo1Fr35NAo",RepMikeJohnson
59,2022-02-01 16:17:35+00:00,1488547084739432449,"Since 9/11, half of ALL American troops stationed abroad have trained at Fort Polk. 🇺🇸

No matter the circumstance, our servicemen and women stand ready to meet the challenge, and I am truly honored to represent these leaders and heroes in Congress. https://t.co/9A3DvbRR8L",RepMikeJohnson
60,2022-02-01 01:58:08+00:00,1488330798969364480,Shockingly out of touch. https://t.co/KDDKtumJPb,RepMikeJohnson
61,2022-01-31 22:34:34+00:00,1488279566238236672,"Like clockwork, grocery prices continue to climb across Louisiana and the nation.

It’s clear that Washington Democrats’ reckless spending is responsible for our prolonged inflation problem. https://t.co/j7Akd1qFol",RepMikeJohnson
62,2022-01-30 23:46:53+00:00,1487935377679785990,https://t.co/NWdChODGHv,RepMikeJohnson
63,2022-01-28 18:22:45+00:00,1487129031795478528,"Our @JudiciaryGOP committee is demanding answers from AG Garland on the Biden Administration’s appalling guidance leading certain states to prioritize race in furnishing lifesaving COVID-19 treatments.

Kudos to @Jim_Jordan and @RepDanBishop for leading this crucial effort! https://t.co/AkwRtBcpu7",RepMikeJohnson
64,2022-01-28 17:31:53+00:00,1487116231656280074,"Oversight of the DOJ and FBI is a primary responsibility of our House Judiciary Committee, even if our Democrat colleagues neglect that duty.

FBI Director Wray and AG Garland MUST answer for the continued and unjustified surveillance of American citizens. https://t.co/eXS2sqO2Ef",RepMikeJohnson
65,2022-01-27 22:51:31+00:00,1486834282849001482,"Enjoyed joining Larry Kudlow on @FoxBusiness this afternoon with @RepBethVanDuyne to discuss Speaker Pelosi's China bill proposal and the Democrats’ flailing efforts to keep Build Back Better alive.

Watch👇 https://t.co/BhbliRGM71",RepMikeJohnson
66,2022-01-27 16:45:02+00:00,1486742052079648769,"Today, we remember the millions of Jewish lives taken during the Holocaust.

Never forget. Never again.
#HolocaustRemembranceDay https://t.co/t4VZhUZ3bu",RepMikeJohnson
67,2022-01-27 14:21:29+00:00,1486705929445949443,"Parents should always be the authority on their children's education.

On National School Choice Week we recognize the importance of giving all students access to the best K-12 education possible, and the freedom of families to choose the options that best serve their needs. https://t.co/4Ppd62jHUy",RepMikeJohnson
68,2022-01-26 15:16:07+00:00,1486357288763990023,"Promoting open border policies

Releasing illegal migrants into the country

Inviting non-citizens to vote in American elections
 
It’s becoming clear that the lawlessness is by design. https://t.co/M2JuNykRHf",RepMikeJohnson
69,2022-01-25 18:13:48+00:00,1486039616666931208,"🚨178,840 enforcement encounters at our southern border last month: the worst December on record.

Under President Biden’s lawlessness, every state is now a border state. https://t.co/j5bjg6rD1v",RepMikeJohnson
70,2022-01-24 20:05:41+00:00,1485705383519965197,"Parents, take note: https://t.co/Xd5H14q67H",RepMikeJohnson
71,2022-01-24 19:39:42+00:00,1485698845963075587,"Between 2016-2018, nearly $2 BILLION in taxpayer dollars went to abortion advocacy groups.
 
I was proud to support this important effort from @RepHartzler to bring transparency to federal funding for abortion advocacy groups. https://t.co/8INn4SDjwr",RepMikeJohnson
72,2022-01-24 17:28:26+00:00,1485665810781806594,"Proud to add my voice to @RepChipRoy’s and @RepFischbach’s call for the FDA to answer for a recent report indicating that 85% of certain prenatal genetic tests are inaccurate.
 
This is urgent because a false positive diagnosis can mislead a family to choose abortion. https://t.co/mbiuho3Ooa https://t.co/k4Zg8GtuAU",RepMikeJohnson
73,2022-01-22 22:12:31+00:00,1485012525787799552,"Many of us believe this may be the year the Supreme Court finally corrects its devastating error, and we pray the 50th anniversary of Roe is never allowed to be.",RepMikeJohnson
74,2022-01-22 22:12:30+00:00,1485012523690647552,"49 yrs ago today, SCOTUS delivered its tragic &amp; constitutionally unfounded opinion in Roe v. Wade. The legalization of abortion openly defied the rules of our Creator &amp; the founding principles of our nation, &amp; has led to the staggering loss of &gt;63 million unborn children. https://t.co/lSQOCgSKtq",RepMikeJohnson
75,2022-01-21 16:27:49+00:00,1484563394552287232,"I am proud to have earned an A+ rating on the 2021 @SBAList annual National Pro-Life Scorecard!

In a political environment that was so hostile to the sanctity of human life in 2021, I’m encouraged to see so many of my colleagues still standing strong with us for unborn children. https://t.co/MG2ueKWYS3",RepMikeJohnson
76,2022-01-20 22:53:54+00:00,1484298168351272962,"It is great to see St. Landry Parish represented so well today at the Capitol!

I joined @RepJuliaLetlow in meeting with Opelousas Catholic School students who are in town to see the sights and join us tomorrow for the big pro-life events. https://t.co/6T0HI8fYRE",RepMikeJohnson
77,2022-01-20 20:27:34+00:00,1484261340885704708,"Great to see St. Landry so well represented today. Stay warm, my friends! https://t.co/VAfLl8f6T6",RepMikeJohnson
78,2022-01-20 20:21:58+00:00,1484259932174266374,"I spoke today to mark the tragic anniversary of Roe v Wade.

In the coming months you will hear a lot of talk from the pro-abortion lobby. The truth is simple: abortion takes a baby’s life.

We pray that 2022 is the year the Supreme Court will recognize this truth once again. https://t.co/20LHofex0B",RepMikeJohnson
79,2022-01-20 19:03:34+00:00,1484240200247259141,"President Biden’s very first act was to kill an American energy pipeline, and our country has faced crisis after crisis of his own doing ever since.

From the moment he was sworn in, up until his disastrous news conference yesterday, Biden's 1st year in office has been a failure. https://t.co/h45LctKWfD",RepMikeJohnson
80,2022-01-20 15:16:54+00:00,1484183159226966016,"“Today marks a full year of unified Democrat Party control of Washington, and it's difficult to imagine how President Biden, Speaker Pelosi and House Dems could have performed worse…”

Read my @FoxNews op-ed with @RepStefanik on Dem's disastrous year:

https://t.co/OAyII4zdkZ",RepMikeJohnson
81,2022-01-20 01:23:08+00:00,1483973335201497092,"Today, I led my colleagues on the House Floor to discuss the past year of crises engineered by President Biden and Congressional Democrats.

The American people simply can’t take much more of this! 

Watch👇 https://t.co/Z5sayGLTiF",RepMikeJohnson
82,2022-01-19 23:43:25+00:00,1483948239447633921,"The margins in Congress require bipartisanship, which was never even attempted by the White House or the Democrat leadership. The primary job Americans elected President Biden to do was to help unite the country. He has done the opposite.",RepMikeJohnson
83,2022-01-19 23:43:24+00:00,1483948237346250758,The American people gave the Democrats a razor-thin majority in the House and a Senate split 50-50. No objective person thinks President Biden was given authority to radically transform our country.,RepMikeJohnson
84,2022-01-19 23:43:24+00:00,1483948235219771394,President Biden’s first news conference in months did little to obscure what is a relatively simple truth: he and the Democrats have fundamentally misread their mandate.,RepMikeJohnson
85,2022-01-19 23:09:00+00:00,1483939579719737345,"President Biden said the 2022 election won’t be legitimate unless Congress bans voter ID, legalizes ballot harvesting, and funds Democrat campaigns with taxpayer dollars.

Some might call that a Big Lie. https://t.co/qKnLHAKSzv",RepMikeJohnson
86,2022-01-19 19:08:52+00:00,1483879146841419780,"Happening now: as we approach a full year of Democrat control, @HouseGOP members are heading to the House Floor to address Biden's Economic, Education, National Security, Crime, Border, Covid, and Energy Crises. Tune in!

📺WATCH: https://t.co/qZHRjFpYGe",RepMikeJohnson
87,2022-01-18 14:53:19+00:00,1483452447670603781,"I'm honored to have received the @FaithandFreedom Friend of the Family Award, which recognizes those who stand up for the critical ideals of life, family, and religious freedom. https://t.co/i78LOsDI3k",RepMikeJohnson
88,2022-01-17 14:36:14+00:00,1483085760765079553,"""Darkness cannot drive out darkness; only light can do that. Hate cannot drive out hate; only love can do that.”
#MLKDay https://t.co/kUlODgjL2M",RepMikeJohnson
89,2022-01-16 15:27:34+00:00,1482736293759094790,Respecting and preserving religious freedom is essential to who we are as Americans—but even more fundamental than that—who we are as human beings. We can never let it be taken for granted or taken away. https://t.co/M8BprtKY2s,RepMikeJohnson
90,2022-01-16 02:45:02+00:00,1482544392846159876,Praying tonight for a safe resolution to this senseless crisis. https://t.co/iFGe1J1Na9,RepMikeJohnson
91,2022-01-16 01:04:18+00:00,1482519044238589953,"Congratulations to our LSU Tigers, Joe Burreaux and Ja’Marr Chase, for securing the Bengals’ first postseason victory since 1990! It’s so good to see character and hard work pay off. https://t.co/al0PvzezWZ",RepMikeJohnson
