,Datetime,Tweet Id,Text,Username
188,2021-11-22 19:19:48+00:00,1462863404008415232,"After 10 months of record setting illegal immigration being met with total inaction by the Biden Administration, you have to assume they are perfectly OK with open borders. https://t.co/Z4XXWHS3Hl",RepMikeJohnson
189,2021-11-22 12:24:01+00:00,1462758769109225474,"As America prays for the people of Waukesha, WI, police say a “person of interest” is now in custody for the horrific act of crashing a vehicle through a Christmas parade yesterday. 5 have died &amp; 40+ are injured.

May all the victims be healed &amp; JUSTICE be done quickly. https://t.co/LKzqbRD98w",RepMikeJohnson
190,2021-11-19 19:22:06+00:00,1461776817963032583,Bravo @GOPLeader https://t.co/avnaOd2ebr,RepMikeJohnson
191,2021-11-19 18:55:41+00:00,1461770168007286784,https://t.co/6OQzI68MZG,RepMikeJohnson
192,2021-11-19 17:26:15+00:00,1461747664790376450,Live look at House Dems' retirement party👇 https://t.co/GmXDjtmA0h,RepMikeJohnson
193,2021-11-19 14:52:22+00:00,1461708939171713024,"No wonder the few remaining reasonable House Democrats were nervous about this debacle. Now that they have gone along with it, there won’t be any of them left here after next year's election. 

My statement on the partisan Democrat multi-trillion dollar tax and spending bill ⬇️ https://t.co/av50NpAzgi",RepMikeJohnson
194,2021-11-19 14:22:02+00:00,1461701302694682626,"While we normally use the electronic vote option on the House Floor, I wanted to register this historic vote in my own hand. 

Let history record clearly who stood today for freedom &amp; responsibility, and who voted to march us down the dark road of government control &amp; socialism. https://t.co/tCV3vOgXh8",RepMikeJohnson
195,2021-11-19 03:10:25+00:00,1461532285690421248,You prefer it whispered to you in Chinese? https://t.co/gf7us9N7Gm,RepMikeJohnson
196,2021-11-19 00:16:27+00:00,1461488504798646273,Now that CBO has confirmed this bill adds nearly $400 BILLION to the deficit—contrary to the White House’s claim that the bill is paid for—let’s see if the moderate Democrats keep their promise to only vote for a bill consistent with White House estimates... https://t.co/6yhApTtSMp https://t.co/f9Zg48Y79u,RepMikeJohnson
197,2021-11-18 21:05:42+00:00,1461440500234338309,"“Fatally flawed...”

“One-size-fits-all sledgehammer…”

The federal Fifth Circuit’s description of President Biden’s vaccine mandate is precisely right, and now Congress must act to permanently outlaw Biden’s unworkable, unconstitutional rule once and for all. https://t.co/XZbaw1bC38",RepMikeJohnson
198,2021-11-18 18:13:45+00:00,1461397228375924737,"There’s been a lot of talk about the Democrats’ disarray over their multi-trillion dollar tax-and-spend scheme. 

Here’s a sample of what is actually in the bill… https://t.co/JQ40nOCYPI",RepMikeJohnson
199,2021-11-18 00:04:58+00:00,1461123226269011968,"Whether it’s the most expensive Thanksgiving in history, inflation and skyrocketing gas prices, or our overwhelmed southern border, one thing is for certain:

The answer to the countless Democrat-caused crises, is NOT more Democrat-authored policies. https://t.co/MMbr38ETtV",RepMikeJohnson
200,2021-11-17 23:10:24+00:00,1461109495342456837,"OSHA is now (reluctantly) recognizing the rule of law…

https://t.co/Vr5papfXQV",RepMikeJohnson
201,2021-11-17 21:51:13+00:00,1461089570171281413,"Happening now: @HouseGOP members are heading to the House Floor to address Biden's economic, border, and energy crises, as well as the #ThanksgivingTax and House Democrats' disastrous tax and spending package.

Tune in! 📺WATCH: https://t.co/qZHRjFpYGe",RepMikeJohnson
202,2021-11-17 20:04:49+00:00,1461062792614658060,"Democrats actually suggest the answer to all the Democrat-caused crises is… more Democrat policy.
 
They would rather cause further pain for hardworking American families than simply admit their reckless tax-and-spend agenda is the wrong response at the worst possible time. https://t.co/dDTt7avlcD",RepMikeJohnson
203,2021-11-17 17:07:21+00:00,1461018132680749062,"🚨 @JudiciaryGOP has evidence that the FBI is using ""counterterrorism tools"" to track American parents.

So did AG Garland mislead Congress when he said this isn’t happening, or does he not know what his own agency is up to?

Garland must answer for his discrepancies under oath. https://t.co/F9htjV4yF7",RepMikeJohnson
204,2021-11-16 21:09:47+00:00,1460716752640352256,"NEW:

Whistleblower documents reveal that the FBI’s COUNTERTERRORISM division is adding a “THREAT TAG” to parents who protest at local school boards.

This comes after Attorney General Garland told Congress that he isn't targeting parents.

Garland needs to testify again ASAP. https://t.co/JMxey19iEz",RepMikeJohnson
205,2021-11-16 19:31:42+00:00,1460692068913889288,"As I have said from the very beginning, the Biden mandates are attempting to steamroll our constitutional norms, and these legal challenges are essential for us to maintain the rule of law and individual rights.",RepMikeJohnson
206,2021-11-16 19:31:19+00:00,1460691971702497280,"mandating COVID vaccines on nearly every full-time employee, part-time employee, volunteer, and contractor working at a wide range of healthcare facilities receiving Medicare or Medicaid funding.
https://t.co/XUUjjId3LX",RepMikeJohnson
207,2021-11-16 19:28:06+00:00,1460691162159853568,"Meanwhile, LA Attorney General Jeff Landry has filed yet another lawsuit with 11 other states challenging the legality of the Centers for Medicare and Medicaid Services’ rule...",RepMikeJohnson
208,2021-11-16 19:25:59+00:00,1460690631538454535,"The injunction prohibits it from going into effect while the remaining legal process plays out.

https://t.co/GQ6Li4GdsF",RepMikeJohnson
209,2021-11-16 19:25:25+00:00,1460690487413772288,"The federal Fifth Circuit (covering LA, TX &amp; MS) just affirmed its NATIONWIDE injunction on the OSHA mandate, rightfully describing it as a “one-size-fits-all sledgehammer” and “fatally flawed.”",RepMikeJohnson
210,2021-11-16 19:25:04+00:00,1460690402483310595,"There is a great deal of confusion and anxiety concerning the Biden Administration’s VACCINE MANDATES, but here is a very encouraging update:",RepMikeJohnson
211,2021-11-15 20:41:31+00:00,1460347252820566018,"Empty store shelves
 
Inflation at 30-year high
 
Gas prices up 61% since last year
 
Home heating prices up 54% since last year
 
Workers staying at home instead of working
 
Most expensive Thanksgiving in recent memory

This is absolutely an historic economic crisis. https://t.co/9iNdkZq6fJ",RepMikeJohnson
212,2021-11-15 18:12:05+00:00,1460309646703538193,“Religion that God our Father accepts as pure and faultless is this: to look after orphans and widows in their distress and to keep oneself from being polluted by the world.” (James 1:27),RepMikeJohnson
213,2021-11-15 18:11:45+00:00,1460309562767073282,"November is National Adoption Month, which brings attention to the issue and the 117,000 children currently waiting to find their forever families. There is no greater gift than this. https://t.co/2HvydzaYTa",RepMikeJohnson
214,2021-11-13 20:16:42+00:00,1459616233096105989,"Proving once again that Louisianians are the strongest, most resilient people of all.

Geaux Ms. Julia!

https://t.co/9oyw5DN764",RepMikeJohnson
215,2021-11-13 16:07:54+00:00,1459553618235994112,"Hello, Big Government Socialist fantasy economics. Meet Reality.

https://t.co/ocXrVSS4HJ",RepMikeJohnson
216,2021-11-12 22:13:51+00:00,1459283325957427204,"To pursue the Left’s radical environmental agenda, the Biden Administration declared war on the oil &amp; gas industry. 

They simply DO NOT CARE how much pain their decisions inflict upon the American people. https://t.co/Czg8Mfgggg",RepMikeJohnson
217,2021-11-12 17:44:11+00:00,1459215460138987523,"Small businesses are the lifeblood of our economy. 

Yesterday, I sat down with local Chamber of Commerce leaders, food producers, and manufacturers in Evangeline Parish for a roundtable on the supply chain and ways to support small businesses during this challenging time. https://t.co/euJ98qKtM4",RepMikeJohnson
218,2021-11-12 14:29:57+00:00,1459166581305577474,"Thanks to all who participated and offered great questions and comments. Town halls are an important part of our representative form of government, and I look forward to seeing you all at another one soon.",RepMikeJohnson
219,2021-11-12 14:29:38+00:00,1459166499520798721,It was great visiting with so many of our friends and neighbors in Evangeline Parish yesterday. https://t.co/6HQr1oaeXP,RepMikeJohnson
220,2021-11-11 21:23:44+00:00,1458908326327160833,I was honored to participate in the excellent Veterans Day ceremony today in Ville Platte! THANK YOU to all those who have defended our freedom!,RepMikeJohnson
221,2021-11-11 21:23:31+00:00,1458908271738335247,"“Our liberties, our values, all for which America stands is safe today because brave men &amp; women have been ready to face the fire at freedom’s front. And we thank God for them.” -Ronald Reagan https://t.co/X7OMg80v0Q",RepMikeJohnson
222,2021-11-11 19:18:09+00:00,1458876722804412416,"Louisiana’s military installations are critical to our nat'l defense, but also our state’s economy.

After generating $10 billion in economic impact and employing 77,000 in 2020, it’s imperative that we continue to support Ft. Polk, Barksdale, and all of our great installations. https://t.co/vmBMzt3EB8",RepMikeJohnson
223,2021-11-11 17:44:46+00:00,1458853220344897536,"To all of the men and women who have served in the U.S. military, we cannot thank you enough for all you have done. Our country is greater because of YOUR sacrifices.

If you enjoy your freedom, thank a veteran today! https://t.co/SyH4wxWZv2",RepMikeJohnson
224,2021-11-10 21:48:59+00:00,1458552292496510979,"I will be hosting a town hall in Evangeline Parish on Thursday, November 11th, at 1:30 pm CT. 

This is an excellent opportunity to voice your concerns or ask any questions you might have about what’s going on in D.C. and in our state.

I hope to see you there! https://t.co/jqoEWglFbO",RepMikeJohnson
225,2021-11-10 20:45:39+00:00,1458536354049052673,"BIG NEWS!
 
According to a new study, military-related spending in Louisiana creates $9.64 BILLION in annual economic impact across all regions of our state, resulting in approximately 77,000 jobs! Barksdale &amp; Ft. Polk—are the primary drivers of this impact.
 
#LouisianaSTRONG https://t.co/oimxxNDEv2",RepMikeJohnson
226,2021-11-10 19:18:33+00:00,1458514433915883521,"Unless these Democrats reject passing YET ANOTHER massive multi-trillion government spending bill while inflation soars to its highest level in 30 years, before they even have full CBO scores, they do not get to rebrand themselves as “Normal.” https://t.co/2uQdq8VZ48",RepMikeJohnson
227,2021-11-10 16:28:34+00:00,1458471654196187138,"Democrats are going to try to tell you that the solution to rising prices, empty shelves, and workers staying at home is to pass a FIFTH massive government spending bill in just the last two years.

Do not listen to them.",RepMikeJohnson
228,2021-11-10 15:10:56+00:00,1458452116746424324,Happy 246th Birthday to the @USMC! Semper Fidelis 🇺🇸 https://t.co/pt5Olyjgmv,RepMikeJohnson
229,2021-11-10 14:16:29+00:00,1458438417742761995,"Since Biden took office, prices are rising at their fastest rate in THREE DECADES.

Republicans have been shouting from the rooftops that Pelosi’s reconciliation bill will make this trend even worse.

A small handful of commonsense Democrats could help put a stop to it right now. https://t.co/Bc1ZwbXKxF",RepMikeJohnson
230,2021-11-09 21:27:52+00:00,1458184589160091652,"Democrat policies are setting Thanksgiving 2021 up to be the most expensive Thanksgiving in memory.

No wonder President Biden’s approval ratings are so abysmal. https://t.co/eSqmrGR8fb",RepMikeJohnson
231,2021-11-09 20:42:46+00:00,1458173241051262981,"REMINDER:

Not only is the Biden Administration IGNORING immigration law, they want to pay illegal immigrants $450K each because President Trump chose to ACTUALLY ENFORCE immigration law.

Every passing day under the Biden Administration is adding outrageous insult to injury.",RepMikeJohnson
232,2021-11-08 20:29:18+00:00,1457807461197438981,"❌Mobilizing against American parents
❌Spying on Americans' bank accounts
❌Crushing American energy independence
❌$450,000 checks for illegal immigrants

In less than one year, the Biden Administration has turned the federal government completely against the American people.",RepMikeJohnson
233,2021-11-07 17:57:35+00:00,1457406894084079621,"The Biden Admin. wants to pay illegal migrants $450K each because President Trump actually enforced immigration law.

That’s 4.5X more than our government pays Gold Star families of fallen U.S. soldiers!

Proud to join @HouseGOP colleagues on this bill to stop this Biden madness. https://t.co/dGj7UNGD9Q",RepMikeJohnson
234,2021-11-07 14:03:11+00:00,1457347906315374593,"Grateful for judges who apply the plain language of the Constitution &amp; respect the rule of law. This 5th Circuit panel included my good friend and former co-counsel, Kyle Duncan, w/ Edith Jones &amp; Kurt Engelhardt.  #stopexecutiveoverreach   https://t.co/d2W5ArHPoP",RepMikeJohnson
235,2021-11-06 22:03:24+00:00,1457106367089684482,Geaux Jeff! https://t.co/NQrER5AEUk,RepMikeJohnson
236,2021-11-06 03:48:51+00:00,1456830916517666820,My statement on the $1.2 trillion spending legislation ⬇️ https://t.co/4T3vt2uzHZ,RepMikeJohnson
237,2021-11-05 21:00:21+00:00,1456728111530352651,"When confronted with simple, direct questions about whether abortion takes a human life, Democrats never give a straight answer, because the truth is devastating to their cause.
 
We will continue to expose them.
 
This is how we will win the abortion debate. https://t.co/6Z1Chpt1bT",RepMikeJohnson
238,2021-11-05 20:07:42+00:00,1456714864257290245,"We've filed legislation to block the mandate, and we will do all we can to support the states' legal challenges to defend your fundamental right of conscience.",RepMikeJohnson
239,2021-11-05 20:07:18+00:00,1456714761891090437,"To the health care workers, first responders, servicemembers, and every hardworking American affected by President Biden's unconstitutional vaccine mandate: We won't stop fighting for you! https://t.co/yRUbiAmwiq",RepMikeJohnson
240,2021-11-05 18:35:19+00:00,1456691613875515392,"House Democrats want to pass their new 2,135 page tax and spending bill:

Before we have a CBO score of the budgetary impact

Before they tell the American people what’s in it

Before Members can even read it

No wonder the few remaining moderate Dems are queasy about this.",RepMikeJohnson
241,2021-11-05 18:03:20+00:00,1456683565039726597,"Here’s the bill that Democrats are trying to pass TODAY after not making it public until LATE LAST NIGHT.
 
Either House Democrats are expert speed readers OR they haven’t read their own legislation yet.
 
I think we know the answer. https://t.co/7GTFCRbGOC",RepMikeJohnson
242,2021-11-05 16:25:01+00:00,1456658824685830145,"As we enter hour 4 of the STILL open vote on our GOP Motion to Adjourn, I just delivered a copy of the Dems’ 2,135 page tax-and-spend bill to the House Floor to illustrate there is literally no way that any Member read that bill since it was released late last night.
 
#madness https://t.co/sj72IJJg97",RepMikeJohnson
243,2021-11-05 15:28:18+00:00,1456644549074464773,"More than 3 hours now, and Speaker Pelosi STILL has the vote open as they try to whip enough vulnerable Democrats to support their tax-and-spending spree… https://t.co/eiLFUiLZdr",RepMikeJohnson
244,2021-11-05 13:25:06+00:00,1456613546473705476,"There’s a reason abortion advocates speak exclusively in euphemisms and avoid using plain English.

They can’t admit the simple truth: that abortion takes a baby’s life.

Just watch for yourself ⬇️ https://t.co/NW8OdrPXVN",RepMikeJohnson
245,2021-11-05 12:52:25+00:00,1456605319950372864,"Right after the House opened for session this morning, we blasted the Biden Administration's crazy plan to pay illegal aliens for entering our country - then moved to ADJOURN to try to stop the vote on the Democrats Big Gov't Socialist scam bills. Votes are being recorded now... https://t.co/wH2wmxKpOK",RepMikeJohnson
246,2021-11-05 11:30:31+00:00,1456584710562500609,"Ron is right!  LA should join FL, GA &amp; AL to challenge the OSHA vaccine mandate in federal court.

The federal government has no constitutional authority to impose this medical policy through an agency rule. The Biden Administration is out of control!  https://t.co/BqN72RZKwJ",RepMikeJohnson
247,2021-11-05 02:55:27+00:00,1456455087606358017,"What we do know for certain is that this is the MOST EXPENSIVE expensive legislation in American history coupled with the LARGEST TAX INCREASES ever considered in Congress.

#DISASTER",RepMikeJohnson
248,2021-11-05 02:55:26+00:00,1456455086478143492,"It’s impossible for Members to actually read and fully digest this 2,100 page monstrosity before the vote, much less obtain an objective CBO score of its total costs!",RepMikeJohnson
249,2021-11-05 02:55:26+00:00,1456455084712341510,"Late tonight, Dems announced will we be voting at 8 AM tomorrow on their utterly reckless, tax and spending, Big Government Socialism bills. 

After months of chaos and disarray, the latest “Build Back Better"" bill version was just filed yesterday! https://t.co/oCbLkEoqlA",RepMikeJohnson
250,2021-11-04 23:37:27+00:00,1456405259002302465,"To my Democrat colleagues obsessed with advancing abortion in the United States:
 
Abortion is not “health care.”
Abortion is not “love” or “a blessing!”
 
Abortion is an unspeakable tragedy, and it is time for our country to move on from it. https://t.co/QVrg0H7p2d",RepMikeJohnson
