,Datetime,Tweet Id,Text,Username
92,2022-01-14 16:00:26+00:00,1482019787706359816,"Yesterday morning: Democrats called the filibuster a racist Jim Crow relic

Yesterday evening: Democrats deployed the filibuster to stop a bill that would sanction Russian energy interests https://t.co/b4Gl3GLbsQ",RepMikeJohnson
93,2022-01-14 14:08:38+00:00,1481991651430223873,https://t.co/CIcamxwkTh,RepMikeJohnson
94,2022-01-14 14:04:53+00:00,1481990706998784000,"Yesterday the Sup Ct affirmed what I said immediately after Biden issued his OHSA vax mandate on private businesses: it was blatantly UNCONSTITUTIONAL.

Now, my 2nd assumption is also being confirmed: Biden KNEW the order was unlawful—&amp; simply didn’t care! https://t.co/HhUGR6gdlA",RepMikeJohnson
95,2022-01-13 22:23:34+00:00,1481753816152395784,"In recent polls, 94% of Americans say it is “EASY to vote!” And the data shows more Americans from minority communities are voting now than ever before in our history.",RepMikeJohnson
96,2022-01-13 22:22:39+00:00,1481753585662713865,"Democrats are intentionally misleading the public to try to convince us that another “Jim Crow” era is at hand. 
 
This is a despicable and clearly false assertion. The FACTS are crystal clear! https://t.co/76JCRpRvgG",RepMikeJohnson
97,2022-01-13 21:01:44+00:00,1481733222937546752,"In America, we protect the rights of the people to make the best decisions for their own families, and we must continue the fight to preserve our fundamental freedoms.",RepMikeJohnson
98,2022-01-13 21:00:50+00:00,1481732998454288391,The opposite outcome on the healthcare worker mandate is a great disappointment and will impose an extreme hardship on many of our area’s providers.,RepMikeJohnson
99,2022-01-13 20:39:01+00:00,1481727506160013314,"🚨 BREAKING NEWS:

This opinion was just issued this afternoon while I was on a flight. Reviewing it now, but it appears to be a critical victory for limited government and personal responsibility—at least as it pertains to the outrageous OSHA mandate. https://t.co/2Nx7Dp8NuE",RepMikeJohnson
100,2022-01-13 15:51:55+00:00,1481655255511101445,"Late last night, House Dems rejected our @HouseGOP resolution affirming that illegal immigrants and foreign citizens should not be allowed to vote in our elections.

It’s outrageous that this even needs to be explained:

American elections should be decided by American citizens. https://t.co/SRG2Bo5edE",RepMikeJohnson
101,2022-01-13 14:10:31+00:00,1481629737533464578,"Consumer prices are at 40 year highs.

Labor shortages are causing empty shelves.

Many schools across the country are closed.

And what are Washington Democrats focused on?

Passing a bill to take over the election system, ban voter ID, and fund their campaigns with your taxes.",RepMikeJohnson
102,2022-01-12 21:19:48+00:00,1481375384272879625,Biden’s presidency has utterly collapsed. https://t.co/zmgJCfU0xF,RepMikeJohnson
103,2022-01-12 19:01:06+00:00,1481340478515724288,"It’s been nearly a year since the Democrats took office and what do they have to show for it? 

Increasing crime in our cities, decreasing faith in our institutions, and their “American Rescue Plan” has proven to be government waste on steroids. https://t.co/MmfJDrPNRG",RepMikeJohnson
104,2022-01-12 16:20:37+00:00,1481300089058512897,"Joe Biden in July: “There’s nobody suggesting there’s unchecked inflation on the way.”
 
Jen Psaki in November: ""We are not in the middle of an historic economic crisis right now.""
 
The reality today: https://t.co/vMRlaFfmvj",RepMikeJohnson
105,2022-01-11 21:35:58+00:00,1481017063447666688,"@timburchett You earned it, brother! Grateful to serve with you.",RepMikeJohnson
106,2022-01-11 20:22:00+00:00,1480998450527412228,"We now know where the idea for the NSBA letter to the Biden Administration labeling parents as domestic terrorists originated:

The Biden Administration. https://t.co/hgpP9Um2fM",RepMikeJohnson
107,2022-01-10 23:18:47+00:00,1480680550339907588,"Remember when Democrats called President Trump a Russian asset?

Now the Biden Administration is literally lobbying American lawmakers on behalf of Russian energy interests. https://t.co/cXKuNsWhpt",RepMikeJohnson
108,2022-01-10 16:32:33+00:00,1480578319892553730,"How are the supposed “experts” the last to understand that deaths FROM Covid should be counted separately from deaths WITH Covid? 

With this admission, there is absolutely NO justification for continued lockdowns and unconstitutional mandates. https://t.co/Nvxp8qqt7w",RepMikeJohnson
109,2022-01-07 16:12:24+00:00,1479486082928554000,"Today marks the worst jobs report of Biden’s presidency so far.

Instead of more spin, the White House owes the American people solutions. https://t.co/G79kU6Fh2t",RepMikeJohnson
110,2022-01-05 20:03:04+00:00,1478819355672694784,Chicago has received BILLIONS in pandemic relief money to assist with keeping schools open safely—but the Chicago Teachers Union members refuse to do their jobs. It’s a complete dereliction of duty! https://t.co/aQYE8BUeBm,RepMikeJohnson
111,2022-01-05 15:44:33+00:00,1478754299089936389,Schumer should heed his OWN advice. https://t.co/hDAD0Hk2Ue,RepMikeJohnson
112,2022-01-04 21:28:21+00:00,1478478433063780364,"Remember: Biden’s self-inflicted testing shortage is the result of him taking COVID stockpile and testing funds to try to fix his self-inflicted border crisis.

This is pure incompetency all the way down. https://t.co/uqTV8zDKu4",RepMikeJohnson
113,2022-01-04 20:14:01+00:00,1478459723032809472,"Randi Weingarten might not grasp it, but parents have known since April 2020 the harmful effects of school closures on school children. https://t.co/93m024bpX1",RepMikeJohnson
114,2022-01-03 23:54:08+00:00,1478152731194007553,"I was humbled to lead 37 @HouseGOP colleagues alongside @SenTedCruz and 9 GOP senators in filing an Amicus Brief in support of the brave service members seeking religious accommodations for the DOD’s vaccine mandate.

The takeaway: When your freedoms are threatened, fight back.",RepMikeJohnson
115,2022-01-03 23:53:01+00:00,1478152449986904068,"MAJOR NEWS:

The U.S. District Court for the Northern District of Texas just ruled that the Department of Defense cannot punish military service members seeking religious exemptions from the Biden Administration’s vaccine mandate. https://t.co/hWcTAesJdB",RepMikeJohnson
116,2022-01-03 20:08:52+00:00,1478096039513047040,"In America we protect the rights of the people to make the best health care decisions for their families.

I joined my colleagues in filing an Amicus Brief in support of blocking Pres. Biden's unconstitutional vaccine mandate and preventing further damage to our small businesses. https://t.co/ZxXhuPKLxD",RepMikeJohnson
117,2022-01-01 06:55:02+00:00,1477171491347308545,"2021 was a long haul, and for so many, it brought great challenge and even suffering. But a new year brings the promise of a new beginning and the hope of better and brighter days. “…And hope does not put us to shame.” (Romans 5:3-4)   May 2022 be your best year yet! https://t.co/AJ4NrSvBKq",RepMikeJohnson
118,2021-12-30 16:55:28+00:00,1476597817644920840,https://t.co/3reoqiDTpu,RepMikeJohnson
119,2021-12-30 04:44:17+00:00,1476413810659442695,There were fitting honors today for a life of service. Our prayers are with the Henry family.  https://t.co/YFpbm5OG0c,RepMikeJohnson
120,2021-12-29 21:09:35+00:00,1476299381846552583,https://t.co/cU9xmtMqPd,RepMikeJohnson
121,2021-12-29 16:04:04+00:00,1476222497276116994,https://t.co/7vgACVKVtm,RepMikeJohnson
122,2021-12-29 13:52:13+00:00,1476189314518335494,https://t.co/JUzrwDYbX4,RepMikeJohnson
123,2021-12-28 19:33:11+00:00,1475912731903594502,https://t.co/mv49W9UTdx,RepMikeJohnson
124,2021-12-28 16:02:26+00:00,1475859697739739145,"It is a great blessing every day to serve the extraordinary people of #LA04, and I am truly honored to be your representative in Washington.",RepMikeJohnson
125,2021-12-28 16:01:59+00:00,1475859583600140290,"As 2021 comes to a close, we want to thank all of our constituents and friends who engaged with my offices this year, either to provide feedback or request assistance. https://t.co/zBPgDEFx8x",RepMikeJohnson
126,2021-12-27 18:07:39+00:00,1475528818865680384,No amount of spin from the White House or their corporate media allies can distract the American people from reality. https://t.co/pdlYQDQLvc,RepMikeJohnson
127,2021-12-23 13:59:04+00:00,1474016710759960580,"Never forget where you came from.

https://t.co/PXPjyaAdHF",RepMikeJohnson
128,2021-12-22 17:49:23+00:00,1473712284925050896,"This profoundly tragic and unnecessary story of loss in LA was caused by an intoxicated driver from out of state.  
We are praying for the Simmons family, and that everyone will renew their commitment to never, ever drive under the influence. https://t.co/SupsZqqpSM",RepMikeJohnson
129,2021-12-22 00:11:10+00:00,1473445974513266695,"""...Sen. Cruz led seven of his Senate colleagues on the brief, which was also joined by 38 House Republicans led by House Republican Conference vice chair Mike Johnson.""

This is not about politics. It's about preserving liberty--and defending our nation. https://t.co/nvuAlTtAEm",RepMikeJohnson
130,2021-12-21 00:47:35+00:00,1473092750996385797,"@CongressmanHice
@RepClayHiggins
@repdarrellissa
@RepRonnyJackson
@RepLaMalfa
@RepDLamborn
@USRepLong
@RepThomasMassie
@RepBrianMast
@RepMaryMiller
@RepGregMurphy
@RepRalphNorman
@RepScottPerry
@RepRosendale
@RepChipRoy
@RepGregSteube
@RepWebster
@TXRandy14",RepMikeJohnson
131,2021-12-21 00:47:09+00:00,1473092643945123842,"@RepRickAllen
@RepBrianBabin
@RepJackBergman
@RepAndyBiggsAZ
@RepDanBishop
@RepMoBrooks
@RepBoebert
@RepKatCammack
@Rep_Clyde
@WarrenDavidson
@RodneyDavis
@RepJeffDuncan
@RepBobGibbs
@replouiegohmert
@RepBobGood
@RepGosar
@RepMichaelGuest
@RepAndyHarrisMD
@RepHartzler",RepMikeJohnson
132,2021-12-21 00:45:40+00:00,1473092270668894212,Proud to be joined by 37 @HouseGOP colleagues in filing an Amicus Brief in support of the 35 Navy service members seeking religious accommodations for the Department of Defense's COVID-19 vaccine mandate. https://t.co/VuNrBXvpPb,RepMikeJohnson
133,2021-12-19 15:40:14+00:00,1472592620702556162,"THANK YOU, Senator Joe Manchin!  With this decision you are definitely serving the best interests of your constituents—and our entire nation. https://t.co/WmeWAG0GXr",RepMikeJohnson
134,2021-12-17 19:40:00+00:00,1471928180969771016,"Under the National Defense Authorization Act of 2022, the Army and the Air Force are now authorized to invest more money in Louisiana than anywhere else in the world.

This bill is a major win for Louisiana and for our country! https://t.co/v3QV0GnopB",RepMikeJohnson
135,2021-12-17 18:22:14+00:00,1471908612243181573,"Under the Dems’ so-called “voting rights” bill:

Federal bureaucrats would take control of all elections, eviscerating states' rights.

Pro-life voters' tax dollars could be sent to pro-abortion candidates.

2nd Amendment advocates would be forced to fund gun control candidates. https://t.co/pteTmvZti1",RepMikeJohnson
136,2021-12-15 22:20:46+00:00,1471243865936084992,"A helpful resource is here: 
https://t.co/dHlcSKYfM7",RepMikeJohnson
137,2021-12-15 22:19:22+00:00,1471243512842752005,"Today, we celebrate the 230th anniversary of the Bill of Rights. 

Now more than ever, we need to defend and preserve our freedoms and help the next generation understand that the job of government is not to GRANT us rights—but to SECURE the rights that are given to us by God. https://t.co/dcWDsmF5dT",RepMikeJohnson
138,2021-12-15 21:23:09+00:00,1471229366919213060,"We’re so grateful that the National Defense Authorization Act of 2022, which funds top priorities for our national defense and for Louisiana’s 4th Congressional District, will now be signed into law. 

Here are the BIG WINS for LA-04 ⬇️ https://t.co/vEZ78BmZh1",RepMikeJohnson
139,2021-12-14 22:04:18+00:00,1470877334559465483,"Inflation according to Dems:
At first it wasn’t real
Then it was “transitory”
Next it was a “high-class problem”

Now that inflation is at the highest point in decades, they say it can only be fixed by passing their BBB bill.

Their spin is as shameless as it is ridiculous. https://t.co/hYqfgLD7xc",RepMikeJohnson
140,2021-12-14 20:58:05+00:00,1470860669075574785,"HOWEVER… @PressSec at press briefing on August 31: 

“The President remains committed to getting every American citizen who wants to get out, out. That’s an enduring commitment, one that will not change and one we’re going to focus on every single day.” https://t.co/e61ItzI6dA",RepMikeJohnson
141,2021-12-14 15:21:48+00:00,1470776041874636809,"73% of Americans believe the border crisis MUST be addressed immediately.

Yet, the Biden Administration continues to sit back while illegal immigrants and dangerous drugs are coming into our country in record-breaking numbers. https://t.co/Mes42ZiEdh",RepMikeJohnson
142,2021-12-13 18:19:44+00:00,1470458429370253313,"Congrats to the Homer Pelicans for bringing home the state 1-A high school football championship over the weekend! Way to go, Pelicans! https://t.co/GTMvuUoOlO",RepMikeJohnson
143,2021-12-13 15:55:30+00:00,1470422135789268998,"On Dec. 13, 1636, it all began when the first three militia regiments in North America were authorized by the Massachusetts colonial legislature.

Today &amp; every day, we are grateful for the men and women of the National Guard who work tirelessly to support and protect our nation.",RepMikeJohnson
144,2021-12-13 15:54:58+00:00,1470422001466621953,Happy 385th Birthday to the @NationalGuard! https://t.co/mtGfHrtCrL,RepMikeJohnson
145,2021-12-11 14:16:25+00:00,1469672423385673736,"A countless number of Americans suffered through devastating tornadoes in 5 states last night. There are ongoing reports of many fatalities, injuries and property damage. Our prayers are with all those affected.  https://t.co/8nNFOIw137",RepMikeJohnson
146,2021-12-10 20:44:57+00:00,1469407812975534087,"Today we learned:
• The Democrat BBB bill will add $3 TRILLION to our national debt
• Inflation since Biden took office is at it’s highest level in 40 years

When Democrats told you their bill is “paid for” and inflation is “transitory”—they were clearly NOT telling the truth. https://t.co/70doNotuku",RepMikeJohnson
147,2021-12-10 20:05:03+00:00,1469397770977042438,"Democrats actually want you to believe the answer to skyrocketing, once-in-a-generation inflation is…

Trillions MORE in new taxes and spending.
 
Seriously. That’s their position. 

KILL THE BILL! https://t.co/NhrGfWc3DS",RepMikeJohnson
148,2021-12-10 18:50:58+00:00,1469379127417483273,"Meanwhile, President Biden and Democrats in Congress are trying to pass ANOTHER multi-trillion dollar spending bill before Christmas.

If they apply any common sense at all, this inflation report will be the final nail in the coffin for BBB. https://t.co/dlbglJTySA",RepMikeJohnson
149,2021-12-10 16:41:01+00:00,1469346424735387648,"We fought hard, and the NDAA will send Louisiana more military construction dollars than anywhere else in the world.

READ: “Barksdale, Fort Polk score big budget wins in the U.S. House passed defense spending bill” at @ShreveportTimes: https://t.co/IwkqOKyQPN",RepMikeJohnson
150,2021-12-10 15:30:34+00:00,1469328696238559240,"REMINDER: Every single House Democrat, except for one, just voted for the largest spending bill in history, at the very same time our country is experiencing the highest prices IN A GENERATION. https://t.co/IxPGk7AtB4",RepMikeJohnson
151,2021-12-09 19:48:12+00:00,1469031141269286918,"Today, we honor the life and legacy of Senator Bob Dole, a true statesman and principled leader whose impact extended far beyond the Halls of Congress.

His service to our nation will not be forgotten. https://t.co/uPXCbjqaP1",RepMikeJohnson
152,2021-12-09 18:14:09+00:00,1469007475093475332,"This is good work by the United States Senate.

I now look forward to our “moderate” House Democrat friends joining House Republicans in pressing House Leadership for a vote on this bipartisan bill to protect Americans from unconstitutional mandates! https://t.co/Pe5GCz2uAP",RepMikeJohnson
153,2021-12-08 21:54:08+00:00,1468700449209466888,"We’re proud of Fort Polk for receiving one of only seven 2021 Army Partnership Awards, which celebrate outstanding defense communities that actively work to improve the quality of life at their installation. 

This recognition is so well deserved!

https://t.co/XczSShKgzB",RepMikeJohnson
154,2021-12-08 18:07:40+00:00,1468643457191321602,"Today, @Jim_Jordan, @RepMattGaetz and I summed up the weaponization of the Biden-Garland Justice Department, including:

• Suing TX for its pro-life law

• Suing GA for its election integrity law

• Aiming the FBI at parents

• Pushing unconstitutional vaccine mandates https://t.co/vOVcaTv49b",RepMikeJohnson
155,2021-12-08 16:23:00+00:00,1468617114688933897,"🚨

HUGE NEWS.

The Biden Administration’s unconstitutional vaccine mandate for federal contractors has been struck down in federal court.

Every time Biden’s mandates are scrutinized by the courts, they fail. https://t.co/g8phVNFUSY",RepMikeJohnson
156,2021-12-08 04:17:06+00:00,1468434437461397505,Proud to support the National Defense Authorization Act of 2022 which funds major priorities for our national defense and for Louisiana’s 4th Congressional District. My statement: https://t.co/7FgACcp2hN,RepMikeJohnson
157,2021-12-07 19:37:50+00:00,1468303757541019649,"Today, we remember the 80th anniversary of the attack on Pearl Harbor and honor the Americans who paid the ultimate sacrifice protecting our freedom. https://t.co/H5HrlZ4wEM",RepMikeJohnson
158,2021-12-05 16:58:26+00:00,1467538868056600585,We’ve lost a true patriot this morning. God bless the family and the legacy of Sen. Bob Dole. https://t.co/Op870Vg08k,RepMikeJohnson
159,2021-12-03 18:11:29+00:00,1466832477394284551,Democrats should probably stop posting graphs for a while. https://t.co/Rz9McrhrQC,RepMikeJohnson
160,2021-12-03 17:25:26+00:00,1466820888771321858,"🚨 🚨 🚨 
 
The Biden Administration has officially backed off and will not enforce their unconstitutional vaccine mandate against health care workers.
 
Next, we must ensure that NO American worker is faced with these outrageous, unlawful mandates. https://t.co/PsyGWpC0hN",RepMikeJohnson
161,2021-12-02 21:43:44+00:00,1466523502354259971,"Thanks, @JoeBiden. https://t.co/4ka1FhH5ew https://t.co/2Avu3SMa4m",RepMikeJohnson
162,2021-12-02 20:20:18+00:00,1466502507027390465,"Democrats talk a big game when it comes to ""transparency"" but their multitrillion dollar tax &amp; spend bill *intentionally* leaves out federal transparency protections.

While we knew they hadn't read the bill themselves, it's now clear they don't want the public to read it either. https://t.co/cgsMmRH2Cz",RepMikeJohnson
163,2021-12-02 14:19:27+00:00,1466411693848895488,"WHY exactly is Roe v. Wade so wrong?

I explained this morning how the Supreme Court hearing went yesterday, and why Roe v. Wade will—and SHOULD be—soon OVERTURNED. https://t.co/pcews1Ui4M",RepMikeJohnson
164,2021-12-02 04:06:14+00:00,1466257373169860609,"Just… wow.
#FireFauci https://t.co/H3A0qz6GIy",RepMikeJohnson
165,2021-12-01 23:51:17+00:00,1466193215833448453,"@RepKatCammack GREAT job tonight, dear friend! THANK YOU for all your hard work and principled leadership!
#defendthedefenseless",RepMikeJohnson
166,2021-12-01 21:56:21+00:00,1466164292282114055,"Happening now: @HouseGOP members are heading to the House Floor to address Biden's Economic, Border, and Energy crises, as well as the Supreme Court's monumental pro-life case. Tune in! 

📺 WATCH: https://t.co/qZHRjFpYGe",RepMikeJohnson
167,2021-12-01 19:06:15+00:00,1466121481772048390,"The pro-abortion lobby is using lots of misleading rhetoric on this fateful day at the Supreme Court, but never forget this primary truth: The lobby REFUSES to acknowledge the humanity of any child prior to the moment of delivery. https://t.co/6Z1Chpt1bT",RepMikeJohnson
168,2021-12-01 17:51:09+00:00,1466102582959652869,"Do not be swayed by the vague, euphemistic language used by the pro-abortion lobby.
 
Abortion is the taking of a human baby’s life. https://t.co/xS99xVqsUb",RepMikeJohnson
169,2021-12-01 16:59:49+00:00,1466089664482365441,It is time for the United States to move on from the inhumane practice of abortion. https://t.co/1urAHQNyl0,RepMikeJohnson
170,2021-12-01 16:16:47+00:00,1466078833908629508,"Here’s a comprehensive list of countries that allow abortions after babies feel pain:

North Korea…
Canada…
Netherlands…
Singapore…
Vietnam…
China…
 
and the United States. https://t.co/DIJtAJJnEx",RepMikeJohnson
171,2021-12-01 13:33:35+00:00,1466037765750067213,"LIFE is precious, and it will be defended here today at the United States Supreme Court.  Pray for this effort!
#defendthedefenseless https://t.co/jQV0u3Qno5",RepMikeJohnson
172,2021-12-01 00:50:07+00:00,1465845630631354369,Big news this evening that affects a countless # of conscientious health care professionals &amp; their families. It’s possible to protect public health AND preserve fundamental freedoms and individ. rights. The courts are acknowledging the Biden administration has crossed the line. https://t.co/yS1KWWvm0K,RepMikeJohnson
173,2021-11-30 19:56:47+00:00,1465771810734198789,"This is an open admission that their federal vaccine mandate is not about a ""public health emergency"" — it’s about politics and control. https://t.co/qOSPAGVlLl",RepMikeJohnson
174,2021-11-30 19:19:39+00:00,1465762466072350722,https://t.co/GeG0MdYcpR https://t.co/mw0XHvCh7M,RepMikeJohnson
175,2021-11-29 23:43:54+00:00,1465466579412570117,"Natchitoches was the last stop on today's Town Hall series, and what a joy it was to have so many constituents join us for the gathering and discussion.

Thank you to everyone who attended today's events. I look forward to seeing you all again soon! https://t.co/4w94f3y86O",RepMikeJohnson
176,2021-11-29 21:44:04+00:00,1465436425382367236,"Thanks to everyone for the big turnout and thoughtful discussion at today's third Town Hall in Many. The great people of Sabine Parish are always engaged, and I appreciate that so much. It is truly my honor to represent you all in Washington. https://t.co/MgE0bkm2Qf",RepMikeJohnson
177,2021-11-29 20:51:04+00:00,1465423086996570115,"Unfortunately, shortages and rising prices didn’t stop at the Thanksgiving dinner table.

Americans are paying more for just about everything this holiday season. 

Get ready for Biden's #ChristmasTreeTax. https://t.co/4ThxUkUCOH",RepMikeJohnson
178,2021-11-29 20:18:46+00:00,1465414956892004354,I really enjoyed the second stop on my Town Hall tour today. It was great to have so many DeSoto Parish leaders and friends gather at the local community theater to discuss all that is going on in D.C. and our state. https://t.co/TCCNGz7NIh,RepMikeJohnson
179,2021-11-29 19:17:25+00:00,1465399519424782342,"Kicked off our four-parish series of Town Hall meetings this morning in Vivian. 
 
It was great to start the day catching up with friends and neighbors, and discussing what’s happening in D.C. and in our state.
 
More to come. https://t.co/IrvBLLQEsU",RepMikeJohnson
180,2021-11-29 16:36:45+00:00,1465359086543908867,Happy Hanukkah to all who are celebrating across the nation. May you enjoy peace and light during this season. https://t.co/1Un5V2gYCu,RepMikeJohnson
181,2021-11-28 19:33:06+00:00,1465041076251672576,"Friends, I’m hosting a series of Town Hall meetings throughout the state tomorrow.
 
Town Halls are a great opportunity to provide an end-of-the-year update on what’s happening in DC and for constituents to ask questions and provide input. 
 
Hope to see you there! https://t.co/DVnoA2CH0D",RepMikeJohnson
182,2021-11-28 05:00:48+00:00,1464821556740337675,"Congratulations to Coach O for going out a winner tonight! The 2019 season can never be topped, and his legacy is secured for all time. https://t.co/8Pf5ARQ8Xd",RepMikeJohnson
183,2021-11-25 21:01:55+00:00,1463976262607724550,George Washington’s original proclamation reminds us of God’s extraordinary blessings on our nation—and the gratitude we owe to Him as a result. https://t.co/Jeo453c3ZV,RepMikeJohnson
184,2021-11-25 11:29:39+00:00,1463832250177499140,"Congress asked Pres. Washington to issue the 1st Thanksgiving Proclamation in Nov. 1789, to “acknowledge the providence of Almighty God, to obey his will, to be grateful for his benefits, and humbly to implore his protection and favor."" #Thanksgiving #Psalm118:1
#NowMoreThanEver https://t.co/Sjz7svR98r",RepMikeJohnson
185,2021-11-23 19:39:00+00:00,1463230622743285761,"Soaring gas prices are a direct result of the Biden campaign to shut down U.S. oil &amp; gas production.

Now, instead of reopening U.S. production, he’s releasing our strategic reserves—which exist only for unforeseeable disruptions like natural disasters.

This is pure ineptitude. https://t.co/6Ojq7No7hB",RepMikeJohnson
186,2021-11-23 17:50:49+00:00,1463203396404535301,"Less than one month ago:

“Administration officials have suggested privately that a release from the strategic petroleum reserve would have a negligible impact…” https://t.co/ICyszCEkkd",RepMikeJohnson
187,2021-11-23 16:50:20+00:00,1463188176726630404,"The SPR is not President Biden’s personal reserve for controlling his own self-made crises.

The SPR is for disruptions in oil supply due to extreme situations like natural disasters and terrorism.

The only supply disruption in this case is Biden’s own disastrous energy policy. https://t.co/SsZlHemQcV",RepMikeJohnson
