,Datetime,Tweet Id,Text,Username
0,2022-02-23 19:18:33+00:00,1496565158608609295,"America’s energy independence is critical to national security. 

By shutting down American pipelines and stifling new projects, Biden has emboldened our enemies like Putin who understand the world is now more dependent on foreign oil and natural gas.",RepRickAllen
1,2022-02-23 16:53:55+00:00,1496528760463581194,".@virginiafoxx and I will continue to demand answers to our straightforward questions, and demand that he recuse himself from all investigations and actions related to labor-management activity in which he participated, appeared or may engage in moving forward.",RepRickAllen
2,2022-02-23 16:53:54+00:00,1496528758748106762,"One would think that @SecMartyWalsh would want to clarify his neutrality and ability to lead the Labor Department, but by refusing to answer for his questionable activities for 3+ months, it’s clear he doesn’t care about accountability. https://t.co/x5tuKgd9EE",RepRickAllen
3,2022-02-22 21:51:42+00:00,1496241311481045005,The U.S. must get back to a doctrine of peace through strength—and today’s sanctions are long past due.,RepRickAllen
4,2022-02-22 21:51:41+00:00,1496241310142980104,"The financial sanctions President Biden announced today are too little and too late. As a result of his inaction to deter Russian aggression, Russia has now further invaded and put our partner Ukraine - and the security of Europe - in grave danger.",RepRickAllen
5,2022-02-22 21:51:41+00:00,1496241308700131332,"Since day 1, President Biden has shown weak leadership on the world stage, gifting Putin the Nord Stream 2 Pipeline and more control over energy supplies in the region and failing to hold Russia accountable for their cyber-attacks.",RepRickAllen
6,2022-02-22 16:41:46+00:00,1496163313906073603,"It’s time to reopen the People’s House!
 
Proud to join 90+ of my House colleagues in urging the Sergeant At Arms to reopen the Capitol to the public. https://t.co/7Gk3Rg45jA",RepRickAllen
7,2022-02-21 17:43:00+00:00,1495816336575852546,"Once again the Biden Administration is attacking America’s energy independence. FERC released new guidance that will severely hinder new and pending pipeline projects, further hurting the pocketbooks of Americans who are already paying high energy costs. https://t.co/LYYBkiKknQ",RepRickAllen
8,2022-02-21 16:21:52+00:00,1495795918716735494,Happy President’s Day! https://t.co/i9fBnA6Pis,RepRickAllen
9,2022-02-15 22:29:02+00:00,1493713991360815108,"The cost of lumber has been on a rollercoaster for the past few years. Supply chain issues and rising inflation are big contributors, but we must also restore our domestic lumber milling industry. https://t.co/yOFCHarsYu",RepRickAllen
10,2022-02-15 19:35:55+00:00,1493670427696193543,"Proud to stand with the 150,000 Georgians living with Alzheimer’s &amp; their 334,000 caregivers who would be impacted by the Biden Admin’s @CMSgov proposal to limit coverage for innovative treatments. 

I support access to FDA-approved treatments! #ENDALZ 

https://t.co/q3p28Pp0Z4",RepRickAllen
11,2022-02-14 17:08:49+00:00,1493271019028729857,"Telephone town halls are a great way to stay connected. During these free calls you’ll have the opportunity to receive a legislative update, ask questions, and answer some polls. 

&gt;&gt; You can sign up to participate in future calls here: https://t.co/Kj52jNvTsy https://t.co/jn39elC8cS",RepRickAllen
12,2022-02-11 15:20:11+00:00,1492156518640275457,"The Biden Admin is trying to circumvent Congress as the NLRB considers reclassifying independent contractors. This could jeopardize the livelihoods of millions of workers. 

Proud to fight for #IndependentContractors alongside @RepJimBanks &amp; @virginiafoxx. https://t.co/YGWRgMns0T",RepRickAllen
13,2022-02-10 18:23:20+00:00,1491840222002401288,"Inflation surged 7.5% over the last year, marking a 40 year high! Instead of addressing the root cause of rising prices, Democrats continue to double down on out-of-control government spending. https://t.co/LfLwCesu3T",RepRickAllen
14,2022-02-08 17:29:25+00:00,1491101877303668736,"Fentanyl is flowing across our borders and into our communities due to Biden and Congressional Democrats’ open-border policies. In 2021, fentanyl overdoses skyrocketed, and it is now reported to be the leading cause of death for Americans aged 18-45. https://t.co/P2MaUt0EvT",RepRickAllen
15,2022-02-04 17:10:29+00:00,1489647562705489922,"Pelosi’s #AmericaCONCEDESAct destroys America’s competitive edge while once again giving the CCP a pass for their malign activities and failing to hold them accountable for their role in COVID-19. 

Beijing is probably delighted with today’s passage. https://t.co/oRcOuchut6",RepRickAllen
16,2022-02-01 16:51:54+00:00,1488555719020404743,"With tax filing season underway, the Biden Administration must address the IRS’s backlog – not push a plan to weaponize the IRS and grant unprecedented access to the majority of Americans’ bank transactions! https://t.co/DB7eYrWy43",RepRickAllen
17,2022-01-31 18:56:03+00:00,1488224576064696322,".@RepublicanStudy members have a plan that will:
- Hold China accountable for COVID-19
- Strengthen our military, sanctions &amp; law enforcement capabilities to counter CCP threats
- Modernize US law to stop intellectual property theft
- And much more!",RepRickAllen
18,2022-01-31 18:56:03+00:00,1488224574839926791,"Pelosi’s “plan” to address China will:
- Surrender our competitive edge
- Invite malign actors into the country via a new visa cap carveout program
- Provide more opportunities for China to steal our intellectual property
- Spend billions on unrelated issues, like climate change",RepRickAllen
19,2022-01-31 17:55:57+00:00,1488209451870040072,"Students thrive when there is a partnership amongst parents, educators and a community. 

ICYMI, I wrote in @AUG_Chronicle why parents should be involved in their child’s education and highlight some of the #schoolchoice programs in #GA12. https://t.co/dsnn4XXk4C",RepRickAllen
20,2022-01-27 18:23:00+00:00,1486766706299125772,"It was wonderful visiting the Augusta Rotary club this week, where I was able to provide an update on vaccine mandates, the supply chain, rising inflation, and more. https://t.co/eVFWKEzM0T",RepRickAllen
21,2022-01-27 16:47:40+00:00,1486742714045677577,"My office is currently accepting internship applications for the summer semester. 

Candidates can find additional information and how to apply on my website, and must complete their application no later than Friday, March 18th. https://t.co/5HTpm6vLxQ https://t.co/4iIxEVg62b",RepRickAllen
22,2022-01-25 23:44:36+00:00,1486122866038956044,"Withdrawing the Emergency Temporary Standard is a good step, but now the Biden Administration must take the vaccine or test mandate completely off the books! https://t.co/lAcVKc0dh1",RepRickAllen
23,2022-01-25 21:44:42+00:00,1486092690173345792,You can watch the full discussion here: https://t.co/JTtrvZ2Ulv https://t.co/aqaPVM1JHE,RepRickAllen
24,2022-01-25 21:44:41+00:00,1486092686398562304,"In honor of National #SchoolChoiceWeek, I hosted a virtual roundtable with local education leaders. I’m proud of the work being done in #GA12 to provide families and students with a variety of education options. https://t.co/IdRbfXwwEj",RepRickAllen
25,2022-01-25 18:15:15+00:00,1486039980254375939,"ALARMING NEW BORDER NUMBERS: 178,840 encounters in December, marking a 142% increase from last year and the worst December on record! It’s past time for Biden &amp; Congressional Democrats to address this crisis they created through their open border policies. https://t.co/DmX19MpQop",RepRickAllen
26,2022-01-24 19:25:57+00:00,1485695386538885125,It’s not too much to ask capable Georgians on Medicaid to engage in education or work. Proud to have joined my GA Republican colleagues in the House in opposing the Biden Administration’s decision to deny Georgia’s proposal to provide Medicaid coverage. https://t.co/eNSRNUw0t0,RepRickAllen
27,2022-01-23 17:03:00+00:00,1485297022597009418,"Today marks the beginning of National #SchoolChoiceWeek! Whether it’s public, public charter, public magnet, private, online schools, or homeschool groups, it’s important to offer families a wide range of educational options to meet their children's needs and interests. https://t.co/P0n9eQ7Y2Z",RepRickAllen
28,2022-01-21 13:10:00+00:00,1484513610747494403,"This week marks the 49th anniversary of the Supreme Court’s decision in Roe v. Wade, a devastating decision that has led to over 60 million babies killed. As a father and grandfather, I will always fight to protect the right to life! https://t.co/P3v7f8Nqmm",RepRickAllen
29,2022-01-20 21:53:03+00:00,1484282855203254272,"President Biden may refuse to send a clear message to Russia, but I’m proud the #USSGeorgia is! We will not sit idly by and allow Putin to invade our ally Ukraine.
https://t.co/jbLKgu7wD1",RepRickAllen
30,2022-01-20 17:15:00+00:00,1484212878794055680,"It’s been one year since Biden took office, and it’s been nothing but broken promises. I want to hear from you, how would you rate Biden’s first year? Take my official survey here: https://t.co/b4ZFx0jeXf https://t.co/U2PEfpNU23",RepRickAllen
31,2022-01-19 16:35:58+00:00,1483840667206000642,"Every life is precious, and I will always fight for the unborn. Honored to receive an A+ rating on @SBAList’s #prolife scorecard. https://t.co/0mxOdMkylY https://t.co/D2QsJN9Kxk",RepRickAllen
32,2022-01-17 13:02:00+00:00,1483062045662756867,"Today we celebrate the life and legacy of an outstanding Georgian, Dr. Martin Luther King Jr. #MLK was a man of deep faith with the profound conviction that God creates us all equal. https://t.co/LInXdm5NKX",RepRickAllen
33,2022-01-13 20:49:52+00:00,1481730236219801611,"BREAKING: #SCOTUS Blocks Biden's Vaccine Mandate! This ruling is a win for America’s workers, businesses, and economy. OSHA is not a public health agency, and I’m proud to have led the fight against this mandate at the congressional level. https://t.co/zQzRfDb7pV",RepRickAllen
34,2022-01-12 21:57:44+00:00,1481384927807614981,"Thanks to @JaySekulow for having me on the show to discuss the truth about Georgia’s election law, which makes it easier to vote in the Peach State than in Biden’s home state of Delaware. It’s a pleasure to work with you &amp; @ACLJ to defend it in the courts. https://t.co/nOJt4HnaIn",RepRickAllen
35,2022-01-12 17:39:08+00:00,1481319851348185089,"Surging illegal immigration + soaring COVID cases = a border crisis of disturbing proportions. 

New photos show the conditions of makeshift camps at our border holding thousands. @POTUS, it's time to wake up and do something!
https://t.co/PDc6jjWrnn",RepRickAllen
36,2022-01-12 15:17:50+00:00,1481284291116032007,American families are struggling under Biden because his administration continues to make excuses and brush off rising inflation! The latest numbers show prices for everyday goods and services jumped 7% in the last year – the highest since 1982. https://t.co/LNwJpw8Jzi,RepRickAllen
37,2022-01-12 00:54:36+00:00,1481067052009992195,"At a time when we are facing a surge at our Southern border, rising prices &amp; inflation, and a supply chain crisis, the President should be focused on addressing these issues rather than falsely claiming that Republicans are suppressing the rights of voters.",RepRickAllen
38,2022-01-12 00:54:36+00:00,1481067051078893572,"In the elections in Atlanta this November, we saw turnout rise by 17%. In fact, it’s easier to vote in Georgia than the President’s home state of Delaware.",RepRickAllen
39,2022-01-12 00:54:36+00:00,1481067050181271555,"They're using ""voting reform"" as a guise to federalize elections and ensure they remain in power. Today’s remarks in Georgia were nothing more than a political stunt, and their claim that Georgia’s law will suppress voters is inaccurate.",RepRickAllen
40,2022-01-12 00:54:36+00:00,1481067049048805382,"I’m proud that Georgia has led the nation in exercising its Constitutional authority to update our election laws. Unfortunately, @POTUS, @VP Harris and Congressional Democrats continue to make baseless accusations against Georgia’s election law.",RepRickAllen
41,2022-01-10 18:43:55+00:00,1480611378314547205,"Liberals keep using COVID-19 as an excuse to use and abuse political power. 

In case you missed it, I joined @JohnFBachman on @newsmax to discuss my fight against Biden’s private business vaccine mandate and more.
https://t.co/8VMXfLR6DW",RepRickAllen
42,2022-01-10 14:24:20+00:00,1480546051757121539,"I might be an Auburn grad, but I think we can all agree... #BeatBama &amp; #GoDawgs!",RepRickAllen
43,2022-01-07 19:00:45+00:00,1479528450234929154,"December marked the worst jobs report in Biden’s presidency, yet he is pushing a vaccine mandate that @AAF estimates will cause 10 – 16 million workers to leave their job.

I’m leading the charge urging SCOTUS to stop this mandate! https://t.co/o2qS5IQ3wb",RepRickAllen
44,2022-01-07 15:09:39+00:00,1479470292800094208,I’m proud to have the support of the @NAHBhome and Americans across the country who will be impacted by this likely unconstitutional mandate. You can follow the case at https://t.co/NzXn8jI4Vv https://t.co/a0YL5uCB8Z,RepRickAllen
45,2022-01-07 15:09:39+00:00,1479470290199531523,Today the Supreme Court is set to hear oral arguments on Biden’s workplace vaccine mandate. Last week I led an amicus brief signed by over 180 members of Congress highlighting that Congress did not give OSHA the authority to implement the mandate.,RepRickAllen
46,2022-01-05 21:46:18+00:00,1478845335552282627,"Chicago Teachers Union at it again – relentless in keeping schools closed after we’ve seen negative impacts like learning loss and increased mental health issues.
 
Students &gt; unions
https://t.co/87lYwGakCy",RepRickAllen
47,2022-01-05 16:58:33+00:00,1478772922982535178,Great news! Was proud to join my colleague @RepMikeJohnson in filing an amicus brief in support of our service members seeking a religious exemption from DoD’s vaccine mandate. https://t.co/C1Kjn5w1fn,RepRickAllen
48,2022-01-04 18:50:05+00:00,1478438602946359298,"Biden cannot force private businesses to mandate the vaccine or weekly testing. It will worsen current labor shortages &amp; the supply chain crisis. 

RT if you agree - Americans should make their own health choices, not be mandated by the government!",RepRickAllen
49,2022-01-01 05:10:35+00:00,1477145205497384964,Wishing everyone in #GA12 a safe and happy New Year! https://t.co/9iJxbbyDNy,RepRickAllen
50,2021-12-30 23:27:48+00:00,1476696551577821185,The brief argues that Congress did not give OSHA the authority to impose a vaccine mandate and urges SCOTUS to stay the mandate.,RepRickAllen
51,2021-12-30 23:27:47+00:00,1476696550336249860,"Proud to join @RepStefanik, @virginiafoxx, @RepJimBanks &amp; @SenatorBraun in leading an amicus brief signed by 183 Members of Congress to SCOTUS against Biden's vaccine mandate on private employers. https://t.co/TBDGfG0aRa",RepRickAllen
52,2021-12-25 13:20:00+00:00,1474731654254153729,"“For to us a child is born, to us a son is given, and the government will be on his shoulders. And he will be called Wonderful Counselor, Mighty God, Everlasting Father, Prince of Peace.” -Isaiah 9:6

Robin and I wish you and your family a very Merry Christmas and Happy New Year! https://t.co/tebcbT75xZ",RepRickAllen
53,2021-12-19 16:01:15+00:00,1472597909539631108,"He will be deeply missed, and Robin and I are praying for his wife Dianne, their children and grandchildren.",RepRickAllen
54,2021-12-19 16:01:15+00:00,1472597908658786311,"I’m thankful to be counted among his ""friends and future friends,"" &amp; especially cherish the time we spent together working on the Every Student Succeeds Act. Johnny’s involvement is the sole reason it got signed into law.",RepRickAllen
55,2021-12-19 16:01:15+00:00,1472597907777929224,"Our state, and nation, are better off because of his leadership, and he leaves behind an incredible legacy as a champion for Georgia.",RepRickAllen
56,2021-12-19 16:01:14+00:00,1472597905798275075,Johnny Isakson was the epitome of a statesman and respected by all who knew him. He was able to achieve so much throughout his career because he always put the interests of Georgians first and never backed down in his pursuit to deliver results. https://t.co/RUyXviHF8o,RepRickAllen
57,2021-12-15 16:53:56+00:00,1471161616104402951,"Make no mistake, President Biden and Democrats have no intention of stopping the 150+ new programs and expansions in the #BuildBackBroke Act. They’ll make them permanent, which the CBO estimates would cost Americans $4.9 trillion and add over $3 trillion to the debt!",RepRickAllen
58,2021-12-14 17:40:33+00:00,1470810958582931456,"Today I led a bipartisan, bicameral letter to @USTreasury  asking for guidance to be issued for the Advanced Nuclear Production Tax Credit. These unique tax credits will directly benefit customers served by Plant Vogtle in Georgia, Alabama and Florida. https://t.co/WsZ179ftFo",RepRickAllen
59,2021-12-10 17:34:42+00:00,1469359933347016709,"Inflation rose at its fastest pace since 1982! It’s clear that Biden and House Democrats' out-of-control spending is only worsening our economic crisis.
https://t.co/zEIWENw4g9",RepRickAllen
60,2021-12-09 19:17:00+00:00,1469023291872628742,"I held a telephone town hall Tuesday night to answer questions from #GA12 residents and to provide an update on the NDAA, vaccine mandates, the supply chain crisis, and more. For those who were unable to participate in the call, here are some highlights: https://t.co/KC2i27GK46 https://t.co/s0cxVtUAMn",RepRickAllen
61,2021-12-09 16:02:51+00:00,1468974431120904193,Thank you to the 52 Senators who stood strong and opposed Biden’s workplace vaccine mandate on private businesses. Now the House must also vote on the Congressional Review Act resolution to repeal this unconstitutional mandate! https://t.co/cqApzCpIwe,RepRickAllen
62,2021-12-09 15:35:16+00:00,1468967491850289163,"Today we honor the life and legacy of U.S. Senator Bob Dole as he lies in state in the U.S. Capitol rotunda. He was an American patriot, World War II hero, and political giant. You can watch the ceremony here: https://t.co/hVtNe9UKuc",RepRickAllen
63,2021-12-08 21:21:53+00:00,1468692332992253954,The bipartisan Ocean Shipping Reform Act will help Georgia’s farmers by alleviating some of the recent congestion at our nation’s ports and addressing unfair shipping practices that have negatively impacted American farmers' exports. https://t.co/DFdAOYbVKJ,RepRickAllen
64,2021-12-08 16:56:49+00:00,1468625625023930368,"As we approach the end of 2021, I want to share some stats on how my office has been working for you throughout the year. 

Thank you #GA12 for the opportunity to serve! https://t.co/G4u8ViZN1j",RepRickAllen
65,2021-12-08 03:20:28+00:00,1468420184906117128,"This year’s NDAA delivers on these goals, bolstering defense spending and including a pay raise for our troops, while holding the Biden Administration accountable for its disastrous and incompetent withdrawal from Afghanistan. My full statement: https://t.co/X7W1Y5IQea",RepRickAllen
66,2021-12-08 03:20:28+00:00,1468420183723327495,Congress has an important duty to ensure America’s military is equipped with the necessary resources to defend our nation while providing support to our service members and their families.,RepRickAllen
67,2021-12-07 16:51:52+00:00,1468261991898886157,"""A date which will live in infamy.""

Today, on the 80th anniversary of the attack at #PearlHarbor, we remember the thousands of Americans whose lives were lost in defense of freedom. https://t.co/dJzqlyK3kc",RepRickAllen
68,2021-12-06 15:15:09+00:00,1467875263593816074,"America’s pharmacies are facing supply chain disruptions and labor shortages, with about 111 drugs on backorder. Congress now must pass policies to help alleviate this mess that was created by Biden’s failed economic policies. https://t.co/xQvv9aTeHX",RepRickAllen
69,2021-12-03 16:12:48+00:00,1466802607444353031,"Stay connected through telephone town halls! These calls provide an opportunity for you to hear a legislative update, ask me questions, and answer poll questions. 

&gt;&gt; You can sign up to participate in these free calls here: https://t.co/Od6MCN57rm https://t.co/918xmkVeAo",RepRickAllen
70,2021-12-01 15:02:11+00:00,1466060061072150541,"Today the Supreme Court will hear a major #prolife case. An unborn baby is a human!
- At 5 weeks unborn babies have a heartbeat
- At 10 weeks they have arms, legs, fingers and toes
- At 15 weeks they have fully developed hearts, lips, noses, and can feel pain. https://t.co/L5YLv1gLuF",RepRickAllen
71,2021-11-30 19:30:05+00:00,1465765093522776068,"Since Biden took office, over 1.6 million illegal immigrants have been apprehended at our southern border. In October alone, 17,126 were released into the U.S. 

It’s clear Democrat policies are only incentivizing more illegal immigration. https://t.co/8dKsYhJZUn",RepRickAllen
72,2021-11-25 16:57:41+00:00,1463914799612444676,Happy Thanksgiving! My hope for you on this special day is that you can take some time to relax with loved ones and reflect on the many blessings that we are able to enjoy as Americans. https://t.co/VKADA0jhSL,RepRickAllen
73,2021-11-19 15:00:08+00:00,1461710893222350849,I urge my Senate colleagues to stand strong and oppose this trillion dollar tax and spend spree that will bankrupt our nation and burden our future generations with insurmountable debt. https://t.co/hvkXdqCEkK,RepRickAllen
74,2021-11-19 15:00:08+00:00,1461710892039606282,"This process has been a slap in the face to every American taxpayer. This 2,000+ page bill will raise taxes, radically expand the IRS's access to Americans’ bank accounts, and rampantly spend taxpayer dollars -- and it was crafted behind closed doors with no bipartisan input.",RepRickAllen
75,2021-11-19 15:00:08+00:00,1461710891058094088,"It is the most socialist piece of legislation and the biggest expansion of government in our lifetime, and enacting it will only make our nation’s many ongoing crises worse.",RepRickAllen
76,2021-11-19 15:00:08+00:00,1461710890001174534,"The so-called ""Build Back Better Act"" will destroy our economy as we know it. If you think rising prices at the gas pump and empty shelves in the grocery store are bad now, you better hope the Senate stops this bill in its tracks.",RepRickAllen
77,2021-11-19 13:51:33+00:00,1461693632235425793,Thank you @GOPLeader for standing for the American people and ensuring House Democrats did not pass their socialist spending bill and radical expansion of government in the dead of night.,RepRickAllen
78,2021-11-18 21:20:54+00:00,1461444324890234884,"Today I participated in @RepFredKeller's press conference to help serve as a voice for the over 80 million American workers who will be impacted by Biden’s vaccine mandate. We must fight for America’s workers, businesses &amp; economy by ensuring this mandate is blocked. https://t.co/8pHeV47dEs",RepRickAllen
79,2021-11-18 16:21:55+00:00,1461369083971182594,Thank you @iandprior for speaking with @HouseGOP members about the state of education. We must put students first and empower parents to get involved! https://t.co/sUrdcCh6KO,RepRickAllen
80,2021-11-18 14:41:43+00:00,1461343869845471239,"While I believe Biden's workplace vaccine mandate is likely unconstitutional &amp; I look forward to watching it continue moving through the courts, it's also our duty to fight this legislatively. That’s why it's important to exercise our authority under the CRA to nullify this rule. https://t.co/FCzBxbXcEd",RepRickAllen
81,2021-11-17 17:09:35+00:00,1461018695086583811,The Biden Administration is abusing their power by implementing this unprecedented and likely unconstitutional mandate on private workplaces. I’m proud to stand for the rights of employers &amp; employees by using our authority under the CRA to seek to block this federal overreach. https://t.co/1TV9FZnwNP,RepRickAllen
82,2021-11-16 23:53:00+00:00,1460757827329347587,New estimates from the Committee for a Responsible Federal Budget show #BuildBackBroke would cost DOUBLE the amount if Democrats’ temporary provisions are made permanent – costing as much as $4.9 trillion. https://t.co/VtJC1CAUrb,RepRickAllen
83,2021-11-16 21:58:45+00:00,1460729074406637569,Great to see the Georgia Department of Education emphasize the importance of financial literacy! You can provide feedback on how we can better equip our students to make personal finance decisions. https://t.co/KyurvKHFRr,RepRickAllen
84,2021-11-16 21:10:05+00:00,1460716828787892224,"In October alone, over 164,300 illegal immigrants were apprehended at the border. This is a 128% surge from the same time last year and the highest total for October in history. 

When will the Biden Administration secure our border?! https://t.co/9rQi8UEqHo",RepRickAllen
85,2021-11-16 15:43:52+00:00,1460634733294014464,"Thanks to Heritage Academy in Augusta for hosting me for a visit and showing how you are partnering with parents and the local community to provide students in Richmond County with a quality, faith-based education. https://t.co/qNkvgV2OOv",RepRickAllen
86,2021-11-15 14:37:37+00:00,1460255672713588738,"During #NationalApprenticeshipWeek, I want to thank employers across the country who lead 80% of apprenticeships. We should support industry-led, not just union-led, apprenticeships because employers know how to directly give workers the skills needed to quickly secure a job. https://t.co/y4kYZszFLu",RepRickAllen
