,Datetime,Tweet Id,Text,Username
87,2021-11-11 16:08:43+00:00,1458829048461897735,"Today we honor America’s veterans who selflessly served in uniform. To those who never returned home, and those who have been left with either physical or invisible wounds, our nation is forever indebted to you. Words truly cannot express the gratitude you deserve. https://t.co/DCA7rdJrde",RepRickAllen
88,2021-11-10 17:01:53+00:00,1458480041885671439,This is a tax on all Americans- inflation is at its highest in over 30 years. #BuildBackBroke will only make the current economic crisis worse! https://t.co/M3pWGTyFvs,RepRickAllen
89,2021-11-08 16:33:43+00:00,1457748178103570432,The #RISEAct will put our nation’s retirement system on a stronger footing by providing workers &amp; employers with more options and incentives to increase retirement savings. https://t.co/Bt4c2c1Uuz,RepRickAllen
90,2021-11-07 18:58:28+00:00,1457422215331336198,"Celebrating my birthday with 10/14 grandchildren, Honey and Santa at Phipps today. Highly favored and blessed to have so many that I love! https://t.co/mJ6bUq1bAC",RepRickAllen
91,2021-11-06 20:42:41+00:00,1457086054637387781,"I’m disappointed that it passed and every single member who voted for it will be responsible for the tax increases, rampant spending, and expansion of IRS that comes if Build Back Broke passes in the coming weeks.",RepRickAllen
92,2021-11-06 20:42:41+00:00,1457086053572096008,"To be clear, neither of these bills will do anything to build back better; they will destroy our economy as we know it! As your Congressman it’s my job to fight for policies that will improve your lives- and this ain’t it!",RepRickAllen
93,2021-11-06 20:42:40+00:00,1457086052561195014,"After progressive Democrats essentially tied the two bills together, by passing infrastructure last night, Democrats took another step forward in advancing #BuildBackBroke.",RepRickAllen
94,2021-11-05 15:53:59+00:00,1456651014346584074,Thank you @GovKemp and @Georgia_AG for fighting against federal overreach. https://t.co/xo2n5qRO33,RepRickAllen
95,2021-11-05 12:59:21+00:00,1456607065992990726,"As I’ve said since day 1, folks should get the vaccine if they're able, but it should be a personal choice &amp; not mandated by the federal government. Once the final OSHA vaccine mandate is submitted, I will do everything within my authority to repeal it.
https://t.co/4oosIp78BS",RepRickAllen
96,2021-11-04 17:32:39+00:00,1456313457083621381,"The American People deserve a full accounting of how the #BuildBackBroke bill will impact spending, deficits and debt now + in the future. I joined Rep. @JayObernolte &amp; members of @HouseGOP demanding Speaker Pelosi allow the CBO to score the bill before the House votes on it.",RepRickAllen
97,2021-11-04 15:18:00+00:00,1456279568944443392,"Americans will feel a #TurkeyTax this year as it’s expected to be the most expensive Thanksgiving meal in the holiday’s history. It’s time for Biden &amp; Dems to work with Republicans, not push socialist policies that will make the inflation, supply chain &amp; economic crises worse! https://t.co/0xwZYZXNBE",RepRickAllen
98,2021-11-04 13:52:00+00:00,1456257926268534786,The School Choice Caucus welcomed Secretary @CondoleezzaRice to the Capitol for a timely conversation on how we can give parents the freedom they deserve to select the best education for their child. Thank you @SenatorTimScott for hosting! https://t.co/dyxp7Vv8Af,RepRickAllen
99,2021-11-04 13:00:49+00:00,1456245048052527107,"Thanks to @MatureAmericans for honoring me with the Patriot Award in recognition of my record fighting for faith, family, freedom and our nation’s seniors. As Lead Republican of @EdLaborGOP HELP Subcommittee, I’m committed to ensuring retirement security for all Americans. https://t.co/oZmFcsUgFP",RepRickAllen
100,2021-11-03 20:36:11+00:00,1455997255941513233,"It’s not just in VA, as I wrote in July- parents across the U.S. are speaking up &amp; we need a fresh debate on #schoolchoice. 
“I’m encouraging every concerned parent to keep sounding the alarm until action is taken at the local, state, and national levels.”
https://t.co/2VjqPy1QkQ",RepRickAllen
101,2021-11-03 03:36:32+00:00,1455740652667420677,"Congratulations to the 2021 #WorldSeries champs, the @Braves! The entire state of Georgia is so proud!",RepRickAllen
102,2021-11-02 19:50:10+00:00,1455623288818917385,"I have in my hands a copy of the massive “Build Back Better” Act that is full of far-left, socialist policies that will destroy our economy. 

Listen in as I break down some of the worst provisions included in the bill ↓ https://t.co/Z4IZ0DA7h3",RepRickAllen
103,2021-11-01 22:43:00+00:00,1455304393289502723,"Rising prices and inflation is a tax on all Americans, and I will keep pushing to stop uncontrolled spending in Congress because no one deserves to pay these increased prices! https://t.co/JS6uvvKHMS",RepRickAllen
104,2021-11-01 22:42:00+00:00,1455304141467787267,"Out-of-control spending has led to our current economic crisis, and Biden &amp; Democrats’ tax and spend bill will only make things worse.",RepRickAllen
105,2021-11-01 21:22:23+00:00,1455284105067864071,"President Biden &amp; House Democrats are pushing a #BuildBackBroke bill that was crafted behind closed doors and is the most radical, socialist piece of legislation in U.S. history. It’s OVER 1,500 pages and before Congress votes on it, I urge my Dem colleagues to actually read it.",RepRickAllen
106,2021-11-01 19:27:49+00:00,1455255275129159689,"Proud to join @RepBrianBabin &amp; @RepStefanik in standing with border patrol agents against vaccine mandates. As we write to Biden ""we are facing the worst border crisis in our nation’s history—a crisis that will only be exacerbated by your vaccine mandate.” https://t.co/lM6CKQmv9X",RepRickAllen
107,2021-10-29 19:21:00+00:00,1454166394690588685,I’d like to congratulate Altamaha EMC on today’s announcement. Broadband access is crucial to families and businesses in #GA12 and this project will ensure that rural Georgians are not left behind simply due to their address. https://t.co/G6QGy6HxXS,RepRickAllen
108,2021-10-29 18:00:25+00:00,1454146116505714691,"Reports that the Biden Administration wants to pay illegal immigrants, who knowingly broke the law, is a slap in the face to every law-abiding citizen. It takes the average American worker almost SEVEN years to earn $450,000. https://t.co/XfCGmeiKu8",RepRickAllen
109,2021-10-28 18:55:43+00:00,1453797646238457860,How do they plan to pay for all this? Through a radical expansion of the IRS that will grant them unprecedented access to your bank account.,RepRickAllen
110,2021-10-28 18:55:19+00:00,1453797544807604225,"- Include stop and go funding for child care instead of long-term reforms to existing child care programs.

- Expand the worst parts of ObamaCare.

- No clear plan to address record numbers of illegal border crossings.

- And much, more more!",RepRickAllen
111,2021-10-28 18:53:51+00:00,1453797175041855489,"Their bill will:

- Worsen the ongoing labor shortage by extending benefits for individuals earning as much as $150,000.

- Advance Green New Deal priorities at the expense of small businesses.",RepRickAllen
112,2021-10-28 18:53:51+00:00,1453797173842354178,"#TBT to Pelosi saying “we have to pass the bill so that you can find out what is in it.” Dems JUST released their trillion dollar tax &amp; spend bill that's THOUSANDS of pages, yet Rules Committee will meet TODAY to consider it. Here’s some of the bad provisions we know are in it.🧵",RepRickAllen
113,2021-10-26 20:45:39+00:00,1453100535146553364,Rising prices and surging inflation is a tax on working Americans that shows no sign of slowing any time soon. Thanksgiving will cost more this year as a result of Biden’s supply chain and economic crisis. https://t.co/1ZZeixuA8h,RepRickAllen
114,2021-10-26 14:06:23+00:00,1453000056324476941,Robin and I look forward to cheering on the Braves in the #WorldSeries -- way to make Georgia proud! https://t.co/Gp3OCGQVnx,RepRickAllen
115,2021-10-26 13:24:10+00:00,1452989433599471620,"Last night the House unanimously passed legislation to award the Congressional Gold Medal to the 13 U.S. service members who were killed in Afghanistan in August. 

I was proud to cosponsor this bill to ensure we never forget their sacrifice! https://t.co/L9ZonGLaVf",RepRickAllen
116,2021-10-25 21:39:09+00:00,1452751611764346881,"🚨Alarming new reports: After labeling concerned parents “domestic terrorists,” National School Board Association President Viola Garcia received a federal appointment by Biden. https://t.co/MJZFcgu9YK",RepRickAllen
117,2021-10-25 14:06:58+00:00,1452637814072516613,It’s a privilege to play a part in helping to secure funding for Gate 6 and other ongoing construction projects that will help our soldiers conduct their critical security missions. https://t.co/1iaA57gReL,RepRickAllen
118,2021-10-25 14:06:56+00:00,1452637807957225481,"After years in the making, it was an honor to participate in the official opening of Gate 6 at Fort Gordon. Opening this new gate, along with all the new construction on and around Fort Gordon, has created a significant number of jobs in the area – boosting our local economy. https://t.co/mrYsGhW10O",RepRickAllen
119,2021-10-25 13:42:22+00:00,1452631623397216260,Dear @POTUS: It’s a tragedy your policies are encouraging people to make the dangerous trek. Do your job and SECURE OUR BORDER! https://t.co/HYfPelcvt4,RepRickAllen
120,2021-10-21 20:48:38+00:00,1451289348041752576,"My office is now accepting internship applications for the spring semester. 

Candidates are encouraged to apply no later than Friday, November 12, 2021. Additional information and the application are available on my website: https://t.co/yRWcEnNV4t https://t.co/XOqiQEwnqv",RepRickAllen
121,2021-10-21 16:22:07+00:00,1451222274644848644,"Proud to join @RepTomEmmer &amp; over 200 @HouseGOP members in the fight against the Biden Administration’s push to grant the IRS unprecedented power to collect data on millions of Americans. 

We will keep applying pressure until they rescind this proposal. https://t.co/yTUliIfbCz",RepRickAllen
122,2021-10-21 14:53:00+00:00,1451199847281922048,"This Saturday, October 23, from 10am to 2pm is National Prescription Drug Take Back Day! This free and anonymous event gives Americans the opportunity to dispose of unneeded medications and help fight opioid addiction. Find a collection site near you: https://t.co/jmVwKWQOlb.",RepRickAllen
123,2021-10-21 13:44:22+00:00,1451182576903888901,"Democrats are desperately trying to sell their trillion dollar tax &amp; spend bill that is nothing more than a blueprint to enact their socialist agenda. 

Last night I spoke on the House floor exposing what’s actually included in their proposal. https://t.co/fHM4PLDs4O",RepRickAllen
124,2021-10-20 21:11:54+00:00,1450932812664745985,"ICYMI: I held a telephone town hall last night to answer questions from #GA12 residents &amp; provided an update on Democrats’ tax + spend bill, immigration, vaccine mandates, and more. For those who were unable to join, here are some of the highlights: https://t.co/GHefVu5Wn2 https://t.co/PdKfNenCoa",RepRickAllen
125,2021-10-20 00:24:53+00:00,1450618990435385355,"Democrats’ tax and spend “budget” #WRECKonciliation bill is a train wreck that will wreck our economy. 

Pass it on.",RepRickAllen
126,2021-10-19 23:39:29+00:00,1450607567332384772,"How does the Democrats’ tax and spend bill impact health care? 

In total, it'll cost nearly $14,200 per person, per year only to put individuals in goverment-subsidized and controlled plans, which are 2x the cost of the average Employer Sponsored Plan. https://t.co/altHMlKweV",RepRickAllen
127,2021-10-18 20:33:46+00:00,1450198442085654533,"- Surging energy costs due to this Administration’s attack on American energy independence
- Rising inflation

More wasteful Washington spending like the Democrats are pushing is wrong and won’t do anything to address this crisis.",RepRickAllen
128,2021-10-18 20:33:46+00:00,1450198440651149318,"Americans are feeling the impacts of a supply chain crisis. This is a result of Biden’s failed policies, including:
- Failure to hold China accountable &amp; making us more reliant on foreign manufacturing
- A labor shortage due to enhanced federal benefits &amp; vaccine mandates",RepRickAllen
129,2021-10-18 13:57:04+00:00,1450098608003497986,I also joined Georgia Ag Commissioner Gary Black for a Farmers Town Hall Meeting where we discussed issues impacting local farmers. https://t.co/Z2iaCg2x4f,RepRickAllen
130,2021-10-18 13:57:02+00:00,1450098600441221120,"Had a great time at Burke County Public School’s Annual Feed My School Event, which teaches students about nutrition and agriculture while enjoying a farm-to-table lunch. https://t.co/NBZLYgwH1B",RepRickAllen
131,2021-10-14 18:11:50+00:00,1448713170999287822,"As inflation and gas prices rise, the Biden Admin has begged OPEC+ to produce more oil -- further crippling our nation's energy independence. I joined over 100 of my Republican colleagues urging Biden to reverse course &amp; prioritize American energy.  
https://t.co/s7zZEGYckB",RepRickAllen
132,2021-10-14 14:12:17+00:00,1448652884988493824,"Stay connected through telephone town halls, where you'll have the opportunity to ask me questions and weigh in on issues impacting you and your family. 

&gt;&gt; Visit https://t.co/BowBesvxVg to participate in future calls. https://t.co/ESHnAYZwZD",RepRickAllen
133,2021-10-14 13:35:11+00:00,1448643549982040068,Democrats’ trillion dollar tax &amp; spend bill is not about addressing America’s urgent needs - it’s their blueprint to fundamentally reshape our nation and implement their radical social agenda.,RepRickAllen
134,2021-10-13 19:30:48+00:00,1448370654412255234,"As the letter states: ""We strongly urge you to uphold the decisions of the court by implementing MPP and performing your duty to secure our border""

Our full letter: https://t.co/29mSdBeHG5",RepRickAllen
135,2021-10-13 19:30:47+00:00,1448370653430747136,"That's why today I sent a letter signed by over 40 members of Congress to DHS in response to the recent announcement of its intention to issue a new memo terminating the Migrant Protection Protocols (MPP), also known as the “Remain in Mexico” policy.",RepRickAllen
136,2021-10-13 19:30:47+00:00,1448370652419956739,"The men and women working under the Department of Homeland Security face immense challenges every day, and they deserve clear guidance as they enforce our immigration laws. They should never be subjected to misguided political directives that make their jobs more difficult.",RepRickAllen
137,2021-10-12 23:32:19+00:00,1448069048219078659,"They control the House, Senate and White House, and if they want to keep spending into oblivion, they must bear the responsibility of cleaning up their fiscal mess themselves.",RepRickAllen
138,2021-10-12 23:32:19+00:00,1448069047120273412,Tonight Democrats bought themselves more time to advance Biden’s socialist tax and spend agenda by raising the debt ceiling.,RepRickAllen
139,2021-10-12 18:06:10+00:00,1447986968034414594,"REMINDER for any student interested in attending a U.S. Service Academy: If you would like to be considered for a congressional nomination, the deadline to submit your completed application to my office is this Friday, October 15th, at 5PM. More info: https://t.co/2RUItWAPcW https://t.co/MOktKefXc3",RepRickAllen
140,2021-10-12 16:23:13+00:00,1447961062310023177,"Today, on #NationalFarmersDay, I’m especially grateful for our farmers in #GA12 who help keep agriculture Georgia’s number one industry! Thank you for your hard work every day – it is an honor to serve you as a member of @HouseAgGOP. https://t.co/Wv5TNAC5KA",RepRickAllen
141,2021-10-12 15:15:18+00:00,1447943970978414600,"As border numbers continue to surge each month, over $100 million worth of border wall materials that are unused and already paid for are just sitting in Texas. 

The Biden Admin REFUSES to do their job to finish the wall and secure our border. https://t.co/Pn3PXNfH6A",RepRickAllen
142,2021-10-06 19:43:18+00:00,1445837086246924292,"Biden’s assault on American energy independence has created a crisis. As a result, Americans are paying more at the pump with gas prices at the highest in 7 years.
https://t.co/shy8fCo9eo",RepRickAllen
143,2021-10-05 22:52:39+00:00,1445522352196886536,"I have spoken to parents about their concerns, and parents should not be intimidated into thinking that there is no forum for their voice to be heard. I will support parents’ rights to peacefully engage and be involved in their child’s education.",RepRickAllen
144,2021-10-05 22:52:39+00:00,1445522350909243403,"Whether it was the unprecedented school closures or concerns with critical race theory-based curriculum being pushed into classrooms, families have faced enormous challenges over the last year and a half and are understandably frustrated.",RepRickAllen
145,2021-10-05 22:52:39+00:00,1445522349764190211,"I am deeply concerned that once again, the Biden DOJ is weaponizing their authority.",RepRickAllen
146,2021-10-05 22:52:39+00:00,1445522348401061891,"While I do not condone violence or threatening behavior in any way, today’s announcement from the DOJ casts a severe chilling effect on parents’ right to speak freely when it comes to their child’s education.",RepRickAllen
147,2021-10-05 19:53:47+00:00,1445477336237805569,Had a productive conversation with Screven County Schools Superintendent Jim Thompson on efforts to keep students in the classroom while mitigating COVID-19 risk. Appreciate the work our educators in #GA12 are doing to put students first! https://t.co/JlAfb5CZQ0,RepRickAllen
148,2021-10-05 16:21:29+00:00,1445423909260693504,It was great to visit the East Georgia Regional Medical Center in Statesboro to receive an update on their operations. Thankful for the staff’s dedication as we continue to combat COVID-19. https://t.co/6SehdCkHt1,RepRickAllen
149,2021-10-04 16:47:37+00:00,1445068097287753744,"My office is currently accepting Military Academy Nomination Applications for any student who may be interested in attending one of our nation’s service academies. To be considered for the class of 2026, students must apply by Friday, October 15th at 5PM.  https://t.co/2RUItWAPcW https://t.co/QtzgQerY1i",RepRickAllen
150,2021-10-01 18:14:48+00:00,1444002873860370433,"Americans are paying more for everything under the Biden Administration. Inflation hit a 30-year high in August, yet Democrats want to pass a massive tax and spending package that will worsen the economic crisis caused by their policies. https://t.co/gOOG8OQNTj",RepRickAllen
151,2021-10-01 14:19:16+00:00,1443943603773054984,"Great news for the Peach State! As a result of our strong pro-workforce and pro-business environment, Georgia has been named the ""Top State for Doing Business"" by @AreaDevelopment for the 8th consecutive year. https://t.co/iPjzXCAEiy",RepRickAllen
152,2021-09-30 15:16:15+00:00,1443595556216086534,"Biden's vaccine mandate comes during a time when inflation is running rampant, job creators are facing workforce shortages, &amp; over 8.4 million Americans are out of work. 

@EdLaborGOP is urging the immediate suspension this overreaching mandate. https://t.co/wGYKugIXCz",RepRickAllen
153,2021-09-29 18:04:07+00:00,1443275411211837441,"School closures impact students' mental health and academic success, and sadly, teachers unions and special interests kept schools closed. Today, at @EdLaborGOP we heard how decision-makers can balance COVID-19 risk &amp; student learning – we don’t have to choose one or the other! https://t.co/QVdai0xqCN",RepRickAllen
154,2021-09-29 16:35:01+00:00,1443252989330927616,Where did Pelosi &amp; Biden learn math? https://t.co/Xm3qNL71pH,RepRickAllen
155,2021-09-29 14:46:36+00:00,1443225703353356297,"Democrats are still playing games and have yet to schedule any significant legislative activity for today! And where is President Biden? This is how they’re running Washington, folks!",RepRickAllen
156,2021-09-29 14:46:35+00:00,1443225702191542272,"Pelosi &amp; Democrat leadership have not put a straightforward funding bill on the floor, risking a possible shutdown tomorrow.",RepRickAllen
157,2021-09-28 16:11:43+00:00,1442884738210017281,Last night I joined #gopHEAT in calling on Democrats to end their war on American energy and to work with us on policies that will get our nation back on the road to energy independence.,RepRickAllen
158,2021-09-28 16:11:43+00:00,1442884736590954500,Democrats are marching full steam ahead with their $3.5 trillion tax &amp; spending spree that will further raise costs for consumers and chip away at our energy independence. https://t.co/IqXfx04u2x,RepRickAllen
159,2021-09-28 15:07:50+00:00,1442868659752345613,"Under Trump, we saw government + private sector work together to develop life-saving vaccines in record time. Under Biden, Democrats have spread fear &amp; confusion while implementing top-down mandates and more spending. 

@EdLaborGOP talk solutions that don’t inflict economic harm. https://t.co/6Jaoj8DWL5",RepRickAllen
160,2021-09-27 20:31:34+00:00,1442587743725490177,"Only 9% of the House Democrats’ “infrastructure” package goes towards roads, bridges and major projects. 

This bill is nothing more than a Trojan Horse for socially progressive “Green New Deal” policies, regulations and mandates. https://t.co/VkWRgcyVwr",RepRickAllen
161,2021-09-24 15:57:37+00:00,1441431635908562947,"Today House Democrats continued their assault on life by passing H.R. 3755. Under their bill, nearly all pro-life protections are removed &amp; every state would be forced to perform abortions until birth. We must protect the sanctity of life. https://t.co/hKzwVdMY89",RepRickAllen
162,2021-09-24 14:30:44+00:00,1441409773933580288,"Border Patrol apprehended over 200,000 immigrants at our Southern Border in August, marking a 21-year high.

So what is the Biden Administration doing to stop this ongoing border surge? Absolutely nothing.

It’s time to finish the wall, end catch and release, &amp; secure our border! https://t.co/meKLyKAACa",RepRickAllen
163,2021-09-24 13:15:47+00:00,1441390912429432835,"Our military must be prepared to fight &amp; win at any given moment, and Congress has a duty to ensure our service members are equipped with the resources necessary to keep Americans safe. My statement on House passage of the NDAA: https://t.co/xJT95SJl33",RepRickAllen
164,2021-09-22 14:26:32+00:00,1440683940562432018,"Contrary to what the Biden Admin has said on the mainstream media, officials are reporting that many Haitian migrants camped in Texas are being released in the U.S. 

This is alarming and exactly why we must end catch and release and secure our border! https://t.co/Fiupv4kehm",RepRickAllen
165,2021-09-22 14:04:39+00:00,1440678432778559492,"Last night House Democrats rammed through their Continuing Resolution for short-term government funding. Pelosi continues to make a mockery of the legislative process and play games with government funding. If this wasn’t bad enough, they blocked funding for our ally Israel!",RepRickAllen
166,2021-09-21 14:14:39+00:00,1440318559704342530,"Joe Biden has destroyed our credibility on the world stage as a result of his foreign policy decisions.
❌ Botched Afghanistan withdrawal
❌ Failed to hold China accountable
❌ Gifted Putin Nord Stream 2 Pipeline
❌ Lifted sanctions against Iran
❌ Created a crisis at our border",RepRickAllen
167,2021-09-20 16:03:26+00:00,1439983548878970891,"House Democrats are pushing the Abortion on Demand Until Birth Act that would remove nearly all pro-life protections &amp; force every state to allow abortions until birth for any reason, with no accountability or protections for women. I will always defend the lives of the unborn. https://t.co/BgMv1HVZp4",RepRickAllen
168,2021-09-17 17:02:13+00:00,1438911180052049920,"Congratulations to @AUG_Health for winning a @Hyundai @HopeOnWheels research grant for $300,000 this year! This #ChildhoodCancerAwareness Month, I want to thank AU for its research contributions to cure #pediatriccancer!",RepRickAllen
169,2021-09-17 14:35:15+00:00,1438874192443805701,"Happy #ConstitutionDay! On this day in 1787, our Founding Fathers signed the U.S. Constitution - laying the foundation for our republic. As Americans, we have a vital duty to always uphold and defend it. https://t.co/7IB027QfuL",RepRickAllen
170,2021-09-16 14:37:38+00:00,1438512405684752389,"New border numbers are in with over 200,000 apprehensions last month - a 317% increase from last August! Biden’s open border policies continue to make the crisis at our Southern Border one of the worst in U.S. history. https://t.co/xKTNq6K4fH",RepRickAllen
171,2021-09-16 12:29:07+00:00,1438480063738044424,"Democrats are proposing almost $3 trillion in tax increases - the largest tax increase in American history. As a result, workers and small businesses will shoulder the burden while the National Association of Manufacturers estimates up to 1 million U.S. jobs will be destroyed.",RepRickAllen
172,2021-09-15 16:57:16+00:00,1438185158314708996,"Since day 1, the Biden Admin has worked to undo the progress made under President Trump. I had the opportunity to share how the Biden tax &amp; spending spree will further harm the pocketbooks of American workers, businesses &amp; families at the @Heritage_Action #SaveOurPaychecks event. https://t.co/bUPonfM0pj",RepRickAllen
