,Datetime,Tweet Id,Text,Username
173,2021-09-14 21:34:48+00:00,1437892611784822786,"Biden’s economic crisis is hurting American workers. With inflation near its highest rate in over a decade, Americans are paying more for everything and bringing home less in their pockets. https://t.co/1W4hUfvP0z",RepRickAllen
174,2021-09-14 20:31:55+00:00,1437876790467387401,"It’s been a tough 18 months for our small businesses, and it is more important than ever to advance policies that empower employers &amp; employees – not stifle their opportunity to grow. Proud to join @RepBlaine in recognizing National #SmallBusinessWeek. https://t.co/QpyTqTpQAl",RepRickAllen
175,2021-09-13 18:47:11+00:00,1437488043791953920,"To pay for their reckless spending, the Biden Admin is pushing an IRS data collection proposal that will increase tax info reporting requirements on financial institutions and infringe on the privacy of Americans. I joined @RepTomEmmer &amp; over 140 colleagues in sounding the alarm. https://t.co/8oZMRTC5fw",RepRickAllen
176,2021-09-11 15:22:27+00:00,1436711746169868291,#NeverForget https://t.co/QG3ent3EVu,RepRickAllen
177,2021-09-11 13:23:41+00:00,1436681857106653189,"On this 20th anniversary of September 11, 2001, let’s honor all who have served in defense of freedom, and stay vigilant in the fight against terrorism that continues today. My latest for @AUG_Chronicle ⬇️
https://t.co/IL8JumSjQH",RepRickAllen
178,2021-09-10 19:04:56+00:00,1436405348424953859,"Democrats are pushing their #SocialistSpendingSpree through the House Agriculture Committee. The $3.5 trillion bill will raise taxes on America’s farmers. 

I will keep fighting against this reckless proposal that could devastate family farms. https://t.co/hC2JfGADu5",RepRickAllen
179,2021-09-09 23:26:35+00:00,1436108806480703489,I thank @GovKemp for his commitment to fight this overreach and take it to the courts.,RepRickAllen
180,2021-09-09 23:26:35+00:00,1436108805473964044,"Rather than instill confidence in the vaccine, Joe Biden is threatening the rights of Americans to earn a living. It is totally hypocritical, as this Administration has not implemented or enforced any sort of requirement for illegal immigrants pouring across our Southern Border.",RepRickAllen
181,2021-09-09 23:26:35+00:00,1436108804521877505,But the federal government has no right to place this mandate on private workplaces that have been struggling over the past 18 months and are desperate to hire workers.,RepRickAllen
182,2021-09-09 23:26:35+00:00,1436108803410472969,"The decision to get a vaccine is personal choice between an individual and their doctor, and I encourage folks to get the vaccine if they are able.",RepRickAllen
183,2021-09-09 23:26:34+00:00,1436108802282098689,"The White House’s announcement that it will order the Dept. of Labor to issue a national vaccine mandate for workers employed by a business with 100+ employees, or require a weekly test before coming to work, is just another example of government overreach by the Biden Admin.",RepRickAllen
184,2021-09-09 19:20:46+00:00,1436046944581914628,House Democrats are pushing through committees their massive $3.5 trillion budget package that radically expands the federal government’s power through costly one-size-fits-all programs and handouts. Their spending spree prioritizes socialist policies over the American people. https://t.co/OjFhLedXaW,RepRickAllen
185,2021-09-09 16:41:28+00:00,1436006854698704897,"Americans are already paying more for everything under the Biden Admin, and today HHS and the White House unveiled their government-controlled drug pricing scheme that will eliminate choice &amp; competition while making us more reliant on nations like China. https://t.co/wi8XgxTPts",RepRickAllen
186,2021-09-08 18:58:14+00:00,1435678886503796748,The Truth in Employment Act will combat the coercive “salting” tactic. https://t.co/A7BZqoyyCX,RepRickAllen
187,2021-09-08 18:58:14+00:00,1435678884666744840,"Employers are desperate to get Americans back in the applicant pool, and small businesses should never be targets of big unions’ forced unionization campaigns or be trapped in a costly legal battle if they do not comply. https://t.co/GQ6Or3d3YU",RepRickAllen
188,2021-09-08 15:15:24+00:00,1435622807719776260,"A majority of Americans agree that taxpayer dollars should not be used to fund abortion, but Democrats continue their push to remove the Hyde Amendment - which has saved over 2.5 million lives - in upcoming spending packages. #HydeSavesLives https://t.co/FENgbsVshR",RepRickAllen
189,2021-09-08 14:20:06+00:00,1435608890775941127,"The commission tasked to provide Congress with recommendations for changing names of military bases, including Fort Gordon, is now accepting public comments. You can visit https://t.co/TuvbZiBWu3 to provide a suggestion.",RepRickAllen
190,2021-09-07 20:20:33+00:00,1435337214234439686,"Folks, even the mainstream media doesn’t know what to call the bill because it’s full of unrelated Democrat priorities!",RepRickAllen
191,2021-09-07 20:20:33+00:00,1435337213177380869,"- Providing amnesty for illegal immigrants
- Eliminating states’ right-to-work laws
- Reinstating the death tax and implementing new burdensome taxes
- Expanding government-controlled health care
- And much more!",RepRickAllen
192,2021-09-07 20:20:33+00:00,1435337211034091521,"This week, House committees will consider portions of Biden’s $3.5 trillion tax and spending spree. So what do Democrats plan to include in the bill? https://t.co/cJIWabhV0G",RepRickAllen
193,2021-09-07 14:32:40+00:00,1435249666426351619,"That’s why I joined over 100 of my @HouseGOP colleagues pledging we will not vote to increase the debt ceiling under any circumstances!
https://t.co/1OkaEwRbNG",RepRickAllen
194,2021-09-07 14:32:40+00:00,1435249665440686082,"House Democrats have been on a massive spending spree. In order for this spending to occur, our nation’s debt limit will have to be increased significantly. Because Democrats are responsible for the spending, they need to take responsibility for increasing the debt ceiling.",RepRickAllen
195,2021-09-06 12:04:00+00:00,1434849863443886084,"Happy Labor Day, America’s workforce! Thankful for the men and women who fuel our country and economy. https://t.co/sUZquMdzIV",RepRickAllen
196,2021-09-03 15:13:04+00:00,1433810281415725059,"The August jobs report was a MAJOR disappointment. Biden’s spending push is not working, yet Democrats are moving forward with their $3.5 trillion socialist tax and spending spree that will make this crisis even worse! https://t.co/O0GGtYyKtu",RepRickAllen
197,2021-09-02 20:33:52+00:00,1433528623722647553,"With reports that Biden pressured former Afghan President Ghani to downplay the threat posed by the Taliban just weeks before they seized the country, we must know the truth! I joined @RepTenney in calling for the release of the full, unedited transcript. https://t.co/uh0yLG4wEI",RepRickAllen
198,2021-09-02 15:04:00+00:00,1433445610682679302,"It was great to meet with civic leaders in Emanuel County, including Swainsboro Mayor Major Schwabe and Sheriff Jeffrey Brewer. We discussed issues impacting the community like the need for a skilled workforce and combating COVID-19. https://t.co/La9lTY2ZhI",RepRickAllen
199,2021-09-02 13:35:49+00:00,1433423420671373313,"I held a telephone town hall Tuesday night to answer questions from residents of #GA12 and provide an update on Afghanistan, COVID-19, federal spending, and more. For those who were unable to participate in the call, here are some of the highlights: https://t.co/dxp5DhrH9H https://t.co/mg7pbW8XQU",RepRickAllen
200,2021-09-01 22:09:34+00:00,1433190319282171907,"They should resign, and Congress must hold this Administration accountable and conduct a thorough investigation and oversight in the coming weeks and months.",RepRickAllen
201,2021-09-01 22:09:33+00:00,1433190317222768640,"It’s clear President Biden and Secretary of State Blinken are not fit to lead, and their failed leadership has put our military, American citizens, and allies in grave danger.",RepRickAllen
202,2021-09-01 19:58:06+00:00,1433157237057507334,These heroes represent the very best of America. Thank you to the special ops veterans who volunteered in a weeklong secret operation to rescue hundreds of our allies. https://t.co/c8jnPqwTCR,RepRickAllen
203,2021-09-01 15:29:51+00:00,1433089728354598914,"Had the opportunity to share a DC update with the Swainsboro Exchange Club before meeting with Twin City Mayor, Matt Donaldson, to discuss issues impacting the city and how we can best serve our students. https://t.co/3VpzztVoHC",RepRickAllen
204,2021-08-31 21:27:57+00:00,1432817460374343687,"We lost 13 brave service members this past week who made the ultimate sacrifice so others may know freedom. I am humbled to join over 150 members in cosponsoring @RepLisaMcClain’s bill to award these heroes a Congressional Gold Medal.
https://t.co/r1JEmNSFYX",RepRickAllen
205,2021-08-31 20:21:46+00:00,1432800804117884932,"Biden won't take questions. 
Pelosi won't call the House back into session.

All while Americans &amp; allies remain stranded in Afghanistan. What happened to no man left behind?",RepRickAllen
206,2021-08-31 02:01:42+00:00,1432523961309483013,"The last U.S. troops left Afghanistan, leaving behind hundreds of Americans and thousands of our allies. This withdrawal shows failed leadership from the top. 

President Biden, do you prioritize politics more than the American people? https://t.co/zsQxvS17K6",RepRickAllen
207,2021-08-27 16:20:25+00:00,1431290514767335425,"Republicans tried to bring forward a vote on a bill to prohibit the withdrawal of U.S. troops until every American is out of Afghanistan, but Democrats refused. 
Wake up, Speaker Pelosi! Bring us back into session to take action since this Administration continues to do nothing.",RepRickAllen
208,2021-08-27 16:20:25+00:00,1431290513525772291,"Earlier this week, Speaker Pelosi called the House back into session to start the process of wasting $3.5 trillion on misguided Democrat priorities...",RepRickAllen
209,2021-08-26 20:31:19+00:00,1430991266796482561,Biden must make clear the United States does not negotiate with terrorists. Check out my e-news for an update on Afghanistan: https://t.co/ihymokNGqW,RepRickAllen
210,2021-08-26 20:31:18+00:00,1430991265181716492,"The situation in Afghanistan is growing worse with each passing hour, and there must be an immediate transition in the mission: No arbitrary deadlines, no excuses. We must do whatever it takes to ensure the safety of Americans and our allies...",RepRickAllen
211,2021-08-26 18:15:36+00:00,1430957112272764934,"At least 10 U.S. Marines have been killed or injured in the explosion outside of Kabul airport, and thousands of Americans and allies remain in immediate danger. Biden must make clear that these attacks will not be tolerated and take action.",RepRickAllen
212,2021-08-26 16:22:32+00:00,1430928659959910401,We have new reports on the ground of explosions outside the gates of the Kabul airport. Please join Robin &amp; me in praying for the thousands of Americans and allies still in Afghanistan.,RepRickAllen
213,2021-08-25 18:55:57+00:00,1430604878393511938,"Great news from SCOTUS! The Migrant Protection Protocols ensure a safer, more orderly process for processing asylum claims while discouraging individuals from illegally entering or making false claims.  https://t.co/9VLLBstzUI",RepRickAllen
214,2021-08-25 13:58:29+00:00,1430530021458907142,"Specifically, we ask about evacuation efforts, the arbitrary August 31st deadline, the rise of other terrorist groups in the region, ensuring the Taliban doesn't get US military equipment, refugees, and more. Read the full letter here: https://t.co/bAxO6mHVcA",RepRickAllen
215,2021-08-25 13:58:29+00:00,1430530019605024770,I joined Sen. @JohnCornyn and members of both the House and Senate demanding President Biden answer several urgent questions regarding Afghanistan. https://t.co/VCvRMlTWsI,RepRickAllen
216,2021-08-24 23:23:26+00:00,1430309805940428806,"The Democrats once again brought up this bill with no opportunity for amendment, which should alarm every American who wants free, fair and secure elections.",RepRickAllen
217,2021-08-24 23:23:25+00:00,1430309804665446403,"Further, this bill would give the Biden Administration the ability to veto states’ voter ID requirements and make it easier for partisan groups to sue states over commonsense measures to safeguard elections.",RepRickAllen
218,2021-08-24 23:23:25+00:00,1430309803528704001,"The Constitution grants states the primary role over administering elections, not federal bureaucrats and the courts.",RepRickAllen
219,2021-08-24 23:23:25+00:00,1430309802341765122,"House Democrats continue to jam through radical proposals to federalize our elections. Now, under the guise of updating the Voting Rights Act, they are pushing H.R. 4 – another unprecedented power grab that would trample on states’ rights.",RepRickAllen
220,2021-08-24 21:21:38+00:00,1430279153803276299,"Instead of focusing on the immediate crisis in Afghanistan in order to get American citizens &amp; allies to safety, or working to get our economy back on track, House Dems are spending precious time to move forward Biden’s $3.5 trillion tax &amp; spending spree. https://t.co/kAwwZuNqIi",RepRickAllen
221,2021-08-24 17:23:32+00:00,1430219233863081994,"I beg to differ, @PressSec. I’m hearing directly from folks on the ground who are waiting to be evacuated and haven’t had food or water in days…
https://t.co/7XJdqOQUB0",RepRickAllen
222,2021-08-24 15:25:50+00:00,1430189613314891778,Every American citizen and ally must be safely evacuated from Afghanistan – no excuses. I joined @RepJacobs in calling on President Biden to immediately provide a clear plan to do so. You can read the text of the resolution here: https://t.co/xdZ6pLPDdT,RepRickAllen
223,2021-08-23 16:17:57+00:00,1429840340693958663,"- Taliban seizes Afghanistan
- Record crossings at our Southern Border
- Inflation surging
- Crime spiking 

Instead of addressing these crises, Pelosi is focusing on Biden’s $3.5 trillion socialist spending spree that advances Green New Deal priorities &amp; provides amnesty.",RepRickAllen
224,2021-08-20 20:27:06+00:00,1428815880398516229,"French and U.K Forces are leaving Kabul to ensure the safe evacuation of their citizens, but Biden is relying on the Taliban to get Americans out. This is unconscionable! The Biden Admin must do better; our military is the best in the world but there’s no plan in sight!",RepRickAllen
225,2021-08-20 16:39:00+00:00,1428758475513884683,"I understand the images coming out of Afghanistan are difficult for many of our post-9/11 veterans and please know you are #NotAlone. If you need to talk to someone, the Veterans Crisis Line is available at 1-800-273-8255 &amp; Press 1 or Text 838-255.",RepRickAllen
226,2021-08-20 16:01:00+00:00,1428748912911962120,"Another consequence of Biden’s failed withdrawal is the Taliban seizing U.S. weapons and equipment left behind. Contrary to what Biden said, this is not planning for every possible contingency. https://t.co/SGmbINJrte",RepRickAllen
227,2021-08-20 14:44:51+00:00,1428729747606065162,Officials on the ground in Kabul warned the Biden Admin of the fallout from not having a strategic withdrawal. The administration must be held accountable - and we must get Americans and our allies out now! https://t.co/csdt7NyMOj,RepRickAllen
228,2021-08-18 19:48:09+00:00,1428081302616616968,"If you or someone you know is in Afghanistan and seeking evacuation, please contact my office. I have dedicated caseworkers who are already working with over a hundred folks to get them home. 706-228-1980",RepRickAllen
229,2021-08-18 16:58:28+00:00,1428038598234763266,"While I’m in Vidalia today, a shipment of onions has made it to my DC office. I look forward to sharing these with my colleagues and showing them why our sweet Vidalia onions are world class! https://t.co/OcoD8XhTRN",RepRickAllen
230,2021-08-17 20:38:18+00:00,1427731535160086548,This is unacceptable! The Biden Admin must immediately report to Congress and the American people a clear plan to ensure the safe evacuation of all Americans from Afghanistan. https://t.co/2RDfPe9pJQ,RepRickAllen
231,2021-08-16 15:34:47+00:00,1427292765755424772,"As the Taliban quickly seized control of Afghanistan following Biden’s botched withdrawal, he has demonstrated that he is a weak commander-in-chief and now the Afghan people face a heartbreaking humanitarian crisis.",RepRickAllen
232,2021-08-13 16:33:34+00:00,1426220395506671618,"It's been a busy few weeks traveling around #GA12, take a look at my e-newsletter to see some of the highlights: https://t.co/dDSNNF8eTn",RepRickAllen
233,2021-08-12 20:56:22+00:00,1425924142512197649,"Georgia has consistently been named the best state to do business, and it’s partially thanks to right to work. Now Democrats want to trample on states’ rights to instead push for forced unionization.",RepRickAllen
234,2021-08-12 20:56:22+00:00,1425924141320916993,Among the many proposed poison pills in the Democrats’ $3.5 trillion budget is a provision to eliminate 27 states’ right-to-work protections.,RepRickAllen
235,2021-08-12 18:24:35+00:00,1425885944914251782,It felt good to be back at the annual Midville Field Day lunch. Thankful for the men and women who help make Georgia’s ag industry the best in the nation! https://t.co/9vamCGOfLf,RepRickAllen
236,2021-08-12 14:03:00+00:00,1425820114306359297,"Thanks to the ReConnect Program, USDA announced a $167 million investment in broadband. I was proud to support Altamaha EMC’s application, which will use a $10.6 million loan &amp; a $10.6 million grant to deploy a fiber-to-the-premises network in rural GA! https://t.co/cuBKLeEsPo",RepRickAllen
237,2021-08-12 12:48:48+00:00,1425801443370471425,Ensuring our veterans have quality care is one of my top priorities in Congress. I had the opportunity to visit both the Carl Vinson VA in Dublin and the Charlie Norwood VA in Augusta to receive an update on their operations as we continue to combat COVID-19. https://t.co/nu1YqKFPyo,RepRickAllen
238,2021-08-11 17:24:44+00:00,1425508493830852609,"Now is not the time for more reckless spending. Inflation rose to 5.4% in July, and Americans continue to pay more for everyday goods and services. Hope my Democrat colleagues take a look at the latest CPI numbers before passing trillions in more spending! https://t.co/Dvm2J7NyGS",RepRickAllen
239,2021-08-10 16:59:54+00:00,1425139858884997121,It’s always great to be in Dublin! Thank you to the Exchange Club for having me today and letting me share a brief legislative update. https://t.co/4ZMknaoFMd,RepRickAllen
240,2021-08-10 15:27:59+00:00,1425116726308573184,Democrats are trying to use their sham “budget” deal to enact PRO Act policies. The federal government should not subsidize union membership! https://t.co/gdNRvprMby,RepRickAllen
241,2021-08-09 20:40:03+00:00,1424832870124826624,"Crime is on the rise, and Americans are rightfully concerned. In 2021, 63 major cities reported a 29% increase for the first 3 months compared to last year. We must #BacktheBlue and give officers the resources they need to keep communities safe. https://t.co/v521mUyPmJ",RepRickAllen
242,2021-08-06 13:52:24+00:00,1423643118067458048,"According to the @NFIB, 49% of small business owners reported unfilled job openings in July. With plenty of available jobs, it’s time to get Americans back to work! https://t.co/w7k11nIPCj",RepRickAllen
243,2021-08-06 00:49:39+00:00,1423446136334032896,"House Democrats doled out $783.5 million to criminals in their partisan stimulus bill. That’s right, your tax dollars went to convicted felons. https://t.co/sZo2GW5tIP",RepRickAllen
244,2021-08-03 18:11:41+00:00,1422621205400535044,"As students prepare to return to the classroom, back to school shopping is at a record high due to inflation: “Families with children in elementary through high school plan to spend an average of $848.90 on school items, which is $59 more than last year.” https://t.co/uCcs1qkoxW",RepRickAllen
245,2021-08-02 19:32:01+00:00,1422279035283968001,"Proud to Iead over 50 @HouseGOP in urging the court to uphold Georgia’s election law in the upcoming DOJ lawsuit. As highlighted in our brief with @ACLJ, the Constitution grants states – not the Executive branch or courts – broad authority over elections. https://t.co/NsfH9iWXMP",RepRickAllen
246,2021-07-30 19:58:04+00:00,1421198428479098894,"""Dr. Anthony Fauci has said that the science has evolved with the virus. We ask that you provide us and the American people that science.""

You can read the full letter here: https://t.co/8amaqk84gr",RepRickAllen
247,2021-07-30 19:58:04+00:00,1421198427635998723,"As we write, ""We are deeply concerned that the CDC has released blanket guidance seeking to reduce this transmission when they have not even provided data on the frequency of breakthrough infections to the public...",RepRickAllen
248,2021-07-30 19:58:04+00:00,1421198426717528065,Today I joined more than 40 of my colleagues calling on the CDC to release data on the frequency of breakthrough infections of COVID-19 in vaccinated individuals.,RepRickAllen
249,2021-07-30 15:34:49+00:00,1421132179803938820,"Roe v. Wade has resulted in over 62 million babies lost from abortion. That is why I signed onto an amicus brief for the upcoming SCOTUS case, Dobbs v. Jackson, to uphold Mississippi’s 15-week abortion ban and protect the unborn. https://t.co/mKsNKFgRMn",RepRickAllen
250,2021-07-29 20:15:34+00:00,1420840443978428416,House Democrats just paved the way for taxpayer-funded abortions by rejecting the long-standing Hyde Amendment. This is insane! https://t.co/jPEzcPa9YO,RepRickAllen
