,Datetime,Tweet Id,Text,Username
86,2021-09-24 19:00:53+00:00,1441477758023049219,"The #NDAA would improve health care services for our Service members, make provisions to help combat sexual assault in the military and take action against climate change by improving critical defense infrastructure.",RepStephenLynch
87,2021-09-24 19:00:53+00:00,1441477756710178821,"This week the House passed the National Defense Authorization Act for FY2022 which would authorize funding to help improve the lives of U.S. Service members &amp; their families, strengthen our national security &amp; invest in emerging technologies to modernize our defense institutions.",RepStephenLynch
88,2021-09-22 21:53:21+00:00,1440796384777572361,3/3  The Coast Guard plays a critical role in the safety of our south shore communities and I will continue to do everything in my power to ensure they do not close Station Scituate.,RepStephenLynch
89,2021-09-22 21:53:21+00:00,1440796383510859779,2/3 The Coast Guard provides life-saving assistance as our first responders in the event of a water emergency and the closure of this station would increase potential response time to two hours in bad weather. This could cost people their lives.,RepStephenLynch
90,2021-09-22 21:53:20+00:00,1440796381526953987,1/3 Today I sent a letter to @USCG Asst. Commander Rear Admiral John Mauger urging the U.S. Coast Guard immediately abandon their current plan to close Station Scituate. https://t.co/MYZPn50KFE,RepStephenLynch
91,2021-09-21 18:20:01+00:00,1440380308344299523,3/3 I would like to thank all the witnesses for sharing their expertise on the various issues surrounding the gathering and usage of consumer financial data and discussing how we can ensure consumer data is protected. You can watching the hearing here: https://t.co/F4ScuZP3gX,RepStephenLynch
92,2021-09-21 18:20:00+00:00,1440380306335227915,"2/3 The collection &amp; utilization of consumer financial data has dramatically increased the past decade &amp; its expansion to mobile platforms &amp; online banking has raised important policy questions surrounding personal data collection, user control &amp; meaningful consent to share data.",RepStephenLynch
93,2021-09-21 18:20:00+00:00,1440380304330412032,1/3 Today as Chair of the @FSCDems #FinTech Task Force I held a hearing to examine how safe and secure data sharing rules can protect consumers’ personal financial information.,RepStephenLynch
94,2021-09-19 00:46:12+00:00,1439390332047798276,2/2 .. and all the volunteers for your hard work to host this fun event to celebrate and support the Norwood community. https://t.co/URUYtCcCi8,RepStephenLynch
95,2021-09-19 00:46:07+00:00,1439390311759941635,"1/2 A wonderful time at Norwood Day – huge crowd enjoying all the entertainment, games and supporting local businesses. My thanks to Jim Geraghty and Rep. John Rogers for your hospitality and the Norwood Recreation Department, Norwood Police and Fire… https://t.co/81ESFNhyGI",RepStephenLynch
96,2021-09-18 19:36:39+00:00,1439312433353568259,2/2 .. for providing much needed support to South Boston restaurants and their employees throughout the pandemic. Thanks to the South Boston Chamber of Commerce and the South Boston Neighborhood Development Corporation for hosting another fun #SBStreetFest,RepStephenLynch
97,2021-09-18 19:36:39+00:00,1439312429855477765,"1/2 Great to stop by the 21st Annual South Boston Street Festival today to enjoy the live music, food and activities. Congratulations to Mike Shaw of the Broadway Restaurant Group for receiving the Tommy Butler Award… https://t.co/h3h5jmrmqM",RepStephenLynch
98,2021-09-16 02:07:51+00:00,1438323718514692098,Wishing all my friends in the Jewish community observing Yom Kippur an easy fast and a meaningful day of peace and reflection. Chag sameach!,RepStephenLynch
99,2021-09-13 14:49:53+00:00,1437428323668344832,2/2 Thank you to the Whitman Fire Chief Tim Clancy and Police Chief Tim Hanlon for hosting such a dignified tribute. #NeverForget,RepStephenLynch
100,2021-09-13 14:49:52+00:00,1437428320409378819,"1/2 Last weekend I was honored to join friends, families and town officials in the Town of Whitman for a touching ceremony to remember all the innocent lives that were lost 20 years ago on 9/11. https://t.co/saeKS9WrLZ",RepStephenLynch
101,2021-09-13 01:29:18+00:00,1437226849843679234,2/2 Thank you to Tom Lyons and the Memorial Committee for such a dignified remembrance ceremony for 27 sons of South Boston.,RepStephenLynch
102,2021-09-12 19:07:03+00:00,1437130654228045824,"1/2 Proud to join seven Congressional Medal of Honor recipients, many Vietnam veterans, Gold Star families and hundreds of my neighbors from South Boston at the 40th Anniversary Rededication of the South Boston Vietnam Veterans Memorial. https://t.co/ajzHfZZltk",RepStephenLynch
103,2021-09-11 23:58:33+00:00,1436841625343471619,2/2 .. of the Generals Bridge and Park to honor the memory and service of these men from @CityofQuincy who shouldered enormous responsibility during times of great consequence for our nation.,RepStephenLynch
104,2021-09-11 23:55:43+00:00,1436840912483721219,"1/2 It was an honor to join Quincy Mayor Tom Koch, General Joseph Dunford, USMC (ret.) General James McConville, US Army, Major General Francis McGinn, US Army, Brigadier General Ronald Rand, USAF (ret.), and General Gordon Sullivan, US Army (ret), for the dedication… https://t.co/3Zk3a3fXoV",RepStephenLynch
105,2021-09-11 20:49:13+00:00,1436793977093697539,Honored to attend the 9/11 remembrance and dedication of Generals Bridge and Park in @CityofQuincy this morning. Congratulations to @mayortomkoch for his vision and hard work on this noble and patriotic project. https://t.co/gzf7df4NxZ,RepStephenLynch
106,2021-09-11 18:59:00+00:00,1436766241931337730,"2/2 .. and the example of courage and self-sacrifice we saw from our fire fighters, police and first responders. God bless America 🇺🇸 #NeverForget",RepStephenLynch
107,2021-09-11 18:59:00+00:00,1436766240412930056,"1/2 On this day, 20 years ago, our nation was forever changed by an unspeakable act of evil. I will never forget the nearly 3,000 lives lost that day, their families and friends who mourn their loss every day…",RepStephenLynch
108,2021-09-09 17:05:00+00:00,1436012774891606018,"2/2 This hotel will help expand economic &amp; employment opportunities, providing around 800 jobs on site &amp; will have a permanent training center for Local 26 hotel training in Boston. I look forward to seeing the positive impact the hotel &amp; its amenities will have on @CityOfBoston.",RepStephenLynch
109,2021-09-09 17:04:57+00:00,1436012765433446400,"1/2 Great to join @MassGovernor Charlie Baker, Boston @MayorKimJaney, Senator @NickCollinsMA, Rep. @david_biele and Boston City Councilors @MFFlaherty and @EdforBoston at the Omni Seaport Hotel grand opening yesterday. https://t.co/3msvA76ld7",RepStephenLynch
110,2021-09-06 23:28:30+00:00,1435022123668549634,"To my friends of the Hebrew faith, wishing you “Shana tova” to all. Be safe. https://t.co/Ielnp2suiV",RepStephenLynch
111,2021-09-06 16:17:40+00:00,1434913700457197579,Wishing all America’s working families a safe and Happy Labor Day! https://t.co/FVQwMzQ1gy,RepStephenLynch
112,2021-09-01 18:10:53+00:00,1433130254516826112,I would like to thank Rob and Donna Manning for their $50 million gift to the University of Massachusetts system! $15 million of which will be awarded to @UMassBoston to establish an endowment for the College of Nursing and Health Sciences. https://t.co/G0WkJnhQFj,RepStephenLynch
113,2021-08-26 22:45:12+00:00,1431024961880215555,Update: Unfortunately it is reported there have now been thirteen U.S. service members that have been killed.,RepStephenLynch
114,2021-08-26 20:22:44+00:00,1430989106494967814,"I strongly condemn the vicious terrorist suicide attack at Hamid Karzai Airport in Kabul that killed dozens of people, including twelve courageous U.S. service members and injured many others. My full statement is below: https://t.co/HOl193SU2w",RepStephenLynch
115,2021-08-15 12:35:59+00:00,1426885378565357574,"Our thoughts and prayers are with the people of Haiti amidst reports of severe earthquake damage and growing numbers of casualties. Because of the fragile state of their government, Haiti will need emergency relief as soon as possible.",RepStephenLynch
116,2021-08-04 16:36:45+00:00,1422959704884527105,"Special thanks to @StoughtonPD Police Chief Donna McNamara and now retired Fire Chief Michael Laracy, and congratulations to Stoughton’s new Fire Chief Michael Carroll!",RepStephenLynch
117,2021-08-04 16:36:45+00:00,1422959702489636866,Great to attend the Town of Stoughton’s public service awards ceremony last night to celebrate Stoughton Police and Fire Departs. retirements &amp; promotions. Our police &amp; firefighters are on the frontlines every day &amp; have dedicated their lives to keeping their communities safe. https://t.co/pvZ82LE0c9,RepStephenLynch
118,2021-07-26 18:53:16+00:00,1419732570967846914,"3/3 These healthcare professionals provide critical care to patients with complex needs, and I hope the BVNA and VNA Care can come to a swift agreement on an equitable contract.",RepStephenLynch
119,2021-07-26 18:53:16+00:00,1419732569403318276,"2/3 After almost 2 years of negotiations, the BVNA is going on a 7 day strike to attain essential contract provisions regarding healthcare and retirement security and to improve patient assignment protocol.",RepStephenLynch
120,2021-07-26 18:53:16+00:00,1419732567306166275,"1/3 This morning I joined @WuTrain, @EdforBoston and Maryanne McHugh in support of the Boston Visiting Nurses Association’s (BVNA) efforts to achieve a fair and equitable first contract following their vote to unionize with the @MassNurses. https://t.co/mJ90Up0a8Y",RepStephenLynch
121,2021-07-23 14:08:22+00:00,1418573710047514628,4/4 I thank all my colleagues on the Oversight Committee for their support and Rep @VirginiaFoxx for co-sponsoring this important piece of legislation.,RepStephenLynch
122,2021-07-23 14:08:22+00:00,1418573708692688904,"3/4 ..of U.S. researchers for their own military and security advantage. My bill will require federal grant making institutions to conduct strict oversight of the projects they fund, safeguarding them from theft and duplication by foreign rivals.",RepStephenLynch
123,2021-07-23 14:08:22+00:00,1418573707128287235,"2/4 ..that are used by America’s adversaries, such as China, to steal intellectual property and AI technology innovations funded by U.S. research. America has become a global leader in A.I. and according to the National Security Commission on A.I., China aims to coopt the work...",RepStephenLynch
124,2021-07-23 14:08:21+00:00,1418573705484161027,"1/4 This week @OversightDems passed my bipartisan bill H.R. 4465, the Federally Funded Research and Technology Development Protection Act, which will help protect U.S. research in artificial intelligence. My bill will curb the use of “foreign talent recruitment programs”...",RepStephenLynch
125,2021-07-21 21:03:20+00:00,1417953361790480389,6/6 Passing this legislation is critical to addressing the health disparities in a fair and equitable way. #Justice40 #INVESTAct,RepStephenLynch
126,2021-07-21 21:03:20+00:00,1417953360557350912,"5/6 Similarly, my bill, H.R. 3521, the Postal Service Electric Fleet Authorization Act, would dedicate funding to convert all U.S. Postal Service vehicles to zero-emission vehicles by 2030 and require them to be built here in the US.",RepStephenLynch
127,2021-07-21 21:03:19+00:00,1417953359412277254,"4/6 .. that are struggling with high asthma rates, such as in Brockton, Boston and Quincy. Many of these neighborhoods rely heavily on older diesel bus service and their replacement with zero-emission buses would have a positive impact on air quality.",RepStephenLynch
128,2021-07-21 21:03:19+00:00,1417953358103654400,"3/6 I am pleased that my bill, the Green Buses for Every Community Act, was included in the House passed version of the #INVESTAct. My bill would dedicate a portion of the funding for the purchase of zero-emission buses which serve low-income areas...",RepStephenLynch
129,2021-07-21 21:03:19+00:00,1417953356946026500,"2/6 As the representative of @CityBrockton, I have seen how low-income and Black and Brown communities have been disproportionately impacted by the coronavirus, as well as air pollution and respiratory ailments.",RepStephenLynch
130,2021-07-21 21:03:18+00:00,1417953355662569476,"1/6 Today @OversightDems held a hearing to examine President Biden’s #Justice40 initiative, which will direct 40% of the benefits for infrastructure, clean energy and workforce investments to low-income communities severely impacted by climate change.",RepStephenLynch
131,2021-07-12 22:30:04+00:00,1414713699164622849,My thanks to Paul Marcus of The Marcus Group and the amazing Ginkgo Bioworks team for showing me around and explaining your innovative work.,RepStephenLynch
132,2021-07-12 22:30:04+00:00,1414713697512136708,"Great to tour the Ginkgo Bioworks foundry in the Seaport today, with Co-founder Barry Canton. GB is an exciting new company founded by MIT grads, whose 500 employees are using breakthrough technology to help strengthen bio security and develop life-changing medicines. https://t.co/AbJfCLm8VD",RepStephenLynch
133,2021-07-04 21:47:07+00:00,1411803786339889158,"On this Independence Day, as America yet again arises from a difficult ordeal, let us celebrate the resiliency of our democracy which holds the promise of liberty and justice for all. 🇺🇸",RepStephenLynch
134,2021-07-01 01:55:32+00:00,1410416752278790144,4/4 H.Res.503 will create a bipartisan Select Committee to investigate and report on the facts and make recommendations on how we can prevent similar domestic terrorist attacks against our country.,RepStephenLynch
135,2021-07-01 01:55:32+00:00,1410416751276343298,"3/4 The events that occurred at the U.S. Capitol that day tragically resulted in the loss of 5 lives and injured more than 140 courageous law enforcement officers, many of them U.S. Military veterans.",RepStephenLynch
136,2021-07-01 01:55:32+00:00,1410416750177435649,"2/4 It is extremely important to identify all of the individuals who “pushed the big lie” that the election was stolen and participated in the attack to overturn the democratic election. This attack was treason, plain and simple.",RepStephenLynch
137,2021-07-01 01:55:31+00:00,1410416748919205894,"1/4 Today the House passed H.Res.503, which empowers Congress to fully investigate the complete facts surrounding the events leading to the treasonous attacks on the U.S. Capitol on January 6th.",RepStephenLynch
138,2021-06-28 20:09:20+00:00,1409604850791469057,2/2 Wonderful to see things starting to get back to normal and the community coming together to celebrate. https://t.co/iHOavkgyjY,RepStephenLynch
139,2021-06-28 20:09:01+00:00,1409604771963674637,"1/2 Proud to march with @braintreemayor, @WalterFTimilty and @SenJohnFKeenan in Braintree’s 4th of July Parade this weekend. Lots of festivities for all, including the celebration of the lifting of all coronavirus restrictions for the Town of Braintree. https://t.co/nSr8ZfXxkY",RepStephenLynch
140,2021-06-28 17:22:30+00:00,1409562868551491587,2/2 You can visit https://t.co/tobg1QuVwL for more information on who is eligible and to ensure you are enrolled in the program.,RepStephenLynch
141,2021-06-28 17:22:30+00:00,1409562867662311428,"1/2 The American Rescue Plan included a provision that increased the child tax credit to $3,600 for kids under 6 years old and $3,000 for kids between ages 6-17. These critical payments will help over 70% of children in my district and are scheduled to begin mid-July.",RepStephenLynch
142,2021-06-26 12:39:36+00:00,1408766898557407233,2/2 This bill will help ensure older workers are treated fairly in the workplace and will empower them to hold their employers accountable for unfair practices.,RepStephenLynch
143,2021-06-26 12:39:36+00:00,1408766897521369091,"1/2 This week the House passed the bipartisan H.R. 2062, the Protecting Older Workers Against Discrimination Act, which will restore critical, well-established workplace protections for older Americans that are facing increasing age discrimination.",RepStephenLynch
144,2021-06-17 01:56:40+00:00,1405343605313658882,"3/3 .. which had been issued more than two and a half years earlier on Jan 1, 1863, by President Abraham Lincoln. It is important we remember our country’s history, as we strive to build a more perfect Union and keep faith with the promise to provide equality and justice for all.",RepStephenLynch
145,2021-06-17 01:56:39+00:00,1405343604315459586,"2/3 Gordon Granger, a Union general, arrived in Galveston, Texas, to inform enslaved African Americans of their freedom and that the Civil War had ended. General Granger’s announcement put into effect the Emancipation Proclamation...",RepStephenLynch
146,2021-06-17 01:56:39+00:00,1405343603363397633,"1/3 Proud to support passage of S. 475, the #Juneteenth  National Independence Day Act, which commemorates the end of slavery in the United States. On June 19, 1865, about two months after the Confederate General Robert E. Lee surrendered at Appomattox Court House, VA...",RepStephenLynch
147,2021-06-16 14:08:21+00:00,1405165352280018948,"2/2 .. it’s important we consider the impact on financial inclusion, consumer privacy, illicit finance protections &amp; business operations. I’d like to thank Dr.  Neha Narula from MIT, Carmelle Cadet and all the witnesses who participated in the hearing.",RepStephenLynch
148,2021-06-16 14:08:21+00:00,1405165351399272448,"1/2 As Chair of @FSCDems FinTech Task Force, I held a hearing yesterday to examine how the use of a Central Bank Digital Currency (CBDC) might expand access to banking services to unbanked &amp; underbanked communities. As the use of cryptocurrencies &amp; CBDCs continues to develop...",RepStephenLynch
149,2021-06-15 23:17:37+00:00,1404941194182987781,3/3 .. there were recommendations to deploy the national guard to other federal buildings and monuments around Washington D.C. instead of protecting the Capitol while it was actively under attack.,RepStephenLynch
150,2021-06-15 23:17:37+00:00,1404941192794722311,"2/3 .. and were woefully slow to respond which further threatened the lives of all those in and around the Capitol that day. I spoke with U.S. Army Lt. General Walter Piatt, Director of Army staff, about why...",RepStephenLynch
151,2021-06-15 23:17:37+00:00,1404941191284658177,"1/3 Today @OversightDems held a second hearing on the January 6th Capitol insurrection to address the many unanswered questions about the events that occurred that day. In our first hearing, we learned that the Trump Administration failed to adequately prepare for the attack...",RepStephenLynch
152,2021-06-15 13:19:01+00:00,1404790551753416707,"2/2 All involved demonstrated creativity in finding solutions that served Brockton Hospital, our hardworking nurses and the best interest of patients and families in the Greater Brockton Community. I am hopeful that this is a trend.",RepStephenLynch
153,2021-06-15 13:19:00+00:00,1404790544056922112,"1/2 Congratulations to the Massachusetts Nurses Association (MNA) and Brockton Signature Hospital for reaching agreement on a new labor contract. I give great credit to Brockton Hospital CEO Kim Hollon, MNA Executive Director Julie Pinkham and the MNA bargaining team.",RepStephenLynch
154,2021-06-15 01:09:05+00:00,1404606854664265732,Great to attend East Bridgewater Town Meeting this evening. My thanks to Moderator Bob Looney for allowing me to give a congressional update about the upcoming transportation bill and the funding East Bridgewater received from the CARES Act and the American Rescue Plan. https://t.co/7UZUbslWAV,RepStephenLynch
155,2021-06-15 00:10:15+00:00,1404592049156931584,"2/2 ..Quincy First Lady, Christine Koch, DA Mike Morrissey, Sen. John Keenan, City Council President Nina Liang &amp; members of the Quincy delegation in the parade. Wonderful to see so many people come out to celebrate the Quincy community &amp; to commemorate the adoption of our flag🇺🇸 https://t.co/XYShfu8hf3",RepStephenLynch
156,2021-06-15 00:09:58+00:00,1404591979082756096,"1/2 Today on #FlagDay we honor the history of the American Flag and its symbol of valor, independence and perseverance. The @CityofQuincy held their historic 70th Flag Day parade over the weekend and I was honored to join my friend Quincy Mayor Tom Koch... https://t.co/zi6PRHRIl0",RepStephenLynch
157,2021-06-14 16:48:16+00:00,1404480820866334720,Thanks to all my colleagues on the @TransportDems for all your hard work during the mark up of the #INVESTAct. I look forward to the House voting on this monumental investment in America’s transportation and infrastructure in the coming weeks! https://t.co/gVZrALu20J,RepStephenLynch
158,2021-06-11 14:15:58+00:00,1403355332412383239,4/4 This conflict of interest can weaken safety standards and put consumers in danger. We must ensure safe and reliable safety standards that the American people can trust.,RepStephenLynch
159,2021-06-11 14:15:58+00:00,1403355331456126979,"3/4 The majority of products on the market are only governed by voluntary standards, which are set by the ASTM Int'l. However, ASTM include employees who work for manufacturers-such as Fisher-Price-and directly influence the standards that will apply to their company’s products.",RepStephenLynch
160,2021-06-11 14:15:58+00:00,1403355330470350852,"2/4 After learning about the pattern of over 50 infant deaths, @OversightDems launched an investigation in 2019 and it was recently concluded that there are grave flaws in our U.S. consumer product safety system.",RepStephenLynch
161,2021-06-11 14:15:58+00:00,1403355329606324228,"1/4 This week the @OversightDems held a hearing to examine infant deaths that have been associated with the Rock ‘n Play Sleeper sold by Fisher-Price, a subsidiary of Mattel, over the past decade.",RepStephenLynch
162,2021-06-09 14:27:51+00:00,1402633544556597251,"4/4 I thank all the witnesses for their testimony at the @OversightDems hearing, especially @MassAGO Maura Healey for pursuing justice on behalf of victims families. #opioidcrisis",RepStephenLynch
163,2021-06-09 14:27:51+00:00,1402633543541477379,3/4 ..  the dangers of OxyContin. Now almost 20 yrs later we are still working to hold them accountable. The SACKLER Act would ensure bad actors like the Sackler family would not be able to avoid personal liability by using the bankruptcy laws to shield their ill-gotten billions.,RepStephenLynch
164,2021-06-09 14:27:50+00:00,1402633542501285888,"2/4 .. on American families &amp; communities for years while they profited from the sale of the highly addictive painkiller OxyContin through Purdue Pharma. In 2005, I filed legislation to ban OxyContin because the Sackler family and Purdue Pharma were lying to the public about...",RepStephenLynch
165,2021-06-09 14:27:50+00:00,1402633541322694658,"1/4 Yesterday @OversightDems held a hearing to examine the Sackler family’s role in fueling America’s devastating opioid epidemic and how our bill, the SACKLER Act, can help provide accountability moving forward. Members of the Sackler family have inflicted irreparable harm...",RepStephenLynch
166,2021-06-01 01:53:35+00:00,1399544624822300673,2/2 I am grateful to represent a community that takes such great care and pride in remembering those who served and continue to serve our country. My thanks to Hingham Town Moderator Michael Puzo and VSO Keith Jermyn for hosting this dignified ceremony.,RepStephenLynch
167,2021-06-01 01:53:34+00:00,1399544621949145090,1/2 This morning the Town of Hingham held an intimate and well-attended tribute at Town Hall to honor the service men and women who gave their lives for our freedoms. Hingham has a long &amp; strong history of military service &amp; loyal support for our veterans and Gold Star families. https://t.co/YD7DQkwciC,RepStephenLynch
168,2021-06-01 00:51:05+00:00,1399528895100096514,"2/2 Special thanks to Joe Kelley, the Veterans Advisory Council, Rolling Thunder, Scituate High/Middle School Band and the Scituate High Football team for this moving tribute to honor our fallen heroes and all Gold Star families. #MemorialDay",RepStephenLynch
169,2021-06-01 00:51:04+00:00,1399528892550029317,1/2 Honored to join Sen. @PatrickMOConnor and @RepKearney and a large gathering at Scituate’s Memorial Day ceremony and their POW/MIA “Chair of Honor” dedication to honor all the Scituate veterans who made the ultimate sacrifice for our country. https://t.co/FI6JjjZNTB,RepStephenLynch
170,2021-05-31 02:53:56+00:00,1399197424330194945,3/3 My thanks to @BraintreeMayor Chuck Kokoros and VSO Vincent Fountaine for your dedication to ensure our veterans and their families are shown the gratitude they deserve.,RepStephenLynch
171,2021-05-31 02:53:55+00:00,1399197421746466817,2/3 We also honored the life Mr. William Varroso – “Officer Bill” – a beloved Braintree police officer who served in the United States Navy and received a purple heart for his service in WWII. https://t.co/wOXWK6mtPA,RepStephenLynch
172,2021-05-31 02:53:43+00:00,1399197371330932737,1/3 Attended a touching and dignified ceremony at Braintree Town Hall this morning to pay tribute to the courageous men and women who gave the ultimate sacrifice for our country. https://t.co/mQnPzBj2NL,RepStephenLynch
173,2021-05-30 20:14:58+00:00,1399097019877167111,2/2 .. who gave their lives for our country. The love and prayers of a grateful nation go out to all Gold Star families this #MemorialDayWeekend,RepStephenLynch
