,Datetime,Tweet Id,Text,Username
0,2022-02-21 23:31:04+00:00,1495903933008654339,"2/2 If we allow authoritarian regimes like Russia and China to use military force to absorb smaller countries, we only invite more situations like this in the future.",RepStephenLynch
1,2022-02-21 23:31:04+00:00,1495903931981082630,1/2 Today I spoke with @brikeilarcnn on @NewDay about Russia’s escalating military threats against Ukraine. The U.S. and NATO must stand in support of the democratic freedom of the Ukrainian people and continue to urge Putin to avoid war.,RepStephenLynch
2,2022-02-15 15:47:45+00:00,1493613008530067459,"3/3 .. investments that will improve safety, operations and maintenance for all our transportation systems. My thanks to @MBTA General Manager Steve Poftak for coordinating this celebratory event and I look forward to seeing all these projects come to fruition.",RepStephenLynch
3,2022-02-15 15:47:45+00:00,1493613007330586637,"2/3 This new MBTA facility will be the first to garage zero- or low- emission buses and help create a greener, more efficient transit system. The funding from the Bipartisan Infrastructure Law will allow cities and towns across the Commonwealth to make critical infrastructure…",RepStephenLynch
4,2022-02-15 15:47:45+00:00,1493613004931440641,"1/3 Great to join my partners @MassGovernor, @SenWarren, Mayor Tom Koch, @RonMariano, @TackeyChan &amp; @BruceJAyers yesterday at the groundbreaking ceremony for the MBTA’s new Quincy Bus Maintenance facility, which will be built with funding from the Bipartisan Infrastructure Law. https://t.co/09L8EzeL6j",RepStephenLynch
5,2022-02-15 02:14:12+00:00,1493408270408638466,2/2 I commend all of those who have spoken out about their experiences and working conditions and I firmly support their right to bargain collectively.,RepStephenLynch
6,2022-02-15 02:14:12+00:00,1493408268848443394,"1/2 I am proud to be an original co-sponsor of H.Res.915, which would grant Congressional staff protections to organize for fundamental collective bargaining rights.",RepStephenLynch
7,2022-02-13 15:42:20+00:00,1492886867376852997,"My congratulations to Susan M. Collins, the first Black woman selected to be the President of the Boston Federal Reserve Bank. I look forward to seeing the positive impact she will have on New England economies and businesses. @BostonFed",RepStephenLynch
8,2022-02-08 23:23:47+00:00,1491191054615592961,"As someone who has played a key role in drafting &amp; negotiating the terms of this bill, I am proud to see the House pass this critical legislation that will place our must trusted government institution on a path of financial viability &amp; continued success. https://t.co/TgcSqk4z3Q",RepStephenLynch
9,2022-02-08 23:23:46+00:00,1491191052996575232,".. mail handlers, letter carriers, supervisors and postmasters that work 6-7 days a week to process and deliver the mail to every American home and business - even in the midst of a global pandemic. https://t.co/TgcSqk4z3Q",RepStephenLynch
10,2022-02-08 23:23:46+00:00,1491191050857500673,"Today I spoke on the House floor in strong support of the Postal Service Reform Act. This bipartisan, landmark agreement includes fundamental reforms that strengthen the U.S. Post Office and provides vital support to the nearly 650,000 dedicated clerks... https://t.co/TgcSqk4z3Q",RepStephenLynch
11,2022-02-06 00:45:27+00:00,1490124443766734849,We have seen throughout the pandemic there are significant risks of relying on global supply chains for critical goods. The #AmericaCOMPETES Act invests $45B to strengthen supply chains and $52B in American computer chip manufacturing to insulate US families from rising prices.,RepStephenLynch
12,2022-02-04 20:01:59+00:00,1489690719820423175,"Proud the House passed the #AmericaCOMPETES Act today, a bold legislative package that makes transformational new investments in research, innovation and American manufacturing that will ensure that America can outcompete any nation in the world.",RepStephenLynch
13,2022-02-03 16:07:23+00:00,1489269293187579904,Yesterday I sent a letter to @PHMSA_DOT Deputy Admin. Tristan Brown requesting PHMSA immediately terminate the operation of the Weymouth Compressor Station. The Compressor Station clearly falls within the regulatory definition of “imminent hazard” &amp; necessitates emergency action. https://t.co/v6YksddvzO,RepStephenLynch
14,2022-01-26 23:06:05+00:00,1486475560989741058,Today I sent a letter to Chairman @RichGlickFERC  urging @FERC to immediately rescind the certificate of public convenience and necessity for the Weymouth Compressor Station. You can read my letter here: https://t.co/d4ND9cJiGs,RepStephenLynch
15,2022-01-21 20:23:47+00:00,1484622777386774529,2/2 Automatically enrolling veterans into VA healthcare will help prioritize suicide prevention efforts by increasing veterans’ access to high quality health services and ensuring they receive the support they need as they transition to civilian life.,RepStephenLynch
16,2022-01-21 20:23:47+00:00,1484622776145166338,"1/2 Proud the House passed H.R. 4673 yesterday, the EVEST Act, which would automatically enroll eligible veterans into @DeptVetAffairs healthcare services during the transition process and provide them the option to opt out if they so choose.",RepStephenLynch
17,2022-01-20 22:07:07+00:00,1484286391118880771,2/2 .. and outspoken in their opposition. The Chairman’s position also reflects the same arguments our Congressional delegation made during our efforts to stop the project. Hopefully this marks a turning point in the history of our efforts to decommission this harmful facility.,RepStephenLynch
18,2022-01-20 22:07:06+00:00,1484286389172768779,1/2 I'm greatly encouraged by Chairman Glick’s statement regarding the inadequacies &amp; errors that were made in the siting &amp; approval of the Weymouth Compressor Station. Chairman Glick reaffirmed the central complaints of local officials &amp; @FRRACS_MA  members who were steadfast... https://t.co/lM2vBrp9Vv,RepStephenLynch
19,2022-01-20 17:02:12+00:00,1484209657451368449,"The first round of bridge funding has been released to Massachusetts from the Bipartisan Infrastructure Law. 
There are almost 500 structurally deficient bridges across our state and the first round of $225.3M will allow us to finally start replacing and fixing our bridges. https://t.co/ECHSfX3csy",RepStephenLynch
20,2022-01-17 18:43:31+00:00,1483147992433635329,"2/2 As some state legislatures across our country attempt to rebuild obstructions to the ballot box, we must remember that his work is not finished. #MLKDay",RepStephenLynch
21,2022-01-17 18:43:31+00:00,1483147990361591809,"1/2 Our nation has set aside this day to remember and to celebrate the life and legacy of Rev Dr. Martin Luther King, Jr.  Dr. King’s peaceful but passionate pursuit of economic justice &amp; equal rights has inspired generations to fight to end discrimination &amp; expand civil rights. https://t.co/mizYxb6VE5",RepStephenLynch
22,2022-01-13 17:27:29+00:00,1481679307575635971,"FEMA will open the fiscal year (FY) 2021 Fire Prevention and Safety (FP&amp;S) Program application period on Tuesday, Jan 18, 2022 at 8am and accept applications through 5pm on Friday, Feb 18, 2022. You can find information on how to apply here: https://t.co/8uisaY5gYh",RepStephenLynch
23,2022-01-12 18:11:47+00:00,1481328068056784901,4/4 I would like to thank all of witnesses for speaking with me about how we could use zero trust architecture in order to remove the vulnerabilities that exist within our government and private sector software programs.,RepStephenLynch
24,2022-01-12 18:11:47+00:00,1481328067201146887,"3/4 .. which requires consistent verification to remove the risk of bad actors breaching our networks.  However, it will require a change in our technological lifestyle and pattern of behavior in order to properly adopt it.",RepStephenLynch
25,2022-01-12 18:11:47+00:00,1481328066316185602,"2/4 We have seen many sophisticated cyberattacks recently, such as the SolarWinds hack, that have shown there is a significant vulnerability in our software systems.  There are great benefits to implementing a zero trust architecture…",RepStephenLynch
26,2022-01-12 18:11:47+00:00,1481328064852283400,1/4 Yesterday the @OversightDems held a bipartisan hearing with cyber experts to discuss how we can strategically update the Federal Informational Security Management Act (FISMA) in order to strengthen our cybersecurity.,RepStephenLynch
27,2022-01-04 14:24:06+00:00,1478371663976841216,Learn more about BNPL services here: https://t.co/IQ5BlAZCtv,RepStephenLynch
28,2022-01-04 14:24:05+00:00,1478371662441730048,"Last month the Consumer Financial Protection Bureau issued orders inquiring into 5 “Buy Now, Pay Later” (BNPL) companies. I recently held a @FSCDems FinTech Task Force hearing that explored the benefits and risks of #BNPL such as late fees, accumulated debt and consumer data use.",RepStephenLynch
29,2022-01-01 21:33:26+00:00,1477392545713901577,"Margaret, our family and I offer our sincere best wishes to all for a safe and healthy and Happy New Year! https://t.co/25oTrWXflZ",RepStephenLynch
30,2021-12-09 13:47:42+00:00,1468940420944207873,I thank Christopher Landberg from the U.S. Department of State and Milancy Harris from the U.S. Department of Defense for their testimony to reassess and re-examine how best to maintain robust counter-terrorism capabilities. https://t.co/oe6kNdflYw,RepStephenLynch
31,2021-12-09 13:47:42+00:00,1468940419333566469,"As terrorist threats to the United States continue to evolve so must our counter-terrorism approach, which will require a whole-of-government approach that develops international partnerships and quick-strike capabilities. https://t.co/oe6kNdflYw",RepStephenLynch
32,2021-12-09 13:47:41+00:00,1468940417647484935,"This week as Chairman of the @OversightDems National Security Subcommittee, I held a hearing to examine the worldwide threat posed by al Qaeda, ISIS and other foreign terrorist organizations. https://t.co/oe6kNdflYw",RepStephenLynch
33,2021-12-08 19:44:08+00:00,1468667733533470725,3/3 I am proud to see the #NDAA would invest in what makes America strong - advancing our technological innovation to protect our homeland and guaranteeing the fair treatment and equal rights of every man or woman who agrees to serve in our nation’s military.,RepStephenLynch
34,2021-12-08 19:44:08+00:00,1468667732187127808,"2/3 .. and provide a $5.8 B increase in funding for defense-wide research and technology. Importantly, the bill reforms the Uniform Code of Military Justice to ensure sexual assault cases are investigated fairly and independently.",RepStephenLynch
35,2021-12-08 19:44:08+00:00,1468667730513608707,"1/3 Last night the House passed the FY22 National Defense Authorization Act, which will provide historic benefits for our service members and their families and strengthen our national security. The #NDAA would increase the pay and improve housing for U.S. service members...",RepStephenLynch
36,2021-12-08 00:53:57+00:00,1468383311265468416,2/2 .. and we remember with pride the response of the greatest generation who stepped forward to defend our nation at a moment when our democratic freedoms hung in the balance. Today we cherish their memory and are humbled by their example. #PearlHarbor,RepStephenLynch
37,2021-12-08 00:53:56+00:00,1468383309814239232,"1/2 80 years ago today our country was attacked without warning by the Empire of Japan at Pearl Harbor, where 2,403 service members and civilians lost their lives. Today we honor all the young lives that perished that day…",RepStephenLynch
38,2021-12-07 14:12:20+00:00,1468221845535182856,"3/3 My thanks to Town Moderator Bob Mullen for coordinating last night and offering me an opportunity to provide a brief congressional update on such a busy night. As always, I will be happy to do so at next Stoughton Town meeting.",RepStephenLynch
39,2021-12-07 14:12:20+00:00,1468221844599808006,2/3 The Town of Stoughton received over $2.5M in CARES Act funding and is set to receive another $2.85M from the American Rescue Plan – all critical funding to help Stoughton recover from the economic impacts of the pandemic.,RepStephenLynch
40,2021-12-07 14:12:20+00:00,1468221843249287171,"1/3 Great to join the Stoughton Town Meeting last evening, which was held virtually to protect the health and safety of all residents as we continue to battle the COVID-19 pandemic.",RepStephenLynch
41,2021-11-26 22:24:24+00:00,1464359411183497222,Enjoyed attending a high-scoring football game between B.C. High and Catholic Memorial yesterday. Congratulations to both teams and good luck to @CatholicMem after clinching a spot in the MIAA Division 2 state championship game that will be played at Gillette Stadium!,RepStephenLynch
42,2021-11-26 17:50:49+00:00,1464290559258939403,2/2 Great job to all the players for their sportsmanship in a very competitive game and congratulations to all the seniors on their last “big game”.,RepStephenLynch
43,2021-11-26 17:50:48+00:00,1464290557480550414,1/2 Stopped by the 89th Annual Thanksgiving Day Football Game between North Quincy HS and Quincy HS yesterday – always enjoy watching a great rivalry game with Mayor Tom Koch and Councilor Noel DiBona.,RepStephenLynch
44,2021-11-26 14:02:02+00:00,1464232984316452875,"2/2 .. a wonderful tradition and a heartfelt tribute to former longtime Whitman Girls Basketball Coach, Jim Daley - he will be missed.",RepStephenLynch
45,2021-11-26 14:02:01+00:00,1464232981812453376,1/2 Great way to kick off Thanksgiving Day yesterday at the Whitman-Hanson Regional vs. Abington High School football game. Great to see the huge turnout supporting both teams… https://t.co/eDHOEftZvJ,RepStephenLynch
46,2021-11-23 16:15:19+00:00,1463179363860549633,Great to join @WalterFTimilty and @Brady_Works at the East Bridgewater Town Meeting last night. My thanks to Town Moderator Bob Looney for allowing me to give a brief congressional update and congratulations to East Bridgewater’s new Town Administrator Charles Seelig. https://t.co/IidnqJJuee,RepStephenLynch
47,2021-11-18 22:06:23+00:00,1461455771133218816,"2/2 The Bay State will benefit greatly from the Infrastructure Investment and Jobs Act, which will provide $4.2B for our roads, $2.5B to modernize our public transportation, $1.1B for bridge replacements and repairs and $1B to improve our water infrastructure.",RepStephenLynch
48,2021-11-18 22:06:22+00:00,1461455769677742080,"1/2 In the past 10 years, commute times have increased almost 11% in Massachusetts, causing irreparable damage to our transportation systems and costing drivers approximately $620 per year in costs from driving on damaged roads.",RepStephenLynch
49,2021-11-18 01:12:03+00:00,1461140110620213248,2/2 .. regarding their physical and mental health care and this bill will ensure they receive the proper support and resources from maternity health care providers. This is a critical step to ensuring all of our veterans receive the healthcare they deserve.,RepStephenLynch
50,2021-11-18 01:12:03+00:00,1461140109353492480,"1/2 Proud the House passed S.796 last night, the Protecting Moms Who Served Act of 2021 which would require the VA to implement a maternity care coordination program for female veterans enrolled in the VA healthcare system. Pregnant and postpartum veterans have unique needs…",RepStephenLynch
51,2021-11-17 19:31:53+00:00,1461054502925213713,"4/4 .. Staff Sergeant Johnny Jones, USMC (ret), and Ms. Alyssa Hundrup of the GAO for your testimony and tremendous work on this important issue. https://t.co/KrP8gTiEyB",RepStephenLynch
52,2021-11-17 19:31:52+00:00,1461054501570453511,"3/4 I am grateful to Brigadier General Jack Hammond, U.S. Army (ret) who is the Executive Director of the Boston Red Sox/Mass. General Hospital Home Base program, Dr. Carla Stumpf-Patton of the TAPS program...",RepStephenLynch
53,2021-11-17 19:31:52+00:00,1461054500135911428,2/4 ... and last year active duty suicides reached the highest rate reported in the past 12 years. America has an obligation to every man and woman who served our country to take action to help prevent these tragedies from occurring.,RepStephenLynch
54,2021-11-17 19:31:52+00:00,1461054498588274694,"1/4 Today I held an @OversightDems National Security hearing to examine how we can put an end to the devastating suicide crisis inflicting our active service members and veterans. Over the last 20 years, the suicide rate among our nation’s veterans has risen by 57%...",RepStephenLynch
55,2021-11-17 17:12:46+00:00,1461019495070318599,3/3 It is important to protect the American taxpayer and our transportation and infrastructure workforce by ensuring projects have adequate payment and performance safeguards in place in the event of a contractor default.,RepStephenLynch
56,2021-11-17 17:12:46+00:00,1461019494021795844,2/3 These surety bonds act as a guarantee that construction workers will be paid for the work they perform on public-private transportation projects. Surety bonds also guarantee that contractors fulfill their obligations to state &amp; local taxpayers on projects funded by TIFIA.,RepStephenLynch
57,2021-11-17 17:12:46+00:00,1461019492654399509,"1/3 Happy to report my bipartisan Surety Bond amendment was included in the Infrastructure Investment &amp; Jobs Act, which will give American workers &amp; local taxpayers the protections they deserve when any contractor is hired to perform work to improve our nation’s infrastructure.",RepStephenLynch
58,2021-11-16 21:28:53+00:00,1460721561384755202,"2/2 This critical funding to the Commonwealth also includes $100M for statewide broadband coverage, $15.7M to prevent cyberattacks and $3.5B to help weatherize our infrastructure against the impacts of climate change.",RepStephenLynch
59,2021-11-16 21:28:53+00:00,1460721559753183241,"1/2 Massachusetts will receive approximately $12.5B from the Infrastructure Investment and Jobs Act to invest in our roads, bridges, ports, ferries, water and public transportation systems.",RepStephenLynch
60,2021-11-15 23:30:06+00:00,1460389675965820931,"2/2 It will also expand access to affordable housing, create millions of good paying jobs and advance environmental justice by investing in a clean energy economy. This is a win for all of America.",RepStephenLynch
61,2021-11-15 23:30:05+00:00,1460389674208440323,"1/2 Proud to join @POTUS at the White House today when he signed the momentous $1.2T Infrastructure Investment and Jobs Act into law, which will invest $550B in America’s roads, rail, ports, public transit, bridges and water infrastructure.",RepStephenLynch
62,2021-11-11 14:46:51+00:00,1458808446141218823,"Today, we the people of the United States have set aside this day to honor all our Veterans &amp; Gold Star families for their noble &amp; courageous service &amp; sacrifice. Your willingness to defend our freedoms &amp; all that we hold dear has won the hearts of a grateful nation. #VeteransDay https://t.co/CnwRMf82To",RepStephenLynch
63,2021-11-03 15:34:05+00:00,1455921229660053506,"With warmest regards, Margaret and I offer our sincere congratulations to Mayor-elect @wutrain on your historic victory! I look forward to working together to make your administration a resounding success for the families of Boston.",RepStephenLynch
64,2021-11-02 19:04:22+00:00,1455611760732430343,"2/2 However, these products raise important questions about the use of consumer financial data and the potential for creating unsustainable levels of consumer debt. I’m grateful for all of our members and our panel of witnesses who offered their perspectives and expertise today.",RepStephenLynch
65,2021-11-02 19:04:22+00:00,1455611759344197638,"1/2 Today as Chair of @FSCDems FinTech Task Force we held a hearing to examine “Buy Now, Pay Later” payment options and the potential risks they pose for consumers. These payment options offer consumers the opportunity to purchase a product and pay over time through installments.",RepStephenLynch
66,2021-10-29 18:15:46+00:00,1454149978176294919,"The FVPSA is the primary source of federal funding for domestic violence shelters in the country and this bill will ensure survivors, particularly in underserved communities, will have access to the resources they need.",RepStephenLynch
67,2021-10-29 18:15:45+00:00,1454149976699846662,"This week the House passed the bipartisan H.R. 2119, Family Violence Prevention and Services Improvement Act (FVPSA) to reauthorize this critical law that will enhance federal investments to address family violence.",RepStephenLynch
68,2021-10-19 18:53:02+00:00,1450535479049396225,"2/2 - which would include two new bridges over the Cape Cod Canal and improvements to the MBTA, rail and broadband services. https://t.co/T79NjKStnN",RepStephenLynch
69,2021-10-19 18:53:01+00:00,1450535476675465219,1/2 Last weekend I spoke with @kelleratlarge on @wbz about the importance of coming to an agreement on the transportation and infrastructure bill. This bill would have a great impact on the entire state of Massachusetts - https://t.co/T79NjKStnN,RepStephenLynch
70,2021-10-19 01:02:48+00:00,1450266144753979393,"Wonderful to attend Westwood Town Meeting this evening held safely outside for an enormous crowd – almost 600 people!  Great to see so many involved in local government. Well done to Town Moderator Jim O’Sullivan and nice to see my friend, Town Clerk Dottie Powers as well. https://t.co/qQr06TBB0X",RepStephenLynch
71,2021-10-18 23:26:16+00:00,1450241852230311938,"3/3 .. Mr. Powell was widely respected and admired for his expertise and counsel, and I am grateful for his service to our country.  My heartfelt condolences go out to the family and friends of Colin Powell.",RepStephenLynch
72,2021-10-18 23:26:16+00:00,1450241851236179974,"2/3 After he retired from the U.S. Army as a four-star general, he was hired as a White House national security adviser and then became the first Black Secretary of State. As a two time recipient of the Presidential Medal of Freedom…",RepStephenLynch
73,2021-10-18 23:26:15+00:00,1450241849759830025,"1/3 I am deeply saddened to hear of the passing of Colin Powell.  Colin Powell began his career in the U.S. Army as an advisor in the Vietnam War, and rose through the ranks to become the first Black man to serve as Chairman of the Joint Chiefs.",RepStephenLynch
74,2021-10-10 01:52:17+00:00,1447017107242340352,2/2 .. during very challenging periods of the war in Iraq. General Odierno was a fierce warrior on the side of democracy and his service has rightfully earned the tribute of a grateful nation. He and his family and the men and women who served under his command are in my prayers.,RepStephenLynch
75,2021-10-10 01:52:16+00:00,1447017105837146113,"1/2 Deeply saddened to learn of the passing of General Ray Odierno, USA. General Odierno served his country in the highest tradition of the United States military. That service included his close cooperation and transparency with the Oversight function of Congress…",RepStephenLynch
76,2021-10-04 18:52:54+00:00,1445099627192143876,My thanks to USCG Rear Admiral Tom Allan for listening to our concerns and putting the safety of our south shore communities above all else.,RepStephenLynch
77,2021-10-04 18:52:53+00:00,1445099624646291461,"Very pleased to hear @USCG officially announce they will continue operations at Station Scituate. Thanks to Scituate Town Admin. Jim Boudreau &amp; all my colleagues in government at federal, state &amp; local levels for your support &amp; hard work to ensure Station Scituate remained open. https://t.co/hcGAV8Dml3",RepStephenLynch
78,2021-09-29 00:24:05+00:00,1443008644212273159,"2/2 Although, for the twentieth straight year my Deed was not selected for the Annual Cow plop - but I’ll be back next year. All for a good cause!",RepStephenLynch
79,2021-09-29 00:24:04+00:00,1443008640617750535,"1/2 We had spectacular weather for Dedham Day on Sunday. Thanks to Clerk Paul Munchbach, his wife Tonya, and JuJu Mucciaccio for their wonderful hospitality. https://t.co/e5c4TWgiPQ",RepStephenLynch
80,2021-09-28 16:20:30+00:00,1442886948092190724,"2/2 Congratulations to Quinn Waters, the brave “Mighty Quinn”, for serving as this year’s grand marshal of the parade! https://t.co/qK41Qa3pWc",RepStephenLynch
81,2021-09-28 16:20:26+00:00,1442886932745252868,1/2 Great time at Weymouth’s 2nd Irish Heritage Day Parade and Festival on Sunday. Weymouth has one of the largest Irish American populations and this event is a great way for everyone to learn about Irish history while having fun. https://t.co/aGTfyJlfsY,RepStephenLynch
82,2021-09-28 01:31:10+00:00,1442663140060286976,"Wonderful time at Hull’s 16th Endless Summer event over the weekend to celebrate the community of Hull with music, food &amp; fun. Thanks to Hull Board Chair Jen Constable &amp; my friend Craig “Wolfie” for your hospitality &amp; thanks to the Hull Nantasket Chamber of Commerce for hosting! https://t.co/KZ3wbfFWCU",RepStephenLynch
83,2021-09-27 13:51:45+00:00,1442487125451186177,"Great to attend the 9th celebration of Westwood Day on Saturday and enjoy the food, activities and entertainment to help support the community of Westwood. Thanks to my friends, Rep. Paul McMurtry and Westwood Town Clerk Dottie Powers, for joining me! https://t.co/7bBBCUIGb0",RepStephenLynch
84,2021-09-24 21:36:21+00:00,1441516881970618368,2/2 .. improve the efficacy of sanctions to thwart bad actors and strengthen our nation’s ability to combat illicit financing networks.,RepStephenLynch
85,2021-09-24 21:36:21+00:00,1441516880565444614,"1/2 Pleased to see the House passed #NDAA included 3 of my amendments, which will collectively increase transparency and oversight of America’s contracting and reconstruction efforts overseas…",RepStephenLynch
