,Datetime,Tweet Id,Text,Username
174,2021-05-30 20:14:57+00:00,1399097017821978630,"1/2 Honored to join my friends Tom McCarthy, Fitzgerald Post 561, Marty Martinez, Boston Veterans Commissioner Robert Santiago, @david_biele &amp; @EdforBoston at the South Boston Memorial Day ceremonies to express our gratitude for all the heroic patriots... https://t.co/qezAUNH8Zo",RepStephenLynch
175,2021-05-28 21:07:05+00:00,1398385360971964416,It is important we all take time this #MemorialDayWeekend to express our gratitude to Gold Star families for their service and sacrifice.,RepStephenLynch
176,2021-05-28 21:07:05+00:00,1398385359931809792,"My sincere thanks to Dan Magoon, Greg Kelly and Edzo Kelly IAFF for adding 17 names to the MFH Memorial this year, including Sgt. Elder Fernandes, USA, a true American patriot and favorite son of Brockton, Massachusetts.",RepStephenLynch
177,2021-05-28 21:07:04+00:00,1398385357285113859,Honored to join @MassGovernor at a heartfelt and dignified ceremony this morning at the 5th annual rededication of the Mass Fallen Heroes Memorial in South Boston to pay tribute to the Commonwealth’s brave service men and women who gave their lives for our nation. https://t.co/iI92lkFgNy,RepStephenLynch
178,2021-05-28 02:13:35+00:00,1398100106117894147,"2/2 This funding will help Quincy College address the needs of the students, faculty and campus, and I am grateful to work alongside such dedicated leaders in local government.",RepStephenLynch
179,2021-05-28 02:13:34+00:00,1398100102544347136,"1/2 Great to join my friend @CityofQuincy Mayor Tom Koch, @QuincyCollege President Dr. Richard DeCristofaro, Rep. @TackeyChan, Council President @Nina_Liang and Councilor David McCarthy to announce the award of over $10.6M to Quincy College from the American Rescue Plan. https://t.co/VpYjHo0CWG",RepStephenLynch
180,2021-05-25 21:15:32+00:00,1397300323740536835,"3/3 .. and require these electric vehicles and components be manufactured in the USA. I’d like to thank my colleagues and original co-sponsors @OversightDems Chairwoman @RepMaloney, @GerryConnolly and @RepLawrence for their support of this bill.",RepStephenLynch
181,2021-05-25 21:15:31+00:00,1397300321752342535,"2/3 This will dramatically reduce the USPS carbon footprint to the great benefit of the health, safety and sustainability of our communities across the country. My bill would also provide funding for the construction of their charging infrastructure...",RepStephenLynch
182,2021-05-25 21:15:31+00:00,1397300320066281478,"1/3 Today I introduced the Postal Service Electric Fleet Authorization Act of 2021 which would authorize $8B for the US Postal Service to convert their diesel postal trucks to a modern, electric fleet &amp; require the Postal Service to acquire only zero-emission vehicles after 2030.",RepStephenLynch
183,2021-05-25 02:11:31+00:00,1397012423291326465,Great turnout at Abington Town Meeting! Pleased to see everyone wearing masks &amp; observing safety protocols. My thanks to Town Moderator Shawn Reilly for allowing me to give a congressional update about the COVID-19 funding Abington has received &amp; the upcoming transportation bill. https://t.co/Wodh2GwK4I,RepStephenLynch
184,2021-05-25 00:10:12+00:00,1396981891585224710,"2/2 Well done to Town Moderator Dan Evans and thanks to members of Town Meeting, participation in local government is the essence of our democracy.",RepStephenLynch
185,2021-05-25 00:10:11+00:00,1396981888653332483,"1/2 A beautiful evening to attend the “drive-in” styled Cohasset Town Meeting, thoughtfully arranged for everyone’s safety and comfort as we continue to navigate the end of the pandemic. https://t.co/2Vw7X09cKb",RepStephenLynch
186,2021-05-21 23:40:39+00:00,1395887292665974790,3/3 The findings of this commission will give the American people the truth about what happened and will ensure this type of shameful attack upon American democracy does not happen ever again.,RepStephenLynch
187,2021-05-21 23:40:39+00:00,1395887291231506433,"2/3 This bill will create a 10-person, bipartisan commission that will investigate and report on the causes and influencing factors behind the January 6th attack on our Capitol.",RepStephenLynch
188,2021-05-21 23:40:38+00:00,1395887289528725504,"1/3 Proud to pass the bipartisan H.R. 3233, the National Commission to Investigate the January 6th Attack on the United States Capitol Complex Act. While hundreds of criminal prosecutions are underway, there are many unanswered questions about what occurred that day.",RepStephenLynch
189,2021-05-21 14:31:19+00:00,1395749049391886338,This week the House passed H.Res.275 to condemn the horrific shootings that occurred at 3 Asian-owned spas in Georgia and honor the 8 innocent people that lost their lives that day. This resolution shows our commitment to #EndGunViolence and #StopAsianHate,RepStephenLynch
190,2021-05-20 19:42:39+00:00,1395465011477336069,4/4 We thank U.S. Special Representative for Afghanistan Reconciliation Zalmay Khalilzad for testifying today and discussing how we can ensure that safeguards are in place to facilitate a peaceful transition of power to the Afghan government.,RepStephenLynch
191,2021-05-20 19:42:39+00:00,1395465009778630656,3/4 I am encouraged that the Biden administration has made it clear that the U.S. will continue to provide vital civilian and humanitarian assistance to the Afghan people.,RepStephenLynch
192,2021-05-20 19:42:39+00:00,1395465007865995270,"2/4 While I certainly share the desire to end America’s longest war, this landmark decision will have wider consequences for our national security and the stability of the region.",RepStephenLynch
193,2021-05-20 19:42:38+00:00,1395465005320089601,1/4 This morning my @OversightDems National Security Subcommittee held a hearing to examine President Biden’s plan to withdraw all remaining U.S. military forces from Afghanistan by September. https://t.co/8EtQkgNyGp,RepStephenLynch
194,2021-05-19 01:02:25+00:00,1394820707566116866,Capital markets rely on investor confidence and the #StopInsiderTrading act will help ensure our markets remain fair.,RepStephenLynch
195,2021-05-19 01:02:25+00:00,1394820705833861124,"As a member of @FSCDems I am very pleased to see H.R. 2655, the Insider Trading Prohibition Act pass the House today, which would make it illegal for a person to trade while aware of material, non-public information and prohibits passing along that information to others.",RepStephenLynch
196,2021-05-18 22:55:18+00:00,1394788715256500225,"2/2 This important legislation will help combat the growing crisis of anti-AAPI discrimination, violence and bigotry that has drastically increased throughout the COVID-19 pandemic and I look forward to seeing President Biden sign it into law.",RepStephenLynch
197,2021-05-18 22:55:18+00:00,1394788714094661641,"1/2 Proud to see the House pass S. 937, the COVID-19 Hates Crimes Act, which will target those who commit hate crimes against members of our Asian American and Pacific Islander (AAPI) communities.",RepStephenLynch
198,2021-05-17 18:21:03+00:00,1394357309384626180,"I am deeply saddened by the tragic loss of Rafael Andrande, 13, and Tiago Depina, 12, cousins from Brockton. My thoughts and prayers are with their families and the City of Brockton in this hour of grief.",RepStephenLynch
199,2021-05-15 16:37:03+00:00,1393606363088105474,3/3 My amendment also requires that these electric vehicles and components be manufactured in the USA.,RepStephenLynch
200,2021-05-15 16:37:03+00:00,1393606362135924741,"2/3 As we move to calling for the procurement of clean and zero-emission vehicles for federal, state, local and tribal fleets, my amendment in the Postal Service Improvement Act provides the USPS with $8B to comply with these new guidelines.",RepStephenLynch
201,2021-05-15 16:37:03+00:00,1393606360844185603,1/3 The U.S. Postal Service operates roughly 1/3 of the entire vehicle fleet owned by the federal government and they are widely recognized as “gas guzzler” mail trucks that have grown increasingly unsafe due to their lack of modern safety features.,RepStephenLynch
202,2021-05-15 15:47:55+00:00,1393593996010733574,"3/3 .. which will dramatically reduce the USPS carbon footprint to the great benefit of the health, safety and sustainability of our communities across the country.",RepStephenLynch
203,2021-05-15 15:47:54+00:00,1393593994752442368,2/3 .. and provide funding for the constructions of their charging infrastructure. My amendment would also require the Postal Service to acquire only electric or zero-emission vehicles after 2030...,RepStephenLynch
204,2021-05-15 15:47:54+00:00,1393593993183862788,1/3 I am pleased to report the Postal Service Improvement Act included my amendment that would authorize $8B for the U.S. Postal Service to convert their diesel and gas guzzling postal trucks to a modern electric fleet of postal vehicles...,RepStephenLynch
205,2021-05-15 14:51:44+00:00,1393579857146257409,3/3 The Postal Service Reform Act would repeal the requirement for the Postal Service to pre-fund retiree health benefits and will integrate those plans with Medicare to ensure our postal workers receive the Medicare benefits they have earned.,RepStephenLynch
206,2021-05-15 14:51:43+00:00,1393579856101838852,2/3 The USPS’s financial condition has been deteriorating over the past decade and the provisions in this bill are critical to helping the Postal Service remain financially stable.,RepStephenLynch
207,2021-05-15 14:51:43+00:00,1393579855107829767,"1/3 This week the @OversightDems passed H.R. 3076, the bipartisan Postal Service Reform Act, which will strengthen the financial viability of the United States Postal Service.",RepStephenLynch
208,2021-05-13 17:54:26+00:00,1392901062420582407,"2/2 This $250,000 grant will be used to decontaminate the Corcoran Supply site in downtown Brockton which will promote economic development &amp; lead to new workforce &amp; affordable housing. I look forward to seeing the positive impact this funding will have on families of Brockton.",RepStephenLynch
209,2021-05-13 17:54:26+00:00,1392901061179056129,"1/2 Great to join @CityBrockton Mayor Bob Sullivan, EPA New England Administrator Deb Szaro, Mass DEP Officials Stephanie Cooper and Doug Gutro to announce an important @EPA Brownfields Cleanup grant to Brockton.",RepStephenLynch
210,2021-05-10 15:19:03+00:00,1391774796128608264,"2/2 My thanks to Town Moderator Michael Puzo, Bob Curley, Al Chambers, Veterans Agent Keith Jermyn and all members of town meeting for your involvement in local government and dedication to your community.",RepStephenLynch
211,2021-05-10 15:19:03+00:00,1391774793981124615,"1/2 Happy to attend Hingham Town Meeting over the weekend, which was held safely outside at the Hingham High School athletic field on a beautiful day. https://t.co/SmehyNGyUY",RepStephenLynch
212,2021-05-10 00:01:13+00:00,1391543813156577288,Wishing all Moms a restful and enjoyable Mother’s Day. Lord knows you have earned it. We are grateful. #HappyMothersDay,RepStephenLynch
213,2021-05-08 20:16:56+00:00,1391124982638563336,"2/2 Also grateful to Town Manager Phil Lemnios, John Struzziery, Senator O’Connor and Rep. Meschino for their local support in our efforts to obtain federal funds for the Hull Pump House project.",RepStephenLynch
214,2021-05-08 20:16:55+00:00,1391124979958358018,1/2 Excellent turnout at @TownofHullMA Town Meeting today. My thanks to Town Moderator George Boylen for allowing me to address town meeting and discuss the American Rescue Plan funding and CARES Act funding for the Town of Hull. https://t.co/dVYcBJVazl,RepStephenLynch
215,2021-05-07 14:47:57+00:00,1390679802391191553,2/2 .. the American Rescue Plan and the upcoming Transportation and Infrastructure bill. New England town meeting is an essential part of our democracy.,RepStephenLynch
216,2021-05-07 14:47:56+00:00,1390679800646352896,1/2 Great to attend the safe and socially-distanced Avon Town Meeting earlier this week. My thanks to Town Moderator Frank Staffier for allowing me to give a congressional update regarding the direct funding to the Town of Avon from the CARES Act... https://t.co/J0NvDcioGz,RepStephenLynch
217,2021-05-07 02:22:01+00:00,1390492083996217344,5/5 My thanks to Chairman @RepMarkTakano and Veterans Committee members for allowing me to participate in this important hearing and for your steadfast support of our veterans and my bill.,RepStephenLynch
218,2021-05-07 02:22:01+00:00,1390492082230411264,"4/5 The K2 Veterans Care Act would establish a presumption of service connection and require the VA to provide hospital care, medical services and benefits for our K2 veterans and their families.",RepStephenLynch
219,2021-05-07 02:22:00+00:00,1390492080301039617,"3/5 .. making them susceptible to severe health disorders including rare forms of cancer. Despite this evidence, the VA has not yet acknowledged the connection between the toxic hazards and the life threatening illnesses among K2 veterans today.",RepStephenLynch
220,2021-05-07 02:22:00+00:00,1390492078795329537,"2/5 .. Uzbekistan, to provide support to our U.S. mission in Afghanistan after the 9/11 attacks. Documents released by my @OversightDems Subcommittee on National Security proved that U.S. service members who deployed to K2 were exposed to toxic chemicals and hazards...",RepStephenLynch
221,2021-05-07 02:21:59+00:00,1390492077084090373,"1/5 Yesterday I testified before the House Veterans Affairs Committee @VetAffairsDems regarding my bill, H.R.1355, the K2 Veterans Care Act. Between 2001 and 2005, more than 15,000 American service members deployed to Karshi Khanabad (K2), a former Soviet air base in southern...",RepStephenLynch
222,2021-05-04 17:43:39+00:00,1389636858267807746,"2/2 And huge thanks to Town Engineering Director, Marc Tisdelle, for his assistance in our efforts to get federal transportation and infrastructure funding for Stoughton. Well done to all the residents who participated.",RepStephenLynch
223,2021-05-04 17:43:39+00:00,1389636856908849154,"1/2 My thanks to Stoughton Town Moderator Bob Mullen for allowing me to address Stoughton Town Meeting virtually last evening. Kudos to Jeanne Fleming, John Roch and Scott Carrara on receiving Congressional awards for their public service.",RepStephenLynch
224,2021-05-04 12:45:03+00:00,1389561709585633285,2/2 The hard work of both of these capable women and their devotion to the community has had a tremendous impact on the Town of Westwood. My thanks to Town Moderator Jim O’Sullivan and members of Town Meeting for your courtesy and your involvement in local government.,RepStephenLynch
225,2021-05-04 12:45:02+00:00,1389561706100281344,"1/2 Enjoyed attending Westwood Town Meeting last night, which was held safely outside at the high school’s athletic field. Congratulations to Barbara Delisle for receiving the prestigious John J. Cronin Public Service Award and to Nancy Hyde who was sworn in as Town Assessor. https://t.co/QfKnD3P646",RepStephenLynch
226,2021-05-04 00:13:55+00:00,1389372682718912512,The $28.6B Restaurant Revitalization Fund from the #ARP is now accepting applications from restaurants to receive funding – visit https://t.co/XFAsT4K6TG to register today. If you have any difficulty please contact our office and we will try to assist you through this process.,RepStephenLynch
227,2021-04-30 01:40:45+00:00,1387944981655130120,"My thanks to CEO Bill Halpin, Chief Medical Officer Dr. Nisha Thakrar, Jocelyn Guggenheim, Director of Clinical Ops., Andrea Smith, Nursing Director, and all the hardworking doctors, nurses and staff who have been on the frontlines of the pandemic since the very beginning. https://t.co/yT7nJ6Qci6",RepStephenLynch
228,2021-04-30 01:40:23+00:00,1387944892517715971,"Great to visit the @SBHealthCenter today with @david_biele and Councilors @mfflaherty &amp; @EdforBoston to tour the site. The SBCHC has administered almost 20,000 vaccines &amp; has led local efforts to test, treat &amp; provide contract tracing for COVID-19, undoubtedly saving many lives. https://t.co/A61fUmog6n",RepStephenLynch
229,2021-04-24 21:18:12+00:00,1386066973252009985,"Stopped by the Vax site at Ironworkers Local 7 in South Boston today! A huge thank you to Mayor @Kim_Janey, the Boston Health Reserve and all my brother and sister Ironworkers for helping to end this pandemic. https://t.co/fbCezWMI6V",RepStephenLynch
230,2021-04-21 20:29:01+00:00,1384967429504311306,4/4 I thank @FSCDems Chairwoman Waters for her steadfast support of this important body as we work to improve the use and quality of these FinTech services.,RepStephenLynch
231,2021-04-21 20:29:01+00:00,1384967428564819969,3/4 This task force will continue to examine the opportunities and challenges posed by these technologies and offer insight into how Congress can help ensure Americans’ data and privacy is secure.,RepStephenLynch
232,2021-04-21 20:29:00+00:00,1384967427734315010,"2/4 Throughout the COVID-19 pandemic we have seen an increased reliance on FinTech applications for lending, payments and money management and these technologies require our full attention to ensure consumer protections are up to par.",RepStephenLynch
233,2021-04-21 20:29:00+00:00,1384967426765381641,1/4 I am grateful to have the opportunity to lead the @FSCDems Task Force on Financial Technology once again and I look forward to building on the bipartisan efforts conducted in the past two years.,RepStephenLynch
234,2021-04-20 23:41:03+00:00,1384653370837938182,I am grateful that the legal process has followed its course and that a jury has determined that Minneapolis police officer Derek Chauvin is guilty of the murder of George Floyd. My full statement on the verdict is below: https://t.co/D2vHH7Dyik,RepStephenLynch
235,2021-04-13 00:14:45+00:00,1381762749051645959,2/2 .. about the American Rescue Plan and the importance of including funding for climate resilient sea walls and efficient water systems in the upcoming Transportation and Infrastructure bill.,RepStephenLynch
236,2021-04-13 00:14:45+00:00,1381762746342064128,1/2 Great to join @RepKearney at the well-attended and socially-distanced Scituate Town Meeting this evening. My thanks to Town Moderator Jim Toomey for allowing me to give a brief Congressional update... https://t.co/lIhDSxkCb1,RepStephenLynch
237,2021-04-11 13:55:29+00:00,1381244516204691458,"My thanks to Mayor Tom Koch, Rep. @tackeychan, @MassAGO, DA Mike Morrissey, @SenJohnFKeenan and Councilor @NoelDiBona for speaking out against these atrocious acts. Always proud to represent Quincy.",RepStephenLynch
238,2021-04-11 13:55:29+00:00,1381244514644459528,"As Atty. Grace Lee pointed out, while there has been an alarming increase in hate crimes against Asian Americans and Pacific Islanders across our country, there is no place for hate in Quincy.",RepStephenLynch
239,2021-04-11 13:55:28+00:00,1381244510961811460,Great to see the huge turnout yesterday at the “Fight Anti-Asian Hate” rally in @CityofQuincy to show support for our AAPI community. https://t.co/GxQcu8heVF,RepStephenLynch
240,2021-04-11 02:47:45+00:00,1381076476146122752,Hearty congratulations to UMass Men’s Hockey Team on winning the NCAA Div. 1 “Frozen Four” National Hockey Championship tonight! Defeating St. Cloud State 5-0. A first in UMass history! Amazing! A hard-fought and well-deserved victory! You make Massachusetts proud!,RepStephenLynch
241,2021-04-08 18:02:03+00:00,1380219403220963328,"I am grateful for all the hard working doctors, nurses and staff at our community health centers and public health programs who have been heroic during this pandemic and help make healthy living more accessible for everyone. #CDWeek2021",RepStephenLynch
242,2021-04-08 18:02:03+00:00,1380219401887178754,Thanks to Mayor Tom Koch @CityofQuincy will be allocating CDBG program funding from the CARES Act to construct an urgent care and radiology suite at the North Quincy @Manet_CHC site.,RepStephenLynch
243,2021-04-08 18:02:02+00:00,1380219399316115456,"Great to join @CityofQuincy Mayor Tom Koch, Quincy Planning Director James Fatseas and Manet CEO Cynthia Sierra to tour @Manet_CHC today in honor of National Public Health Week. #CDWeek2021 #NPHW https://t.co/etal58K4Oc",RepStephenLynch
244,2021-04-07 17:21:46+00:00,1379846877949140994,"The VA New England Healthcare System is now offering COVID-19 vaccines to all veterans, their spouses and caregivers – those who are eligible can sign up here: https://t.co/12P2qT8dNo",RepStephenLynch
245,2021-04-07 12:58:05+00:00,1379780520033333249,"Very saddened to learn of the passing of my colleague yesterday, Rep. Alcee Hastings, who proudly served the people of South Florida for almost 30 years. My thoughts are with his wife Patricia and the entire Hastings family during this difficult time.",RepStephenLynch
246,2021-04-02 23:18:07+00:00,1378124614472232960,2/2 I remain grateful for the courageous service of all of our law enforcement personnel. I offer my prayers and support to the Evans family and to our Capitol Police families and I pray for a full recovery for the officers injured by this attack.,RepStephenLynch
247,2021-04-02 23:18:06+00:00,1378124613050306569,"1/2 I am deeply saddened to learn of the death of Capitol Police Officer, William Evans, who was killed in the line of duty today while defending the US Capitol from another attack.",RepStephenLynch
248,2021-03-31 15:47:53+00:00,1377286534701875200,"2/2 I am proud that these masks are made in West Bridgewater and I thank Joe Fallon, Jim Weiner and all the hard working local employees from the Brockton area for providing the American people with high quality PPE as we continue to battle the COVID-19 pandemic. https://t.co/zVrheBd91i",RepStephenLynch
249,2021-03-31 15:46:58+00:00,1377286304388411393,1/2 Pleased to join @SenMarkey earlier this week for a tour of the Shawmut Advanced Materials facility that now manufactures N-95 masks. https://t.co/ebXN8eUnKM,RepStephenLynch
250,2021-03-30 23:45:12+00:00,1377044269941334016,My thanks to CEO Jim Brett for coordinating this informative virtual event with all your members.,RepStephenLynch
