,Datetime,Tweet Id,Text,Username
237,2022-01-05 19:05:47+00:00,1478804940801908736,"HAPPENING NOW: I’m holding a press conference with @AsmAguiarCurry on the investments coming to Napa County to improve access to high-speed internet from the bipartisan infrastructure law.

Tune in on my Facebook page: https://t.co/p8SmbGYion",RepThompson
238,2022-01-05 16:30:00+00:00,1478765737913118720,"The Infrastructure Investment and Jobs Act is delivering the largest federal investment in high-speed and quality internet in our nation’s history.
 
Today at 11am, I’ll be in Napa with @AsmAguiarCurry to discuss how Napa County is benefiting from these historic investments.",RepThompson
239,2022-01-04 23:45:00+00:00,1478512819515518976,"The Infrastructure Investment and Jobs Act is going to create millions of good-paying jobs, fix our roads &amp; bridges, improve access to public transit, and make life better for every Californian. This is an historic piece of legislation &amp; I was proud to play a part in passing it.",RepThompson
240,2022-01-04 20:30:00+00:00,1478463745886195713,"We owe our healthcare workers a debt that can never truly be repaid — especially as they are on the frontlines of another #COVID19 surge.
 
Help to support our healthcare heroes by getting the vaccine. It's quick, easy, and effective. https://t.co/eXyArULZNd",RepThompson
241,2022-01-04 16:00:01+00:00,1478395805593751555,"As we near the one-year anniversary of the January 6 insurrection, we must commit to safeguarding our democracy for generations to come.
 
A free and fair election is the foundation of our democracy — we must do everything we can to pass voting rights NOW.",RepThompson
242,2022-01-04 02:34:41+00:00,1478193135998185472,"Today, @TheJusticeDept announced it is strengthening a rule designed to encourage the use of secure gun storage or safety devices.
 
Last month, I led a letter to @usedgov to raise awareness about secure gun storage &amp; the need to get this information into the hands of parents.",RepThompson
243,2022-01-04 02:00:00+00:00,1478184405793341441,"In the new year, one of my top priorities is to crush the COVID-19 pandemic — and the best way to do that is to get as many vaccines in arms as possible.
 
Do your part to protect our communities and get vaccinated. Learn more below. https://t.co/0aHc4M4Qvn",RepThompson
244,2022-01-03 23:00:00+00:00,1478139107494621186,"Congratulations to Rich Freedman on his retirement after 27 years with the @vjotimesherald. His work is a clear example of the passion he has for the Vallejo community.
 
I wish him luck &amp; hope that retirement is filled with joy, happiness, and relaxation.
https://t.co/MZ6WpylbgY",RepThompson
245,2022-01-03 20:30:09+00:00,1478101396633366532,"Excellent news! The FDA just authorized #COVID19 boosters for kids ages 12-15 who are five months after their 2nd dose.
 
This will further our recovery efforts and help children stay safe in school.
https://t.co/0lPztHfU07",RepThompson
246,2022-01-03 16:05:06+00:00,1478034696588124168,"My thoughts &amp; prayers are going out to the family and friends of Kate Ellen Gerrity Sater. I was honored to know &amp; work with Kate. She was part of my first campaign &amp; was smart, dedicated, a dear friend &amp; cared deeply about our country &amp; community.

May her memory be a blessing.",RepThompson
247,2022-01-02 20:00:00+00:00,1477731420781129734,"Thanks to the Infrastructure Investment &amp; Jobs Act, CA will get at least $100 million for broadband, at a time when more than 545,000 people in CA can’t access the internet. This funding will increase people’s access to telehealth, online learning &amp; more. https://t.co/YEw1kqMJHH",RepThompson
248,2022-01-02 19:50:59+00:00,1477729154216996870,"Have you or your family been affected by surprise medical bills?

Starting January 1, the No Surprises Act went into effect to ban most unexpected medical charges. I was proud to vote for this bill to protect patients from financial burden.

Learn more: https://t.co/POPREH4Are",RepThompson
249,2022-01-02 15:00:00+00:00,1477655925183897601,"As Congress returns to DC for legislative business, we must continue to work to pass the #BuildBackBetter Act. This bill will cut taxes for the middle class, make healthcare and childcare more affordable, and take bold action to tackle climate change, which includes my GREEN Act.",RepThompson
250,2022-01-01 16:00:01+00:00,1477308641430708224,"Once again, it's time for New Year's Resolutions! This year, my resolution is to continue working with my colleagues to pass the #BuildBackBetter Act and work to make sure criminals and the dangerously mentally ill don't get their hands on guns. What's your resolution for 2022?",RepThompson
