,Datetime,Tweet Id,Text,Username
160,2022-01-21 22:32:27+00:00,1484655157275238403,"HEADS UP: The National Weather Service issued a high wind warning for most of the Bay Area.
 
Gusts are expected through tomorrow morning with speeds of up to 70 mph. Be on the lookout for downed branches and loose objects.
 
https://t.co/TJDaBCNH1X https://t.co/xWR59uajvz",RepThompson
161,2022-01-21 19:45:04+00:00,1484613031728455680,"The US is the greatest democracy in the world — but we have work to do to ensure voting is easy &amp; accessible to every eligible American.

By getting dark money out of politics, promoting free &amp; fair elections, and making voting easy, we can continue to be a beacon for democracy.",RepThompson
162,2022-01-21 16:05:04+00:00,1484557667867713540,"This research from @Everytown makes it clear that strong gun laws reduce gun violence.

As chair of the Gun Violence Prevention Task Force, I’m committed to finding pragmatic solutions to reduce gun violence and keep our communities safe. Read more ⬇

https://t.co/kcUYY59kxn",RepThompson
163,2022-01-21 01:30:00+00:00,1484337449094594560,"Our communities know all too well the damage and trauma that wildfires leave behind — but no one should be unable to insure their home solely because of the threat of wildfires.
 
Climate action is critical to keep our communities and homes safe.
 
https://t.co/jlssAywMHM",RepThompson
164,2022-01-20 21:32:00+00:00,1484277554953478150,"Across our country, an overwhelmingly majority of Americans support the reforms in the Freedom to Vote: John R. Lewis Act. 
 
There is too much at stake not to take on voting rights — voting should not be made more difficult.
https://t.co/MzdBUWEaXq",RepThompson
165,2022-01-20 20:15:00+00:00,1484258177332002818,"COVID-19 testing is essential to reduce the spread of the virus &amp; protect our communities.
 
I wrote a letter to @HHSGov calling for Medicare beneficiaries be allowed to access at-home rapid tests for free. To protect our seniors, we must ensure easy &amp; accessible testing for all.",RepThompson
166,2022-01-20 18:20:00+00:00,1484229236458078208,"This week, @forestservice announced $3 billion from the Infrastructure Investment and Jobs Act to combat wildfires on 20 million acres of land in the West.
 
As nearly 25% of the US is at moderate to high risk for wildfires, this funding will help keep our communities safe.",RepThompson
167,2022-01-20 17:05:00+00:00,1484210362413158407,"Climate change is not a far-off possibility — it’s a stark reality that we must address.
 
CA has been devastated by wildfires, floods, and drought because of more drastic weather patterns. The time for climate action is now — we cannot afford to wait.
 
https://t.co/qZK53kFcDw",RepThompson
168,2022-01-20 15:19:14+00:00,1484183747452833793,"1 year since @POTUS took office, here’s some of what we’ve accomplished:
 
✅6.4 million jobs created
✅Largest investment in clean water &amp; climate resilience
✅Unemployment at 3.9%
✅Expanded access to health care
✅Most diverse administration in history
 
I’m ready for year 2.",RepThompson
169,2022-01-20 03:05:00+00:00,1483998969411764228,"Heads up, the 2022 tax season is approaching! If you received #ChildTaxCredit payments from the American Rescue Plan last year, be on the lookout for filing info letters from the IRS.

Reminder: 2022 tax season starts January 24 &amp; ends April 18.
https://t.co/A0T8fXM6V6",RepThompson
170,2022-01-20 00:20:00+00:00,1483957445567283200,"REMINDER: Every household in the country can now order 4 #COVID19 tests free of charge from https://t.co/2zh8QcUrKC.

It takes less than 5 minutes and they’ll be delivered straight to your house. Don’t miss out — order now!",RepThompson
171,2022-01-19 21:35:00+00:00,1483915922284945409,"Tremendous news! @POTUS is announcing that 400 million N95 masks are going to be available to people across the country free of charge.

Masks keep you, your loved ones, and all you come into contact with safe as we continue to work to crush this virus.
https://t.co/1HbDll6TDF",RepThompson
172,2022-01-19 19:26:28+00:00,1483883576542339078,"Here’s just a few things the House has delivered that are waiting on action in the Senate:
 
🇺🇸Voting rights
🛑 Gun violence prevention
☀️ Climate action
🏳️‍🌈 LGBTQ+ rights
🏥 Reproductive rights
 
It’s time for the Senate to act and pass these bills.",RepThompson
173,2022-01-18 23:15:00+00:00,1483578700113190912,"Social Security is a vital program that Americans pay into their entire lives &amp; depend on to retire with dignity.

Protecting it is simply the right thing to do — I’m ready to strengthen Social Security, increase benefits, and ensure everyone gets the support they deserve.",RepThompson
174,2022-01-18 19:33:00+00:00,1483522831619088387,"TODAY: You can now order 4 tests per household free of charge online at https://t.co/d0f2PsnYwA.

As we continue to fight #COVID19, we must have a robust testing program to ensure everyone who needs a test can get a test, and I'll keep pushing for expanded testing.",RepThompson
175,2022-01-18 16:45:00+00:00,1483480552963510277,"If we’re to truly honor the legacy of Dr. Martin Luther King Jr., we must pass voting rights and protect this most sacred tool for generations to come.

We can’t stall progress because of antiquated Senate rules, it’s time to send voting rights legislation to @POTUS.",RepThompson
176,2022-01-18 01:15:00+00:00,1483246510846316547,"If you contract #COVID19, you should contact your health care provider before going to the hospital UNLESS you have severe symptoms.
 
As hospitals continue to feel the stress of the pandemic, we must ensure people with severe cases can receive the care they deserve.",RepThompson
177,2022-01-17 21:05:00+00:00,1483183596542304261,"The Infrastructure Investment &amp; Jobs Act continues to deliver for California by sending critical funding to our state to create millions of jobs and modernize our infrastructure for generations to come. As we recover from #COVID19, this funding will set us up for a bright future.",RepThompson
178,2022-01-17 18:55:00+00:00,1483150880593494017,"We must do everything we can to keep our kids safe while they are at school —and that means more testing.
 
I’m glad to see @POTUS taking action and pledging to send 10 million tests to schools every month to protect our kids from #COVID19.
https://t.co/OrNYfurGzw",RepThompson
179,2022-01-17 15:20:33+00:00,1483096912479899656,"On #MLKDay, we remember the lessons of Dr. Martin Luther King Jr.
He taught us that “the time is always right to do what is right.”
He taught us to “accept finite disappointment, but never lose infinite hope.” 
 
We must ensure his legacy is secure for EVERY American. https://t.co/Rd3rQqRaXx",RepThompson
180,2022-01-17 03:39:11+00:00,1482920410387730432,"It’s great to see @NikitaDucarroz welcomed back to #CA05! Nikita just earned a bronze medal competing in Swiss Freestyle BMX at the Tokyo Olympics.
 
We’re so proud of what she has accomplished and I look forward to seeing what her bright future has in store. https://t.co/LAPsB5Rvaj",RepThompson
181,2022-01-17 02:27:22+00:00,1482902335697342469,"I’m horrified at the attack at the Congregation Beth Israel that happened this weekend. My thoughts are w/the Jewish community in Colleyville &amp; across the country as they heal from this attack.

I’m grateful to the first responders &amp; all who answered the call against this attack.",RepThompson
182,2022-01-17 00:40:00+00:00,1482875314959269889,"HEADS UP: Starting 1/19, every American can order four tests per household through https://t.co/2zh8QcCQT4. These tests come from the first 500 million that @POTUS secured with 500 million more on the way.
 
Don't miss out on this opportunity for free at-home tests!",RepThompson
183,2022-01-16 19:25:00+00:00,1482796042550759434,"ICYMI: I wrote an op-ed in the @RecordBee to highlight the road ahead for the Build Back Better Act &amp; how it’s going to set up every family for a bright future. I was proud to vote for this historic legislation, it’s time for the Senate to follow through: https://t.co/e8L1216vYG",RepThompson
184,2022-01-16 15:15:00+00:00,1482733128053669891,"To protect the right to vote, the Senate must pass the voting rights legislation that the House has passed.
 
History is going to remember this moment when we had a choice between action &amp; inaction — we must be on the right side of history &amp; protect the sacred right to vote.",RepThompson
185,2022-01-15 23:30:00+00:00,1482495312245710860,"It could not be clearer, winters are getting “extraordinarily warm”, and climate change continues to cause massive amounts of damage across the world.
 
We must act now to combat climate change — our future depends on it.
 
https://t.co/YTy8RA9QSQ",RepThompson
186,2022-01-15 18:15:00+00:00,1482416039216521216,"Many shoppers could spend $10 or less a month on health care coverage thanks to the American Rescue Plan I worked to pass last year.
 
Open Enrollment for health care ends TODAY, January 15th. Sign up now to #GetCovered at https://t.co/TgHfL2Y1rr.
 
https://t.co/0FQnHMElSl",RepThompson
187,2022-01-15 17:19:40+00:00,1482402114819272705,"Heads up, Sonoma County residents: a tsunami advisory is in effect until further notice.

Stay away from coastal areas and keep an eye out for further alerts from local officials. https://t.co/umtuEDLgbf",RepThompson
188,2022-01-15 15:41:53+00:00,1482377507353550850,"Today marks what would have been Dr. Martin Luther King Jr.’s 93rd birthday. As we reflect on his legacy this weekend, we must remember that his work is not done. We must protect &amp; preserve the principles of equality &amp; justice that he gave his life for. Happy Birthday, Dr. King. https://t.co/4eAVVX5ipN",RepThompson
189,2022-01-15 00:15:00+00:00,1482144247671308288,"Seniors across #CA05 and the country rely on Social Security to be able to retire with security and dignity.

I'm proud to support Social Security 2100 to enhance benefits and ensure this program serves those who have paid into it for years to come. #Secure2100",RepThompson
190,2022-01-14 21:35:00+00:00,1482103982575214594,"Last year, extreme weather &amp; climate-related disasters cost Americans nearly $100 BILLION, with more than 40% of Americans living in counties affected by extreme climate disasters.

We must invest in combating climate change now.

https://t.co/vmUQ1OzLU2",RepThompson
191,2022-01-14 18:47:36+00:00,1482061857284362242,"The evidence is clear: in just SIX months, the expanded #ChildTaxCredit boosted our economy, reduced child poverty &amp; food insecurity, and helped families afford their basic needs. We cannot let this progress end here.

It's time to pass #BuildBackBetter. https://t.co/SZGJ31tTQG",RepThompson
192,2022-01-14 17:25:59+00:00,1482041315345018890,"NEWS: $849 M is on the way to CA from the Infrastructure Investment and Jobs Act to fix our bridges.

This is the 1st part of more than $4.2 billion that CA is receiving over 5 years for our bridges. I was proud to vote for this law that will create jobs &amp; support our economy.",RepThompson
193,2022-01-14 03:00:01+00:00,1481823390541369344,Happy Korean American Day! I’m honored to recognize the rich and vibrant culture of Korean Americans and I am grateful for their incredible contributions to our community. https://t.co/tTcEDWEqAb,RepThompson
194,2022-01-14 00:22:00+00:00,1481783621505753091,"Great news! Santa Rosa just began operations for its new mental health crisis response team inRESPONSE.

This program will provide a mental health specialist care to those in crisis and reduce police responses to mental health calls. https://t.co/pMOfJYLJe0",RepThompson
195,2022-01-13 22:39:00+00:00,1481757700589436928,"Study after study shows that most gun owners agree that requiring background checks is a smart way to ensure that dangerous people do not get guns.

My bipartisan HR 8 would put commonsense reforms in place to protect our communities &amp; help keep guns away from dangerous people.",RepThompson
196,2022-01-13 20:27:00+00:00,1481724481731129346,"This week, I sent a letter to the Biden admin urging them to secure more tests as Omicron continues to rapidly spread.
 
Today, @POTUS announced an additional 500 million tests, bringing the total to 1 billion tests, to be made available to Americans.
 
https://t.co/1JA0BTLpJN",RepThompson
197,2022-01-13 18:10:04+00:00,1481690022596296704,"Passing the #FreedomToVoteAct and the #JohnLewisVotingRightsAct is the only way to protect the fundamental right to vote. 

The Senate must act now to get these bills across the finish line and ensure our democracy is safeguarded for generations.",RepThompson
198,2022-01-13 14:28:44+00:00,1481634320431394816,"SOON: I'm going on @CNNnewsroom to discuss the letter I sent with my colleagues to urge the Biden administration to secure more tests.

We have an urgent need to get tests directly into the hands of my constituents and Americans across the country.

Tune in at 9:35am ET!",RepThompson
199,2022-01-13 13:42:45+00:00,1481622748078256135,"It was great to meet with my Student Leadership Council last night to update them on my work in Congress &amp; answer their insightful questions.

During #MentoringMonth, I’m proud to work with young people throughout #CA05 to help them succeed through academic &amp; personal challenges. https://t.co/hAmv7uPCxD",RepThompson
200,2022-01-12 22:30:00+00:00,1481393048848195584,"The message from @POTUS is clear, we must take action to protect the right to vote as this most sacred tool is under assault from legislatures across the country.
 
We can’t allow this moment to pass us by, it’s time to step up and deliver voting rights reform NOW. https://t.co/wHwZjA1XgC",RepThompson
201,2022-01-12 19:45:00+00:00,1481351524764696578,"The National Guard has been tasked to respond to significant issues over the last year, from natural disasters, #COVID19, unrest, border missions &amp; Afghan refugee resettlement.
 
The Guard &amp; Reserve GI Bill Parity Act ensures that #EveryDayInUniformCounts toward GI Bill benefits.",RepThompson
202,2022-01-12 18:05:14+00:00,1481326418323779584,"This has always been a two-track approach. We delivered on infrastructure, and now we need to deliver on Build Back Better.
 
I wrote in the @RecordBee about how I’m working to advance Build Back Better &amp; bring historic investments to Lake County &amp; #CA05: https://t.co/e8L1216vYG",RepThompson
203,2022-01-12 16:15:00+00:00,1481298677129875457,"As Omicron continues to spread, accessing a #COVID19 test should be easy for every American. 

The good news is that starting Saturday, insurers will be required to cover costs of at-home COVID tests — each person on a plan can get 8 tests/month for free.

https://t.co/5hI25M8FbY",RepThompson
204,2022-01-12 14:45:00+00:00,1481276027267518468,"The Infrastructure Investment &amp; Jobs Act is the most significant investment in infrastructure since Eisenhower’s federal highway system.

I was proud to help deliver this law to fix our roads, provide clean water, modernize public transit, deliver high-speed internet, and more.",RepThompson
205,2022-01-11 16:03:59+00:00,1480933515164360706,"Today, @POTUS is going to Georgia to talk about voting rights because he recognizes the importance of passing legislation that will protect every eligible voter’s right to participate in our democracy.

The Senate must follow the House's example &amp; deliver meaningful voter reform.",RepThompson
206,2022-01-11 02:46:34+00:00,1480732839721193483,"Heads up, Sonoma County residents: Due to the rapid spread of the Omicron variant, @CountyofSonoma is putting a voluntary #StayAtHome order into effect at 12:01am on Wed., encouraging people to limit interactions outside of their household.

Read more ⬇️
https://t.co/bcIomQa3jK",RepThompson
207,2022-01-10 23:45:00+00:00,1480687146457522178,"Last week, I was glad to meet with the Santa Rosa Fire Foundation and to hear about their plans for the future.

SRFF is a recently formed non-profit that allows the community to make direct donations towards new firefighting equipment and scholarship programs.",RepThompson
208,2022-01-10 19:15:00+00:00,1480619198887903243,"Voting rights are under assault from state legislatures across the country — our democracy cannot afford federal inaction.

The House has sent numerous voting rights bills to the Senate, they must take these up now. We have to protect people’s right to vote.",RepThompson
209,2022-01-10 18:35:33+00:00,1480609270139965442,"Led a letter with my colleagues urging @POTUS to act now &amp; increase the availability of COVID-19 rapid tests. As the Omicron variant continues to spread, it’s vital that people have access to rapid testing to help slow the spread &amp; protect others. Read ⬇
 https://t.co/MgJoHY44I6",RepThompson
210,2022-01-10 16:04:53+00:00,1480571356580352006,"As the House comes back into session for the new year, I’m ready to get our work done for the people.

That means investing in combatting climate change, lowering costs for middle class families, and building a more resilient future for every community.",RepThompson
211,2022-01-10 03:41:57+00:00,1480384392069533697,"My son is a proud deputy sheriff in Napa County, and every day I am grateful for him and everyone in #CA05 and across the country who protect and serve our communities.

On National Law Enforcement Appreciation Day, I thank them for their tireless service.",RepThompson
212,2022-01-10 03:30:00+00:00,1480381382073405442,"The spread of the Omicron variant is serious and if we want to get back to normal, we have to continue to take common sense steps to protect our loved ones.
 
Wear a mask, get the vaccine, get the booster (if eligible), and do the right thing. We can do this — together.",RepThompson
213,2022-01-09 23:16:41+00:00,1480317633442590721,"As we continue to fight to crush this virus, it is important that we continue to do our part to help protect ourselves and other by wearing a mask and getting the vaccine and booster.
https://t.co/Qq5nZrxsI5",RepThompson
214,2022-01-09 23:16:41+00:00,1480317632268099584,"Two years ago today, WHO first announced cases of COVID-19. Over the last 2 years we have worked hard to protect people from the virus, provide vital financial relief for families &amp; businesses, ensure schools can open safely &amp; support local cities &amp; counties.",RepThompson
215,2022-01-09 19:05:00+00:00,1480254294574071812,"Clean water is a human right — that’s why I’m excited that the Infrastructure Investment &amp; Jobs Act is bringing over $600M to California to improve our drinking water.
 
These funds will create jobs, modernize water infrastructure, &amp; ensure every family has access to clean water.",RepThompson
216,2022-01-09 16:35:00+00:00,1480216545741651974,"Our right to vote is one of the most precious tools in our democracy.
 
We must protect it — our country depends on democracy winning the day. It’s time to pass voting rights reform.",RepThompson
217,2022-01-09 01:50:00+00:00,1479993828274847746,"Great news! @SSU_1961 is receiving a $1.1 million grant to collect information about forests that will help inform and support forest health management and active fire operations in California.
 
This will go a long way in our fight to keep our communities safe from wildfires.",RepThompson
218,2022-01-08 22:10:00+00:00,1479938463281594368,"The bipartisan infrastructure law is delivering one of the largest investments in our infrastructure ever.
 
The funding will improve access to high-speed internet, fix our roads and bridges, increase our ability to combat wildfires, and more.",RepThompson
219,2022-01-08 18:25:00+00:00,1479881840236318724,"Protecting our democracy means protecting the right to vote. As state legislatures across the country impose additional barriers to make it harder for our communities to have their voices heard, we must act.
 
The Senate must pass a voting rights bill now with no more delays.",RepThompson
220,2022-01-08 16:42:50+00:00,1479856130792857609,"Since then, Gabby has taken that tragedy and dedicated herself to work tirelessly to help prevent gun violence and protect others from experiencing the trauma she went through. I am honored to be her friend and to work alongside her to keep our communities safe from gun. (2/2) https://t.co/n6Qo0HARvz",RepThompson
221,2022-01-08 16:42:43+00:00,1479856098853244930,"Eleven years ago, my good friend and former colleague, Gabby Giffords, was shot and wounded alongside 12 others when a gunman opened fire during one of her community events. One of Gabby’s staff and five of her constituents lost their lives that day. (1/2)",RepThompson
222,2022-01-08 02:20:00+00:00,1479638990093361156,"CA Residents: California has extended the indoor mask mandate until February 15. 
 
This is a good reminder to continue wearing a mask and do our part to protect ourselves and other from COVID-19.
 
https://t.co/gqW4zkT9rW",RepThompson
223,2022-01-08 00:25:00+00:00,1479610049227935744,"On January 1, a nationwide ban on surprise medical bills went into effect.

Watch this video from @KFF on how you will be protected from the estimated 10 million surprise bills patient face every year thanks to this new legislation ⬇️ https://t.co/TQhr6T6MrL",RepThompson
224,2022-01-07 20:45:00+00:00,1479554684712984577,"Good news: @VallejoPD to receive a $1 million grant from @TheJusticeDept for Project HOPE, a program that will use evidence- and community-based strategies to prevent &amp; reduce gun violence in Vallejo &amp; create safer neighborhoods. Learn more ⬇ https://t.co/g7sCWFlvaA",RepThompson
225,2022-01-07 18:15:00+00:00,1479516935998128138,1/6 has made it clear: the Senate must pass the John Lewis Voting Rights Advancement Act to protect our sacred right to vote. This legislation will restore Voting Rights Act protections against discriminatory election laws &amp; make sure every eligible voter's voice can be heard.,RepThompson
226,2022-01-07 16:18:34+00:00,1479487636708511753,"Last night, I joined @NapaIndivisible for a candlelight vigil to honor those affected by the January 6 attack.

This attack goes beyond just the Capitol building — it was an attack on what makes us the greatest country on the planet, our democracy. We can't let it happen again. https://t.co/fcjk5qPtp3",RepThompson
227,2022-01-07 02:43:29+00:00,1479282515038941187,"Today @RepGaramendi &amp; I spoke at the I-505/Vaca Valley Parkway Improvement project to highlight the benefits the bipartisan infrastructure law is sending to our communities.
 
Thanks to the local leaders who joined us — I look forward to working together to implement these funds. https://t.co/vgVuTrSHOK",RepThompson
228,2022-01-06 23:00:01+00:00,1479226274686005248,"The #BuildBackBetter Act would make the largest investment to combat climate change EVER.
 
This bill includes my GREEN Act to expand our use of renewable energy &amp; lessen our carbon footprint by reducing greenhouse gas emissions. We must pass this bill to protect our planet.",RepThompson
229,2022-01-06 20:30:00+00:00,1479188522586107904,"The #BidenBoom is no joke. Job numbers continue to blow past expectations as we recover from #COVID19 — with over 6 million new jobs since @POTUS took office.
 
Unemployment is down.
Wages are up.
Our economic plan is working.
 
https://t.co/8qmJh2Wy5w",RepThompson
230,2022-01-06 19:18:01+00:00,1479170405562732550,"Tune in now to a press conference with me, @RepGaramendi, Vacaville Mayor Ron Rowlett, and local Solano County leaders about the investments coming to our communities from the historic bipartisan infrastructure law.

WATCH: https://t.co/Tn954kzLYB",RepThompson
231,2022-01-06 15:45:00+00:00,1479116799387992064,"As we reflect on the tragic events of 1/6, my thoughts are going out to USCP and Metro officers, my fellow members, our staff, the reporters, photographers, Capitol support staff, and everyone across our country who were affected by this dark day in our nation’s history.",RepThompson
232,2022-01-06 14:11:36+00:00,1479093293577388035,"The attack on our Capitol one year ago is something we can never forget.
 
I wrote in @NorthBayNews on why we must take action to protect our democracy and ensure an attack like this never happens again.
 
READ: https://t.co/B5LSKhDVXK",RepThompson
233,2022-01-06 03:30:00+00:00,1478931830409764865,Great to meet with Alisa Karesh and Emily Bit from New Tech High School who are a part of the Napa Schools for Climate Action to discuss what they are doing to help combat climate change. Thank you for all your work on this important issue! https://t.co/hgsm4NPzAs,RepThompson
234,2022-01-06 02:28:03+00:00,1478916239632343043,"Today, @AsmAguiarCurry, @barbnemko, &amp; I toured the culinary classroom at Camille Creek Community School where the culinary students learn classic French cuisine &amp; cook meals daily for students.

The kitchen practices sustainability &amp; trains chefs for good careers in food service. https://t.co/xk1nTMBbmj",RepThompson
235,2022-01-06 01:17:43+00:00,1478898541166829569,"One of my top goals for 2022? Passing the #BuildBackBetter Act.
 
This bill will lower costs for families by making health care, child care, and education more affordable while creating millions of jobs. We can get this done — it’s time to step up and deliver for every family.",RepThompson
236,2022-01-05 21:05:00+00:00,1478834942243225603,"The overwhelming majority of responsible gun owners support background checks for all gun sales.
 
I know that we can prevent gun violence while supporting Second Amendment rights. By taking responsible measures, we can save lives &amp; keep our communities safe.",RepThompson
