,Datetime,Tweet Id,Text,Username
79,2022-02-05 23:15:02+00:00,1490101689801707521,"Over the last year, we have seen child poverty slashed to the lowest levels on record thanks to the #ChildTaxCredit that I passed last year.
 
Renewing this program is the first step to ensuring that every child has the support they need to live a healthy &amp; successful life.",RepThompson
80,2022-02-05 20:00:46+00:00,1490052802613288963,"Today marks the 29th anniversary of the Family and Medical Leave Act.
 
I worked with my @WaysMeansCmte to advance legislation that would provide universal paid leave, and I am committed to ensuring that no worker has to choose between their health, family, and their paycheck.",RepThompson
81,2022-02-05 16:01:44+00:00,1489992648995790849,RT if you’re ready to end gun violence. #GVSurvivorsWeek,RepThompson
82,2022-02-04 23:05:02+00:00,1489736786725195779,"The Infrastructure Investment and Jobs Act is the largest investment in our infrastructure since Eisenhower’s federal interstate system.

After 4 years of talk from the previous administration, @POTUS delivered infrastructure for the United States.",RepThompson
83,2022-02-04 20:19:19+00:00,1489695083066703876,"As @HouseGVP Chair, I applaud @POTUS' ongoing efforts to reduce gun violence in our communities.

By supporting law enforcement, stopping the flow of ghost guns, keeping firearms away from dangerous people &amp; investing in community-based intervention programs, we can save lives.",RepThompson
84,2022-02-04 18:11:01+00:00,1489662795192938499,"Today, I proudly cast my vote to restore American leadership in manufacturing and invest in American workers. 

The #AmericaCOMPETES Act will bolster our economy by preventing shortages of critical goods and ensuring they're made right here in the US.

https://t.co/KuZwnJel4j",RepThompson
85,2022-02-04 15:07:05+00:00,1489616505155338244,"This month’s jobs report adding 467,000 jobs shows that Democrats are getting people back to work.
 
I’m committed to making sure that we continue to bring good-paying jobs back to the US and that we are providing economic opportunity to every American.

https://t.co/c6wec3oz9T",RepThompson
86,2022-02-03 22:45:15+00:00,1489369419549716488,"Today, my staff &amp; I celebrated the anniversary of my longest serving staffer, Brad Onorato.
 
For 32 years, Brad has worked harder than anyone, has been a bulldog for #CA05, and a dear friend. He loves our district and the work as much, and I'm so honored to have him on my team. https://t.co/uGLGQrjrhP",RepThompson
87,2022-02-03 20:45:03+00:00,1489339170250182662,"Declining American manufacturing has reduced economic opportunity for working families. The #AmericaCOMPETES Act would bring high-quality jobs back to the U.S., invest in cutting-edge research &amp; bolster American competitiveness. It's time to #BuyAmerican. https://t.co/uqzXVHsVDo",RepThompson
88,2022-02-03 18:06:58+00:00,1489299388367257600,"On the 152nd anniversary of the 15th Amendment which protected the right to vote against racial discrimination, I call on the Senate to pass voting rights legislation to protect our most sacred right.
 
It’s past due to ensure our democracy is fair &amp; accessible to every American.",RepThompson
89,2022-02-03 16:15:22+00:00,1489271300719792128,"Every one of these kids is a gun violence survivor, from Marjory Stoneman Douglas to Sandy Hook to Columbine. 

This week, we must uplift and support gun violence survivors and work to prevent gun violence in our schools and communities. #GVSurvivorsWeek 2/2",RepThompson
90,2022-02-03 16:15:21+00:00,1489271299293782028,"Since the Columbine school shooting, more than 292,000 children have been exposed to gun violence at school.

An entire generation of students are learning that active shooter drills are a regular part of going to school — a grim reality. #GVSurvivorsWeek 1/2",RepThompson
91,2022-02-03 02:40:02+00:00,1489066118123827200,"Met with @AfterTheFireUSA to discuss what Congress can do to create income tax exemptions to support wildfire survivors. 

Thank you for your advocacy on this important issue &amp; I'll continue to work to ensure wildfire survivors have the resources they need to recover and rebuild. https://t.co/w5gTJrE1ot",RepThompson
92,2022-02-03 01:15:01+00:00,1489044723948003329,"Great to see a former member of my Student Leadership Council recognized as the first Napa County Youth Poet Laureate.

Congratulations to Joey DeNatale on this honor — I look forward to seeing all that you accomplish in a bright future.

https://t.co/foiG4Hlh89",RepThompson
93,2022-02-02 23:05:03+00:00,1489012013678346247,"Today is World Wetlands Day, and as a proud member of the Migratory Bird Conservation Commission and hunter for the last 60 years, I am committed to preserving these critical ecosystems and providing opportunities for responsible recreational activities like hunting. https://t.co/nTg84jh7zJ",RepThompson
94,2022-02-02 21:50:10+00:00,1488993170918715392,"Today, @POTUS, @VP, and @FLOTUS are taking action to end cancer as we know it.
 
We're setting an ambitious goal to reduce the cancer death rate by at least 50% over the next 25 years. It's time to improve the experience of people and their families living with cancer.",RepThompson
95,2022-02-02 18:30:13+00:00,1488942851820032006,"Telehealth has been shown to provide immense benefits to health outcomes by providing easier access to health care for underserved communities.

I’m proud to be working to ensure that everyone in #CA05 can receive the care they deserve.

https://t.co/bDMXz8esyC",RepThompson
96,2022-02-02 15:48:23+00:00,1488902122913640453,HAPPENING NOW: My colleagues and I on the @WaysMeansCmte are holding a hearing on expanding access to mental health resources to ensure that everyone struggling has the support they need. You can tune in below. https://t.co/SU7q0GwMbx,RepThompson
97,2022-02-02 02:00:48+00:00,1488693857441169414,"Unemployment is down 71 percent since @POTUS took office and inflation continues to slow.

Democrats are getting people back on the job, working to lower prices, and building a stronger and more inclusive economy for every American.",RepThompson
98,2022-02-01 23:15:01+00:00,1488652136636370945,"The Infrastructure Investment and Jobs Act is the largest investment in our infrastructure since Eisenhower’s highway system.

Want to learn more about this historic law? Visit https://t.co/j2YD09sl1l to explore funding opportunities from this law and how to apply.",RepThompson
99,2022-02-01 19:00:04+00:00,1488587974816276494,"Today, we must continue to support all survivors of gun violence and help them deal with the impact that persists even years after the initial trauma. #GVSurvivorsWeek 

7/7",RepThompson
100,2022-02-01 19:00:04+00:00,1488587973780193280,"Gun violence like this touches everyone. Every first responder, everyone at Pathway Home, and everyone throughout our community. 

6/7",RepThompson
101,2022-02-01 19:00:03+00:00,1488587972400357386,"Thankfully, I was told that my son was safe. Later that day, we found out that three women were killed. Christine, Jen, and Jennifer were taken from their families too soon while they were at their place of work supporting veterans as they returned to the United States.

5/7",RepThompson
102,2022-02-01 19:00:03+00:00,1488587971251085316,"On the way, I was briefed by former Napa Sheriff John Robertson and learned that a deputy had exchanged gunfire with the suspect.

4/7",RepThompson
103,2022-02-01 19:00:03+00:00,1488587970131243020,"I was supposed to be heading to Sacramento for a gun violence prevention town hall but instead I drove straight to Pathway Home where my son, a Napa Deputy Sheriff, was among the first to respond.

3/7",RepThompson
104,2022-02-01 19:00:03+00:00,1488587969036529674,"Almost 4 years ago, I was flying back to California and upon landing, I was told that a gunman had taken hostages at the Yountville Veterans Home.

2/7",RepThompson
105,2022-02-01 19:00:02+00:00,1488587967228784645,"During National Gun Violence Survivors Week, I am thinking of the friends and families of Christine Loeber, Jen Golick, and Jennifer Gonzales Shushereba. #GVSurvivorsWeek 

🧵THREAD 1/7 https://t.co/NKvIkX6XiH",RepThompson
106,2022-02-01 17:35:02+00:00,1488566576295124995,"Happy Lunar New Year! I am wishing all those who celebrate a peaceful, prosperous, and successful year ahead. #YearOfTheTiger https://t.co/UoD8txggej",RepThompson
107,2022-02-01 16:10:37+00:00,1488545331587518471,"Today marks the beginning of #BlackHistoryMonth! As we celebrate and honor the history and contributions of African Americans in our country, we must recommit to protecting and preserving the principles of equality, liberty, justice and for all. 

https://t.co/rUlUSelWJ6",RepThompson
108,2022-02-01 14:46:13+00:00,1488524091221028874,"This week, my thoughts are with the survivors of gun violence as we continue to push for reforms that will reduce gun violence, keep our communities safe, and prevent dangerous people from getting guns. #GVSurvivorsWeek 2/2",RepThompson
109,2022-02-01 14:46:12+00:00,1488524089144889347,Today marks the beginning of National Gun Violence Survivors Week — the date in which indicates the approximate time that gun deaths in the United States surpass the number of gun deaths experienced by peer countries in an entire calendar year. #GVSurvivorsWeek 1/2 https://t.co/CN3dNvc3sD,RepThompson
110,2022-02-01 13:46:03+00:00,1488508951729688579,"BAY AREA: @NWS has issued a high wind warning beginning last night through Thursday at 10am.
 
There is a possibility of strong gusts that could topple trees and trigger power outages. Keep an eye out for fallen debris and stay safe! https://t.co/tbC8uxOjqF",RepThompson
111,2022-01-31 22:45:02+00:00,1488282203046006785,"As we get our economy back on track after #COVID19, the Infrastructure Investment and Jobs Act is going to help us build back better.

By investing in our roads, bridges, ports, and airports, we’re setting our economy up for a strong future.",RepThompson
112,2022-01-31 19:15:04+00:00,1488229361673248773,"Many of our nation's most vulnerable — including seniors and disabled Americans — rely on #SocialSecurity checks to afford daily expenses.

I’m proud to work with @RepJohnLarson on Social Security 2100 to expand and enhance benefits and protect this program for years to come. https://t.co/cMkTFTcPU0",RepThompson
113,2022-01-31 18:08:57+00:00,1488212721397116930,".@RepMGS is right. Ghost guns continue to be a threat to the safety of our communities &amp; we must take action to address this issue.
 
Law enforcement agrees that ghost guns undermine state and federal gun laws AND endanger public safety. I’m ready to take on ghost guns — are you? https://t.co/PFD0NK8eiK",RepThompson
114,2022-01-31 15:35:45+00:00,1488174170462642182,"The thought of a former president offering the possibility of pardoning January 6 rioters and insurrectionists is a direct assault on our democracy.

We cannot let our democracy be threatened by those who do not like the outcome of elections.",RepThompson
115,2022-01-31 01:30:03+00:00,1487961341621116928,"The Child Tax Credit helped families across the country afford groceries, gas, school supplies and more while slashing child poverty.

This historic program provided economic opportunity to countless families — we must renew the payments.
https://t.co/h8u7AXK8fP",RepThompson
116,2022-01-30 23:23:02+00:00,1487929378738778121,What a great day for a bike ride here in #CA05! https://t.co/FoGqBaa37G,RepThompson
117,2022-01-30 20:00:49+00:00,1487878488912809989,"It’s a California showdown tonight — but my allegiances are squarely with the 49ers.

Let’s go Niners! #BeatLA",RepThompson
118,2022-01-30 00:45:01+00:00,1487587621815689219,"Do your part to keep our communities safe and wear a mask, get the vaccine, and get the booster if you’re eligible!

Get free of charge COVID tests online: https://t.co/2zh8QcCQT4
Get free of charge COVID tests over the phone: 800-232-0233
Find a vaccine: https://t.co/mUK1zrNBEE",RepThompson
119,2022-01-29 20:15:01+00:00,1487519673272918022,"Right now, state legislatures across the country are imposing onerous restrictions on voting.

Democrats are working to make voting easier for every American, not harder. We have to protect the right to vote and ensure it’s accessible to all.",RepThompson
120,2022-01-29 16:30:08+00:00,1487463081278160896,"The #AmericaCOMPETES Act incentivizes domestic production of critical technology like semiconductors.

I am proud to be an original co-sponsor of this bill and look forward to ensuring that key manufacturing is done right here in the US.

https://t.co/53Ae6JpBMa",RepThompson
121,2022-01-29 02:03:15+00:00,1487244919915917318,"Last year the Ely Stage Coach Stop &amp; County Museum celebrated its 10th anniversary. To recognize this I stopped by to present a certificate &amp; U.S. flag that was flown over the Capitol to the Lake Co. Historical Society Board.
 
Thanks for hosting me &amp; here's to the next 10 years! https://t.co/K0HFI0LWv2",RepThompson
122,2022-01-29 00:48:26+00:00,1487226092641570816,"Today, I had the opportunity to meet with the Habematolel Pomo Indian Tribe of Upper Lake and discuss key Tribal priorities.
 
We have a responsibility to respect Native sovereignty &amp; I’m proud to work with tribal communities to ensure they have the resources they deserve. https://t.co/mprRoES4eH",RepThompson
123,2022-01-28 22:01:10+00:00,1487184000103981062,"During the COVID-19 pandemic, telehealth has played a vital role in keeping patients safe while receiving the care they deserve.

I am calling for immediate action to permanently expand access to telehealth, reduce health care costs, and improve health outcomes for all. https://t.co/rjqLxk7NPO",RepThompson
124,2022-01-28 19:40:02+00:00,1487148480623783937,"As the Omicron variants surges, restaurants are struggling to keep their doors open, leading to temporary closures &amp; loss of revenue.

I sent a letter with @repblumenauer and @RepBrianFitz urging leadership to #ReplenishRRF and provide immediate relief to our restaurants. https://t.co/7OXiHoqtNJ",RepThompson
125,2022-01-28 18:35:01+00:00,1487132121386962955,"This is sad news, I am praying for a swift recovery for all those injured in this bridge collapse.

We desperately need the investments in the Infrastructure Investment and Jobs Act to fix and repair our bridges to prevent tragedies like this. 

https://t.co/kAE2Dsiuge",RepThompson
126,2022-01-28 16:08:34+00:00,1487095263764361220,"Our waterways are interconnected.
 
When we invest in our ports, harbors, and waterways, we grow our economy, create jobs, and ensure clean water for healthy children, families, and communities.
 
The Bipartisan Infrastructure Law will invest $17B to do just that. https://t.co/oMVtLz1F1Q",RepThompson
127,2022-01-28 02:35:01+00:00,1486890528687992842,"SONOMA COUNTY: Four weekends of free COVID-19 vaccines are coming up at the Sonoma County Fairgrounds!

Clinics will be held Saturday and Sunday for each of the next four weekends, Jan. 29-30 and Feb. 5-6, 12-13, and 19-20 from 9 a.m. to 4 p.m.  
https://t.co/BYsk72YEpx",RepThompson
128,2022-01-27 22:40:02+00:00,1486831391061032963,"I’m proud to welcome my office’s newest @BrookingsInst Fellows, Craig Kiley and Jerrod Kearney! Craig comes to us from @NGA_GEOINT and Jerrod comes from @NSAGov 

We’re excited to have them on the team and look forward to all they will accomplish for our district. https://t.co/a8g0zISzxt",RepThompson
129,2022-01-27 20:05:07+00:00,1486792406607572994,"#TBT to when Carmen the donkey crashed a town hall I held last year.

Thanks to @farm_forget for making Carmen available and for their work to provide a safe haven to children and animals who are experiencing abuse in their lives. https://t.co/QSSiqKXmNS",RepThompson
130,2022-01-27 17:50:01+00:00,1486758408325779459,"Today, I am honoring and remembering the 6 million Jews and other victims who were murdered during the Holocaust by the Nazi regime.

On International Holocaust Remembrance Day, we must continue to combat antisemitism wherever it occurs and remember the pledge of never again.",RepThompson
131,2022-01-27 17:19:05+00:00,1486750624012279812,"President Biden and Democrats presided over the strongest economic growth in the United States since 1984.

We’re building back stronger.

https://t.co/AZSfJ6xVqd",RepThompson
132,2022-01-27 02:00:47+00:00,1486519526078492673,"It was great to meet with Dub Hay to learn about Leatherhead coffee and their work to support first responders.
 
Leatherhead sends part of its proceeds for First Responders Resiliency Inc., which works to decrease stress and enhance resiliency in first responders. https://t.co/9nj6uVDIzt",RepThompson
133,2022-01-27 01:10:02+00:00,1486506752640274432,"The future of farming was on full display at Dutton Ranch in Sonoma County &amp; I was impressed.

Electric vehicles are key to tackling climate change and Ford’s electric fleet launch with the Sonoma County Winegrowers will modernize our farming and protect our environment. https://t.co/OPcDWKEbUm",RepThompson
134,2022-01-27 00:30:09+00:00,1486496717239459843,"This week, I led a letter with @RepCosta &amp; @RepJoeNeguse to @POTUS calling for increased efforts to combat wildfires.

CA has experienced devastating wildfires over the last year &amp; climate change has made the West more susceptible. We need action now to keep our communities safe. https://t.co/Wf5I5FQgDZ",RepThompson
135,2022-01-26 20:57:56+00:00,1486443311514763269,"Tax season is here but the IRS reports millions of unaddressed returns from last year.

Many families in #CA05 and across the country are depending on prompt tax returns for daily expenses which is why I co-led a letter to the @IRSnews calling for an improved filing process. https://t.co/WedNs1bLzy",RepThompson
136,2022-01-26 20:15:04+00:00,1486432521453715458,"The #AmericaCOMPETES Act will bolster our economy and national security by providing $45 billion in funding to make our supply chain more resilient.

It also will ensure that critical goods, industrial equipment, and manufacturing technology are made here in the United States.",RepThompson
137,2022-01-26 17:30:15+00:00,1486391046401675269,"As we work to crush this virus, every American should have access to free vaccines, free testing, and free masks.

It’s that simple.",RepThompson
138,2022-01-26 15:45:04+00:00,1486364574668443649,"The Infrastructure Investment &amp; Jobs Act is so good that even Republicans who voted against it are highlighting how it's helping their districts.

That’s how you know the bill is historic. I’m proud to have voted for it &amp; secure billions for CA to modernize our infrastructure.",RepThompson
139,2022-01-26 02:02:31+00:00,1486157573841690624,"HAPPENING NOW: I'm holding a virtual town hall with @RepGaramendi and local California leaders on the Infrastructure Investment and Jobs Act.

Tune in with any questions you have: https://t.co/UDSQp29ZeD",RepThompson
140,2022-01-25 22:35:02+00:00,1486105358368182278,"More than 500 major businesses across our country support the Equality Act. The House has passed this critical legislation, and now the Senate must do the same.
 
It’s time to guarantee LGBTQ+ people in this country have equal protections under the law and #PassTheEqualityAct. https://t.co/BSSYk2cOTT",RepThompson
141,2022-01-25 20:01:56+00:00,1486066830426914817,"Last year, climate disasters cost us $145 BILLION in damages — now Republicans are trying to worsen this crisis by asking the Supreme Court to gut life-saving clean air protections.

I'm joining my Democratic colleagues and asking the Supreme Court to defend the #CleanAirAct. https://t.co/1sMF3lKE7R",RepThompson
142,2022-01-25 18:19:00+00:00,1486040924006146053,"TONIGHT AT 6 PM: @RepGaramendi &amp; I are holding a town hall to talk about the Infrastructure Investment and Jobs Act &amp; the funding that’s on its way to our communities.

RSVP to thompson.townhall@mail.house.gov or watch on Facebook: https://t.co/OzwZhaaKww

Tune in to learn more! https://t.co/U0TH4acuLN",RepThompson
143,2022-01-25 17:10:03+00:00,1486023574779482117,"Investing in climate provisions like my GREEN Act will:

⚡ Put us on a path to 100% clean electricity by 2035
👷‍♀️ Sustain as many as 679,000 new clean energy jobs every year
🚗 Electrify up to 60% of new cars by 2030
⚖️ Deliver equitable economic benefits

Let’s get this done!",RepThompson
144,2022-01-25 15:27:36+00:00,1485997790224424965,"It is horrendous to see antisemitic fliers in the Bay Area as Jewish communities across the country are reeling from yet another attack on their place of worship.

We must stand up in the face of this bigotry — and I am committed to stamping out antisemitism wherever it persists.",RepThompson
145,2022-01-25 02:34:00+00:00,1485803107015544834,"TOMORROW AT 6 PM: I’m holding a Zoom town hall with @RepGaramendi &amp; local leaders on the Infrastructure Investment and Jobs Act.

Tune in to hear how this funding we secured is going to put our communities on the road to a brighter future.

RSVP: thompson.townhall@mail.house.gov https://t.co/zCurYy4AnT",RepThompson
146,2022-01-24 22:50:01+00:00,1485746741840392196,"Following the 49th anniversary of Roe v. Wade this past weekend and as states across the country impose restrictive abortion laws, we must take action to protect the right to choose.

That means sending the Women’s Health Protection Act to @POTUS now.",RepThompson
147,2022-01-24 19:20:02+00:00,1485693894797008903,"Investing in climate provisions will create good-paying union jobs, advance justice, and cut climate pollution in half by 2030.
 
I introduced the GREEN Act because I know that #ClimateAction cannot wait. I am ready to deliver transformative change for our nation.",RepThompson
148,2022-01-24 17:51:02+00:00,1485671499390402570,My thoughts are going out to the family and loved ones of NYPD Officer Jason Rivera and I am praying for the swift recovery of Officer Wilbert Mora. 2/2,RepThompson
149,2022-01-24 17:51:02+00:00,1485671498077638658,"As the father of a deputy sheriff &amp; as an American, I'm sickened at the recent police shootings across the country.

These brave men and women wear the uniform everyday &amp; risk their lives to protect us. I am grateful for their work &amp; will continue to support first responders. 1/2",RepThompson
150,2022-01-24 01:30:03+00:00,1485424627748950018,"ICYMI: I wrote a letter to @usmayors calling for strong local laws to ban ghost guns and reduce gun violence in our communities.

As more than 110 people are killed by gun violence every day, it is imperative that we take action.
https://t.co/8xJyo8IaOw",RepThompson
151,2022-01-23 22:05:01+00:00,1485373028762587147,"Studies show that booster shots are critical for protecting against the Omicron variant.

To keep our communities safe, do the right thing and get the vaccine, get the booster (if eligible), and wear a mask.

https://t.co/Uuwi9AIS0f",RepThompson
152,2022-01-23 18:10:01+00:00,1485313888778432516,"The Infrastructure Investment &amp; Jobs Act is paving the way to a brighter future with:

⏰ Less time on congested roads 
💸 Fewer costly repairs 
🚲 More alternatives to driving 
🚌 More frequent transit 
🚧 Millions of good-paying jobs

We’re on the way to building back better.",RepThompson
153,2022-01-23 15:45:01+00:00,1485277399306719235,"Investing in semiconductor chip manufacturing here in the US will help lower costs for families and address supply chain issues. 

The announcement by @POTUS will get Americans back to work and invest in the middle class, setting up a strong economy.
https://t.co/tyycq4URiP",RepThompson
154,2022-01-23 02:40:02+00:00,1485079850029363201,"This week, the Biden admin announced a #COVID19 test hotline to expand availability for folks to order 4 free at-home tests.

Call 800-232-0233 to request up to 4 free tests for your household. You can also order online at https://t.co/2zh8QcCQT4.",RepThompson
155,2022-01-23 00:30:00+00:00,1485047125545156610,"Do you have questions about Infrastructure Investment and Jobs Act funding coming to CA?

On Tuesday at 6 PM, I’m holding a town hall with @RepGaramendi &amp; local leaders to talk about this funding and how it will help our communities.

RSVP: thompson.townhall@mail.house.gov https://t.co/nPrJeYsxLy",RepThompson
156,2022-01-22 22:15:03+00:00,1485013165599567873,"With over 6 million jobs created in his first year, the #BidenBoom continues to surpass expectations for job creation.

As we recover from the pandemic, we must continue to create good-paying jobs and grow our economy from the bottom up and middle out.

https://t.co/CdwXNbWIWI",RepThompson
157,2022-01-22 19:00:35+00:00,1484964227282612232,"Have you ordered your free #COVID19 tests yet? Every household in #CA05 can order 4 free tests from https://t.co/2zh8QcCQT4.

Testing will help us keep our communities safe and boost our local economy — order your tests today!",RepThompson
158,2022-01-22 15:56:36+00:00,1484917923584290816,"Today marks the 49th anniversary of Roe v. Wade and the ability for everyone to have the freedom to make their own decisions about their bodies, lives, and futures.

The Senate must take up &amp; pass the Women’s Health Protection Act to protect care for millions of women.",RepThompson
159,2022-01-21 23:30:05+00:00,1484669661950226433,"This week, @SenFeinstein and I led 39 of our colleagues on a letter to @usmayors calling for a ban on ghost guns.

Shutting off the supply of untraceable weapons is essential to saving lives, and I am committed to working with local leaders to stop gun violence.",RepThompson
