,Datetime,Tweet Id,Text,Username
195,2022-01-14 18:45:44+00:00,1482061387484614656,"It’s clear that Democrats’ reckless spending approach to the pandemic has created the inflation crisis Oklahomans now face, especially after inflation hit a devastating 7% in December. 

I have warned about the impact of out-of-control spending on our economy for years.",SenatorLankford
196,2022-01-14 16:46:12+00:00,1482031303730024456,The real issue in our Republic right now is that we are not sticking with &amp; following our Founding principles. https://t.co/7qNHYsezkr,SenatorLankford
197,2022-01-14 14:58:47+00:00,1482004272518774787,"Biden’s foreign and domestic policy makes absolutely no sense to most Oklahomans.
 
https://t.co/pYCCcw2i6E",SenatorLankford
198,2022-01-14 14:58:36+00:00,1482004227438387209,"Biden &amp; his team have tried to appease the Kremlin by not imposing sanctions on the Nord Stream 2 pipeline, even as the Biden Administration blocked domestic energy in America like the Keystone pipeline.",SenatorLankford
199,2022-01-14 14:58:10+00:00,1482004117082017794,"Cancelling sanctions on Russia as they aggressively move against their neighbors shows American weakness, hurts US energy dominance, threatens the security of our allies, and gives more power to Putin. I strongly support US sanctions on the Russian Nord Stream 2 pipeline.",SenatorLankford
200,2022-01-13 23:05:02+00:00,1481764254978031616,"The Senate is the one place in the world where the minority, however large or small, has a voice – it’s been a part of the secret sauce of America. Democrats are willing to destroy the fabric of our Republic to get their way. We will not allow them to silence half of our country. https://t.co/XcZX6yw6lN",SenatorLankford
201,2022-01-13 20:36:58+00:00,1481726990113595392,https://t.co/Am4ADi7Ds3,SenatorLankford
202,2022-01-13 18:26:55+00:00,1481694264333635585,"Every senator, every House member, and the president should support my bill to keep the U.S. government out of the sad and disgusting business of human trafficking with Americans’ hard-earned tax dollars.
 
https://t.co/JsQJ5JXH0r",SenatorLankford
203,2022-01-13 18:26:48+00:00,1481694235669762060,"When our tax dollars are used to facilitate the trafficking of human beings, that violates everything our nation stands for. Protecting life, liberty, &amp; the pursuit of happiness is not just an American value; it is a guide post for a better life in any nation for any individual.",SenatorLankford
204,2022-01-13 17:06:34+00:00,1481674042927194114,Schumer claims that an election law in Georgia is suppressing voters—when the same law has been in place for years in New York. https://t.co/9EixSOtA56,SenatorLankford
205,2022-01-13 16:00:02+00:00,1481657299328376841,We will not allow the Democrats to silence half the country by eliminating the minority voice in the Senate. https://t.co/fG64sYgAGr,SenatorLankford
206,2022-01-13 12:00:01+00:00,1481596896367898625,Several of my Democrat colleagues used to be fervent supporters of the filibuster and the minority’s voice in the Senate—they seem to have different core beliefs now that they’re in the majority. https://t.co/HxwLGE57k9,SenatorLankford
207,2022-01-12 23:30:00+00:00,1481408147524784133,"Democrats’ progressive policies are hurting Americans. With Democrats in power, inflation has risen 7% - a 40 year high – causing increases in the cost of food and gasoline for Americans. https://t.co/hPTkyyb6uQ",SenatorLankford
208,2022-01-12 22:14:13+00:00,1481389077266116618,"Senator Ed Markey (D-MA)
Senator Debbie Stabenow (D-MI)
Senator Sheldon Whitehouse (D-RI)
Senator Bob Menendez (D-NJ)
 
All said don’t change the legislative filibuster.",SenatorLankford
209,2022-01-12 22:13:56+00:00,1481389004964696068,"Senator Mazie Hirono (D-HI)
Senator John Tester (D-MT)
Senator Tom Carper (D-DW)
Senator Maggie Hassan (D-NH)
Senator Tammy Duckworth (D-IL)
Senator Tim Kaine (D-VA)
Senator Jack Reed (D-RI)",SenatorLankford
210,2022-01-12 22:13:25+00:00,1481388876388352014,"Senator Joe Manchin (D-WV)
Senator Angus King (D-ME)
Senator Mark Warner (D-VA)
Senator Bob Casey (D-PA)
Senator Martin Heinrich (D-NM)
Senator Jeanne Shaheen (D-NH)
Senator Sherrod Brown (D-OH)
Senator Brian Schatz (D-HI)
Senator Maria Cantwell (D-WA)",SenatorLankford
211,2022-01-12 22:13:07+00:00,1481388800903467019,"This letter was signed by
 
Senator Kamala Harris (D-CA)
Senator Chris Coons (D-DW)
Senator Patrick Leahy (D-VT)
Senator Dianne Feinstein (D-CA)
Senator Amy Klobuchar (D-MN)
Senator Kirsten Gillibrand (D-NY)
Senator Cory Booker (D-NJ)
Senator Michael Bennett (D-CO)",SenatorLankford
212,2022-01-12 22:12:47+00:00,1481388716405014537,"“We are asking you to join us in opposing any effort to curtail the existing rights and prerogatives of Senators to engage in full, robust, and extended debate as we consider legislation before this body in the future.”",SenatorLankford
213,2022-01-12 22:12:35+00:00,1481388664697638913,"In 2017, in an effort to preserve the filibuster, several of my Democratic colleagues signed a letter saying:",SenatorLankford
214,2022-01-12 14:30:00+00:00,1481272252918374404,"The Senate is the only place in government where the minority voice is protected.
 
I believe the minority voice in the Senate still counts. I believed that when we were in the majority, and I believe it now. https://t.co/Ae8blur4Ho",SenatorLankford
215,2022-01-12 12:40:00+00:00,1481244569572306944,PROGRAMMING ALERT: I’m joining @KTULNews to talk about Schumer’s attempts to nuke the filibuster—tune in.,SenatorLankford
216,2022-01-12 00:30:00+00:00,1481060859308695553,"When Senate Democrats were in the minority they filibustered legislation 589 times.
 
Now that they are in the majority, they want to get rid of the filibuster because it’s “unfair and overused.” https://t.co/gWjDTCj4iT",SenatorLankford
217,2022-01-11 21:01:21+00:00,1481008352654204936,"Every Senator, every House member, and the President should support my bill to keep the US government out of the sad and disgusting business of human trafficking with Americans’ hard-earned tax dollars.

https://t.co/VmlBnvmY4d",SenatorLankford
218,2022-01-11 21:01:16+00:00,1481008331095429122,We are the United States of America. We have to ensure when we work with a contractor that they are not trafficking workers. It is ridiculous and illegal that this is still going on with almost no one being held accountable.,SenatorLankford
219,2022-01-11 18:55:16+00:00,1480976623071596552,"The filibuster has been a core feature of our Republic since the very beginning. 
 
Chuck Schumer is trying to silence half of the American people. https://t.co/19UbHuWaOk",SenatorLankford
220,2022-01-11 16:11:35+00:00,1480935431004987392,"I stand with Israel and for lasting peace in the Middle East, alongside my colleagues, as we launch the Abraham Accords Caucus. We will seek peace through expanding and encouraging the Accords and set the example for other nations who desire peace.
 
https://t.co/maPRMhOpOK",SenatorLankford
221,2022-01-11 16:11:24+00:00,1480935383072489479,"It was a great day for peace when I joined President Trump at the White House and leaders from Israel, Bahrain, and the United Arab Emirates more than a year ago as they signed the historic Abraham Accords.",SenatorLankford
222,2022-01-11 14:56:54+00:00,1480916636379058177,"It’s estimated that there are 24.9 million victims of human trafficking worldwide—including many victims in the United States. 

Human trafficking is a crisis, and we must work together to end it.
 
#HumanTraffickingAwarenessDay https://t.co/b2gFh5Vblr",SenatorLankford
223,2022-01-10 22:50:00+00:00,1480673305560551426,Catching up with Lee on KTOK 1000 &amp; Chad on @KOKCradio shortly to discuss Schumer’s attempts to nuke the filibuster &amp; the latest on Biden’s vaccine mandates. Tune in.,SenatorLankford
224,2022-01-10 22:18:32+00:00,1480665389256355844,"Democrats have said recently that eliminating the filibuster would “be the end of the Senate as it was originally designed.” Now, they’re pushing to eliminate it entirely. https://t.co/GLBHZwW3d9",SenatorLankford
225,2022-01-10 13:00:02+00:00,1480524835872665603,https://t.co/wT4hnPuQYN,SenatorLankford
226,2022-01-09 23:55:00+00:00,1480327275190964226,I’m joining @TGowdySC on @FoxNews to talk about Schumer’s threat to bend Senate rules just to get what he wants. Tune in.,SenatorLankford
227,2022-01-09 13:00:01+00:00,1480162445410897921,"Today and every day we are grateful for the men and women everywhere who protect and serve us. They, and their families, are owed a debt of gratitude we can never repay. #LawEnforcementAppreciationDay https://t.co/yNHORlj4sN",SenatorLankford
228,2022-01-08 18:00:00+00:00,1479875550663503873,"If you pay people not to work, they’ll choose not to work. Democrat policies are disincentivizing work. https://t.co/ztD74dVtXA",SenatorLankford
229,2022-01-07 21:00:00+00:00,1479558459230015488,Follow me on @GETTRofficial! https://t.co/hKmKlcFwJZ,SenatorLankford
230,2022-01-07 19:03:46+00:00,1479529210159026177,https://t.co/NvDIyEpbmV,SenatorLankford
231,2022-01-07 19:03:24+00:00,1479529116080746496,"I have been clear for months that Biden’s vaccine mandates are a far overreach of his power, and the Supreme Court should uphold the right of every American to make the choices that are best for them, not what a president of the United States who has never met them feels is best.",SenatorLankford
232,2022-01-07 15:00:03+00:00,1479467874980753408,What could go wrong with free press by having the federal government paying the salary of journalists? Let’s keep the free press the free press. https://t.co/Iaft9rVU3z,SenatorLankford
233,2022-01-07 12:30:00+00:00,1479430114148376576,"Schumer’s threat to change the rules of the Senate unless he gets his way is not just a temper tantrum; it is a threat to our Republic.

https://t.co/b90ILpU26U",SenatorLankford
234,2022-01-07 00:00:00+00:00,1479241372586549253,"Whether it’s the Dems’ Build Back Broke bill or whatever progressive agenda Dems try to push in 2022—I’ll continue to push back against their agenda that increases taxes &amp; inflation, incentivizes not working &amp; ultimately hurts working class people in OK &amp; across the country. https://t.co/WzogZTt3vh",SenatorLankford
235,2022-01-06 20:48:39+00:00,1479193214653546498,"Grateful for the life of my friend, Senator Johnny Isakson. 

Something Johnny said often was “I don’t have enemies, I have friends and I have future friends”—words that we all should learn from &amp; try to live by. Johnny leaves behind quite a positive legacy. https://t.co/R05PClEijN",SenatorLankford
236,2022-01-06 18:57:25+00:00,1479165222027997187,"Americans should have the freedom to choose whether they get the vaccine or not without the fear of being fired. 

https://t.co/ElZeLvgTDb",SenatorLankford
237,2022-01-06 18:57:17+00:00,1479165190625189898,"Tomorrow, SCOTUS will hear arguments on Biden’s vaccine mandates on private businesses &amp; health care workers. I have joined several of my Republican colleagues in signing an amicus brief in opposition to Biden’s overreach.",SenatorLankford
238,2022-01-06 01:58:40+00:00,1478908844831133700,More radical social policy rather than focusing on stopping the crime wave in America. This is not the way to encourage law enforcement.,SenatorLankford
239,2022-01-06 01:58:24+00:00,1478908779668377608,"As murder &amp; assault go up in America, Biden’s leaked Executive Order on law enforcement demonstrates again that his administration thinks the problem is law enforcement, not criminals. His order disregards women’s safety by allowing men to be housed in women’s prisons. https://t.co/AUVvz9tL3Q",SenatorLankford
240,2022-01-05 18:04:07+00:00,1478789421180854294,Democrats keep pouring out government benefits &amp; entitlements—working class Americans are tired of it. Democrat policies are hurting those they claim to help. https://t.co/ZiZAX6Gjjm,SenatorLankford
241,2022-01-05 16:00:02+00:00,1478758196349181955,"Schumer’s attempt to change the rules of the Senate is for one purpose: to bend the rules to get what he wants.
 
https://t.co/g905bj1uMp",SenatorLankford
242,2022-01-04 22:34:06+00:00,1478494979685298182,"I have demanded the gaps in the wall be closed for months—after refusing to acknowledge the crisis at our border &amp; wasting billions to appease far left radicals, Biden finally relented &amp; DHS is closing the gaps.
  
https://t.co/z1StePIXOm",SenatorLankford
243,2022-01-04 22:33:58+00:00,1478494943547203588,Biden’s failing policies ENCOURAGED over 1.8 million illegal border crossers over the US/Mexico border last year.,SenatorLankford
244,2022-01-04 21:03:33+00:00,1478472190555312132,PROGRAMMING ALERT: I’m joining Larry Kudlow on @FoxBusiness shortly to talk about Biden’s bad policy &amp; Schumer’s threats to long-standing Senate rules—tune in.,SenatorLankford
245,2022-01-04 19:58:04+00:00,1478455708991508480,"This is another victory against Biden’s vaccine mandate—I will continue to keep fighting.
 
https://t.co/wfHaw0hzTT",SenatorLankford
246,2022-01-04 19:57:57+00:00,1478455683507003399,"DOD said they would respect requests for religious exemptions, but to date ZERO have been granted.
 
I have pushed DOD to honor the religious rights of our men &amp; women in uniform &amp; signed an amicus brief in support of our Navy SEALs.",SenatorLankford
247,2022-01-04 19:57:30+00:00,1478455568322998280,A federal judge sided with 35 U.S. Navy SEALs to protect service members seeking religious exemptions from Biden’s vaccine mandate. This ruling stops the DOD from punishing military service members who have religious objections to the vaccine.,SenatorLankford
248,2022-01-04 18:26:09+00:00,1478432578952695819,"Another win against Biden’s vaccine mandate—a federal judge blocked Biden’s vaccine &amp; mask mandate for Head Start programs in Oklahoma &amp; 23 other states.
 
https://t.co/IMQw3TRwhd",SenatorLankford
249,2022-01-04 18:10:08+00:00,1478428547572248576,"Those serving our nation &amp; their families deserve the best &amp; today justice was served.
 
https://t.co/vWLZc9I7qH",SenatorLankford
250,2022-01-04 18:09:57+00:00,1478428502911242245,Oklahomans are grateful to law enforcement agencies &amp; the US Attorney’s office for the Western District of OK for their part to hold accountable a company that was taking millions while leaving our military men &amp; women at Altus AFB &amp; Tinker AFB to live in unsafe housing.,SenatorLankford
