,Datetime,Tweet Id,Text,Username
0,2022-02-23 20:59:35+00:00,1496590586819891200,The NYET act that I introduced with over 30 Republican Senators would actually stop all construction to Nord Stream 2 immediately.,SenatorLankford
1,2022-02-23 20:58:05+00:00,1496590208829169671,This should have been done months ago. It was a huge mistake when Biden allowed Nord Stream 2 to move forward by waiving sanctions passed by Congress. The Admin’s refusal to use the tools at its disposal to stop the pipeline a year ago emboldened Russia to act more aggressively. https://t.co/5lekvk1RXr,SenatorLankford
2,2022-02-23 20:00:01+00:00,1496575593223127040,"“China is becoming less free over time” – Matt Pottinger
 
On the latest episode of The Breakdown, China expert Matt Pottinger joins me to talk about all things China. You can listen to our conversation on Apple Podcasts, Spotify &amp; Soundcloud. https://t.co/wEVKj2eYQ9",SenatorLankford
3,2022-02-23 18:01:28+00:00,1496545762322358276,I’m trying to make it very clear—if you are helping Russia facilitate moving in on Ukraine you should face the same sanctions Russia is facing. https://t.co/6uvk3TmMrP,SenatorLankford
4,2022-02-23 16:00:02+00:00,1496515199913934854,"The transportation needs of Miami, Oklahoma are not the same as Miami, Florida.
 
Sec. Buttigieg &amp; the Dept. of Transportation should let states decide what their transportation needs are instead of forcing a one-size-fits-all infrastructure plan.
 
https://t.co/E0Shu7cpgE",SenatorLankford
5,2022-02-22 22:00:01+00:00,1496243405244059653,I have said all along—It is much easier to prevent a war from ever starting than to stop a war once it has begun. We need to do everything we can to engage &amp; prevent this. https://t.co/M1xUjijxST,SenatorLankford
6,2022-02-22 21:00:01+00:00,1496228307754528770,"Chemical abortions don’t just kill the unborn child, they cause serious health risks for the mother—that’s why I am calling on the FDA to reverse their decision to make chemical abortions available by mail.
 
https://t.co/pG4eW7qmJn",SenatorLankford
7,2022-02-22 18:04:11+00:00,1496184058166059013,A year ago? 1.7% inflation. Now? 7.5% inflation—this is an issue created solely by Biden’s policies. https://t.co/DukfC8wV4k,SenatorLankford
8,2022-02-22 17:06:13+00:00,1496169467298074626,Joining @JaySekulow soon to discuss the latest with the tensions between Russia and Ukraine. Tune in here --https://t.co/JQuZBaUMee,SenatorLankford
9,2022-02-22 14:29:44+00:00,1496130088877842437,Cindy &amp; I spent yesterday morning in OKC visiting with several of our fellow Oklahomans at the State Capitol. https://t.co/3H1TUnJvhg,SenatorLankford
10,2022-02-21 14:00:03+00:00,1495760229866242051,Happy #PresidentsDay 🇺🇸 https://t.co/3aGumEcVZB,SenatorLankford
11,2022-02-21 03:11:54+00:00,1495597119352320003,It is easier to prevent a war from starting then it is to stop a war once it’s already started. https://t.co/vyztWpjAX1,SenatorLankford
12,2022-02-20 21:17:34+00:00,1495507948046589954,Tonight — tune in 📺 https://t.co/md97B1USZj,SenatorLankford
13,2022-02-20 21:00:00+00:00,1495503525899431936,It’s #NationalLoveYourPetDay &amp; we sure do love our Liberty Belle! https://t.co/uH5wDQNNej,SenatorLankford
14,2022-02-19 23:06:56+00:00,1495173083572977669,"It’s easier to stop a war that has never started than it is to end a war in process. The world stands with the free people of Ukraine. If Russia does not stop, there will be severe consequences. https://t.co/cZTmIZoxc0",SenatorLankford
15,2022-02-18 22:31:02+00:00,1494801661675638786,"Chinese citizens can be imprisoned and even killed for violating the CCP’s oppressive population control policies.
We cannot remain silent. We cannot turn a blind eye &amp; we must lead the world in ending these human rights abuses. #WinterOlympics2022 #Beijing",SenatorLankford
16,2022-02-18 22:30:00+00:00,1494801400202735620,"For decades, the CCP has imposed national “birth control” policies, including restrictions on the # of children a family can have, killing babies, forced abortions, late-term abortions, forced IUD placement &amp; forced sterilizations targeting the #Uyghurs &amp; other religious groups. https://t.co/DT4EhGTVR7",SenatorLankford
17,2022-02-18 21:00:01+00:00,1494778753179783169,Inflation is at a 40-year high—half of America has not seen inflation quite like this before. What’s Biden’s solution? Spend even more. https://t.co/frUgvpYto2,SenatorLankford
18,2022-02-18 20:09:20+00:00,1494766001086504966,"I’ve repeatedly called on CBP Commissioner Magnus to share data with Congress. It’s ridiculous that we have to go hunt for information in court filings—the American people deserve better from their government. 

Congress should not be the last to know. https://t.co/5ze8hNOmnX",SenatorLankford
19,2022-02-18 19:30:00+00:00,1494756101622956032,I firmly believe that the best thing we can do is to work to keep a war from ever starting rather than try to stop it once it starts. We need to make it clear that the United States stands with the free people of Ukraine. https://t.co/TwfJdGZJV1,SenatorLankford
20,2022-02-18 16:00:02+00:00,1494703263052009476,"Special Counsel Durham was appointed to look into the FBI Investigation into the alleged Russian interference in the 2016 elections—he should be allowed to do his job without interference from the DOJ.
 
https://t.co/sK2AplLH83",SenatorLankford
21,2022-02-18 15:25:51+00:00,1494694659939000327,"CC: @SenHydeSmith @SteveDaines @LindseyGrahamSC @JerryMoran @SenMikeLee @JohnBoozman
 
https://t.co/sfKYgqKk6P",SenatorLankford
22,2022-02-18 15:25:44+00:00,1494694628548878338,The Equal Rights Amendment does not have the constitutionally-required support from states &amp; shouldn’t be certified—the Archivist of the US needs to respect the rule of law &amp; not unilaterally ratify this amendment just because the progressive left wants him to.,SenatorLankford
23,2022-02-18 12:30:00+00:00,1494650403979513860,The situation in Ukraine is just Putin’s way of trying to stay relevant on the world stage &amp; exhibit control over his neighbors. https://t.co/hwADoRfAU1,SenatorLankford
24,2022-02-18 00:10:59+00:00,1494464425792876545,My statement on Congress continuing to kick the can down the road on gov’t funding 👇 https://t.co/o7aKqt4De3,SenatorLankford
25,2022-02-17 22:50:39+00:00,1494444209679573006,"We need to make it very clear that the world stands with the free people of Ukraine &amp; that we will bring strong, unrelenting consequences on the economy of Russia if they move across the border into Ukraine. https://t.co/I1QcB9Cndp",SenatorLankford
26,2022-02-17 22:38:44+00:00,1494441208495628289,"This would be like Target kicking someone out of their store and asking the federal government to also block them from Walmart. One strike &amp; you’re out.
https://t.co/HvFJmgj7vu",SenatorLankford
27,2022-02-17 22:38:27+00:00,1494441138874421249,"I strongly condemn violence towards airline workers. But airlines can already deny service to any individual. 

@Delta is asking the DOJ to get rid of due process for people accused of unruly behavior &amp; make the federal gov impose the Delta policy on other private businesses.",SenatorLankford
28,2022-02-17 21:06:52+00:00,1494418091232612357,America needs to push back on Putin’s threats. https://t.co/tH7e0iaUpq,SenatorLankford
29,2022-02-17 19:30:00+00:00,1494393715691032581,"The heartbeat is a sign of life – that there’s a human being separate from the mom who is alive and we should value that life!
 
https://t.co/bOKZXjqryY",SenatorLankford
30,2022-02-17 18:30:37+00:00,1494378769217425414,"I have been fighting against all of the vaccine mandates since day one and joined with @SenMikeLee to force the Senate to vote to defund the mandates. That vote has not happened yet but is expected sometime today.

https://t.co/730zTyZ2Ur",SenatorLankford
31,2022-02-17 15:09:52+00:00,1494328247219224587,Every Republican has agreed that American’s tax dollars should not buy crack pipes - but it has not passed yet because some on the Democratic side are holding up the bill - the curious would ask who wants to give out free crack pipes? This shouldn’t be controversial… https://t.co/DoWxXAnbcO,SenatorLankford
32,2022-02-17 15:01:10+00:00,1494326060200067085,"This week I got to be behind the camera as a member of my team Courtney received an award from @EANGUS72 for her faithful &amp; tireless work on behalf of Oklahoma, the National Guard &amp; their families. 

It was an honor to attend the award ceremony with Courtney &amp; her husband. https://t.co/FM5eXCd8Sm",SenatorLankford
33,2022-02-17 02:55:45+00:00,1494143502204211205,"Joining @SchmittNYC on @newsmax shortly to talk about the situation in Ukraine &amp; funding the government—tune in here:

https://t.co/yhTcBL1UHR",SenatorLankford
34,2022-02-16 21:50:19+00:00,1494066637745577984,"Enes is a naturalized American, but he certainly understands our freedom of speech better than the @NBA. Who is the better positive role model Enes or the @NBA ?",SenatorLankford
35,2022-02-16 21:50:19+00:00,1494066636143353856,"The @NBA allows their athletes to reject our national anthem and criticize America, but they will not allow any athlete to criticize #CommunistChina  China.",SenatorLankford
36,2022-02-16 21:50:18+00:00,1494066633224388609,"Enes Kanter Freedom is speaking up for oppressed people of communist China, but the @NBA is determined to silence him so they can make billions while promoting Chinese propaganda. https://t.co/wtipDO3gf3",SenatorLankford
37,2022-02-16 20:00:01+00:00,1494038880172920834,When Biden removed sanctions on the Nord Stream 2 pipeline he gave Russia the green light to gain more money &amp; more influence in Europe. https://t.co/2R3IeLdJU6,SenatorLankford
38,2022-02-16 14:15:00+00:00,1493952052409495553,Opportunities to tune in &amp; hear about the issues today: https://t.co/Kon7njg3z5,SenatorLankford
39,2022-02-15 18:50:22+00:00,1493658962977304576,"The Senate just voted to confirm Dr. Robert Califf—Biden’s pro-abortion, controversial, Obama-era nominee—to serve as FDA commissioner. I opposed the nomination. https://t.co/rQrOg6cTjT",SenatorLankford
40,2022-02-15 17:15:00+00:00,1493634963035463683,"Biden is actively trying to push up energy prices—what’s the result of that? Record breaking increases on inflation, skyrocketing gas prices &amp; 72% of Americans saying that America is on the wrong track. https://t.co/33MYkaWYR7",SenatorLankford
41,2022-02-15 16:18:21+00:00,1493620705983934468,"On the latest ep. of The Breakdown I had China expert &amp; former Deputy National Security Advisor Matt Pottinger on to talk about China’s human rights abuses, their economic &amp; military coercion &amp; their efforts to take advantage of the world.

Tune in wherever you listen to podcasts https://t.co/6OdSqEtpe1",SenatorLankford
42,2022-02-15 14:20:24+00:00,1493591023318147076,"With antisemitism sadly on the rise worldwide it's vital that we call it out &amp; condemn it no matter where it occurs. I’m proud to stand w/ our Task Force for Combatting Antisemitism &amp; our Jewish friends &amp; neighbors to shine a light on this antisemitic hate
https://t.co/7NpwVBfxTY",SenatorLankford
43,2022-02-15 02:08:09+00:00,1493406748748791815,"The next episode of my podcast, The Breakdown with James Lankford, will be streaming tomorrow. You won’t want to miss this one.
 
Subscribe on Apple Podcasts, Soundcloud &amp; Spotify. https://t.co/6QyJZNrQsk",SenatorLankford
44,2022-02-15 01:00:02+00:00,1493389605780996096,"We are seeing the results of Biden’s open border in our country: a spike in violent crime. 

Our law enforcement is being handcuffed. This is not what Americans want. https://t.co/aPfuk4YCnb",SenatorLankford
45,2022-02-14 22:07:12+00:00,1493346112295559176,"Almost 60% of Americans are not happy with Democrat leadership—Democrats have been so focused on their progressive agendas that the essential things, like funding the government, are falling through the cracks. https://t.co/IWHj7KsHw7",SenatorLankford
46,2022-02-14 19:00:01+00:00,1493299006348267520,"Wishing a happy #ValentinesDay to my bride, Cindy! https://t.co/Ve7VEwhu8s",SenatorLankford
47,2022-02-14 18:36:49+00:00,1493293164622405637,"We in Congress are demanding the courts allow decisions that affect the nation in this way to be made by Congress, not forced by the President, which is an absolute affront to the Constitution.",SenatorLankford
48,2022-02-14 18:36:28+00:00,1493293078798802944,"In pushing his COVID-19 vaccine mandates, allowing basically zero religious accommodations to military members &amp; willfully turning a blind eye to natural immunity rates, the Biden Admin is teetering on China-like ‘commands’ to Americans &amp; Oklahomans",SenatorLankford
49,2022-02-14 18:35:59+00:00,1493292956882804741,"However much he may want to be, President Biden &amp; any US president is not a king or a dictator with absolute power; that’s how they do things in places like China, Russia &amp; North Korea, not in the US. 
https://t.co/kazkDMLLCx",SenatorLankford
50,2022-02-14 17:41:47+00:00,1493279315714269186,"The Border Patrol should be the one complaining this Valentine’s Day, not people who got a free ride into the greatest country in the world.",SenatorLankford
51,2022-02-14 17:41:46+00:00,1493279313462018048,We live in an upside down world when people here illegally can strike publicly without any fear of arrest because the Biden Administration will not stop people crossing the border illegally or arrest someone once they are in the country illegally. https://t.co/CsbRvCiGA8,SenatorLankford
52,2022-02-14 16:00:00+00:00,1493253702337150984,"Every state becomes a border state when Biden’s policies are allowing drugs, weapons &amp; criminals from other countries to freely enter into the US at our southern border. https://t.co/k2f1AgDDuD",SenatorLankford
53,2022-02-14 12:00:02+00:00,1493193310273347587,"Policies put in place have directly led to skyrocketing energy prices, 2M+ people illegally entering through our southern borders &amp; a 40-year high inflation.
 
If we don’t deal with the real consequences of these bad policies this will never get better. https://t.co/V8TIMYRG43",SenatorLankford
54,2022-02-11 20:20:43+00:00,1492232147977097221,It is easier to stop a war that has never started than it is to end a war in process. This is a strong stance America can take to counter Russia &amp; Belarus as they continue to threaten Ukraine’s independence.,SenatorLankford
55,2022-02-11 20:20:30+00:00,1492232094600286216,"Belarus is allowing thousands of Russian troops into their country to line the border with Ukraine. The US should make it clear that strong economic &amp; diplomatic sanctions will be applied to any country that supports Russia’s attempts to invade Ukraine.
https://t.co/X1O55HPmQO",SenatorLankford
56,2022-02-11 16:00:00+00:00,1492166539386265600,I joined Scott on KLBC 106.3 to talk about Biden’s border crisis &amp; vaccine mandates—listen to our conversation here👇 https://t.co/X2LYHuN75b,SenatorLankford
57,2022-02-11 12:30:00+00:00,1492113691776630785,"We just crossed the $30,000,000,000,000 mark in debt—Congress has to slow down spending &amp; address the debt. https://t.co/i0dI31knoI",SenatorLankford
58,2022-02-11 01:00:00+00:00,1491940046475345922,You can tell a lot about an administration’s priorities &amp; values based on who they put in place &amp; nominate for different roles. https://t.co/rhjyh9LDeJ,SenatorLankford
59,2022-02-10 23:30:00+00:00,1491917397661343744,"We need to keep applying economic &amp; diplomatic pressure on Russia—it’s better to have a war that never starts than ending one that’s already started.
 
🎥: @KSWO_7NEWS https://t.co/9J2bqOvL0Q",SenatorLankford
60,2022-02-10 22:40:13+00:00,1491904868759519235,"Biden should provide Americans with the most accurate natural immunity data, so Americans can make their own decisions &amp; better understand the reality of our current COVID circumstances. Let’s truly follow the science &amp; ensure guidance is in line with natural immunity studies.",SenatorLankford
61,2022-02-10 22:38:29+00:00,1491904433105559558,"Biden is so obsessed with vaccine mandates that he refuses to even evaluate or release information on those who have acquired natural immunity to COVID-19.
 
Natural immunity is a component of reducing the spread of COVID-19, along with vaccines.
https://t.co/PsIk8pbtMb",SenatorLankford
62,2022-02-10 21:06:47+00:00,1491881354325381121,Biden is intentionally finding ways to make the price of energy more expensive. Who feels the pain of that? Every single American. https://t.co/86JhvPXx4x,SenatorLankford
63,2022-02-10 19:43:21+00:00,1491860356586741765,"We truly need an all of the above approach to give this effort the best chance of success. 
 
&amp; I’m always glad to see some Oklahomans representing our state in a Senate hearing.",SenatorLankford
64,2022-02-10 19:43:03+00:00,1491860281366044672,"If the goal is to determine whether hydrogen is a viable alternative to some of our existing energy technologies, we cannot discount a method that could drive the need for, and development of, other parts of the supply chain.",SenatorLankford
65,2022-02-10 19:42:08+00:00,1491860052793344010,The simple truth is that 95% of hydrogen produced in the United States today is made from natural gas. https://t.co/Echwo3Icra,SenatorLankford
66,2022-02-10 16:53:23+00:00,1491817583556845571,🔗 https://t.co/tDjccjQd9q,SenatorLankford
67,2022-02-10 16:52:58+00:00,1491817481463283713,"#Inflation hits another multi-decade high—7.5%. 

Democrat policies are driving up the cost of groceries, gas, heating our homes, etc.—driving up the cost of living for everyone. Inflation hurts everyone, especially seniors and those on a fixed income. https://t.co/HnTjO5QfU7",SenatorLankford
68,2022-02-10 14:35:22+00:00,1491782850311458821,We’re not asking for something unreasonable. https://t.co/ZqJUKFCzWB,SenatorLankford
69,2022-02-10 03:25:59+00:00,1491614394408742913,Spent time with the Williams Energy Co. team today in my DC office before they share their perspective on hydrogen energy with @EnergyGOP as we talk about the future of hydrogen. It’s important to share Oklahoma’s all-of-the-above energy perspective with my Senate colleagues. https://t.co/fKnVYC7I3r,SenatorLankford
70,2022-02-09 22:30:00+00:00,1491539908556640261,"Biden continues to look the other way while crime in America skyrockets. 

Biden’s policies are backwards—he is handcuffing law enforcement &amp; releasing criminals. That’s not what America is looking for. https://t.co/WAZfNopKoq",SenatorLankford
71,2022-02-09 21:01:53+00:00,1491517734089281537,"We must protect our athletes, we must not turn a blind eye &amp; we must lead the world in ending these human rights abuses.",SenatorLankford
72,2022-02-09 21:01:42+00:00,1491517686395949059,"The US cannot remain silent—we must stand up for what is right. We must call out &amp; hold China accountable for these crimes against the #Uyghurs – forced sterilization, forced abortion, infanticide, forced labor, restrictions on religion &amp; expression, torture &amp; mass surveillance.",SenatorLankford
73,2022-02-09 21:01:27+00:00,1491517623707840517,"As the #WinterOlympics2022 take place in Beijing, we cannot ignore that the Chinese Communist Party is leading not in the medal count, but in genocide &amp; crimes against humanity against the #Uyghurs. https://t.co/WBnictntkO",SenatorLankford
74,2022-02-09 18:55:35+00:00,1491485947741016070,I called out the Election Assistance Commission for using partisan resources on their website &amp; today they responded that links to these resources have been removed. They committed to me that they will continue to be an independent nonpartisan resource—&amp; I will hold them to it. https://t.co/utTFllJnms,SenatorLankford
75,2022-02-08 22:00:00+00:00,1491169972286070786,"It’s clear that Biden has no interest in securing our border—his policies have only created chaos.
 
Listen to my conversation with @ChadAlexander2 on @KOKCradio about the #BidenBorderCrisis here 👇 https://t.co/bfhqI4cND4",SenatorLankford
76,2022-02-08 19:58:51+00:00,1491139481403289603,https://t.co/bP90orRcxH,SenatorLankford
77,2022-02-08 19:58:41+00:00,1491139441024729088,"The Biden Admin wants to resurrect redefining federalize waters—this completely overlooks feedback from stakeholders—our farmers &amp; ranchers need certainty, not a federal power grab that ignores the feedback of those who utilize &amp; depend on water resources for their livelihoods.",SenatorLankford
78,2022-02-08 18:20:57+00:00,1491114844237742080,"Inflation is harming everyone as the cost of living soars across the US. The Democrats’ reckless spending &amp; bad policies are making life harder for all Americans, not just Federal employees.
https://t.co/Uf8rItr3xd",SenatorLankford
79,2022-02-08 18:20:43+00:00,1491114788289916928,MORE SMOKE &amp; MIRRORS. Biden has requested the largest Federal employee wage increase in 15 years—but that 4.6% increase won’t matter because of the 7% hike in inflation caused by Democrats’ reckless spending &amp; bad policies.,SenatorLankford
80,2022-02-08 15:06:33+00:00,1491065921531789322,"Our national debt was $28T in September 2021—now it’s over $30T. 

Democrats’ out of control spending is making a bad situation worse. https://t.co/zU8S5RJte6",SenatorLankford
81,2022-02-08 03:09:12+00:00,1490885396167032832,"We should end the constant threat of a government shutdown by passing my bill #PreventGovShutdownsAct

https://t.co/eBqTiQh34a",SenatorLankford
82,2022-02-08 03:08:44+00:00,1490885279959629824,"The deadline to pass funding for the 2022 fiscal year was last September 30th. Democrats kicked the can to December 3rd, then to February 18th &amp; now they’re planning to hold off making decisions until March—",SenatorLankford
83,2022-02-07 22:00:01+00:00,1490807587696168966,"Ensuring that Oklahomans in rural communities have access to reliable broadband service is more important now than ever—I’m working to make sure that federally funded broadband projects are prioritizing rural communities.
https://t.co/Ne4Bv3KUzS",SenatorLankford
84,2022-02-07 21:00:01+00:00,1490792486993858562,"73% of Americans are not satisfied with Biden’s energy policies.
 
Americans are feeling the negative impacts of Biden’s failing energy policies &amp; it shows. https://t.co/rhQ2ZiDaUD",SenatorLankford
85,2022-02-07 18:00:01+00:00,1490747190175694850,I am grateful our nation’s seniors have groups like 60 Plus looking out for what’s in their best interest &amp; tracking issues that matter to them. We absolutely cannot forget about our nation’s seniors &amp; I will continue to do everything I can to ensure we faithfully serve them. https://t.co/dv48IeoIgW,SenatorLankford
86,2022-02-07 16:00:00+00:00,1490716985704869889,"Our national debt is now above $30,000,000,000,000 - $2 trillion of debt added in just the last two months! https://t.co/iBlDAForU4",SenatorLankford
87,2022-02-07 12:30:00+00:00,1490664137973800965,"House Democrats proposed a bill to combat China that is a carbon copy of Chinese policy.
 
If we’re going to respond to China, there are clear ways to do that—following their lead of central government control is not the answer. https://t.co/MUK5vhZdEp",SenatorLankford
88,2022-02-04 21:30:00+00:00,1489712872041058306,The men &amp; women serving as Border Patrol agents signed up to enforce our laws &amp; protect our Southern border—but Biden is treating them like hotel check-in staff. https://t.co/onOprAyACS,SenatorLankford
89,2022-02-04 20:46:18+00:00,1489701872403427330,"Our men &amp; women in uniform don’t lose their right to religious freedom when they decide to serve. This is a blatant disregard of our constitutional freedoms.
https://t.co/xHDkdyPEzZ",SenatorLankford
90,2022-02-04 20:46:08+00:00,1489701832507203584,"118 sailors have been removed from service for  not getting the COVID vaccine but ZERO of the nearly 4,000 religious accommodation requests have been granted.",SenatorLankford
91,2022-02-04 19:38:29+00:00,1489684806090870792,"Our national debt is now over $30,000,000,000,000. We have to control Democrats out of control spending. https://t.co/L9rDHG7eww",SenatorLankford
92,2022-02-04 17:30:00+00:00,1489652474382278662,"Military personnel, private businesses, members of the federal workforce &amp; others legally in the United States are having vaccine mandates forced on them by Biden.

If you cross our border illegally, you’re given the option of whether you want it or not. https://t.co/OvEamrugJB",SenatorLankford
93,2022-02-04 15:37:42+00:00,1489624209311645698,We continue to show the world that the freedom of religion—the freedom to live your faith—is not only a vital component of what it means to be Americans but is a fundamental human right of all people.,SenatorLankford
94,2022-02-04 15:37:12+00:00,1489624085692825609,At yesterday’s #NationalPrayerBreakfast I was again reminded of the power of prayer to unite people. We have a common goal at this breakfast to encircle our national &amp; international leaders with God’s word &amp; with our gratitude for His many blessings. https://t.co/YWBVmhm8zE,SenatorLankford
95,2022-02-04 12:30:01+00:00,1489576979745677316,Biden &amp; his team used millions of taxpayer dollars so that they could say they’re doing something about the chaos at our border—when they’re actually doing nothing about it. https://t.co/oIQ2fN08ob,SenatorLankford
